Contenido,IR,Fecha,Dispositivo,Likes,Retweets,Entidad,Hora,Foto
"[DISTANCIAMIENTO FÍSICO]
Cada vez que salgas mantén, como mínimo, un metro de distancia con los demás
🏃‍♀️|----1mt-… https://t.co/ZWLwD3ojA5",https://twitter.com/i/web/status/1259901054034075654,11/05/2020 13:39:53,Twitter Web App,3,4,Super de Salud Chile,13:39:53,http://pbs.twimg.com/profile_images/986969865830518784/gbIFCMKC.jpg
"RT @ministeriosalud: Tras el anuncio de extensión de cuarentenas en 6 comunas a partir de mañana martes, te informamos sobre los territorio…",https://twitter.com/i/web/status/1259908004318572545,11/05/2020 14:07:30,Twitter Web App,0,69,Super de Salud Chile,14:07:30,http://pbs.twimg.com/profile_images/986969865830518784/gbIFCMKC.jpg
"@paulamarinass Hola, buenas tardes. El reclamo lo puedes ingresar directamente en nuestro sitio web:

https://t.co/NQzvk7eZ1q",https://twitter.com/i/web/status/1259916693364715521,11/05/2020 14:42:02,Twitter Web App,0,0,Super de Salud Chile,14:42:02,http://pbs.twimg.com/profile_images/986969865830518784/gbIFCMKC.jpg
"RT @ministeriosalud: Subsec @arturozunigaj:

""Recibimos 50 vehículos en comodato, y serán distribuido con alcaldes en sus municipios""

""Ven…",https://twitter.com/i/web/status/1259917323865030656,11/05/2020 14:44:32,Twitter for iPhone,0,19,Instituto de Salud Pública de Chile,14:44:32,http://pbs.twimg.com/profile_images/1219288777228681216/DWTCW08o.jpg
"RT @ministeriosalud: Alcalde @muniecentral @RodrigoDelgadoM:

""No hay nada más concreto y oportuno que este comodato, para que estos vehícu…",https://twitter.com/i/web/status/1259917361542463489,11/05/2020 14:44:41,Twitter for iPhone,0,5,Instituto de Salud Pública de Chile,14:44:41,http://pbs.twimg.com/profile_images/1219288777228681216/DWTCW08o.jpg
@paulamarinass Hola! Acá puedes ingresarlo👇 https://t.co/TGSQHwKFVH,https://twitter.com/i/web/status/1259918126575235073,11/05/2020 14:47:44,Twitter Web App,0,0,Super de Salud Chile,14:47:44,http://pbs.twimg.com/profile_images/986969865830518784/gbIFCMKC.jpg
"Puedes convertir un pañuelo en una mascarilla. Pero primero #LávateLasManos

Sigue estos pasos y… https://t.co/HHc2ztVMsd",https://twitter.com/i/web/status/1259921214757167104,11/05/2020 15:00:00,TweetDeck,0,0,Instituto de Salud Pública de Chile,15:00:00,http://pbs.twimg.com/profile_images/1219288777228681216/DWTCW08o.jpg
"RT @segegob: ¡Beneficio de subsidio familiar!

@ChileAtiende informa que este subsidio se extenderá por 6 meses, es decir, no tienes que re…",https://twitter.com/i/web/status/1259921538964471808,11/05/2020 15:01:17,Twitter Web App,0,8,Super de Salud Chile,15:01:17,http://pbs.twimg.com/profile_images/986969865830518784/gbIFCMKC.jpg
"El uso de mascarilla es obligatorio en:
🔹Transporte público y privado remunerado
🔹Ascensores
🔹Comercio
🔹Lugares de… https://t.co/DXeEcGtmQ5",https://twitter.com/i/web/status/1259928123291942912,11/05/2020 15:27:27,Twitter Web App,0,0,Super de Salud Chile,15:27:27,http://pbs.twimg.com/profile_images/986969865830518784/gbIFCMKC.jpg
"RT @Cenabast: Entre marzo y abril, más de 29 millones de unidades de guantes fueron distribuidos a la red de salud. Seguimos! 🏥🏥🏥#PlanCoron…",https://twitter.com/i/web/status/1259936028997095426,11/05/2020 15:58:52,Twitter Web App,0,17,Super de Salud Chile,15:58:52,http://pbs.twimg.com/profile_images/986969865830518784/gbIFCMKC.jpg
Ahora las farmacias y almacenes farmacéuticos pueden vender medicamentos a través de sitios en web en todo Chile.… https://t.co/8GquF75vSS,https://twitter.com/i/web/status/1259936315732185088,11/05/2020 16:00:00,TweetDeck,0,2,Instituto de Salud Pública de Chile,16:00:00,http://pbs.twimg.com/profile_images/1219288777228681216/DWTCW08o.jpg
"RT @ONU_es: ""A la #COVID19 no le importa quiénes somos, dónde vivimos ni en qué creemos, no hace ninguna distinción. Necesitamos hasta la ú…",https://twitter.com/i/web/status/1259937756983197700,11/05/2020 16:05:44,Twitter Web App,0,256,OPS/OMS,16:05:44,http://pbs.twimg.com/profile_images/1096094749902028801/ijbQWupW.png
"RT @OEA_oficial: 🗓️ VIERNES, 15 de mayo, 12:00-1:30 EST, Seminario de @opsoms sobre el bienestar y la resiliencia de la familia en el conte…",https://twitter.com/i/web/status/1259937931063590913,11/05/2020 16:06:25,Twitter Web App,0,28,OPS/OMS,16:06:25,http://pbs.twimg.com/profile_images/1096094749902028801/ijbQWupW.png
RT @ministeriosalud: Ministerio de Salud facilita más de 50 vehículos para municipios de la RM  https://t.co/XBUZMZrtUZ #PlanCoronavirus,https://twitter.com/i/web/status/1259941896413163520,11/05/2020 16:22:11,Twitter Web App,0,11,Super de Salud Chile,16:22:11,http://pbs.twimg.com/profile_images/986969865830518784/gbIFCMKC.jpg
RT @ministeriosalud: Autoridades de salud garantizan disponibilidad de ventiladores  https://t.co/4wyxZgFS7s #PlanCoronavirus,https://twitter.com/i/web/status/1259945626386731009,11/05/2020 16:37:00,Twitter for iPhone,0,10,Instituto de Salud Pública de Chile,16:37:00,http://pbs.twimg.com/profile_images/1219288777228681216/DWTCW08o.jpg
RT @ministeriosalud: Ministerio de Salud facilita más de 50 vehículos para municipios de la RM  https://t.co/XBUZMZrtUZ #PlanCoronavirus,https://twitter.com/i/web/status/1259945635060551682,11/05/2020 16:37:02,Twitter for iPhone,0,11,Instituto de Salud Pública de Chile,16:37:02,http://pbs.twimg.com/profile_images/1219288777228681216/DWTCW08o.jpg
"Como @SuperDeSalud enviamos nuestro más sentido pésame a los familiares y amigos de Karen Figueroa Rodríguez, funci… https://t.co/IPg1zBztpC",https://twitter.com/i/web/status/1259949075417444353,11/05/2020 16:50:42,Twitter Web App,1,1,Super de Salud Chile,16:50:42,http://pbs.twimg.com/profile_images/986969865830518784/gbIFCMKC.jpg
"Protégete contra el nuevo Coronavirus COVID-19.

Entérate más sobre cómo prevenirlo en: https://t.co/YdvmOl5Grx… https://t.co/Upf61y2I1c",https://twitter.com/i/web/status/1259951412814819328,11/05/2020 17:00:00,TweetDeck,0,0,Instituto de Salud Pública de Chile,17:00:00,http://pbs.twimg.com/profile_images/1219288777228681216/DWTCW08o.jpg
Como #Colmed hemos recibido denuncias de este tipo y estamos revisando los casos junto a #UDELAM. Hacemos un llamad… https://t.co/fpze2WCoPc,https://twitter.com/i/web/status/1259953600794632192,11/05/2020 17:08:41,Twitter Web App,23,20,Colmed Chile,17:08:41,http://pbs.twimg.com/profile_images/1245851467891736576/TayMmMjI.jpg
Hospital San José desmiente falta de ventiladores tras muerte de paciente https://t.co/T8LEEDBVfX vía @T13,https://twitter.com/i/web/status/1259953767375462400,11/05/2020 17:09:21,Twitter Web Client,31,19,Ministerio de Salud,17:09:21,http://pbs.twimg.com/profile_images/1240679830183649288/S94zI3Yu.jpg
"RT @pdazan: Sabemos que la medida de cuarentena tiene efectos adversos, es por eso que hacemos un llamado a respetar la indicación de aisla…",https://twitter.com/i/web/status/1259954786004131842,11/05/2020 17:13:24,Twitter Web App,0,20,Ministerio de Salud,17:13:24,http://pbs.twimg.com/profile_images/1240679830183649288/S94zI3Yu.jpg
El #dengue es una enfermedad viral 🤒 que si no es tratada a tiempo puede ser MORTAL en cuestión de HORAS ⌛. 👀Entéra… https://t.co/wRGA4ctKnY,https://twitter.com/i/web/status/1259960247596339207,11/05/2020 17:35:06,Twitter Web App,47,36,OPS/OMS,17:35:06,http://pbs.twimg.com/profile_images/1096094749902028801/ijbQWupW.png
"El 3 de marzo de este año se confirmó el primer contagio de #COVID_19 en 🇨🇱.

Dos meses antes, ya nos preparábamos… https://t.co/pnRufp22BJ",https://twitter.com/i/web/status/1259960679030611969,11/05/2020 17:36:49,Twitter Web App,11,11,Ministerio de Salud,17:36:49,http://pbs.twimg.com/profile_images/1240679830183649288/S94zI3Yu.jpg
Hagamos un buen uso de nuestra red asistencial y recuerda llamar a @Salud_Responde al 600 360 7777 como primer medi… https://t.co/aH6e8gDkb5,https://twitter.com/i/web/status/1259966512875462656,11/05/2020 18:00:00,Twitter Media Studio,12,4,Ministerio de Salud,18:00:00,http://pbs.twimg.com/profile_images/1240679830183649288/S94zI3Yu.jpg
"Donemos Sangre. Aquí te contamos cómo ir a donar.

Si tu comuna está en cuarentena puedes pedir tu permiso en… https://t.co/5Iszf9SI7w",https://twitter.com/i/web/status/1259966513651552257,11/05/2020 18:00:00,TweetDeck,2,3,Instituto de Salud Pública de Chile,18:00:00,http://pbs.twimg.com/profile_images/1219288777228681216/DWTCW08o.jpg
RT @opscuba: Caridad Cairo Soler ha dedicado más de 50 años a la labor de enfermería. Conoce la historia de esta enfermera en el boletín de…,https://twitter.com/i/web/status/1259967619198828544,11/05/2020 18:04:24,Twitter for iPhone,0,1,OPS/OMS,18:04:24,http://pbs.twimg.com/profile_images/1096094749902028801/ijbQWupW.png
RT @opsargentina: Mañana es el Día Internacional de las Enfermeras y Enfermeros. Participá a las 13.30 (hora de ARG) del webinar sobre su c…,https://twitter.com/i/web/status/1259967656570114049,11/05/2020 18:04:33,Twitter for iPhone,0,7,OPS/OMS,18:04:33,http://pbs.twimg.com/profile_images/1096094749902028801/ijbQWupW.png
"RT @OPSOMSPeru: #COVID19 Si trabajas en una obra, mantén una distancia mínima de 1 metro en todo momento 👷‍♀‍↔️👷

Encuentra esto y más para…",https://twitter.com/i/web/status/1259967712618590209,11/05/2020 18:04:46,Twitter for iPhone,0,10,OPS/OMS,18:04:46,http://pbs.twimg.com/profile_images/1096094749902028801/ijbQWupW.png
"Nuestro Vicepresidente Patricio Meza y los doctores Daniella Greibe y Arturo Hillerns, de la Asociación Médica y de… https://t.co/pf8zwYdTdC",https://twitter.com/i/web/status/1259967789810540544,11/05/2020 18:05:04,Twitter Web App,25,7,Colmed Chile,18:05:04,http://pbs.twimg.com/profile_images/1245851467891736576/TayMmMjI.jpg
RT @Ops_Paraguay: 💦Paraguay fortalece los sistemas de agua y saneamiento en Centros educativos y penitenciarías con la cooperación técnica…,https://twitter.com/i/web/status/1259967894928134152,11/05/2020 18:05:29,Twitter for iPhone,0,7,OPS/OMS,18:05:29,http://pbs.twimg.com/profile_images/1096094749902028801/ijbQWupW.png
"RT @OPASOMSBrasil: Somos todos os dias bombardeados c/ várias informações sobre #COVID19: qtas pessoas estão infectadas, qtas perderam a vi…",https://twitter.com/i/web/status/1259967945670877187,11/05/2020 18:05:41,Twitter for iPhone,0,8,OPS/OMS,18:05:41,http://pbs.twimg.com/profile_images/1096094749902028801/ijbQWupW.png
Minsal descartó que muerte de paciente en Hospital San José haya sido por falta de ventiladores https://t.co/J0MrlM6sFN,https://twitter.com/i/web/status/1259968300299112448,11/05/2020 18:07:06,Twitter Web Client,16,12,Ministerio de Salud,18:07:06,http://pbs.twimg.com/profile_images/1240679830183649288/S94zI3Yu.jpg
"RT @GobiernodeChile: Dos meses antes de que el #coronavirus🦠 llegara a nuestro país, como @GobiernodeChile ya estábamos preparándonos para…",https://twitter.com/i/web/status/1259968367630274560,11/05/2020 18:07:22,Twitter Web App,0,79,Ministerio de Salud,18:07:22,http://pbs.twimg.com/profile_images/1240679830183649288/S94zI3Yu.jpg
RT @HCMagallanes: ❤Qué alegría siente todo nuestro hospital al ver a Pamela Carrasco Tens HCM que estuvo 39 días hospitalizada x Covid-19 s…,https://twitter.com/i/web/status/1259978549970128901,11/05/2020 18:47:50,Twitter Web App,0,17,Ministerio de Salud,18:47:50,http://pbs.twimg.com/profile_images/1240679830183649288/S94zI3Yu.jpg
"RT @GobiernodeChile: Dos meses antes de que el #coronavirus🦠 llegara a nuestro país, como @GobiernodeChile ya estábamos preparándonos para…",https://twitter.com/i/web/status/1259978619767717888,11/05/2020 18:48:06,Twitter for iPhone,0,79,Super de Salud Chile,18:48:06,http://pbs.twimg.com/profile_images/986969865830518784/gbIFCMKC.jpg
"[#AHORA] En #PautaFinal de #Radio @Pauta_cl, nuestro secretario nacional, Dr. José Miguel Bernucci (@pajarobere), s… https://t.co/dLmA4lwVDS",https://twitter.com/i/web/status/1259979547069558784,11/05/2020 18:51:47,Twitter Web App,18,9,Colmed Chile,18:51:47,http://pbs.twimg.com/profile_images/1245851467891736576/TayMmMjI.jpg
"Dr. Bernucci: ""Hemos visto que durante las últimas semanas hemos tenido un aumento explosivo del ingreso de pacient… https://t.co/W0dTe3tSMa",https://twitter.com/i/web/status/1259981332656029703,11/05/2020 18:58:53,Twitter Web App,8,13,Colmed Chile,18:58:53,http://pbs.twimg.com/profile_images/1245851467891736576/TayMmMjI.jpg
Sigue estos consejos si un miembro de tu hogar es diagnosticado con #COVID_19 y es enviado a realizar su cuarentena… https://t.co/kq9EfzKu0f,https://twitter.com/i/web/status/1259981612265152514,11/05/2020 19:00:00,Twitter Media Studio,8,7,Ministerio de Salud,19:00:00,http://pbs.twimg.com/profile_images/1240679830183649288/S94zI3Yu.jpg
"Es obligatorio el uso de mascarilla, pero evita tocártela y #LávateLasManos 

Conoce más sobre esta nueva medida en… https://t.co/4eT8wgFyY5",https://twitter.com/i/web/status/1259981611728158720,11/05/2020 19:00:00,TweetDeck,2,2,Instituto de Salud Pública de Chile,19:00:00,http://pbs.twimg.com/profile_images/1219288777228681216/DWTCW08o.jpg
RT @arturozunigaj: Ministerio de Salud facilita más de 50 vehículos para municipios de la RM - Ministerio de Salud - Gobierno de Chile http…,https://twitter.com/i/web/status/1259984216772816897,11/05/2020 19:10:21,Twitter for iPhone,0,14,Ministerio de Salud,19:10:21,http://pbs.twimg.com/profile_images/1240679830183649288/S94zI3Yu.jpg
"[#AHORA] Nuestro Vicepdte. Dr. Patricio Meza, conversa con @adnradiochile, sobre el aumento de casos por #COVID19 e… https://t.co/v9c0qBm8An",https://twitter.com/i/web/status/1259986514366341120,11/05/2020 19:19:29,Twitter Web App,9,4,Colmed Chile,19:19:29,http://pbs.twimg.com/profile_images/1245851467891736576/TayMmMjI.jpg
"Dr. Meza: ""Estamos muy preocupados por el aumento de casos en los últimos días, el tener más de mil contagiados al… https://t.co/WLk3HqdEQB",https://twitter.com/i/web/status/1259988043068473346,11/05/2020 19:25:33,Twitter Web App,9,12,Colmed Chile,19:25:33,http://pbs.twimg.com/profile_images/1245851467891736576/TayMmMjI.jpg
"Dr. Meza: ""Nuestros equipos de salud están con una sobrecarga asistencia tremenda, con mucho estrés, es algo que no… https://t.co/kW34G6JbsM",https://twitter.com/i/web/status/1259989391289786368,11/05/2020 19:30:55,Twitter Web App,7,5,Colmed Chile,19:30:55,http://pbs.twimg.com/profile_images/1245851467891736576/TayMmMjI.jpg
"Dr. Meza: ""Estamos preocupados por el aumento de pacientes que han sido hospitalizados en las Unidades de Cuidados… https://t.co/LYv6aAdWqQ",https://twitter.com/i/web/status/1259990339521261569,11/05/2020 19:34:41,Twitter Web App,17,14,Colmed Chile,19:34:41,http://pbs.twimg.com/profile_images/1245851467891736576/TayMmMjI.jpg
"Desde el #Colmed y junto a @ASOFAMECH @Asocimed_Chile y la Academia Chilena de Medicina, rechazamos la modificación… https://t.co/JR5EYnwhkR",https://twitter.com/i/web/status/1259991382321778689,11/05/2020 19:38:49,Twitter Web App,50,42,Colmed Chile,19:38:49,http://pbs.twimg.com/profile_images/1245851467891736576/TayMmMjI.jpg
Nos parece injustificado pues la alerta sanitaria permiten contratar médic@s sin EUNACOM ni título revalidado y a e… https://t.co/znxMHAI7cF,https://twitter.com/i/web/status/1259991384452366338,11/05/2020 19:38:50,Twitter Web App,20,12,Colmed Chile,19:38:50,http://pbs.twimg.com/profile_images/1245851467891736576/TayMmMjI.jpg
"👋🏼 Es normal sentir miedo 😳 y ansiedad en estos tiempos de #COVID19.
#Hablemos ❤️ https://t.co/6n4mN56yuW",https://twitter.com/i/web/status/1259996272012013568,11/05/2020 19:58:15,Twitter for iPhone,77,35,OPS/OMS,19:58:15,http://pbs.twimg.com/profile_images/1096094749902028801/ijbQWupW.png
"Si estás en aislamiento domiciliario, es muy importante mantener las medidas de prevención en el hogar.

- Lávate l… https://t.co/hSgFVVZhAP",https://twitter.com/i/web/status/1259996713219022849,11/05/2020 20:00:00,TweetDeck,1,1,Instituto de Salud Pública de Chile,20:00:00,http://pbs.twimg.com/profile_images/1219288777228681216/DWTCW08o.jpg
"¿Te lavaste las manos?

Hazlo frecuentemente con agua y jabón, además de seguir estas recomendaciones.

Visita… https://t.co/ZVyu8uKuT8",https://twitter.com/i/web/status/1259996711256195074,11/05/2020 20:00:00,Twitter Media Studio,3,6,Ministerio de Salud,20:00:00,http://pbs.twimg.com/profile_images/1240679830183649288/S94zI3Yu.jpg
"RT @UNOPS_es: #COVID19 #coronavirus | ¿Trabajas en una obra? Evita los apretones de manos, abrazos y demás formas de contacto cercano. 
➡️…",https://twitter.com/i/web/status/1259998121741955073,11/05/2020 20:05:36,Twitter for iPhone,0,10,OPS/OMS,20:05:36,http://pbs.twimg.com/profile_images/1096094749902028801/ijbQWupW.png
