name,url,description,datePublished,imagen,pais,Fuente
Sexto cargamento de vacunas Sinovac contra el COVID-19 ...,https://www.elperiodista.cl/2021/03/sexto-cargamento-de-vacunas-sinovac-contra-el-covid-19-llega-a-chile-con-dos-millones-de-dosis/,"Con esto, más de 13 millones de vacunas de los laboratorios Sinovac y Pfizer-BioNTech ya han arribado a nuestro país.",21-03-2021 23:48,https://www.bing.com/th?id=OVFT.fhskuYJioYBYvkYN94pffi,Chile,El Periodista
Pastor bendijo a Punta Arenas desde avioneta para ...,https://www.chilevision.cl/contigo-en-la-manana/mejores-momentos/pastor-bendijo-a-punta-arenas-desde-avioneta-para-librarlos-del-covid-19,La autoridad religiosa dio 7 vueltas alrededor de la ciudad para evitar la propagación del coronavirus en la Región de Magallanes.,22-03-2021 03:03,https://www.bing.com/th?id=OVFT.q4wqxTm4_n4kJZc3CRvZVi,Chile,chilevision.cl
Más de 7 mil infectados: Chile alcanzó récord de casos ...,https://www.chilevision.cl/contigo-en-la-manana/mejores-momentos/mas-de-7-mil-infectados-chile-alcanzo-record-de-casos-diarios-por,¿Es necesario un confinamiento total del país? El aumento de pacientes enfermos por coronavirus preocupa a las autoridades.,22-03-2021 03:03,https://www.bing.com/th?id=OVFT.HJPMXY2UjnSPjrwcI_bkNS,Chile,chilevision.cl
"Retorno a clases, teletrabajo y hacinamiento",https://www.diarioconcepcion.cl/opinion/2021/03/22/retorno-a-clases-teletrabajo-y-hacinamiento.html,"Comienza un nuevo año académico y va desapareciendo la sensación de “libertad” en nuestros entornos sociales, se escabullen los permisos de vacaciones (a quienes pueden) y nos encontramos de golpe nue",22-03-2021 03:26,https://www.bing.com/th?id=OVFT.A7KBrGppfM3Fn8asLtkfFy,Chile,El Diario de Concepcion
Streaming y entrevistas: La programación de EmolTV | Emol.com,https://www.emol.com/noticias/Nacional/2021/03/22/1015550/Programacion-EmolTV-semana-22-marzo.html,Mutual de Seguridad te entrega estos consejos en la semana de la felicidad: cuida tu cuerpo aliméntalo de manera saludable. Mutual de Seguridad te entrega estos consejos en la semana de la felicidad: cultiva el optimismo de esta manera tu salud mental se verá beneficiada. Jueves 18 de marzo,22-03-2021 03:55,https://www.bing.com/th?id=OVFT.Hb7iaFkpXyboqaAy7Y1wXi,Chile,Emol
Las rigurosas medidas sanitarias contra el COVID-19 con ...,https://www.24horas.cl/deportes/rallymobil/las-rigurosas-medidas-sanitarias-contra-el-covid-19-con-las-que-se-realizara-el-rallymobil-2021-4701503,"La pandemia cambió todo, lo que no deja ajeno a la principal competencia tuerca del país, ya que deberá contar con especiales medidas para poder desarrollar el campeonato.",22-03-2021 04:04,https://www.bing.com/th?id=OVFT.xOzFf8sEcg_anBEBEQJJii,Chile,24 Horas Chile
Lo que debes saber este lunes antes de que abra el mercado ...,https://www.df.cl/noticias/mercados/mercados-en-accion/lo-que-debes-saber-este-lunes-antes-de-que-abra-el-mercado/2021-03-22/072935.html,"Pero las caídas comenzaron en Asia, después de que el fin de semana el presidente de Turquía, Recep Tayyip Erdogan, ordenara la salida del jefe del banco central. Naci Agbal había asumido en noviembre",22-03-2021 10:29,https://www.bing.com/th?id=OVFT.Ufmw1duqVkVxc9AOZgZ2bC,Chile,df.cl
La vacuna de AstraZeneca previene al 79% el covid-19 ...,https://www.elciudadano.com/actualidad/la-vacuna-de-astrazeneca-previene-al-79-el-covid-19-sintomatico/03/22/,"La vacuna de AstraZeneca anterior al 79 por ciento el covid-19 sintomático y al cien por ciento los casos graves y hospitalizaciones, según un ensayo de fase III realizado en EEUU, Chile y Perú. Esta evaluación provisional de seguridad y eficacia se basa en 32.449 participantes, entre ellos 141",22-03-2021 10:43,https://www.bing.com/th?id=OVFT.xMXCLHHEPMubMPgxYYROzS,Chile,El Ciudadano
REPORTE : Los iPhones de este año mantienen (por ahora ...,https://www.transmedia.cl/blog/2021/03/22/reporte-los-iphones-de-este-ano-mantienen-por-ahora-fecha-de-anuncio-para-septiembre/,"Según la firma de análisis Wedbush indica que el iPhone 13 está en camino de su lanzamiento habitual en septiembre (hasta ahora) y tomando en cuenta que el año pasado, la interrupción de la cadena de",22-03-2021 11:11,https://www.bing.com/th?id=OVFT.He_atZE3H27vASPrzk9jgC,Chile,Transmedia
Hoy comienza la vacunación de vocales de mesa entre 51 y ...,http://www.ladiscusion.cl/hoy-comienza-la-vacunacion-de-vocales-de-mesa-entre-51-y-56-anos/,"Este lunes se realiza una nueva jornada del proceso de vacunación contra el Covid-19 en todo el país. En esta oportunidad se atenderá a vocales de mesa entre 51 y 56 años y personal de apoyo a las elecciones del 10 y 11 de abril. De acuerdo al calendario de vacunación del gobierno, se continúa",22-03-2021 11:32,https://www.bing.com/th?id=OVFT.LHWM27td3DdTLmnEULRF6S,Chile,La Discusión
Presentan primer cortometraje de ciencia ficción realizado ...,https://new.diariolaprensa.cl/index.php/2021/03/22/presentan-primer-cortometraje-de-ciencia-ficcion-realizado-en-curico/,CURICÓ. Se trata de un trabajo creado por la productora Caos Films de los realizadores locales: Cristian Gálvez Jiraldo (director); Carlos Núñez Ramírez (asistente de dirección y actuación); y Emilian,22-03-2021 11:41,https://www.bing.com/th?id=OVFT.bmaH5XhdJANfh3iRrHZcWC,Chile,La Prensa
Arturo Vidal tiene fecha de regreso con el Inter de Milán ...,https://redgol.cl/vidal/Arturo-Vidal-tiene-fecha-de-regreso-con-el-Inter-de-Milan-para-el-11-de-abril-20210322-0008.html,"Arturo Vidal avanza a buen ritmo en su recuperación luego de la operación en su rodilla izquierda que se realizó este 12 de marzo y que lo ha dejado apartado de las canchas con el Inter de Milán, que no ha aflojado en su ausencia y es el líder de la Serie A con muchas opciones de volver a alzar",22-03-2021 11:51,https://www.bing.com/th?id=OVFT.DD8Ze8L8vwb4prGncmWcKS,Chile,redgol
SanCarlosOnline,https://www.sancarlosonline.cl/search?updated-max=2021-03-20T08:01:00-07:00&max-results=16,"LOCAL.- (SConline).- Las cifras del coronavirus en San Carlos  siguen siendo negativas y en las últimas horas las autoridades sanitarias confirmaron otros dos fallecidos en la comuna de San Carlos, do",22-03-2021 12:00,https://www.bing.com/th?id=OVFT.TZkmJxlKV8Ouqka7kKRtoi,Chile,San Carlos Online
Los Ángeles por cuarta vez superó los 100 casos diarios de ...,https://www.latribuna.cl/coronavirus/2021/03/22/los-angeles-por-cuarta-vez-supero-los-100-casos-diarios-de-covid-19.html,La capital provincial está en el lugar 11 a nivel nacional entre las comunas con la mayor cantidad de personas que pueden contagiar esta enfermedad (824).,22-03-2021 12:25,https://www.bing.com/th?id=OVFT.fQX-I79EnWgXbHImC4j-ji,Chile,La Tribuna
María Soledad Barría: “Extrememos las medidas ya y vamos a ...,https://www.servicioweb.cl/maria-soledad-barria-extrememos-las-medidas-ya-y-vamos-a-las-elecciones-que-se-ha-ganado-el-pueblo-de-chile/,"Este sábado, los contagios de coronavirus superaron los siete mil, la mayor cifra de toda la pandemia. Con varios días seguidos en que los nuevos casos sobrepasan los seis mil, las medidas tomadas por",22-03-2021 12:31,https://www.bing.com/th?id=OVFT.coGbfCv3lQiGEjJ6w6udbC,Chile,Servicio Web
Activa Secano: San Rosendo será beneficiado con proyecto ...,https://www.latribuna.cl/noticias/2021/03/22/activa-secano-san-rosendo-sera-beneficiado-con-proyecto-para-combatir-la-sequia-y-reactivar-su-economia.html,"La iniciativa es implementada por el programa Servicio País de la Fundación Superación de la Pobreza, y es cofinanciada por la Unión Europea. Tendrá una duración de dos años y contribuirá al desarroll",22-03-2021 12:56,https://www.bing.com/th?id=OVFT.2OY0yS1ucafJCCdyaXWucy,Chile,La Tribuna
Senadora Rincón llama a suscribir acuerdo por Chile ante ...,http://www.lanacion.cl/senadora-rincon-llama-a-suscribir-acuerdo-por-chile-ante-complejo-escenario-por-pandemia/,“Nuestro país enfrenta un momento complejo por la pandemia de Covid-19 y como chilenas y chilenos debemos entregar señales concretas y de preocupación por la seguridad y tranquilidad de nuestras famil,22-03-2021 12:58,https://www.bing.com/th?id=OVFT.pCU680PR6E10OC3dAQhI8i,Chile,La Nación
Ximena Rincón llama a suscribir acuerdo por Chile ante ...,https://www.elmostrador.cl/dia/2021/03/22/ximena-rincon-llama-a-suscribir-acuerdo-por-chile-ante-complejo-escenario-por-pandemia/,“Nuestro país enfrenta un momento complejo por la pandemia de covid-19 y como chilenas y chilenos debemos entregar señales concretas y de preocupación por la seguridad y tranquilidad de nuestras famil,22-03-2021 13:05,https://www.bing.com/th?id=OVFT.ok3tewu9P6MlbXcPwEk04S,Chile,El Mostrador
Astrazeneca vacuna coagulo estudio chile - Noticias BBC ...,https://www.24horas.cl/noticiasbbc/astrazeneca-vacuna-coagulo-estudio-chile-4701229,Un ensayo clínico muy esperado concluye que la vacuna también reduce en un 100% los casos graves de covid-19 y es efectiva en todos los rangos de edad.,22-03-2021 13:13,https://www.bing.com/th?id=OVFT.7MQrU2sVSvxA3FKOLd5YXS,Chile,24 Horas Chile
Ximena Rincón llama a suscribir acuerdo por Chile ante ...,https://www.eldesconcierto.cl/nacional/2021/03/22/ximena-rincon-llama-a-suscribir-acuerdo-por-chile-ante-complejo-escenario-de-la-pandemia.html,"Ximena Rincón llama a suscribir acuerdo por Chile ante complejo escenario de la pandemia Por: Agencia Uno ... “Nuestro país enfrenta un momento complejo por la pandemia de COVID-19 y como chilenas y chilenos debemos entregar señales concretas y de preocupación por la seguridad y tranquilidad de nuestras familias, ...",22-03-2021 14:27,https://www.bing.com/th?id=OVFT.XWZFgS6HL_qmDyjpl_wWjS,Chile,eldesconcierto
Vacuna de AstraZeneca mostró efectividad del 80% en ...,https://www.biobiochile.cl/noticias/salud-y-bienestar/tratamientos/2021/03/22/vacuna-de-astrazeneca-mostro-efectividad-del-80-en-mayores-de-65-anos-segun-estudio-en-eeuu.shtml,"La vacuna de AstraZeneca contra la COVID-19 tiene una eficacia del 80 por ciento en mayores de 65 años, según el ensayo de fase III que la compañía ha realizado en Estados Unidos. Los resultados de es",22-03-2021 14:58,https://www.bing.com/th?id=OVFT.t_688-Jflvi2cl_r8QcaeC,Chile,Chile
Al borde de la cuarentena total: especialistas recomiendan ...,https://www.elmostrador.cl/noticias/pais/2021/03/22/al-borde-de-la-cuarentena-total-especialistas-recomiendan-confinamiento-en-la-rm-y-se-agudizan-dudas-sobre-realizacion-de-elecciones-de-abril/,"La atención ante el esperado informe del Ministerio de Salud de este lunes sobre el avance del Covid-19 está concentrada en saber si habrá una cuarentena completa en la Región Metropolitana, como reco",22-03-2021 15:10,https://www.bing.com/th?id=OVFT.afoRh8fCpTqqYwR1zDmREC,Chile,El Mostrador
Se inicia plan de vacunación contra Covid-19 para personas ...,https://www.elperiodista.cl/2021/03/se-inicia-plan-de-vacunacion-contra-covid-19-para-personas-que-viven-en-la-calle/,Se inicia plan de vacunación contra Covid-19 para personas que viven en la calle La subsecretaria de Salud Pública indicó que las personas serán ubicadas a través de distintas bases de datos que maneja el Ejecutivo a través del Ministerio de Desarrollo Social y el Ministerio de Vivienda.,22-03-2021 15:16,https://www.bing.com/th?id=OVFT.tybWbW-HHko8aCTflQU7MS,Chile,El Periodista
79% de efectividad y sin mayores riesgos de coágulos: Los ...,https://www.duna.cl/noticias/2021/03/22/79-de-efectividad-y-sin-mayores-riesgos-de-coagulos-los-estudios-sobre-la-vacuna-de-astrazeneca/,"Los esperados resultados de los ensayos clínicos de la vacuna de Oxford-AstraZeneca llevados a cabo en Estados Unidos, Chile y Perú confirmaron que es tanto segura como altamente efectiva. La vacuna m",22-03-2021 15:57,https://www.bing.com/th?id=OVFT.UI7oPGMjYkWNcOzjIC3cIi,Chile,duna
Gobierno inicia proceso de vacunación de trabajadores ...,https://www.df.cl/noticias/empresas/energia/gobierno-inicia-proceso-de-vacunacion-de-trabajadores-esenciales-del/2021-03-22/121025.html,"El sector de energía, que involucra alrededor de 80 mil trabajadores esenciales, podrá inocularse entre hoy y mañana.",22-03-2021 16:03,https://www.bing.com/th?id=OVFT.OY7eUY09Sm0NW7W2hh547i,Chile,df.cl
Plan Paso a Paso: 42 comunas del país retroceden a ...,https://www.t13.cl/noticia/nacional/cuarentena-pandemia-chile-minsal-22-03-2021,"El Ministerio de Salud (Minsal) anunció, durante la jornada de este lunes, nuevas modificaciones a las cuarentenas del Plan Paso a Paso en el marco de la pandemia del coronavirus COVID-19. Dicho plan",22-03-2021 16:22,https://www.bing.com/th?id=OVFT.VUwhOXdHim8SkKMywcX4Ri,Chile,T13
Informe Epidemiológico: cifra nacional de casos activos ...,https://www.adnradio.cl/nacional/2021/03/20/informe-epidemiologico-cifra-nacional-de-casos-activos-supera-los-47-mil-y-rm-va-al-alza.html,"En total, ocho regiones superan los 2 mil casos activos. Puente Alto, Temuco y Concepción encabezan el listado.",22-03-2021 16:35,https://www.bing.com/th?id=OVFT.ZWbXBg7tiRccDUBX39r7wC,Chile,ADN
Chile registra más de 6.155 nuevos contagios por COVID-19 ...,https://www.t13.cl/noticia/nacional/chile-contagios-nuevos-muertos-22-03-2021,"Este lunes, el Ministerio de Salud (Minsal) confirmó 6.155 nuevos contagios y 80 muertes en las últimas 24 horas producto de la pandemia de coronavirus en Chile. En un nuevo balance de la autoridad sa",22-03-2021 16:38,https://www.bing.com/th?id=OVFT.pA2cJJIrWYOGKS1vfv9jJS,Chile,T13
Uruguayos salvados por arriero chileno en 1972 ...,https://laprensaaustral.cl/2021/03/22/uruguayos-salvados-por-arriero-chileno-en-1972-protagonizaron-emotivo-video-motivacional/,Algunos de los 16 pasajeros que salieron con vida del accidente aéreo de 1972 en la cordillera de los Andes participaron de una campaña oficial que busca generar conciencia sobre la importancia de ext,22-03-2021 16:47,https://www.bing.com/th?id=OVFT.QGpvdTvkxomd72myDBIgUi,Chile,La Prensa Austral
Masiva cuarentena en Chile: Más de 40 comunas a Fase 1 ...,https://www.eldesconcierto.cl/nacional/2021/03/22/masiva-cuarentena-en-chile-mas-de-40-comunas-a-fase-1-cierre-de-supermercados-y-suspension-de-permiso-de-desplazamiento.html,"Luego de los récords de contagios en toda la pandemia que se han informado en los últimos días, el gobierno decidió poner en cuarentena a casi 14 millones de personas en Chile, donde la Región Metropo",22-03-2021 16:54,https://www.bing.com/th?id=OVFT.xk_f4AvTBTI4jtGCggVdfi,Chile,eldesconcierto
Las sorprendentes predicciones para el fin de la pandemia ...,https://laprensaaustral.cl/2021/03/22/las-sorprendentes-predicciones-para-el-fin-de-la-pandemia-segun-un-experto-de-yale/,"El Covid-19, declarado pandemia por la Organización Mundial de la Salud (OMS) hace poco más de un año, se presentó como un cisne negro, metáfora acuñada por el filósofo libanés Nassim Taleb para descr",22-03-2021 17:00,https://www.bing.com/th?id=OVFT.FcLmj0rLB5YUK_GMmFR0ri,Chile,La Prensa Austral
Volkswagen cierra temporalmente sus fábricas en Brasil por ...,https://www.latercera.com/mtonline/noticia/volkswagen-cierra-temporalmente-sus-fabricas-en-brasil-por-el-covid-19/S3E42B2Y5FCJVAJT5X6CEIH3SA/,La firma alemana opta por priorizar la salud de las personas y bajará la producción por 12 días en sus cuatro instalaciones.,22-03-2021 17:01,https://www.bing.com/th?id=OVFT.2xUnIXAO-c5bHQ0BXYjAOi,Chile,LA TERCERA
La dura estadística de decesos: 20% de las comunas de ...,https://www.latercera.com/la-tercera-pm/noticia/la-dura-estadistica-de-decesos-20-de-las-comunas-de-chile-ya-suma-mas-muertos-por-covid-19-que-en-todo-2020/UV2QU5V7URCHDN636PLGQHKDVA/,"De acuerdo a datos del DEIS, 73 municipios ya superaron sus fallecidos por esta causa respecto al año pasado y otros 15 tienen exactamente la misma cantidad. La lista se concentra en la zona centro-sur del país, sobre todo entre las regiones de Ñuble y Los Lagos. Es, sin duda, la estadística",22-03-2021 17:01,https://www.bing.com/th?id=OVFT.diatXALqqWgfB0mRcIEysS,Chile,LA TERCERA
