name,url,description,datePublished,imagen,pais,Fuente
Pintor local Luis Guzmán inaugurará muestra en Dubái – La ...,http://www.ladiscusion.cl/pintor-local-luis-guzman-inaugurara-muestra-en-dubai/,El artista chillanejo Luis Guzmán Molina inaugurará una muestra este jueves en Dubai. La exposición se titula “Acuarelas del sur del mundo” y será montada en el Centro Financiero de la ciudad,03-03-2021 02:06,https://www.bing.com/th?id=OVFT.o74IX1CoBEKPDB4cdSk-6C,Chile,La Discusión
Las vacunas: una lucha global que requiere una respuesta ...,https://www.elmostrador.cl/noticias/opinion/2021/03/03/las-vacunas-una-lucha-global-que-requiere-una-respuesta-global/,"Además, la Unión Europea y sus estados miembros contribuyeron al Fondo de Acceso Global para Vacunas Covid-19, COVAX, que representa el esfuerzo solidario de muchos países para garantizar el acceso a",03-03-2021 04:15,https://www.bing.com/th?id=OVFT.Oz0ahN9DKRixGiguQtbK_y,Chile,El Mostrador
Cerca de 27 mil turistas extranjeros ingresaron al país en ...,https://www.elmostrador.cl/generacion-m/2021/03/03/cerca-de-27-mil-turistas-extranjeros-ingresaron-al-pais-en-enero/,"En tanto, durante enero, el tráfico aéreo nacional, tuvo una caída de -64,7% en relación con el mismo mes del año anterior",03-03-2021 05:00,https://www.bing.com/th?id=OVFT.RUP1x8kuT37th3bt6zo-bC,Chile,El Mostrador
El Ciudadano | Organizaciones del pueblo Mapuche rechazan ...,https://www.elciudadano.com/chile/organizaciones-del-pueblo-mapuche-rechazan-extension-de-estado-de-excepcion/03/03/,"Organizaciones del pueblo mapuche denunciaron que el gobierno de Chile pretende extender el estado de excepción en la región chilena de La Araucanía, intención ya anunciado por el presidente Sebastián",03-03-2021 06:43,https://www.bing.com/th?id=OVFT.bbB2cPbi19HX2u44ljXzri,Chile,El Ciudadano
La próxima Copa del Mundo a la vista: Los lujos y cuánto ...,https://www.24horas.cl/deportes/eliminatorias-qatar-2022/la-proxima-copa-del-mundo-a-la-vista-los-lujos-y-cuanto-cuestan-los-tickets-para-qatar-2022-4677523,"A más de un año de su inicio, la FIFA ya inició la venta de paquetes para el Mundial más lujoso que se tenga recuerdo. Los tickets de partidos hasta antes de la fase de semifinales costarán entre 950",03-03-2021 07:18,https://www.bing.com/th?id=OVFT.MdqqNwFBLNnKBAZzazzsVy,Chile,24 Horas Chile
Ministro Figueroa da inicio al año de educación parvularia ...,https://www.24horas.cl/nacional/ministro-figueroa-da-inicio-al-ano-de-educacion-parvularia-2021-4677525,"La mañana de este miércoles, el ministro de Educación, Raúl Figueroa, dio inicio al año escolar de la Educación Parvularia 2021. En ese sentido, destacó que son estos niños quienes requieren mayor con",03-03-2021 07:21,https://www.bing.com/th?id=OVFT.kD8WGgzT_rgkOXNAfGHA0i,Chile,24 Horas Chile
Llega a Chile cargamento más grande de vacunas Pfizer ...,https://www.biobiochile.cl/noticias/nacional/chile/2021/03/03/llega-a-chile-cargamento-mas-grande-de-vacunas-pfizer-biontech.shtml,"La mañana de este miércoles, en el primer aniversario del primer contagio confirmado de covid-19, Chile recibió el cargamento",03-03-2021 07:22,https://www.bing.com/th?id=OVFT.WoXVjWQSW2JnbInkvsF9Iy,Chile,Chile
Nueve farmacéuticas avanzan en vacunas Covid-19 para niños ...,https://www.latercera.com/que-pasa/noticia/nueve-farmaceuticas-avanzan-en-vacunas-covid-19-para-ninos/QNZ6C2N3IRHILJWKMQYFMPNHZU/,"Ninguna vacuna hasta ahora está aprobada para ellos. La urgencia de la pandemia y evitar casos graves y muertes en grupos de riesgo, los mantiene fuera. Pero diversos estudios ya están en marcha para",03-03-2021 08:41,https://www.bing.com/th?id=OVFT.G2uUU7R736fzOXXhJSPTpi,Chile,LA TERCERA
Funcionarios de Paso Fronterizo Cardenal Samoré fueron ...,https://www.biobiochile.cl/noticias/nacional/region-de-los-lagos/2021/03/03/funcionarios-de-paso-fronterizo-cardenal-samore-fueron-inoculados-contra-el-covid-19.shtml,"En la provincia de Osorno, funcionarios del Paso Fronterizo Cardenal Samoré fueron inoculados contra el covid-19, mientras que obras",03-03-2021 09:41,https://www.bing.com/th?id=OVFT.5KEmpjBMBooogpgWC0jLVC,Chile,Chile
Cuando el Minsal confirmó el primer caso de Covid-19 en Chile,http://www.lanacion.cl/cuando-el-minsal-confirmo-el-primer-caso-de-covid-19-en-chile/,"Hace justo un año, exministro Jaime Mañalich se trasladó a la Región del Maule para informar que se trataba de un médico, de 33 años, del Cesfam Carlos Gidi de San Javier, que se encontraba internado",03-03-2021 10:00,https://www.bing.com/th?id=OVFT.4Qu_oSKKimuTY72O0FkaYC,Chile,La Nación
Enrique Paris y Paula Daza se emocionaron a un año del ...,https://www.elperiscopio.cl/destacado-1/enrique-paris-y-paula-daza-se-emocionaron-a-un-ano-del-primer-caso-de-covid-19-en-chile/,Las autoridades recordaron a quienes han fallecido producto de la pandemia y valoraron los esfuerzos de quienes han trabajado por combatirla.,03-03-2021 10:09,https://www.bing.com/th?id=OVFT.kT0pswQIhikHlYqv_eMvMi,Chile,elperiscopio.cl
"Arturo Zúñiga, a un año del primer caso de COVID-19 en ...",https://www.lacuarta.com/cronica/noticia/arturo-zuniga-primer-caso-covid/608587/,"El exsubsecretario de Redes Asistenciales, relató al diario pop cómo se vivió el 3 de marzo de 2020, cuando arribó el coronavirus en Chile.",03-03-2021 10:10,https://www.bing.com/th?id=OVFT.3bD9YtAwczvQUfmwluvQCy,Chile,La Cuarta
El nuevo golpe que sufrió Florcita Motuda en la Cámara de ...,https://www.elperiscopio.cl/destacado-1/el-nuevo-golpe-que-sufrio-florcita-motuda-en-la-camara-de-diputados/,El parlamentario buscaba anular los castigos que le impusieron por difundir fotos íntimas en sus redes sociales.,03-03-2021 10:17,https://www.bing.com/th?id=OVFT.MCqQ0EuPSnPV-8eMt97VWC,Chile,elperiscopio.cl
Chile estudiará manufactura de vacunas,https://www.pauta.cl/ciencia-y-tecnologia/couve-vacunas-coronavirus-ciencia,El ministro Andrés Couve destacó que hay desarrollo en el país de vacunas pero que su elaboración es una discusión a tener.,03-03-2021 11:51,https://www.bing.com/th?id=OVFT.Wft767LLuZx1XPGuQzotRy,Chile,pauta
HRT recuerda primer caso de Covid-19 en Chile – Diario La ...,https://new.diariolaprensa.cl/index.php/2021/03/03/hrt-recuerda-primer-caso-de-covid-19-en-chile/,"El director del Hospital Regional de Talca, Osvaldo Acevedo, junto al equipo del Servicio de Medicina desde hace un año atiende pacientes con Covid-19. TALCA. Hace exactamente un año, fue confirmado e",03-03-2021 12:08,https://www.bing.com/th?id=OVFT.Oh9ED5avYixV0ZHFFupwDy,Chile,La Prensa
Niños/as de Chile Chico son parte de salida pedagógica al ...,https://www.rln.cl/regional/84301-ninos-as-de-chile-chico-son-parte-de-salida-pedagogica-al-parque-patagonia,"El Departamento de Educación Municipal de Chile Chico, bajo sus proyectos educativos “el viento es música” y “Puelche” del área extra-escolar, liderado por el profesor Jorge Armando Pillancari, realiz",03-03-2021 12:49,https://www.bing.com/th?id=OVFT.teJ6gwzNqO1q-TKvAOqwqi,Chile,Radio las Nieves
COVID-19 en Chile: a 365 días del primer caso en el país ...,https://uchile.cl/noticias/173263/covid-19-en-chile-la-realidad-del-pais-a-365-dias-del-primer-caso,UChile.online. La pandemia que cambió nuestras vidas COVID-19 en Chile: a 365 días del primer caso en el país. Hoy 3 de marzo se cumple un año desde que el SARS-CoV-2 llegó a,03-03-2021 13:07,https://www.bing.com/th?id=OVFT.R_CF2wu8yN2uSVeJ-s0n6y,Chile,uchile.cl
Chile inicia aplicación de segunda dosis según plan de ...,https://www.t13.cl/noticia/nacional/chile-inicia-inoculacion-segundas-dosis-mayores-90-anos-03-03-2021,"Este miércoles, además de la segunda dosis, podrán vacunarse los adultos mayores de 62 años y los trabajadores de la educación escolar y pre escolar entre 28 y 31 años.",03-03-2021 13:08,https://www.bing.com/th?id=OVFT.a02Ld5uZov4PVXw9IzhRPC,Chile,T13
Esta jornada llegaron al país más de 200 mil vacunas del ...,https://www.meganoticias.cl/nacional/328900-vacuna-contra-el-coronavirus-llegaron-al-pais-mas-de-200-mil-dosis-laboratorio-pfizer-crx12.html,"En la presente jornada llegaron al país más de 200 mil vacunas del laboratorio Pfizer, para seguir con el proceso contra el coronavirus. La información la entregó el Gobierno en su cuenta de Twitter.",03-03-2021 13:09,https://www.bing.com/th?id=OVFT.JzJwPi68-nl86Ao7ZJLJdS,Chile,meganoticias
A un año del primer caso de coronavirus en Chile: Hoy ...,https://www.meganoticias.cl/nacional/328896-vacunacion-masiva-segunda-dosis-coronavirus-mayores-90-anos-un-ano-primer-caso-en-chile-rex10.html,"En todos los centros médicos del país comenzó la segunda etapa del proceso de vacunación masiva que se realiza en medio del combate al coronavirus, todo a un año del primer caso en Chile.",03-03-2021 13:21,https://www.bing.com/th?id=OVFT.x_wH2H9EKMJkkUcd-hcEPi,Chile,meganoticias
Pandemia: Estudio revela que Chile sigue siendo uno de los ...,https://www.emol.com/noticias/Economia/2021/03/03/1013720/Empleos-internacional-enero-2021.html,"El análisis de la Cámara de Comercio de Santiago, demostró que, si bien el mercado laboral ha logrado recuperar un millón de trabajos, la reactivación continúa siendo débil.",03-03-2021 13:39,https://www.bing.com/th?id=OVFT.Tgxzm39YWbOEoP-CCVI_5i,Chile,Emol
"Chile supera las 3,5 millones de personas vacunadas contra ...",http://www.ladiscusion.cl/chile-supera-las-35-millones-de-personas-vacunadas-contra-el-covid-19/,"El Ministerio de Salud informó que este martes se superó a las 3,5 millones de personas vacunadas en el país, con la primera dosis, contra el Covid-19. De acuerdo con los datos entregados por el",03-03-2021 13:40,https://www.bing.com/th?id=OVFT.TbZ-K7v9Rvcag3Xjx7Iv9i,Chile,La Discusión
Dos fallecidos tras violento accidente automovilístico en ...,https://www.chilevision.cl/contigo-en-la-manana/mejores-momentos/dos-fallecidos-tras-violento-accidente-automovilistico-en-puente-alto,"Un automóvil que circulaba en el sector de Cuatro Oriente con Pedro Duarte, en Puente Alto, fue impactado por un bus Red del recorrido F15 que iba sin pasajeros. Dos personas resultaron fallecidas y u",03-03-2021 13:53,https://www.bing.com/th?id=OVFT._yXowtiZfQX9v-kKdm6uqy,Chile,chilevision.cl
"“Aquí todos dejamos de lados los egos y, como región ...",https://elpinguino.com/noticia/2021/03/03/aqui-todos-dejamos-de-lados-los-egos-y-como-region-todos-juntos-hemos-logrado-grandes-objetivos-y-eso-me-da-esperanza,"Al cumplirse el primer mes del proceso de vacunación, la secretaria ministerial de la región habló sobre el proceso que se vivió de manera silenciosa en el Ministerio para poder asegurar las dosis suf",03-03-2021 14:02,https://www.bing.com/th?id=OVFT.ImMmaV8mRrHjJLGlJHqlQS,Chile,ELPINGUINO
Chile registra 3.053 nuevos casos de COVID-19 en un día ...,https://www.t13.cl/noticia/nacional/chile-registra-3.053-nuevos-casos-covid-19-03-03-2021,Desde el ministerio informaron que en las últimas 24 horas se registraron 3.053nuevos casos de COVID-19 sumando 835.552 en todo el territorio nacional desde el inicio de la emerg,03-03-2021 14:06,https://www.bing.com/th?id=OVFT.lvQg7NXP9cq2US3y60lG8i,Chile,T13
Llega a Chile nuevo cargamento con más de 200 mil vacunas ...,https://www.latercera.com/nacional/noticia/llega-a-chile-nuevo-cargamento-con-mas-de-200-mil-vacunas-pfizer-contra-el-coronavirus/2MK3FYO7MNDZXBJI7V7XDYNCDQ/,Se trata del séptimo cargamento de este tipo en aterrizar en nuestro país y el undécimo si se consideran los cuatro arribos de las dosis de Sinovac.,03-03-2021 14:29,https://www.bing.com/th?id=OVFT.7c6GUyC1jyS2G0l7NLm5AC,Chile,LA TERCERA
A un año del primer caso de Covid-19 en Chile Minsal ...,https://www.latribuna.cl/destacados/2021/03/03/a-un-ano-del-primer-caso-de-covid-19-minsal-informo-3-053-pcr-positivos.html,"Además, se reportaron 20 fallecidos en las últimas 24 horas, llegando a un total de 20.704 muertos en el país.",03-03-2021 14:44,https://www.bing.com/th?id=OVFT.isUZq7NkocGX6P28Vwes9y,Chile,La Tribuna
"Cancelaciones, postergaciones y la virtualización de los ...",https://www.emol.com/noticias/Nacional/2021/03/03/1013711/Eventos-impactados-pandemia-Chile-Mundo.html,"Conciertos, festivales y encuentros políticos se siguen adaptando a los cambios que dejó el coronavirus en el mundo y en Chile, a un año del primer caso en el país.",03-03-2021 15:21,https://www.bing.com/th?id=OVFT.BYC4JPLfda4PynPRtv9V9S,Chile,Emol
"Chile registra más de 3,6 millones de personas vacunadas ...",http://www.lanacion.cl/chile-registra-mas-de-36-millones-de-personas-vacunadas-contra-el-covid-19/,"El Ministerio de Salud detalló que, del total de inoculados, el 59,1% corresponde a mujeres y un 40,9% son hombres. Además, 2.342.409 personas vacunadas tienen 60 años y más.",03-03-2021 16:57,https://www.bing.com/th?id=OVFT.BLj-26-vgB7fUjwLk8RePi,Chile,La Nación
"""Lo bueno, lo malo y lo feo"": El balance a la gestión de ...",https://www.duna.cl/noticias/2021/03/03/lo-bueno-lo-malo-y-lo-feo-el-balance-a-la-gestion-de-la-pandemia/,"A un año del primer caso de Covid-19 en Chile, los máximos representantes del Ministerio de Salud hicieron un balance de la pandemia en el país, en un punto de prensa donde se recibió el séptimo carga",03-03-2021 17:16,https://www.bing.com/th?id=OVFT.ZLohzYg0jQpshZizMZQfIS,Chile,duna
Subsecretaria de Salud Pública da inicio al proceso de ...,https://www.elperiodista.cl/2021/03/subsecretaria-de-salud-publica-da-inicio-al-proceso-de-vacunacion-de-segundas-dosis-en-el-pais/,"Esta mañana la subsecretaria de Salud Pública, Paula Daza, junto a la alcaldesa Evelyn Matthei, iniciaron al proceso de vacunación de las segunda dosis contra el COVID-19. Ambas llegaron al Cesfam Ale",03-03-2021 17:27,https://www.bing.com/th?id=OVFT.CZlDRsVX1ix7q1fn5Q7PQC,Chile,El Periodista
Las bolsas del mundo hoy - Diario Financiero,https://www.df.cl/noticias/mercados/bolsa-monedas/wall-street-se-inquieta-por-rendimientos-de-los-bonos-del-tesoro-y-el/2021-03-03/081353.html,Los principales mercados de Asia terminaron con avances mientras que en Europa los principales indicadores presentan ganancias.,03-03-2021 17:35,https://www.bing.com/th?id=OVFT.wWN4-Xz1rCAzq4PrJsuxqy,Chile,df.cl
