name,url,description,datePublished,imagen,pais,Fuente
Lavín sigue jugando la carta del outsider: “No es el ...,https://www.elmostrador.cl/noticias/pais/2020/05/04/lavin-sigue-jugando-la-carta-del-outsider-no-es-el-minuto-de-abrir-el-comercio-y-mucho-menos-todavia-de-la-vuelta-a-clases/,Los dichos del alcalde UDI de Las Condes se suman al explosivo aumento de casos de Covid-19 registrados en los últimos días y representan otro flanco que pone en entredicho la apuesta del Gobierno hac,04-05-2020 00:00,https://www.bing.com/th?id=ON.24EAE0E5660AB8F494B7A611D25415E0,Chile,El Mostrador
Avispón asesino: el nuevo y peligroso insecto mortal que ...,https://www.fayerwayer.com/2020/05/avispon-asesino-insecto-america/,"El mundo está en un momento de máxima tensión por la peligrosa pandemia global del Coronavirus Covid-19. Las tasas de mortalidad de la enfermedad son alarmantes, particularmente en Estados Unidos. Per",05-05-2020 20:12,https://www.bing.com/th?id=ON.C7DC417CB218D9C2CCBAECE8FAFFE3CF,Chile,FayerWayer
U. de Chile y U. Católica proponen al Mineduc currículum ...,https://www.t13.cl/noticia/nacional/dos-universidades-proponen-al-mineduc-curriculum-de-emergencia-por-dos-anos,"Hace casi dos meses que 3,6 millones de estudiantes han dejado de asistir a los establecimientos educacionales en todo el país, como una medida del Ministerio de Educación para mitigar los contagios d",05-05-2020 20:18,https://www.bing.com/th?id=ON.EF62992D07C00E543E22321BD553475B,Chile,T13
"Ministro de Agricultura, Antonio Walker: “La agricultura ...",https://www.elrancaguino.cl/2020/05/05/85312/,"El ministro de Agricultura, Antonio Walker, visitó este jueves la ciudad de Rancagua para lanzar en la Vega Baquedano, el programa especial Kit de Sanitización para Ferias Libres correspondiente a Ser",05-05-2020 20:22,https://www.bing.com/th?id=ON.B1A4EBC5B932626CD7DA40EF1D8C3775,Chile,elrancaguino.cl
Proponen al Mineduc un currículum de emergencia y ...,https://www.radioagricultura.cl/nacional/2020/05/05/proponen-al-mineduc-un-curriculum-de-emergencia-y-suspension-del-simce.html,"El Ministerio de Educación (Mineduc) decidió suspender las clases presenciales en todo el sistema educacional hace ya casi dos meses, con el objetivo de mitigar los contagios de la pandemia mundial qu",05-05-2020 20:30,https://www.bing.com/th?id=ON.4F65C30A3C00E089836A0E312C76CFE1,Chile,Radio Agricultura
"JP Morgan prevé caída de 2,3% del PIB de Chile en 2020 y ...",https://www.df.cl/noticias/economia-y-politica/macro/jpmorgan-preve-caida-de-2-3-del-pib-de-chile-en-2020-y-recuperacion-de/2020-05-05/121311.html,"Levemente más pesimista que Hacienda y en línea con el Banco Central se ubica la proyección de crecimiento para Chile durante este año de JPMorgan, que estima que el Producto Interno Bruto (PIB) del p",05-05-2020 20:30,https://www.bing.com/th?id=ON.C80E2761B65C6EC666FE28389519C56D,Chile,df.cl
Bomberos sufrirá vergonzosa baja de presupuesto por culpa ...,https://www.elperiscopio.cl/destacado-1/bomberos-sufrira-vergonzosa-baja-de-presupuesto-por-culpa-del-covid-19/,Desde la institución reaccionaron con mucha molestia por la medida tomada por el Ministerio de Hacienda. La expansión del Covid-19 en nuestro país ha obligado a las autoridades a tomar una serie de me,05-05-2020 20:29,https://www.bing.com/th?id=ON.EBEB575244E701C2F5C4EF0863B93C3C,Chile,elperiscopio.cl
"Siches por aumento de casos de COVID-19: ""Es fruto del ...",https://www.t13.cl/noticia/nacional/Izkia-Siches-aumento-casos-coronavirus-paso-en-falso-comunicacional-gobierno-05-05-2020,"La presidenta del Colegio Médico, Izkia Siches indicó que el aumento de casos de COVID-19 en Chile se debe al ""paso en falso comunicacional y el mensaje que se ha dado por parte del gobierno de hacer",05-05-2020 20:30,https://www.bing.com/th?id=ON.D4476872FFD694487A0E618B6D42694F,Chile,T13
Michelle Bachelet participará de conversatorio respecto de ...,https://www.adnradio.cl/nacional/2020/05/05/michelle-bachelet-participara-de-conversatorio-respecto-de-la-respuesta-de-los-estados-frente-al-covid-19.html,"Este miércoles, Michelle Bachelet, Alta Comisionada de las Naciones Unidas, participará de una reunión virtual organizada por el Programa de Salud Global, parte de la Escuela de Salud Pública de la Un",05-05-2020 20:50,https://www.bing.com/th?id=ON.9499785E1B2C6CED63CB235382CB513E,Chile,ADN
"""Chascas"" Valenzuela y teleseries post Covid-19: ""No se ...",https://www.biobiochile.cl/noticias/artes-y-cultura/actualidad-cultural/2020/05/05/chascas-valenzuela-y-teleseries-post-covid-19-no-se-podran-escribir-escenas-donde-haya-contactos.shtml,"Más de 50 días de cuarentena lleva Ignacio “Chascas” Valenzuela, célebre guionista chileno de teleseries hoy radicado en Miami en plena pandemia del Covid-19, virus que ha tenido a Estados Unidos como",05-05-2020 20:58,https://www.bing.com/th?id=ON.981E3F7502DD830CB4E98E12863336D1,Chile,Chile
Alta Comisionada de los DD.HH. Michelle Bachelet ...,https://www.uchile.cl/noticias/163077/michelle-bachelet-analizara-en-la-u-de-chile-respuesta-a-la-pandemia,"La autoridad internacional, ex Presidenta de Chile y egresada de la Casa de Bello será parte del conversatorio virtual ""Respuestas de los Estados a la pandemia COVID-19 ¿qué hace la diferencia y cómo",05-05-2020 21:17,https://www.bing.com/th?id=ON.939BE38A402571C2A313CCB17090FBBA,Chile,uchile.cl
Conversatorio sobre DD.HH. y la pandemia de COVID-19 con ...,https://www.uchile.cl/agenda/162837/conversatorio-sobre-ddhh-y-pandemia-con-michelle-bachelet,"Respuestas de los Estados a la Pandemia COVID19, ¿qué hace la diferencia y cómo se protegen los derechos humanos? Invitada: Alta Comisionada de Naciones Unidas para los Derechos Humanos, Sra. Michelle",05-05-2020 21:17,https://www.bing.com/th?id=ON.79D2E484695BB629350381627893252E,Chile,uchile.cl
"Más casos, más decesos y 14 comunas en cuarentena: Las ...",https://www.emol.com/noticias/Nacional/2020/05/05/985169/Region-Metropolitana-cifras-coronavirus.html,La Región Metropolitana es la zona que más preocupa a las autoridades respecto a los contagios de covid-19: una razón es por el alza de nuevos casos que se han registrado en los últimos días y la segu,05-05-2020 21:23,https://www.bing.com/th?id=ON.FCC3284C94DC38A942A610024552FF61,Chile,Emol
"Venta de autos nuevos se desploma en Chile y cae 72,8% en ...",https://www.latercera.com/mtonline/noticia/venta-de-autos-nuevos-se-desploma-en-chile-y-cae-728-en-abril/LYMAFMWVNNBTZHHQY3IWQGQXQU/,"Era esperable por todo lo que sucede con el Covid-19, pero no por eso deja de sorprender. La venta de autos nuevos en Chile continúa en caída libre, lo que se reflejó en la comercialización de 8.906 u",05-05-2020 21:31,https://www.bing.com/th?id=ON.DEBDDB116960AD8F91FAE6CC46F052E9,Chile,LA TERCERA
Ignacio Gutiérrez sobre el Festival de Viña... | Puranoticia,https://www.puranoticia.cl/noticias/espectaculos/ignacio-gutierrez-sobre-el-festival-de-vina-2021-quizas-podrian/2020-05-05/173209.html,"El animador de «Buenos días a todos», tiene dudas de que la edición 2021 del evento estival se vaya a llevar a cabo debido a la pandemia del Covid-19. Casi todos los años, a mitad del mismo se comienz",05-05-2020 21:32,https://www.bing.com/th?id=ON.50A61DB6C5CCFC460C952B9DD1CB156C,Chile,Puranoticia.cl
Organizaciones sociales rechazan intención del Gobierno de ...,https://www.elciudadano.com/especiales/covid19-coronavirus/organizaciones-sociales-rechazan-intencion-del-gobierno-de-aprobar-ley-de-migraciones-en-medio-de-covid-19/05/05/,"A través de una declaración pública, la Red Nacional de Organizaciones Migrantes y Promigrantes rechazó la decisión del gobierno de Sebastián Piñera de poner discusión inmediata al proyecto de Ley de",05-05-2020 21:44,https://www.bing.com/th?id=ON.491D112EA956CEE8AA3530E11F1B9C99,Chile,El Ciudadano
Cinco personas fallecieron las últimas 24 horas ...,https://www.puranoticia.cl/noticias/nacional/cinco-personas-fallecieron-las-ultimas-24-horas-a-causa-de-la-pandemia/2020-05-05/110256.html,"Cinco personas fallecieron las últimas 24 horas a causa del coronavirus Covid-19 en Chile. De esta manera, la cifra total de víctimas fatales asciende a 275 personas. Así lo dio a conocer la subsecret",05-05-2020 21:43,https://www.bing.com/th?id=ON.152DE6BEC2850D489FA93812AB5F7098,Chile,Puranoticia.cl
"“Profunda molestia” en Bomberos por rebaja de 7,8% en su ...",http://lanacion.cl/2020/05/05/profunda-molestia-en-bomberos-por-rebaja-de-78-en-su-presupuesto-debido-al-covid-19/,"“Hoy nos rebajan más de lo que significó el reajuste 2019 y 2020, lo que resulta inaceptable para realizar la función de la que es la institución más valorada de nuestro país”, expresó Bomberos de Chi",05-05-2020 22:00,https://www.bing.com/th?id=ON.169924588B079FB6EE91C50DA1E206CB,Chile,La Nación
La llama podría ser el animal encargado de detener el ...,https://www.publimetro.cl/cl/noticias/2020/05/05/llama-contagio-anticuerpos-coronavirus.html,Científicos estadounidenses y belgas dieron a conocer una relevante información sobre los avances de un tratamiento que podría detener la infección del coronavirus y donde la llama jugaría un importan,05-05-2020 22:03,https://www.bing.com/th?id=ON.E85F2A83BA1E59875E25389F2FE50F2B,Chile,publimetro.cl
11.926 PYMES MAGALLÁNICAS PODRÍAN ACCEDER A CRÉDITOS ...,http://www.radiopolar.com/noticia_157220.html,"Este martes 5 de mayo, el Intendente de Magallanes y de la Antártica Chilena, José Fernández Dübrock, acompañado por las Seremis de Hacienda, Lil Garcés, y de Economía, Fomento y Turismo, Natalia East",05-05-2020 22:05,https://www.bing.com/th?id=ON.35A46AB7D937D5E09FD3476A69679B56,Chile,Radio Polar
Banco de Chile y BancoEstado lideran reprogramaciones de ...,https://www.df.cl/noticias/mercados/banca-fintech/banco-de-chile-y-bancoestado-lideran-reprogramaciones-de-creditos-por/2020-05-04/185410.html,"Una de las medidas que tomó la banca con sus clientes en medio de la crisis sanitaria y económica por la propagación del Covid-19 fue reprogramar créditos en las líneas de negocio de consumo, hipoteca",05-05-2020 22:10,https://www.bing.com/th?id=ON.EB60A5D9026B07CF2D50E0B0BFF00A91,Chile,df.cl
80 días atrapado por el COVID-19 en Costa Rica | El ...,http://www.elmartutino.cl/noticia/sociedad/80-dias-atrapado-por-el-covid-19-en-costa-rica,"Levantarse muy temprano, hacer las compras de la casa, trabajar, leer y ver series. Parece una rutina clásica para cualquier persona: incluso en tiempos de pandemia. Salvo si estás a más de 5 mil kiló",05-05-2020 22:17,https://www.bing.com/th?id=ON.BF613EDC4FBEC488751BE2FCD330157A,Chile,Mar
Académicos de la UC y U. de Chile proponen al Mineduc ...,http://lanacion.cl/2020/05/05/academicos-de-la-uc-y-u-de-chile-proponen-al-mineduc-curriculum-de-emergencia-por-2-anos-y-suspension-del-simce/,El documento contiene una serie recomendaciones para enfrentar la crisis sanitaria en el sistema educacional y releva el bienestar emocional de las comunidades educativas y fue entregado el 24 de abri,05-05-2020 22:26,https://www.bing.com/th?id=ON.716A8BBB93251298AED7FBD50743EF43,Chile,La Nación
Dos ministros bolivianos en cuarentena por casos positivos ...,https://www.cooperativa.cl/noticias/sociedad/salud/coronavirus/dos-ministros-bolivianos-en-cuarentena-por-casos-positivos-de-covid-19/2020-05-05/180655.html,"Luis Fernando López y María Elva Pinckert se han caracterizado por su trabajo en terreno. Ambos esperan los resultados para saber si han contraído el virus. El ministro interino de Defensa de Bolivia,",05-05-2020 22:29,https://www.bing.com/th?id=ON.CAEF05AE12CF7A0AC8A541C6753616FC,Chile,Radio Cooperativa
Gobierno autorizó delivery de comidas y medicamentos hasta ...,https://www.adnradio.cl/nacional/2020/05/05/gobierno-autorizo-delivery-de-comidas-y-medicamentos-hasta-la-medianoche.html,"Desde este martes, el despacho a domicilio de comida y medicamentos estará autorizado hasta la medianoche, según informó el ministro de Economía, Lucas Palacios, a través de Twitter. Este tipo de serv",05-05-2020 22:50,https://www.bing.com/th?id=ON.27857BD0E5CA5F9580E074438AE5D585,Chile,ADN
Las dos caras del Covid-19: muertes en el mundo superan ...,https://www.elmostrador.cl/noticias/mundo/2020/05/05/las-dos-caras-del-covid-19-muertes-en-el-mundo-superan-las-250-000-mientras-los-paises-regresan-a-sus-nuevas-normalidades/,"El coronavirus ya ha matado a casi 255.000 personas y continúa su avance en particular en Estados Unidos, Reino Unido, Brasil y Rusia. Sin embargo, estos países y otros, como Chile, han comenzado a re",05-05-2020 22:55,https://www.bing.com/th?id=ON.FCD8F88C31D2EF7B2E373514B978B560,Chile,El Mostrador
Los datos personales sí importan - La Tercera,https://www.latercera.com/opinion/noticia/los-datos-personales-si-importan/VWXOSHR7VNF2ND7X7TGMV4XQDU/,Todos hemos leído y escuchado en estos días la preocupación en torno a los datos personales y el control del Covid-19. Reconozco que se trata de aquellos temas jurídicos relevantes que asoman cada cie,05-05-2020 22:59,https://www.bing.com/th?id=ON.9CA1C48988C3C8F7101324B99A15ECB6,Chile,LA TERCERA
Chile alcanza demanda récord en colocación de bonos por US ...,https://www.radioagricultura.cl/economia/2020/05/05/chile-alcanza-demanda-record-en-colocacion-de-bonos-por-us2-000-millones.html,El Ministerio de Hacienda informó que este martes emitió bonos de Tesorería en euros y dólares en mercados internacionales por un total equivalente a US$2.000 millones. Las operaciones contemplaron la,05-05-2020 23:10,https://www.bing.com/th?id=ON.BE8D07D33E8B03628B888E4128784865,Chile,Radio Agricultura
"Venta de autos a nivel nacional tuvo una caída de 72,8% en ...",https://www.biobiochile.cl/noticias/economia/negocios-y-empresas/2020/05/05/venta-de-autos-a-nivel-nacional-tuvo-una-caida-de-728-en-abril.shtml,"El mercado automotriz es uno de los negocios que se han visto bien afectados por la pandemia provocada por el coronavirus. Si bien las ventas ya venían malas desde marzo, fecha en la cual se registró",05-05-2020 23:12,https://www.bing.com/th?id=ON.9B269D9FDC152B2CCC33C014A89390F5,Chile,Chile
Chile emite deuda por US$2.000 millones para financiar ...,https://www.emol.com/noticias/Economia/2020/05/05/985212/Chile-emite-deuda.html,"SANTIAGO.- El Ministerio de Hacienda informó que hoy, martes 5 de mayo, emitió bonos de Tesorería en euros y dólares en mercados internacionales por un total equivalente a US$2.000 millones. Así, las",05-05-2020 23:15,https://www.bing.com/th?id=ON.A4BF75E65D00B8F29D8B5BF26BA7FBC8,Chile,Emol
Autocine Chile ya cuenta con cartelera para su primer ...,https://www.elciudadano.com/artes/autocine-chile-ya-cuenta-con-cartelera-para-su-primer-ciclo-de-peliculas/05/05/,"Con el clásico musical de finales de los setenta, “Grease”, protagonizado por John Travolta y  Olivia Newton- John, se dará inicio el próximo 13 de mayo a las 19.30 horas, en el Club de Campo Las Vizc",05-05-2020 23:19,https://www.bing.com/th?id=ON.6C48A0837449B1570411241E705DF68A,Chile,El Ciudadano
Ministro de Agricultura destaca aplicación de medidas de ...,https://www.elrancaguino.cl/2020/05/05/ministro-de-agricultura-destaca-aplicacion-de-medidas-de-proteccion-frente-al-covid-19-en-agrosuper/,La autoridad verificó en terreno la implementación de medidas y protocolos que tienen como fin proteger la salud de los colaboradores de la compañía. Con el objetivo de observar las medidas preventiva,05-05-2020 23:25,https://www.bing.com/th?id=ON.6A81526E0CDF41DFF0561BC4A9C4FFCD,Chile,elrancaguino.cl
"La dura frase del embajador chino en Chile: ""Mentir no ...",https://www.publimetro.cl/cl/noticias/2020/05/05/xu-bu-columna-embajador-estados-unidos.html,"La eventual responsabilidad que podría tener China en el origen del coronavirus tras los dichos del Secretario de Estado de Estados Unidos, Mike Pompeo, no dejaron indiferente al embajador chino en Ch",05-05-2020 23:25,https://www.bing.com/th?id=ON.64DB7893ACB0A2562A76D87EBAE9117C,Chile,publimetro.cl
