name,url,description,datePublished,imagen,pais,Fuente
Ministro Desbordes encabezó esta tarde el Juramento a la ...,https://www.lacuarta.com/cronica/noticia/desbordes-encabezo-juramento-la-bandera/561794/,"En un acto realizado en la Escuela de Telecomunicaciones del Ejército, en Peñalolén, el ministro de Defensa Nacional, Mario Desbordes, encabezó la tradicional ceremonia de Juramento a la Bandera, que en las unidades militares de todo el país efectuaron un total de 4.291 hombres y 907 mujeres que iniciaron su Servicio Militar.",30-10-2020 23:12,https://www.bing.com/th?id=OVFT.M2HyYQDRRXXuKssQUxDblC,Chile,La Cuarta
Vuelve el fútbol femenino y esto es lo que tienes que ...,https://www.chvnoticias.cl/deportes/calendario-primera-fecha-campeonato-nacional-femenino_20201030/,"El balón comenzará a rodar en el Germán Becker con el duelo entre Temuco y Palestino a las 11 horas del sábado. Las actuales campeonas del fútbol chileno, Santiago Morning, se medirán ante Deportes Iq",30-10-2020 23:22,https://www.bing.com/th?id=OVFT.ScymtSbJ-2h32E6b8ugIOS,Chile,chvnoticias
Después de la bofetada al poder y al neoliberalismo ...,http://piensachile.com/2020/10/despues-de-la-bofetada-al-poder-y-al-neoliberalismo-chilenos-ahora-que/,"interrumpido por la pandemia de Covid-19, obligó al Parlamento a aprobar una ley para que la Asamblea Constitucional -que se elegirá el 11 de abril próximo- sea absolutamente paritaria en su composición entre hombres y mujeres, que no solo reconoce a las mujeres el derecho a participar en igualdad de condiciones, sino también a escribir ...",30-10-2020 23:33,https://www.bing.com/th?id=OVFT.b1wCVxm26BKH7XI23QMByi,Chile,piensaChile.com
Francisco Reyes no descarta postularse como constituyente,https://www.chvnoticias.cl/show/francisco-reyes-no-descarta-constituyente_20201030/,"""No lo descarto, pero lo que estamos buscando muchos independientes es entrar a ese espacio como independientes"", manifestó el actor nacional en entrevista con CNN Chile, a propósito de la tercera ver",31-10-2020 00:13,https://www.bing.com/th?id=OVFT.GQOn7H1m75lKjf6YknNrji,Chile,chvnoticias
Candidatos en EE.UU. se juegan últimas cartas mientras ...,https://www.cnnchile.com/mundo/elecciones-eeuu-covid-19-casos-aumento_20201030/,"Kamala Harris, la primera candidata a vicepresidenta afroamericana en la historia de EE.UU. estuvo en Texas, mientras que el actual vicepresidente, Mike Pence, visitó Arizona. En las últimas 24 horas",31-10-2020 01:13,https://www.bing.com/th?id=OVFT.YL9euyRkKezzXFg6YkiNEC,Chile,CNN Chile
El grupo que combate el Covid-19 en el aire - La Tercera,https://www.latercera.com/nacional/noticia/el-grupo-que-combate-el-covid-19-en-el-aire/EJOU5VHOAJGIHOCR56Y5VUNSEY/,"En la búsqueda de una cama UCI, un equipo formado por el Samu Metropolitano ha coordinado los traslados de 406 pacientes contagiados con Covid-19 por todo el país.",31-10-2020 01:18,https://www.bing.com/th?id=OVFT.6Tach6T74prEfDPsUKa0gC,Chile,LA TERCERA
"INE: El bicho dejó a 1,1 millones de chilenos sin pega",https://www.lacuarta.com/cronica/noticia/ine-bicho-dejo-11-millones-chilenos-sin-pega/561829/,"Como se viene repitiendo hace varios meses, esta no sólo es una pandemia sanitaria debido al Covid-19, sino que además es una crisis económica que",31-10-2020 03:08,https://www.bing.com/th?id=OVFT.OreZLtCe71_A3SZzHSUAOC,Chile,La Cuarta
Salud redujo total de camas críticas en la Región: 15 UCI ...,https://www.diarioconcepcion.cl/ciudad/2020/10/31/salud-redujo-total-de-camas-criticas-en-la-region-15-uci-menos.html,"Hospital Regional esperará efecto de las elecciones para reconvertir UCI Covid-19 a otras patologías. Minsal informó 204 nuevos infectados y 1.313 activos. Para enfrentar la pandemia en la Región, se aumentó de 90 a 208 las camas UCI y de 120 a 149 las del tipo UTI, las que a pesar de la amplia",31-10-2020 04:04,https://www.bing.com/th?id=OVFT.tQzw5SsM35NfAK7WdzMisC,Chile,El Diario de Concepcion
COVID – 19: ampliemos el alcance de los comités paritarios ...,https://www.elmostrador.cl/destacado/2020/10/31/covid-19-ampliemos-el-alcance-de-los-comites-paritarios/,"La ley vigente está siendo modificada en el Congreso a través de una moción de varios senadores, quienes plantean hacer obligatorio un “Protocolo de Seguridad Sanitaria Laboral COVID-19 en complemento a los reglamentos internos” y para ello, proponen incluir testeo de temperatura, del contagio, medidas de distanciamiento en los puestos ...",31-10-2020 04:04,https://www.bing.com/th?id=OVFT.1w9V0OmkJgsohqASnYaAIC,Chile,El Mostrador
Más de 45.000 personas han sido hospitalizadas en casi ...,https://www.chanarcillo.cl/mas-de-45-000-personas-han-sido-hospitalizadas-en-casi-ocho-meses/,"Desde el 4 de marzo a la fecha más de 42.000 pacientes han sido dados de alta desde unidades básicas, intermedias y de Cuidados Intensivos en el país; estos, sumados los 2.700 que hasta ayer eran atendidos en centros públicos y privados, llegan a 45.097 las personas que han sido hospitalizadas",31-10-2020 05:03,https://www.bing.com/th?id=OVFT.03prwIlY6xAaUBN3ytkuCi,Chile,Diario Chanarcillo
Gobierno está elaborando un protocolo para partidos de ...,https://www.chanarcillo.cl/gobierno-esta-elaborando-un-protocolo-para-partidos-de-futbol-con-publico/,*Arturo Zúñiga explicó que están trabajando junto al Ministerio del Deporte. Tomará como referencia los duelos a puertas cerradas en,31-10-2020 05:03,https://www.bing.com/th?id=OVFT.mpTZd6_0HqKwy__a7ywJVy,Chile,Diario Chanarcillo
Cementerios cerrados durante el fin de semana para evitar ...,http://www.diariolaregion.cl/cementerios-cerrados-durante-el-fin-de-semana-para-evitar-nuevos-contagios/,"Aun cuando todas las comunas de la región están próximas a avanzar a Fase 4 y los contagios de Coronavirus han ido a la baja, la medida de aplicar restricciones en los cementerios durante el fin de",31-10-2020 08:22,https://www.bing.com/th?id=OVFT.yuWCODtuhuo2ptgGvz90Hi,Chile,La Region
Alerta del Instituto de Salud Pública por producto ...,https://www.publimetro.cl/cl/noticias/2020/10/31/salud-sanitizacion-covid-producto-falso.html,El Instituto de Salud Pública de Chile emitió una alerta por una cápsula sanitizante de ozono con resolución falsificada del ISP y que estaría siendo utilizada con fines de desinfección contra el covid-19.,31-10-2020 12:00,https://www.bing.com/th?id=OVFT.xUKLaKFllUgXfYtEd6XCYy,Chile,publimetro.cl
Pandemia del Covid-19 alcanzó su récord de contagios con ...,https://www.radioagricultura.cl/internacional/2020/10/31/pandemia-del-covid-19-alcanzo-su-record-de-contagios-con-mas-de-565-mil-casos-en-24-horas.html,"La pandemia de coronavirus registró en las últimas 24 horas su récord diario de casos en toda su serie histórica, con 565.797 contagios en las últimas 24 horas y eleva el total a más de 45,6 millones de personas contagiadas y 1,18 millones de víctimas mortales, según el balance actualizado a",31-10-2020 12:55,https://www.bing.com/th?id=OVFT.KUKe3tvDp50dJVvyPJ1jgS,Chile,Radio Agricultura
Gobierno celebra creación de 750 nuevas empresas en la ...,https://laprensaaustral.cl/2020/10/31/gobierno-celebra-creacion-de-750-nuevas-empresas-en-la-region-aunque-no-da-cuenta-de-precarizacion-de-la-economia/,"– Sólo en septiembre nacieron 150 nuevos emprendimientos en Magallanes, destacó la seremi de Economía. De acuerdo a lo informado, la cifra significa un aumento de un 14,5% con respecto a lo registrado",31-10-2020 13:12,https://www.bing.com/th?id=OVFT.-e6e6fdbkHOE3-a6gkat6y,Chile,La Prensa Austral
"Minsal informó 1.686 nuevos casos, llegando a 510.256 ...",https://www.adnradio.cl/nacional/2020/10/31/minsal-informo-1-686-nuevos-casos-llegando-a-510-256-casos-totales-de-contagiados-con-covid-19-en-chile.html,"Durante la mañana de este sábado, el ministro de Salud, Enrique Paris encabezó la entrega de un nuevo balance respecto del estado de la pandemia del coronavirus Covid-19 en Chile, informando que hubo 1.686 nuevos casos, llegando a un total de 510.256 contagiados desde el inicio de la pandemia",31-10-2020 13:40,https://www.bing.com/th?id=OVFT.pAqAsf09p8Af31YvoeeaOi,Chile,ADN
Minsal reporta 49 decesos y 1.686 nuevos casos: Hubo más ...,https://www.emol.com/noticias/Nacional/2020/10/31/1002402/Minsal-decesos-contagios-positividad.html,"Con esto, la cifra de víctimas fatales ascendió a 14.207, mientras que la de los contagios a 510.256. Este sábado el Ministerio de Salud entregó una actualización de las cifras del coronavirus en Chile. Esta vez, y tal como es los lunes y jueves, el balance fue televisado. Así, se reportaron",31-10-2020 13:46,https://www.bing.com/th?id=OVFT.AAqzbwEeyEZyiMUEMCmViS,Chile,Emol
Nuevo balance Minsal coronavirus en Chile 31 de octubre ...,https://www.t13.cl/noticia/nacional/balance-coronavirus-chile-covid-19-minsal-muertes-contagios-31-10-2020,"Este sábado, el Ministerio de Salud (Minsal) entregó un nuevo balance sobre el avance de la pandemia del COVID-19 en Chile. En esa línea, se reportaron 1.686 nuevos casos y 49 muertes por COVID-19 en",31-10-2020 13:47,https://www.bing.com/th?id=OVFT.jw_GekOqWUudw3DVI3Iljy,Chile,T13
SanCarlosOnline: Entregan implementación para jóvenes ...,https://www.sancarlosonline.cl/2020/10/entregan-implementacion-para-jovenes.html,"Además de la implementación deportiva, la entrega también incluyó kits de prevención Covid-19 para aquellos atletas autorizados para entrenar en lugares públicos. Éste se compone de escudo facial, termómetro, mascarillas, pulverizados, pilas y gel para manos, entre otros artículos.",31-10-2020 13:58,https://www.bing.com/th?id=OVFT.OazILq0NHb2uu2nQO-D_zC,Chile,San Carlos Online
Minsal confirma 1.686 casos nuevos de coronavirus: 49 ...,https://www.duna.cl/noticias/2020/10/31/minsal-confirma-1-686-casos-nuevos-de-coronavirus-49-personas-han-fallecido-por-covid-19/,"El subsecretario de Redes Asistenciales, Arturo Zúñiga, informó de 1.686 casos nuevos, de estos: 1.077 casos con síntomas, 579 casos asintomáticos y 30 no notificados. En total hay 510.256 contagiados, 9.121 activos y 486.642 recuperados. Asimismo, confirmó 49 fallecidos inscritos",31-10-2020 13:58,https://www.bing.com/th?id=OVFT.zEGyaiv9hYWuF_hlSIVZrC,Chile,duna
Covid-19: Minsal confirmó 49 nuevos fallecidos y cifra ...,https://www.adnradio.cl/nacional/2020/10/31/covid-19-minsal-confirmo-49-nuevos-fallecidos-y-cifra-llego-a-los-14-207-muertos-por-el-virus-en-el-pais.html,"Este sábado, el Ministerio de Salud (Minsal) entregó un nuevo reporte de cómo avanza la pandemia del Covid-19 en el país, informando que hubo 49 nuevos fallecidos producto de la enfermedad, informados",31-10-2020 13:58,https://www.bing.com/th?id=OVFT.WvTlhCpJKR0dlpmlOhMpFi,Chile,ADN
Minsal confirmó 1.686 contagios de Covid-19 y 49 ...,http://www.ladiscusion.cl/minsal-confirmo-1-686-contagios-de-covid-19-y-49-fallecidos-en-chile/,"Hoy sábado las autoridades de salud entregaron un nuevo reporte del estado de la pandemia en Chile, informando que en la última jornada se han presentado 1.686 casos nuevos de coronavirus, lo que",31-10-2020 14:00,https://www.bing.com/th?id=OVFT.wCv8kQUjNBggao7Uq7ejDi,Chile,La Discusión
Minsal reporta 1.686 nuevos contagios y 49 fallecidos por ...,https://www.elmostrador.cl/dia/2020/10/31/minsal-reporta-1-686-nuevos-contagios-y-49-fallecidos-por-covid-19-en-la-ultima-jornada/,"El Ministerio de Salud informó este sábado que, en las últimas 24 horas, se registraron 1.686 casos nuevos de coronavirus Covid-19 en Chile, llegando a un total de 510.256 contagios desde que inició la pandemia en marzo de este año. De acuerdo a las cifras del reporte diario, encabezado por el",31-10-2020 14:37,https://www.bing.com/th?id=OVFT.visvlYOUS7RqFZtF8lRWKy,Chile,El Mostrador
Reporte Minsal del sábado 31 de octubre denota leve alza ...,https://www.eldesconcierto.cl/2020/10/31/reporte-minsal-del-sabado-31-de-octubre-denota-leve-alza-de-contagios-de-covid-19-en-chile/,"Este sábado 31 de octubre, el Ministerio de Salud entregó un nuevo reporte de la situación del COVID-19 en Chile, donde aparte de reflejar una pequeña alza de contagios",31-10-2020 14:51,https://www.bing.com/th?id=OVFT.zUGY3RPqKcvnKSK5UpuiJC,Chile,eldesconcierto
"Paris y vacuna en Chile: ""Se están reclutando personas en ...",https://www.meganoticias.cl/nacional/317789-ministro-paris-coronavirus-vacuna-colina-san-bernardo-maule-correos-clases-crx12.html,"Conoce qué dijo el Ministro de Salud, Enrique Paris, sobre el estudio clínico en fase 3 de la vacuna contra el coronavirus, los correos que deben enviar a la justicia y una posible vuelta a clases de",31-10-2020 15:00,https://www.bing.com/th?id=OVFT.DmPpvciuGzGRVHZLT5YoiC,Chile,meganoticias
Fútbol chileno hasta fines de enero: ANFP da a conocer el ...,https://www.eldesconcierto.cl/2020/10/31/futbol-chileno-hasta-fines-de-enero-anfp-da-a-conocer-el-fixture-completo-de-la-segunda-rueda/,"Este fin de semana se terminará de jugar la primera rueda del Campeonato Nacional 2020, y a falta de algunos duelos pendientes de jornadas anteriores, la ANFP publicó el fixture para la segunda rueda",31-10-2020 15:46,https://www.bing.com/th?id=OVFT.ttlMBNib3jq4h3IMRF0YpS,Chile,eldesconcierto
"Helen Kouyoumdjian, vicepresidenta ejecutiva de Fedetur ...",https://www.elrancaguino.cl/2020/10/31/helen-kouyoumdjian-vicepresidenta-ejecutiva-de-fedetur-podemos-asegurar-una-experiencia-sanitariamente-segura-para-los-turistas/,"El gremio de este sector económico pide a gritos su reapertura. “Necesitamos volver a trabajar porque de otra manera no podremos avanzar ni mucho menos llegar a fin de año”, comenta en exclusiva con #",31-10-2020 16:25,https://www.bing.com/th?id=OVFT.lQjSAhgzBKm8St4UcZ3fMS,Chile,elrancaguino.cl
Más de 1900 clientes de Edelaysen se han inscrito a la Ley ...,http://www.eldivisadero.cl/noticia-60162,"Fue en el contexto de la pandemia del Covid-19 que, hace casi tres meses, fue aprobada en el congreso la Ley de Servicios Básicos, la cual prohibe el corte del suministro y entrega facilidades de pago a todas aquellas personas que han tenido dificultades para pagar sus cuentas. Esta ley se puso en",31-10-2020 16:29,https://www.bing.com/th?id=OVFT.TakVz9Q-gpSwVdVIITBtUS,Chile,Diario el Divisadero
Contagio de Covid-19 en gatos sería solo desde personas,https://www.radioagricultura.cl/nacional/2020/10/31/contagio-de-covid-19-en-gatos-seria-solo-desde-personas.html,"Expertos informaron que los gatos contagiados de coronavirus no transmiten la enfermedad a personas, esto tras un revelador estudio realizado por la Universidad de Chile que indicó la susceptibilidad de los felinos de contraer Covid-19 al mantener contacto con sus dueños enfermos. Es necesario",31-10-2020 16:45,https://www.bing.com/th?id=OVFT._IrA7rpPD7PY6UEenhdHSS,Chile,Radio Agricultura
Colegio Médico Veterinario aclara: Contagios de COVID-19 ...,https://www.biobiochile.cl/noticias/ciencia-y-tecnologia/ciencia/2020/10/31/colegio-medico-veterinario-aclara-contagios-de-covid-19-en-gatos-serian-unicamente-desde-personas.shtml,"Esta semana se publicó en diversos medios la noticia sobre la detección de gatos contagiados con COVID-19 en Chile,",31-10-2020 16:49,https://www.bing.com/th?id=OVFT.9wFSYxt6IUaLweQJdek42C,Chile,Chile
Colegio Médico Veterinario: Gatos se contagiarían de Covid ...,https://www.24horas.cl/coronavirus/colegio-medico-veterinario-gatos-se-contagiarian-de-covid-19-solo-a-traves-de-sus-duenos-4512594,"Desde la entidad realizaron un llamado a la comunidad a informarse mediante fuentes confiables, de manera de no generar pánico en la población y estimular conductas inadecuadas como el abandono de ani",31-10-2020 16:59,https://www.bing.com/th?id=OVFT.cZ6ZTBLn1_ujcd4uPODZqS,Chile,24 Horas Chile
Informe Epidemiológico: Total de fallecidos asociados al ...,https://www.latercera.com/nacional/noticia/informe-epidemiologico-total-de-fallecidos-asociados-al-covid-19-asciende-a-19070-victimas-fatales/T3MAAMCHKVCSTDU4PIEZMITTA4/,"Esta cantidad se desglosa de este modo: 14.207 son muertes confirmadas por coronavirus, y las 4.863 restantes son casos sospechosos.",31-10-2020 17:49,https://www.bing.com/th?id=OVFT.W_glLzqyzWBdcJkY1hptYS,Chile,LA TERCERA
Volante de La Roja dio positivo por COVID-19: está en duda ...,https://www.biobiochile.cl/noticias/deportes/futbol/la-roja/2020/10/31/volante-de-la-roja-dio-positivo-por-covid-19-seria-duda-para-duelos-ante-peru-y-venezuela.shtml,"El volante chileno Claudio Baeza se perdió la noche del viernes el encuentro de Necaxa ante Toluca, por el Torneo Apertura mexicano que terminó con triunfo de los ‘Rayos’ por 3-2, al dar positivo en u",31-10-2020 18:19,https://www.bing.com/th?id=OVFT.RXyqbCDlJo1tt48uDs_RGi,Chile,Chile
Temuco y Puerto Montt lideran: Las 20 comunas con más ...,https://www.meganoticias.cl/nacional/317798-coronavirus-comunas-mas-casos-activos-temuco-puerto-montt-punta-arenas-dax13.html,Conoce cuáles son las 20 comunas con más casos activos de coronavirus en Chile. La información fue dada a conocer este sábado 31 de octubre mediante un nuevo Informe Epidemiológico del Minsal.,31-10-2020 19:00,https://www.bing.com/th?id=OVFT.y-v-iJ106sZbhlwuJSyLVi,Chile,meganoticias
