name,url,description,datePublished,imagen,pais,Fuente
El enigmático y amoroso mensaje de Isla respecto a su ...,https://www.elperiscopio.cl/deportes/mauricio-isla-espera-su-nuevo-equipo-con-gala-no-tengo-idea-mi-destino-pero-tengo-claro-que-sera-contigo/,"El jugador de la Roja no tiene claro su panorma como futbolista profesional. El destino del ""Huaso"" está lejos de Turquía, ya que hace unos días fue anunciado como jugador no considerado por el Fenerb",02-06-2020 08:33,https://www.bing.com/th?id=ON.F0AC98EDF09777A4EB098E31ABFA0031,Chile,elperiscopio.cl
266 hogares de Chillán recibieron las primeras cajas de ...,http://www.ladiscusion.cl/266-hogares-de-chillan-recibieron-las-primeras-cajas-de-alimentos/,"La mañana de este sábado partió la distribución de las 30 mil cajas de alimentos para las familias afectadas por la crisis generada por la pandemia de Covid-19 en la región de Ñuble. Ejército, Carabin",07-06-2020 01:50,https://www.bing.com/th?id=ON.FB01367FB6D513F528540FE40CCCBD8A,Chile,La Discusión
"""Se escapó de las manos, esa es la realidad"": el análisis ...",https://www.biobiochile.cl/noticias/nacional/region-metropolitana/2020/06/05/se-escapo-las-manos-esa-la-realidad-analisis-rosa-oyarce-covid-19-chile.shtml,"La exseremi de Salud de la región Metropolitana, Rosa Oyarce, se refirió a las acciones y trabajos que ha implementado el Gobierno para poder enfrentar la pandemia por coronavirus. En conversación con",07-06-2020 02:35,https://www.bing.com/th?id=ON.5ACA1E5B8D41281D942FCE603E80949B,Chile,Chile
Clínicas de Chile preocupadas por muertes no relacionadas ...,https://www.biobiochile.cl/noticias/nacional/chile/2020/06/05/clinicas-chile-preocupados-muertes-no-relacionadas-covid-19-consultas-bajado-75.shtml,"Desde la asociación gremial Clínicas de Chile mostraron su preocupación debido a la gran cantidad de muertos indirectos del Covid-19, declaraciones que coinciden con la preocupación que mostró el mini",07-06-2020 02:35,https://www.bing.com/th?id=ON.42D7B0C95DCF30F891D9502BA1231351,Chile,Chile
"""Es posible que se adelanten decisiones"": Mañalich anuncia ...",https://www.meganoticias.cl/nacional/304021-coronavirus-jaime-manalich-reunion-extraordinaria-presidente-pinera-domingo-7-junio-es-posible-que-se-adelanten-decisiones.html,"El Ministro de Salud, Jaime Mañalich, anunció una ""reunión extraordinaria"" para este domingo 7 de junio con el Presidente de la República, Sebastián Piñera, todo esto en el marco de la pandemia por co",07-06-2020 02:37,https://www.bing.com/th?id=ON.6329B854AF11A5996C7963F9FD9757F6,Chile,meganoticias
Jefe de Seguridad Presidencial dio positivo a coronavirus ...,https://www.meganoticias.cl/nacional/304027-jefe-seguridad-presidencial-positivo-coronavirus-descartan-contacto-presidente-sebastian-pinera.html,Durante la noche de este sábado Carabineros informó que el jefe del Departamento de Seguridad Presidencial dio positivo a coronavirus. Comunicado de prensa respecto a la cuarentena obligatoria que cum,07-06-2020 03:06,https://www.bing.com/th?id=ON.5D0B3D7DBC005C8F92B2A93F54D180A4,Chile,meganoticias
Compañía Chilena de Fósforos descarta posible brote de ...,http://www.diarioelheraldo.cl/noticia/compania-chilena-de-fosforos-descarta-posible-brote-de-covid-19-en-planta-de-retiro,"Empresa señala que desde el inicio de la pandemia ha implementado una serie de medidas preventivas, que van más allá de lo recomendado por las autoridades de salud, que incluyen cerca de 260 testeos a",07-06-2020 03:10,https://www.bing.com/th?id=ON.F791C93B09715AC94F7AAE9FC53C893B,Chile,El Heraldo
Advierten que la credibilidad de los datos es clave para ...,http://www.ladiscusion.cl/advierten-que-la-credibilidad-de-los-datos-es-clave-para-superar-la-pandemia/,"En las últimas semanas las cifras oficiales del Covid-19 en la región han estado en el centro del debate en las redes sociales, donde usuarios han cuestionado la estadística, cada vez que Ñuble aparec",07-06-2020 03:32,https://www.bing.com/th?id=ON.C8F1577EBDCD2D1951304E429F2DFEF3,Chile,La Discusión
La Región Metropolitana superó los 100 mil contagios de ...,http://www.diarioelheraldo.cl/noticia/la-region-metropolitana-supero-los-100-mil-contagios-de-covid-19,"Tras el balance diario de las autoridades respecto al Covid-19, realizado este sábado por la subsecretaria de Salud Pública, Paula Daza, se anunció que en las últimas 24 horas se registraron 4.128 nue",07-06-2020 04:08,https://www.bing.com/th?id=ON.D091ABBA1163F9818DF795AAFA272A0C,Chile,El Heraldo
Primeros pacientes con coronavirus son trasladados desde ...,http://www.elvacanudo.cl/noticia/salud/primeros-pacientes-con-coronavirus-son-trasladados-desde-santiago-hasta-osorno,"Cuatro pacientes con Covid-19 serán trasladados durante la tarde-noche de este viernes 5 de junio, desde Santiago a través de un avión Hércules de la Fuerza Aérea de Chile (FACH). Según informó Radio",07-06-2020 04:19,https://www.bing.com/th?id=ON.5ECD7C7216E1E058D8B26BBFA38E05D6,Chile,El Vacanudo
"Carlos Saavedra, rector UdeC: “Lo que observamos es ...",https://www.diarioconcepcion.cl/edicion-especial/2020/06/07/carlos-saavedra-rector-udec-lo-que-observamos-es-consecuencia-de-nuestra-historia-en-la-universidad-hay-un-esfuerzo-por-ser-un-aporte.html,"La pandemia provocada por el coronavirus está acelerando grandes cambios en la manera en que trabajamos y vivimos. Como todo evento disruptivo, ha obligado a las instituciones a generar respuestas ráp",07-06-2020 05:05,https://www.bing.com/th?id=ON.832FBAAA64C2568B2F8CEA3CEC43247E,Chile,El Diario de Concepcion
Chile registra nuevo peak diario de fallecidos por coronavirus,https://www.lacuarta.com/cronica/noticia/reporte-covid-peak-diario-fallecidos/506681/,"Además, durante las últimas 24 horas se registraron 5.246 nuevos contagiados. Este sábado 6 de junio se realizó un nuevo reporte diario sobre la situación del coronavirus en Chile. Y en esta ocasión,",07-06-2020 06:13,https://www.bing.com/th?id=ON.4D7FD65466E479EEF788CC9FE16A336A,Chile,La Cuarta
Francia y el coronavirus: A fortalecer el multilateralismo ...,https://www.elmostrador.cl/destacado/2020/06/07/francia-y-el-coronavirus-a-fortalecer-el-multilateralismo/,Francia ha reafirmado su compromiso con el multilateralismo y su apoyo a la OMS para luchar en contra de la epidemia. Solo juntos vamos a vencer el virus. Mediante una declaración conjunta de la Alian,07-06-2020 09:05,https://www.bing.com/th?id=ON.85A961ED3E25A5122BFA539F2A1B1672,Chile,El Mostrador
Los emprendedores sorteando el Covid-19 - La Tercera,https://www.latercera.com/conversacioneslt/noticia/los-emprendedores-sorteando-el-covid-19/MSP7APS7P5CMLFOK7SOLYHXX4U/,"La presidenta de la Asociación de Emprendedores de Chile, Alejandra Mustakis, conversa con la editora de Pulso Domingo, María José Tapia, sobre los desafíos que enfrentan los emprendedores en medio de",07-06-2020 10:19,https://www.bing.com/th?id=ON.E49E8744D151A7AFBE6F9B8760BABFA2,Chile,LA TERCERA
"Casos en Chile, Bolivia y Perú: Expertos debaten sobre ...",https://www.emol.com/noticias/Nacional/2020/06/07/988388/expertos-vivir-en-altura-covid19.html,"Para tener una idea, según los últimos datos del Minsal, Calama presenta una letalidad de 3,45%, mientras que la media a nivel país es de 1,1%. En tanto, el 23° informe epidemiológico detalla que se h",07-06-2020 11:43,https://www.bing.com/th?id=ON.F58466CBB2BA9C579C640F3E62552587,Chile,Emol
Casi 2.500 menores de 4 años se han contagiado de ...,https://www.emol.com/noticias/Nacional/2020/06/07/988401/menores-20-anos-covid-hospitalizados.html,"Pese a esto, los más jóvenes no están libres de contraer la enfermedad. Así lo demuestra el nuevo informe epidemiológico publicado la noche del sábado 6 de junio. Considerando los datos recopilados a",07-06-2020 12:37,https://www.bing.com/th?id=ON.37D07D8CDED25B7D184E2D9B27974FEB,Chile,Emol
Vichuquén es la única comuna del Maule sin contagios por ...,https://new.diariolaprensa.cl/index.php/2020/06/07/vichuquen-es-la-unica-comuna-del-maule-sin-contagios-por-covid-19/,"A pesar de ser considerado como un territorio “de alto riesgo”. A juicio del alcalde Roberto Rivera, los vecinos han tenido un “comportamiento ejemplar”, sobre todo en el autocuidado, colaborando de p",07-06-2020 12:51,https://www.bing.com/th?id=ON.FCB9379EC0E5236C5B1522559CDE86EA,Chile,La Prensa
"La solidaridad, ¡un valor fundamental! – Diario La Prensa",https://new.diariolaprensa.cl/index.php/2020/06/07/la-solidaridad-un-valor-fundamental/,"Curicó. En tiempos tan difíciles y complejos como los que atraviesa la humanidad este año, se requiere de mucha responsabilidad colectiva, empatía social y sobre todo… solidaridad.   La pandemia del C",07-06-2020 12:51,https://www.bing.com/th?id=ON.450BDACF68C8CB6D048BF9A8AD039EC9,Chile,La Prensa
Carabinero que es jefe de seguridad del Presidente ...,https://www.publimetro.cl/cl/noticias/2020/06/06/carabinero-jefe-seguridad-del-presidente-sebastian-pinera-coronavirus.html,"A través de un comunicado público, Carabineros de Chile informó que el jefe del Departamento de Seguridad Presidencial fue detectado como “un caso positivo de covid-19”. “Mediante el sistema de contro",07-06-2020 12:54,https://www.bing.com/th?id=ON.51109DC90E555B2543A9154E92DA78BD,Chile,publimetro.cl
Más de 3 millones de elementos para la protección ha ...,https://elpinguino.com/noticia/2020/06/07/mas-de-3-millones-de-elementos-para-la-proteccion--ha-adquirido-servicio-de-salud-magallanes-,"La subdirectora de Recursos Físicos y Financieros del Servicio de Salud Magallanes, Liliana Garrido, señaló que la adquisición de estos insumos también se pudieron realizar gracias a los fondos traspa",07-06-2020 13:07,https://www.bing.com/th?id=ON.BD452FBBFF3A5A03A9FC2A2E84CB1594,Chile,ELPINGUINO
Consejos prácticos para liberar el estrés del encierro ...,https://www.elrancaguino.cl/2020/06/06/consejos-practicos-para-liberar-el-estres-del-encierro-desde-barrer-hasta-subir-las-escaleras/,"La situación actual que está viviendo el mundo y Chile, por cierto, es quizás la más compleja en mucho tiempo o en la historia para algunos. Toda la civilización se ha visto afectada de una u otra for",07-06-2020 13:15,https://www.bing.com/th?id=ON.A79C00C5115A5427AC09A78E407788AF,Chile,elrancaguino.cl
Dos nuevos médicos fallecieron producto del Covid-19 ...,https://www.cooperativa.cl/noticias/sociedad/salud/coronavirus/dos-nuevos-medicos-fallecieron-producto-del-covid-19/2020-06-06/164329.html,"El Colegio que los agrupa informó a través de sus redes sociales la muerte de Juan Carlos Carvajal y Patricio Morales. Con ellos, el número de profesionales médicos fallecidos por coronavirus asciende",07-06-2020 13:17,https://www.bing.com/th?id=ON.42C529EF13263D3435054F17BAD303C9,Chile,Radio Cooperativa
La advertencia de Eduardo Engel: “Los datos que tenemos no ...,https://www.latercera.com/la-tercera-domingo/noticia/la-advertencia-de-eduardo-engel-los-datos-que-tenemos-no-permiten-todavia-ver-ninguna-luz-a-la-salida-del-tunel-en-santiago/AHMTSAON6NEDBAA7QF4KGJWDIY/,Urgencia. En esa palabra resume el economista Eduardo Engel su inquietud ante el avance del Covid-19 en Chile. El director de Espacio Público esta semana hizo noticia luego de que el ministro de Salud,07-06-2020 13:51,https://www.bing.com/th?id=ON.1C3F14EE124BED693640F7C0F3FAF6C2,Chile,LA TERCERA
Senadora Goic: brechas de especialistas se mantendrán ...,https://laprensaaustral.cl/cronica/senadora-goic-brechas-de-especialistas-se-mantendran-mientras-el-minsal-no-disponga-los-cargos-para-contratar/,Advirtiendo que se mantendrán las brechas de especialistas mientras que el Ministerio de Salud no disponga de los recursos y de los cargos para contratar a los médicos en los distintos Servicios de Sa,07-06-2020 13:55,https://www.bing.com/th?id=ON.8A87A058F626E1657DDFDDBD5B926F88,Chile,La Prensa Austral
Los muertos por Covid-19 ya superan los 400 mil en todo el ...,https://www.cooperativa.cl/noticias/sociedad/salud/coronavirus/los-muertos-por-covid-19-ya-superan-los-400-mil-en-todo-el-mundo/2020-06-07/094403.html,"De acuerdo con los datos proporcionados por la Universidad Johns Hopkins, la cifra de contagiados traspasó los 6,9 millones. Estados Unidos es el país con más muertes, con 109 mil 802, lo que supone u",07-06-2020 14:07,https://www.bing.com/th?id=ON.19637421C6C02D91BD4B496F776A51FB,Chile,Radio Cooperativa
AFC Chile informa reapertura de sucursales de Puente Alto ...,https://www.df.cl/noticias/economia-y-politica/laboral-personas/afc-chile-informa-reapertura-de-sucursales-de-puente-alto-y-maipu/2020-06-06/171750.html,"La Adminitradora de Fondos para la Cesantía Chile (AFC) informó esta tarde que el lunes 8 de junio reabrirá la sucursal de Puente Alto y el martes 9 la de Maipú tras cumplir la cuarentena. La primera,",07-06-2020 14:12,https://www.bing.com/th?id=ON.910E77191C3D2D67367B6F55FF316E0B,Chile,df.cl
Doctor Artaza llama a prepararse para lamentar más de 100 ...,https://www.lacuarta.com/cronica/noticia/doctor-artaza-llama-prepararse-100-victimas/506817/,"El ex ministro de Salud hizo un crudo análisis de la pandemia en el país, cuando el último reporte de fallecimientos llegó a su cifra más alta desde que llegó el virus: 93 decesos. El doctor Osvaldo A",07-06-2020 14:23,https://www.bing.com/th?id=ON.D310CC749A8E7962A2F337D2B9396A2C,Chile,La Cuarta
257 menores de 5 años están hospitalizados por Covid-19 en ...,https://www.elmostrador.cl/dia/2020/06/07/257-menores-de-5-anos-estan-hospitalizados-por-covid-19-en-chile-contagios-en-ninos-superan-los-2-mil/,El úlitmo informe epidemiológico revela que 436 menores de 17 años están hospitalizados por la pandemia. 257 tienen menos de 5 años y 179 están entre los 5 y 17 años. Compartir Twittear Compartir Impr,07-06-2020 14:37,https://www.bing.com/th?id=ON.816876AD7D4F14DB2785AE12D7C6ABF6,Chile,El Mostrador
Sociedad Chilena de Nefrología rechaza discriminación de ...,https://www.elciudadano.com/chile/sociedad-chilena-de-nefrologia-rechaza-discriminacion-de-pacientes-en-dialisis-con-covid-19-positivo-en-las-residencias-sanitarias/06/06/,"La subsecretaria de Salud Pública, Paula Daza, informó el pasado domingo que existe un 35% de ocupación en las residencias sanitarias, y que se duplicará la cantidad de estos recintos en los próximos",07-06-2020 15:06,https://www.bing.com/th?id=ON.2C855836683981E34AD92104A27A39F4,Chile,El Ciudadano
censo agropecuario y forestal - Diario Financiero,https://www.df.cl/noticias/economia-y-politica/pais/ine-y-odepa-reagendan-inicio-de-nuevo-censo-agropecuario-y-forestal-2020/2020-06-07/113640.html,"En el contexto de la contingencia generada por la pandemia de Covid-19 en Chile, y las medidas de resguardo que se han tomado en todas las regiones del país, el Instituto Nacional de Estadísticas (INE) y la Oficina de Estudios y Políticas Agrarias del Ministerio de Agricultura (Odepa) anunciaron",07-06-2020 15:41,https://www.bing.com/th?id=ON.AB0B1B84AB295D854FDE5558356D1824,Chile,df.cl
6.400 menores de 14 años se han contagiado de Covid-19 en ...,https://www.theclinic.cl/2020/06/07/6-400-menores-de-14-anos-se-han-contagiado-de-covid-19-en-chile/,"El último informe epidemiológico entregado por el Minsal detalló que un total de 6.400 menores de 14 años se han contagiado de Covid-19. De estos, 2.456 corresponde a menores de cuatro años; 1.815 ent",07-06-2020 16:09,https://www.bing.com/th?id=ON.87D983200FE9A322C027B790CC9C8AF8,Chile,Clinic
Doctor Ugarte homenajea en redes a nuevo médico mártir que ...,https://www.publimetro.cl/cl/noticias/2020/06/06/doctor-ugarte-homenajea-redes-nuevo-medico-martir-muere-coronavirus.html,"La pelea contra el coronavirus no está resultando fácil, qué duda cabe. El mejor ejemplo, tal vez, está en el caso de la llamada ""primera línea"" de la Salud, que esta vez lamenta la muerte de dos de s",07-06-2020 16:13,https://www.bing.com/th?id=ON.3E84BD3732C294972AB09CB9647C95D5,Chile,publimetro.cl
No suspendieron faenas: Denuncian que construcción de Mall ...,https://www.elciudadano.com/chile/no-suspendieron-faenas-denuncian-que-construccion-de-mall-outlet-en-talca-se-convirtio-en-foco-de-contagio-de-covid-19/06/07/,"Esta semana, un reportaje publicado por el Diario de la U. de Chile denunció que, desde mediados de abril, los trabajadores de la construcción del Mall Outlet de Talca han dado positivo en el examen d",07-06-2020 16:58,https://www.bing.com/th?id=ON.4123E5A6973ADA46BDE3CF66A3C07B77,Chile,El Ciudadano
