name,url,description,datePublished,imagen,pais,Fuente
Confirman 77 casos nuevos de Covid 19 con PCR positivos; 39 de Coyhaique y 30 de Aysén,https://www.rln.cl/destacado/87569-confirman-77-casos-nuevos-de-covid-19-con-pcr-positivos-39-de-coyhaique-y-30-de-aysen,Durante el reporte de la Seremi de Salud de este jueves 03 de Junio se informó que en las últimas horas se confirmaron 77 nuevos casos de Covid 19 con PCR positivos en la región de Aysén. Aysén.- Segú,03-06-2021 19:55,https://www.bing.com/th?id=OVFT.Ui3LnGKlokCoh67vhNMejC,Chile,Radio las Nieves
"Seremi de Salud advierte que caso de COVID-19 de Arturo Vidal ""terminará en una sanción""",https://www.t13.cl/noticia/deportest13/seremi-salud-paula-labra-coronavirus-covid-arturo-vidal-sancion-03-06-2021,"La Seremi de Salud de la Región Metropolitana, Paula Labra, se refirió este jueves al sumario sanitario contra Arturo Vidal, tras el caso de COVID-19 del volante luego de llegar",03-06-2021 20:05,https://www.bing.com/th?id=OVFT.sSajyaw-wxqtVHRMAk2iOS,Chile,T13
"Crónica internacional: Hongos negros letales, la “cara B” de la pandemia que acecha en Chile",https://www.theclinic.cl/2021/06/03/cronica-internacional-hongos-negros-letales-la-cara-b-de-la-pandemia-que-acecha-en-chile/,"""Hongos negros"" son unos microorganismos que producen una infección potencialmente mortal y poco común ha hecho saltar las alarmas en Chile.",03-06-2021 20:24,https://www.bing.com/th?id=OVFT.xL7YN-4MUdfM5Ynz7JVJeC,Chile,Clinic
Expertos y expertas de ICOVID Chile alertan por altos niveles de contagios y hospitalizaciones,https://www.elperiodista.cl/2021/06/expertos-y-expertas-de-icovid-chile-alertan-por-altos-niveles-de-contagios-y-hospitalizaciones/,"El equipo ICOVID Chile, iniciativa liderada por la Universidad de Chile, la Pontificia Universidad Católica de Chile y la Universidad de Concepción, presentó su informe número 43 con análisis y datos",03-06-2021 20:33,https://www.bing.com/th?id=OVFT.PZ_Rmj8yFT2Lnag8lYtutS,Chile,El Periodista
Buscan mejorar condiciones laborales de docentes y asistentes de la educación,https://www.radioagricultura.cl/nacional/2021/06/03/buscan-mejorar-condiciones-laborales-de-docentes-y-asistentes-de-la-educacion.html,"Las diputadas Camila Rojas (Comunes), Cristina Girardi (PPD) y los diputados Gonzalo Winter (CS), Rodrigo González (PPD), junto al presidente",03-06-2021 20:34,https://www.bing.com/th?id=OVFT.mLzl2tUVTv72MKIvNy57Ni,Chile,Radio Agricultura
Talca y Pencahue retroceden a la fase de cuarentena del Plan Paso a Paso,https://redatacama.com/regional/talca-y-pencahue-retroceden-a-la-fase-de-cuarentena-del-plan-paso-a-paso,"Pelluhue retrocederá a la fase de transición del Plan Paso a Paso. En un nuevo balance sobre la situación del Covid-19 en Chile, las autoridades del Ministerio de Salud informaron que desde este sábad",03-06-2021 21:21,https://www.bing.com/th?id=OVFT.WgVQW52_qz27HAqZ0rr5Hy,Chile,Red Atacama
16 empresas y organismos forman asociación gremial para impulsar polo de innovación en salud,https://www.df.cl/noticias/empresas/salud/16-empresas-y-organismos-forman-asociacion-gremial-para-impulsar-polo-de/2021-06-03/172611.html,"Firmas como laboratorios, farmacias digitales, proveedores de insumos médicos, soluciones TI y telemedicina, junto a fundaciones, centros de I+D y fondos de capital de riesgo, lanzaron Pro Salud Chile",03-06-2021 21:32,https://www.bing.com/th?id=OVFT.RtJVAjJhJ3qQSjR672IC-y,Chile,df.cl
Habla joven que fue pinchada pero no recibió vacuna contra el Covid-19 en Huechuraba,https://www.lacuarta.com/cronica/noticia/habla-joven-fue-pinchada/639353/,"Una insólita denuncia fue la que realizó una joven que fue pinchada, pero no recibió la vacuna contra el Covid-19 en la comuna de",03-06-2021 21:36,https://www.bing.com/th?id=OVFT.JVqzDwkMUxETo3D76pGbEi,Chile,La Cuarta
Minsal llamó “a la tranquilidad” por presuntos efectos adversos con las vacunas AstraZeneca y CanSino,https://www.adnradio.cl/nacional/2021/06/03/minsal-vacunas-astrazeneca-cansino-covid-19.html,La autoridad sanitaria se refirió a los casos reportados en el marco del proceso de inoculación contra el covid-19.,03-06-2021 22:02,https://www.bing.com/th?id=OVFT.LL33TEr4bziua-ForwPbRS,Chile,ADN
Trabajo investigativo y control de la pandemia fueron los focos de la PDI durante 2020,https://www.rln.cl/policial/87581-trabajo-investigativo-y-control-de-la-pandemia-fueron-los-focos-de-la-pdi-durante-2020,"Este miércoles 3 de junio, y en el marco del 88° Aniversario de la Policía de Investigaciones de Chile, se realizó la Cuenta Pública institucional para dar a conocer a la ciudadanía los avances y resu",03-06-2021 23:01,https://www.bing.com/th?id=OVFT.tkkluaRXuTUuIkOXnaopxS,Chile,Radio las Nieves
"Chile vs Argentina EN VIVO MINUTO A MINUTO en USA | Ver ONLINE GRATIS, STREAMING y por TV en las Eliminatorias Qatar 2022",https://redgol.cl/seleccionchilena/Argentina-vs.-Chile-EN-VIVO-ONLINE-por-las-Eliminatorias-Sudamericanas-a-Qatar-2022-Dia-horario-canales-de-TV-para-VER-EN-DIRECTO-la-jornada-7-via-TyC-Sports-RedGol-TNT-Sports-Fubo-TV-20210603-0117.html,"Chile y Argentina chocan a las 20:00 horas y puedes ver el partido AQUÍ totalmente en vivo, online y gratis en Redgol.cl. Conoce las formaciones y todo lo que debes saber de cara a este compromiso. Si",03-06-2021 23:15,https://www.bing.com/th?id=OVFT.4YC7qDi_HWlo6sxP6QhqNC,Chile,redgol
Presentan proyecto para mejorar condiciones laborales de docentes y asistentes de la educación en pandemia,https://www.elciudadano.com/chile/presentan-proyecto-para-mejorar-condiciones-laborales-de-docentes-y-asistentes-de-la-educacion-en-pandemia/06/03/,Iniciativa busca extender a los trabajadores de la educación las normas sobre trabajo a distancia contenidas en la ley 21.220 sobre Teletrabajo y propone cuatro medidas para aliviar el agobio laboral,03-06-2021 23:33,https://www.bing.com/th?id=OVFT.ubyUq8orjPPr7zg9TPvU6i,Chile,El Ciudadano
ICOVID Chile alerta por altos niveles de contagios y hospitalizaciones,http://www.ladiscusion.cl/icovid-chile-alerta-por-altos-niveles-de-contagios-y-hospitalizaciones/,"El equipo ICOVID Chile, iniciativa liderada por la Universidad de Chile, la Pontificia Universidad Católica de Chile y la Universidad de Concepción, presentó su informe número 43 con análisis y",04-06-2021 00:05,https://www.bing.com/th?id=OVFT.icd4BGrS3Mu8nWgCPbq61i,Chile,La Discusión
EE. UU. está a punto de enviar millones de vacunas contra la COVID a los países necesitados,https://holadoctor.com/es/noticias/ee-uu-esta-a-punto-de-enviar-millones-de-vacunas-contra-la-covid-a-los-paises-necesitados,"MIÉRCOLES, 2 de junio de 2021 (HealthDay News) -- Estados Unidos pronto enviará millones de dosis de vacunas contra el coronavirus alrededor del mundo, incluyendo a América Latina, señaló el martes el",04-06-2021 00:12,https://www.bing.com/th?id=OVFT.I5UkhkFdz9v8ZqC4ao3kRy,Chile,holadoctor
Los compañeros de equipo que serán rivales en el partido entre Chile y Argentina,https://www.latercera.com/el-deportivo/noticia/los-companeros-de-equipo-que-seran-rivales-en-el-partido-entre-chile-y-argentina/O6TW3L7OEBFDVBKP424SZ6VQYA/,Cuatro seleccionados chilenos tienen vínculos deportivos con siete argentinos a nivel de clubes. Este jueves se enfrentan por las Eliminatorias.,04-06-2021 01:02,https://www.bing.com/th?id=OVFT.IaU0zWSJ_1hAyzdsi5AezC,Chile,LA TERCERA
"Joven que recibió ""vacuna fantasma"" en Huechuraba desmiente a autoridades y asegura que no ha sido inoculada",https://www.puranoticia.cl/noticias/nacional/joven-que-recibio-vacuna-fantasma-en-huechuraba-desmiente-a/2021-06-03/212449.html,"Camila Santander señaló que está estudiando con su familia presentar acciones legales, luego que incluso la Municipalidad reconocieran lo ocurrido.",04-06-2021 01:56,https://www.bing.com/th?id=OVFT.h7DGh8DptJIGnoO9QzXfKi,Chile,Puranoticia.cl
"El emotivo mensaje de Arturo Vidal para la Roja tras el empate en Argentina: ""Unos leones""",https://redgol.cl/vidal/Chile-vs-Argentina-El-emotivo-mensaje-de-Arturo-Vidal-para-la-Roja-tras-el-empate-en-Argentina-Unos-leones-20210603-0135.html,"El gran ausente en la selección chilena, que se recupera del coronavirus, envió un mensaje en sus redes sociales.",04-06-2021 02:43,https://www.bing.com/th?id=OVFT.ZnG14P7imBvXd937hLmFMC,Chile,redgol
Tras intubación por covid: esposa de Giovanni Cárdenas comparte esperanzadora foto del exMasterChef,https://www.biobiochile.cl/noticias/espectaculos-y-tv/tv/2021/06/03/tras-intubacion-por-covid-esposa-de-giovanni-cardenas-comparte-esperanzadora-foto-del-exmasterchef.shtml,"Con 31 años, el exparticipante de MasterChef Chile (Canal 13) vive duros momentos tras contagiarse de covid-19. Luego del",04-06-2021 02:53,https://www.bing.com/th?id=OVFT.V8VtOd7j5mh2GSHnM7Swmy,Chile,Chile
"Arturo Vidal celebró el empate de la Roja ante Argentina: ""Unos leones""",https://www.puranoticia.cl/noticias/deportes/arturo-vidal-celebro-el-empate-de-la-roja-ante-argentina-unos-leones/2021-06-03/222213.html,Arturo Vidal no estuvo presente en el empate de la Selección chilena ante Argentina luego de quedar fuera tras contagiarse de Covid-19. Pero el volante nacional siguió atento el,04-06-2021 02:58,https://www.bing.com/th?id=OVFT.hrp6Y66lDyXF0EVz9m6RmC,Chile,Puranoticia.cl
Esposa de Giovanni Cárdenas compartió imagen de ex Masterchef desde la clínica,https://www.lacuarta.com/espectaculos/noticia/esposa-giovanni-cardenas-compartio-imagen-masterchef-desde-clinica/639451/,"Estos últimos días, el ex finalista de Masterchef Chile, Giovanni Cárdenas, se ha mantenido en un estado bastante delicado de salud tras contagiarse.",04-06-2021 03:01,https://www.bing.com/th?id=OVFT.vhwXU8NYW9ItpmHIdUtoHy,Chile,La Cuarta
Vidal felicitó a sus compañeros de Selección por el empate con Argentina,https://www.13.cl/programas/copa-america/noticias/vidal-felicito-a-sus-companeros-de-seleccion-por-el-empate-con,"Vidal no pudo decir presente por ser positivo de Covid 19, pero eso no le impidió mandarle un mensaje de felicitaciones a sus compañeros. Es una baja sensisble, muy sensible. Arturo Vidal puede ser pa",04-06-2021 03:41,https://www.bing.com/th?id=OVFT.keOs9gxV7zblT7tVrWJwYi,Chile,13.cl
La bohemia porteña está de luto: fallece destacado músico Juan Toledo tras contagiarse de covid-19,https://www.biobiochile.cl/noticias/nacional/region-de-valparaiso/2021/06/04/la-bohemia-portena-esta-de-luto-fallece-destacado-musico-juan-toledo-tras-contagiarse-de-covid-19.shtml,"La escena cultural de Valparaíso se encuentra de luto, ya que este miércoles falleció el destacado artista local Juan",04-06-2021 04:45,https://www.bing.com/th?id=OVFT.YBi1V8l5CZxu0DEEU1t4Yi,Chile,Chile
Una deslucida Copa América ya definió sedes y calendario,https://www.diarioconcepcion.cl/deportes/2021/06/04/una-deslucida-copa-america-ya-definio-sedes-y-calendario.html,"Restan sólo 9 días para el inicio de un cuestionado torneo que tendrá sede en Brasil. “Es un riesgo enorme, gigante”, dijo el DT Martín Lasarte. Chile jugará en Cuiabá, Río de Janeiro y Brasilia.",04-06-2021 07:05,https://www.bing.com/th?id=OVFT.OcquguSHCpt-kwDiw8V6Ri,Chile,El Diario de Concepcion
"Doctor Ugarte y pase de movilidad: ""No era oportuno aplicarlo ahora que las cifras están tan altas""",https://www.t13.cl/noticia/nacional/doctor-ugarte-y-pase-movilidad-no-era-oportuno-aplicarlo-ahora-cifras-estan-tan-altas,"En conversación con T13 Noche, el médico y jefe de urgencias de la Clínica Indisa, Sebastián Ugarte, se refirió al presente actual de la pandemia del COVID-19 en Chile y a la implementación del pase d",04-06-2021 07:47,https://www.bing.com/th?id=OVFT.YNlz7VipcUNbD48ga3O9Sy,Chile,T13
Vacunación: Hoy viernes continúa la inoculación contra el Covid-19 para las personas de 23 años y más,https://www.latercera.com/nacional/noticia/vacunacion-hoy-viernes-continua-la-inoculacion-contra-el-covid-19-para-las-personas-de-23-anos-y-mas/2WIHFAZQAJBM7DB6ZYB6ZRNX4U/,"Este fin de semana por otra parte se enfocará la vacunación para los rezagados de 23 años y más, y continuará la inoculación con segunda dosis y para las mujeres embarazadas a partir de las 16 semanas",04-06-2021 11:52,https://www.bing.com/th?id=OVFT.AiFkgALNeuYLaYn0G_MGyi,Chile,LA TERCERA
