name,url,description,datePublished,imagen,pais,Fuente
Proponen consultar a la población si es momento de avanzar ...,http://www.ladiscusion.cl/proponen-consultar-a-la-poblacion-si-es-momento-de-avanzar-a-nueva-normalidad/,"Este lunes el ministro de Salud, Jaime Mañalich, señaló que las comunas del país que no presenten brotes de Covid-19 deben prepararse para retomar la nueva normalidad, que incluye el regreso a las cla",26-05-2020 15:06,https://www.bing.com/th?id=ON.1A8542E6579BE23079E52C741B7D384F,Chile,La Discusión
Un salvavidas para Latam: se acoge a ley de bancarrota de ...,https://www.publimetro.cl/cl/noticias/2020/05/26/salvavidas-latam-se-acoge-ley-bancarrota-estados-unidos-reorganizar-la-empresa.html,"Latam Airlines Group y sus filiales en Chile, Perú, Colombia, Ecuador y los Estados Unidos iniciaron hoy un proceso voluntario de reorganización y reestructuración de su deuda bajo la protección del C",26-05-2020 15:10,https://www.bing.com/th?id=ON.9111ADFEC14C72F5356F2F7D1212423D,Chile,publimetro.cl
La cuarentena en la ciudad y la trampa de la regresión ...,http://www.elmartutino.cl/noticia/sociedad/la-cuarentena-en-la-ciudad-y-la-trampa-de-la-regresion-bondadosa,"Las medidas determinadas por la Cuarentena y su impacto en el funcionamiento urbano, han dado pie para una serie de especulaciones respecto al futuro de las ciudades. No es para menos. Después de todo",26-05-2020 15:15,https://www.bing.com/th?id=ON.5E70045BFDBD592C96A4736441EE9408,Chile,Mar
Chile supera las 800 muertes por coronavirus tras nuevo ...,https://www.24horas.cl/coronavirus/chile-supera-las-800-muertes-por-coronavirus-tras-nuevo-balance-del-minsal-4203120,"El Ministerio de Salud entregó un nuevo balance respecto a la pandemia de coronavirus COVID-19 en Chile, informando que en las últimas 24 horas se reportaron 45 nuevas muertes por el virus, lo cual la",26-05-2020 15:26,https://www.bing.com/th?id=ON.90DBAAB3275B6CFE4AF785D971EEC2C4,Chile,24 Horas Chile
Chile vuelve a registrar máximo diario de muertes ...,https://www.biobiochile.cl/noticias/nacional/chile/2020/05/26/chile-vuelve-registrar-maximo-diario-muertes-fallecidos-superan-los-800-casos-bordean-78-mil.shtml,"Estamos recopilando más antecedentes sobre esta noticia, quédate atento a las actualizaciones. Chile sumó este martes 3.964 nuevos casos y otros 45 decesos por coronavirus. Con esta última cifra se ig",26-05-2020 15:27,https://www.bing.com/th?id=ON.5183F270A8130B185F7B89ECDDC3C6AE,Chile,Chile
Chile supera los 800 muertos por coronavirus: Minsal ...,https://www.latercera.com/que-pasa/noticia/chile-supera-los-800-muertos-por-coronavirus-minsal-informa-que-en-las-ultimas-24-horas-se-registraron-3964-casos-y-45-fallecidos/DWGENVLKUNC67HQHKBIEOA45EA/,"En las últimas 24 horas se han registrado un total de 3.964 casos, de los cuales 3.618 presentaron síntomas y 346 fueron asintomáticos. Así lo informó esta mañana la subsecretaria de Salud Pública Pau",26-05-2020 15:27,https://www.bing.com/th?id=ON.7FEEEA050575686E54F01F3DA0CDD0F1,Chile,LA TERCERA
Chile registra 3.964 nuevos contagiados y 45 fallecidos ...,https://www.theclinic.cl/2020/05/26/chile-registra-3-964-nuevos-contagiados-y-45-fallecidos-por-covid-19-en-ultima-jornada/,"Durante la mañana de este martes la subsecretaria de Salud Pública, Paula Daza, informó que hasta ayer a las 21 horas Chile registró 3.964 nuevos casos confirmados de Covid-19, cifra de la que se desp",26-05-2020 15:28,https://www.bing.com/th?id=ON.4A97DACED8270025BB45EA68E605EE38,Chile,Clinic
Chile supera barrera de los 800 muertos por COVID-19: 77 ...,https://www.lacuarta.com/cronica/noticia/reporte-contagiados-coronavirus-2/501540/,"El Ministerio de Salud actualizó las cifras de COVID-19 que siguen en constante alza. Esta mañana, la autoridad sanitaria entregó un nuevo balance con las cifras que deja el impacto del COVID-19 en nu",26-05-2020 15:30,https://www.bing.com/th?id=ON.9096A85B35FA8A83754C21C48336EE05,Chile,La Cuarta
Chile superó los 800 muertos por Covid-19,https://www.adnradio.cl/nacional/2020/05/26/chile-supero-los-800-muertos-por-covid-19.html,"El ministro de Salud informó que personas 45 fallecieron producto del coronavirus Covid-19, en las últimas 24 horas, de acuerdo con el reporte cerrado a las 21:00 horas del 25 de mayo. Desde el primer",26-05-2020 15:30,https://www.bing.com/th?id=ON.90C592640D89F001D143D9F69DE82CF3,Chile,ADN
Cuarentena en comunas del país: ¿Cuándo se renuevan o ...,https://www.meganoticias.cl/dato-util/302853-cuarentena-comunas-santiago-region-metropolitana-cuando-se-renueva-termina-informacion.html,"El Gobierno sigue analizando medidas para combatir la expansión del coronavirus que afecta a todo el páis, siendo la aplicación de la cuarentena total una de las iniciativas de mayor impacto para inte",26-05-2020 15:32,https://www.bing.com/th?id=ON.0D7EE038DD3C23076064CBB66B850ED5,Chile,meganoticias
El coronavirus avanza y deja 806 muertes y 77.961 ...,https://www.prensafutbol.cl/355958-informe-coronavirus-chile-26-de-mayo-2020-covid19/,"El ministerio de Salud de Chile reportó el avance de contagios por coronavirus en el país, cifra que subió en 3.964 en las últimas 24 horas, con lo que se llegó a 77.961 casos este 26/05. Además, se l",26-05-2020 15:32,https://www.bing.com/th?id=ON.6865A3DD0BBF5CA8DDB1642A1D572FB2,Chile,Prensafútbol
Pandemia en Chile: Ministerio de Salud reporta ...,https://www.puranoticia.cl/noticias/nacional/pandemia-en-chile-ministerio-de-salud-reporta-3-964-casos-nuevos-de/2020-05-26/112558.html,"1.202 pacientes se encuentran en Unidades de Cuidados Intensivos (UCI), de los cuales 1.029 están conectados a ventilación mecánica. De ellos, 229 permanecen hospitalizados en estado crítico. 3.964 so",26-05-2020 15:32,https://www.bing.com/th?id=ON.DEA51731B7629C344AD9E7D016BB16CB,Chile,Puranoticia.cl
Izkia Siches y el dilema de la última cama: “Lo que más ...,https://www.elmostrador.cl/dia/2020/05/26/izkia-siches-y-el-dilema-de-la-ultima-cama-lo-que-mas-hemos-planteado-es-que-no-haya-diferencias-sociales-ni-cosas-arbitrarias/,"La doctora confesó además su preocupación por la escalada del Covid-19, señalando que “a pesar de que ya hemos completado un periodo de cuarentena en la Gran Santiago, no hemos visto una reducción de",26-05-2020 15:35,https://www.bing.com/th?id=ON.E7D56244DF435A243BC796D352E78F00,Chile,El Mostrador
Chile registra otro máximo diario con 45 muertes ...,https://elpinguino.com/noticia/2020/05/26/chile-registra-otro-maximo-diario-con-45-muertes-fallecidos-superan-los-800-y-casos-bordean-78-mil,Chile sumó este martes 3.964 nuevos casos y otros 45 decesos por coronavirus. Con esta última cifra se igualó el récord diario de fallecidos por Covid-19. Según se indicó en el tradicional balance des,26-05-2020 15:35,https://www.bing.com/th?id=ON.5518F0125555B25AA711AAA2B1F5D923,Chile,ELPINGUINO
"Cifra de fallecidos se eleva a 806 personas,... | Puranoticia",https://www.puranoticia.cl/noticias/nacional/cifra-de-fallecidos-se-eleva-a-806-personas-tras-reporte-con-45-nuevos/2020-05-26/113443.html,"La subsecretaria Paula Daza indicó que la mayoría de los fallecidos eran ""adultos mayores y personas con comorbilidad y enfermedades crónicas importantes"". 45 personas fallecieron durante las últimas",26-05-2020 15:36,https://www.bing.com/th?id=ON.C5968DBC9B96C91BCB46B05D51C50A46,Chile,Puranoticia.cl
Reportan 45 fallecidos por coronavirus y 3.964 nuevos ...,http://www.ladiscusion.cl/reportan-45-fallecidos-por-coronavirus-y-3-964-nuevos-casos-en-el-pais/,"En el habitual reporte diario sobre el Covid-19 en el país, el Ministerio de Salud informó que hasta las 21:00 horas de ayer se registraron 45 muertes asociadas a la enfermedad, elevando a 806 las víc",26-05-2020 15:39,https://www.bing.com/th?id=ON.357843EA45B5129F81BC6F728041F880,Chile,La Discusión
Académico de U. de Chile proyecta que peak de casos por ...,https://www.biobiochile.cl/noticias/opinion/entrevistas/2020/05/26/academico-u-chile-proyecta-peak-casos-covid-19-seria-la-primera-semana-junio.shtml,"La próxima semana se podría registrar el peak de casos por contagios de Covid-19 en el país, según lo han determinado las proyecciones de académicos de la Escuela de Salud Pública de la Universidad de",26-05-2020 15:40,https://www.bing.com/th?id=ON.F1C4D872F4342F2DCA7F4F10EFC14052,Chile,Chile
Wilma González encantó a seguidores con cambio de look en ...,https://www.adnradio.cl/espectaculos/2020/05/26/wilma-gonzalez-encanto-con-cambio-de-look-en-cuarentena.html,La exchica reality Wilma González encantó en redes sociales con un cambio de look durante la pandemia por el coronavirus Covid-19. La española radicada en Chile compartió este lunes fotos de la celebr,26-05-2020 15:41,https://www.bing.com/th?id=ON.E2B07AF7CCCA174AB511AC863F2CA9B8,Chile,ADN
"Covid-19: Chile llegó a casi 78 mil contagios, con 806 ...",https://www.cooperativa.cl/noticias/sociedad/salud/coronavirus/covid-19-chile-llego-a-casi-78-mil-contagios-con-806-muertos-y-30-915/2020-05-26/112412.html,"La subsecretaria Daza entregó las cifras de este martes. Este martes, la subsecretaria de Salud Pública, Paula Daza, informó que en las últimas 24 horas se registraron 3.964 nuevos contagios de corona",26-05-2020 15:42,https://www.bing.com/th?id=ON.982D11DAEEF759DE4B5DAD4DFB0C359D,Chile,Radio Cooperativa
Coronavirus: Chile supera la barrera de 800 fallecidos y ...,https://www.elmostrador.cl/dia/2020/05/26/coronavirus-chile-supera-la-barrera-de-800-fallecidos-y-contagiados-llegan-a-mas-de-77-mil/,"Al principio de su alocución, el ministro Mañalich brindó unas palabras de reconocimiento al personal de salud. En esa línea, el subsecretario de Redes Asistenciales, Arturo Zúñiga pidió ""a cada uno d",26-05-2020 15:46,https://www.bing.com/th?id=ON.A0AB7A01C858DC74BA6F4A44402BF9C6,Chile,El Mostrador
"""La pelea será mucho más larga"": Mañalich lamenta poca ...",https://www.24horas.cl/coronavirus/la-pelea-sera-mucho-mas-larga-manalich-lamenta-poca-corresponsabilidad-de-chilenos-ante-la-pandemia--4203054,"El ministro de Salud, Jaime Mañalich, lamentó la posición de Chile como uno de los países que menos respeta el lavado de manos en el contexto de la pandemia del coronavirus. ""Tengo que reconocer que l",26-05-2020 15:48,https://www.bing.com/th?id=ON.9E521BA31FC546CCEE21EEC53D826E89,Chile,24 Horas Chile
Mañalich compromete aumento a 4.859 camas con ventiladores ...,https://www.cnnchile.com/coronavirus/manalich-aumento-4-859-camas-ventiladores-junio_20200526/,"El ministro de Salud, Jaime Mañalich, anunció este martes que el compromiso de aumentar las camas con ventiladores en el sistema de salud en 550 unidades.  Durante el reporte diario del avance del COV",26-05-2020 15:51,https://www.bing.com/th?id=ON.134233FA7BE54F71D9BF029BCA9295E7,Chile,CNN Chile
Futbolista de Provincial Osorno es el primero en Chile en ...,http://www.elvacanudo.cl/noticia/sociedad/futbolista-de-provincial-osorno-es-el-primero-en-chile-en-revelar-contagio-por-coro,"El arquero de Provincial Osorno, Marcelo Salas, fue confirmado como contagiado con coronavirus, convirtiéndose en el primer el primer futbolista en hacer pública dicha situación. Según informó El Peri",26-05-2020 15:54,https://www.bing.com/th?id=ON.B8D5CB0197902FDE821F7056E2CF2736,Chile,El Vacanudo
Avance del Fogape en cifras: hasta ayer se habían cursado ...,https://www.df.cl/noticias/mercados/banca-fintech/avance-del-fogape-en-cifras-se-han-cursado-47-306-creditos-a-pyme/2020-05-26/113616.html,"La mañana de este martes, el ministro de Hacienda Ignacio Briones entregó en la comisión de Hacienda del Senado el estado de avance de la entrega de créditos de la línea Covid-19 del Fondo de Garantía",26-05-2020 15:55,https://www.bing.com/th?id=ON.C55E9054347E60EBACD70CCFFE67B251,Chile,df.cl
El Coronavirus no da chance: Se registra el sexto día ...,https://www.elperiscopio.cl/destacado-1/el-coronavirus-no-da-chance-se-registra-el-sexto-dia-sobre-los-40-fallecidos/,"Durante esta jornada, y en la ya habitual conferencia de prensa que entrega el ministerio de Salud, se informó que en Chile se registró 45 muertes, 3.964 nuevos casos, lo que suma un total de 77.961 l",26-05-2020 15:59,https://www.bing.com/th?id=ON.B09D109581C12893011D8694FACF929B,Chile,elperiscopio.cl
Ex Posta Central utiliza innovador tratamiento para manejo ...,https://www.elperiodista.cl/ex-posta-central-utiliza-innovador-tratamiento-para-manejo-de-pacientes-covid-19/,"El subsecretario de Redes Asistenciales, Arturo Zúñiga, visitó el Hospital de Urgencia Asistencia Pública (HUAP), establecimiento que utiliza como tratamiento para pacientes COVID-19, la oxigenoterapi",26-05-2020 16:01,https://www.bing.com/th?id=ON.7B20E5327C49DECF58B9764782FF7FCF,Chile,El Periodista
Mañalich desmiente que Chile enfrente hoy el dilema de la ...,https://www.elperiodista.cl/manalich-desmiente-que-chile-enfrente-hoy-el-dilema-de-la-ultima-cama-en-los-centros-hospitalarios/,"El Minsal hoy informó de 3.964 nuevos casos de Covid-19 y 45 muertes en las últimas 24 horas. Hasta ayer a las 21, entonces, suman 77.961 los contagios y 806 la cantidad de personas fallecidas en el p",26-05-2020 16:01,https://www.bing.com/th?id=ON.4B0C284C76D144998AA9A54EC18CDD2A,Chile,El Periodista
Ministerio de Hacienda mostró su postura por la delicada ...,https://www.radioagricultura.cl/economia/2020/05/26/ministerio-de-hacienda-se-refirio-la-delicada-situacion-que-atraviesa-latam.html,"Latam Airlines comunicó durante la madrugada de este martes que se acogerá a un proceso de “reorganización” basándose en el procedimiento del capítulo 11 del Código de Quiebras de Estados Unidos, debi",26-05-2020 16:06,https://www.bing.com/th?id=ON.B1C1246151A274C8BFA4665176E7BDEE,Chile,Radio Agricultura
Deudas impagas con bancos internacionales llevan a Latam ...,http://www.elvacanudo.cl/noticia/economia/deudas-impagas-con-bancos-internacionales-llevan-latam-airlines-acogerse-la-bancarr,"El covid-19 se ha cobrado a un gigante del mercado de las aerolíneas. Se trata de Latam, compañía que ya venía tambaleando desde el inicio de la pandemia, y que este martes informó que se acogerá a la",26-05-2020 16:13,https://www.bing.com/th?id=ON.FB8D238A626B2876A6A9436B6C481784,Chile,El Vacanudo
Fallecidos por covid-19 en la última jornada: 38 son de la ...,https://www.emol.com/noticias/Nacional/2020/05/26/987249/Muertos-coronavirus-35-RM.html,"De las muertes, 38 se registraron en la Región Metropolitana, que equivalen al 84% del total. También hubo cuatro víctimas en la Región de Valparaíso, dos en Antofagasta y una en Tarapacá. En cuanto a",26-05-2020 16:12,https://www.bing.com/th?id=ON.2201AF955C0848CF4DDFE8FAA472061E,Chile,Emol
Estudio revela que Chile es de los países que menos ...,https://www.diarioconcepcion.cl/pais/2020/05/26/estudio-revela-que-chile-es-de-los-paises-que-menos-respeta-el-lavado-de-manos-ante-covid-19.html,Un informe de la Oficina Nacional de Investigación Económica (National Bureau of Economic Research) de Estados Unidos reveló que Chile está entre los países que menos aplica el lavado de manos tras el,26-05-2020 16:16,https://www.bing.com/th?id=ON.8624ABA926F87AF7349E832A4B016AA4,Chile,El Diario de Concepcion
"Gobierno ""suplica"" a la ciudadanía respetar medidas ...",https://www.emol.com/noticias/Nacional/2020/05/26/987252/Gobierno-llama-a-respetar-medidas.html,"El ministro de Salud, Jaime Mañalich, hizo un llamado a la ""corresponsabilidad"" de la ciudadanía a respetar las medidas sanitarias impuestas con el fin de evitar la propagación del covid-19, lamentand",26-05-2020 16:23,https://www.bing.com/th?id=ON.F0C1FB467E722C9C7B814B93A848E2DE,Chile,Emol
"Oxigenación de alto flujo, la técnica alternativa para ...",https://diariosenred.com/nacional/oxigenacion-de-alto-flujo-la-tecnica-alternativa-para-pacientes,La técnica de oxigenación de alto flujo ya ha sido utilizada en otros países para tratar a personas con insuficiencia respiratoria aguda. La propagación del Covid-19 en nuestro país mantiene casi al l,26-05-2020 16:31,https://www.bing.com/th?id=ON.0E7E866FEB123311CE71ED14E51FB03A,Chile,Diarios en Red
Intendencia del Biobío aseguró que entregará más de 100 ...,https://www.cooperativa.cl/noticias/sociedad/salud/coronavirus/intendencia-del-biobio-aseguro-que-entregara-mas-de-100-mil-cajas-de/2020-05-26/115545.html,"La Región del Biobío comenzó la entrega de cajas de alimentos a familias en las comunas de Antuco y Alto Biobío, que en su primera etapa considera 27.716 cajas que tienen como objetivo, principalmente",26-05-2020 16:50,https://www.bing.com/th?id=ON.F13860F3A78A74A380FA63744E8B2563,Chile,Radio Cooperativa
"Mañalich explica el dilema de ""la última cama"" en Chile",https://www.publimetro.cl/cl/noticias/2020/05/26/costa-rica-matriomonio-igualitario.html,"Desde el primer minuto de martes 26 de mayo de 2020 y con una ceremonia transmitida a través de redes sociales, Dunia Araya y Alexandra Quiros contrajeron matrimonio, convirtiéndose así en la primera",26-05-2020 16:54,https://www.bing.com/th?id=ON.F7BCAAA314114C4F41F2A32DB212284B,Chile,publimetro.cl
"Mañalich ante posible colapso del sistema de salud: ""No ...",https://www.meganoticias.cl/nacional/302866-jaime-manalich-coronavirus-dilema-etico-debate-ultima-cama-camas-ventiladores-mecanicos.html,"Este martes, tras efectuar un nuevo balance del estado de la pandemia de coronavirus en Chile, el ministro de Salud, Jaime Mañalich, se refirió al dilema ético que se estaría viviendo en algunos recin",26-05-2020 16:53,https://www.bing.com/th?id=ON.193F02E406EAA0A654CF0AB0E0A38156,Chile,meganoticias
Chile supera las 800 muertes por covid-19: total de casos ...,https://www.diarioconcepcion.cl/pais/2020/05/26/chile-supera-las-800-muertes-por-covid-19-total-de-casos-positivos-llega-a-77-961.html,"Un nuevo balance entregado este martes por el Ministerio de Salud reveló que Chile registró 45 nuevos decesos y 3.964 casos positivos de covid-19, durante las últimas 24 horas, Del total de nuevos con",26-05-2020 17:00,https://www.bing.com/th?id=ON.B9BA24B4356FCC3B334AAFE110835055,Chile,El Diario de Concepcion
Números que inquietan: Ocho de cada diez casos acumulados ...,https://www.latercera.com/nacional/noticia/numeros-que-inquietan-ocho-de-cada-diez-casos-acumulados-de-coronavirus-en-chile-se-produjeron-en-la-region-metropolitana/BMA6JXVKYFD3FGW2NSI5ZNOHJM/,"Al día de hoy, en el área capitalina ya se totalizan 58.930 contagiados, cifra que representa un 79,6% de los 73.997 que se han registrado en todo el país. Durante esta jornada, los casos nuevos en la",26-05-2020 17:02,https://www.bing.com/th?id=ON.F05E6404EDAC92E14218779E6650CBFA,Chile,LA TERCERA
