name,url,description,datePublished,imagen,pais,Fuente
Economistas contra salubristas: un falso dilema - El Mostrador,https://www.elmostrador.cl/noticias/opinion/columnas/2020/04/30/economistas-contra-salubristas-un-falso-dilema/,Un sondeo reciente preguntó a economistas calificados en Estados Unidos si acaso el gobierno debía invertir más en acelerar el testeo por Covid-19 y para lograr una vacuna. Obviamente todos estuvieron,30-04-2020 05:19,https://www.bing.com/th?id=ON.B83058F59650AEC7EEB51D543274E830,Chile,El Mostrador
Diputados aprueban proyecto de Ingreso Familiar de ...,https://www.t13.cl/noticia/nacional/diputados-aprueban-proyecto-ingreso-familiar-emergencia-crisis-covid-19,"Durante la madrugada de este jueves, la Cámara de Diputados aprobó en general el proyecto de Ingreso Familiar de Emergencia y que busca ayudar económicamente a los hogares que no posean ingresos forma",30-04-2020 06:50,https://www.bing.com/th?id=ON.EDA8495E6F4754874F00BF8A9E03729F,Chile,T13
Sostenibilidad fiscal y Covid-19 - Diario Financiero,https://www.df.cl/noticias/opinion/columnistas/sostenibilidad-fiscal-y-covid-19/2020-04-29/171811.html,"Las medidas económicas del gobierno para enfrentar el Covid-19 llegan ya a US$ 17.105 millones (6,9% del PIB), estos se financiarán recurriendo a los fondos y activos del tesoro público, y a un mayor",30-04-2020 08:02,https://www.bing.com/th?id=ON.0A70DCF87836750F1C03DAA0577D6C7F,Chile,df.cl
Banco Central proyecta una caída de 18% para el comercio ...,https://www.df.cl/noticias/economia-y-politica/macro/banco-central-proyecta-una-caida-de-18-para-el-comercio-en-abril/2020-04-29/134054.html,"Un duro golpe dará la pandemia por Covid-19 a la economía local en el segundo trimestre del año y abril será la primera muestra de ello. De acuerdo con una estimación realizada por el Banco Central, p",30-04-2020 08:09,https://www.bing.com/th?id=ON.B254CCBC10809E038953A4905EE98C85,Chile,df.cl
Chilenos crearon prueba para detectar el coronavirus a ...,https://www.cooperativa.cl/noticias/sociedad/salud/coronavirus/chilenos-crearon-prueba-para-detectar-el-coronavirus-a-partir-del-olfato/2020-04-30/042424.html,"""Tenemos capacidad para producir kits de bajo costo que permitan evaluar a miles de individuos por semana"", anunció un grupo de investigadores de la UC. La aplicación masiva de este test rápido permit",30-04-2020 08:56,https://www.bing.com/th?id=ON.85CC93E83D1E7CAB8542DA10632DB17E,Chile,Radio Cooperativa
Coronavirus en Chile: 10% de los contagios activos ...,https://www.t13.cl/noticia/nacional/Coronavirus-10-de-los-contagios-activos-corresponden-a-trabajadores-de-la-salud-chile,"En el último reporte entregado por el Ministerio de Salud respecto del avance del coronavirus en Chile, el ministro Jaime Mañalich indicó que del total de los 6.612 contagios activos, 720 corresponden",30-04-2020 09:10,https://www.bing.com/th?id=ON.9AF25C4B805EFF39836084B3A676ED2A,Chile,T13
Coronavirus: cerca de 228.000 fallecidos y sobre 3.206.000 ...,https://www.adnradio.cl/internacional/2020/04/30/coronavirus-mas-de-227-000-fallecidos-y-3-206-000-contagios-a-nivel-global.html,"La cifra de muertes por el Covid-19 no logra ser detenida. En algo más de cinco meses de que comenzara la pandemia del coronavirus, se registran 227.958 fallecidos y 3.206.333 contagiados en todo el m",30-04-2020 10:06,https://www.bing.com/th?id=ON.2E1D7E08FC128C135828DA3C8CBA6504,Chile,ADN
Usuarios denuncian mal funcionamiento de la Comisaría Virtual,https://www.elperiscopio.cl/destacado-1/mal-funcionamiento-de-la-comisaria-virtual/,Los cibernautas han mostrado su descontento con la plataforma que maneja Carabineros de Chile. Una serie de reclamos han manifestado los usuarios en redes sociales tras el mal funcionamiento del sitio,30-04-2020 10:07,https://www.bing.com/th?id=ON.8251183DDF0195DA7DC402F03994ED8F,Chile,elperiscopio.cl
"Clínicas califican de ""tremendo"" el golpe financiero de la ...",https://www.emol.com/noticias/Economia/2020/04/30/984655/Clinicas-coronavirus.html,"Si bien en un inicio se pudo haber pensado que sería uno de los rubros más beneficiado con la llegada del covid-19 al país, hoy los datos dicen otra cosa: el escenario de las clínicas en Chile ha sido",30-04-2020 10:14,https://www.bing.com/th?id=ON.D138509DD67B20B487D5FE7CB4B42194,Chile,Emol
Último informe del Minsal incluye casos asintomáticos en ...,https://www.emol.com/noticias/Nacional/2020/04/29/984666/Minsal-incluye-asintomaticos-ultimo-informe.html,"SANTIAGO.- En el último reporte publicado este miércoles por el Ministerio de Salud (Minsal) sobre el número de contagios en el país, se incluyó a los casos asintomáticos, acumulando un total de 15.13",30-04-2020 10:37,https://www.bing.com/th?id=ON.1746A9F7375B04555A7C84AFB260973E,Chile,Emol
Cancillería anunció operativo de repatriación de chilenos ...,https://www.adnradio.cl/nacional/2020/04/29/cancilleria-anuncio-operativo-de-repatriacion-de-chilenos-varados-en-india-y-asia-pacifico.html,"Con la preocupación puesta en los chilenos que quieren volver al país en medio de la pandemia, el Gobierno informó de un operativo de repatriación para los ciudadanos que se encuentran varados en Indi",30-04-2020 10:55,https://www.bing.com/th?id=ON.7FD73877D15008868565B38BF55C32A2,Chile,ADN
"Covid-19: Chile suma 14.885 contagiados, 216 muertos y 8 ...",https://www.cooperativa.cl/noticias/sociedad/salud/coronavirus/covid-19-chile-suma-14-885-contagiados-216-muertos-y-8-057-recuperados/2020-04-29/101520.html,"Se registraron 520 casos nuevos y nueve fallecidos en las últimas 24 horas. Sin embargo, la cifra de contagiados no considera a los 250 pacientes asintomáticos con PCR positivo, que desde hoy empezó a",30-04-2020 10:58,https://www.bing.com/th?id=ON.BF0388FC30403B86E9890917E96F8913,Chile,Radio Cooperativa
16 mil mipymes de la región podrían acceder a crédito con ...,https://www.elrancaguino.cl/2020/04/29/16-mil-mipymes-de-la-region-podrian-acceder-a-credito-con-aval-del-estado/,"– Este martes se puso en marcha de la ley de capitalización del Fogape por US$3 mil millones, el que podrá apalancar garantías para financiamientos por un potencial de más de US$ 25.000 millones. Xime",30-04-2020 11:02,https://www.bing.com/th?id=ON.B3FC638671FDEFCAFA924A4D6AA7325D,Chile,elrancaguino.cl
Jóvenes voluntarios realizan demarcación de distancia ...,https://www.elrancaguino.cl/2020/04/29/jovenes-voluntarios-realizan-demarcacion-de-distancia-afuera-de-chile-atiende/,"Movidos por las ganas de ser un aporte en la prevención de la propagación del Covid-19 en la Región, un grupo de voluntarios de la Agrupación JVPRO, apoyados por la Gobernación de Cachapoal y la Direc",30-04-2020 11:02,https://www.bing.com/th?id=ON.6799236055FB3FE62E134C67F5D11DAC,Chile,elrancaguino.cl
Cómo se vive la “nueva normalidad” en el mundo: Las fotos ...,https://www.latercera.com/nacional/noticia/como-se-vive-la-nueva-normalidad-en-el-mundo-las-fotos-que-deja-la-semana/XAOMJIGLQZH3RMI6TBPHDZJ554/,"Los surfistas y nadadores se dirigen al océano después de que Bondi Beach reabrió sus puertas luego de un cierre de cinco semanas en Sydney el 28 de abril de 2020, en medio de la nueva pandemia de cor",30-04-2020 11:07,https://www.bing.com/th?id=ON.220619A88C177A820E73609969305043,Chile,LA TERCERA
Héctor Velis-Meza: “Lo que hablamos y escribimos es ...,https://www.publimetro.cl/cl/noticias/2020/04/30/hector-velis-meza-lo-hablamos-escribimos-dinamico-no-fanaticos.html,"En 2010 la Real Academia Española de la Lengua, RAE, instauró la norma de quitarle la tilde a las palabras “sólo” y “éste” en determinadas acepciones, y por estos días ha sido reflotada una polémica d",30-04-2020 11:15,https://www.bing.com/th?id=ON.F6BF734E35ECD3B9E6255B4A1C6087F2,Chile,publimetro.cl
“Cuando termine la cuarentena voy a salir rodando”: el ...,https://www.elmostrador.cl/braga/2020/04/30/cuando-termine-la-cuarentena-voy-a-salir-rodando-el-miedo-a-engordar-durante-la-pandemia/,"“Voy a terminar rodando al final de la cuarentena” es una frase que repiten muchas mujeres, a quienes les preocupa subir de peso durante la crisis sanitaria por el Covid-19, ya que no están realizando",30-04-2020 11:14,https://www.bing.com/th?id=ON.8C3A22EB7529795F3CE78C160661DBDA,Chile,El Mostrador
El Covid-19 ahonda las grietas en las cárceles de América ...,https://www.latercera.com/mundo/noticia/el-covid-19-ahonda-las-grietas-en-las-carceles-de-america-latina/F6YMBX3DHVF6XLCIER4FW257VE/,"Más de 1,5 millones de reclusos cumplen sus penas en cárceles de América Latina, donde la mayor preocupación de las últimas semanas no es el hacinamiento, la pobreza y la violencia, sino evitar los co",30-04-2020 11:19,https://www.bing.com/th?id=ON.FFDC00CF767DC52D65B68FBC3A470116,Chile,LA TERCERA
Comunas ubicadas a la salida de Santiago y con bajos casos ...,https://www.cnnchile.com/coronavirus/comunas-salida-santiago-preocupadas-feriado_20200430/,"A su alcalde le preocupa que las personas, motivadas por el estrés de las cuarentenas y la estabilización de las tasas de contagio, quieran aprovechar del Día del Trabajador para desplazarse hacia sus",30-04-2020 11:35,https://www.bing.com/th?id=ON.55CE99399F60F067D281E6C75284382A,Chile,CNN Chile
Carta abierta del Coronel (R) y actualmente Práctico de ...,https://www.radiosantiago.cl/archivo/128259,"Mucho he pensado antes de dejar la tranquilidad del anonimato quien fuera un antiguo (10 años desde entonces) colaborador suyo cuando fue Ministro de Salud también, pero en la alborada del primer gobi",30-04-2020 11:58,https://www.bing.com/th?id=ON.2C94E9BB698AD2B438A8D55C17CEFA2A,Chile,Radio Santiago
Chile suma 520 nuevos casos de Covid-19 con polémica por ...,https://www.biobiochile.cl/noticias/nacional/chile/2020/04/29/chile-suma-520-nuevos-casos-de-covid-19-con-polemica-por-exclusion-de-250-pacientes-asintomaticos.shtml,"El Ministerio de Salud (Minsal) informó la mañana de este miércoles que se reportaron 520 nuevos casos de Covid-19, con lo que el total nacional llega a los 14.885 contagios. Además, se informó de 250",30-04-2020 12:09,https://www.bing.com/th?id=ON.0D5B27BF368C73E0C19F645DF5BA0947,Chile,Chile
INDH visitó 30 hogares del Sename para... | Puranoticia,https://www.puranoticia.cl/noticias/nacional/indh-visito-30-hogares-del-sename-para-verificar-medidas-adoptadas-ante/2020-04-30/082053.html,"Organismo informó que no tuvo contacto con los niños, y que está cumpliendo con las medidas necesarias para asegurarse de que éstas sean cumplidas también en las residencias. A través de un despliegue",30-04-2020 12:22,https://www.bing.com/th?id=ON.AECD4285193A17C9C868670B2E0A04EB,Chile,Puranoticia.cl
El problema de Rafael Araneda para regresar a Chile desde ...,https://www.biobiochile.cl/noticias/espectaculos-y-tv/tv/2020/04/29/el-problema-de-rafael-araneda-para-regresar-a-chile-desde-ee-uu-lleva-toda-la-cuarentena-alla.shtml,"La cuarentena por el Covid-19 encontró a Rafael Araneda en uno de los países más afectados por la pandemia, Estados Unidos, donde por estos días conduce el programa Enamorándonos USA de Univisión. Con",30-04-2020 12:34,https://www.bing.com/th?id=ON.8086065143EB99A1F8AB4DB60117204E,Chile,Chile
Cámara despacha proyecto de Ingreso Familiar de Emergencia ...,https://www.24horas.cl/coronavirus/camara-despacha-proyecto-de-ingreso-familiar-de-emergencia-tras-rechazar-los-montos-y-procedimientos-para-definir-beneficiarios-4138203,"Cerca de las 2:00 horas de este jueves, la Cámara de Diputadas y Diputados aprobó en forma unánime el proyecto de Ingreso Familiar de Emergencia, el cual busca ir en ayuda económica para las personas",30-04-2020 12:38,https://www.bing.com/th?id=ON.46AA5E7AD0A1C06924E75E9009668F01,Chile,24 Horas Chile
El dilema de los torneos tradicionales de futsal infantil ...,https://laprensaaustral.cl/deportes/el-dilema-de-los-torneos-tradicionales-de-futsal-infantil-en-medio-de-la-crisis-sanitaria/,Varios son los campeonatos de futsal infantil que año a año se vienen realizando y que ya asoman tradicionales en el calendario deportivo regional. Lo cierto es que esta disciplina ha entrado fuerte a,30-04-2020 12:37,https://www.bing.com/th?id=ON.5803EB867F229A1A05C5C7A2013C1282,Chile,La Prensa Austral
Diputados DC: Renuncia de Lorenzini “es un golpe al ...,http://lanacion.cl/2020/04/28/diputados-dc-renuncia-de-lorenzini-es-un-golpe-al-partido-pero-lo-llaman-a-seguir-en-la-bancada/,"Los legisladores de la instancia parlamentaria lamentaron la dimisión de su camarada, subrayando que ejerció un rol muy importante en las comisiones de la Cámara como la de Hacienda, sobre todo ahora",30-04-2020 12:46,https://www.bing.com/th?id=ON.08C1385E0F630F81590A46C65A9E9148,Chile,La Nación
La nueva forma de contabilizar: entran los “asintomáticos’’,https://www.lacuarta.com/cronica/noticia/asintomaticos-contabilizar-reporte-coronavirus/490052/,"El ministro Jaime Mañalich indicó que ahora no solo se informarán los casos positivos y sintomáticos de coronavirus, sino que también se dará la cifra de aquellas personas cuyo examen PCR es positivo,",30-04-2020 12:47,https://www.bing.com/th?id=ON.ABB08CB92E4C1364A78F9C86CBE63621,Chile,La Cuarta
Senadores de oposición llaman al Gobierno a... | Puranoticia,https://www.puranoticia.cl/noticias/senadores-de-oposicion-llaman-al-gobierno-a-aumentar-a-100-litros-por/2020-04-30/090307.html,"Allende, Provoste, Órdenes, Insulza, Girardi, Huenchumilla y Guillier recordaron que más de 500 mil ciudadanos viven sin posibilidad de acceso regular al agua potable. Ante la grave sequía que enfrent",30-04-2020 13:05,https://www.bing.com/th?id=ON.3C9B1ADE09E411B975380B034592B4BB,Chile,Puranoticia.cl
