name,url,description,datePublished,imagen,pais,Fuente
Chile registró casi 7 mil casos nuevos de Covid-19,http://www.ladiscusion.cl/chile-registro-casi-7-mil-casos-nuevos-de-covid-19/,"El Ministerio de Salud (Minsal) reportó 6.903 casos nuevos y 127 nuevos decesos por covid-19. Con ello, el  total de casos activos, es decir, aquellas personas que portan el SARS-CoV-2 y que son",14-05-2021 14:46,https://www.bing.com/th?id=OVFT.CccnXoQIxBnaNlWHToCIHS,Chile,La Discusión
Chile: Casi 7.000 casos nuevos de Covid-19 en la última jornada,https://radioportales.cl/sitio/chile-casi-7-000-casos-nuevos-de-covid-19-en-la-ultima-jornada/,"El Minsal reportó este viernes 127 nuevos decesos por covid-19, según el Departamento de Estadística e Información de Salud, DEIS, lo que eleva el total nacional de defunciones a 27 mil 647 con PCR co",14-05-2021 15:35,https://www.bing.com/th?id=OVFT.P0ZXDdb-7OWF8QytI53bBi,Chile,Radio Portales
La incertidumbre de ser padres de un hijo con asma en tiempos de pandemia.,https://www.elrancaguino.cl/2021/05/14/la-incertidumbre-de-ser-padres-de-un-hijo-con-asma-en-tiempos-de-pandemia/,Por: Viviana Aguirre Vicedecana de Investigación y Desarrollo de la Facultad de Ciencias Médicas de Usach       La,14-05-2021 17:40,https://www.bing.com/th?id=OVFT.FZmJfSmOCJuTlR-c_LO8Gi,Chile,elrancaguino.cl
Ejército ya se encuentra desplegado en locales de votación de la región de Aysén,https://www.rln.cl/destacado/86980-ejercito-ya-se-encuentra-desplegado-en-locales-de-votacion-de-la-region-de-aysen,"Integrantes de las unidades de la IV División de Ejército se encuentran desplegados en los establecimientos educacionales asignados como locales de votación en la Región de Aysén, para el proceso de l",14-05-2021 18:42,https://www.bing.com/th?id=OVFT.cPYaqBhBTIN-Drda80GyQC,Chile,Radio las Nieves
Radiograma: Contagios de Covid-19 llegan a la cifra más alta en lo que va del mes,https://www.biobiochile.cl/biobiotv/programas/radiograma-biobiotv/2021/05/14/radiograma-contagios-de-covid-19-llegan-a-la-cifra-mas-alta-en-lo-que-va-del-mes.shtml,Revisa la edición de Radiograma Mediodía del viernes 14 de mayo junto a Katherine Cubillos y Nibaldo Mosciatti en Bio Bio TV. Revisa la edición de Radiograma Mediodía del viernes 14 de mayo junto a Ka,14-05-2021 19:10,https://www.bing.com/th?id=OVFT.xJXJwIBTqaGijNxZHwIxYS,Chile,Chile
Rol de las telecomunicaciones en pandemia será eje principal en webinar de la Universidad de Concepción,https://mundoenlinea.cl/2021/05/14/rol-de-las-telecomunicaciones-en-pandemia-sera-eje-principal-en-webinar-de-la-universidad-de-concepcion/,"Desde principios del 2020, debido a la crisis sanitaria acarreada por el Covid-19, gran parte de la población mundial a tenido que quedarse en sus hogares, obligando a potenciar distintas manera de re",14-05-2021 20:08,https://www.bing.com/th?id=OVFT.42mFp1XcdaawyqkORvYphS,Chile,Mundo en línea
Bolsa de Santiago cierra este viernes con su mejor desempeño del año a la espera de elecciones,https://www.emol.com/noticias/Economia/2021/05/14/1020930/Bolsa-Santiado-ad-portas-elecciones.html,"Pese al positivo dato de este viernes, el IPSA -principal índice de la plaza local- no logró recuperar todo lo perdido en las últimas jornadas, registrando una caída semanal de 0,95%.",14-05-2021 20:51,https://www.bing.com/th?id=OVFT.jxLNykd6pmCdIUu3UAIOcy,Chile,Emol
Plan Paso a Paso: Revisa qué comunas cambian de fase este sábado,https://www.t13.cl/noticia/nacional/plan-paso-paso-comunas-cuarentena-transicion-14-05-2021,A las 05:00 horas de este sábado 15 de mayo se registran modificaciones en el Plan Paso a Paso. Revisa todos los detalles en T13.cl.,14-05-2021 21:12,https://www.bing.com/th?id=OVFT.fXid9xHcXchxuDT2KdbRJy,Chile,T13
Marco Kremerman advierte que la evasión de impuestos podría llegar a US$22.000 millones al año,https://www.elciudadano.com/chile/marco-kremerman-advierte-que-la-evasion-de-impuestos-podria-llegar-a-us22-000-millones-al-ano/05/14/,Las discusiones se dan en el contexto de la solicitud de la oposición de quitar recursos a las FF.AA. para poder cancelar el Bono Universal.,14-05-2021 21:16,https://www.bing.com/th?id=OVFT.gTIXEiYSjwdNppD8q2uvHi,Chile,El Ciudadano
"Presidenta del Senado reafirma críticas al Gobierno: ""Hasta ahora no ha presentado ni una sola propuesta""",https://www.puranoticia.cl/noticias/nacional/presidenta-del-senado-reafirma-criticas-al-gobierno-hasta-ahora-no-ha/2021-05-14/164757.html,"Yasna Provoste lamentó la postura del Ejecutivo y advirtió que ""solo con propuestas concretas podemos recuperar la gobernabilidad"".",14-05-2021 21:19,https://www.bing.com/th?id=OVFT.rBmwwDflejrsIGi2VBTUli,Chile,Puranoticia.cl
"Ex ""MasterChef"" Giovanni Cárdenas está intubado tras contagiarse de coronavirus",https://www.meganoticias.cl/tendencias/336663-master-chef-chile-giovanni-cardenas-neumonia-coronavirus-pizzas-instagram-mlx20.html,"Giovanni Cárdenas, exparticipante del programa MasterChef, se encuentra viviendo un complejo momento producto de su estado de salud, luego de que el cocinero se contagiara de Covid-19.",14-05-2021 21:30,https://www.bing.com/th?id=OVFT.C-Hd4TRxArrhx9Q9NgJdri,Chile,meganoticias
Red de Laboratorios universitarios duplicarán capacidad nacional para secuenciar coronavirus,https://www.latercera.com/que-pasa/noticia/red-de-laboratorios-universitarios-duplicaran-capacidad-nacional-para-secuenciar-coronavirus/5YFC26MJIJFP3JONMDRKQZNE6Y/,"A través de la coordinación del Ministerio de Ciencia, seis universidades desde Antofagasta a Punta Arenas participan de un plan de aceleramiento que permitirá analizar hasta 360 muestras semanales pa",14-05-2021 21:34,https://www.bing.com/th?id=OVFT.fkh2Bwb7yRWc9OdWGtyr0i,Chile,LA TERCERA
Elecciones 15 y 16 de mayo: Especialista entrega recomendaciones sanitarias para los adultos mayores,https://www.t13.cl/noticia/elecciones-2021/nacional/elecciones-especialista-recomendaciones-sanitarias-adultos-mayores-14-05-2021,"El investigador Centro de Gerociencia, Salud Mental y Metabolismo, Felipe Salech, entregó algunas recomendaciones para evitar el contagio de COVID-19 y llamó a no confiarse pese a estar vacunado con l",14-05-2021 21:46,https://www.bing.com/th?id=OVFT.GwsragP0uRpB-5Jt_dUr8C,Chile,T13
Valdivia: Fallece destacado radiodifusor,https://www.latribuna.cl/destacados/2021/05/14/valdivia-fallece-destacado-radiodifusor.html,"Augusto Olave a los 17 años se incorporó a la radio Austral de Valdivia, emisora liderada en ese entonces por su padre, periodista y diputado.",14-05-2021 23:03,https://www.bing.com/th?id=OVFT._aMimZJNF6tQMm_LM-mFyS,Chile,La Tribuna
Pese a tendencia a la baja de nuevos casos de Covid-19 cifras se mantienen tres veces por sobre el límite,http://www.ladiscusion.cl/pese-a-tendencia-a-la-baja-de-nuevos-casos-de-covid-19/,"El equipo ICOVID Chile, iniciativa liderada por la Universidad de Chile, la Pontificia Universidad Católica de Chile y la Universidad de Concepción, presentó su informe número 40 con análisis y",14-05-2021 23:15,https://www.bing.com/th?id=OVFT.boBE3yaJlNL9JfzOjLa1yC,Chile,La Discusión
Revelan que exconcursante de MasterChef pidió hablar con su esposa antes de ser intubado por covid-19,https://www.adnradio.cl/tiempo-libre/2021/05/14/revelan-que-exconcursante-de-masterchef-pidio-hablar-con-su-esposa-antes-de-ser-intubado-por-covid-19.html,"Giovanni Cárdenas, exconcursante de la cuarta temporada de MasterChef Chile, se encuentra internado en la Clínica Indisa producto de complicaciones derivadas del covid-19. Incluso debió ser intubado y",15-05-2021 00:57,https://www.bing.com/th?id=OVFT.PsnmRP4s0pWBiwmYLghgIy,Chile,ADN
Paris se equivocó con las cuentas proyectando menos de la mitad de casos COVID-19 para la semana preelectoral,https://www.elciudadano.com/chile/paris-se-equivoco-con-las-cuentas-proyectando-menos-de-la-mitad-de-casos-covid-19-para-la-semana-preelectoral/05/14/,Instan a los electores y electoras a no bajar la guardia ante el COVID-19 y conservar las medidas de bioseguridad.,15-05-2021 01:44,https://www.bing.com/th?id=OVFT.1XmArYWddI5JW_MlECK0Ay,Chile,El Ciudadano
Parques Vergara y Rioja de Viña del Mar reabrirán al público desde el lunes 17 de mayo,https://www.puranoticia.cl/noticias/regiones/parques-vergara-y-rioja-de-vina-del-mar-reabriran-al-publico-desde-el/2021-05-14/215920.html,"Todos los recintos permanecerán cerrados durante los fines de semana, mientras Viña del Mar se encuentre en la Fase 2 de «Transición» del plan Paso a paso.",15-05-2021 02:33,https://www.bing.com/th?id=OVFT.YiS9qYfTupbmxEBeyxWrUy,Chile,Puranoticia.cl
Covid-19 y potencial impacto en función vascular placentaria con mirada futura,https://www.diarioconcepcion.cl/ciencia-y-sociedad/2021/05/15/covid-19-y-potencial-impacto-en-funcion-vascular-placentaria-con-mirada-futura.html,Evidencia muestra que el patógeno genera alteraciones en este órgano clave en la gestación y el conocimiento previo indica que hay efectos de corto y largo plazo en niños gestados en condiciones de pa,15-05-2021 03:06,https://www.bing.com/th?id=OVFT.olcDnxgGgrkpu79fFe1pkC,Chile,El Diario de Concepcion
Hacia un nuevo pacto de dignidad con las mujeres,https://www.elmostrador.cl/braga/2021/05/15/hacia-un-nuevo-pacto-de-dignidad-con-las-mujeres/,"Mucho más que una crisis sanitaria, social y económica ha significado la pandemia. Su arribo a Chile trajo, además, la pérdida de miles de puestos laborales ocupados por mujeres, lo que ha derivado en",15-05-2021 05:02,https://www.bing.com/th?id=OVFT.0A6R9otdWQVBU6_w7JCHXC,Chile,El Mostrador
Alberto Dougnac: “A ningún paciente Covid-19 le faltó cama UCI”,https://www.latercera.com/la-tercera-sabado/noticia/alberto-dougnac-a-ningun-paciente-covid-19-le-falto-cama-uci/G52YIL3UZNEMXHXV26G4IE4J4Q/,"A casi un mes de registrarse la mayor ocupación de camas críticas de toda la pandemia, el subsecretario de Redes Asistenciales hace un balance: señala que hoy el sistema sanitario está menos presionad",15-05-2021 05:11,https://www.bing.com/th?id=OVFT.XF8qrlxzSWK7E5_UvI8auS,Chile,LA TERCERA
Cuarentenas: Conoce todas las comunas que permanecen en confinamiento total en Chile,https://www.meganoticias.cl/dato-util/336477-minsal-comunas-cuarentena-hoy-fase-1-covid-cog23.html,"Para contener la pandemia de Covid-19 en Chile, el Ministerio de Salud ha establecido cuarentenas totales en diversas comunas del país. Conoce el listado de comunas aquí.",15-05-2021 09:00,https://www.bing.com/th?id=OVFT.a49AzrVhuCyVw3JUZW1LvC,Chile,meganoticias
Elecciones: 24 preguntas y respuestas del trascendental proceso de este fin de semana,http://www.lanacion.cl/elecciones-24-preguntas-y-respuestas-del-trascendental-proceso-de-este-fin-de-semana/,"Este 15 y 16 de mayo se realizarán las elecciones para elegir a los convencionales constituyentes, los gobernadores regionales, alcaldes y concejales. Según datos del padrón electoral entregado por el",15-05-2021 10:45,https://www.bing.com/th?id=OVFT.UeR3ubaPyOts7ENd2qVnIy,Chile,La Nación
