name,url,description,datePublished,imagen,pais,Fuente
OvejeroNoticias Ministerio de Transportes amplía opciones ...,https://www.ovejeronoticias.cl/2020/05/91133/,* Contraloría aprobó resolución que permitirá a los transportistas realizar labores como traslado de insumos y otras. El cambio busca paliar el impacto que les ha generado las suspensiones de clases y,20-05-2020 15:30,https://www.bing.com/th?id=ON.2988C82A278AACAE1BA800D9B84DC8B4,Chile,Ovejero Noticias
Alcaldes y reparto de canastas familiares: Vamos a ...,http://lanacion.cl/2020/05/20/alcaldes-y-reparto-de-canastas-familiares-vamos-a-priorizar-los-barrios-vulnerables/,"“A los barrios donde vamos a estar llegando son barrios que han sido duramente golpeados por la pandemia”, señaló el presidente de la Asociación de Municipalidades de Chile, Rodrigo Delgado, al confir",20-05-2020 15:31,https://www.bing.com/th?id=ON.2A0B3192022F6AD8B61A12910DDB8AF0,Chile,La Nación
Covid-19: Aldeas SOS pone a disposición recintos en Ñuble ...,https://www.diarioconcepcion.cl/ciudad/2020/05/20/covid-19-aldeas-sos-pone-a-disposicion-recintos-en-nuble-y-chiguayante.html,"Dada la difícil situación que plantea el coronavirus y la necesidad urgente de lugares, tanto para la habilitación de centros hospitalarios de emergencia o para residencias sanitarias de aislamiento,",20-05-2020 15:33,https://www.bing.com/th?id=ON.90A7B3F1B3CB5BB63B227F57B454D6C2,Chile,El Diario de Concepcion
alerceweb.cl | 400 agricultores podrán regularizar sus ...,https://alerceweb.cl/index.php/2020/05/20/400-agricultores-podran-regularizar-sus-titulos-de-dominios-gracias-a-convenio-indap-bienes-nacionales/,"El acuerdo permitirá a pequeños productores poner en regla títulos de dominio de propiedades agrícolas para acceder a créditos y programas de INDAP, como también de otros servicios públicos. En la bús",20-05-2020 15:40,https://www.bing.com/th?id=ON.D20AE1C017E4733FF90DE493E8B5D7A8,Chile,Alerce Web
Integrantes de programa de televisión a cuarentena por ...,http://www.elmagallanews.cl/noticia/sociedad/integrantes-de-programa-de-television-cuarentena-por-senador-que-tiene-covid-19,"Durante esta jornada se confirmó que el Senador José Manuel Ossandón dio positivo por Covid-19. El legislador es el tercer contagiado del Congreso, por lo que su anuncio generó que los integrantes del",20-05-2020 15:44,https://www.bing.com/th?id=ON.E6B0A8B92757CE1BD7BC83D77A3F73ED,Chile,El Magallanews
Goldman Sachs: la mayoría de las economías de la región ...,https://www.radiosantiago.cl/archivo/130557,"Economistas de Goldman Sachs rebajaron el panorama económico de América Latina en 2020 por la pandemia del coronavirus a un 7,6%, la que sería la mayor desaceleración registrada, y dijeron que volver",20-05-2020 15:45,https://www.bing.com/th?id=ON.ABA3DCEB0BA3C2C471235DACE760DF0E,Chile,Radio Santiago
Entregan detalles sobre cordones sanitarios y permisos de ...,http://www.elmagallanews.cl/noticia/sociedad/entregan-detalles-sobre-cordones-sanitarios-y-permisos-de-desplazamiento,"Como parte del reporte diario COVID-19 de la región de Magallanes, el Seremi de Salud (S), Sergio Ruiz, entregó información acerca de los diversos dispositivos de control sanitario instalados para hac",20-05-2020 15:53,https://www.bing.com/th?id=ON.5ADC4FDD96A5AE4233688048B17D2F0D,Chile,El Magallanews
Chile y otros dos países sudamericanos aparecen en el ...,https://www.radiosantiago.cl/archivo/130532,"La pandemia de coronavirus tiene en vilo a todo el mundo y hasta este martes 19 de mayo la cantidad de personas que contrajeron la enfermedad ascendió a 4.889.287, mientras que los muertos a causa de",20-05-2020 15:58,https://www.bing.com/th?id=ON.D19184F8B12AD239AE2D54F546B26970,Chile,Radio Santiago
Visviri: Cómo se vive la pandemia donde comienza Chile,https://www.theclinic.cl/2020/05/20/visviri-como-se-vive-la-pandemia-donde-comienza-chile/,“En Arica están encerrados como en una jaula. Siempre yo bajaba y subía porque mis hijas viven allá. Pero desde marzo me vine y ya no he vuelto a bajar. Acá estamos más aislados. No tengo mucha comuni,20-05-2020 16:00,https://www.bing.com/th?id=ON.F0F443EB02A91B6453E09B01836157CF,Chile,Clinic
"Mascarillas obligatorias, entre otras: Viña del Mar ...",http://www.elmartutino.cl/noticia/sociedad/mascarillas-obligatorias-entre-otras-vina-del-mar-endurece-medidas-para-prevenir-pr,"Con el fin de aumentar las medidas para prevenir la propagación del virus Covid-19, la alcaldesa Virginia Reginato envió para su aprobación en el Concejo Municipal, la Ordenanza Municipal sobre Uso Ob",20-05-2020 16:02,https://www.bing.com/th?id=ON.25B256B3C5532E707C816D5750D85FF5,Chile,Mar
Jean Paul Luksic: “Chile ahora debe enfrentar el desafío ...,https://www.latercera.com/pulso/noticia/jean-paul-luksic-chile-ahora-debe-enfrentar-el-desafio-de-abordar-los-problemas-sociales-y-mejorar-el-bienestar-de-las-personas/ZLFIMSTALRF3BODF4KT35MUZ24/,"En medio del difícil contexto a raíz de los efectos del estallido social y el coronavirus en la actividad y el mercado laboral, el presidente de Antofagasta Plc, Jean Paul Lulsic, realizó un llamado a",20-05-2020 16:03,https://www.bing.com/th?id=ON.B6052624282DFFEB12F94C6336D6AD73,Chile,LA TERCERA
"Minsal informa nueva categoría de Covid-19 en Chile: ""caso ...",https://www.biobiochile.cl/noticias/nacional/chile/2020/05/20/minsal-informa-cambio-definicion-toda-persona-tenga-infeccion-respiratoria-seria-covid-19.shtml,"Estamos recopilando más antecedentes sobre esta noticia, quédate atento a las actualizaciones. Durante un nuevo balance entregado por el Minsal respecto a la situación de contagios en el país, el mini",20-05-2020 16:04,https://www.bing.com/th?id=ON.48F9A71AC28DB9C60622DE92EB436B78,Chile,Chile
Plasma de recuperados de COVID-19 comenzaría a aplicarse a ...,https://www.lacuarta.com/cronica/noticia/tratamiento-plasma-pacientes-covid-19/499045/,"Actualmente, la tecnología sólo está siendo usada en algunos de los pacientes COVID-19 positivo que llegan a las unidades de cuidados intensivos y que sus vidas están en riesgo. Buenas noticias para c",20-05-2020 16:07,https://www.bing.com/th?id=ON.BAB2BFAD79AA420CB622E81715D1AD95,Chile,La Cuarta
Minsal reportó 35 muertes por Covid-19 en las últimas 24 ...,https://www.adnradio.cl/nacional/2020/05/20/minsal-reporto-35-muertes-por-covid-19-en-las-ultimas-24-horas-la-cifra-diaria-mas-alta-a-la-fecha.html,"El ministerio de Salud informó que 35 personas murieron por coronavirus Covid-19, en las últimas 24 horas, de acuerdo con el informe cerrado a las 21:00 horas del 19 de mayo. El número diario es el má",20-05-2020 16:11,https://www.bing.com/th?id=ON.03DB45623555CF7A9709B3D077495C28,Chile,ADN
Reportan 4.038 nuevos casos de coronavirus en Chile: Total ...,https://eltipografo.cl/2020/05/reportan-4-038-nuevos-casos-de-coronavirus-en-chile-para-un-total-de-53-617-contagiados/,"Este miércoles, durante el balance diario sobre coronavirus, Paula Daza, Subsecretaria de Salud Pública,  reportó 4.038 nuevos casos de coronavirus  en el país. Con este nuevo informe, la cifra de con",20-05-2020 16:11,https://www.bing.com/th?id=ON.5141855C189F7E8EE40A9DE8C02C785F,Chile,eltipografo.cl
El Covid-19 muy lejos de ceder: Minsal reporta 4.038 ...,https://www.latercera.com/que-pasa/noticia/el-covid-19-muy-lejos-de-ceder-minsal-reporta-4038-nuevos-contagiados-y-35-fallecidos-las-mayores-cifras-desde-el-inicio-de-la-pandemia/EHBYM67NXFGPRDWOMMRUJOAOME/,"Casi al mediodía, el Ministerio de Salud (Minsal) informó que en todo Chile se registraron, al cierre de ayer a las 21.00 horas, 4.038 casos nuevos de coronavirus, la mayor cifra desde que se inició l",20-05-2020 16:12,https://www.bing.com/th?id=ON.450721E66A12BBE49C87FB53C0C2CA0D,Chile,LA TERCERA
4.038 casos nuevos de Covid-19 en Chile que totaliza 53 ...,https://www.itvpatagonia.com/noticias/4-038-casos-nuevos-de-covid-19-en-chile-que-totaliza-53-617-diagnosticados-35-fallecidos-en-la-ultima-jornada/,"El Ministerio de Salud informó que durante las últimas 24 horas se registraron 4,038 nuevos casos de contagio por Covid-19 en el país, nueva cifra récord diaria, lo que eleva la cifra total de infecta",20-05-2020 16:12,https://www.bing.com/th?id=ON.E648F3A19E717709BB97F42A2E9FFBC3,Chile,ITV
Financial Times comparó exceso de muertes en Chile con ...,https://www.cooperativa.cl/noticias/sociedad/salud/coronavirus/financial-times-comparo-exceso-de-muertes-en-chile-con-otros-paises-tras/2020-05-20/112753.html,La pandemia ha dejado más de 300 mil personas fallecidas en el mundo. En los últimos días la mayor preocupación surge desde América. El Ministerio de Salud ha informado más de 500 muertes en el país a,20-05-2020 16:12,https://www.bing.com/th?id=ON.65F97E913A6525417C804301E45608C4,Chile,Radio Cooperativa
Cifras de coronavirus dan nuevo salto en Chile ...,https://www.puranoticia.cl/noticias/nacional/cifras-de-coronavirus-dan-nuevo-salto-en-chile-reportan-4-038-casos/2020-05-20/120850.html,"904 pacientes se encuentran hospitalizados en Unidades de Cuidados Intensivos (UCI), de los cuales 758 se encuentran con ventilación mecánica. 4.038 son los casos nuevos diagnosticados con coronavirus",20-05-2020 16:13,https://www.bing.com/th?id=ON.F697D62BDD319A680B3DF091FDD4E600,Chile,Puranoticia.cl
Revise si recibirá el Ingreso Familiar de Emergencia ...,https://www.puentealtoaldia.com/revise-si-recibira-el-ingreso-familiar-de-emergencia/,"Desde hoy se puede consultar si recibirá el pago automático o si deberá solicitar el Ingreso de Emergencia del Gobierno de Chile. Para hacerlo, deberá ingresar en http://ingresodeemergencia.cl y revis",20-05-2020 16:18,https://www.bing.com/th?id=ON.A3EE894BB90F5B253BE27F9A849A3806,Chile,Puente Alto al Dia
Cada día peor: Minsal registró más de 4 mil casos nuevos y ...,https://www.publimetro.cl/cl/noticias/2020/05/20/minsal-coronavirus-balance-peor.html/,La crisis sanitaria del covid-19 no deja de pegarle fuertemente a Chile y este miércoles se registró el número más altos de casos confirmados y de pacientes fallecidos desde que se inició la pandemia.,20-05-2020 16:19,https://www.bing.com/th?id=ON.3699CC8F6E9A2186E22AB2A05FDE34B4,Chile,publimetro.cl
Chile registra nuevo peak de muertos y contagios diarios ...,https://www.24horas.cl/coronavirus/chile-registra-nuevo-peak-de-muertos-y-contagios-diarios-de-coronavirus-4189620,"El Ministerio de Salud entregó un nuevo balance respecto de la pandemia de coronavirus COVID-19 en Chile, indicando que en las últimas 24 horas se reportó un nuevo peak de contagios y fallecidos, lleg",20-05-2020 16:18,https://www.bing.com/th?id=ON.BE0953199511AD8FAF5260FDBE61D407,Chile,24 Horas Chile
Chile supera los 5 mil contagios por covid-19: sumó 4.038 ...,https://www.diarioconcepcion.cl/pais/2020/05/20/chile-supera-los-5-mil-contagios-por-covid-19-sumo-4-038-nuevos-casos-en-la-ultima-jornada.html,"El Ministerio de Salud (Minsal) anunció este miércoles que hay 53.617 casos confirmados de covid-19 en Chile, lo que significa un aumento de 4.038 contagios (3.647 con síntomas y 391 asintomáticos) re",20-05-2020 16:18,https://www.bing.com/th?id=ON.B5792617F18D178A476DEF79C5C78A28,Chile,El Diario de Concepcion
Chile registra nuevo récord de 4.038 casos de COVID-19 en ...,https://www.lacuarta.com/cronica/noticia/reporte-coronavirus-contagio/499143/,"Desde el Ministerio de Salud informaron que los contagios totales se elevaron a 53.617 casos. Este miércoles, las autoridad sanitaria actualizó las cifras por COVID-19 que ya lleva 12 semanas desde la",20-05-2020 16:20,https://www.bing.com/th?id=ON.30168319F14E3AA05977465E9882F23F,Chile,La Cuarta
"Covid-19: Chile superó los 50 mil contagios, con 544 ...",https://www.cooperativa.cl/noticias/sociedad/salud/coronavirus/covid-19-chile-supero-los-50-mil-contagios-con-544-muertos-y-22-504/2020-05-20/102905.html,"Se registró una cifra récord de 35 nuevos muertos en las últimas 24 horas. El Ministerio de Salud informó que durante las últimas 24 horas se registraron 4,038 nuevos casos de contagio por Covid-19 en",20-05-2020 16:20,https://www.bing.com/th?id=ON.3C7068EC66CF1C7AE807ACA41BDBC31E,Chile,Radio Cooperativa
Covid-19: Chile supera los 50 mil casos totales y alcanza ...,https://www.latribuna.cl/nacional/2020/05/20/covid-19-chile-supera-los-50-mil-casos-totales-y-alcanza-544-muertos.html,"El Ministerio de Salud reportó 4.038 casos nuevos de Covid-19, de los cuales 3.647 tuvieron síntomas y 391 fueron asintomáticos. En total, han existido 53.617 casos totales y 22.504 se han recuperado.",20-05-2020 16:22,https://www.bing.com/th?id=ON.F32E5E42D00FF5D384A36A9F90147BBA,Chile,La Tribuna
35 personas fallecieron el último día por Covid-19: cifra ...,https://www.puranoticia.cl/noticias/nacional/35-personas-fallecieron-el-ultimo-dia-por-covid-19-cifra-es-la-mas-alta/2020-05-20/122657.html,"35 personas fallecieron durante las últimas 24 horas en Chile a causa del coronavirus Covid-19. Así lo informó la subsecretaria de Salud Pública, Paula Daza, durante el último balance de la pandemia,",20-05-2020 16:27,https://www.bing.com/th?id=ON.88A88D2EE7C5A8E50AEA6C38E61DCC28,Chile,Puranoticia.cl
Se dispararon las cifras: 4.038 nuevos casos y 35 ...,https://www.elperiscopio.cl/destacado-1/se-dispararon-las-cifras-4-038-nuevos-casos-y-35-fallecidos-por-coronavirus-en-24-horas/,"Durante esta jornada, y en la ya habitual conferencia de prensa que entrega el ministerio de Salud, se informó que en Chile se registró 35 muertes, 4.038 nuevos casos, lo que suma un total de 53.617 l",20-05-2020 16:29,https://www.bing.com/th?id=ON.5A65CE5712208931F3E81996BB808A0B,Chile,elperiscopio.cl
Ministro Mañalich informó que habrá nueva categoría de ...,https://www.adnradio.cl/nacional/2020/05/20/ministro-manalich-informo-que-habra-nueva-categoria-de-caso-probable-estos-seran-las-caracteristicas.html,"El ministro de Salud, Jaime Mañalich, entregó varios detalles relevantes en torno al contexto en el que se está desarrollando la pandemia del coronavirus Covid-19 en Chile. Lo primero que expuso la au",20-05-2020 16:30,https://www.bing.com/th?id=ON.5917F7341FDCC6356968A1B54BE47CFE,Chile,ADN
"Qué es un ""caso probable"" de coronavirus - Coronavirus ...",https://www.24horas.cl/coronavirus/que-es-un-caso-probable-de-coronavirus-4189968,"El Ministerio de Salud informó que, a partir de este miércoles, se decidió agregar la categoría ""caso probable"" a la medición que se hace para analizar a los pacientes con coronavirus COVID-19. Según",20-05-2020 16:29,https://www.bing.com/th?id=ON.AE9D089E0539A214441AB6BBF3D851E6,Chile,24 Horas Chile
"Exmandatario Ernesto Samper: ""Creo que un mundo en el que ...",https://www.elciudadano.com/entrevistas/exmandatario-ernesto-samper-creo-que-un-mundo-en-el-que-lidera-rusia-y-china-seria-mucho-mejor-que-el-actual/05/20/,"La pandemia del COVID-19 también es una epidemia de la biopolítica, ya que los presidentes Donald Trump, de EE.UU., y Jair Bolsonaro, de Brasil, la utilizan para sacar beneficio electoral, dijo el exp",20-05-2020 16:34,https://www.bing.com/th?id=ON.55CAAAB48F9B48361D661198EC9C5516,Chile,El Ciudadano
Covid-19: Nuevas cifras record dejan 35 nuevos fallecidos ...,https://www.redbiobio.com/nacional/covid-19-nuevas-cifras-record-dejan-35-nuevos-fallecidos-y-mas-de-50,"Durante las últimas 24 horas se informó el fallecimiento de 35 personas, mientras que los casos fueron 4.038. Como ha sido común durante los últimos días, la cifra de contagios se ha elevado proporcio",20-05-2020 16:35,https://www.bing.com/th?id=ON.91A0E7E17B160413611E560B2F36BBF9,Chile,Red Bio Bio
"Vecinos protestan en La Pintana: ""El 90% de la villa está ...",https://www.puentealtoaldia.com/visiten-a-los-contagiados-vecinos-protestan-en-la-pintana/,"Primero fue en El Bosque, hoy son los vecinos de la Pintana quienes se manifiestan en San Juan Bautista con Venancia Leiva por falta de alimentos, atención de salud, solicitando la presencia de las au",20-05-2020 16:40,https://www.bing.com/th?id=ON.5BD5D3160E491038AFC366E3B5287156,Chile,Puente Alto al Dia
Caso de Covid-19 al interior del CAR obliga a 13 ...,https://www.elmostrador.cl/dia/2020/05/20/caso-de-covid-19-al-interior-del-car-obliga-a-13-deportistas-del-team-chile-a-realizar-cuarentena/,"Un trabajador en el área del casino del Centro de Alto Rendimiento del Estadio Nacional dio positivo en test de coronavirus, obligando a 13 deportistas del Team Chile que hospedan en el lugar, mantene",20-05-2020 16:53,https://www.bing.com/th?id=ON.5CAFA041EF7CF37C78AF583951091425,Chile,El Mostrador
Chile supera los 500 fallecidos por COVID-19 y se acerca a ...,https://www.cnnchile.com/coronavirus/minuto-a-minuto-coronavirus-chile-18-de-mayo-2_20200520/,Chile vivió una de sus jornadas más duras desde el inicio de la pandemia del coronavirus en el país: el Ministerio de Salud consignó que en las últimas 24 horas se registraron 31 fallecidos y 3.520 nu,20-05-2020 16:56,https://www.bing.com/th?id=ON.549FED8415A9B548CE1AEB5482660DE9,Chile,CNN Chile
Parlamentarios y dirigentes defienden elección de ...,https://elpinguino.com/noticia/2020/05/20/parlamentarios-y-dirigentes-defienden-eleccion-de-gobernadores,"La pandemia obligó a reagendar todo el calendario electoral, lo que podría poner en riesgo ala elección de Gobernadores Regionales La pandemia del Covid-19 obligó a reagendar todo el calendario electo",20-05-2020 17:05,https://www.bing.com/th?id=ON.FDC2AB4B1A75FA285337AA9031B7C92C,Chile,ELPINGUINO
Covid-19 avanza sin cesar y marca otro récord consecutivo ...,https://elpinguino.com/noticia/2020/05/20/covid-19-avanza-sin-cesar-y-marca-otro-record-consecutivo-4038-nuevos-casos-y-35-muertos-en-un-dia,"Chile volvió a romper sus propios récords este miércoles, luego de que se reportaran 4.038 casos nuevos y 35 decesos por coronavirus. Con esto, el total de contagios llega a los 53.617 y a las 544 mue",20-05-2020 17:05,https://www.bing.com/th?id=ON.BCC326180BE40BD8E1B4C3660752F959,Chile,ELPINGUINO
La creativa forma de entrenar de canoístas del Maule ...,http://www.elamaule.cl/noticia/deporte/la-creativa-forma-de-entrenar-de-canoistas-del-maule-durante-el-encierro-fotos,Tres competencias de alto nivel figuran en el calendario oficial del Canotaje federado para el II semestre del año en curso. En agosto debiera disputarse el Campeonato de 2.000 metros en el Lago Colbú,20-05-2020 17:07,https://www.bing.com/th?id=ON.1B08BE6D0294938459273C2B75DFE22E,Chile,elamaule.cl
