name,url,description,datePublished,imagen,pais,Fuente
Chile supera los 11 mil casos diarios de covid-19,https://radioportales.cl/sitio/chile-supera-los-11-mil-casos-diarios-de-covid-19/,"virus en el país llegó a 3 millones 783 mil 945, 3 millones 686 mil 307, 37 mil 891 activas de contagiar. En cuanto a los decesos, según el DEIS, hubo 31 fallecidos, para un total de 58 mil 36 en el p",09-06-2022 16:08,https://www.bing.com/th?id=OVFT.pyfHyoS65CTz4wjTv7u6NS,Chile,Radio Portales
COVID-19: Se han administrado casi 58 millones de dosis en Chile,https://www.radioagricultura.cl/nacional/2022/06/10/covid-19-se-han-administrado-casi-58-millones-de-dosis-en-chile/,El Ministerio de Salud informó este viernes que hasta la fecha se han administrado casi 58 millones de dosis contra el Covid-19,10-06-2022 16:15,https://www.bing.com/th?id=OVFT.TVx9bSBpMhY5SecsGht60C,Chile,Radio Agricultura
Brote de Covid-19 en hospital de Lolol alcanzó a 24 personas entre personal y pacientes,https://eltipografo.cl/2022/06/brote-de-covid-19-en-hospital-de-lolol-alcanzo-a-24-personas-entre-personal-y-pacientes-a,"Hasta 24 personas estuvieron contagiadas por el brote de Covid-19 en el hospital de Lolol, situación que se mantuvo así hasta el pasado viernes. Hoy lunes consultada la situación en dicho recinto hosp",13-06-2022 15:24,https://www.bing.com/th?id=OVFT.ar1LIe-SLLIn5Vhyi6fHzi,Chile,eltipografo.cl
Casos siguen al alza: Chile reporta 11.754 nuevos contagios de COVID-19 este jueves,https://www.t13.cl/noticia/nacional/casos-alza-chile-reporta-11.754-contagios-covid-19-jueves-16-06-2022,"El Departamento de Estadísticas e Información de Salud (DEIS) confirmó la muerte de 36 pacientes, por lo que la cifra de fallecidos aumentó a 58.171.",16-06-2022 14:15,https://www.bing.com/th?id=OVFT.TdH9Ov900CVygznpdzfzGi,Chile,T13
Covid-19: Chile bordea los 12 mil casos y anota la cifra más alta desde marzo,https://www.infinita.cl/noticias/2022/06/16/covid-19-chile-marzo-casos.html,"Durante la jornada de este jueves, el Ministerio de Salud confirmó un total de 11.754 casos nuevos de Covid-19 en",16-06-2022 16:48,https://www.bing.com/th?id=OVFT.1FlQrE_xmUubNUUfKTzG2S,Chile,Radio Infinita
Covid 19: Chile registró la mayor cifra diaria desde marzo,https://radioportales.cl/sitio/covid-19-chile-registro-la-mayor-cifra-diaria-desde-marzo/,"El Minsal reportó este jueves 11 mil 754 casos nuevos de COVID-19, 6 mil 518 sintomáticos, mil 824 asintomáticos Además, y 3 mil 412 con test PCR Positivo no notificados. La cifra total de personas af",16-06-2022 17:55,https://www.bing.com/th?id=OVFT.7ESmbZfelCuQkzLQrVvkry,Chile,Radio Portales
Un millón por contagiado: China ofrece recompensas por delatar casos positivos de Covid-19,https://www.theclinic.cl/2022/06/17/china-recompensas-casos-covid/,Autoridades del área rural de China señalaron que sus residentes que acusen a contagiados de Covid-19 recibirán una recomensas.,17-06-2022 14:43,https://www.bing.com/th?id=OVFT.NKZpzunhrkI4m-QLIRbmyS,Chile,Clinic
