name,url,description,datePublished,imagen,pais,Fuente
El Reino Unido sumó 717 nuevas muertes por coronavirus y ...,https://www.radiosantiago.cl/archivo/126568,"La pandemia de coronavirus dejó otros 717 muertos en Reino Unido, con lo que ya suman 11.329 los decesos causados por la COVID-19 en suelo británico. Además, casi 4.500 personas dieron positivo a la COVID-19 en las últimas 24 horas, lo que eleva a casi 89.000 los infectados desde el inicio de la",13-04-2020 15:11,https://www.bing.com/th?id=ON.51DF31B11CD3FBA2619E7D35E117013A&pid=News,Chile,Radio Santiago
Ya hay 114 mil 185 fallecimientos por covid-19 en el mundo,https://lasillarota.com/mundo/ya-hay-114-mil-185-fallecimientos-por-covid-19-en-el-mundo-coronavirus-oms-pandemia-contagios/380381,"De acuerdo con la estimación de la propagación del virus que elabora la Universidad John Hopkins, en Estados Unidos hay 556 mil 44 personas enfermas de covid-19 y 22 mil 73 personas fallecidas, con casi siete mil casos ocurridos únicamente en la ciudad de Nueva York, uno de los destinos",13-04-2020 15:04,https://www.bing.com/th?id=ON.343E5429D3A0F1D3BDF0B6018CADF8C5&pid=News,Chile,La Silla Rota
Dos nuevos fallecidos por la pandemia: cifra de ...,https://www.puranoticia.cl/noticias/nacional/dos-nuevos-fallecidos-por-la-pandemia-cifra-de-decesos-asciende-a-82/2020-04-13/105600.html,"Subsecretaria de Salud Pública, Paula Daza, informó que estos dos fallecidos eran adultos mayores que se encontraban con patologías asociadas. A 82 personas aumentó la cantidad de fallecidos producto de la propagación del coronavirus Covid-19 en Chile. Esto, luego de reportarse dos casos nuevos",13-04-2020 14:57,https://www.bing.com/th?id=ON.16DB7FFF71AE803C96C6B7E1B03B0728&pid=News,Chile,Puranoticia.cl
Ecólogos desarrollan modelo de dispersión del COVID-19 ...,https://www.elmostrador.cl/cultura/2020/04/13/ecologos-desarrollan-modelo-de-dispersion-del-covid-19-para-todas-las-comunas-de-santiago/,"Desde sus casas y laboratorios virtuales, investigadores del Instituto de Ecología y Biodiversidad, IEB, están generando herramientas que podrían ayudar a mitigar la actual crisis sanitaria por coronavirus en Chile. Derek Corcoran, junto a un equipo de científicos, desarrolló un modelo",13-04-2020 05:06,https://www.bing.com/th?id=ON.55CB5BCDEC74D00F0EFCB2BF7C92377A&pid=News,Chile,El Mostrador
Gobierno entrega nuevo balance por coronavirus: casos ...,https://www.latercera.com/que-pasa/noticia/gobierno-entrega-nuevo-balance-por-coronavirus-casos-aumentan-a-7213-en-el-pais/AOVVJPEJXBFI7LJGQZXQCOJGVQ/,"Un nuevo balance nacional por el coronavirus (Covid-19) entregaron ese domingo. Esto en el contexto de una visita que realizó el Presidente Sebastián Piñera-junto al titular de Salud, Jaime Mañalich, y el subsecretario de Redes Asistenciales, Arturo Zúñiga- al nuevo hospital Félix Bulnes que",13-04-2020 03:14,https://www.bing.com/th?id=ON.F6C1FC9274DAEEA227335FED7062BC3D&pid=News,Chile,LA TERCERA
¿Cuántos casos y muertes por coronavirus hay en Chile hoy ...,https://larepublica.pe/mundo/2020/04/13/cuantos-casos-y-muertes-por-coronavirus-hay-en-chile-hoy-13-de-abril-atmp/,"Coronavirus en Chile: cifras de casos y fallecidos hoy, lunes 13 de abril Conoce aquí los últimos números y noticias relacionados a los contagios y muertes por COVID-19 en Chile.",13-04-2020 15:13,https://www.bing.com/th?id=ON.353DB42160F2C44CCDB9D16C3593FF15&pid=News,Chile,La República
Confirman 7.525 contagiados y 82 fallecidos en total por ...,https://www.theclinic.cl/2020/04/13/confirman-7-525-contagiados-y-82-fallecidos-en-total-por-covid-19-en-chile/,"Confirman 7.525 contagiados y 82 fallecidos en total por Covid-19 en Chile. ... Paula Daza, señaló que en las últimas horas se registraron 312 casos nuevos de contagiados y dos fallecidos por coronavirus. Compártelo. El ministerio de Salud entregó este lunes un nuevo balance sobre las víctimas de coronavirus en Chile.",13-04-2020 14:51,https://www.bing.com/th?id=ON.ABECCA89891EA71CEFFF4F36986A1ED1&pid=News,Chile,Clinic
Impuesto a fortunas en Argentina contra COVID-19 - Contenido,https://contenido.com.mx/2020/04/impuesto-a-fortunas-en-argentina-contra-covid-19/,"Impuesto a fortunas en Argentina contra COVID-19 Los bloques oficialistas del Congreso de Argentina elaboran un proyecto de ley que fija un impuesto por única vez a grandes fortunas para financiar la campaña sanitaria y social contra la pandemia del nuevo coronavirus, informaron el lunes legisladores.",13-04-2020 15:01,https://www.bing.com/th?id=ON.AE6DF0F2A867D2573A24D23A83D63321&pid=News,Chile,Contenido
Cómo se vive la pandemia en la Antártica | Tele 13,https://www.t13.cl/noticia/mundo/bbc/coronavirus-como-se-vive-pandemia-antartica,"Cómo se vive la pandemia en la Antártica, único continente que no registra contagios de COVID-19. El virus aún no ha llegado al continente blanco, pero sus pocos habitantes ya están tomando medidas preventivas estrictas.",13-04-2020 11:35,https://www.bing.com/th?id=ON.E97FC30D502940A60DEE367B3887F236&pid=News,Chile,T13
COMUNICADO: Narada aumenta sus donaciones para COVID-19 y ...,https://www.notimerica.com/comunicados/noticia-comunicado-narada-aumenta-donaciones-covid-19-envia-suministros-20-paises-20200413160118.html,"HANGZHOU, China, 13 de abril de 2020 /PRNewswire/ -- Narada ha donado más de 20 000 mascarillas y guantes quirúrgicos a más de 20 países, incluidos Italia, España, Reino Unido y Estados Unidos como re",13-04-2020 15:05,https://www.bing.com/th?id=ON.29279B5B63EF85CE1AE46994E40B779E&pid=News,Chile,notimerica.com
Fact Checking 43: ¿Chile detecta el 100% de sus casos de ...,https://www.latercera.com/que-pasa/noticia/fact-checking-43-chile-detecta-el-100-de-sus-casos-de-covid-19-empresarios-donan-77000000000-al-estado/H7ATV2GSHZEXDGW7U3XGEF4CAQ/,"En él se indican ocho medidas de colaboración de empresas a la crisis del Covid-19 y decisiones tomadas por el Gobierno. Entre estas resalta una que señala: “Empresarios donan al Estado $77.000.000.000”, es decir, un monto que equivale de manera aproximada al 55% de los recursos que puso a disposición el Ministerio de Hacienda a todos ...",13-04-2020 13:06,https://www.bing.com/th?id=ON.57398B80E628FFB372B7A0E7685E0B39&pid=News,Chile,LA TERCERA
Confirman 7 nuevos fallecidos por Covid-19 en Chile | La ...,http://lanacion.cl/2020/04/12/confirman-7-nuevos-fallecidos-por-covid-19-en-chile/,"Confirman 7 nuevos fallecidos por Covid-19 en Chile Según el balance entregado por la subsecretaria de Salud Pública, Paula Daza, de las nuevas víctimas fatales de la enfermedad, uno corresponde a la región de Magallanes, uno de Arica-Parinacota, tres de la Metropolitana, uno de Ñuble y uno de Los Ríos.",13-04-2020 12:38,https://www.bing.com/th?id=ON.FBFE04BC90A2973EEA05858B303C6A75&pid=News,Chile,La Nación
Tres claves para el diseño de la campaña masiva del COVID-19,https://www.elmostrador.cl/noticias/opinion/2020/04/13/tres-claves-para-el-diseno-de-la-campana-masiva-del-covid-19/,El ministro de Salud confirmó la adquisición de los servicios para realizar una campaña de comunicación masiva en el contexto de la crisis del coronavirus en Chile. Ante las reacciones negativas que han surgido en redes sociales criticando la inversión de 400 millones de pesos en una campaña,13-04-2020 10:10,https://www.bing.com/th?id=ON.338876CDC98CB754016BFD151AB9650C&pid=News,Chile,El Mostrador
Ministerio de Salud informa 82 muertos en Chile por ...,https://www.msn.com/es-cl/news/other/ministerio-de-salud-informa-82-muertos-en-chile-por-coronavirus-y-7525-contagios/ar-BB12z1PK,El Gobierno indicó que las dos nuevas víctimas fatales reportadas en las últimas 24 horas corresponden a adultos mayores de la región Metropolitana y Magallanes.,13-04-2020 14:44,https://www.bing.com/th?id=ON.62FB6B5697DA28A18D635191E1FEBD57&pid=News,Chile,MSN
Covid-19: Chile ha tenido 7.525 contagiados y 82 ...,https://www.cooperativa.cl/noticias/sociedad/salud/coronavirus/covid-19-chile-ha-tenido-7-525-contagiados-y-82-fallecidos-por-coronavirus/2020-04-13/101131.html,"El Gobierno detalló cómo se establece la cuarentena en cada comuna. La subsecretaria Paula Daza confirmó 312 nuevos casos de contagios por coronavirus, elevando la cifra total a 7.525 personas con Covid-19. La autoridad detalló que estamos entrando en la sexta semana de la pandemia en el país",13-04-2020 14:58,https://www.bing.com/th?id=ON.0B355585293A00E8DF707C26B24D8531&pid=News,Chile,Radio Cooperativa
"Chile tiene 7.525 personas contagiadas, tras... | Puranoticia",https://www.puranoticia.cl/noticias/nacional/chile-tiene-7-525-personas-contagiadas-tras-informarse-312-casos-nuevos/2020-04-13/104810.html,"El último reporte diario del Ministerio de Salud, en base a datos recopilados entre las 21:00 horas del sábado y las 21:00 horas del domingo, arrojó que Chile tiene 7.525 personas contagiadas, luego de informarse 312 nuevos casos con coronavirus Covid-19.",13-04-2020 14:50,https://www.bing.com/th?id=ON.9CA46B132EE2D0B0684887154B53625F&pid=News,Chile,Puranoticia.cl
Coronavirus en Chile: xx muertes y xx contagiados con ...,https://www.t13.cl/noticia/nacional/chile-coronavirus-nueva-cifra-lunes-13-de-abril,"Durante este lunes, el Gobierno entregó una actualización sobre el coronavirus en Chile. En ese sentido, detalló que dos personas han muerto a causa del COVID-19 en las últimas 24 horas, mientras que el número de contagiados aumentó cifrando el total en 7.525. El balance fue entregado por la",13-04-2020 14:35,https://www.bing.com/th?id=ON.498929C8D0E99FE21BBB91EA3D9ADF0F&pid=News,Chile,T13
Chile llegó a 82 fallecidos y 7.525 contagiados a causa ...,https://www.prensafutbol.cl/351773-casos-nuevos-fallecidos-informe-covid19-chile/,Chile llegó a 82 fallecidos y 7.525 contagiados a causa del COVID-19. El último informe entregado por el Ministerio de Salud señaló que durante las últimas 24 horas se registraron 312 nuevos contagios y dos nuevos fallecidos.,13-04-2020 15:09,https://www.bing.com/th?id=ON.1848ACF89DD437FF9C14228E8602CE19&pid=News,Chile,Prensafútbol
Covid-19: Chile ha registrado 7.525 casos positivos por ...,https://www.cooperativa.cl/noticias/sociedad/salud/coronavirus/covid-19-chile-ha-registrado-7-525-casos-positivos-por-coronavirus/2020-04-13/101131.html,"El Gobierno detalló cómo se establece la cuarentena en cada comuna. La subsecretaria Paula Daza confirmó 312 nuevos casos de contagios por coronavirus, elevando la cifra total a 7.525 personas con Covid-19. El jefe de Estado detalló que estamos entrando en la sexta semana de la pandemia en el",13-04-2020 14:35,https://www.bing.com/th?id=ON.0B355585293A00E8DF707C26B24D8531&pid=News,Chile,Radio Cooperativa
