name,url,description,datePublished,imagen,pais,Fuente
Liderazgo femenino en tiempos de crisis - El Mostrador,https://www.elmostrador.cl/noticias/opinion/columnas/2020/09/07/liderazgo-femenino-en-tiempos-de-crisis-2/,"Países como Nueva Zelanda, Islandia, Noruega, Finlandia o Alemania han enfrentado la emergencia sanitaria de COVID-19 de una manera sobresaliente, que les ha generado el reconocimiento de la comunidad",07-09-2020 05:35,https://www.bing.com/th?id=ON.B27AFE59A028FC03B6925CD29AD60BC2,Chile,El Mostrador
Minsal reporta 41 decesos y 2.077 casos: Nuevo récord de ...,https://www.emol.com/noticias/Nacional/2020/09/06/997171/Minsal-balance-coronavirus.html,"El Ministerio de Salud (Minsal) entregó este domingo un nuevo balance sobre la situación de coronavirus en el país, donde el ministro de Salud, Enrique Paris, destacó que ""vivimos momentos difíciles e",07-09-2020 05:36,https://www.bing.com/th?id=ON.F9043DC106C9F6B7026620EE1F8B442E,Chile,Emol
Coronavirus en tiempo real: La curva de contagios en Chile ...,https://www.t13.cl/noticia/nacional/6-septiembre-2020-curva-contagios-muertes-coronavirus-chile,Un médico de la región del Maule fue el primer paciente cuyos exámenes por COVID-19 dieron positivos en Chile. El profesional de 33 años llegó al país proveniente de un viaje que incluyó varios destin,07-09-2020 09:28,https://www.bing.com/th?id=ON.4EB3B6C9758AD1F69926470CD8ED2917,Chile,T13
Amenaza por cuarentena – La Discusión,http://www.ladiscusion.cl/amenaza-por-cuarentena/,"Con el objetivo de controlar la expansión del covid-19 en la intercomuna Chillán y Chillán Viejo se decretó una segunda cuarentena, que obliga a las personas a estar confinadas en sus casas, al menos",07-09-2020 10:50,https://www.bing.com/th?id=ON.15F49873726EDFC827CF33936459EC6B,Chile,La Discusión
En Copiapó y Tierra Amarilla no se podrá pedir permiso ...,http://www.chanarcillo.cl/en-copiapo-y-tierra-amarilla-no-se-podra-pedir-permiso-especial-de-fiestas-patrias-por-estar-en-cuarentena/,"El fin de semana, el Ministerio de Salud en la entrega de un nuevo balance del COVID-19 en Chile, fue el ministro vocero de Gobierno, Jaime Bellolio, el que anunció una modificación en el plan de Fies",07-09-2020 11:13,https://www.bing.com/th?id=ON.1386902C9A56A9B01A86276A9F5DAE49,Chile,Diario Chanarcillo
Jóvenes comenzaron el servicio militar en el Regimiento N ...,http://www.chanarcillo.cl/jovenes-comenzaron-el-servicio-militar-en-el-regimiento-n-23-copiapo/,"Con todas las medidas que la emergencia sanitaria del COVID-19 que se vive en la actualidad, se llevó a efecto el proceso de recepción y acuartelamiento de jóvenes que dieron inicio así a su proceso d",07-09-2020 11:13,https://www.bing.com/th?id=ON.C348BF9977B878E000AE3F49E9BF15BB,Chile,Diario Chanarcillo
Seminario Internacional Estado de excepción-excepción del ...,https://www.uchile.cl/agenda/166592/seminario-internacional-estado-de-excepcion-excepcion-del-estado,"El Centro de Estudios de Ética Aplicada de la U. de Chile invita a la segunda sesión ""Gobernanza ética para sociedades equitativas"" del Seminario Internacional ""Estado de excepción-excepción del Esta",07-09-2020 12:39,https://www.bing.com/th?id=ON.7521D829DA9A72FFF3EB981A6BC5B5AC,Chile,uchile.cl
Cifra de víctimas fatales por Covid-19 en el mundo se ...,http://www.lanacion.cl/cifra-de-victimas-fatales-por-covid-19-en-el-mundo-se-acerca-a-890-000/,La pandemia de nuevo coronavirus ha provocado al menos 889.498 muertos en el mundo desde que la oficina de la Organización Mundial de la Salud (OMS) en China dio cuenta de la aparición de la enfermeda,07-09-2020 13:05,https://www.bing.com/th?id=ON.8EE01F19A6998FA625F84EB4424D1E39,Chile,La Nación
Casos activos: Radiografía de los contagiados en el mundo ...,https://www.latercera.com/mundo/noticia/casos-activos-radiografia-de-los-contagiados-en-el-mundo/NPZYHJG5YFEFJCXRFKEHPDYHPE/,"De los 27,2 millones de contagiados por Covid-19 en el planeta, 7 millones son casos activos, es decir, personas infectadas actualmente con PCR positivo y dentro de los 14 días en que pueden transmiti",07-09-2020 13:32,https://www.bing.com/th?id=ON.E15F88918D7E9CE4BE8D463199A2EB92,Chile,LA TERCERA
Cómo identificar síntomas de las alergias y no ...,https://www.24horas.cl/programas/entrevistas/como-identificar-sintomas-de-las-alergias-y-no-confundirlas-con-el-covid-19-4435503,"Departamento de Extranjería: ""Pedimos que no obliguen al Estado de Chile a dar",07-09-2020 14:06,https://www.bing.com/th?id=ON.8CFB64C39DB107DEC07BEE1C781704C2,Chile,24 Horas Chile
Minsal informó 1.764 nuevos casos y hay un total de 424 ...,https://www.adnradio.cl/nacional/2020/09/07/minsal-informo-1-764-nuevos-casos-y-hay-un-total-de-424-274-contagiados-con-covid-19-en-chile.html,"Durante la mañana de este lunes el Ministerio de Salud (Minsal) entregó a través de sus redes sociales un nuevo balance respecto del estado de la pandemia del coronavirus Covid-19 en Chile, informando",07-09-2020 14:12,https://www.bing.com/th?id=ON.1590BAE11F898376F2D7FD92DA5353FE,Chile,ADN
Covid-19 en Chile: 60 personas fallecieron en las últimas ...,https://www.adnradio.cl/nacional/2020/09/07/covid-19-en-chile-60-personas-fallecieron-en-las-ultimas-24-horas-segun-el-deis-2.html,"El Ministerio de Salud informó este lunes que 60 personas murieron producto del Covid-19, en las últimas 24 horas, según el Departamento de Estadísticas e Información de Salud (DEIS). De acuerdo con e",07-09-2020 14:12,https://www.bing.com/th?id=ON.CF3268D4EB6AEE566D169673DEE86C59,Chile,ADN
"Reporte diario: 1.764 nuevos casos Covid, con una ...",https://www.cooperativa.cl/noticias/sociedad/salud/coronavirus/reporte-diario-1-764-nuevos-casos-covid-con-una-positividad-de-5-69/2020-09-07/113407.html,Los fallecidos registrados durante la pasada jornada fueron 60 y llegan en total a 11.652. El Ministerio de Salud reportó este lunes 1.764 nuevos casos confirmados de coronavirus en Chile. Según indic,07-09-2020 15:05,https://www.bing.com/th?id=ON.9A1F9D09A2CA938128F7CE3F9359A9D9,Chile,Radio Cooperativa
Sondeo a trabajadores: 60% ocuparía aguinaldo de fiestas ...,https://www.biobiochile.cl/noticias/economia/tu-bolsillo/2020/09/07/sondeo-a-trabajadores-60-ocuparia-aguinaldo-de-fiestas-patrias-para-pagar-deudas.shtml,"Pese a la pandemia por covid-19 que está azotando a Chile, quienes todavía mantienen sus fuentes de trabajo esperan con ansias sus aguinaldos por Fiestas Patrias, entregados cada año. Pero ¿cómo utili",07-09-2020 15:08,https://www.bing.com/th?id=ON.E6D6E73A8C0F17D06EF62E2F0BB6CE06,Chile,Chile
Magallanes anota nuevo récord de contagios y junto a Bío ...,https://www.biobiochile.cl/noticias/nacional/chile/2020/09/07/magallanes-anota-nuevo-record-de-contagios-y-junto-a-bio-bio-viven-compleja-situacion.shtml,"El Ministerio de Salud reportó este lunes 1.764 nuevos casos por coronavirus y otras 60 muertes por coronavirus, según un balance emitido esta mañana a través del sitio web del Gobierno. Tal como ha s",07-09-2020 15:08,https://www.bing.com/th?id=ON.B2CE6ECF28BA8ED86DE113F5CF3E4D71,Chile,Chile
Minsal reporta 41 fallecidos y 2.077 nuevos casos de ...,https://laprensaaustral.cl/nacional/minsal-reporta-41-fallecidos-y-2-077-nuevos-casos-de-coronavirus-en-las-ultimas-24-horas/,"El Ministerio de Salud (Minsal) entregó este domingo un nuevo balance sobre la situación de coronavirus en el país, donde el ministro de Salud, Enrique Paris, destacó que “vivimos momentos difíciles e",07-09-2020 15:29,https://www.bing.com/th?id=ON.6D69AA19D6CCFD4CE36CE937EA4F9D86,Chile,La Prensa Austral
"La economía chilena sigue estable, ¿cómo puede mejorar ...",https://www.elperiodista.cl/la-economia-chilena-sigue-estable-como-puede-mejorar/,"No obstante, y contra todo pronóstico, la economía chilena ha logrado mantenerse estable. Pese a la llegada amenazadora de la peor recesión de la historia de América Latina, se espera que Chile solo s",07-09-2020 15:54,https://www.bing.com/th?id=ON.5A5F2AB46D45389EB7EEDA1EAFB97731,Chile,El Periodista
Intercambio de servicios chilenos con el exterior se ...,https://www.df.cl/noticias/economia-y-politica/comercio-exterior/intercambio-de-servicios-chilenos-con-el-exterior-se-contrajo-un-24-en/2020-09-07/132220.html,No solo el comercio de bienes chilenos con el resto del mundo se ha resentido en medio de la pandemia. También lo ha hecho el intercambio de servicios. Así lo revela un estudio realizado por la Cámara,07-09-2020 16:48,https://www.bing.com/th?id=ON.AF8019E7A4433B88159C6A953EEF296F,Chile,df.cl
El Ciudadano | Gobierno excluye del criticado plan ...,https://www.elciudadano.com/chile/gobierno-excluye-del-criticado-plan-fondeate-en-casa-a-comunas-en-paso-uno-del-desconfinamiento/09/07/,"El vocero de Gobierno, Jaime Bellolio (UDI), anunció este domingo que se excluirá del  criticado plan «Fondéate en casa» -permiso que permite la reunión con cierto número de personas en Fiestas Patria",07-09-2020 16:49,https://www.bing.com/th?id=ON.1709DC8383E5A66562A65C995AD6B565,Chile,El Ciudadano
Chile acumula más de 424 mil casos de coronavirus | Tele 13,https://www.t13.cl/noticia/nacional/balance-minsal-casos-coronavirus-07-09-2020,"El Ministerio de Salud (Minsal) entregó, durante la mañana de este lunes, un nuevo informe sobre el avance de la pandemia del nuevo coronavirus COVID-19 cuyos primeros casos en el país se registraron",07-09-2020 16:55,https://www.bing.com/th?id=ON.A09EE2E94573B6E9FEF21F6B88AE49F8,Chile,T13
Chile registra 16.905 casos activos y 60 nuevos decesos ...,https://www.diarioconcepcion.cl/pais/2020/09/07/chile-registra-16-905-casos-activos-y-60-nuevos-decesos-por-covid-19.html,"Un nuevo balance entregado este lunes por el Ministerio de Salud informó que Chile registró 60 nuevos decesos inscritos y 1.764 casos positivos de covid-19, durante las últimas 24 horas. Del total de",07-09-2020 17:15,https://www.bing.com/th?id=ON.FF4EA860B3B25915DD17619505A5FC8D,Chile,El Diario de Concepcion
"Covid-19 en Chile: 2.077 nuevos casos, llegando a 422.510 ...",http://www.radioportales.cl/sitio/covid-19-en-chile-2-077-nuevos-casos-llegando-a-422-510-contagiados-totales/,"El ministerio de Salud entregó este domingo un nuevo balance del coronavirus Covid-19 en Chile, dando cuenta de 2.077 nuevos casos, llegando a un total de 422.510 contagiados desde el inicio de la pan",07-09-2020 17:42,https://www.bing.com/th?id=ON.8F1C9C2D523D4C4E7C108F75DFEED951,Chile,Radio Portales
Chile y la ausencia de un plan de formación de ...,https://www.latercera.com/que-pasa/noticia/chile-y-la-ausencia-de-un-plan-de-formacion-de-investigadores-e-investigadoras/GHJD5LXYDRAURPDVN4SRBW234M/,"A raíz de los desafíos presentados por el Covid-19 ha ido quedando de manifiesto, una vez más, que el desarrollo del país no sólo no puede prescindir de la ciencia y el conocimiento, sino que es invia",07-09-2020 17:58,https://www.bing.com/th?id=ON.E0F8C012DC0A80FA3261611672AECF04,Chile,LA TERCERA
Alcalde de Punta Arenas y nueva ola de contagios por ...,https://www.radioagricultura.cl/nacional/2020/09/07/alcalde-de-punta-arenas-y-nueva-ola-de-contagios-por-coronavirus-ha-sido-muy-compleja.html,"Durante este sábado el Ministerio de Salud publicó el informe epidemiológico y reveló que Punta Arenas es la ciudad de Chile con más contagios por coronavirus: 1.026 casos activos, lo que representa e",07-09-2020 18:31,https://www.bing.com/th?id=ON.700D6B4E5028D14CBCDD7320F4274E82,Chile,Radio Agricultura
Aguinaldo Fiestas Patrias: 60% de los trabajadores lo ...,https://www.radioagricultura.cl/economia/2020/09/07/aguinaldo-fiestas-patrias-60-de-los-trabajadores-lo-usaran-para-pagar-deudas.html,"Un estudio reveló cómo los trabajadores y trabajadoras chilenas utilizarán su aguinaldo de Fiestas Patrias, en medio de la pandemia de Covid-19 que afecta al país. Según Chiledeudas.cl, en promedio, l",07-09-2020 18:31,https://www.bing.com/th?id=ON.94AB9FE426587430805A0C124F3DFB0F,Chile,Radio Agricultura
Cuarentena en Chillán y Chillán Viejo: Solicitudes de ...,https://www.cooperativa.cl/noticias/sociedad/salud/coronavirus/cuarentena-en-chillan-y-chillan-viejo-solicitudes-de-permisos-bajaron/2020-09-07/135319.html,Este fin de semana se detuvo a 44 personas por no portar permisos de desplazamiento. Carabineros registró 17.023 solicitudes de permisos temporales y 153 salvoconductos. Su primer fin de semana bajo c,07-09-2020 18:33,https://www.bing.com/th?id=ON.DFD4704FC74470A471697684B8770B0D,Chile,Radio Cooperativa
Residencia Espejo para adultos mayores es remodelada ...,https://www.puentealtoaldia.com/residencia-espejo-para-adultos-mayores-es-remodelada-gracias-al-apoyo-de-cmpc/,"En el lugar, personas de tercera edad podrán residir transitoriamente mientras realizan cuarentena, y gracias a la donación de la empresa contarán con un espacio equipado, cómodo y seguro. La vejez pr",07-09-2020 18:38,https://www.bing.com/th?id=ON.EBC0B2ED0C304C75E74B11E32E359B42,Chile,Puente Alto al Dia
Famae Magallanes da a conocer su aporte al combate del ...,https://www.itvpatagonia.com/noticias/famae-magallanes-da-a-conocer-su-aporte-al-combate-del-covid-19/,"Este centro de mantenimiento fue creado en Punta Arenas el 8 de enero del año 2016, tiene cuatro años de antigüedad y su misión es apoyar a la V División de Ejército y a la Región de Magallanes en el",07-09-2020 18:44,https://www.bing.com/th?id=ON.183DBAE3595D16815870AAD4EF599092,Chile,ITV
Uruguay: Christian Bravo ingresó en victoria de ...,https://www.puranoticia.cl/noticias/deportes/uruguay-christian-bravo-ingreso-en-victoria-de-penarol-sobre-liverpool/2020-09-05/192315.html,"Con este resultado, el cuadro que enfrentará a Colo Colo el 15 de septiembre en el Monumental por Copa Libertadores se ubica en el cuarto lugar con 15 puntos, a cuatro del líder Rentistas. Peñarol, co",07-09-2020 19:20,https://www.bing.com/th?id=ON.2FBD31ADD319D835DBE10BDA84EAB8A4,Chile,Puranoticia.cl
Ipsos: Sebastián Piñera es el tercer Presidente ...,https://www.puranoticia.cl/noticias/internacional/ipsos-sebastian-pinera-es-el-tercer-presidente-mejor-evaluado-por/2020-09-07/101054.html,"La encuesta revela que el listado es liderado por el presidente de Uruguay, Luis Lacalle Pou, quien tiene un 73% de respaldo a su gestión. Casi medio año después de la llegada del Covid-19 a la región",07-09-2020 19:25,https://www.bing.com/th?id=ON.CF59E507EF0D676B0C5138ACE48C5187,Chile,Puranoticia.cl
Covid-19: Chile registra 424.274 casos totales y 11.652 ...,https://www.latribuna.cl/destacados/2020/09/07/covid-19-chile-registra-424-274-casos-totales-y-11-652-fallecidos.html,"En unidades de cuidados intensivos se encuentran internadas 930 personas, de las cuales 669 se encuentran con apoyo de ventilación mecánica y 115 permanecen en estado crítico. Durante la mañana de est",07-09-2020 19:41,https://www.bing.com/th?id=ON.143B53D235B15CD460868417B7C7382E,Chile,La Tribuna
Minera Los Pelambres operará principalmente con agua de ...,http://www.diariolaregion.cl/minera-los-pelambres-operara-principalmente-con-agua-de-mar-a-partir-de-2025/,"La compañía prepara un conjunto de inversiones que presentará al Sistema de Evaluación de Impacto Ambiental (SEIA) en los próximos meses, para lo cual iniciará un proceso voluntario de participación c",07-09-2020 19:47,https://www.bing.com/th?id=ON.968838FA505897CFEFA2DFFF7AB936BF,Chile,La Region
Uniendo esfuerzos por un aire más limpio. - El Rancagüino,https://www.elrancaguino.cl/2020/09/07/uniendo-esfuerzos-por-un-aire-mas-limpio/,Este 7 de septiembre se celebra por primera vez el Día Internacional del Aire Limpio por un cielo azul y recibimos esta nueva efeméride con una buena noticia: en la región metropolitana este invierno,07-09-2020 19:55,https://www.bing.com/th?id=ON.3A3350C86BC619ACF458BB8E07E353CE,Chile,elrancaguino.cl
El cobre no brilló en agosto - Pauta.cl,https://www.pauta.cl/economia/bloomberg/exportaciones-de-cobre-cayeron-11-en-agosto-segun-banco-central,"Chile, el mayor productor de cobre en el mundo, acaba de ofrecer más información sobre por qué los mercados se han estado ajustando últimamente. El país, que había logrado mantener la producción cerca",07-09-2020 20:10,https://www.bing.com/th?id=ON.CC1990EAA44A0F7EFE0237D254B05108,Chile,pauta
Cifra de hospitalizados a causa del Covid-19 en Chile ...,https://redtarapaca.com/nacional/cifra-de-hospitalizados-a-causa-del-covid-19-en-chile-aumenta-a-930,"En el nuevo reporte también se contabilizaron 60 nuevos fallecidos a causa del virus. En un nuevo balance sobre la situación del Covid-19 en Chile, se expuso que en las últimas horas se registraron 93",07-09-2020 20:13,https://www.bing.com/th?id=ON.A960493384866CD427D273CCD6E12C74,Chile,Red Tarapaca
543 fallecidos totales registra O´Higgins según informe ...,https://www.elrancaguino.cl/2020/09/07/543-fallecidos-totales-registra-ohiggins-segun-informe-epidemiologico/,"En el informe entregado hoy la intendencia de la región de O´Higgins se informaron 83 nuevos casos de contagios de Covid 19 llegando a 13 mil 986 casos totales, mientras que la cifra de fallecidos en",07-09-2020 20:17,https://www.bing.com/th?id=ON.405685514541A9134DEA0F2687B09FF7,Chile,elrancaguino.cl
"Jueza Paola Schisano: “Mujeres, personas mayores y menores ...",https://www.latribuna.cl/los-angeles/2020/09/07/jueza-paola-schisano-mujeres-personas-mayores-y-menores-de-edad-se-encuentran-en-especial-situacion-de-vulnerabilidad.html,"Muchas dudas y cuestionamientos se han gestado hacia el Poder Judicial en el último tiempo, en especial cuando se dio a conocer públicamente el femicidio de Ámbar Cornejo y el trasfondo donde se revel",07-09-2020 20:48,https://www.bing.com/th?id=ON.2975ED5B0F15348B08C272563CF66068,Chile,La Tribuna
