name,url,description,datePublished,imagen,pais,Fuente
Pauta Final - 2 de julio de 2021,https://www.pauta.cl/programas/pauta-final/pauta-final-2-de-julio-de-2021,"Conversamos con el constituyente de La Lista del Pueblo Rodrigo Rojas sobre la previa a la ceremonia inaugural de la Convención. Además, hablamos con la subsecretaria de la Niñez, Blanquita Honorato,",02-07-2021 23:02,https://www.bing.com/th?id=OVFT.VTKa1Nivq0pUhPM1sYylvy,Chile,pauta
"Alertan compleja situación para personas mayores de 70 años, contrastando con disminución de casos",http://www.ladiscusion.cl/alertan-compleja-situacion-para-personas-mayores-de-70-anos-contrastando-con/,"El equipo ICOVID Chile, iniciativa liderada por la Universidad de Chile, la Pontificia Universidad Católica de Chile y la Universidad de Concepción, presentó su informe número 47 con análisis y",03-07-2021 00:11,https://www.bing.com/th?id=OVFT.p4Kvj-hS4UJd3qVd2QcdWS,Chile,La Discusión
D. Antofagasta reportó tres casos de Covid-19 al interior de su cuerpo técnico,https://www.puranoticia.cl/noticias/deportes/d-antofagasta-reporto-tres-casos-de-covid-19-al-interior-de-su-cuerpo/2021-07-02/210100.html,Deportes Antofagasta reportó durante la tarde de este viernes la presencia de tres casos de Covid-19 al interior de su cuerpo técnico. El hecho fue confirmado por la institución mediante un comunicado,03-07-2021 01:36,https://www.bing.com/th?id=OVFT.tVzTksn8_9zQD4NapmCEFi,Chile,Puranoticia.cl
"Crimen y violencia se mantienen como la principal preocupación de los chilenos, según Ipsos",https://www.puranoticia.cl/noticias/nacional/crimen-y-violencia-se-mantienen-como-la-principal-preocupacion-de-los/2021-07-02/212059.html,El informe «Preocupaciones del mundo: junio 2021» mostró que el Covid-19 sólo es la tercera causa de inquietud en nuestro país.,03-07-2021 01:54,https://www.bing.com/th?id=OVFT.S7JJRj0cZKoRZCE4w7TUki,Chile,Puranoticia.cl
"Alinco apoya proyecto que pide incluir el Covid-19 en AUGE, GES y Ley ""Ricarte Soto""",http://www.eldivisadero.cl/noticia-63179,"Valparaíso-. Solicitar al Presidente de la República incorporar las enfermedades derivadas del Covid-19, al Régimen General de Garantías Explícitas (GES), al Plan de Acceso Universal de Garantías Expl",03-07-2021 02:34,https://www.bing.com/th?id=OVFT.5cOtYqc9nZDMquXwJTgyay,Chile,Diario el Divisadero
"Minsal reporta 3.880 casos nuevos y 164 decesos: Positividad llegó a 5,20% y vuelve a ser la más baja del año",https://www.emol.com/noticias/Nacional/2021/07/03/1025650/balance-minsal-3-julio-2021.html,Los contagios son más de 1.300 menos que el sábado de la semana pasada. Los contagiantes son 22.809 en todo el territorio nacional.,03-07-2021 04:30,https://www.bing.com/th?id=OVFT.fbXEJB_0dylwPlSB-MRasC,Chile,Emol
Reclaman derechos por sistema de sanitización en base a niebla en Los Ángeles,https://www.latribuna.cl/noticias/2021/07/03/reclaman-derechos-por-sistema-de-sanitizacion-en-base-a-niebla-en-los-angeles.html,"Desde un centro de salud dieron a conocer que el proyecto fue desarrollado por ellos, por lo que analizarían una demanda por plagio en contra de innovador angelino. El acusado, por su parte, precisó q",03-07-2021 05:07,https://www.bing.com/th?id=OVFT.PqwsNbVKxuUBRmtTbONodi,Chile,La Tribuna
Actuar con celeridad frente a la nueva variante del coronavirus,https://www.diarioconcepcion.cl/editorial/2021/07/03/actuar-con-celeridad-frente-a-la-nueva-variante-del-coronavirus.html,Los especialistas no dejan de destacar la importancia de la vacunación en el menor tiempo posible y en línea con la nueva realidad que impone la variante Delta. Un relajo en las medidas sanitarias y u,03-07-2021 07:16,https://www.bing.com/th?id=OVFT.sb7Yhstd4-dGN8rxtbW-9i,Chile,El Diario de Concepcion
"""No es la realidad de las cosas"": Referentes de la Selección responden a críticas por no darle pases a Ben Brereton",https://www.24horas.cl/copaamerica2021/referentes-seleccion-criticas-pases-ben-brereton---4852500,"A través de una transmisión en vivo de Mauricio Isla, Alexis Sánchez y Claudio Bravo salieron al paso de los cuestionamientos de las redes sociales, señalando que ""es difícil generar ocasiones cuando",03-07-2021 08:19,https://www.bing.com/th?id=OVFT.3pcr6LlMULdUS-yiFcFQFS,Chile,24 Horas Chile
Por esta razón Giovanni Cárdenas no pagará $65 millones en gastos médicos tras ser intubado por Covid-19,https://www.radioagricultura.cl/entretencion/2021/07/03/por-esta-razon-giovanni-cardenas-no-pagara-65-millones-en-gastos-medicos-tras-permanecer-intubado-por-covid-19.html,"Ayer te contábamos que Giovanni Cárdenas, ex concursante del programa MasterChef Chile, enfrentaba un angustiante momento. El cocinero debía más de",03-07-2021 11:30,https://www.bing.com/th?id=OVFT.t6i-Tqhl-PwwoPzLrS3fhC,Chile,Radio Agricultura
Ejército y municipio invitan a niños a crear dibujos y pinturas para honrar la bandera,https://laprensaaustral.cl/2021/07/03/ejercito-y-municipio-invitan-a-ninos-a-crear-dibujos-y-pinturas-para-honrar-la-bandera/,"A diferencia de otros años, en que la conmemoración del Día de la Bandera en recuerdo de la Batalla de la Concepción, reunía a miles de familias que llegaban a saludar a los soldados conscriptos, ahor",03-07-2021 12:07,https://www.bing.com/th?id=OVFT.Kz9kfDllV-ctk5WIjt-1Vy,Chile,La Prensa Austral
Fiesta en Bellavista tras derrota de la “Roja”: música y alcohol en plena calle para pasar la pena,https://www.publimetro.cl/cl/noticias/2021/07/03/fiesta-en-bellavista-derrota-de-la-roja-musica-y-alcohol-para-pasar-la-pena.html,"Tres detenidos hubo luego del carrete improvisado que realizaron los hinchas en el sector de Bellavista, provocando incidentes e interrumpiendo el tránsito en la calle.",03-07-2021 13:01,https://www.bing.com/th?id=OVFT.CSw-Lm-E4aOpT9-WcAZdnC,Chile,publimetro.cl
"Experto y hospitalizaciones por coronavirus en Chile: ""Hay un aumento de pacientes vacunados""",https://www.meganoticias.cl/nacional/342466-entrevista-doctor-rodrigo-rosas-ingreso-uci-pacientes-jovenes-adultos-mayores-03-07-2021.html,"Revisa en detalle las declaraciones del jefe de Servicio de Urgencias de la Clínica Alemana, Rodrigo Rosas, quien se refirió al ingreso de jóvenes y adultos mayores a las UCI por coronavirus.",03-07-2021 13:09,https://www.bing.com/th?id=OVFT.mO6xkhNOfnMpaSgkR-3m-y,Chile,meganoticias
"Cientos de personas se congregaron en masiva “fiesta” en Bellavista, pese a riesgo de contagios",http://www.lanacion.cl/cientos-de-personas-se-congregaron-en-masiva-fiesta-en-bellavista-pese-a-riesgo-de-contagios/,"Se trató de una ""congregación espontánea"" de gente que llegó al bohemio sector de la capital con un parlante, causando una gran aglomeración de personas, quienes bebían alcohol y bailaban en la vía pú",03-07-2021 14:01,https://www.bing.com/th?id=OVFT.Y9GCrL_LSwcr69EFeMqkFC,Chile,La Nación
Coronavirus en Chile: 3.880 nuevos contagios y 164 muertes en las últimas 24 horas,https://www.t13.cl/noticia/nacional/coronavirus-chile-3880-nuevos-contagios-y-164-muertes-ultimas-24-horas,La positividad de la totalidad de exámenes realizados alcanzó el % a nivel nacional y un % en la Región Metropolitana.,03-07-2021 14:06,https://www.bing.com/th?id=OVFT.mkYyEoZ1C4XNYCIdT94bsy,Chile,T13
"Martín Lasarte:""Alexis sabía que no iba poder y sin embargo hizo un esfuerzo""",https://www.elperiscopio.cl/deportes/arturo-vidal-3/,Arturo Vidal se lanzó contra el árbitro.Chile perdió contra Brasil por los cuartos de final de la Copa América y Arturo Vidal apuntó al.,03-07-2021 14:44,https://www.bing.com/th?id=OVFT.-M0Y_KwwVUlXtPEXRZUiai,Chile,elperiscopio.cl
Bono Pyme | ¿Cómo saber si soy beneficiario?,https://redgol.cl/tendencias/Bono-Pyme-como-postular-SII.cl--Como-saber-si-soy-beneficiario-del-Bono-Pyme-Bono-pyme-2021-postular-online-20210702-0060.html,Las micro y pequeñas empresas que cumplan los requisitos exigidos puedes solicitar el beneficio desde el 2 de julio.,03-07-2021 15:05,https://www.bing.com/th?id=OVFT.9TpJo7l-MHIZk9QfzOv9oS,Chile,redgol
"Covid-19 en Chile: Minsal informó 164 muertes en las últimas 24 horas, llegando a un total de 32.973 fallecidos",https://www.adnradio.cl/nacional/2021/07/03/covid-19-en-chile-minsal-informo-164-muertes-en-las-ultimas-24-horas-llegando-a-un-total-de-32-973-fallecidos.html,"El ministerio de Salud (Minsal) notificó este sábado 3 de julio 164 muertes por covid-19 en Chile en el marco del informe del avance de la pandemia del covid en las últimas 24 horas, de acuerdo con la",03-07-2021 15:19,https://www.bing.com/th?id=OVFT.1HPoy0WgduJYGFTKAXhUfi,Chile,ADN
Nuevo informe Covid: 3.880 nuevos casos y 161 nuevos fallecidos en Chile,https://www.lacuarta.com/cronica/noticia/informe-covid-chile-3-julio-2021/648504/,"El Ministerio de Salud reportó este sábado 3.880 casos nuevos de COVID-19, de los cuales 2.659 corresponden a personas sintomáticas y 1.030 no presentan síntomas. Además, se registraron 191 test PCR P",03-07-2021 15:23,https://www.bing.com/th?id=OVFT.Op8bD-EjH1GDwb7WEDOnNy,Chile,La Cuarta
Minsal informó 3.880 casos nuevos de covid-19 en Chile: contagiados totales alcanzaron 1.566.461,https://www.adnradio.cl/nacional/2021/07/03/balance-minsal-3-de-julio-3-880-casos-nuevos-de-covid-19-en-chile.html,"El ministerio de Salud ( Minsal) informó este sábado 3 de julio en nuevo balance 3.880 casos nuevos de coronavirus covid-19 en Chile en las últimas 24 horas, alcanzando un total de 1.566.461 contagiad",03-07-2021 15:34,https://www.bing.com/th?id=OVFT.5XKsnNfbP6ZpaJgfzU7kuy,Chile,ADN
La vacuna de fabricación cubana Abdala comenzó a ser administrada en Venezuela,https://www.elciudadano.com/latinoamerica/la-vacuna-de-fabricacion-cubana-abdala-comenzo-a-ser-administrada-en-venezuela/07/03/,"Venezuela inició una campaña de vacunación generalizada con la vacuna Abdala, producida por Cuba, la que según los estudios desarrollados al interior de",03-07-2021 15:56,https://www.bing.com/th?id=OVFT.s7qfE_aDHWQypPv_kooy9y,Chile,El Ciudadano
VIDEOS | Masiva fiesta en Bellavista en plena pandemia provoca indignación en redes sociales,https://redgol.cl/tendencias/VIDEOS--Masiva-fiesta-en-Bellavista-en-plena-pandemia-provoca-indignacion-en-redes-sociales-20210703-0023.html,"Pese a que Chile se encuentra en medio de una compleja emergencia sanitaria debido a la pandemia del coronavirus, la noche de ayer viernes 2 de julio se registró una fiesta masiva en el Barrio Bellavi",03-07-2021 16:07,https://www.bing.com/th?id=OVFT.7KqBpXRkfG9GrOjpnH4Y8S,Chile,redgol
Seremi de Salud reporta 41 nuevos contagios por Covid-19,http://www.eldivisadero.cl/noticia-63186,"Los casos activos a nivel regional ascienden a 269, de los cuales 146 son Coyhaique y 79 de Aysén. Lago Verde, O'Higgins y Tortel son las únicas tres que se mantienen sin casos activos.",03-07-2021 17:17,https://www.bing.com/th?id=OVFT.zBQxmmBVhAH4zxb_znmwTy,Chile,Diario el Divisadero
Chile suma 3.880 nuevos contagios covid-19: hay 22.809 casos activos,https://www.diarioconcepcion.cl/pais/2021/07/03/chile-suma-3-880-nuevos-contagios-covid-19-hay-22-809-casos-activos.html,"Este sábado 3 de julio el Ministerio de Salud informó en el reporte covid-19 que Chile registró 164 nuevos decesos inscritos y 3.880 casos positivos. Del total de nuevos contagios, 2.659 fueron sintom",03-07-2021 18:07,https://www.bing.com/th?id=OVFT.f34RLRcLu7Gunl4Pc2qbYC,Chile,El Diario de Concepcion
Parroquia El Carmen de Rancagua se prepara para festejar a su patrona.,https://www.elrancaguino.cl/2021/07/03/parroquia-el-carmen-de-rancagua-se-prepara-para-festejar-a-su-patrona/,"Este 16 de julio se celebra a la Patrona de Chile y en la Parroquia Nuestra Señora del Carmen ... 12:15 horas. “A pesar del Covid 19, nuestra comunidad parroquial y sus comunidades, sigue viva y orante, atendiendo dentro de las posibilidades las ...",03-07-2021 18:15,https://www.bing.com/th?id=OVFT.caF0J-w7JqEe8b_pRfVCwS,Chile,elrancaguino.cl
Transportistas bolivianos piden que Chile agilice controles Covid en la frontera,https://www.theclinic.cl/2021/07/03/transportistas-bolivianos-piden-que-chile-agilice-controles-covid-en-la-frontera/,Transportistas de carga pesada de Bolivia piden que Chile agilice toma de pruebas contra el covid en la frontera para dar flujo a camiones retenidos.,03-07-2021 18:45,https://www.bing.com/th?id=OVFT.aPuxXs3ZNodD0yTOMcBkpS,Chile,Clinic
Corte Suprema acoge recurso de amparo y deja sin efecto expulsión de ciudadanos venezolanos,https://www.elmostrador.cl/dia/2021/07/03/corte-suprema-acoge-recurso-de-amparo-y-deja-sin-efecto-expulsion-de-ciudadanos-venezolanos/,La Segunda Sala del máximo tribunal anuló las resoluciones dictadas por la Intendencia Regional de Valparaíso que ordenaron la salida obligada del país de dos ciudadanos venezolanos que cuentan con ar,03-07-2021 19:20,https://www.bing.com/th?id=OVFT.MvQldcIVRvmB5PLk4qlSDS,Chile,El Mostrador
Reportan 33 nuevos casos de Covid 19 con PCR positivos; 16 de Coyhaique y 05 de Aysén,https://www.rln.cl/destacado/88601-reportan-33-nuevos-casos-de-covid-19-con-pcr-positivos-16-de-coyhaique-y-05-de-aysen,"Durante el reporte de la Seremi de Salud de este sábado 03 de Julio se informó que en las últimas horas se confirmaron 33 nuevos casos de Covid 19 con PCR positivos. Aysén.- Según se detalló, de estos",03-07-2021 19:58,https://www.bing.com/th?id=OVFT.cvrC3TR4-lKXDAkrY3lBTi,Chile,Radio las Nieves
Bebé en cuarentena: Nace la primera guagua chilena al interior de una residencia sanitaria,https://www.lacuarta.com/cronica/noticia/nace-primer-bebe-interior-residencia-sanitaria-chile/648567/,Una joven de 20 años en Iquique dio a luz a su bebé al interior de una residencia sanitaria convirtiéndose en el primer caso chileno.,03-07-2021 22:01,https://www.bing.com/th?id=OVFT.TqJunoHBW4Qhuulunu8FMS,Chile,La Cuarta
El itinerario que llegó a la Convención Constitucional que se inaugura este domingo,https://www.elciudadano.com/chile/el-itinerario-que-llego-a-la-convencion-constitucional-que-se-inaugura-este-domingo/07/03/,"Grandes expectativas hay en torno de la primera sesión de la Convención Constitucional, la que será realizada este domingo 4 de julio en el recinto del",03-07-2021 22:30,https://www.bing.com/th?id=OVFT.pLCjp32noLL0EPrArl_9Ey,Chile,El Ciudadano
Las 20 comunas con más casos activos de Covid: Destacan 7 de la RM y 3 del norte del país,https://www.meganoticias.cl/nacional/342497-coronavirus-informe-epidemiologico-comunas-casos-activos-puente-alto-maipu-arica-03-07-2021.html,Conoce cuáles son las 20 comunas con más casos activos de coronavirus en nuestro país. La información fue dada a conocer en un nuevo Informe Epidemiológico publicado este sábado por el ministerio de S,03-07-2021 22:31,https://www.bing.com/th?id=OVFT.FJmQTyTCqnk6h68QkdOuKS,Chile,meganoticias
278 contagios por covid-19 registra la región de La Araucanía en último balance,https://www.biobiochile.cl/noticias/nacional/chile/2021/07/03/278-contagios-por-covid-19-registra-la-region-de-la-araucania-en-ultimo-balance.shtml,"11 muertes y 278 contagios de Coronavirus se informaron en las últimas horas en la región de la Araucanía, que además registró la positividad diaria más alta del país. Este fin de semana 27 comunas se",03-07-2021 23:25,https://www.bing.com/th?id=OVFT.EdHf1FkCE1JD3HLyekktIy,Chile,Chile
DEIS: Fallecimientos atribuidos al Covid-19 ascienden a 42.547 a nivel nacional tras sumar otros mil decesos confirmados y sospechosos,https://www.latercera.com/nacional/noticia/deis-fallecimientos-atribuidos-al-covid-19-ascienden-a-42547-a-nivel-nacional-tras-sumar-otros-mil-decesos-confirmados-y-sospechosos/ZGAYNGJ33BGVXF3VODGIYS7UOQ/,"De acuerdo al informe semanal del organismo dependiente del Minsal, en lo que va del 2021 se han reportado 20.342 muertes, lo que equivale al 91,61% de las registradas durante el año pasado. Además, d",03-07-2021 23:29,https://www.bing.com/th?id=OVFT.vFIuAvJnYzTsTc62qYIoFi,Chile,LA TERCERA
211 nuevos casos de covid-19 registra la región de Los Ríos,https://www.biobiochile.cl/noticias/nacional/chile/2021/07/03/211-nuevos-casos-de-covid-19-registra-la-region-de-los-rios.shtml,"Más de 200 nuevos casos de covid19 fueron confirmados para la región de Los Ríos, zona en la que hay actualmente más de mil personas contagiantes. En concreto, la seremi de Salud de la zona notificó 2",03-07-2021 23:33,https://www.bing.com/th?id=OVFT.rpSyFBGA_xKVt9jUBy_C_y,Chile,Chile
EL FUTURO DE PACIFIC sin Fritz Bartsch,https://www.latercera.com/pulso/noticia/el-futuro-de-pacific-sin-fritz-bartsch/6NLSDUP57VC5RGNRVGNG7VOWDU/,"Envuelta desde hace años en problemas judiciales, tres locales de la mayor cadena de gimnasios del país fueron embargados en mayo. Los tribunales han considerado que las sociedades ligadas a la cadena",04-07-2021 00:00,https://www.bing.com/th?id=OVFT.P6sSeDpXkzWJwMOQrQ6AOi,Chile,LA TERCERA
