name,url,description,datePublished,imagen,pais,Fuente
FTC da por superado debate por quina para directorio de ...,https://www.df.cl/noticias/empresas/mineria/ftc-da-por-superado-debate-por-quina-para-directorio-de-codelco-aunque/2020-05-15/102703.html,"Con versiones contrapuestas terminó consejo directivo nacional de la Federación de Trabajadores del Cobre (FTC), multisindical que agrupa a funcionarios de Codelco, realizado este jueves en medio de l",15-05-2020 21:34,https://www.bing.com/th?id=ON.4F755BFE4235436A8DB19B704BEE794E,Chile,df.cl
"“Las ganas de jugar no me las quita nadie, pero en este ...",https://laprensaaustral.cl/deportes/las-ganas-de-jugar-no-me-las-quita-nadie-pero-en-este-momento-lo-primero-es-la-salud/,"Cuando a los 14 años brilló defendiendo al seleccionado Sub-15 de Punta Arenas en el Mundialito de Valdivia, seguro se ilusionó con cumplir algún día el anhelo de todo niño que abraza la “redonda pasi",16-05-2020 12:51,https://www.bing.com/th?id=ON.B78C1C6ADBCD5A2F1B74CD9B92441ABC,Chile,La Prensa Austral
"Seremi de Salud, Mariela Rojas: “No podemos descartar en ...",https://laprensaaustral.cl/cronica/seremi-de-salud-mariela-rojas-no-podemos-descartar-en-las-siguientes-semanas-un-aumento-de-casos-o-de-muertes/,"Un verdadero “tirón de orejas” fueron las palabras que entregó ayer la secretaria regional ministerial de Salud, Mariela Rojas, respecto a la poca responsabilidad de la gente frente a la gravedad que",16-05-2020 12:51,https://www.bing.com/th?id=ON.F92FF7130D2393DA36FBBA5BC8F94155,Chile,La Prensa Austral
"Presidente pide unidad, respalda a Mañalich y advierte a ...",https://www.emol.com/noticias/Nacional/2020/05/15/986287/Pinera-Criticas-Coronavirus.html,"El Presidente Sebastián Piñera reiteró este viernes el llamado a la unidad que ha venido realizando desde el inicio de la pandemia del coronavirus, luego del endurecimiento del discurso de distintos s",16-05-2020 12:50,https://www.bing.com/th?id=ON.E8F5EBFB837B70F5379C3F7671AC0551,Chile,Emol
Se dio el vamos a campaña para pintar líneas de ...,https://www.itvpatagonia.com/noticias/se-dio-el-vamos-a-campana-para-pintar-lineas-de-distanciamiento-social-en-espacios-publicos-de-punta-arenas/,"Mantener una distancia social de al menos un metro ha sido una conducta asimilada ya por gran parte de la población. Junto con el lavado de manos, es una de las principales recomendaciones compartidas",16-05-2020 14:03,https://www.bing.com/th?id=ON.F2219E364F750A5C9B090C85628F2E0A,Chile,ITV
Joven madre falleció por Covid-19: había dado a luz hace ...,https://www.lacuarta.com/cronica/noticia/terrible-madre-murio-covid-19/497369/,Lamentable hecho se produjo durante las últimas horas en le Región de O'Higgins. Una lamentable noticia relacionada con el coronavirus se registró durante las últimas horas en el Región de O’Higgins.,16-05-2020 14:21,https://www.bing.com/th?id=ON.570397068799E3790420DDBD118585B7,Chile,La Cuarta
Estudio revela que Tagua Tagua fue el sitio con mayor ...,https://www.latercera.com/que-pasa/noticia/estudio-revela-que-tagua-tagua-fue-el-sitio-con-mayor-diversidad-de-fauna-del-chile-de-la-edad-del-hielo/S7QFVFA5QJFINCJVMBTR6RQOFA/,"En Chile central, el registro fósil de fauna del Pleistoceno tardío (20 mil a 12 mil años atrás) es abundante: existen cerca de 32 sitios paleontológicos y arqueológicos dispersos a lo largo de este t",16-05-2020 14:44,https://www.bing.com/th?id=ON.B3A4289B13F36D2EDEF60DC3C859C75F,Chile,LA TERCERA
Caso positivo de senador por covid-19 repercute en seis ...,https://www.emol.com/noticias/Nacional/2020/05/15/986348/Coronavirus-Senado-diputados.html,"El diagnostico del vicepresidente del Senado, Rabindranath Quinteros (PS), quien fue confirmado con covid-19 este viernes, repercutió en seis diputados quienes han debido tomar las medidas de precauci",16-05-2020 15:01,https://www.bing.com/th?id=ON.4A907338FC4711A6D2A3FAC3783CC046,Chile,Emol
La drástica medida de control a cinco laboratorios que ...,https://www.elperiscopio.cl/destacado-1/la-drastica-medida-de-control-a-cinco-laboratorios-que-entregaban-resultados-de-covid-19-pocos-claros/,"La alta demanda que se ha dado en las ultimas semanas para la realización masiva de tests PCR a personas, ha llevado a que se habiliten muchos mas laboratorios de los presupuestados para tal fin, entr",16-05-2020 15:04,https://www.bing.com/th?id=ON.23401481489C48871BAABE92A739CF06,Chile,elperiscopio.cl
1.886 casos nuevos de Covid-19 en Chile que totaliza 41 ...,https://www.itvpatagonia.com/noticias/1-886-casos-nuevos-de-covid-19-en-chile-que-totaliza-41-428-diagnosticados-27-fallecidos-en-la-ultima-jornada/,1.886 casos nuevos de Covid-19 en Chile que totaliza 41.428 diagnosticados. 27 fallecidos en la última jornada,16-05-2020 15:09,https://www.bing.com/th?id=ON.02ED74577568E5BD385123A3B1FBFB0E,Chile,ITV
"Minsal reportó 1.886 nuevos casos, llegando a 41.421 los ...",https://www.adnradio.cl/nacional/2020/05/16/minsal-reporto-1-886-nuevos-casos-llegando-a-41-421-los-contagiados-con-coronavirus.html,"Durante este sábado, el Ministerio de Salud entregó el último reporte con respecto al coronavirus Covid-19 en Chile. Los casos nuevos durante las últimas 24 horas fueron 1.886, de los cuales 1.573 pre",16-05-2020 15:13,https://www.bing.com/th?id=ON.7ECB3BD8540FECFCF0C70EE6890F6DB6,Chile,ADN
Chile registra nuevo récord de 27 fallecidos y supera los ...,https://www.theclinic.cl/2020/05/16/chile-registra-nuevo-record-de-27-fallecidos-y-supera-los-40-mil-contagiados-por-covid-19/,"En las últimas 24 horas se confirmaron 1.8886 nuevos casos de personas contagiadas, siendo 1.573 con síntomas y 313 asintomáticos. La subsecretaria de Salud, Paula Daza, informó que Chile registró una",16-05-2020 15:20,https://www.bing.com/th?id=ON.28F9CBBC334BDBB42109F5765CCE35A5,Chile,Clinic
41 MIL 428 CASOS POR COVID-19 SE REGISTRAN EN CHILE,http://www.radiopolar.com/noticia_157466.html,Ud. es el visitante nro.:,16-05-2020 15:23,https://www.bing.com/th?id=ON.E1136D8A7FA6735788508A6BCA0710EF,Chile,Radio Polar
Chile supera los 40 mil contagiados por Covid-19: récord ...,https://www.lacuarta.com/cronica/noticia/chile-40-mil-covid-19/497383/,"El Minsal entregó el balance diario por coronavirus desde La Moneda. Este sábado, el Ministerio de Salud entregó un nuevo balance de cifras por COVID-19 en el país. En las últimas 24 horas, con corte",16-05-2020 15:25,https://www.bing.com/th?id=ON.EE48A2E07F3F79CEEA6264583E87A30E,Chile,La Cuarta
Covid-19: Chile superó los 40 mil casos y registró nuevo ...,https://www.cooperativa.cl/noticias/sociedad/salud/coronavirus/covid-19-chile-supero-los-40-mil-casos-y-registro-nuevo-maximo-de/2020-05-16/110849.html,"La subsecretaria de Salud Pública, Paula Daza, reveló que los recuperados llegan a 18.014. Este sábado, la subsecretaria de Salud Pública, Paula Daza, informó que en las últimas 24 horas se registraro",16-05-2020 15:26,https://www.bing.com/th?id=ON.F7996F33448EFB9C46E94867A7F87DF7,Chile,Radio Cooperativa
Nuevamente Chile supera máximo de fallecidos al día: 27 ...,https://elpinguino.com/noticia/2020/05/16/nuevamente-chile-supera-maximo-de-fallecidos-al-dia-27-muertos-y-casos-totales-superan-los-41-mil,"Por tercer día consecutivo, Chile superó este sábado el alza diaria más alta de muertos al día por coronavirus Covid-19; esta vez con 27 fallecidos. El jueves fueron 22 los fallecidos, el viernes se n",16-05-2020 15:31,https://www.bing.com/th?id=ON.6AD75EAB80DE6962505C8AE5FEEF5F3A,Chile,ELPINGUINO
Coronavirus: Chile superó los 40 mil contagiados,https://www.elperiscopio.cl/destacado-1/coronavirus-chile-supero-los-40-mil-contagiados/,"Este sábado 16 de mayo, la subsecretaria de Salud Pública, Paula Daza, informó que en las últimas 24 horas se registraron 1.886 nuevos contagios de Covid-19, con lo que la cifra total llegó a 41.428 c",16-05-2020 15:41,https://www.bing.com/th?id=ON.2B492755EBBC14077F74978F540BD2B2,Chile,elperiscopio.cl
Casos de Covid-19 en Chile superan los 40 mil y número de ...,https://www.elmostrador.cl/dia/2020/05/16/casos-de-covid-19-en-chile-superan-los-40-mil-y-numero-de-fallecidos-llega-a-421/,"La subsecretaria de Salud Pública, Paula Daza, fue la encargada de entregar el reporte sobre los nuevos contagios y fallecidos por Covid-19 en el país. En las últimas 24 horas se registraron 1.886 nue",16-05-2020 15:49,https://www.bing.com/th?id=ON.49C3702527CF461B4E6CD128A5BD7DBB,Chile,El Mostrador
Chile superó los 40.000 contagiados y el máximo de muertes ...,https://www.prensafutbol.cl/354920-chile-supero-los-40-000-contagiados-y-el-maximo-de-muertes-en-un-dia/,"Si el jueves (14/05) fueron 22 las muertes, el viernes (15/05) fueron 26, hoy (16/05) las autoridades confirmaron 27 fallecidos estableciendo un. Además, 1.886 nuevos casos contagiados alcanzando un t",16-05-2020 15:57,https://www.bing.com/th?id=ON.41EE311D16144CF8F1305546429E8DC3,Chile,Prensafútbol
Baja radiación solar podría acentuar la propagación del ...,https://elpinguino.com/noticia/2020/05/16/baja-radiacion-solar-podria-acentuar-la-propagacion-del-covid-19-en-invierno,"Baja radiación solar podría acentuar la propagación del Covid-19 en invierno. cronica . 16/05/2020 a las 13:00 ... semanas se dio a conocer un estudio del académico del Departamento de Física de la Universidad de Santiago de Chile (USACh) y experto en cambio climático, ...",16-05-2020 16:05,https://www.bing.com/th?id=ON.B99AB560BCEBB82F074BA7450E5EFB59,Chile,ELPINGUINO
Muertes en Chile por Coronavirus siguen en... | Puranoticia,https://www.puranoticia.cl/noticias/nacional/muertes-en-chile-por-coronavirus-siguen-en-aumento-27-casos-en-ultimas/2020-05-16/115926.html,"El ministerio de Salud informó este sábado que hasta las 21 horas de este viernes se registraron otros 27 fallecimientos por covid-19, superando la cifra de hace 24 horas -fueron 26-, por lo que es la",16-05-2020 16:04,https://www.bing.com/th?id=ON.06270C8F590BDA5E97D1DEB56F41A809,Chile,Puranoticia.cl
Valparaíso: Sharp da a conocer nueva estrategia de ...,https://www.elciudadano.com/chile/valparaiso-sharp-da-a-conocer-nueva-estrategia-de-atencion-de-salud-y-la-adquisicion-de-una-ambulancia/05/16/,"En el marco de la implementación de la estrategia de Confinamiento Comunitario, el alcalde de Valparaíso, Jorge Sharp, junto al director del Área de Salud de la Corporación Municipal, Alejandro Escoba",16-05-2020 16:08,https://www.bing.com/th?id=ON.93F3B9F92B3A2104096B74C3E8BB5CB1,Chile,El Ciudadano
A las 22 horas de hoy comienza cuarentena obligatoria para ...,https://www.elrancaguino.cl/2020/05/15/a-las-22-horas-de-hoy-comienza-cuarentena-obligatoria-para-mayores-de-75-anos/,"– El Ministerio de Salud rebajó la edad que aplicaba para mayores de 80 años, debido a que más del 25% de los fallecimientos por Covid 19 que ha habido en el país, se registran en personas de 75 años",16-05-2020 16:10,https://www.bing.com/th?id=ON.362FB77800993525CED8C544EFE941B9,Chile,elrancaguino.cl
FACH prepara traslado de otros tres pacientes Covid-19 ...,https://www.biobiochile.cl/noticias/nacional/chile/2020/05/16/fach-prepara-traslado-otros-tres-pacientes-covid-19-graves-desde-santiago-concepcion.shtml,"La Fuerza Aérea de Chile (FACH) prepara un nuevo traslado en avión de pacientes graves a causa del Covid-19 desde Santiago a Concepción, el segundo de esta naturaleza durante esta semana. Se trata de",16-05-2020 16:09,https://www.bing.com/th?id=ON.DE2A63DB75B72C1B6A296A63C14528CB,Chile,Chile
Mauricio Isla: “Volvería a Chile si un club me hace el ...,https://www.adnradio.cl/deportes/2020/05/16/mauricio-isla-volveria-a-chile-si-un-club-me-hace-el-ofrecimiento.html,"“Volvería a Chile si un club me hace el ofrecimiento”, expresó Mauricio Isla a Francisco Saavedra en el programa Abrazo en línea de Canal 13. El “Huaso” juega en el Fenerbahçe de Turquía desde mediado",16-05-2020 16:17,https://www.bing.com/th?id=ON.9E454728C8F9C58225731BA539470DE3,Chile,ADN
OvejeroNoticias Seremi de Agricultura con agentes ...,https://www.ovejeronoticias.cl/2020/05/seremi-de-agricultura-con-agentes-regionales-del-banco-estado-buscan-optimizar-el-apoyo-financiero-a-los-agricultores-y-ganaderos-de-la-region/,". Como resultado de la inédita reunión en video conferencia sostenida ayer entre el ministro de Agricultura Antonio Walker y el gerente general ejecutivo de Banco Estado, Juan Cooper, con los 16 direc",16-05-2020 16:37,https://www.bing.com/th?id=ON.C3B15B082475476031E79A8E7DCFB342,Chile,Ovejero Noticias
Chile es noveno en nuevos contagios en el mundo y 12º en ...,https://www.publimetro.cl/cl/noticias/2020/05/16/chile-noveno-nuevos-contagios-mundo-12o-muertes-aguante-la-batalla-esta-dura.html,La batalla contra el coronavirus está dura en varios puntos del planeta. Estados Unidos sigue como el país más afectado y Rusia rápidamente empieza a transformarse en el epicentro de la pandemia. Pero,16-05-2020 16:38,https://www.bing.com/th?id=ON.11E8766DB85F75289689F21CEEEBC960,Chile,publimetro.cl
Covid-19: Corresponsal cuestiona presencia de militares en ...,https://www.elciudadano.com/chile/covid-19-corresponsal-cuestiona-presencia-de-militares-en-puntos-criticos-tras-recorrido-por-santiago/05/16/,"La corresponsal en Chile de la cadena de noticias Telesur, Paola Dragnic, cuestionó este viernes la presencia de militares en los llamados «puntos estratégicos» de la capital, tras realizar un recorri",16-05-2020 16:40,https://www.bing.com/th?id=ON.F3ABC333652825FF2B375CB23CF05721,Chile,El Ciudadano
Camionero quedó en prisión preventiva tras intentar ...,https://www.cooperativa.cl/noticias/pais/region-de-arica/camionero-quedo-en-prision-preventiva-tras-intentar-ingresar-mas-de-70/2020-05-16/124634.html,El sujeto aprovechó el permiso excepcional para que transportistas crucen la frontera en medio de la crisis por Covid-19. La droga fue avaluada en más de 1.700 millones de pesos. Un hombre de 61 años,16-05-2020 16:54,https://www.bing.com/th?id=ON.B4941FD6DB9936F4D15729F9A6B707A7,Chile,Radio Cooperativa
El avance de la pandemia: 1 de cada 500 chilenos ya se ha ...,https://www.biobiochile.cl/noticias/nacional/chile/2020/05/15/el-avance-de-la-pandemia-1-de-cada-500-chilenos-ya-se-ha-contagiado-de-coronavirus.shtml,"19.107.216 habitantes: esa es la última proyección de población que realizó el Instituto Nacional de Estadísticas (INE) para 2019, de acuerdo a los datos del Censo 2017. Y este viernes el total de con",16-05-2020 17:08,https://www.bing.com/th?id=ON.D2937F5E8AA4E31EFF67C74A7FFD6CAE,Chile,Chile
Fuerza Aérea de Chile prepara nuevo traslado de ...,https://www.puranoticia.cl/noticias/nacional/fuerza-aerea-de-chile-prepara-nuevo-traslado-de-pacientes-con/2020-05-16/132222.html,"Esto forma del plan del Ministerio de Salud para descongestionar la red asistencial de la Región Metropolitana, recordando que el pasado jueves ya fueron transportadas otras dos personas. La Fuerza Aé",16-05-2020 17:23,https://www.bing.com/th?id=ON.105DE58F37D913DE95252D5782A596A9,Chile,Puranoticia.cl
"Latam despedirá 1.400 empleados en Chile, Colombia ...",https://www.elmostrador.cl/mercados/2020/05/16/latam-despedira-1-400-empleados-en-chile-colombia-ecuador-y-peru-en-medio-de-la-pandemia/,"Latam Airlines anunció este viernes que despedirá a 1.400 empleados de sus filiales en Chile, Colombia, Ecuador y Perú como resultado de la drástica reducción de sus operaciones por culpa de la pandem",16-05-2020 17:26,https://www.bing.com/th?id=ON.6294C942B3BF805A02E5F46BDFE4AB72,Chile,El Mostrador
Rafael Gumucio desde Nueva York: Una carta desde el futuro ...,https://www.elperiodista.cl/rafael-gumucio-desde-nueva-york-una-carta-desde-el-futuro/,"Nueva York es como Santiago una cuidad altamente segregada con un sistema de salud privado engorrosamente caro. La única diferencia es que los pobres no viven a kilómetros, y no lo separan jardines de",16-05-2020 17:43,https://www.bing.com/th?id=ON.8D51943997BD06E35A2582E68FB5B2D4,Chile,El Periodista
"El Senado, la Fiscalía, 36 municipios y 12 embajadas se ...",https://www.elperiodista.cl/el-senado-la-fiscalia-36-municipios-y-12-embajadas-se-suman-a-campana-del-arcoiris/,"Un total de 56 instituciones se han plegado hasta ahora a la Campaña Arcoíris, una iniciativa mediante la cual el Movimiento de Integración y Liberación Homosexual (Movilh) invita a instituciones públ",16-05-2020 18:07,https://www.bing.com/th?id=ON.46C51FBBB209EFA8CB07798CE3D9ABE0,Chile,El Periodista
