name,url,description,datePublished,imagen,pais,Fuente
EN VIVO: Cifras actualizadas de coronavirus en Chile | Tele 13,https://www.t13.cl/noticia/nacional/en-vivo-coronavirus-chile-casos-muertes-minsal-19-06-2020,"El 3 de marzo de 2020 el Ministerio de Salud confirmó el primer caso positivo de coronavirus en Chile. Desde ahí, cada día la autoridad sanitaria presenta un balance del estado de avance de la pandemi",19-06-2020 14:27,https://www.bing.com/th?id=ON.17379DB4A5482652A1EA9FE41BD20AB5,Chile,T13
Alejandro Navarro se querelló contra Jaime Mañalich por ...,https://www.elperiscopio.cl/destacado-1/alejandro-navarro-denuncia-jaime-manalich/,"“Ocultar 31.412 Covid-19 confirmados y permitir que circulen, es una acción criminal”, criticó el senador. El senador de la República, Alejandro Navarro, ingresó este jueves una denuncia en contra del",19-06-2020 14:35,https://www.bing.com/th?id=ON.1D51C35E1BD5A9EB3A334DD75266AAB1,Chile,elperiscopio.cl
Así es la larga recuperación de pacientes intubados por ...,https://www.elperiscopio.cl/destacado-1/asi-es-la-larga-recuperacion-de-pacientes-intubados-por-covid-19/,"Pese a que la recuperación de estos pacientes dependerá de la edad, de las enfermedades de base, del tiempo que estuvieron conectados y del daño sistémico provocado por el Covid-19, en Clínica MEDS advirtieron que el tratamiento y la recuperación de personas va a depender del nivel de compromiso biológico y de las limitaciones ...",19-06-2020 14:35,https://www.bing.com/th?id=ON.0D795BB8FE2768FB8D0DD3AC256420A0,Chile,elperiscopio.cl
Llegan a Chile pórticos que permiten medir la temperatura ...,https://www.meganoticias.cl/nacional/305271-porticos-que-permiten-medir-la-temperatura-de-una-persona-por-segundo.html,"Están disponible en Chile un nuevo dispositivo que permite tomar la temperatura de las personas, se trata de unos pórticos que miden la temperatura mediante luz dual, una tecnología global, ya probada",19-06-2020 14:39,https://www.bing.com/th?id=ON.D706BF83DC2E010D3B1FAC7FCC44E1E7,Chile,meganoticias
Seremi de Valparaíso salió de la UCI tras casi un mes ...,https://www.cooperativa.cl/noticias/sociedad/salud/coronavirus/seremi-de-valparaiso-salio-de-la-uci-tras-casi-un-mes-internado-por/2020-06-19/101532.html,"El seremi de Salud de Valparaíso, Francisco Álvarez, salió este jueves de la UCI de la Clínica Ciudad del Mar, donde estuvo internado desde el 25 de mayo por su grave caso de Covid-19, que lo llevó incluso a estar conectado a ventilación mecánica por tres semanas.",19-06-2020 14:41,https://www.bing.com/th?id=ON.BCED2F28C6375145C45B8777738D969A,Chile,Radio Cooperativa
Estados Unidos y la promesa (incumplida) de libertad - La ...,https://www.latercera.com/opinion/noticia/estados-unidos-y-la-promesa-incumplida-de-libertad/FK2KTQS5KVDATH4DG73P32VXM4/,"Por Patricio Valenzuela, académico de Ingeniería Industrial e Investigador Instituto Milenio MIPP, U. de Chile, y Sebastián Acevedo, sociólogo y magister en Políticas Públicas de la Universidad de Chi",19-06-2020 14:43,https://www.bing.com/th?id=ON.6A33E257AD0CF052B0635A70E08CE260,Chile,LA TERCERA
El ministro de Ciencia sometido a revisión de pares - Pauta.cl,https://www.pauta.cl/politica/criticas-ministro-de-ciencias-couve-gestion-de-la-pandemia,"Galardonado y reconocido. ""El ministro Andrés Couve es sin duda uno de los representantes más talentosos e importantes del mundo científico"", decía el Presidente Sebastián Piñera en la ceremonia de inauguración del Ministerio de Ciencias, Tecnología, Conocimiento e Innovación, en agosto de",19-06-2020 14:50,https://www.bing.com/th?id=ON.C8A5E83BA0F8B9BD5CE3B5AB358EEBEB,Chile,pauta
OvejeroNoticias Todo está al revés: a 8 meses del 18 de ...,https://www.ovejeronoticias.cl/2020/06/todo-esta-al-reves-a-8-meses-del-18-de-octubre-el-dia-que-chile-desperto-juan-salvador-miranda-opiniones/,"El 18 de octubre fue como un ruido tremendo que despertó y logro sacar del letargo al pueblo de Chile,  pero quizás lo que desnudo al modelo de una forma arrolladora fue el covid 19, esta pandemia glo",19-06-2020 15:02,https://www.bing.com/th?id=ON.A8521D3A09C5D9F6CDA97229D6902CD2,Chile,Ovejero Noticias
La Región de Antofagasta está siendo devastada por la ...,https://www.elciudadano.com/general/la-region-de-antofagasta-esta-siendo-devastada-por-la-pandemia-pero-las-mineras-siguen-operando-con-el-aval-del-gobierno/06/19/,"El Consejo Minero -que agrupa a las grandes mineras privadas y también a Codelco- informó este miércoles 19 que hay 1.040 contagiados con covid-19 en el sector, siendo los principales focos de contagio Chuquicamata y Escondida (Región de Antofagasta). Pese a esto, el ministro de Minería Baldo",19-06-2020 15:06,https://www.bing.com/th?id=ON.3253D3FF07E2BC2728453003CD23F80A,Chile,El Ciudadano
Coronavirus en directo: La crisis del Covid-19 minuto a ...,https://www.meganoticias.cl/nacional/305203-directo-envivo-coronavirus-casos-chile-contagios-muertes-comunas-cuarentena-20200619html.html,"Las nuevas comunas que entran en cuarentena desde las 22:00 horas de este viernes son: Los Andes, San Felipe, Rancagua, Machalí y el radio urbano de Curicó. Ver Más 10:15 horas: RM es la cuarta zona c",19-06-2020 15:08,https://www.bing.com/th?id=ON.BF5628D621E9AF7AE8731D37C3883141,Chile,meganoticias
Dr. Ugarte llama a no confiarse y advierte sobre una ...,http://www.elquehaydecierto.cl/noticia/coronavirus/dr-ugarte-llama-no-confiarse-y-advierte-sobre-una-posible-segunda-ola-de-contagi,"Uno de los rostros más reconocidos hoy en día en la medicina de Chile es sin dudas el dr. Sebastián Ugarte, quien ha pasado por práxticamente todos los matinales como experto para hablar sobre el Covi",19-06-2020 15:09,https://www.bing.com/th?id=ON.D7CFC8793F4C88ACF775D67F35A16C2F,Chile,El Quehay Decierto
“COCINA PAÍS”: UNA INICIATIVA SOLIDARIA Y COLABORATIVA,https://eltipografo.cl/2020/06/cocina-pais-una-iniciativa-solidaria-y-colaborativa,"Son cerca de las 11:00 de la mañana y los chefs del local Mini Restaurant de Rancagua ya tienen listo el almuerzo: arroz primavera con pollo asado y pan amasado. Esta vez, estas preparaciones tendrán",19-06-2020 15:18,https://www.bing.com/th?id=ON.32192AFE63E43C32F8282C5D90EBFA6B,Chile,eltipografo.cl
La Región Metropolitana es la cuarta zona con más casos de ...,http://www.lanacion.cl/la-region-metropolitana-es-la-cuarta-zona-con-mas-casos-de-covid-19-en-el-mundo/,"Con los números en contra y un confinamiento que se resiste a aportar resultados positivos, por distintos factores, la Región Metropolitana anotó un triste lugar en la estadística mundial respecto del",19-06-2020 15:17,https://www.bing.com/th?id=ON.3F96CB3C4687FFA44B100E05C57BB009,Chile,La Nación
Más de 4.000 fallecidos por Covid-19 en Chile,https://www.radioagricultura.cl/nacional/2020/06/19/mas-de-4-000-fallecidos-por-covid-19-en-chile.html,"El Ministerio de Salud reportó 6.290 casos nuevos de Covid-19, de los cuales 5.016 fueron con síntomas y 675 se registraron como asintomáticos. En total, han existido 231.393 casos de contagio y 35.80",19-06-2020 15:20,https://www.bing.com/th?id=ON.F7C48E1093608A5DA46BA7F1C8B13A00,Chile,Radio Agricultura
"Paris descarta que Gobierno haya buscado la ""inmunidad de ...",https://www.biobiochile.cl/noticias/nacional/chile/2020/06/19/paris-descarta-gobierno-haya-buscado-la-inmunidad-rebano.shtml,"En el reporte diario por los casos de Covid-19, el ministro de Salud, Enrique Paris, se refirió a la polémica surgida por la política de rebaño, que consiste en esperar que mucha gente se contagie par",19-06-2020 15:24,https://www.bing.com/th?id=ON.7D14BF2F3F580FAE7C6EF9FD6B3DFA7C,Chile,Chile
Chile supera barrera de 4 mil fallecidos por COVID-19: 231 ...,https://www.lacuarta.com/cronica/noticia/reporte-contagios-covid-6/512581/,"El Ministerio de Salud actualizó las cifras que deja la pandemia en Chile, que continúan en constante alza. Un nuevo reporte de las cifras por COVID-19 entregó este viernes el Ministerio de Salud. Mon",19-06-2020 15:27,https://www.bing.com/th?id=ON.D0FFCAF31F3C367A7B22167BDE73750E,Chile,La Cuarta
Covid-19: Chile suma 4.093 muertos y 6.290 casos nuevos ...,https://www.latribuna.cl/nacional/2020/06/19/covid-19-chile-suma-4-093-muertos-y-6-290-casos-nuevos.html,"El Ministerio de Salud reportó 6.290 casos nuevos de Covid-19, de los cuales 5.016 fueron con síntomas y 675 se registraron como asintomáticos. En total, han existido 231.393 casos de contagio y 35.80",19-06-2020 15:27,https://www.bing.com/th?id=ON.4B162A12EC11F5823AF0CE0EC885D680,Chile,La Tribuna
Colapsa morgue en Calama: ordenan comprar de container ...,https://www.elciudadano.com/chile/colapsa-morgue-en-calama-ordenan-comprar-de-container-mortuorio/06/19/,"Las zonas de Antofagastas y Calama no dejan de ser noticia en Chile. Esta vez porque se ha posicionada en el tercer lugar más afectada el coronavirus. Las morgues, tanto de Calama como de Antofagasta,",19-06-2020 15:28,https://www.bing.com/th?id=ON.B9FDBF4D037B3AF2BB6DF19A0DF7431D,Chile,El Ciudadano
6.290 casos nuevos elevan cifra total de... | Puranoticia,https://www.puranoticia.cl/noticias/nacional/6-290-casos-nuevos-elevan-cifra-total-de-contagiados-a-231-393-personas/2020-06-19/111259.html,"6.290 son los casos nuevos diagnosticados con coronavirus Covid-19 en Chile, con lo que la cifra total de contagiados asciende a 231.393 personas con la enfermedad pulmonar calificada como pandemia. De igual forma, esta cifra de contagiados fue separada entre quienes presentaron síntomas y quienes",19-06-2020 15:28,https://www.bing.com/th?id=ON.C67FBC75122D33F3C919E9B5D3E888B4,Chile,Puranoticia.cl
Chile alcanza peak de contagios diarios y supera los 4.000 ...,https://www.cooperativa.cl/noticias/sociedad/salud/coronavirus/chile-alcanza-peak-de-contagios-diarios-y-supera-los-4-000-fallecidos/2020-06-19/110326.html,"Los fallecidos, informados por el Registro Civil, sumaron 252 personas. La cifra total de contagiados se elevó a 231.393. Recuerda nuestra campaña ""Todos podemos hacer más"", si tienes una iniciativa s",19-06-2020 15:30,https://www.bing.com/th?id=ON.2210F579926A928519FC1A3C3145D043,Chile,Radio Cooperativa
6.290 nuevos casos de Covid-19 en Chile que totaliza 231 ...,https://www.itvpatagonia.com/noticias/6-290-nuevos-casos-de-covid-19-en-chile-que-totaliza-231-393-diagnosticados-252-fallecidos-en-las-ultimas-jornadas/,"El Gobierno anunció que en las últimas horas se registraron 6.290 casos de contagio por Covid-19 en Chile, lo que eleva la cifra total a 231.393. Los fallecidos, informados por el Registro Civil, suma",19-06-2020 15:31,https://www.bing.com/th?id=ON.241B87C8AAB648F02F71140EF0636A3E,Chile,ITV
Universia organiza conversatorios virtuales con directivos ...,https://noticias.universia.cl/educacion/noticia/2020/06/18/1167982/universia-organiza-conversatorios-virtuales-directivos-comunicaciones-generar-intercambios-experiencias-situacion-covid-19.html,"Uno de los objetivos de Universia Chile es ser un punto de encuentro de sus 60 instituciones socias, en especial, de sus directivos, académicos y alumnos. Cada año se programan diversas iniciativas pa",19-06-2020 15:33,https://www.bing.com/th?id=ON.007A625A4F780C2800DD30E6CC1C5CB9,Chile,Universia Chile
Coronavirus en tiempo real: La curva de contagios en Chile ...,https://www.t13.cl/noticia/nacional/19-junio-2020-curva-contagios-coronavirus,Un médico de la región del Maule fue el primer paciente cuyos exámenes por COVID-19 dieron positivos en Chile. El profesional de 33 años llegó al país proveniente de un viaje que incluyó varios destin,19-06-2020 15:34,https://www.bing.com/th?id=ON.596331403BED14405B844F353FCE7C0B,Chile,T13
Chile supera los 4 mil muertos por coronavirus tras ...,https://elpinguino.com/noticia/2020/06/19/chile-supera-los-4-mil-muertos-por-coronavirus-tras-confirmarse-otros-252-fallecidos,"El Ministerio de Salud, durante este viernes, reportó que los casos de Covid-19 en el país sumaron 6.290 contagios en las últimas 24 horas, 5.016 de éstos sintomáticos, 599 asintomáticos y 675 no noti",19-06-2020 15:34,https://www.bing.com/th?id=ON.82F3E69EB860EF234D3127D4B30BC449,Chile,ELPINGUINO
Minsal informó de 252 muertes más por Covid-19 y 6.290 ...,http://www.lanacion.cl/minsal-informo-de-252-muertes-mas-por-covid-19-y-6-290-nuevos-casos/,"El Ministerio de Salud, encabezado por Enrique Paris, entregó un nuevo balance respecto a la pandemia por coronavirus en Chile, señalando que se produjeron 252 víctimas fatales más por esta enfermedad",19-06-2020 15:36,https://www.bing.com/th?id=ON.BE4D04D9CCAD5BB08F3CAAD6B5AAAE72,Chile,La Nación
CHILE SE ACERCA AL MILLÓN DE EXÁMENES REALIZADOS POR COVID-19,http://www.radiopolar.com/noticia_158212.html,CHILE SE ACERCA AL MILLÓN DE EXÁMENES REALIZADOS POR COVID-19. 19-06-2020 - 12:32. Twittear. Total de casos en Chile 231.393 6.290 casos últimas horas 5.016 con síntomas 599 sin síntomas Fallecidos a la fecha 4.093 Pacientes en UCI 1.911 395 estado crítico 35.609 pacientes activos,19-06-2020 15:36,https://www.bing.com/th?id=ON.E0B4552673EF8BFFC891C11F0CDB207D,Chile,Radio Polar
Chile supera las 4 mil víctimas fatales a causa ...,https://www.puranoticia.cl/noticias/nacional/chile-supera-las-4-mil-victimas-fatales-a-causa-de-la-pandemia-reportan/2020-06-19/113502.html,"252 personas fallecieron durante las últimas 24 horas en Chile a causa del coronavirus Covid-19. Así lo dio a conocer el subsecretario de Redes Asistenciales, Arturo Zúñiga, en base a datos recopilado",19-06-2020 15:37,https://www.bing.com/th?id=ON.EA8B1A6A78761C06451FCEFE7DE301FB,Chile,Puranoticia.cl
6 Historias de chilenos conviviendo con el covid-19 en “la ...,https://www.radiosantiago.cl/archivo/133638,"Son pasadas las 00:32 horas del lunes 15 de junio y la intersección entre las calles Schulstraße y Reinickendorfer Straße, en Berlín, está casi desierta. Una mujer en bicicleta, tres peatones y un hom",19-06-2020 15:38,https://www.bing.com/th?id=ON.0F816E1D9F186E788196934410671172,Chile,Radio Santiago
Chile supera los 4 mil fallecidos por Covid-19 y reporta 6 ...,https://www.diariosenred.com/nacional/chile-supera-los-4-mil-fallecidos-por-covid-19-y-reporta-6-290-nuevos-casos,"El país ya sobrepasó las 4 mil víctimas fatales de Coronavirus.  Este viernes 19 de junio, el informe tuvo el peor registro de decesos. En el reporte diario entregado por el Ministerio de Salud (Minsa",19-06-2020 15:38,https://www.bing.com/th?id=ON.D5389A97499F2F25FE6C1E03AEA83F56,Chile,Diarios en Red
Chile superó los 4 mil muertos y llegó 231.393 casos de ...,https://www.prensafutbol.cl/358214-informe-coronavirus-chile-19-de-junio-de-2020-covid19/,"El ministerio de Salud de Chile entregó el informe diario con el avance del COVID-19 en el país, el cual dejó 252 nuevos fallecidos y subió un total de 4.093 víctimas fatales. Y se sumaron 6.290 conta",19-06-2020 15:42,https://www.bing.com/th?id=ON.D76A2ADE8941A43B6C58E2A36B1847B8,Chile,Prensafútbol
Fallecidos por covid-19 llegan a 4.093 en Chile: contagios ...,https://www.diarioconcepcion.cl/pais/2020/06/19/fallecidos-por-covid-19-llegan-a-4-093-en-chile-contagios-suman-231-393.html,"Un nuevo balance entregado este viernes por el Ministerio de Salud reveló que Chile registró 252 nuevos decesos y 6.290 casos positivos de covid-19, durante las últimas 24 horas. Del total de nuevos c",19-06-2020 15:43,https://www.bing.com/th?id=ON.3D9B21CF578D8DC1B255DEE6F1EF3AE9,Chile,El Diario de Concepcion
Cómo es la “nueva normalidad”: historias de chilenos ...,https://www.publimetro.cl/cl/noticias/2020/06/18/la-nueva-normalidad-historias-chilenos-conviviendo-covid-19-extranjero.html,"En Berlín, Berna, Roma, Madrid, Auckland y Sydney disminuyeron las cifras por covid-19 y comenzó el relajo de las medidas. Seis chilenos que viven allá cuentan cómo la vida nocturna, manifestaciones y",19-06-2020 15:46,https://www.bing.com/th?id=ON.6B85603F3E16D90A6E37FFF86B97AB8E,Chile,publimetro.cl
Fallecidos sin confirmación de PCR se informarán el sábado ...,https://www.emol.com/noticias/Nacional/2020/06/19/989593/Fallecidos-sin-PCR-reporte-semanal.html,"Hasta el momento, la cifra de fallecidos por covid-19 reportada por el Ministerio de Salud incluye exclusivamente a aquellos pacientes que tienen el virus como causa de muerte en el certificado de def",19-06-2020 15:49,https://www.bing.com/th?id=ON.9EC2747425030FFF72DD530133D87E58,Chile,Emol
Minsal anuncia que reporte de fallecidos incorporará ...,https://www.theclinic.cl/2020/06/19/minsal-anuncia-que-reporte-de-fallecidos-incorporara-muertes-sin-confirmacion-de-laboratorio/,"El Jefe del Departamento de Epidemiología del Ministerio de Salud, Rafael Araos, anunció que a partir de este sábado el reporte de fallecidos por Covid -19 en Chile incorporará la información proporci",19-06-2020 15:50,https://www.bing.com/th?id=ON.ABECCA89891EA71CEFFF4F36986A1ED1,Chile,Clinic
Chile registra 6.290 nuevos contagiados y 252 fallecidos ...,https://www.theclinic.cl/2020/06/19/chile-registra-6-290-nuevos-contagiados-y-252-fallecidos-por-covid-19-en-ultima-jornada/,"El subsecretario de Redes Asistenciales, Arturo Zúñiga, informó que hasta ayer a las 21 horas Chile registró 6.290 nuevos contagiados de Covid-29, con 5.016 personas con síntomas, 599 asintomáticos y",19-06-2020 15:50,https://www.bing.com/th?id=ON.4A97DACED8270025BB45EA68E605EE38,Chile,Clinic
Minsal comenzará a reportar fallecidos probables por Covid-19,https://www.radioagricultura.cl/nacional/2020/06/19/minsal-comenzara-a-reportar-fallecidos-probables-por-covid-19.html,"El jefe de epidemiología del Minsal, Rafael Araos, anunció que a partir de mañana el informe epidemiológico incluirá un reporte de muertes por Covid-19, aunque no tengan una confirmación por parte de",19-06-2020 15:54,https://www.bing.com/th?id=ON.E8E6F323D1992BBBE7057184322D03A0,Chile,Radio Agricultura
Latam prevé una “tímida” recuperación de la demanda en lo ...,https://www.elmostrador.cl/mercados/2020/06/19/latam-preve-una-timida-recuperacion-de-la-demanda-en-lo-que-queda-de-ano/,"Antes de la pandemia, Latam operaba cerca de 1.400 vuelos diarios a 145 destinos en 26 países y contaba con una flota de 332 aviones, pero hasta junio operaba sólo un 5 % de sus líneas, manteniendo só",19-06-2020 15:56,https://www.bing.com/th?id=ON.7C35389B44A8E9C0D104FC8D7D3930BB,Chile,El Mostrador
Autoridades chinas confirman que no existe restricción ...,https://elpinguino.com/noticia/2020/06/19/autoridades-chinas-confirman-que-no-existe-restriccion-para-importaciones-de-salmon-chileno,"La directora nacional de Sernapesca, Alicia Gallardo Lagno; y autoridades de la Administración General Aduanera de la República de China, confirmaron que no existe ninguna restricción para el ingreso",19-06-2020 16:08,https://www.bing.com/th?id=ON.CBD44A9E95082479AC2F4C27E066C24B,Chile,ELPINGUINO
