name,url,description,datePublished,imagen,pais,Fuente
Reporte Covid-19: 44 nuevos contagios a nivel regional,http://www.eldivisadero.cl/noticia-62967,"La Seremi de Salud Aysén informó este lunes 44 nuevos contagios por Covid-19 en nuestra región. Se trata de 37 casos confirmados mediante examen PCR o test de antígenos, de los cuales 20 son de Coyhai",14-06-2021 17:54,https://www.bing.com/th?id=OVFT.zBQxmmBVhAH4zxb_znmwTy,Chile,Diario el Divisadero
Covid-19: Chile presenta 4.347 casos nuevos y 57 fallecidos en las últimas 24 horas,https://www.latribuna.cl/noticias/2021/06/16/covid-19-chile-presenta-4-347-casos-nuevos-y-57-fallecidos-en-las-ultimas-24-horas.html,"La cifra total de personas que han sido diagnosticadas con COVID-19 en el país alcanza a las 1.491.561. De ese total, 39.176 pacientes se encuentran en etapa activa. Los casos recuperados son 1.420.36",16-06-2021 14:13,https://www.bing.com/th?id=OVFT.eVxw9ibjncXSueHLaSN3gC,Chile,La Tribuna
COVID-19 Empresa chilena inaugura primer laboratorio en el país que tendrá resultados PCR en menos de 4 horas,https://www.diariolongino.cl/covid-19-empresa-chilena-inaugura-primer-laboratorio-en-el-pais-que-tendra-resultados-pcr-en-menos-de-4-horas/?print=print,"GenoSUR hizo la presentación este miércoles y tiene como innovación que entregará resultados de exámenes de  PCR en un máximo de 4 horas, siendo así el primer laboratorio en tener tiempos de entrega t",17-06-2021 03:41,https://www.bing.com/th?id=OVFT.30hlUQ0pzVxbCJ7k2ozyjC,Chile,El Longino
"NUEVOS CASOS DE COVID-19 COMIENZAN A BAJAR, CON UNA OCUPACIÓN HOSPITALARIA Y MORTALIDAD EN NIVELES CRÍTICOS",http://www.radiopolar.com/noticia_167677.html,"El equipo ICOVID Chile, iniciativa liderada por la Universidad de Chile, la Pontificia Universidad Católica de Chile y la Universidad de Concepción, presentó su informe número 45 con análisis y datos",17-06-2021 18:27,https://www.bing.com/th?id=OVFT.8YoNgx3C-Iljk0SUAO3o_y,Chile,Radio Polar
"Estados Unidos recomienda no viajar a Chile: niveles de Covid-19 son ""muy altos""",https://www.13.cl/programas/servicios-13/salud/estados-unidos-recomienda-no-viajar-a-chile-niveles-de-covid-19-son-muy,"La Oficina de Asuntos Consulares del Departamento de Estado de Estados Unidos recomendó a sus ciudadanos que no viajen a Chile por los altos niveles de contagios de coronavirus. Además, la oficina agr",18-06-2021 14:36,https://www.bing.com/th?id=OVFT.3q363JskWckF2IleyPEPDC,Chile,13.cl
DEIS: Decesos por covid-19 en Chile llegarían a 40.455 sumando confirmados y sospechosos,https://www.emol.com/noticias/Nacional/2021/06/19/1024437/decesos-covid19-confirmados-sospechosos.html,"A los 31.392 fallecimientos informados por la cartera, se sumarían 9.063 que aún están a la espera de resultado del examen de PCR.",19-06-2021 03:45,https://www.bing.com/th?id=OVFT.6H5vUTTLRHdtZnxSBGS5oy,Chile,Emol
Defensa de Bolivia: «Vamos dispuestos a dar todo lo que tenemos»,https://www.prensafutbol.cl/415555-defensa-de-bolivia-estamos-dispuestos-a-dar-todo-lo-que-tenemos/,"Bolivia no ha tenido una fácil Copa América, debido a la cantidad de contagiados por Covid-19 y la caída en el debut por 1-3 ante Paraguay. De cara al duelo contra Chile este viernes 18 de junio, el j",19-06-2021 04:13,https://www.bing.com/th?id=OVFT.Q3T2vKxrl5EAqoJCG0R4li,Chile,Prensafútbol
Columna de Marcela Potin: ¿Qué pasa que la evolución de la pandemia parece tan lenta en Chile?,https://www.latercera.com/la-tercera-sabado/noticia/columna-de-marcela-potin-que-pasa-que-la-evolucion-de-la-pandemia-parece-tan-lenta-en-chile/Z7KVX62Y4VFF7MMPRPA2XIJWAY/,"Si bien la estrategia de vacunación anti Covid-19 en Chile es un orgullo, surge la pregunta sobre qué pasa que la evolución de la pandemia parece tan lenta. Algunos factores importantes son probableme",19-06-2021 04:42,https://www.bing.com/th?id=OVFT.jKWTDsqnuidwb83rbr5kXC,Chile,LA TERCERA
"Abren postulaciones al Fondo Concursable “Con tu Aporte, Crecemos 2021” de Minera Lumina Copper Chile",https://www.chanarcillo.cl/abren-postulaciones-al-fondo-concursable-con-tu-aporte-crecemos-2021-de-minera-lumina-copper-chile/,"Debido a la pandemia Covid-19, todo el proceso se realizará de manera online a través de la página www.fondoconcursablecaserones.cl. Hasta el 6 de julio se extenderá el plazo para postular al Fondo Co",19-06-2021 10:16,https://www.bing.com/th?id=OVFT.AYBC4V1W9ruKyl2I9hzaxS,Chile,Diario Chanarcillo
Colombia no pudo doblegar a Venezuela y sólo igualó sin goles,https://www.prensafutbol.cl/415742-colombia-no-pudo-doblegar-a-venezuela-y-solo-igualo-sin-goles/,"No hubo máxima expresión del fútbol en Goiânia. En un compromiso válido a la fecha 2 de la Copa América, la selección de Colombia no pudo derribar al fondo de la selección venezolana pese a sus innume",19-06-2021 10:39,https://www.bing.com/th?id=OVFT.IejOXJqVK9ajL24AbhEJci,Chile,Prensafútbol
"Asech entrega propuestas para el control de la pandemia, ayuda a las pymes y reaperturas",https://www.radioagricultura.cl/nacional/2021/06/19/asech-entrega-propuestas-para-el-control-de-la-pandemia-ayuda-a-las-pymes-y-reaperturas.html,"Debido a las consecuencias económicas y sociales derivadas de la pandemia de Covid-19, la Asociación de Emprendedores de Chile (Asech)",19-06-2021 11:51,https://www.bing.com/th?id=OVFT.zPKUMb_XaeHaIO619TE7li,Chile,Radio Agricultura
Rugby Callaquén: un gigante dormido que espera el retorno a las canchas,https://www.latribuna.cl/noticias/2021/06/19/rugby-callaquen-un-gigante-dormido-que-espera-el-retorno-a-las-canchas.html,"“Tenemos una gran responsabilidad en nuestros hombros, pues somos el mejor equipo de rugby en la región. Esto es un gran incentivo para nuestros jóvenes principalmente, quienes serán, en el mediano pl",19-06-2021 12:40,https://www.bing.com/th?id=OVFT.5LcEXlcAhrgoFr9SsR689y,Chile,La Tribuna
Coronavirus en Chile: 6.263 nuevos casos y 133 fallecidos en las últimas 24 horas,https://www.t13.cl/noticia/nacional/coronavirus-chile-6.263-nuevos-casos-y-133-fallecidos-ultimas-24-horas,El Ministerio de Salud confirmó este lunes la ocurrencia de 6.263 nuevos contagios con COVID-19 y 133 muertes por las enfermedad en las últimas 24 horas. La autoridad sanitaria indicó que del total de,19-06-2021 14:08,https://www.bing.com/th?id=OVFT.17UMvwwVJnY0961vD7L0gi,Chile,T13
Presidente del Colegio Médico de Valparaíso destacó el rol de los TENS en la pandemia,https://elproa.cl/2021/06/presidente-del-colegio-medico-de-valparaiso-destaco-el-rol-de-los-tens-en-la-pandemia/,"El doctor Luis Ignacio De la Torre compartió con estudiantes de la carrera Técnico en Enfermería, donde entregó cifras sobre el aumento de la capacidad hospitalaria del país, lo que … Leer más",19-06-2021 15:04,https://www.bing.com/th?id=OVFT.XbdDe5foX2Eingnpk9gEsS,Chile,elproa.cl
"Covid-19 en Chile: Minsal informó 133 muertes en las últimas 24 horas, llegando a un total de 31.392 fallecidos",https://www.adnradio.cl/nacional/2021/06/19/covid-19-en-chile-minsal-informo-133-muertes-en-las-ultimas-24-horas-llegando-a-un-total-de-31-392-fallecidos.html,"El ministerio de Salud (Minsal) notificó este sábado 19 de junio 133 muertes por covid-19 en Chile en las últimas 24 horas, de acuerdo con la certificación del Departamento de Estadística e Informació",19-06-2021 15:06,https://www.bing.com/th?id=OVFT.-_7-rmPS4IXNAw9LMfzbBC,Chile,ADN
Minsal informó 6.263 casos nuevos de covid-19 en Chile: contagiados totales alcanzaron 1.511.275,https://www.adnradio.cl/nacional/2021/06/19/minsal-informo-6-263-casos-nuevos-de-covid-19-en-chile-contagiados-totales-alcanzaron-1-511-275.html,"El ministerio de Salud ( Minsal) informó este sábado 19 de junio 6.263 casos nuevos de coronavirus covid-19 en Chile en las últimas 24 horas, alcanzando un total de 1.511.275 contagiados desde el inic",19-06-2021 15:13,https://www.bing.com/th?id=OVFT.w4aEAzv0SuoI9QiJno2oQy,Chile,ADN
"Minsal reportó 6.263 contagios por Covid-19: positividad fue de un 7,77 por ciento a nivel nacional",https://www.theclinic.cl/2021/06/19/minsal-reporto-6-263-contagios-por-covid-19-positividad-fue-de-un-777-por-ciento-a-nivel-nacional/,Eldemás Minsal informó además que en las últimas 24 horas se registraron 133 personas fallecidas por causas asociadas al Covid-19.,19-06-2021 15:55,https://www.bing.com/th?id=OVFT.AKgT7vyhMn8803JXIVaynS,Chile,Clinic
"Los ""Europeos"" que juegan Copa América, encabezados por Ben Brereton",https://www.13.cl/programas/copa-america/noticias/los-europeos-que-juegan-copa-america-encabezados-por-ben-brereton,"Hay cuatro jugadores que nacieron en el Viejo Continente pero representas a sus selecciones en esta Copa América, por Chile está el ya querido Ben Brereton. La Copa América con toque europeo Gianluca",19-06-2021 16:33,https://www.bing.com/th?id=OVFT.YWbmPJ2vmsCZWDmERZQQVC,Chile,13.cl
"Informe Epidemiológico: Puente Alto, Maipú y Santiago lideran como las comunas con más casos activos de Covid-19",https://www.radioagricultura.cl/nacional/2021/06/19/informe-epidemiologico-puente-alto-maipu-y-santiago-lideran-como-las-comunas-con-mas-casos-activos-de-covid-19.html,"Durante este sábado 19 de junio, el Ministerio de Salud (Minsal) publicó el 130° Informe Epidemiológico, que detalla los casos de",19-06-2021 17:45,https://www.bing.com/th?id=OVFT.zPKUMb_XaeHaIO619TE7li,Chile,Radio Agricultura
Posibles cambios al Plan Paso a Paso se conocerán la próxima semana,http://www.ladiscusion.cl/posibles-cambios-al-plan-paso-a-paso-se-conoceran-la-proxima-semana/,"El Ministerio de Salud entregó su balance respecto a la reunión sostenida este sábado por diversas organizaciones, con el fin de estudiar los posibles cambios al Plan Paso a Paso. Según detalló el",19-06-2021 18:31,https://www.bing.com/th?id=OVFT.aSydn-CigIrNpYCzf8TKcy,Chile,La Discusión
Chile suma 6.263 casos positivos y 133 muertes por covid-19,https://www.diarioconcepcion.cl/pais/2021/06/19/chile-suma-6-263-casos-positivos-y-133-muertes-por-covid-19.html,"Este sábado 19 de junio el Ministerio de Salud informó en el reporte covid-19 que Chile registró 133 nuevos decesos inscritos y 6.263 casos positivos. Del total de nuevos contagios, 4.224 fueron sinto",19-06-2021 19:06,https://www.bing.com/th?id=OVFT.Hs5wsK3vou3Ar0BkXoEtQy,Chile,El Diario de Concepcion
DEIS: Chile supera los 40 mil fallecimientos atribuidos al Covid-19 tras sumar 1.056 decesos confirmados y sospechosos,https://www.latercera.com/nacional/noticia/deis-chile-supera-los-40-mil-fallecimientos-atribuidos-al-covid-19-tras-sumar-1056-decesos-confirmados-y-sospechosos/B42MXG7LFVEFZCDYTHDDKEVSQY/,"De acuerdo a la actualización semanal de defunciones del Departamento de Estadísticas e Información de Salud del Minsal, desde el inicio de la pandemia se han registrado 31.392 muertes confirmadas y 9",19-06-2021 19:14,https://www.bing.com/th?id=OVFT.Mqj6QIzcSISnI7Cdmgf7yy,Chile,LA TERCERA
Minsal se reunió con expertos para analizar medidas del Plan Paso a Paso,https://www.elperiodista.cl/2021/06/minsal-se-reunio-con-expertos-para-analizar-medidas-del-plan-paso-a-paso/,"Las autoridades sanitarias intercambiaron hoy impresiones con representantes de 140 organizaciones, entre ellas varias de profesionales, como el Colegio Médico, sobre la marcha de la estrategia sanita",19-06-2021 19:22,https://www.bing.com/th?id=OVFT.opXWY0oaLUE5j1Xh4HrkxS,Chile,El Periodista
Más de 40 mil fallecidos (probables y certificados) suman en Chile producto del Covid,https://www.elperiodista.cl/2021/06/mas-de-40-mil-fallecidos-probables-y-certificados-suman-en-chile-producto-del-covid/,"El informe epidemiológico número 130, dado a conocer esta mañana por el Minsal, reportó que en Chile, desde el 3 de marzo de 2020 hasta el 16 de junio han fallecido 40.365 personas, entre casos probab",19-06-2021 19:54,https://www.bing.com/th?id=OVFT.MgSqmqBo98EGAS8rYEW7SC,Chile,El Periodista
Informe epidemiológico: Siete comunas de la Región Metropolitana lideran los casos de contagios,https://www.t13.cl/noticia/nacional/informe-epidemiologico-siete-comunas-region-metropolitana-lideran-casos-contagios,"Este sábado fue publicado el 130° Informe Epidemiológico del Ministerio de Salud, en el que se establece la cantidad de casos activos por comunas, además de otros datos relacionados con las consecuenc",19-06-2021 20:07,https://www.bing.com/th?id=OVFT.rFYkkZhfIjkyZLlM92YbAS,Chile,T13
Marcelo Díaz defiende enojo de Vidal por su cambio ante Bolivia: “En caliente es muy difícil pensar”,https://www.publimetro.cl/cl/grafico-chile/2021/06/19/marcelo-diaz-defiende-enojo-vidal-cambio-bolivia-caliente-dificil-pensar.html,"El jugador de Racing aseguró además que con el formado en Colo Colo en la cancha, la Roja “fue más” ante Bolivia que cuando dejó el terreno.",19-06-2021 21:01,https://www.bing.com/th?id=OVFT.SXdFsaJVcWp373HeTCGaVC,Chile,publimetro.cl
Libres de coronavirus: Las 14 comunas que no presentan casos activos en Chile,https://www.meganoticias.cl/nacional/340988-informe-epidemiologico-comunas-libres-coronavirus-colchane-rapa-nui-torres-del-paine-19-06-2021.html,El ministerio de Salud dio a conocer este sábado las comunas que no presentan casos activos de coronavirus en Chile. La información fue entregada en un nuevo Informe Epidemiológico.,19-06-2021 21:15,https://www.bing.com/th?id=OVFT.FJmQTyTCqnk6h68QkdOuKS,Chile,meganoticias
Vacunación Covid-19 | ¿Qué se puede hacer y qué no después de vacunarme?,https://redgol.cl/tendencias/Vacunacion-Covid-19--Que-se-puede-hacer-y-que-no-despues-de-vacunarme-20210619-0067.html,"No hay normas generales pero sí varias recomendaciones para las personas que se vacunan. El calendario de vacunación contra el Covid-19 está cerrando el círculo en Chile, con la inoculación de las per",19-06-2021 21:28,https://www.bing.com/th?id=OVFT.ameQ-vCMYAt7aA4azNWpgC,Chile,redgol
Conoce el calendario vacunación Covid-19 en Chile tras los cambios al proceso por nuevo feriado,https://www.elmostrador.cl/noticias/multimedia/2021/06/19/conoce-el-calendario-vacunacion-covid-19-en-chile-tras-los-cambios-al-proceso-por-nuevo-feriado/,"La principal modificación es que el viernes se iban a poder vacunar rezagados de 18 y 19 años, lo que finalmente no ocurrirá. De todas formas, ambos grupos etarios están considerados en la inoculación",19-06-2021 21:37,https://www.bing.com/th?id=OVFT.n1E-1n-EsPdS2LhQycMeBC,Chile,El Mostrador
"Más de 500.000 muertos por covid-19 en Brasil, amenazado por una tercera ola",https://www.biobiochile.cl/noticias/internacional/america-latina/2021/06/19/mas-de-500-000-muertos-por-covid-19-en-brasil-amenazado-por-una-tercera-ola.shtml,"Brasil superó el sábado la marca de 500.000 muertos por covid 19 y avizora la tercera ola de una pandemia agravada, según los expertos, por la oposición del gobierno de Jair Bolsonaro al uso de máscar",19-06-2021 23:11,https://www.bing.com/th?id=OVFT.iCISdWpPF2Q6laKMziGB3S,Chile,Chile
DEIS: Chile tiene menos casos activos de Covid-19 que hace una semana,https://www.elmostrador.cl/dia/2021/06/19/deis-chile-tiene-menos-casos-activos-de-covid-19-que-hace-una-semana/,"Por otro lado el país superó las 40.000 muertes —desde el inicio de la pandemia— entre pacientes con Covid-19 confirmado y con sospecha de contagio, cerca de la mitad de ellas se han registrado en lo",20-06-2021 00:24,https://www.bing.com/th?id=OVFT.wARgHsyn46ndoRmobzo9HC,Chile,El Mostrador
Pacientes covid-19 en camas UCI: Hay 303 más que hace un mes y la mayoría se concentra entre los 50 y 59 años,https://www.emol.com/noticias/Nacional/2021/06/19/1024412/camas-uci-en-chile.html,"Las regiones de Coquimbo, Tarapacá y Metropolitana son las que cuentan con la menor capacidad, en proporción al número de cupos que tienen habilitados.",20-06-2021 00:33,https://www.bing.com/th?id=OVFT.Lqkax7DYnUwOXf0JtmKbci,Chile,Emol
Phoenix Suns vs L.A Clippers | Ver EN VIVO la primera final de la conferencia Oeste de la NBA,https://redgol.cl/redsport/Phoenix-Suns-vs-L.A-Clippers-por-el-juego-1-de-la-serie-final-de-la-conferencia-Oeste-de-la-NBA-20210619-0070.html,Los hombres de Phoenix lograron llegar a este trascendental encuentro tras dejar en el camino a Denver Nuggets por un contundente 4-0en la serie de semifinales. Los Suns han tenid,20-06-2021 01:10,https://www.bing.com/th?id=OVFT.KtX3L9KWI6QdHt9iNCYLzi,Chile,redgol
Canciones románticas del siglo XIX con Andrea Aguilar y Liza Chung,https://www.beethovenfm.cl/evento/canciones-romanticas-del-siglo-xix-con-andrea-aguilar-y-liza-chung/,"Canciones de Schumann, Dvorák y Brahms abordan la soprano Andrea Aguilar y la pianista Liza Chung en una nueva entrega de Música UC.",20-06-2021 01:56,https://www.bing.com/th?id=OVFT.-7UzjPioBQsp7y1X6s7mVS,Chile,Beethoven FM
Provincia de Bío Bío reporta 103 casos nuevos por covid-19: Los Ángeles sumó 53,https://www.biobiochile.cl/noticias/nacional/region-del-bio-bio/2021/06/19/provincia-de-bio-bio-reporta-103-casos-nuevos-por-covid-19-los-angeles-sumo-53.shtml,"Cifras menores a las dadas a conocer en el reporte del viernes donde hubo 170 nuevos contagios y 962 personas activas. En esta ocasión, el informe sanitario dio cuenta que Los Ángeles tuvo 53 nuevos c",20-06-2021 02:32,https://www.bing.com/th?id=OVFT.hOOMR1BhhTlIBIdw_zWIIi,Chile,Chile
"Minsal reporta 6.263 nuevos contagios y 133 decesos: Positividad llegó a 7,77%, la más baja en un mes",http://www.diarioelheraldo.cl/noticia/minsal-reporta-6263-nuevos-contagios-y-133-decesos-positividad-llego-a-777-la-mas-baja-en-un-mes,"Hoy, el Ministerio de Salud (Minsal) realizó un nuevo reporte por la situación de la pandemia del covid-19 en el país e informó 6.263 casos",20-06-2021 03:16,https://www.bing.com/th?id=OVFT.-aw4ZjxSKNhKzhZ-txghwC,Chile,El Heraldo
"Infectóloga: Una vez que se controle la pandemia, es probable que haya que vacunarse cada año",http://www.diarioelheraldo.cl/noticia/infectologa-una-vez-que-se-controle-la-pandemia-es-probable-que-haya-que-vacunarse-cada-ano,"La infectóloga María Luz Endeiza advirtió que no estar vacunado contra el Covid-19 representa un ""riesgo altísimo"" para la salud propia y de los demás, y planteó que en el futuro, cuando se logre cont",20-06-2021 03:18,https://www.bing.com/th?id=OVFT.BWGioelyZRrFpUzP3mjK8S,Chile,El Heraldo
Taller internacional abordará desafíos del envejecimiento y de la pandemia por Covid-19,https://www.diarioconcepcion.cl/ciudad/2021/06/20/taller-internacional-abordara-desafios-del-envejecimiento-y-de-la-pandemia-por-covid-19.html,"Las jornadas forman parte de un intercambio académico y científico entre Chile y Cuba, impulsado por la Dirección de Relaciones Internacionales de la Universidad de Concepción.",20-06-2021 07:03,https://www.bing.com/th?id=OVFT.GQ802DunuHeuWFUYciC_Ki,Chile,El Diario de Concepcion
Cuarentenas: Conoce todas las comunas que permanecen en confinamiento total en Chile,https://www.meganoticias.cl/dato-util/340705-minsal-comunas-en-cuarentena-hoy-fase-1-covid-20-06-2021.html,"Para contener la pandemia de Covid-19 en Chile, el Ministerio de Salud ha establecido cuarentenas totales en diversas comunas del país. Conoce el listado de comunas aquí.",20-06-2021 09:03,https://www.bing.com/th?id=OVFT.v2j3bOo4jHSUYpkQrw-ySy,Chile,meganoticias
