name,url,description,datePublished,imagen,pais,Fuente
Diputado impulsará proyecto para que la vacuna contra el ...,https://www.chilevision.cl/contigo-en-la-manana/mejores-momentos/diputado-impulsara-proyecto-para-que-la-vacuna-contra-el-covid-19-sea,"Durante esta mañana y junto a un panel político se debatió la propuesta del diputado DC Gabriel Silber, quien presentará una moción para que la vacuna contra el COVID-19 sea obligatoria en el país.",05-01-2021 20:05,https://www.bing.com/th?id=OVFT.xQuDQjN1F7Rja2et1yDUhS,Chile,chilevision.cl
Funcionarios de UCI público y privadas de Puerto Montt ...,http://www.cronicalibre.cl/2021/01/05/funcionarios-de-uci-publico-y-privadas-de-puerto-montt-osorno-y-castro-se-suman-a-vacunacion-covid-19/,"Al Hospital Puerto Montt llegaron hoy 500 vacunas Pfizer contra el COVID 19, correspondientes a la primera dosis destinada a los funcionarios UCI de los hospitales de Osorno, Castro, además del Hospit",05-01-2021 21:11,https://www.bing.com/th?id=OVFT.P786iWV2fM01rWYd_JPEJi,Chile,cronicalibre.cl
Tarapacá es la primera región de la zona norte de Chile en ...,https://www.elperiodista.cl/tarapaca-es-la-primera-region-de-la-zona-norte-de-chile-en-recibir-la-vacuna-contra-el-covid-19/,"Cumpliendo con el anuncio del Gobierno, este martes llegaron las primeras dosis de la vacuna contra el COVID-19 a la región de Tarapacá, zonas que ha registrado un alto aumento de casos positivos en l",05-01-2021 21:28,https://www.bing.com/th?id=OVFT.E2Qy819lQvFVmhnDcFM0Qi,Chile,El Periodista
OvejeroNoticias Desde el próximo martes 12 de enero se ...,https://www.ovejeronoticias.cl/2021/01/desde-el-proximo-martes-12-de-enero-se-reabren-al-publico-las-reservas-nacionales-magallanes-y-laguna-parrillar/,"Desde el próximo martes 12 de enero vuelven a abrir al público las reservas nacionales Magallanes y Laguna Parrillar, áreas silvestres protegidas del Estado de Chile que son administradas por",05-01-2021 21:36,https://www.bing.com/th?id=OVFT.yJqtqnjqC8e8T7c-nTuBBC,Chile,Ovejero Noticias
Minsal prepara aumento de camas UCI en la zona norte tras ...,http://www.lanacion.cl/minsal-prepara-aumento-de-camas-uci-en-la-zona-norte-tras-alza-en-contagios/,"El titular de Salud, Enrique Paris, sostuvo en el marco de su visita para informar de las primeras vacunaciones contra el coronavirus en Tarapacá, que en este momento ""la Región de Tarapacá tiene la p",05-01-2021 22:11,https://www.bing.com/th?id=OVFT.Q_K7tAbiMV7YgB9dHZ6Sjy,Chile,La Nación
Indulto al 18-0 se enfrenta con cifras del Poder Judicial ...,https://www.pauta.cl/nacional/poder-judicial-cifras-detenidos-estallido-social-indulto,La vocera de la Corte Suprema aclara cifras que algunos senadores de oposición llegaron a estimar en más de 800 casos.,05-01-2021 22:54,https://www.bing.com/th?id=OVFT.bcgrcWg2ECgvK-Azbq_PIS,Chile,pauta
El fantasma del confinamiento sobrevuela Europa ante ...,https://www.elperiodista.cl/el-fantasma-del-confinamiento-sobrevuela-europa-ante-propagacion-del-coronavirus/,"A nivel mundial, en las últimas 24 horas la Covid-19 dejó más de medio millón de casos y más de 10.000 defunciones, elevando los totales a 85,7 millones y 1,85 millones, respectivamente, de acuerdo co",05-01-2021 22:59,https://www.bing.com/th?id=OVFT.GdxQl_azlD01SND1zGMKMy,Chile,El Periodista
Ministro Paris le confirma a Diputado Calisto que en 45 ...,http://vientopatagon.cl/2021/01/05/ministro-paris-le-confirma-a-diputado-calisto-que-en-45-dias-se-vacunara-a-todos-los-funcionarios-de-la-salud-de-la-region/,"Santiago.- Este lunes el diputado Miguel Ángel Calisto se reunió con el Ministro de Salud, Enrique Paris, para solicitarle el inicio del proceso de vacunación para los funcionarios de la salud de la r",05-01-2021 23:31,https://www.bing.com/th?id=OVFT.rQtOjSQGSOeKBg0j35b6DC,Chile,Viento Patagon
El Ciudadano | Pfizer afirma que efectividad de 95 % de su ...,https://www.elciudadano.com/chile/pfizer-afirma-que-efectividad-de-95-de-su-vacuna-se-logra-despues-de-la-segunda-dosis/01/05/,"Según la farmacéutica, ""las personas pueden haber contraído la enfermedad antes o inmediatamente después de ser vacunadas"".",06-01-2021 00:42,https://www.bing.com/th?id=OVFT.sSuwJ2tqcQG5_SlNgTgW2C,Chile,El Ciudadano
Diputados DC presentan proyecto de ley por obligatoriedad ...,http://elproa.cl/web/detallenoticia.asp?id=32491,Martes 5 de Enero de 2021 Diputados DC presentan proyecto de ley por obligatoriedad de vacuna contra el Covid-19 “Veremos quienes quieren exacerbar el individualismo y quienes e,06-01-2021 01:26,https://www.bing.com/th?id=OVFT.KDJgStZl5MXZTPI2CwzHhS,Chile,elproa.cl
Chile podría fabricar vacunas contra el coronavirus en el ...,https://www.meganoticias.cl/nacional/323438-vacuna-chilena-coronavirus-fabricacion-en-el-sur-de-chile-felipe-tapia-jrx07.html,"En el sur de Chile se podrían fabricar vacunas contra el coronavirus, luego de un acuerdo firmado con las universidades Austral y de Los Lagos. Esto gracias a la investigación realizada en Alemania po",06-01-2021 01:30,https://www.bing.com/th?id=OVFT.yljtFEgNAYecuPKbsBZTxS,Chile,meganoticias
ME Elecmetal entregó alegría y esperanza en Navidad a 300 ...,https://www.elrancaguino.cl/2021/01/05/me-elecmetal-entrego-alegria-y-esperanza-en-navidad-a-300-familias-de-la-region/,"Ximena Mella Urra Fotos: Nico Carrasco /Cedidas   Un total de 300 cajas de mercadería, fueron entregadas a las comunidades",06-01-2021 02:15,https://www.bing.com/th?id=OVFT.ZDZXDAZj6Fu2ajqAbw7RHy,Chile,elrancaguino.cl
"Unión Europea, América Latina, Mercosur: la otra relación ...",https://www.elmostrador.cl/destacado/2021/01/06/union-europea-america-latina-mercosur-la-otra-relacion-transatlantica/,"América Latina y el Caribe (LAC) están sufriendo con especial dureza los efectos de la pandemia del COVID-19, que ha pasado de ser una crisis sanitaria a una crisis política y de desarrollo. Con el 8%",06-01-2021 04:12,https://www.bing.com/th?id=OVFT.wD_9X05k6DAlC1du5wwWHC,Chile,El Mostrador
21 fallecidos y 2.457 nuevos contagios por COVID-19 ...,https://www.chanarcillo.cl/21-fallecidos-y-2-457-nuevos-contagios-por-covid-19-presento-ayer-el-pais/,"El ministro de Salud, Enrique Paris informó ayer que de acuerdo a los diagnósticos reportados se notificaron 2.457 casos nuevos",06-01-2021 07:00,https://www.bing.com/th?id=OVFT.yquOLVpeY9B1SttYfd948C,Chile,Diario Chanarcillo
IPSA inicia el año con optimismo mientras que en Wall ...,https://www.df.cl/noticias/mercados/bolsa-monedas/inversionistas-parten-con-todo-el-2021-bolsas-suben-con-fuerza-ante/2021-01-04/082642.html,"Los inversionistas están optimistas sobre las perspectivas para 2021. Muestra de ello, es que el CEO de Chaikin Analytics, Marc Chaikin, escribió en una nota que ""el mercado de valores está posicionad",06-01-2021 08:24,https://www.bing.com/th?id=OVFT.QVeLMZKzMcRsxmccBDZXoS,Chile,df.cl
Reelecto dirigente de profesores insistirá en pago de la ...,http://www.diariolaregion.cl/reelecto-dirigente-de-profesores-insistira-en-pago-de-la-deuda-historica/,El presidente del comunal dice que es probable solicitar a los parlamentarios crear derechamente una ley que reconozca la deuda histórica y que estipule algún mecanismo de pago a la brevedad posible,06-01-2021 08:41,https://www.bing.com/th?id=OVFT.gVjFz9fWbHS5V6qDudKBfC,Chile,La Region
Problemas de stock y alta demanda: El escenario de la ...,https://www.emol.com/noticias/Economia/2021/01/06/1008531/Precios-autos-suben-stock-demandapandemia.html,Líderes del gremio comentaron a Emol que un retraso en la llegada de bienes al país afectó la importación del 100% de los automóviles que Chile recibe desde 28 países diferentes.,06-01-2021 09:00,https://www.bing.com/th?id=OVFT.VgvPKWykc1gb5wUPhWIGey,Chile,Emol
DF Lab / Transformación Digital: Balance 2020 y desafío ...,https://www.df.cl/noticias/opinion/cartas/df-lab-transformacion-digital-balance-2020-y-desafio-2021/2021-01-06/093622.html,"La pandemia del coronavirus ha acelerado los procesos de transformación digital en todo el mundo, en todas las industrias y Chile no es la excepción. Las cifras que nos deja el 2020 son elocuentes y n",06-01-2021 09:58,https://www.bing.com/th?id=OVFT.faek6qmm0V8Jn3JeQUHBGS,Chile,df.cl
Uso de camas críticas se encuentra al límite en medio del ...,https://www.meganoticias.cl/nacional/323454-camas-criticas-covid-cgx02.html,"Preocupación existe por el aumento de la ocupación de camas críticas, en medio de la alza de contagios de coronavirus de las últimas semanas. Incluso, en algunos recintos asistenciales su disponibilid",06-01-2021 09:58,https://www.bing.com/th?id=OVFT.pZez5xh9qkTsEt94GfhBrC,Chile,meganoticias
¿Cómo funciona el Permiso Especial de Vacaciones? | Tele 13,https://www.t13.cl/noticia/nacional/permiso-vacaciones-fecha-vigencia-detalles-comunas-06-01-2021,¿Qué pasa si mi comuna retrocede a Cuarentena (Fase 1) mientras estoy de vacaciones? ¿Qué pasa con los hijos de padres separados? En T13.cl te explicamos todos los detalles sobre lo que tienes que con,06-01-2021 10:50,https://www.bing.com/th?id=OVFT.SNbJECy8cV2Sfeugi_pg0S,Chile,T13
"El Ciudadano | ""Ahora Nos Toca Participar"" levantará ...",https://www.elciudadano.com/chile/ahora-nos-toca-participar-levantara-propuestas-ciudadanas-regionales-para-llevar-candidatos-a-la-convencion-constituyente/01/06/,"Iniciativa buscará generar propuestas ciudadanas en todas las regiones para luego presentar a las diversas candidaturas, y buscar su apoyo y compromiso.",06-01-2021 11:06,https://www.bing.com/th?id=OVFT.q5Of9fJbJtguf70t8JX5Fy,Chile,El Ciudadano
"Covid-19: contagios nuevos, excluyendo a la RM, alcanzan ...",https://www.latercera.com/nacional/noticia/covid-19-contagios-nuevos-excluyendo-a-la-rm-alcanzan-la-mayor-cifra-de-toda-la-pandemia/MK5CSYNNCZCWNILKHWO7XA4W2E/,"El promedio de casos de los últimos siete días de las 15 regiones del país que no son Santiago superó los dos mil diarios. En el peor momento previo, durante junio, llegó a los 1.600. La situación hos",06-01-2021 11:50,https://www.bing.com/th?id=OVFT.rGzINeMP-cPG5-WkV5Ssqy,Chile,LA TERCERA
"Epidemiólogo y sistema TTA: ""No hemos sido capaces de ...",https://www.pauta.cl/nacional/aumento-covid-ano-nuevo-navidad,El especialista Manuel Nájera explicó que la principal preocupación de este segundo brote es la ocupación de camas UCI.,06-01-2021 11:57,https://www.bing.com/th?id=OVFT.-xeplm_0uEc3mdM3M8xzJi,Chile,pauta
Comunas de Valparaíso podrían retroceder a cuarentena ...,https://www.biobiochile.cl/noticias/nacional/region-de-valparaiso/2021/01/06/comunas-de-valparaiso-podrian-retroceder-a-cuarentena-expertos-dicen-que-no-es-una-medida-efectiva.shtml,Las cifras con respecto al covid-19 en la región de Valparaíso podrían eventualmente hacer decretar una cuarentena para la,06-01-2021 12:13,https://www.bing.com/th?id=OVFT.whvSmp_i_SpAd6-jBOP8vy,Chile,Chile
ISP aclara: vacuna Pfizer BioNTech no provoca infección ...,https://www.publimetro.cl/cl/noticias/2021/01/06/isp-vacuna-pfizer.html,El organismo recordó que la eficacia que se alcanza con esta vacuna es de 52% doce días después de la primera dosis en algunas personas.,06-01-2021 12:19,https://www.bing.com/th?id=OVFT.39jhqaltf6bZa6Q6a52RBi,Chile,publimetro.cl
Ministro Paris confirmo que en 45 días se vacunará a todos ...,https://www.rln.cl/destacado/82182-ministro-paris-confirmo-que-en-45-dias-se-vacunara-a-todos-los-funcionarios-de-la-salud-de-la-region,"El diputado Miguel Ángel Calisto se reunió con el Ministro de Salud, Enrique Paris, para solicitarle el inicio del proceso de vacunación para los funcionarios de la salud de la región. La autoridad sa",06-01-2021 12:27,https://www.bing.com/th?id=OVFT.aSF-eJZtgRggAzvQJI8-WC,Chile,Radio las Nieves
Motocicletas se consolidan como el medio de transporte más ...,https://www.publimetro.cl/cl/tacometro/2021/01/06/motocicletas-se-consolidan-medio-transporte-mas-eficiente-pandemia.html,Las estadísticas en Chile confirman que la moto se consolidó como una alternativa económica y segura para resguardar el distanciamiento social.,06-01-2021 12:39,https://www.bing.com/th?id=OVFT.NqiVzE09SzBU149JzyJmky,Chile,publimetro.cl
Mañalich: “No es buena idea hacer obligatoria la ...,https://www.elmostrador.cl/dia/2021/01/06/manalich-no-es-buena-idea-hacer-obligatoria-la-vacunacion-contra-covid/,"La recomendación de Mañalich se da luego que hace unos días, el diputado Gabriel Silber (DC) señalara que presentará un proyecto de ley para establecer como obligatoria la vacunación contra el covid-19. ""La única forma de lograr una efectiva inmunización en todo Chile es que todos los",06-01-2021 13:01,https://www.bing.com/th?id=OVFT.dBpOOo-loDjqHbWQFEilpy,Chile,El Mostrador
Gobierno reconoce ante comisión del Senado falla en ...,https://laprensaaustral.cl/2021/01/06/gobierno-reconoce-ante-comision-del-senado-falla-en-cumplimiento-de-protocolo-por-covid-en-antartica/,"Ministros de Relaciones Exteriores y de Defensa, Andrés Allamand y Baldo Prokurica, respectivamente, garantizaron que hoy no hay casos activos de coronavirus en la Antártica y que se investiga para es",06-01-2021 13:03,https://www.bing.com/th?id=OVFT.C3sxEFCXnufD_Rms0VIB0i,Chile,La Prensa Austral
Funcionarios de Hospital El Pino protestan tras ataque y ...,https://www.biobiochile.cl/noticias/nacional/region-metropolitana/2021/01/06/funcionarios-de-hospital-el-pino-protestan-tras-ataque-y-confirman-que-fallecido-tenia-covid-19.shtml,Funcionarios del Hospital El Pino realizaron una protesta esta mañana luego que un grupo de familiares de un fallecido,06-01-2021 13:07,https://www.bing.com/th?id=OVFT.x35euQaHp6zJZVFcu7LECi,Chile,Chile
De la crisis a la esperanza - La Tercera,https://www.latercera.com/opinion/noticia/de-la-crisis-a-la-esperanza/47CIDZ5N7RDZ5E4VZCOZYEF4NQ/,"Por Eugenio Yáñez, Universidad San Sebastián; Voces Católicas. Siempre de un mal se puede extraer un bien. Esta es una verdad antigua que solemos pasar por alto, ya sea por un",06-01-2021 13:30,https://www.bing.com/th?id=OVFT.N9aTIVyDYhiucCJA-jDyQC,Chile,LA TERCERA
