name,url,description,datePublished,imagen,pais,Fuente
"Informe que defiende ""nueva normalidad"" proyecta en 2 a 3 ...",https://www.emol.com/noticias/Nacional/2020/04/22/983824/Informe-nueva-normalidad.html,"Un informe interno del Gobierno contiene parte de la estrategia del Ejecutivo ante el covid-19. El texto, al que accedió ""El Mercurio"", se denomina ""La nueva normalidad, nueva etapa en el combate al coronavirus"". En el documento se establece una proyección respecto del peak de contagios, el que se",22-04-2020 15:21,https://www.bing.com/th?id=ON.929C1E366775F435DFC476DB9AAF9901,Chile,Emol
Ministro Mañalich expuso ante la OMS las medidas que se ...,https://www.biobiochile.cl/noticias/nacional/chile/2020/04/23/ministro-manalich-expuso-ante-la-oms-las-medidas-que-se-estan-aplicando-para-contener-el-covid-19.shtml,"El ministro de Salud, Jaime Mañalich expuso ante la Organización Mundial de la Salud las medidas que se están aplicando para contener el Covid-19 en América. La instancia se efectuó a las 06:00 horas de este jueves en una reunión con el director de la OMS, Tedros Adhanom y ministros de Europa",23-04-2020 15:52,https://www.bing.com/th?id=ON.E0BB61D47295F5B3BD4ED1D3970B03C1,Chile,Chile
"Coronavirus: el anime está de luto, muere Kumiko Okae ...",https://www.fayerwayer.com/2020/04/coronavirus-anime-kumiko-okae-pokemon/,"La pandemia global por el Coronavirus Covid-19 sigue expandiéndose a nivel global, incrementando con ello lamentablemente el número de contagios y de fallecimientos. Dentro de esa espiral sucede, como sería de esperarse, que entre las víctimas se cuenta a personas que significan mucho para",23-04-2020 15:54,https://www.bing.com/th?id=ON.88FDAFA21E69E53D6183FD9E53A55E62,Chile,FayerWayer
Los académicos extranjeros que no le creen al carné COVID-19,https://www.elmostrador.cl/noticias/sin-editar/2020/04/23/los-academicos-extranjeros-que-no-le-creen-al-carne-covid-19/,"“¿Qué es el ""pasaporte o carné de inmunidad"" al COVID-19 y por qué genera polémica?”, se pregunta un reportaje de la BBC respecto a esta iniciativa que barajan algunos gobiernos, entre ellos el de Chile, dentro de su paquete de medidas de combate a la pandemia de coronavirus.",23-04-2020 15:59,https://www.bing.com/th?id=ON.9984F7ED1B569AFC3348768BC590774B,Chile,El Mostrador
Chile asume representación de América en reunión de la OMS ...,https://www.latercera.com/nacional/noticia/chile-asume-representacion-de-america-en-reunion-de-la-oms-donde-se-reporto-sobre-brote-de-coronavirus-en-cada-continente/JXFKHULY6JDZBHQILBDC3MYDJE/,Coronavirus; Covid-19... Chile asume representación de América en reunión de la OMS donde se reportó sobre brote de coronavirus en cada continente. Alejandra Jara. ... Otro de los temas abordados en la reunión fue el de una “nueva economía mundial” post Covid -19.,23-04-2020 16:08,https://www.bing.com/th?id=ON.073AD60A791A8EA7CFADB8B9B6787DB0,Chile,LA TERCERA
Sky reactivará progresivamente su operación en Chile a ...,https://www.df.cl/noticias/empresas/industria/sky-reactivara-progresivamente-su-operacion-en-chile-a-partir-del-1-de/2020-04-23/115528.html,"A un mes de haber suspendido los vuelos producto de la crisis del covid-19, Sky anunció que a partir del 1 de junio comenzará a reactivar sus operaciones domésticas, considerando las determinaciones que vaya adoptando la autoridad sanitaria a nivel nacional. ""Aplazamos el inicio de las",23-04-2020 16:09,https://www.bing.com/th?id=ON.2B4AAE6AB5FB071DF30032264560FF5E,Chile,df.cl
Chile se acerca a los 12 mil contagiados y lamenta otros 8 ...,https://laprensaaustral.cl/nacional/chile-se-acerca-a-los-12-mil-contagiados-y-lamenta-otros-8-fallecidos/,"Chile sumó otros 516 casos nuevos de personas contagiadas con el Covid-19. Así, el total de infectados sube a 11.812. De este número, 5.804 personas se han recuperado (49%), lo que quiere decir que están en una etapa en que no son capaces ni transmitir el virus ni de ser contagiados nuevamente",23-04-2020 16:10,https://www.bing.com/th?id=ON.01B439066D6D3589AF1A225900BB2A4C,Chile,La Prensa Austral
"Mañalich confirma nuevo brote en cité de migrantes, esta ...",http://lanacion.cl/2020/04/23/manalich-confirma-nuevo-brote-en-cite-de-migrantes-esta-vez-en-estacion-central/,"El ministro de Salud, Jaime Mañalich, confirmó un segundo brote de Covid-19 en un cité ocupado por ciudadanos extranjeros, esta vez en la comuna de Estación Central, donde un grupo cercano a las 100 personas de origen peruano presentó 8 casos positivos hasta el momento.",23-04-2020 16:18,https://www.bing.com/th?id=ON.57ED57E39BDA87BA80BD1F16DC1038E1,Chile,La Nación
Obras de teatro grabadas y cátedras artístico-culturales ...,https://www.elmostrador.cl/cultura/2020/04/23/obras-de-teatro-grabadas-y-catedras-artistico-culturales-via-online/,"La cultura es una de las áreas que más se ha visto afectada por la pandemia de COVID-19. La suspensión de funciones teatrales, conciertos y el cierre de exposiciones y museos ha llevado a generar diversas alternativas para que las personas puedan seguir contando con este tipo de contenidos desde",23-04-2020 16:20,https://www.bing.com/th?id=ON.74DDC1751960BB6870006A5188A51EF9,Chile,El Mostrador
Chile es invitado por la OMS para presentar evolución del ...,https://www.radiosantiago.cl/archivo/127852,"Chile es invitado por la OMS para presentar evolución del brote coronavirus en representación de toda América. La autoridad sanitaria confirmó que serán cinco los países que tendrán este rol para su respectivo continente, y aseguró que se trata de un ""honor""",23-04-2020 16:20,https://www.bing.com/th?id=ON.A1A17AE79DCB6153FC7AE908B5C7D7A7,Chile,Radio Santiago
516 casos nuevos de Covid-19 en Chile: total de ...,https://www.radioagricultura.cl/nacional/2020/04/23/516-casos-nuevos-de-covid-19-en-chile-total-de-diagnosticados-asciende-a-11-812.html,"El Ministerio de Salud reportó 516 casos nuevos de Covid-19 en el país, llegando a un total de 11.812 diagnosticados con la enfermedad. Esta cifra, que considera un balance hasta las 21:00 horas de este miércoles, es la más alta desde que se inició la crisis sanitaria en Chile. Además, se",23-04-2020 16:27,https://www.bing.com/th?id=ON.A8B39FD08CC3BE006ED41F5C3780F32E,Chile,Radio Agricultura
Subsecretario Zúñiga: “Nuestro plan considera llegar a 4 ...,https://www.cnnchile.com/coronavirus/subsecretario-zuniga-nuestro-plan-considera-llegar-a-4-263-ventiladores-en-junio_20200423/,"El subsecretario de Redes Asistenciales, Arturo Zúñiga, se refirió este jueves a la disponibilidad de ventiladores mecánicos en el país, asunto que ha cobrado relevancia mundial frente a los déficit de este instrumento que algunos sistemas de salud han presentado en el mundo durante la crisis por el COVID-19.",23-04-2020 16:34,https://www.bing.com/th?id=ON.9B808A5B0AF3E8A437F6AE580637A3E0,Chile,CNN Chile
Por qué la economía de Paraguay en la región será la que ...,https://www.emol.com/noticias/Economia/2020/04/23/983933/paraguay-economia-que-menos-cae.html,"""El parón económico en los principales socios comerciales de la región, la caída en el valor de las materias primeras y el golpe en áreas como el turismo lo llevarán a la peor contracción de la actividad económica que la región haya sufrido desde que se iniciaron los registros, en 1900",23-04-2020 16:48,https://www.bing.com/th?id=ON.B998DC86D4774C8F7348A695F094866B,Chile,Emol
"“Por lo menos hasta ahora, ha resultado exitoso ...",https://www.cnnchile.com/coronavirus/bloomberg-medidas-chile-coronavirus-exitosas_20200423/,"“Por lo menos hasta ahora, ha resultado exitoso”: Bloomberg evalúa medidas de Chile contra el coronavirus El medio menciona que el país tiene la mayor capacidad de testeo de Latinoamérica, pero también repara en la controversia que ha generado el carnet COVID-19.",23-04-2020 16:50,https://www.bing.com/th?id=ON.26931D251A7A740553B7B6743EFA16C8,Chile,CNN Chile
Indap presenta nuevo paquete de medidas para apoyar a ...,https://www.biobiochile.cl/noticias/economia/tu-bolsillo/2020/04/23/indap-presenta-nuevo-paquete-de-medidas-para-apoyar-a-pequenos-agricultores-ante-covid-19-y-sequia.shtml,"Beneficios económicos, plataformas para comercialización en línea, recursos para riego eficiente y múltiples iniciativas para la prevención, forman parte del amplio set de medidas que dispone el Instituto de Desarrollo Agropecuario (Indap) para apoyar a sus más de 160 mil usuarias y usuarios",23-04-2020 16:51,https://www.bing.com/th?id=ON.438227D83585A489139833FFCF1CB764,Chile,Chile
Seremi de Salud de Biobío confirma 61 contagios tras brote ...,https://www.24horas.cl/coronavirus/seremi-de-salud-de-biobio-confirma-61-contagios-tras-brote-en-sanatorio-aleman-4121730,"La Seremi de Salud del Biobío informó la presencia de 61 contagios en el Sanatorio Alemán tras el último balance entregado sobre la situación por la pandemia de coronavirus COVID-19. Según explicó el seremi de la cartera, Héctor Muñoz, del total de casos 37 son funcionarios, 5 pacientes y",23-04-2020 17:06,https://www.bing.com/th?id=ON.8E71782523997EC6E1D3BB36F2B45E58,Chile,24 Horas Chile
Mañalich expuso ante la OMS medidas que aplica Chile para ...,http://lanacion.cl/2020/04/23/ministro-de-salud-expone-ante-la-oms-medidas-que-aplica-chile-para-contener-el-covid-19/,"Mañalich expuso ante la OMS medidas que aplica Chile para contener el Covid-19. A las 6:00 AM de Chile, el secretario de Estado se reunió este jueves con el director de la Organización Mundial ...",23-04-2020 17:13,https://www.bing.com/th?id=ON.99159B6A036E1C6B3165C9C49C584F57,Chile,La Nación
“Una tragedia humana inimaginable”: OMS alerta sobre el ...,https://www.latercera.com/que-pasa/noticia/una-tragedia-humana-inimaginable-oms-alerta-sobre-el-impacto-del-coronavirus-en-hogares-de-adultos-mayores/34AXGWNGQNFBPMQYQGN7MRYJ5Y/,"Desde los inicios de pandemia de coronavirus, diversos estudios apuntaron a los adultos mayores como el principal foco de riesgo de muerte. Esto se sostiene con datos como los recabados en China a más de 72 mil pacientes, que además señala que en pacientes de 70 a 79 años la tasa de mortalidad es de un 8%, mientras que en 60 a 69 años es ...",23-04-2020 17:16,https://www.bing.com/th?id=ON.0757226A98DE757B3DEF5D56BA3713AB,Chile,LA TERCERA
Reo que fue liberado como medida por el coronavirus mató a ...,https://www.cooperativa.cl/noticias/mundo/europa/turquia/reo-que-fue-liberado-como-medida-por-el-coronavirus-mato-a-su-hija-en/2020-04-23/125439.html,"Coronavirus: Chile suma 11.812 contagiados, 168 muertos y 5.804 recuperados . Funcionarios piden intervención total de cárcel de Puente Alto tras motín . Un preso que fue liberado por el gobierno de Turquía como medida preventiva ante la pandemia del Covid-19, mató a su hija tras golpearla violentamente. ...",23-04-2020 17:17,https://www.bing.com/th?id=ON.89BF0A4F02F7388FB6D94A5D988FB280,Chile,Radio Cooperativa
Campaña “El tenis ayuda al tenis” va en auxilio de los ...,https://www.adnradio.cl/tenis/2020/04/21/campana-el-tenis-ayuda-al-tenis-va-en-auxilio-de-los-profesores-que-ensenan-este-deporte.html,"Al igual que otros deportes, el tenis se ha visto afectado negativamente por la pandemia del Covid-19, no solamente por la suspensión de los diferentes torneos que estaban programados, sino que también para quienes lo practican y lo enseñan. Desde que se decretó a mediados de marzo el Estado de",23-04-2020 17:26,https://www.bing.com/th?id=ON.CDC1FF4BBFA80D9ED341502809B53AF4,Chile,ADN
Coronavirus: gobierno busca tener 4 mil ventiladores | Tele 13,https://www.t13.cl/noticia/nacional/reacondicionados-formula-del-gobierno-llegar-4-mil-ventiladores-covid-19-23-04-20,"Un total de 4 mil 263 ventiladores para pacientes críticos de Coronavirus. Esta es la meta que busca lograr el gobierno de aquí a junio para salvar la mayor cantidad de vidas posibles frente a esta pandemia que a la fecha suma 11 mil 812 casos en Chille, de los cuales 168 han fallecido. Fue el",23-04-2020 17:25,https://www.bing.com/th?id=ON.D864052E637838C5B6CDC82D6A3F1362,Chile,T13
Gobernador de Cachapoal y Director de SERVIU entregaron ...,https://www.elrancaguino.cl/2020/04/23/gobernador-de-cachapoal-y-director-de-serviu-entregaron-kits-de-higiene-a-familias-del-campamento-los-peumos-de-machali/,"-La actividad se enmarca en el Plan de Acción Preventivo de Campamentos del Ministerio de Vivienda y Urbanismo (MINVU), creado para disminuir la emergencia provocada por el COVID-19, siendo parte de las iniciativas de Gobierno para enfrentar el impacto social y económico en los asentamientos precarios. En el marco del Plan de Acción ...",23-04-2020 17:29,https://www.bing.com/th?id=ON.9D20020DC8A453AB1C235D532175F98D,Chile,elrancaguino.cl
Comenzó a regir ordenanza de uso obligatorio de mascarilla ...,https://www.elrancaguino.cl/2020/04/23/comenzo-a-regir-ordenanza-de-uso-obligatorio-de-mascarilla-en-olivar/,"El lunes pasado, en sesión del Concejo Municipal –presidido por la alcaldesa de Olivar, Práxedes Pérez Aránguiz- se aprobó la ordenanza que tiene por objetivo reglamentar a nivel comunal el uso de la mascarilla, esto en el contexto de la emergencia sanitaria por Covid-19. La jefa comunal, explicó que “es deber de todos los […]",23-04-2020 17:29,https://www.bing.com/th?id=ON.6476FF44038485FED62813A0068B4F79,Chile,elrancaguino.cl
TVN profundiza plan de reestructuración y desvincula 30 ...,https://www.df.cl/noticias/empresas/telecom-tecnologia/tvn-profundiza-plan-de-reestructuracion-y-desvincula-30-trabajadores/2020-04-23/075032.html,"El covid-19 sigue golpeando con fuerza a los canales de televisión. A las medidas anunciadas en marzo, donde se incluye la reducción de los salarios de rostros así como el despido del director de programación, este miércoles Televisión Nacional de Chile (TVN) sumó la desvinculación de 30 trabajadores de diversas áreas.",23-04-2020 17:29,https://www.bing.com/th?id=ON.4F247BFBDCA4CB82A75D4BEFE2BE5345,Chile,df.cl
Ocho personas fallecieron el último día por Covid-19 ...,https://www.puranoticia.cl/noticias/nacional/ocho-personas-fallecieron-el-ultimo-dia-por-covid-19-victimas-ascienden/2020-04-23/112411.html,"Ocho personas fallecieron las últimas 24 horas a causa del coronavirus Covid-19 en Chile, con lo que la cifra total de víctimas fatales asciende a 168 personas. Así lo dio a conocer la subsecretaria de Salud Pública, Paula Daza, en el marco del reporte diario de la contigencia sanitaria, con datos recopilados entre las 21:00 horas del ...",23-04-2020 17:29,https://www.bing.com/th?id=ON.AFBDBD562B170FE7D2FD0A5A3E9B69DC,Chile,Puranoticia.cl
Minsal elevó a 168 las personas muertas por coronavirus ...,https://www.adnradio.cl/nacional/2020/04/23/4587608.html,"El ministerio de Salud informó que ocho personas murieron de coronavirus Covid-19, en las últimas 24 horas. De acuerdo con esta cifra, los fallecidos ya son 168 desde el inicio de la crisis sanitaria en Chile, el pasado 3 de marzo. Según la subsecretaria de Salud, Paula Daza, siete de las",23-04-2020 17:34,https://www.bing.com/th?id=ON.28B9A48431D3E5FB0650E99BFE1EFA50,Chile,ADN
El cobre: La solución chilena para frenar la propagación ...,https://www.24horas.cl/coronavirus/el-cobre-la-solucion-chilena-para-frenar-la-propagacion-del-coronavirus-4121778,"Chile, el mayor productor de cobre del mundo, lidera ahora una industria de producción de materiales antimicrobianos que pueden ayudar a frenar la pandemia de COVID-19, dada la efectividad que algunos estudios recientes atribuyen a este metal contra el nuevo coronavirus. Previo a la llegada del",23-04-2020 17:34,https://www.bing.com/th?id=ON.762B29548226D0FF5077454D4B175432,Chile,24 Horas Chile
Temblores y coronavirus: ¿Cómo afectan las cuarentenas a ...,https://www.t13.cl/noticia/nacional/ruido-sismico-sismo-chile-cuarentena-coronavirus-23-04-2020,"Temblores y coronavirus: ¿Cómo afectan las cuarentenas a la actividad sísmica y su monitoreo? El geólogo Marcelo Lagos explicó a T13.cl que al sacar a las personas de la ecuación se pueden detectar ""señales mucho más finas de sismicidad natural"".",23-04-2020 17:41,https://www.bing.com/th?id=ON.98AEA44438B1A71DDFCA5CE2911D6F9D,Chile,T13
Cifra de contagiados con coronavirus en Chile... | Puranoticia,https://www.puranoticia.cl/noticias/nacional/cifra-de-contagiados-con-coronavirus-en-chile-llega-a-11-812-personas/2020-04-23/111722.html,"411 personas se encuentran hospitalizadas en Unidades de Cuidados Intensivos (UCI), de las cuales 316 están conectadas a ventilación mecánica. 516 son los casos nuevos diagnosticados con coronavirus Covid-19 en Chile, con lo que la cifra total de contagiados asciende a 11.812 personas con la",23-04-2020 17:48,https://www.bing.com/th?id=ON.5E56EAB89B532D9B928215E354D554DD,Chile,Puranoticia.cl
