name,url,description,datePublished,imagen,pais,Fuente
Vacuna de Moderna sería 100% eficaz contra casos graves de ...,https://www.lacuarta.com/cronica/noticia/vacuna-moderna-100-eficaz/573403/,"Ninguna farmacéutica se quiere quedar atrás en la carrera por ser los primeros en tener la vacuna contra el coronavirus, y el batacazo esta vez",01-12-2020 03:18,https://www.bing.com/th?id=OVFT.zKfG_PBdZdWvnFCH3EGujS,Chile,La Cuarta
China detuvo entrada de productos del mar chilenos por ...,https://www.diarioconcepcion.cl/economia/2020/12/01/asexma-biobio-alerta-de-posible-triquinuela-por-parte-de-china.html,"China informó de presencia de coronavirus en embarque de centollas. Sernapesca aseguró que se siguieron todos los protocolos, y que se encuentra investigando el caso. De todas formas afecta la imagen",01-12-2020 04:11,https://www.bing.com/th?id=OVFT.gQTe48f0vKDDgKJKeCtQzC,Chile,El Diario de Concepcion
Chile presenta 1.313 nuevos casos de Coronavirus - Diario ...,https://www.chanarcillo.cl/chile-presenta-1-313-nuevos-casos-de-coronavirus/,"Las autoridades de Salud entregaron un nuevo balance sobre el avance del coronavirus en el país, oportunidad donde se informó de 1.313 nuevos casos. En la instancia el ministro Paris expresó gran preocupación por un aumento sostenido de casos en nueve regiones, y reprochó la conducta de algunas",01-12-2020 05:09,https://www.bing.com/th?id=OVFT.uhN0ZAUWRlxsiNldNEAo1S,Chile,Diario Chanarcillo
Presencia de Covid-19 en empaque de mariscos chilenos ...,https://www.chanarcillo.cl/presencia-de-covid-19-en-empaque-de-mariscos-chilenos-exportados-a-china/,"Presencia de Covid-19 en empaque ... Sernapesca, confirmó le presencia de coronavirus en un empaque de centolla chilena que fue exportada a China. Así lo señaló el Servicio a través de su portal web, donde indica que la Administración General de Aduana China (GACC) notificó a la embajada de Chile en Beijing sobre este caso. Ante tal ...",01-12-2020 05:26,https://www.bing.com/th?id=OVFT.odmntDkJplPWSVOheTV1eC,Chile,Diario Chanarcillo
Minsal se alista para nueva ola COVID-19 en enero | Tele 13,https://www.t13.cl/noticia/nacional/segunda-ola-covid-19-9-mil-casos-minsal-1-12-2020,"El ministro Paris, en el balance realizado este lunes, aseguró que nueve regiones del país han aumentado sus casos diarios y recalcó el uso de mascarillas junto con el lavado de manos.",01-12-2020 11:53,https://www.bing.com/th?id=OVFT.JYhrTtByRfCAEd6LWuOJ3S,Chile,T13
Día Mundial del Sida 2020 | La Tribuna,https://www.latribuna.cl/opinion/2020/12/01/dia-mundial-del-sida-2020.html,"Como bien sabemos, durante el año 2020, el mundo ha estado expuesto a la pandemia por COVID-19, la cual ha planteado enormes desafíos para la salud de la población en diferentes ámbitos, incluida la t",01-12-2020 12:08,https://www.bing.com/th?id=OVFT.aW1ndhA4mnr6IQulE53dPy,Chile,La Tribuna
"Ministro Couve y Covid-19: ""La vacuna no va a estar lista ...",https://www.duna.cl/programa/hablemos-en-off/2020/12/01/ministro-couve-y-covid-19-la-vacuna-no-va-a-estar-lista-para-esta-segunda-ola-en-chile/,"En Hablemos en Off, el ministro de Ciencia, Andrés Couve se refirió al avance de la vacunas contra el Covid-19 y el incierto escenario que se vive respecto de la segunda ola. #HablemosEnOff | @acouvec",01-12-2020 12:39,https://www.bing.com/th?id=OVFT.m8tx0B5ohxfopm1bQmbPei,Chile,duna
Moderna: ¿Tendremos disponible en Chile la vacuna que ...,https://www.publimetro.cl/cl/noticias/2020/12/01/vacuna-moderna-chile.html,"La carrera por el antídoto contra el coronavirus está desatada. La vacuna del laboratorio Moderna es hasta ahora la que mayor efectividad ha presentado. Sin embargo, ninguna vacuna aún ha sido certifi",01-12-2020 12:44,https://www.bing.com/th?id=OVFT.D6oZJ1adx-T9UjJrRk7zyy,Chile,publimetro.cl
Gobierno se prepara para una segunda ola por Covid-19 ...,https://www.latercera.com/nacional/noticia/gobierno-se-prepara-para-una-segunda-ola-por-covid-19-proyectada-para-enero/IYUMO4VKAVFTFI3KJFP7Y5IOKY/,"Ejecutivo trabaja en estrategia con tres escenarios que considera experiencias dispares, como las de Europa y Estados Unidos. Ministro Paris advirtió dificultad: “el personal está cansando, hay que re",01-12-2020 12:50,https://www.bing.com/th?id=OVFT.adgLeqK8geIt79CieX-ejS,Chile,LA TERCERA
Fact Checking: El uso de mascarillas por tiempo prolongado ...,https://www.meganoticias.cl/calidad-de-vida/320380-mascarilla-acne-danos-en-la-piel-fact-checking-ppx03.html,Conoce la cuáles son los daños que puede ocasionar el uso de mascarilla de acuerdo a los especialistas. Por redes sociales se han difundido imágenes al respecto e información que es cierta sobre la ap,01-12-2020 13:31,https://www.bing.com/th?id=OVFT.3B6jFPaqCjLor9CRvoNJWC,Chile,meganoticias
Sernapesca no encontró evidencia de contagio de Covid-19 ...,http://www.lanacion.cl/sernapesca-no-encontro-evidencia-de-contagio-de-covid-19-en-centolla-exportada-a-china/,"En virtud del hallazgo notificado por la autoridad china, Sernapesca indicó que mantendrá los controles en plantas procesadoras y estará reportando la situación periódicamente.",01-12-2020 13:58,https://www.bing.com/th?id=OVFT.HSdOtKYSGbzM1f9udnc8pS,Chile,La Nación
Minsal: Chile reporta 1.119 nuevos casos de coronavirus ...,https://www.t13.cl/noticia/nacional/minsal-chile-reporta-1.119-nuevos-casos-coronavirus-y-muertes-aumentan-15.430,El DEIS reportó el fallecimiento de 20 pacientes en todo el país en las últimas 24 horas mientras que 695 continúan internados en la UCI.,01-12-2020 14:07,https://www.bing.com/th?id=OVFT.WOmgqPhpI-eXVL2jpYd8Li,Chile,T13
Covid-19: Minsal reporta 1.119 casos nuevos y 20 muertos ...,https://www.latribuna.cl/nacional/2020/12/01/covid-19-minsal-reporta-1-119-casos-nuevos-y-20-muertos.html,"Respecto a la de Red de Laboratorios y la capacidad diagnóstica, ayer se informaron los resultados de 23.680 exámenes PCR, alcanzando a la fecha un total de 5.357.133 test analizados a nivel nacional.",01-12-2020 14:17,https://www.bing.com/th?id=OVFT.kG6EGACk7RooKU5GJ0NsGy,Chile,La Tribuna
Chile registra 1.119 nuevos contagios covid-19: hay 9.089 ...,https://www.diarioconcepcion.cl/pais/2020/12/01/chile-registra-1-119-nuevos-contagios-covid-19-hay-9-089-casos-activos.html,"Un nuevo balance entregado este martes por el Ministerio de Salud informó que Chile registró 20 nuevos decesos inscritos y 1.119 casos positivos de covid-19, durante las últimas 24 horas. Del total de",01-12-2020 14:51,https://www.bing.com/th?id=OVFT.r8LCvNwRuGdQbRpcnw_PeC,Chile,El Diario de Concepcion
Covid-19: Paris proyecta escenario “catastrófico” que se ...,http://www.lanacion.cl/covid-19-paris-proyecta-escenario-catastrofico-que-se-podria-vivir-post-fiestas-de-fin-de-ano/,"El ministro de Salud dijo que el sistema de salud para poder afrontar el eventual peor contexto, tendrá que solicitar ayuda a universidades, a becados e internos de medicina, enfermería y otras carrer",01-12-2020 14:53,https://www.bing.com/th?id=OVFT.tntskOrpp1TQEXR4cnEfwC,Chile,La Nación
Balance Covid-19: Chile reportó 1.119 casos nuevos y 20 ...,http://www.radioportales.cl/sitio/balance-covid-19-chile-reporto-1-119-casos-nuevos-y-20-fallecidos/,"El Minsal informó este martes 20 decesos por Covid-19 registrados por el Departamento de Estadísticas e Información de Salud de la cartera, DEIS, para un total nacional de 15 mil 430. Asimismo, report",01-12-2020 15:26,https://www.bing.com/th?id=OVFT.kHEtEG5rX_HCWhF_f_l7GC,Chile,Radio Portales
Fundación SIDA Maule: “El VIH no está en cuarentena ...,https://diariosenred.com/regional/fundacion-sida-maule-el-vih-no-esta-en-cuarentena,Fundación SIDA Maule realiza un llamado a los maulinos a no bajar los brazos: tomar medidas de prevención y acceder al diagnóstico.,01-12-2020 15:40,https://www.bing.com/th?id=OVFT.bLUu6eDcXvh2Hm46xVtAxS,Chile,Diarios en Red
Día Mundial del SIDA: 10 mil personas en Chile saben su ...,https://www.biobiochile.cl/noticias/salud-y-bienestar/cuerpo/2020/12/01/dia-mundial-del-sida-10-mil-personas-en-chile-saben-su-diagnostico-pero-no-estan-en-tratamiento.shtml,"La pandemia del COVID-19 obligó a todo el sistema de salud chileno a concentrar sus energías en dar respuesta al virus, implementar estrategias que implican restringir la movilidad, adoptar medidas co",01-12-2020 16:08,https://www.bing.com/th?id=OVFT.kk6rrBl8n5-zo-_PeSDTTi,Chile,Chile
“Chile Vamos seguirá manteniéndose unido frente al ...,http://www.diarioeldia.cl/region/juan-manuel-fuenzalida/chile-vamos-seguira-manteniendose-unido-frente-escenario-electoral,"“Los resultados obtenidos en las urnas de la región como también lo vivido en el puerto de Coquimbo demuestran que nuestros candidatos dejaron los pies en la calle, escucharon a nuestros vecinos y fue",01-12-2020 16:21,https://www.bing.com/th?id=OVFT.b2vEApwCne4cj_6weBncsS,Chile,El Día
Presidente Piñera anuncia que plan de vacunación contra el ...,https://www.duna.cl/noticias/2020/12/01/presidente-pinera-anuncia-que-plan-de-vacunacion-contra-el-covid-19-empezaria-el-primer-trimestre-del-2021-e-incluiria-a-152-millones-de-personas/,"Este martes, el presidente Sebastián Piñera anunció que el plan de vacunación contra el coronavirus se iniciaría el primer trimestre de 2021 y consideraría a 15,2 millones de personas. “Nuestra meta e",01-12-2020 17:37,https://www.bing.com/th?id=OVFT.37WQcXoyseP5tO6JpItv9y,Chile,duna
Tecnología europea para garantizar la salud en las salas ...,https://opinionsur.cl/tecnologia-europea-para-garantizar-la-salud-en-las-salas-de-clases/,"Desde el Mineduc indicaron que las aperturas dependerán mucho de las características de cada establecimiento. Por ejemplo, los colegios que tengan un alto número de alumnos por sala deberán acordar di",01-12-2020 18:31,https://www.bing.com/th?id=OVFT.hxl40icG1vEHJM00iY8dQS,Chile,Opinion Sur
Izkia Siches critica programa de Cecilia Morel sobre ...,https://www.theclinic.cl/2020/12/01/izkia-siches-critica-programa-de-cecilia-morel-sobre-turismo-para-el-adulto-mayor-en-pandemia-despues-no-le-echemos-la-culpa-a-las-personas/,"La presidenta del Colegio Médico, Izkia Siches, se refirió al regreso del programa “Adulto Mayor” de la Primera Dama, Cecilia Morel, que apunta a que los ancianos puedan realizar turismo por Chile sig",01-12-2020 18:35,https://www.bing.com/th?id=OVFT.GBad3B90gE2y5Ste3K8GdS,Chile,Clinic
Presidente Piñera asegura que vacuna contra el COVID-19 ...,https://www.elmostrador.cl/dia/2020/12/01/presidente-pinera-asegura-que-vacuna-contra-el-covid-19-sera-voluntaria-y-gratuita/,"“Hemos estructurado un plan logístico a nivel nacional para enfrentar exitosamente estos desafíos, el hospital digital hará un seguimiento de las personas que reciban la primera dosis, también reciban",01-12-2020 18:38,https://www.bing.com/th?id=OVFT.OjaaAQzYDK_DsBNIH5PxUy,Chile,El Mostrador
Armada de Chile realizó apertura de bases antárticas en el ...,https://opinionsur.cl/armada-de-chile-realizo-apertura-de-bases-antarticas-en-el-marco-de-la-comantar-2020-2021/,"El 26 de noviembre, se realizó la activación de la Capitanía de Puerto Bahía Paraíso, repartición Naval más cercana al Polo Sur, aproximadamente a 1.500 millas náuticas de este, en el despliegue de Un",01-12-2020 18:43,https://www.bing.com/th?id=OVFT.yBX3cV3pdo68Hz0HJB5sDi,Chile,Opinion Sur
Doctor advierte sobre eventual rebrote tras eclipse solar ...,https://www.meganoticias.cl/nacional/320513-doctor-tomas-regueira-advierte-rebrote-coronavirus-eclipse-solar-dax13.html,"Revisa en detalle las declaraciones del expresidente de la Sochimi, Tomás Regueira, quien advirtió este martes sobre un eventual rebrote de coronavirus tras el eclipse solar del próximo 14 de diciembr",01-12-2020 19:35,https://www.bing.com/th?id=OVFT.AuNCuGlX47Y32ibOJ6ewJC,Chile,meganoticias
200.905 hogares de la Región de OHiggins recibirán el Bono ...,https://www.elrancaguino.cl/2020/12/01/200-905-hogares-de-la-region-de-ohiggins-recibiran-el-bono-covid-navidad/,"La seremi de Desarrollo Social y Familia, Mónica Toro informó que 200.905 hogares de la Región de OHiggins recibirán el",01-12-2020 19:40,https://www.bing.com/th?id=OVFT.yW8iBl8yBdtE2CUndwk97S,Chile,elrancaguino.cl
El presente y el futuro del trabajo en Chile | evolucion ...,https://www.biobiochile.cl/biobiotv/programas/evolucion-laboral/2020/12/01/el-presente-y-el-futuro-del-trabajo-en-chile.shtml,"En Evolucion laboral, Fernando Arab, Sub Secretario del Trabajo analiza los avances del trabajo durante el 2020 y los actuales desafíos sobre jornadas y COVID-19. En Evolucion laboral, Fernando Arab,",01-12-2020 19:54,https://www.bing.com/th?id=OVFT.vHon87tvitjv9ll69oJwuy,Chile,Chile
Colegio Médico critica estrategia del Gobierno frente a ...,https://www.elmostrador.cl/noticias/pais/2020/12/01/colegio-medico-critica-estrategia-del-gobierno-frente-a-segunda-ola-del-covid-19-izkia-siches-acusa-que-hay-mensajes-contradictorios/,"El Gobierno proyecta una segunda ola de Covid-19 para enero, pero al mismo tiempo lanza planes de vacaciones para los adultos mayores. A juicio de la presidenta del Colegio Médico, esto es contradicto",01-12-2020 20:01,https://www.bing.com/th?id=OVFT.ngonr9cv4Rmm5HY2fgJlPS,Chile,El Mostrador
“Efecto Covid” en la justicia: tribunales civiles de ...,https://www.latercera.com/la-tercera-pm/noticia/efecto-covid-en-la-justicia-tribunales-civiles-de-santiago-advierten-que-tardaran-tres-anos-en-ponerse-al-dia/2J5JTJ5C4VDPPJ5GGJ5MPDRAJU/,"El comité de magistrados de esta materia de la Región Metropolitana pide con urgencia tomar medidas para evitar que el sistema se siga atrasando, producto de las suspensiones generadas por la pandemia",01-12-2020 20:03,https://www.bing.com/th?id=OVFT.FrUnO5OQNqwAI6PEOfSJZS,Chile,LA TERCERA
CMF finaliza implementación de nuevos estándares ...,https://www.df.cl/noticias/mercados/banca-fintech/basilea-iii-cmf-finaliza-implementacion-de-nuevos-estandares-normativos/2020-12-01/165757.html,"El regulador publicó este martes las normas para determinar los activos ponderados por riesgo (APR) de crédito, mercado y operacional de la banca; y sobre los estándares de divulgación de información",01-12-2020 20:32,https://www.bing.com/th?id=OVFT.8QXpaakPai7JrS2lO-rjVi,Chile,df.cl
