name,url,description,datePublished,imagen,pais,Fuente
Especialista por nuevo método para detectar el Covid-19 ...,https://www.adnradio.cl/ciencia/2020/09/17/especialista-por-nuevo-metodo-para-detectar-el-covid-19-sera-parecido-a-un-alcotest.html,"El pasado miércoles, el Ministerio de Salud informó 1.305 nuevos casos de Covid-19 detectados en el país, con lo que Chile alcanzó los 439.287 pacientes confirmados con coronavirus, siendo una de las",17-09-2020 12:09,https://www.bing.com/th?id=ON.80D605A08860A81E1809203161C1CC69,Chile,ADN
"Pandemia sigue aumentando, con puntos álgidos en el norte ...",https://www.t13.cl/noticia/nacional/informe-icovid-pandemia-aumentando-norte-sur-pais-16-09-20,"El grupo ICOVID Chile entregó su sexto informe con el análisis de las cifras de la pandemia del coronavirus COVID-19, cuyos primeros casos en el país se registraron durante marzo de este año. Se trata",17-09-2020 12:12,https://www.bing.com/th?id=ON.4DCCB7B26B865818D6684E7500BC521C,Chile,T13
1.305 nuevos casos de Covid-19 en Chile que totaliza 439 ...,https://www.itvpatagonia.com/noticias/1-305-nuevos-casos-de-covid-19-en-chile-que-totaliza-439-287-diagnosticados-18-fallecidos-en-la-ultima-jornada/,"Con 18 personas fallecidas en las últimas 24 horas, Chile alcanzó la menor cifra de decesos diarios de los últimos 90 días, destacó este miércoles el ministro de Salud, Enrique Paris. Durante la últim",17-09-2020 12:39,https://www.bing.com/th?id=ON.FD71C9F926412D2A30CC2A33F20B6DFE,Chile,ITV
Autoridades recuerdan que 18 y 19 son Feriados ...,https://www.rln.cl/destacado/77686-autoridades-recuerdan-que-18-y-19-son-feriados-irrenunciables-en-el-comercio,"Junto a dirigenta de la Cámara de Comercio de Coyhaique, las autoridades recordaron que los trabajadores del comercio tienen feriado irrenunciable el día 18 y 19 de septiembre, además de hacer un llam",17-09-2020 12:52,https://www.bing.com/th?id=ON.E288E5A7973CDBE638991E4D20C22AE8,Chile,Radio las Nieves
Y ahora ... ¿Quién podrá defendernos? | ELPINGUINO.COM,https://elpinguino.com/noticia/2020/09/17/y-ahora--quien-podra-defendernos-,“En Magallanes ya hemos visto como muchas empresas están cerrando la temporada. No habrá turismo en Magallanes”. Algunos no comprenden la importancia que tiene el turismo para la Región de Magallanes,17-09-2020 13:54,https://www.bing.com/th?id=ON.1C24B6A329E146F4E2881620F4BBBDAA,Chile,ELPINGUINO
Fonda de La Cuarta lo dejará como trompo en estas Fiestas ...,https://www.lacuarta.com/espectaculos/noticia/fonda-la-cuarta/545853/,"A través de LaCuarta.com y sus redes sociales, podrá festejar un “18” al gratín junto a la familia. “Vamos con un show para todos los gustos”, avisó Juan Javier de Loncomilla, animador del brillo. Las",17-09-2020 14:06,https://www.bing.com/th?id=ON.3B1794B5BFFA1538689C1B812C33576F,Chile,La Cuarta
Citi ve posibilidades de más conflicto social en América ...,https://www.df.cl/noticias/internacional/economia/citi-ve-posibilidades-de-mas-conflicto-social-en-america-latina/2020-09-17/081415.html,"A América Latina le esperan más consecuencias de la pandemia de covid-19, incluida la posibilidad de un aumento del desempleo y un resurgimiento de conflictos sociales, según el presidente de Citigrou",17-09-2020 14:15,https://www.bing.com/th?id=ON.43FDBF502C79A00BC81A3264A0FB2719,Chile,df.cl
Informe ICovid: Casos de coronavirus siguen en aumento en ...,https://www.cooperativa.cl/noticias/sociedad/salud/coronavirus/informe-icovid-casos-de-coronavirus-siguen-en-aumento-en-la-previa-de/2020-09-17/095403.html,"En términos de la dinámica de contagios, la situación muestra un claro ascenso en las regiones de Atacama, Maule, La Araucanía, Los Ríos y Magallanes. Expertos señalan la importancia de mejorar el sis",17-09-2020 14:16,https://www.bing.com/th?id=ON.D3CC497A11D886A23EFF1C289718EBD0,Chile,Radio Cooperativa
Regimiento de Los Ángeles realizó ceremonia en ...,https://www.latribuna.cl/comunas/2020/09/17/regimiento-de-los-angeles-realizo-ceremonia-en-conmemoracion-a-los-210-anos-de-la-independencia-nacional.html,"En el patio de honor del Destacamento de Montaña Nº 17 “Los Ángeles”, se llevó a cabo una emotiva y reducida ceremonia en conmemoración a los 201º años de la Independencia Nacional y Día de las Gloria",17-09-2020 14:32,https://www.bing.com/th?id=ON.8DB6AD788C1D58B2BA6E5F5CCEB8E973,Chile,La Tribuna
Covid-19: Chile registra 12.142 fallecidos y 1.860 casos ...,https://www.latribuna.cl/destacados/2020/09/17/covid-19-chile-registra-12-142-fallecidos-y-1-860-casos-nuevos.html,"Ministerio de Salud informó este jueves con 84 personas fallecidas por coronavirus Covid-19 en las últimas 24 horas, según el Departamento de Estadísticas e Información de Salud (DEIS). La cifra de mu",17-09-2020 14:32,https://www.bing.com/th?id=ON.4B3DB7102AA33EE20982DDFD13B33EF9,Chile,La Tribuna
"""Estamos muy, muy preocupados por el aumento de ... - pauta.cl",https://www.pauta.cl/nacional/estamos-muy-muy-preocupados-por-el-aumento-de-contagios,"El embajador de Chile en Argentina, Nicolás Monckeberg, comentó el Plebiscito del 25 de octubre. ""De este proceso Chile puede salir tremendamente fortalecido"", agregó. Víctor Manoli advirtió por estri",17-09-2020 14:45,https://www.bing.com/th?id=ON.66EEE7A973747B4F637A64D005BFF34B,Chile,pauta
"""Chile tiene una tremenda oportunidad"" - Pauta.cl",https://www.pauta.cl/nacional/chile-tiene-una-tremenda-oportunidad,"Víctor Manoli advirtió por estrictos controles y multas para quienes intenten ingresar a la región durante fiestas patrias. ""Estamos poniendo todas las trabas"" para que la gente entienda, insistió. La",17-09-2020 14:45,https://www.bing.com/th?id=ON.C5B48911628BEAA3C4E82F31718E9507,Chile,pauta
Minsal reporta 84 fallecidos y 1.860 nuevos casos de ...,https://www.publimetro.cl/cl/noticias/2020/09/17/minsal-reporte-coronavirus-covid-casos-chile-4.html,"El Ministerio de Salud reportó hoy 1.860 casos nuevos de coronavirus, de los cuales 1.283 corresponden a personas sintomáticas y 540 no presentan síntomas. Además, se registraron 37 contagios que no f",17-09-2020 14:47,https://www.bing.com/th?id=ON.3AD029F18B0C1E2A89E035546DBDDCF4,Chile,publimetro.cl
A solidarizar con las ollas comunes: Clarisa Hardy reedita ...,https://www.elmostrador.cl/dia/2020/09/17/a-solidarizar-con-las-ollas-comunes-clarisa-hardy-reedita-dos-libros-sobre-la-organizacion-social-en-los-80-que-revivio-en-pandemia/,"Este jueves será la presentación de ""Hambre + Dignidad = Ollas Comunes"" y ""Organizarse Para Vivir. Pobreza Urbana y organización popular"", dos libros clave sobre este fenómeno en los ‘80, y que ahora",17-09-2020 14:56,https://www.bing.com/th?id=ON.8FF68CE5CAF93C50F500842630BC27D7,Chile,El Mostrador
Chile registró 1.860 nuevos contagios de Covid-19: conoce ...,https://redlosrios.com/nacional/chile-registro-1-860-nuevos-contagios-de-covid-19-conoce-los-casos-por,"Hasta la fecha se registran 15.080 casos activos, de los cuales 895 se encuentran hospitalizados. El Ministerio de Salud entregó este jueves un nuevo balance sobre el Covid-19 en el país dando cuenta",17-09-2020 14:58,https://www.bing.com/th?id=ON.A9CFF0F2465EFE00C6E532041284148D,Chile,Red Los Rios
Resurgen proyectos de obras portuarias para el extremo ...,https://www.itvpatagonia.com/noticias/resurgen-proyectos-de-obras-portuarias-para-el-extremo-austral/,"A fines de octubre del 2020 se terminarían los estudios del Gobierno Regional (GORE) de Magallanes, extremo austral de Chile, para elaborar la política del sector portuario en el territorio. Por ello",17-09-2020 15:20,https://www.bing.com/th?id=ON.8D2546098A4C2209FEA9D729CB5E0B69,Chile,ITV
Realizan en Chile inédito y exitoso trasplante a joven con ...,https://www.meganoticias.cl/nacional/313775-trasplante-pulmon-paciente-covid-clinica-las-condes-tecnica-ex-vivo-emx01.html,"Un joven con coronavirus logró ser trasplantado de un pulmón gracias a una inédita técnica desarrollada en pacientes afectados por la pandemia. Se trata de Óscar Lobos, de 26 años, quien el pasado 15",17-09-2020 15:40,https://www.bing.com/th?id=ON.E7067B9DB5C7BF8204008F1F1FFA13CB,Chile,meganoticias
Covid-19: Magallanes y Bío Bío mantienen alto nivel de ...,https://www.biobiochile.cl/noticias/nacional/chile/2020/09/17/covid-19-magallanes-y-bio-bio-mantienen-alto-nivel-de-contagios-diarios-previo-a-fiestas-patrias.shtml,"Este jueves entregaron desde Salud un nuevo balance de COVID-19 en el país, oportunidad en que las regiones de Magallanes y Bío Bío marcaron cifras por encima de los 200 contagios. En cuanto al panora",17-09-2020 15:41,https://www.bing.com/th?id=ON.25CECCD7C753FFA3ED5088A8379E9E3B,Chile,Chile
Chile suma 84 nuevas muertes y 1.860 casos positivos de ...,https://www.diarioconcepcion.cl/pais/2020/09/17/chile-suma-84-nuevas-muertes-y-1-860-casos-positivos-de-covid-19.html,"Un nuevo balance entregado este jueves por el Ministerio de Salud informó que Chile registró 84 nuevos decesos inscritos y 1.860 casos positivos de covid-19, durante las últimas 24 horas. Del total de",17-09-2020 15:42,https://www.bing.com/th?id=ON.229D06C514DB4A5040B760103EE963CE,Chile,El Diario de Concepcion
Fiestas Patrias de alto riesgo: especialistas prevén ...,https://www.elmostrador.cl/noticias/pais/2020/09/17/fiestas-patrias-de-alto-riesgo-especialistas-preven-rebrote-significativo-de-los-casos-de-coronavirus-en-las-proximas-semanas/,"Pese al positivo balance que hace el Minsal de las cifras de los últimos días y el llamado al autocuidado para no retroceder en el combate al Covid-19 debido a las Fiestas Patrias, entre los expertos",17-09-2020 15:44,https://www.bing.com/th?id=ON.A24CEEE7FD1EEF17330719957AACF2CA,Chile,El Mostrador
Chile registró 1.860 nuevos casos de COVID-19 según Minsal ...,https://www.t13.cl/noticia/nacional/balance-minsal-casos-coronavirus-17-09-2020,"El Ministerio de Salud (Minsal) entregó, durante la mañana de este jueves, un nuevo informe sobre el avance de la pandemia del nuevo coronavirus COVID-19 cuyos primeros casos en el país se registraron",17-09-2020 15:50,https://www.bing.com/th?id=ON.AB6B5A09AD25063A32CB8694E1513FF1,Chile,T13
Covid-19 en Chile: 84 personas murieron en las últimas 24 ...,https://www.adnradio.cl/nacional/2020/09/17/covid-19-en-chile-84-personas-murieron-en-las-ultimas-24-horas-segun-el-deis.html,"El Ministerio de Salud informó este jueves con 84 personas fallecidas por coronavirus Covid-19 en las últimas 24 horas, según el Departamento de Estadísticas e Información de Salud (DEIS). La cifra de",17-09-2020 16:23,https://www.bing.com/th?id=ON.32C18758FED6C87D869CAC1AEFADDA01,Chile,ADN
Ministro Paris llamó a celebrar las Fiesta Patrias en ...,https://www.cooperativa.cl/noticias/sociedad/salud/coronavirus/ministro-paris-llamo-a-celebrar-las-fiesta-patrias-en-modo-covid/2020-09-17/115820.html,"El titular del Minsal señaló que en estas fechas hay que ""respetar las medidas de autocuidado, cuidando a nuestros seres queridos"". La autoridad sanitaria también destacó que ""por segundo día consecut",17-09-2020 16:31,https://www.bing.com/th?id=ON.51152C29DE8499273159A1B178246BA4,Chile,Radio Cooperativa
Fiscalización sanitaria en Fiestas Patrias: 14 mil ...,https://www.latercera.com/nacional/noticia/fiscalizacion-sanitaria-en-fiestas-patrias-14-mil-vehiculos-han-sido-devueltos-a-santiago/OF7WD2OWDVAN5JTERIVVRKX5PY/,"Esta mañana, la ministra de Transportes Gloria Hutt, en conjunto con el ministro de Vivienda, Felipe Ward, y el subsecretario de Desarrollo Regional y Administrativo (Subdere), Juan Manuel Masferrer,",17-09-2020 17:06,https://www.bing.com/th?id=ON.831F760E6259C6E184336F15CD49221F,Chile,LA TERCERA
Casos siguen en aumento en la previa de Fiestas Patrias ...,https://www.elperiodista.cl/casos-siguen-en-aumento-en-la-previa-de-fiestas-patrias-puntos-algidos-en-el-norte-y-sur-del-pais/,"El equipo ICOVID Chile, iniciativa liderada por la Universidad de Chile, la Pontificia Universidad Católica de Chile y la Universidad de Concepción, presentó su sexto informe con análisis y datos de l",17-09-2020 17:15,https://www.bing.com/th?id=ON.D40A22EA3C7F49065BE7F66C28780493,Chile,El Periodista
"Pobreza, COVID y la ética del cuidado | El Amaule ...",https://www.elamaule.cl/noticia/economia/pobreza-covid-y-la-etica-del-cuidado,"El 2021 se viene complejo. Mientras no exista una vacuna que permita proteger del coronavirus a las poblaciones más vulnerables, las medidas de protección personal serán imprescindibles para preservar",17-09-2020 17:19,https://www.bing.com/th?id=ON.AB89FE192DED012E185CEEA7DD93C9F7,Chile,elamaule.cl
Fiestas Patrias en pandemia: ¿Cómo será la celebración en ...,https://www.elrancaguino.cl/2020/09/17/fiestas-patrias-en-pandemia-como-sera-la-celebracion-en-la-region/,"Ante el aumento del Covid-19 en el país, el Gobierno dispuso de una serie de medidas de seguridad sanitarias para la celebración de las Fiestas Patrias. De acuerdo al último reporte de las autoridades",17-09-2020 17:51,https://www.bing.com/th?id=ON.8F49FC430F7B35750C99EAE2D84148E4,Chile,elrancaguino.cl
Dólar en Chile toma fuerzas previo a las Fiestas Patrias ...,https://www.df.cl/noticias/mercados/bolsa-monedas/dolar-en-chile-toma-fuerzas-previo-a-las-fiestas-patrias-tras-las/2020-09-17/090632.html,El dólar en Chile avanza a paso firme antes de que se inicien las Fiestas Patrias tras conocerse la decisión de la Reserva Federal de Estados Unidos sobre mantener su política monetaria y de proyectar,17-09-2020 18:20,https://www.bing.com/th?id=ON.38477DBA152F5702C83CD70EC46AC87C,Chile,df.cl
Casos de Covid-19 siguen en aumento en previa de Fiestas ...,https://www.latercera.com/que-pasa/noticia/casos-de-covid-19-siguen-en-aumento-en-previa-de-fiestas-patrias-puntos-algidos-en-el-norte-y-sur-del-pais/LNEFVXLEXFGNJEJQVW6JEXDQCU/,"El equipo ICOVID Chile, iniciativa liderada por la Universidad de Chile, la Pontificia Universidad Católica de Chile y la Universidad de Concepción, presentó su sexto informe con análisis y datos de l",17-09-2020 18:21,https://www.bing.com/th?id=ON.9DAA37193F3D1EA409E4EF09C9002270,Chile,LA TERCERA
Seremi de Salud y Departamento de Salud de Melipilla ...,http://www.diariolabrador.cl/seremi-de-salud-y-departamento-de-salud-de-melipilla-continuaran-testeos-masivos-en-fiestas-patrias/,"Con el objetivo de no relajar las medidas de prevención del Covid-19 por parte de la comunidad en Melipilla, la Seremi de Salud de la región Metropolitana en conjunto con el Departamento de Salud de M",17-09-2020 18:28,https://www.bing.com/th?id=ON.5D1246733DAFCB28AD446BEE289F2DFF,Chile,El Labrador
PRODEMU Magallanes llama a las mujeres a celebrar estas ...,https://www.soberaniaradio.cl/publicacion/?idPublicacion=38727,"Prevenir una nueva alza en los contagios por Covid_19 durante los días de celebración de fiestas patrias es el objetivo de las autoridades, por ello PRODEMU, fundación que preside la Primera Dama Ceci",17-09-2020 18:41,https://www.bing.com/th?id=ON.DEEE059A2B68662027CFB58C137FBF83,Chile,Soberania
