name,url,description,datePublished,imagen,pais,Fuente
Coronavirus en Chile: 42 fallecidos y 3.368 nuevos casos en las últimas 24 horas,https://www.t13.cl/noticia/nacional/coronavirus-chile-09-04-2022,"443 pacientes están internados en Unidades de Cuidados Intensivos (UCI), de los cuales 324 están conectadas a ventilación mecánica invasiva.",09-04-2022 14:11,https://www.bing.com/th?id=OVFT.RFUOxhzJfRLO-PX7nncjCy,Chile,T13
Chile reporta 3.368 casos y 42 fallecidos por Covid-19,https://www.ladiscusion.cl/chile-reporta-3-368-casos-y-42-fallecidos-por-covid-19/,"El Ministerio de Salud informó 3.368 casos nuevos de Covid-19, acumulando a la fecha desde el inicio de la pandemia 3.508.556  personas que han sido diagnosticadas con el virus. De acuerdo con la",09-04-2022 14:32,https://www.bing.com/th?id=OVFT.2NSX4l6e1QaLCf2et4Qs-y,Chile,La Discusión
Chile reporta 1.478 casos nuevos de Covid en las últimas horas,https://www.ladiscusion.cl/chile-reporta-1-478-casos-nuevos-de-covid-en-las-ultimas-horas/,"El Ministerio de Salud informa 1.478 casos nuevos de Covid-19, con una positividad de 4,01% en las últimas 24 horas a nivel nacional, con 31.374 exámenes, PCR y test de antígeno. La positividad diaria en la Región Metropolitana es de 3,58%. La ...",12-04-2022 15:58,https://www.bing.com/th?id=OVFT._hkl3byvklhc8pCV4DN7Ey,Chile,La Discusión
Corea del Sur retirará casi todas las medidas contra COVID,https://www.publimetro.cl/noticias/2022/04/15/corea-del-sur-retirara-casi-todas-las-medidas-contra-covid/,A finales de mayo se eliminará la obligatoriedad de hacer una cuarentena obligatoria de siete días en caso de contraer el virus,15-04-2022 12:46,https://www.bing.com/th?id=OVFT.sP9j4-yTIg7k9LNHjf1Q5i,Chile,publimetro
"Chile registra 2.515 casos nuevos de COVID-19 este miércoles: positividad en la RM alcanza el 5,91%",https://www.t13.cl/noticia/nacional/chile-2.515-casos-covid-19-miercoles-591-positividad-rm-20-04-2022,"En tanto, 8.003 pacientes están en etapa activa del virus, es decir, en el periodo contagiante de la enfermedad.",20-04-2022 14:14,https://www.bing.com/th?id=OVFT.r8_cuUIjQb6FvV3l6rGS0S,Chile,T13
Chile registra 2.515 casos nuevos de COVID-19 este miércoles,https://radioportales.cl/sitio/chile-registra-2-515-casos-nuevos-de-covid-19-este-miercoles/,"El Minsal reportó este miércoles 2 mil 515 casos nuevos de COVID-19, mil 498 sintomáticos, 374 asintomáticos, y 643 con test PCR Positivo no notificados. La cifra total de personas afectadas por el vi",20-04-2022 17:01,https://www.bing.com/th?id=OVFT.hBQue7m_ndKwXpx5mk-QBC,Chile,Radio Portales
Shanghái mantendrá estrictos controles de Covid-19 mientras aumentan las infecciones fuera de cuarentena,https://www.latercera.com/mundo/noticia/shanghai-mantendra-estrictos-controles-de-covid-19-mientras-aumentan-las-infecciones-fuera-de-cuarentena/FADU7D5EAFDUZBJUSGLBZKW3NU/,"A principios de abril, Shanghái ordenó a casi todos los residentes que se quedaran en casa después de que los casos de Covid-19 empezaran a aumentar. Los residentes se han enfrentado a pérdidas de ing",21-04-2022 14:38,https://www.bing.com/th?id=OVFT.C25CF2YgJ2ok38VMzlIeni,Chile,LA TERCERA
