name,url,description,datePublished,imagen,pais,Fuente
Parques Vergara y Rioja de Viña del Mar reabrirán al público desde el lunes 17 de mayo,https://www.puranoticia.cl/noticias/regiones/parques-vergara-y-rioja-de-vina-del-mar-reabriran-al-publico-desde-el/2021-05-14/215920.html,"Todos los recintos permanecerán cerrados durante los fines de semana, mientras Viña del Mar se encuentre en la Fase 2 de «Transición» del plan Paso a paso.",15-05-2021 02:33,https://www.bing.com/th?id=OVFT.YiS9qYfTupbmxEBeyxWrUy,Chile,Puranoticia.cl
Covid-19 y potencial impacto en función vascular placentaria con mirada futura,https://www.diarioconcepcion.cl/ciencia-y-sociedad/2021/05/15/covid-19-y-potencial-impacto-en-funcion-vascular-placentaria-con-mirada-futura.html,Evidencia muestra que el patógeno genera alteraciones en este órgano clave en la gestación y el conocimiento previo indica que hay efectos de corto y largo plazo en niños gestados en condiciones de pa,15-05-2021 03:06,https://www.bing.com/th?id=OVFT.olcDnxgGgrkpu79fFe1pkC,Chile,El Diario de Concepcion
Alberto Dougnac: “A ningún paciente Covid-19 le faltó cama UCI”,https://www.latercera.com/la-tercera-sabado/noticia/alberto-dougnac-a-ningun-paciente-covid-19-le-falto-cama-uci/G52YIL3UZNEMXHXV26G4IE4J4Q/,"A casi un mes de registrarse la mayor ocupación de camas críticas de toda la pandemia, el subsecretario de Redes Asistenciales hace un balance: señala que hoy el sistema sanitario está menos presionad",15-05-2021 05:11,https://www.bing.com/th?id=OVFT.XF8qrlxzSWK7E5_UvI8auS,Chile,LA TERCERA
Cuarentenas: Conoce todas las comunas que permanecen en confinamiento total en Chile,https://www.meganoticias.cl/dato-util/336477-minsal-comunas-cuarentena-hoy-fase-1-covid-cog23.html,"Para contener la pandemia de Covid-19 en Chile, el Ministerio de Salud ha establecido cuarentenas totales en diversas comunas del país. Conoce el listado de comunas aquí.",15-05-2021 09:00,https://www.bing.com/th?id=OVFT.a49AzrVhuCyVw3JUZW1LvC,Chile,meganoticias
Megaelección 2021:: Revisa con tu RUT si eres vocal de mesa,https://www.meganoticias.cl/dato-util/336269-donde-ver-si-soy-vocal-de-mesa-consultar-con-rut-servel-cl-elecciones-mayo-2021-dax13.html,"Conoce cómo revisar si fuiste designado como vocal de mesa para las elecciones de este 15 y 16 de mayo. En este nuevo proceso electoral, se escoge a los próximos alcaldes, concejales, gobernadores y c",15-05-2021 09:02,https://www.bing.com/th?id=OVFT.biTPSgIzh76oTCrz8Bagey,Chile,meganoticias
Chile registra 87 muertos y 6.769 nuevos casos de COVID-19 en jornada de elecciones,https://www.radioagricultura.cl/nacional/2021/05/15/chile-registra-87-muertos-y-6-769-nuevos-casos-de-covid-19-en-jornada-de-elecciones.html,"El ministro de Salud, Enrique Paris, informó que las últimas 24 horas se registró un total de 6.769 nuevos casos,",15-05-2021 11:03,https://www.bing.com/th?id=OVFT.SC10zPK2WQ0T4mjQIynHrS,Chile,Radio Agricultura
"Presidente dice que votar ""es un imperativo moral"" y que espera que ""tengamos una Constitución que recoja el alma de nuestro país""",https://www.emol.com/noticias/Nacional/2021/05/15/1020954/Sebastian-Pinera-vota-en-elecciones.html,"El Mandatario tenía planificado votar cerca de las 8:30, pero a esa hora la mesa aún no estaba constituida. Pudo concretar su derecho a eso de las 9:20 horas.",15-05-2021 11:30,https://www.bing.com/th?id=OVFT.jxLNykd6pmCdIUu3UAIOcy,Chile,Emol
Chile llegó con 9.069.300 vacunados contra el covid-19 a las elecciones de este fin de semana,https://www.adnradio.cl/nacional/2021/05/15/chile-llego-con-9-069-300-vacunados-contra-el-covid-19-a-las-elecciones-de-este-fin-de-semana.html,"El ministro de Salud, Enrique Paris, también informó que a la fecha se han inoculado 4.076.036 personas contra la influenza.",15-05-2021 12:17,https://www.bing.com/th?id=OVFT.7g8RZJ1GLxuQ8WSekEy3GC,Chile,ADN
Ex MasterChef Giovanni Cárdenas está intubado tras contagiarse de COVID-19: se mantiene estable,https://www.t13.cl/noticia/tendencias/ex-masterchef-giovanni-cardenas-covid-19-intubado-15-05-2021,"Cárdenas se hizo conocido al participar en la cuarta temporada de MasterChef Chile, donde llegó incluso a ser uno de los finalistas.",15-05-2021 12:57,https://www.bing.com/th?id=OVFT.TdUfO15Y6iFvpOrUa6ggWC,Chile,T13
Presidente Piñera ejerce su derecho a voto y hace llamado a la ciudadanía para asistir a las urnas y realizar un “aporte al futuro de Chile”,https://www.df.cl/noticias/economia-y-politica/politica/presidente-pinera-ejerce-su-derecho-a-voto-y-hace-llamado-a-la/2021-05-15/083431.html,"“De todos depende que las elecciones sean participativas y seguras”, añadió el mandatario, haciendo énfasis en la necesidad de mantener los resguardos frente a la pandemia.",15-05-2021 13:43,https://www.bing.com/th?id=OVFT.qXry_6inn3QIEZkU8ylDFi,Chile,df.cl
Por segundo día consecutivo: Chile registra más de 6 mil nuevos casos de COVID-19,https://www.t13.cl/noticia/nacional/balance-casos-contagios-muertos-coronavirus-15-05-2021,"2.953 pacientes están internados en Unidades de Cuidados Intensivos (UCI) del país, de las cuales 2.471 están conectados a ventilación mecánica.",15-05-2021 14:06,https://www.bing.com/th?id=OVFT._9EoXEi1DMNFdr-FqIhjrC,Chile,T13
Covid-19 en Chile: Minsal reportó 6.769 casos nuevos,http://www.lanacion.cl/covid-19-en-chile-minsal-reporto-6-769-casos-nuevos/,"En cuanto a los decesos, en las últimas 24 horas se registraron 87 fallecidos por causas asociadas al Covid-19. El número total de víctimas fatales asciende a 27.734 en el país.",15-05-2021 14:20,https://www.bing.com/th?id=OVFT.aIFbTHaxj3DokVuQNi7GHy,Chile,La Nación
Minsal informó 6.769 casos nuevos de covid-19 en Chile: contagiados totales alcanzaron 1.280.252,https://www.adnradio.cl/nacional/2021/05/15/minsal-informo-6-769-casos-nuevos-de-covid-19-en-chile-contagiados-totales-alcanzaron-1-280-252.html,"El ministerio de Salud (Minsal) informó este sábado 6.769 casos nuevos de coronavirus covid-19 en Chile en las últimas 24 horas, alcanzando un total de 1.280.252 contagiados desde el inicio de la pand",15-05-2021 15:10,https://www.bing.com/th?id=OVFT.GNnoYQEmUoxigDBrOlRKuy,Chile,ADN
Nuevo balance del Minsal ratifica alza de contagios: 6.769 casos en últimas 24 horas,https://www.puranoticia.cl/noticias/nacional/nuevo-balance-del-minsal-ratifica-alza-de-contagios-6-769-casos-en/2021-05-15/114216.html,"El Ministerio de Salud emitió este sábado un nuevo balance de la evolución de la pandemia del covid-19 en nuestro país, documentando que sigue el alza de nuevos contagios con 6.769 casos, cifra que se",15-05-2021 16:14,https://www.bing.com/th?id=OVFT.XeNhsR93ueu-IwMw9GOR0i,Chile,Puranoticia.cl
Ministro Paris destaca proceso eleccionario y asegura que esta jornada “es diferente a las otras”,https://www.radioagricultura.cl/nacional/2021/05/15/ministro-paris-destaca-proceso-eleccionario-y-asegura-que-esta-jornada-es-diferente-a-las-otras.html,"El ministro de Salud, Enrique Paris, llegó hasta Providencia para emitir su sufragio, en un proceso eleccionario que se realiza",15-05-2021 16:23,https://www.bing.com/th?id=OVFT.y2Q52_Hkze4t9kYE94QZui,Chile,Radio Agricultura
Vocal en Quintero era contacto estrecho por covid-19: le cursaron sumario y mesa debió cerrar,https://www.biobiochile.cl/noticias/nacional/region-de-valparaiso/2021/05/15/vocal-en-quintero-era-contacto-estrecho-por-covid-19-le-cursaron-sumario-y-mesa-debio-cerrar.shtml,"Un operativo de sanitización se realizó en la comuna de Quintero, en la región de Valparaíso, luego que un vocal de mesa llegara hasta un recinto, sin embargo, el hombre era contacto estrecho por coro",15-05-2021 17:30,https://www.bing.com/th?id=OVFT.52v_UejJvM3_gMsypyH0iS,Chile,Chile
Presidente Piñera llama a la ciudadanía a asistir a las urnas y realizar “aporte al futuro de Chile”,https://www.df.cl/noticias/economia-y-politica/politica/presidente-pinera-llama-a-la-ciudadania-a-asistir-a-las-urnas-y-realizar/2021-05-15/083431.html,"El jefe de Estado señaló la importancia de las elecciones constituyentes, un proceso que ""va a marcar los caminos de nuestro país por las próximas décadas"".",15-05-2021 18:52,https://www.bing.com/th?id=OVFT.nDT8WYjKO8pw-m8QEy--wi,Chile,df.cl
Copa de la Liga Profesional,https://redgol.cl/internacional/Boca-Juniors-vs-River-Plate-por-cuartos-de-final-de-la-Copa-de-la-Liga-Profesional--20210515-0020.html,El campeonato trasandino comenzará su fase de definiciones con un Supercásico donde solo uno podrá avanzar a las semifinales del torneo.,15-05-2021 19:15,https://www.bing.com/th?id=OVFT.EAJkc0qrJO4mw4_utG9TMi,Chile,redgol
Vocal de mesa fue informado que era positivo de COVID-19 mientras ejercía sus funciones en Los Ángeles,https://www.24horas.cl/elecciones-2021/vocal-de-mesa-fue-informado-que-era-positivo-de-covid-19-mientras-ejercia-sus-funciones-en-los-angeles-4781130,"Una particular situación se vivió este sábado en Los Ángeles, región del Biobío, luego que una persona fuese informada que era positivo de COVID-19 mientras ejercía sus funciones como vocal de mesa. T",15-05-2021 19:48,https://www.bing.com/th?id=OVFT.u2VsRI70rGyyEr54Vr24Sy,Chile,24 Horas Chile
Advierte la OPS: En 37 países se han detectado las 4 variantes del COVID-19,https://www.elciudadano.com/mundo/advierte-la-ops-en-37-paises-se-han-detectado-las-4-variantes-del-covid-19/05/15/,La Organización Panamericana de la Salud (OPS) advirtió con preocupación que una o más de las cuatro variantes de COVID-19 fueron detectadas hasta ahora en 37 países y territorios de las Américas.,15-05-2021 20:34,https://www.bing.com/th?id=OVFT.zV_gnF8-v00ql1_LeuahjC,Chile,El Ciudadano
Galería: Las imágenes que ha dejado la primera jornada de la megaelección de este 15 y 16 de mayo,https://www.latercera.com/nacional/noticia/galeria-las-imagenes-que-ha-dejado-la-primera-jornada-de-la-megaeleccion-de-este-15-y-16-de-mayo/MEDTUJ4H5BFAXJBEY2LEUSLJVU/,"Este fin de semana se definirán quienes integrarán la Convención Constitucional, además de gobernadores regionales, alcaldes y concejales.",15-05-2021 20:46,https://www.bing.com/th?id=OVFT.l6HjIkloeCEZCSs89KqrOi,Chile,LA TERCERA
"DEIS: muertes por Covid-19 superan las 35 mil en Chile, entre casos confirmados y probables",https://www.elmostrador.cl/dia/2021/05/15/deis-muertes-por-covid-19-superan-las-35-mil-en-chile-entre-casos-confirmados-y-probables/,"El departamento dependiente del Ministerio de Salud informó que solo en la última semana se han sumado 853 muertes vinculadas a la pandemia. Con ello, en lo que va del quinto mes del año ya se registr",15-05-2021 22:38,https://www.bing.com/th?id=OVFT.784y5qCmoBSqouetnC08WC,Chile,El Mostrador
Se cierran las urnas y concluye primera jornada de histórica “mega elección”,https://www.elperiodista.cl/2021/05/se-cierran-las-urnas-y-concluye-primera-jornada-de-historica-mega-eleccion/,"A las 18:00 horas de este sábado el Servicio Electoral (Servel) ordenó el cierre de las urnas, dando conclusión a la primera jornada de votación de la denominada “mega elección” de alcaldes, concejale",15-05-2021 22:48,https://www.bing.com/th?id=OVFT.SHC6KyWD-Ew06DBhTQvCdi,Chile,El Periodista
"Ministro Paris reconoce ""complejo escenario"" por Covid-19 pero destaca avance de campaña de vacunación",https://www.elmostrador.cl/dia/2021/05/15/ministro-paris-reconoce-complejo-escenario-por-covid-19-pero-destaca-avance-de-campana-de-vacunacion/,"A propósito de la situación de la pandemia en Chile y las altas cifras de contagiados de los últimos días en el país, el jefe del Minsal llamó a no bajar la guardia, y sostuvo que el escenario sigue s",15-05-2021 22:53,https://www.bing.com/th?id=OVFT.aDK7X8CvaXR-1F4UVHOvUy,Chile,El Mostrador
