name,url,description,datePublished,imagen,pais,Fuente
Más trabajos a domicilio y con estrictas medidas ...,https://www.emol.com/noticias/Autos/2020/05/03/984763/talleres-mecanicos-coronavirus-servicio-domicilio.html,"La llegada del coronavirus al país, en marzo pasado con el primer confirmado con Covid-19, obligó a modificar por completo distintas áreas del acontecer nacional desde el comercio hasta los servicios.",03-05-2020 15:39,https://www.bing.com/th?id=ON.C539ABA7127BE3BDE066E42F2F5742C7,Chile,Emol
Ecólogos chilenos advierten que promover biodiversidad en ...,https://www.elmostrador.cl/cultura/2020/05/03/ecologos-chilenos-advierten-que-promover-biodiversidad-en-el-planeta-es-crucial-para-frenar-nuevas-pandemias/,"Vivimos en un mundo altamente globalizado, y las acciones que suceden en un lugar, pueden tener repercusiones en puntos muy distantes del planeta.  Así lo vemos con la actual crisis por Covid-19, cuya",03-05-2020 16:09,https://www.bing.com/th?id=ON.65AA0F8BCB9662EF826AC457F2F7EBEF,Chile,El Mostrador
Coronavirus en Chile: Chile registra casi 20 mil ...,https://www.t13.cl/noticia/nacional/coronavirus-chile-nuevos-casos-contagios-muertes-covid-19-03-05-2020,"Este domingo, el Ministerio de Salud entregó una nueva actualización sobre el avance del coronavirus en Chile y se confirmó que hay 1.228 nuevos casos de contagio y, además, otras 13 personas murieron",03-05-2020 16:32,https://www.bing.com/th?id=ON.98212E438BE447B43F822CC203DE0A73,Chile,T13
Julia Fernandes: “Tengo miedo por mi abuela”,https://www.lacuarta.com/espectaculos/noticia/julia-fernandes-miedo-abuela/490855/,"La ex chica reality vive la crisis sanitaria alejada de su familia y le preocupa la situación de Brasil y del Amazonas, donde vive su familia. El coronavirus ha obligado a cientos de personas a cambia",03-05-2020 16:36,https://www.bing.com/th?id=ON.72381DF1F4211DFDA4849254AAEC9CF0,Chile,La Cuarta
La cifras de Sudamérica en la pandemia: Brasil lidera por ...,https://www.emol.com/noticias/Internacional/2020/05/03/984923/Coronavirus-Sudamerica.html,"Brasil sigue siendo el país con más casos de personas contagiadas con covid-19 y el que ha registrado también el mayor número de fallecidos. Al analizar la realidad regional, según las cifras que regi",03-05-2020 16:35,https://www.bing.com/th?id=ON.F757BE9CF27DA9366E2B516CB4D38DDF,Chile,Emol
19 MIL 663 CASOS TOTALES EN CHILE POR COVID-19,http://radiopolar.com/noticia_157169.html,"674 ventiladores disponibles en el país. Ministro Mañalich dijo que el aumento de casos se debe al aumento del testeo. Pero, también a la desobediencia de mucha gente que está saliendo y no cumpliendo",03-05-2020 16:36,https://www.bing.com/th?id=ON.E1F46DAA128EE659C7B824BE6E83597A,Chile,Radio Polar
Minsal reporta 13 fallecidos y 1.228 nuevos casos de ...,https://www.publimetro.cl/cl/social/2020/05/03/minsal-coronavirus-covid-casos-chile-salud-manalich.html,"El Ministerio de Salud dio a conocer este domingo desde Viña del Mar un nuevo reporte sobre los casos de coronavirus en Chile. El titular del Minsal, Jaime Mañalich, reportó 1.228 nuevos contagios de",03-05-2020 16:41,https://www.bing.com/th?id=ON.A881A887B557F3469BA5093FEA4F917E,Chile,publimetro.cl
Minsal informa que total de contagios por Covid-19 bordea ...,https://www.latercera.com/nacional/noticia/a-dos-meses-del-inicio-del-brote-total-de-contagios-por-covid-19-bordea-los-20000-casos-y-cifra-de-nuevos-fallecidos-llega-a-13-todos-eran-de-la-rm/JCE44ECCNJHRTEM455TXM35HFU/,"A dos meses desde que comenzó el brote en Chile, el ministro de Salud, Jaime Mañalich, mostró su preocupación por el incremento de casos en la Región Metropolitana y anunció que se intensificarán las",03-05-2020 16:43,https://www.bing.com/th?id=ON.F80606B0197ACD9C59DB2D1747A82A3D,Chile,LA TERCERA
Gobierno confirma 1.228 nuevos casos Covid-19 y 13 nuevos ...,https://elpinguino.com/noticia/2020/05/03/gobierno-confirma-1228-nuevos-casos-covid-19-y-13-nuevos-fallecidos-contagios-llegan-a-19663-,"En Magallanes se registraron 25 nuevos casos en total de Covid-19 (todos con síntomas), cifra con la cual el total de contagios asciende a los 777. En tanto el número de decesos se mantiene en Este do",03-05-2020 16:46,https://www.bing.com/th?id=ON.7CA689D3186FFC80E7DC170617D467A8,Chile,ELPINGUINO
Con 1.228 nuevos casos Chile se acerca a los 20.000 ...,https://www.prensafutbol.cl/353715-reporte-covid-19-con-1-228-nuevos-casos-chile-cerca-los-20-000-contagiados/,"El ministerio de salud lamentó el fallecimiento de 13 personas en las últimas 24 horas y comparó esta pandemia con un conflicto armado. “Esta guerra va para largo y sus batallas serán muchas”, expresó",03-05-2020 17:12,https://www.bing.com/th?id=ON.EEE5B4BF7BBBC2015134CE468E87DC20,Chile,Prensafútbol
"A dos meses del primer positivo, nuevos contagios llegan a ...",https://www.latercera.com/nacional/noticia/a-dos-meses-del-primer-positivo-nuevos-contagios-llegan-a-1427-en-un-dia/AMNFTUCVJZBQBIFLR6CTZB6U3Q/,"“La capacidad de testeo ha aumentado de manera muy importante”. De esta forma, el ministro de Salud, Jaime Mañalich, explicó el mayor incremento de nuevos casos de personas contagiadas con coronavirus",03-05-2020 17:15,https://www.bing.com/th?id=ON.80101226ED68B50881AF3BB4DD6153C2,Chile,LA TERCERA
La distancia social de Piñera - El Mostrador,https://www.elmostrador.cl/noticias/opinion/2020/05/03/la-distancia-social-de-pinera/,"A más tardar para el año nuevo chino, el último fin de semana de enero, todo el mundo se enteró de la existencia de un virus de rápida expansión. Para los medios de comunicación, llamó de sobremanera",03-05-2020 17:36,https://www.bing.com/th?id=ON.EB403F9CDEB7B281B845C87773433851,Chile,El Mostrador
Mañalich explica finalidad del carnet COVID-19 y confirma ...,https://www.t13.cl/noticia/nacional/manalich-explica-finalidad-del-carnet-covid-19-y-confirma-tendra-duracion-tres-meses,"""El principal mérito de este carnet es darle esa tranquilidad, de que ya no representa un peligro"", dijo sobre este documento, detallando quiénes lo recibirán. Uno de los temas que tocó el ministro de",03-05-2020 17:40,https://www.bing.com/th?id=ON.1365DEC906356BEF6043ADAB9D0C515B,Chile,T13
Senador Chahuán exige ayuda inmediata para jóvenes ...,https://www.radioagricultura.cl/nacional/2020/05/03/senador-chahuan-exige-ayuda-inmediata-para-jovenes-chilenos-abandonados-en-isla-de-honduras.html,"El senador Francisco Chahuán exigió ayuda inmediata de las autoridades para dos jóvenes chilenos abandonados en Roatán, una isla de Honduras.  Eduardo González y Franco Moraga no han podido salir del",03-05-2020 17:49,https://www.bing.com/th?id=ON.099CD0F5086E024F01735A15AC5DFD5E,Chile,Radio Agricultura
Adultos mayores de Colchagua rebieron kits de higene. – El ...,https://www.elrancaguino.cl/2020/05/03/adultos-mayores-de-colchagua-rebieron-kits-de-higene/,"En una nueva jornada de distribución de kits de higiene, autoridades regionales llegaron hasta los Condominios de Viviendas Tuteladas (CVT) Cordillera y Los Lingues, de la capital de la provincia de C",03-05-2020 18:07,https://www.bing.com/th?id=ON.98B7B6683DD107FF8FE48685FFEDB81F,Chile,elrancaguino.cl
La historia de dos jóvenes viñamarinos que... | Puranoticia,https://www.puranoticia.cl/noticias/regiones/la-historia-de-dos-jovenes-vinamarinos-que-estan-varados-en-una-isla-de/2020-05-02/192447.html,"Dos jóvenes viñamarinos llevan 45 días viviendo una situación dramática en la isla hondureña Roatán, que se encuentra cerrada para el ingreso y salida de personas, esto con el fin de evitar la propaga",03-05-2020 18:10,https://www.bing.com/th?id=ON.9043A978289E23ADA8DCB93936571C5D,Chile,Puranoticia.cl
Chimbarongo: mnOrdenanza municipal mandata uso obligatorio ...,https://www.elrancaguino.cl/2020/05/03/chimbarongo-mnordenanza-municipal-mandata-uso-obligatorio-de-mascarilla-en-la-comuna/,"La Ilustre Municipalidad de Chimbarongo, informó sobre una nueva ordenanza que ordena el uso obligatorio de mascarillas y otros mecanismos de prevención de contagio de Pandemia Covid 19. El documento",03-05-2020 18:49,https://www.bing.com/th?id=ON.E6B1389127E2EA4A809FBB381133DD29,Chile,elrancaguino.cl
Balance diario del coronavirus en Chile se realizará esta ...,https://www.adnradio.cl/regional/2020/05/03/balance-diario-del-coronavirus-en-chile-se-realizara-esta-jornada-en-la-region-de-valparaiso.html,"Tras una visita inspectiva al nuevo Hospital Gustavo Fricke de Viña del Mar, las autoridades de salud, encabezados por el ministro Jaime Mañalich, entregarán el nuevo informe sobre el avance del coron",03-05-2020 18:49,https://www.bing.com/th?id=ON.3530AEF6F6240FF758115B3C181DFC00,Chile,ADN
300 emprendedores magallánicos han respondido encuesta del ...,https://elpinguino.com/noticia/2020/05/03/300-emprendedores-magallanicos-han-respondido-encuesta-del-gobierno-regional-,"En el marco de la Estrategia Regional Covid-19, para hacer frente a la crisis sanitaria más importante que ha debido enfrentar Chile en el último siglo, y con el fin de impulsar la reactivación socioe",03-05-2020 19:05,https://www.bing.com/th?id=ON.B031B55B47C12C5E5BADF978851F4FE7,Chile,ELPINGUINO
"CDN - Canal de Noticias, Malleco",https://www.canaldenoticias.cl/noticias/?post=12017,"Este domingo 3 de mayo se conmemora el Día Mundial de la Libertad de Prensa, en un contexto donde el los medios de comunicación juegan un rol crucial en otorgar la adecuada información sobre la pandem",03-05-2020 19:34,https://www.bing.com/th?id=ON.DDBB19970906DEDFBB244A07002F0FE8,Chile,CANAL DE NOTICIAS
Covid-19 hace tambalear el amor tarifado en Chile,https://www.lacuarta.com/cronica/noticia/covid-19-amor-tarifado/490845/,"Night Clubs, Cafés con piernas, strippers y scorts sufren una crisis sin precedentes y ven amenazada la estabilidad de su negocio, asegurando que el rubro está con los días contados. El impacto económ",03-05-2020 19:45,https://www.bing.com/th?id=ON.7251E329E09B9EE63CB7F2F67591E027,Chile,La Cuarta
Nuevo informe por Covid 19: Chile se acerca a los 20.000 ...,https://www.cooperativa.cl/noticias/sociedad/salud/coronavirus/nuevo-informe-por-covid-19-chile-se-acerca-a-los-20-000-contagiados/2020-05-03/121929.html,Ministerio de Salud confirmó que en las últimas 24 horas se registraron 1.228 nuevos casos y 13 fallecidos. El Ministerio de Salud confirmó que en las últimas 24 horas se registraron 1.228 nuevos caso,03-05-2020 20:02,https://www.bing.com/th?id=ON.6E87C2E9C985FE9ABD88D0489E972805,Chile,Radio Cooperativa
Los Ríos registra casi 200 casos de Covid-19: una menor de ...,https://www.biobiochile.cl/noticias/nacional/region-de-los-rios/2020/05/03/los-rios-registra-casi-200-casos-de-covid-19-una-menor-de-12-anos-dentro-de-los-nuevos-contagios.shtml,"Casi 200 casos de Covid-19 se registran en la región de Los Ríos, luego que se confirmaran dos nuevos contagios en Valdivia y La Unión. Son 198 los confirmados hasta la fecha en la región de Los Ríos,",03-05-2020 20:10,https://www.bing.com/th?id=ON.CB1E6410207C081438388DF078584F88,Chile,Chile
Chilenos regresan al país tras estar varados en España por ...,http://lanacion.cl/2020/05/03/chilenos-regresan-al-pais-tras-estar-varados-en-espana-por-mas-de-un-mes/,"En la tarde de este domingo se inició un vuelo desde España con 136 chilenos que podrán regresar al país luego de que estuvieran varados en Europa desde finales de marzo, debido a la pandemia de Covid",03-05-2020 21:01,https://www.bing.com/th?id=ON.1B26B8F5CD3D800212A2630B18FA2CE8,Chile,La Nación
Se reportan 13 decesos más y 1.228 nuevos casos de Covid ...,http://lanacion.cl/2020/05/03/se-reportan-13-decesos-mas-y-1-228-nuevos-casos-de-covid-19-en-chile/,"Jaime Mañalich, ministro de Salud, dio a conocer este domingo en Valparaíso un nuevo balance relacionados a los casos de Covid-19 en Chile. El secretario de Estado comunicó que en las últimas 24 horas",03-05-2020 21:43,https://www.bing.com/th?id=ON.5C5B8A9378A2E1392069C61B6A2C8859,Chile,La Nación
Castro (PS) al Gobierno: “Se precipitaron relajando las ...,https://www.radioagricultura.cl/politica/2020/05/03/castro-ps-al-gobierno-se-precipitaron-relajando-las-medidas-y-privilegiaron-la-economia-por-sobre-la-salud.html,El diputado socialista Juan Luis Castro se sumó a las críticas al manejo del Gobierno respecto a la pandemia del coronavirus que ya lleva un total de 19.663 contagiados en Chile. El parlamentario subr,03-05-2020 21:47,https://www.bing.com/th?id=ON.02661210959DFAF2549F2B95FF013D82,Chile,Radio Agricultura
Anuncian cuarentena en 4 comunas de la RM y dos de la ...,https://www.biobiochile.cl/noticias/nacional/chile/2020/05/03/desde-el-martes-entran-en-cuarentena-cerrillos-recoleta-quilicura-y-todo-santiago-centro.shtml,"Estamos recopilando más antecedentes sobre esta noticia, quédate atento a las actualizaciones. El ministro de Salud, Jaime Mañalich, anunció nuevas medidas para enfrentar la pandemia del Covid-19, lue",03-05-2020 21:57,https://www.bing.com/th?id=ON.C84055A54CB4882EF9CB70B5F9031CF2,Chile,Chile
Maule: Universidad Autónoma tendrá un laboratorio para ...,https://www.cooperativa.cl/noticias/sociedad/salud/coronavirus/maule-universidad-autonoma-tendra-un-laboratorio-para-analizar-180/2020-05-03/164113.html,"Hasta 180 muestras de Covid-19 diarias podrán ser analizadas en el laboratorio que tendrá la Universidad autónoma de Chile gracias a un convenio suscrito con el Servicio de Salud del Maule, que permit",03-05-2020 22:01,https://www.bing.com/th?id=ON.9D75AC4BE184A9F3198E3E37B93528C7,Chile,Radio Cooperativa
El plan de salvataje financiero que prepara el gobierno ...,https://www.radiosantiago.cl/archivo/128799,Fuerte fue el impacto de prorrogar el pago de los permisos de circulación de la plaza vehicular del país como una forma de alivianar el bolsillo de los chilenos en tiempos de Covid-19. Pero los efecto,03-05-2020 22:04,https://www.bing.com/th?id=ON.ABA3DCEB0BA3C2C471235DACE760DF0E,Chile,Radio Santiago
Coronavirus en Chile: Se registraron 1.427 casos durante ...,https://www.elperiscopio.cl/noticias/coronavirus-en-chile-se-registraron-1-427-casos-durante-las-ultimas-24-horas/,"El Ministerio de Salud confirmó este sábado 02 de mayo que en las últimas 24 horas se registraron 1.427 nuevos casos documentados de contagio por Covid-19, que elevan preocupantemente la cifra total a",03-05-2020 22:07,https://www.bing.com/th?id=ON.B63D5F8BCF4F7CF4891E7210B614E59A,Chile,elperiscopio.cl
"Covid-19 en Chile: Más de 17.000 contagiados, 234 muertos ...",https://www.elperiscopio.cl/destacado-1/covid-19-en-chile-mas-de-17-000-contagiados-234-muertos-y-985-nuevos-casos/,"Este viernes 01 de mayo, el Ministerio de Salud confirmó que en las últimas 24 horas se registraron 985 nuevos casos documentados de contagio por coronavirus, que elevan la cifra total a 17.008 person",03-05-2020 22:07,https://www.bing.com/th?id=ON.8DFCB74BF7826D9EFB5AE80F938082B0,Chile,elperiscopio.cl
Coronavirus en Chile: 13 nuevas muertes en... | Puranoticia,https://www.puranoticia.cl/noticias/nacional/coronavirus-en-chile-13-nuevas-muertes-en-ultimas-24-horas-y-1-228/2020-05-03/124842.html,"El Ministerio de Salud informó que hasta las 21 horas de ayer se produjeron 13 nuevas muertes por covid-19, la misma cantidad reportada este sábado, con lo cual el número oficial de fallecidos subió a",03-05-2020 22:11,https://www.bing.com/th?id=ON.9D687DDBAA6FA855FCC1B6886364EB05,Chile,Puranoticia.cl
