name,url,description,datePublished,imagen,pais,Fuente
Nuevo informe DEIS: Chile superó los 20 mil fallecidos por ...,https://www.lacuarta.com/deportes/noticia/nuevo-informe-deis-chile-supero-los-20-mil-fallecidos-covid-19/569665/,"En el documento se incluyen los confirmados y sospechosos fallecidos por covid-19 en Chile, cifra que ya va en más de 20 mil fallecidos.",21-11-2020 20:18,https://www.bing.com/th?id=OVFT.OreZLtCe71_A3SZzHSUAOC,Chile,La Cuarta
Expertos y expertas plantean preocupación ante focos ...,https://www.rln.cl/nacional/80557-expertos-y-expertas-plantean-preocupacion-ante-focos-geograficos-de-mayor-transmision-en-el-norte-y-sur-del-pais,"Se observan dos territorios con mayores valores de transmisión: entre las regiones de Atacama y Coquimbo, y entre Ñuble y Los Lagos, lo que preocupa especialmente a las y los investigadores debido a l",21-11-2020 20:20,https://www.bing.com/th?id=OVFT.ZEstkpW95BfQXriDwmA0MS,Chile,Radio las Nieves
DEIS: Chile sobrepasa los 20.000 fallecidos por Covid-19 ...,https://www.latribuna.cl/noticias/2020/11/21/deis-chile-sobrepasa-los-20-000-fallecidos-por-covid-19-entre-confirmados-y-probables.html,"Las regiones con las mayores tasas de incidencias por casos confirmados son Arica, Magallanes y Metropolitana.",21-11-2020 22:04,https://www.bing.com/th?id=OVFT.HnlEfejk5slv327RkM52eC,Chile,La Tribuna
Vacuna contra el coronavirus: Pfizer espera rápido ...,https://www.publimetro.cl/cl/noticias/2020/11/21/vacuna-contra-el-coronavirus-pfizer-espera-rapido-lanzamiento-en-america-latina.html,La farmacéutica que firmó acuerdo con Chile asegura que aguardan el visto bueno de la FDA para que ensayo sea distribuido pronto.,21-11-2020 22:29,https://www.bing.com/th?id=OVFT.L5QuoVvd5EiCJS4uDymgcC,Chile,publimetro.cl
Libres de coronavirus: Conoce las 53 comunas que no tienen ...,https://www.meganoticias.cl/nacional/319676-libres-de-coronavirus-comunas-sin-casos-activos-algarrobo-torres-del-paine-jdx14.html,"Conoce detalle sobre las comunas que no tienen casos activos de coronavirus en el territorio nacional, según lo reportado en el más reciente informe epidemiológico del Ministerio de Salud.",22-11-2020 01:30,https://www.bing.com/th?id=OVFT.7dCz-YSH92BuvyVDCdC-xy,Chile,meganoticias
Solo Puente Alto y Maipú de la RM aparecen dentro de las ...,https://www.elperiodista.cl/solo-puente-alto-y-maipu-de-la-rm-aparecen-dentro-de-las-20-comunas-con-mas-casos-activos-en-el-pais/,"En el Informe Epidemiológico Nº70, entregado hoy por el Ministerio de Salud, junto con reportarse que al 19 de noviembre los contagios de Covid 19 en Chile sumaban  610.829 (537.585 confirmados por PC",22-11-2020 01:50,https://www.bing.com/th?id=OVFT.q83t0oSKR8IuvZUSNL2rty,Chile,El Periodista
Los indicadores claves de la pandemia para no permiten ...,http://www.ladiscusion.cl/los-indicadores-claves-de-la-pandemia-para-no-permiten-avanzar-a-fase-3/,"Chillán, Chillán Viejo y Quillón son las comunas de la región de Ñuble que se encuentran en etapa 2 de Transición, el resto del territorio se mantiene en la fase 3 de Preparación del Plan Paso a",22-11-2020 02:52,https://www.bing.com/th?id=OVFT.OzT4c-ezmeSGiTwta_wj_i,Chile,La Discusión
Se encienden alarmas debido a caída de clasificación de riesgo,https://www.diarioconcepcion.cl/economia/2020/11/22/se-encienden-alarmas-debido-a-caida-de-clasificacion-de-riesgo.html,"Se estima imperioso el que se establezca una senda creíble de consolidación fiscal, una vez concluida la crisis sanitaria, de lo contrario se caerá en un círculo vicioso que obligará a destinar menore",22-11-2020 04:10,https://www.bing.com/th?id=OVFT.LIIRnmwXGR_GUgmhq7_LaC,Chile,El Diario de Concepcion
Covid-19: “No me quiero vacunar” - La Tercera,https://www.latercera.com/la-tercera-domingo/noticia/covid-19-no-me-quiero-vacunar/2J7HZA7NZVGI3CDDHWXB5RIDLQ/,"Una encuesta realizada por Ipsos en conjunto con el Foro Económico Mundial mostró que, a nivel planetario, el 27% no está dispuesto a vacunarse. Entre los países con mayores dudas figuran Francia, Esp",22-11-2020 05:20,https://www.bing.com/th?id=OVFT.rjf_6xcyp9gVaZ8qK5jzFi,Chile,LA TERCERA
Pandemia de coronavirus supera los 58 millones de casos en ...,https://www.radioagricultura.cl/internacional/2020/11/22/pandemia-de-coronavirus-supera-los-58-millones-de-casos-en-todo-el-mundo.html,"La pandemia del nuevo coronavirus acumula más de 58 millones de casos en todo el mundo tras sumar en las últimas 24 horas más 570.000 nuevos contagios, una cifra que rompe los dos últimos días de récords que habían registrado más de 600.000 infectados globales, según el balance global de la",22-11-2020 12:10,https://www.bing.com/th?id=OVFT.4xJ9INd8XGdPE_w5LE3pMS,Chile,Radio Agricultura
Minsal reporta más de 1.400 nuevos contagios y 39 muertes ...,https://www.meganoticias.cl/nacional/319710-coronavirus-chile-casos-retorno-seguro-plan-paso-a-paso-domingo-22-noviembre-jdx14.html,"Conoce detalles sobre las cifras de personas contagiadas y fallecidas por la pandemia de coronavirus en Chile, según el más reciente balance del Ministerio de Salud.",22-11-2020 14:08,https://www.bing.com/th?id=OVFT.tdWD6gc80p9pxV8J1URjLy,Chile,meganoticias
Chile registra 39 muertos y 1.497 casos nuevos de covid-19 ...,https://www.biobiochile.cl/noticias/nacional/chile/2020/11/22/chile-registra-39-muertos-y-1-497-casos-nuevos-de-covid-19-en-las-ultimas-24-horas.shtml,"Este domingo el Gobierno, por medio del Ministerio de Salud, entregó un nuevo reporte sobre la propagación de la pandemia del covid-19 en Chile. En las últimas 24 horas, se registraron 1.497 nuevos contagios de covid-19, de los cuales 961 son sintomáticos y 522 son asintomáticos. Con ello el",22-11-2020 14:16,https://www.bing.com/th?id=OVFT.Fk3S7KPCX8gVXSy4oBXpey,Chile,Chile
Covid-19: Chile reportó 39 decesos y 1.497 nuevos ...,https://www.latribuna.cl/coronavirus/2020/11/22/covid-19-chile-reporto-39-decesos-y-1-497-nuevos-contagios.html,"Con esto, la cifra de contagios asciende a 540.640, mientras que la de fallecidos a 15.069 desde que comenzó la pandemia en Chile.",22-11-2020 14:21,https://www.bing.com/th?id=OVFT.wIw6qfsFKM460B7T_upUJC,Chile,La Tribuna
Covid-19: 1.497 nuevos casos y 39 fallecidos en Chile ...,http://www.radioportales.cl/sitio/covid-19-1-497-nuevos-casos-y-39-fallecidos-en-chile/,"El Ministerio de Salud (Minsal) reportó este Domingo 1.497 nuevos casos de contagio por COVID-19 y 39 muertes, tras dar a conocer un nuevo balance diario sobre el avance de la pandemia de coronavirus",22-11-2020 14:29,https://www.bing.com/th?id=OVFT.CV1iFQzhz_zUHLb_eaIYuy,Chile,Radio Portales
Colmed cuestiona las palabras de Dougnac sobre doctora ...,https://www.latercera.com/nacional/noticia/colmed-cuestiona-las-palabras-de-dougnac-sobre-doctora-fallecida-por-covid-19-son-inoportunas-inadecuadas-y-absolutamente-innecesarias/GON2GXZMWRD4PFU3XCJMZFUCSU/,"Desde el Colegio Médico criticaron las palabras del subsecretario de Redes Asistenciales, Alberto Dougnac, sobre la presunta responsabilidad de la doctora Carol Ortíz en el contagio de coronavirus, qu",22-11-2020 14:54,https://www.bing.com/th?id=OVFT.to68W1Kn1bwCGX1gQ71_OC,Chile,LA TERCERA
Balance COVID- 19: Chile registra 1.497 casos nuevos y 39 ...,https://www.24horas.cl/coronavirus/balance-chile-registra-1497-casos-nuevos-y-39-fallecidos-en-la-ultima-jornada-4541662,"Balance COVID- 19: Chile registra 1.497 casos nuevos y 39 fallecidos en la última jornada. ... a raíz del coronavirus. Con aquellas cifras, Chile llegó a un total de 15.069 fallecidos y 540.640 contagios producto de la pandemia. ... Balance diario #COVID_19 🔹 1.497 casos nuevos 🔹 961 sintomáticos 🔹 522 asintomáticos",22-11-2020 15:00,https://www.bing.com/th?id=OVFT.8ChT1UtcuMt9OOx7glbLSy,Chile,24 Horas Chile
Minsal reporta 1.497 nuevos contagios y 39 fallecidos por ...,https://www.elmostrador.cl/dia/2020/11/22/minsal-reporta-1-497-nuevos-contagios-y-39-fallecidos-por-covid-19-en-ultima-jornada-hay-9-145-casos-activos-en-chile/,"PAÍS. Minsal reporta 1.497 nuevos contagios y 39 fallecidos por Covid-19 en última jornada: hay 9.145 casos activos en Chile por El Mostrador 22 noviembre, 2020",22-11-2020 15:05,https://www.bing.com/th?id=OVFT.s_t9ASD6vFDn6wDo_grCXi,Chile,El Mostrador
Reporte del Covid-19: 39 fallecidos y 1.497 nuevos ...,http://www.lanacion.cl/reporte-del-covid-19-39-fallecidos-y-1-497-nuevos-contagios-en-chile/,"El Ministerio de Salud entregó este domingo un nuevo reporte diario sobre el estado de la pandemia del Covid-19 en Chile, correspondiente a las últimas 24 horas. Según la entidad ministerial, se registraron 39 muertes producto del coronavirus y 1.497 nuevos casos de la enfermedad. De los nuevos",22-11-2020 15:21,https://www.bing.com/th?id=OVFT.77JFD9tIx70BfZaIdGc4Ii,Chile,La Nación
Van 289 este año: ministro Paris llama a incrementar la ...,https://www.publimetro.cl/cl/noticias/2020/11/22/paris-dia-trasplantes-hospital.html,En el Día Nacional del trasplante el ministro de Salud visitó a una paciente trasplantada de hígado en el hospital Doctor Sótero del Río.,22-11-2020 15:39,https://www.bing.com/th?id=OVFT.kYeOm7Ga-wGooTdZ258xsy,Chile,publimetro.cl
Piñera anuncia reapertura de frontera aérea por Santiago ...,https://www.t13.cl/noticia/nacional/pinera-anuncia-reapertura-fronteras-extranjeros-no-residentes-chile,"No obstante, el Jefe de Estado precisó que los extranjeros que pretenden ingresar a territorio chileno deberán cumplir una serie de requisitos antes y que consideran, en esta primera etapa, la entrega",22-11-2020 15:55,https://www.bing.com/th?id=OVFT.EZSXKR1MECu1i-ZxDCIEHi,Chile,T13
LEY DE PROTECCION AL EMPLEO - El Rancagüino,https://www.elrancaguino.cl/2020/11/22/ley-de-proteccion-al-empleo/,"Un informe publicado en septiembre por Termómetro Laboral de O´Higgins –entidad compuesta por la Universidad de O´Higgins, la Cámara Chilena",22-11-2020 16:35,https://www.bing.com/th?id=OVFT.UiWjQC-pibMWiUqN6aPozC,Chile,elrancaguino.cl
Presidente Piñera por vacuna contra el COVID-19 en Chile ...,https://www.24horas.cl/coronavirus/presidente-pinera-por-vacuna-contra-el-covid-19-en-chile-nuestro-gobierno-ha-tomado-todas-las-medidas-necesarias-4541738,"Durante la tarde de este domingo, el presidente Sebastián Piñera participó en la reapertura de la frontera en el Aeropuerto Arturo Merino Benítez . En la ocasión se refirió además a los avances de la vacuna contra el COVID-19 en el país y los acuerdos que ha alcanzado el Gobierno.",22-11-2020 18:07,https://www.bing.com/th?id=OVFT.Sum82AI3WOU4wxR1bcI-ki,Chile,24 Horas Chile
"300 sumarios sanitarios, 71 nuevos casos y tres muertos ...",https://www.biobiochile.cl/noticias/nacional/region-de-valparaiso/2020/11/22/300-sumarios-sanitarios-71-nuevos-casos-y-tres-muertos-por-covid-19-en-region-de-valparaiso.shtml,"Más de 300 sumarios sanitarios cursó la Seremi de Salud durante este fin de semana en la región de Valparaíso, donde fiscalizaron a más de 130 mil personas en playas, centros comerciales y turísticos.",22-11-2020 18:28,https://www.bing.com/th?id=OVFT.YGcYwrM5jT0nSqmAm5_y0C,Chile,Chile
La vacuna contra el COVID-19 podría empezar a ...,https://www.cnnchile.com/coronavirus/vacuna-covid-19-administrarse-ee-uu-12-diciembre_20201122/,"(EFE) – Los primeros estadounidenses podrían empezar a recibir la vacuna contra el COVID-19 el próximo 12 de diciembre, pronosticó este domingo el principal asesor de la Operación “Warp Speed”, el equipo de la Casa Blanca que intenta acelerar las soluciones médicas a la pandemia.",22-11-2020 18:32,https://www.bing.com/th?id=OVFT.6I5mQUoZUylFKD3kducfly,Chile,CNN Chile
PREVIA | Universidad de Chile visita a Everton de Viña del ...,https://www.adnradio.cl/futbol/2020/11/22/previa-universidad-de-chile-visita-a-everton-de-vina-del-mar-buscando-volver-a-la-victoria-y-quedarse-con-los-tres-puntos.html,"A contar de las 19:15 horas, Everton de Viña del Mar recibirá en el Estadio Sausalito a Universidad de Chile por la vigésima fecha del Campeonato Nacional. Los “Ruleteros” vienen de rescatar un trabaj",22-11-2020 18:36,https://www.bing.com/th?id=OVFT.4YG9MAsL8ASQPQRC3jlZnC,Chile,ADN
Gobierno anuncia reapertura de fronteras tras cierre por ...,https://www.elmostrador.cl/dia/2020/11/22/gobierno-anuncia-reapertura-de-fronteras-tras-cierre-por-pandemia-se-exigira-resultado-negativo-de-un-test-pcr/,"Este lunes comenzará la apertura gradual de los límites aéreos a través del principal terminal aéreo del país, posibilitando el ingreso de ciudadanos extranjeros que cumpla una serie de requisitos.",22-11-2020 18:57,https://www.bing.com/th?id=OVFT.a9UL5LANRYpjfh2t3G3lKC,Chile,El Mostrador
