name,url,description,datePublished,imagen,pais,Fuente
Viajes Interregionales | Revisa AQUÍ cómo sacar el Pasaporte C19 para viajar a otra región,https://redgol.cl/tendencias/Como-sacar-el-C19-para-los-viajes-interregionales--Requisitos-Pasaporte-Sanitario-Chile-Plan-Paso-a-Paso-20210715-0053.html,"Plan Paso a Paso permite estos desplazamientos. Revisa aquí los requisitos para obtenerlo. La situación sanitaria del Covid-19 sigue mejorando en Chile, donde el último informe del Ministerio de Salud",15-07-2021 18:48,https://www.bing.com/th?id=OVFT.e24nQHkyg_Jce6VVy2Z9gi,Chile,redgol
Claudio Orrego jura como nuevo gobernador de la Región Metropolitana de Santiago,https://www.diariolabrador.cl/claudio-orrego-jura-como-nuevo-gobernador-de-la-region-metropolitana-de-santiago/,"En el marco del Pleno Extraordinario Nº 02-2021 del Consejo Regional Metropolitano de Santiago (CORE), Claudio Orrego Larraín juró como nuevo Gobernador de la Región Metropolitana y presidente del Con",15-07-2021 18:57,https://www.bing.com/th?id=OVFT.rzj3lMPoBLon1lLckVLsqS,Chile,El Labrador
La mitad de las pymes sufrieron ataques informáticos en 2020,http://www.eldivisadero.cl/noticia-63329,"Solo en 2020, hubo más de 2,3 mil millones de intentos de ataques cibernéticos en nuestro país, cifras que preocupan pero que puedan ser controladas con una correcta capacitación de los colaboradores.",15-07-2021 19:24,https://www.bing.com/th?id=OVFT.IC7cRe7-sSYp4gwoFDsFDC,Chile,Diario el Divisadero
José Antonio Kast exigió la renuncia de Izkia Siches al Colmed por un insólito motivo,https://www.elperiscopio.cl/noticias/jose-antonio-kast-exigio-la-renuncia-de-izkia-siches-al-colmed-por-un-insolito-motivo/,"La crítica de Kast contra Siches fue respaldada por Jaime Mañalich, quien rechazó la estrategia de confinamiento tras la disminución de casos COVID-19.",15-07-2021 19:33,https://www.bing.com/th?id=OVFT.2SaYeFV2JfVOb3TAYex9OC,Chile,elperiscopio.cl
Buque no puede recalar en Quintero porque su capitán es sospechoso de portar la variante Delta del Covid-19,https://www.puranoticia.cl/noticias/regiones/buque-no-puede-recalar-en-quintero-porque-su-capitan-es-sospechoso-de/2021-07-15/153644.html,"El capitán de la nave fue enviado a una residencia sanitaria, hasta que se conozcan los resultados del examen de PCR que se realizó.",15-07-2021 20:08,https://www.bing.com/th?id=OVFT.n4t6szjDvzTF8bH9zsYUaS,Chile,Puranoticia.cl
Testeo gratuito y entrega de condones femeninos: Las alternativas que anunció Minsal para prevenir el contagio de VIH,https://www.theclinic.cl/2021/07/15/testeo-gratuito-y-entrega-de-condones-femeninos-las-alternativas-que-anuncio-minsal-para-prevenir-el-contagio-de-vih/,"Durante el balance diario por Covid-19 de este jueves, la subseretaria Paula Daza informó nuevas medidas para prevenir el contagio de VIH.",15-07-2021 20:53,https://www.bing.com/th?id=OVFT.ppz9sE_CR0n2CAfdL9ee2C,Chile,Clinic
Estudio de eficacia de Sinovac en Chile: Solo un 2% de los vacunados se ha contagiado de COVID-19,https://www.t13.cl/noticia/nacional/resultados-eficacia-vacuna-sinovac-tercera-dosis-15-07-2021,"Solo 45 de los 2.300 vacunados evaluados se contagió por COVID-19 y la mayoría de ellos lo hizo de forma leve. Solo tres de ellos requirieron asistencia hospitalaria, pero ninguno falleció, ratificand",15-07-2021 20:53,https://www.bing.com/th?id=OVFT.74B1xqF2awfa5VYgOK_try,Chile,T13
Piden cumplir con los aforos establecidos para evitar sumarios sanitarios,http://www.ladiscusion.cl/piden-cumplir-con-los-aforos-establecidos-para-evitar-sumarios-sanitarios/,"Desde este 15 de julio la región de Ñuble cuenta con 18 comunas en fase 3 de Preparación y tres en Transición, lo que coincide con un fin de semana largo y la entrada en vigencia de las",15-07-2021 20:58,https://www.bing.com/th?id=OVFT.HO8b1mZyyVpYQ1Ld-QaXvC,Chile,La Discusión
"Couve por resultados de estudio de Sinovac en Chile: ""Son insumos clave para decidir si aplicar o no una dosis de refuerzo""",https://www.emol.com/noticias/Nacional/2021/07/15/1026925/couve-estudio-sinovac-dosis-refuerzo.html,"El ministro de Ciencia destacó que el análisis, desarrollado por la UC y el Instituto Milenio de Inmunología e Inmunoterapia, muestra que ""la mayor parte de las personas presenta anticuerpos neutraliz",15-07-2021 21:11,https://www.bing.com/th?id=OVFT.jxLNykd6pmCdIUu3UAIOcy,Chile,Emol
"24 horas party people: The Weeknd, Metallica, Lorde y BTS animarán Festival Global Citizen 2021",https://www.latercera.com/culto/2021/07/15/24-horas-party-people-the-weeknd-metallica-lorde-y-bts-animaran-festival-global-citizen-2021/,"El próximo 26 de septiembre se realizará -durante un día completo- una nueva versión de este certamen creado por una organización filantrópica del mismo nombre, el cual se transmitirá desde seis conti",15-07-2021 21:23,https://www.bing.com/th?id=OVFT.Xruv99p4RXSEfl1E-t6CxC,Chile,LA TERCERA
Sensini: «Everton todavía no logra explotar su potencial ofensivo»,https://www.prensafutbol.cl/421326-sensini-everton-todavia-no-logra-explotar-su-potencial-ofensivo/,"Everton de Viña del Mar pasa por un buen momento, acumulando nueve partidos sin perder entre el Campeonato Nacional y Copa Chile. De cara a la reanudación ... el contagio de Cecilio Waterman de COVID-19 junto a al selección de Panamá y la lesión ...",15-07-2021 21:32,https://www.bing.com/th?id=OVFT.wqLUwCW2Yz8OmBCl-4zumS,Chile,Prensafútbol
10 panoramas pandémicos al aire libre para vacaciones de invierno,https://www.duna.cl/tendencias/2021/07/15/10-panoramas-pandemicos-al-aire-libre-para-vacaciones-de-invierno/,Parques y personajes reactivan sus actividades ampliándose al aire libre o abriendo sus espacios ya que la pandemia lo permite.,15-07-2021 21:32,https://www.bing.com/th?id=OVFT.3rkixmF87EBPOkt6YkPazi,Chile,duna
Estudio PUC de vacuna Sinovac: En seis meses no se registran muertes por Covid,http://www.lanacion.cl/estudio-puc-de-vacuna-sinovac-en-seis-meses-no-se-registran-muertes-por-covid/,Un equipo liderado por la Pontificia Universidad Católica e integrado por el “Consorcio Científico para Evaluar Vacunas Covid-19” presentó este jueves los resultados del seguimiento a los 2.300 voluntarios que participaron en Chile del estudio en ...,15-07-2021 21:57,https://www.bing.com/th?id=OVFT.Z_ZKKnuXS11zTTcYusScei,Chile,La Nación
Estudio Sinovac en Chile: no se registraron fallecidos en vacunados por estudio clínico,https://redgol.cl/tendencias/Estudio-Sinovac-en-Chile-no-se-registraron-fallecidos-vacunados-en-estudio-clinico-20210715-0103.html,"Este es el alentador resultado de la investigación sobre la eficacia de la vacuna más utilizada en Chile y eso no es todo, además, de las 45 personas que se contagiaron, solo tres (0,088%) requirieron",15-07-2021 22:00,https://www.bing.com/th?id=OVFT.fJYElQHQWwGKZ5-MF9hOay,Chile,redgol
“Marcha por los niños” llega a La Moneda: Familias de menores asesinados exigen justicia,https://www.chilevision.cl/contigo-en-directo/mejores-momentos/marcha-por-los-ninos-llega-a-la-moneda-familias-de-menores-asesinados,Los padres de niños que han fallecido en circunstancias violentas se reunieron en Plaza Baquedano y marcharon hasta La Moneda para entregar una carta al presidente. Las madres de Tomás Bravo y Tamara,15-07-2021 22:01,https://www.bing.com/th?id=OVFT.Fub-64_PCA7xhbczwVSN0C,Chile,chilevision.cl
Pymes piden al Gobierno “reaccionar” por las 33 semanas de continua alza del combustible,http://www.lanacion.cl/pymes-piden-al-gobierno-reaccionar-por-las-33-semanas-de-continua-alza-del-combustible/,"Héctor Sandoval, presidente del Consejo Nacional de la Micro, Pequeña y Mediana Empresa de Chile, manifestó: ""No podemos continuar con esta inacción por parte de quienes tienen que tomar medidas al re",15-07-2021 22:02,https://www.bing.com/th?id=OVFT.NwHe1FRM0_PYJhblAbg3kS,Chile,La Nación
Para los desconfiados: estudio PUC a Sinovac muestra que en seis meses no se registran fallecidos por covid,https://www.publimetro.cl/cl/noticias/2021/07/15/estudio-puc-a-vacuna-sinovac-en-seis-meses-no-se-registran-fallecidos-por-covid.html,"El seguimiento a 2.300 voluntarios en Chile en fase 3 de la vacuna contra el covid-19, Sinovac, mostraron alentadores resultados.",15-07-2021 22:07,https://www.bing.com/th?id=OVFT.Pmk3Jh8Fk1o5cVPvIAivrC,Chile,publimetro.cl
A no cantar victoria: informe ICOVID advierte por sobrecarga en camas UCI pese a disminución de nuevos casos de coronavirus,https://www.elmostrador.cl/noticias/pais/2021/07/15/a-no-cantar-victoria-informe-icovid-revela-sobrecarga-en-camas-uci-pese-a-disminucion-de-nuevos-casos-de-coronavirus/,"De acuerdo al nuevo informe ICOVID, el número de nuevos contagios por Covid-19 sigue a la baja y se observa una disminución significativa en 14 de las 16 regiones del país, exceptuando Atacama y Aysén",15-07-2021 22:29,https://www.bing.com/th?id=OVFT.mK-g5BGckd8pOlLAHN_7Wi,Chile,El Mostrador
Adulto mayor en riesgo vital: Fue baleado en la cabeza tras encerrona en Vitacura,https://www.chilevision.cl/contigo-en-directo/mejores-momentos/adulto-mayor-en-riesgo-vital-fue-baleado-en-la-cabeza-tras-encerrona-en,El hombre de 66 años fue abordado por delincuentes cerca de las 11 de la mañana. Policía realiza un intenso operativo para dar con los autores de los disparos.,15-07-2021 22:54,https://www.bing.com/th?id=OVFT.SHImjmMzrrB4easLDsnSBi,Chile,chilevision.cl
Brote de Covid-19 afecta a funcionarios del Hospital de Panguipulli: hay ocho contagiados,https://www.puranoticia.cl/noticias/regiones/brote-de-covid-19-afecta-a-funcionarios-del-hospital-de-panguipulli-hay/2021-07-15/182449.html,"Producto de la situación, el recinto asistencial detalló que el servicio de Pediatría estará momentáneamente cerrado y que Medicina Hombres, Maternidad, Movilización y Rayos se encuentran a la mitad d",15-07-2021 22:56,https://www.bing.com/th?id=OVFT.lS2xBbKJatex4f32jVVruC,Chile,Puranoticia.cl
Eficaz contra la variante Delta: Estudio chileno determinó la efectividad de la vacuna Sinovac,https://www.meganoticias.cl/calidad-de-vida/344119-eficacia-sinovac-contagios-variante-delta-15-06-2021.html,"Revisa los alentadores resultados que entregó el estudio clínico en fase 3 liderado por la Universidad Católica, sobre la eficacia de la vacuna del laboratorio Sinovac, contra el coronavirus",15-07-2021 23:00,https://www.bing.com/th?id=OVFT.5LsmdeoSutBZw5pK6BZnIy,Chile,meganoticias
Estudio de la vacuna Sinovac contra el Covid-19 en Chile recomienda una tercera dosis,https://www.elperiodista.cl/2021/07/estudio-de-la-vacuna-sinovac-contra-el-covid-19-en-chile-recomienda-una-tercera-dosis/,"Un estudio de la vacuna Sinovac (China) contra el Covid-19 realizado en nuestro país reveló que es necesario implementar una tercera dosis en el ciclo de vacunación, debido a que los anticuerpos dismi",15-07-2021 23:12,https://www.bing.com/th?id=OVFT.h6oXw2EnL6h9Y3UWu8FSmS,Chile,El Periodista
Minsal informa que fueron adquiridos test PCR que permiten detectar la presencia de variante Delta al momento de ser aplicados,https://www.latercera.com/nacional/noticia/minsal-informa-que-fueron-adquiridos-test-pcr-que-permiten-detectar-la-presencia-de-variante-delta-al-momento-de-ser-aplicados/7QDVX42JLZARLFMT7A7BRHTBUU/,"La subsecretaria Paula Daza indicó que la aplicación de los PCR de variantes comenzarán a utilizarse la próxima semana en las regiones que tienen alto flujo de personas como en Arica, Tarapacá, Magall",15-07-2021 23:25,https://www.bing.com/th?id=OVFT.WqWGps_ZiAA1057J-DoNKC,Chile,LA TERCERA
Advierten alta incidencia y sobrecarga en UCI pese a sostenida disminución de casos nuevos de Covid-19,http://www.ladiscusion.cl/advierten-alta-incidencia-y-sobrecarga-en-uci-pese-a-sostenida-disminucion-de/,"El equipo ICOVID Chile, iniciativa liderada por la Universidad de Chile, la Pontificia Universidad Católica de Chile y la Universidad de Concepción, presentó su informe número 49 con análisis y",15-07-2021 23:25,https://www.bing.com/th?id=OVFT.wiasNTL_2EdrOIEW9ISTNi,Chile,La Discusión
Estudio UC: Ningún vacunado con Sinovac ha fallecido por coronavirus en 6 meses,https://www.elciudadano.com/chile/estudio-uc-ningun-vacunado-con-sinovac-ha-fallecido-por-coronavirus-en-6-meses/07/15/,"Este jueves, un equipo liderado por la Pontificia Universidad Católica e integrado por el “Consorcio Científico para Evaluar Vacunas Covid-19” presentó",15-07-2021 23:40,https://www.bing.com/th?id=OVFT.ivJ4uyEn3AKY--cIdZKJ5C,Chile,El Ciudadano
5 aspectos clave de esta semana constituyente,https://www.uchile.cl/noticias/178087/5-aspectos-clave-de-esta-semana-constituyente,UChile.online. UChile Constituyente 5 aspectos clave de esta semana constituyente. Esta semana la Convención Constitucional tomó importantes definiciones en torno a su funcionam,16-07-2021 01:08,https://www.bing.com/th?id=OVFT.KtxiQUgpwv6kq87nkGNB1i,Chile,uchile.cl
"Informe iCovid advierte que ""pese a sostenida disminución de casos covid-19"" la carga UCI ""sigue siendo alta""",https://www.emol.com/noticias/Nacional/2021/07/15/1026938/informe-icovid-chile-15-julio.html,"Según el nuevo reporte, a nivel nacional se observa una disminución significativa en el número de contagios: 14 de las 16 regiones del país muestran una tendencia a la baja, exceptuando Atacama y Aysé",16-07-2021 01:11,https://www.bing.com/th?id=OVFT.3yoX72EyFepj0hgTwe0a0S,Chile,Emol
ICOVID: Especialistas advierten de alta incidencia y sobrecarga en UCI pese a sostenida baja de casos nuevos,https://www.uchile.cl/noticias/178062/icovid-alta-incidencia-y-sobrecarga-uci-pese-a-baja-de-casos-nuevos,"UChile.online. Nuevo informe ICOVID: Especialistas advierten de alta incidencia y sobrecarga en UCI pese a sostenida baja de casos nuevos. Según el nuevo reporte, a nivel naciona",16-07-2021 01:25,https://www.bing.com/th?id=OVFT.zMid4rVN_1mYVdF7pFT-5y,Chile,uchile.cl
Ejército se despliega a los locales de votación de los comicios de este domingo,https://www.rln.cl/destacado/89100-ejercito-se-despliega-a-los-locales-de-votacion-de-los-comicios-de-este-domingo,"Desde el año 1941 el Ejército de Chile, junto a las otras ramas de las Fuerzas Armadas, está a cargo de la seguridad y orden público al interior de los locales de votación a lo largo de todo el país.",16-07-2021 02:11,https://www.bing.com/th?id=OVFT.TVv-TtG97RGuBvT4f-c4fC,Chile,Radio las Nieves
Estudio UC sobre CoronaVac: respuesta inmune después de seis meses y necesidad de una dosis de refuerzo,https://www.theclinic.cl/2021/07/15/estudio-uc-sobre-coronavac-respuesta-inmune-despues-de-seis-meses-y-necesidad-de-una-dosis-de-refuerzo/,"El Dr. Alexis Kalergis destacó que CoronaVac ""tiene un muy buen perfil de seguridad, sin efectos adversos severos en las personas vacunadas"".",16-07-2021 02:28,https://www.bing.com/th?id=OVFT.t4x6-qaRmUO36gUYEw0Jvy,Chile,Clinic
Los Ríos: balance por covid-19 informa de 7 personas fallecidas y 144 nuevos casos en la región,https://www.biobiochile.cl/noticias/nacional/region-de-los-rios/2021/07/15/los-rios-balance-por-covid-19-informa-de-7-personas-fallecidas-y-144-nuevos-casos-en-la-region.shtml,"Siete nuevos fallecidos por covid-19 tuvo la región de Los Ríos y 144 casos nuevos, según la autoridad sanitaria,",16-07-2021 02:53,https://www.bing.com/th?id=OVFT.9PFcTBqQEs_DrVZUFAY08S,Chile,Chile
Cerebro y corazón: efecto de la salud mental en la cardiaca,https://www.diarioconcepcion.cl/ciencia-y-sociedad/2021/07/16/cerebro-y-corazon-efecto-de-la-salud-mental-en-la-cardiaca.html,"Mente y cuerpo conviven en un mismo organismo, por lo que cuadros o episodios de ansiedad y estrés pueden expresarse como diversos síntomas o somatizaciones. Por ejemplo, aquellos que se encuentran a",16-07-2021 04:07,https://www.bing.com/th?id=OVFT.3gHS5kNdIWPbDNvXlAP_YC,Chile,El Diario de Concepcion
OMS no aconseja de momento una tercera dosis de refuerzo contra covid-19,https://www.biobiochile.cl/noticias/salud-y-bienestar/tratamientos/2021/07/16/oms-no-aconseja-de-momento-una-tercera-dosis-de-refuerzo-contra-covid-19.shtml,La Organización Mundial de la Salud (OMS) pidió el jueves a los países miembros que sean “extremadamente cautos” y,16-07-2021 04:24,https://www.bing.com/th?id=OVFT.6Yt_HnxUX8mz6lV7iS8Iby,Chile,Chile
Once variantes del Covid-19 han sido detectadas en Chile,https://www.elmostrador.cl/agenda-pais/2021/07/16/once-variantes-del-covid-19-han-sido-detectadas-en-chile/,"Aunque en el medio internacional se habla de la reciente la aparición y expansión de la variante Épsilon, ésta ya se encuentra en Chile desde el mes de marzo. Se indicó que la transmisibilidad de Épsi",16-07-2021 04:39,https://www.bing.com/th?id=OVFT.NCkBZvN97O-tEEG2ZQyE9C,Chile,El Mostrador
Estudio de Sinovac en Chile concluye que menos de un 2% de los vacunados desarrolla Covid-19 con síntomas,https://www.df.cl/noticias/empresas/salud/estudio-de-sinovac-en-chile-concluye-que-menos-de-un-2-de-los-vacunados/2021-07-16/012022.html,"Resultados de investigación a vacuna del laboratorio chino arrojó una alta protección contra los casos graves y la muerte, aunque su efecto disminuye con el tiempo y hace necesaria una dosis adicional",16-07-2021 05:33,https://www.bing.com/th?id=OVFT.gDyY_BYr1edmFl2PDFaN2y,Chile,df.cl
