name,url,description,datePublished,imagen,pais,Fuente
Latam suspende indefinidamente sus operaciones en ...,https://www.elperiodista.cl/latam-suspende-indefinidamente-sus-operaciones-en-argentina/,"A través de un comunicado, Latam Airlines Argentina informó que presentó ante el Ministerio de Trabajo, Empleo y Seguridad Social del país un “Procedimiento Preventivo de Crisis (PPC)” para resolver l",18-06-2020 16:50,https://www.bing.com/th?id=ON.42CCC7C65094D914F8904A23DFE45AAC,Chile,El Periodista
Más de 4 mil muertos en Chile por Covid-19 | El Periodista ...,https://www.elperiodista.cl/mas-de-4-mil-muertos-en-chile-por-covid-19/,"Ayer en el Registro Civil, de acuerdo a lo informado por el subsecretario Arturo Zúñiga, se inscribieron 252 fallecimientos. El número de muertes de personas asociados con la enfermedad alcanza a 4.09",19-06-2020 18:04,https://www.bing.com/th?id=ON.0D9FA5729F1DA82AA719BE30FDC99DF4,Chile,El Periodista
Director de la PDI: “Hay muchos sectores que tienen una ...,https://www.latercera.com/la-tercera-pm/noticia/director-de-la-pdi-hay-muchos-sectores-que-tienen-una-deuda-con-el-pais-de-no-haber-condenado-la-violencia/O3KWQY6XC5G2BFEE4Z4LEQPTNU/,"La investigación por narcotráfico que involucra al presunto activista de la CAM Emilio Berkhoff, la causa por la supuesta corrupción en las licitaciones de luminarias en diversos municipios del país,",19-06-2020 18:06,https://www.bing.com/th?id=ON.23857ED16029955EDD7CF619A60C22C6,Chile,LA TERCERA
Chile: Alcaldes de Asociación de Farmacias Populares ...,https://www.elciudadano.com/salud/chile-alcaldes-de-asociacion-de-farmacias-populares-anunciaron-que-produciran-medicamento-para-el-coronavirus/06/19/,Una esperanzadora noticia anunciaron ayer seis alcaldes pertenecientes a la Asociación Chilena de Farmacias Populares (Achifarp). Se trataría de la fabricación de un medicamento para combatir el Coron,19-06-2020 18:07,https://www.bing.com/th?id=ON.AF559FE4B87D6BC42C908EA428E58B5B,Chile,El Ciudadano
Senado vota el aumento del Ingreso Familiar de Emergencia ...,https://www.cooperativa.cl/noticias/sociedad/salud/coronavirus/senado-vota-el-aumento-del-ingreso-familiar-de-emergencia/2020-06-19/135930.html,"La iniciativa eleva a 100 mil pesos el monto por integrante del hogar. Desde la oposición sostienen que se está llegando tarde, mientras que desde el oficialismo dicen que todos se equivocaron al esti",19-06-2020 18:21,https://www.bing.com/th?id=ON.1806CA2185B5B00168576BF299DC1E40,Chile,Radio Cooperativa
Coronavirus sigue expandiéndose y la OMS advierte que “el ...,https://www.elmostrador.cl/noticias/mundo/2020/06/19/coronavirus-sigue-expandiendose-y-la-oms-advierte-que-el-mundo-esta-en-una-nueva-y-peligrosa-fase/,"""Casi la mitad de esos casos se reportaron en América, con elevados números también en el sur de Asia y Oriente Medio"", señaló el experto etíope, quien alertó de que ""el virus sigue expandiéndose rápi",19-06-2020 18:26,https://www.bing.com/th?id=ON.72FEF048C6FC71DAF5423E7796544C76,Chile,El Mostrador
Estas son las cinco tendencias turísticas post coronavirus,https://www.diarioconcepcion.cl/economia/2020/06/19/estas-son-las-cinco-tendencias-turisticas-post-coronavirus.html,"La pandemia del coronavirus ha llegado a cambiar el mundo en todo sentido. Muchas industrias se han visto afectadas ya sea directa o indirectamente, y el turismo ha sido de los rubros más damnificados",19-06-2020 18:27,https://www.bing.com/th?id=ON.BBB1520D82BFC394FD6C320B136BEE46,Chile,El Diario de Concepcion
"Campaña ""La humanidad somos todes"" lanza iniciativa de ...",https://www.uchile.cl/noticias/164452/lanzan-mapeo-de-redes-de-apoyo-migrante-y-pro-migrante,"Conocer, contactar y difundir las distintas redes que se despliegan a nivel nacional y local sin distinciones ni discriminaciones, para promover las instancias de apoyo que ya se están dando en todos",19-06-2020 18:31,https://www.bing.com/th?id=ON.57BC1B8B4A675933D4FA0D0B444511E3,Chile,uchile.cl
Otra crisis en Salud: falta de probidad en arriendo de ...,https://www.biobiochile.cl/especial/reportajes/2020/06/19/otra-crisis-salud-falta-probidad-arriendo-hoteles-provoca-salida-funcionarios.shtml,"Las irregularidades en la contratación de Residencias Sanitarias abrió un nuevo flanco en el Ministerio de Salud que ha salpicado a varios y que obligó al recién asumido Enrique Paris, a remitir los antecedentes a la Fiscalía Centro Norte por la comisión de eventuales delitos de fraude al",19-06-2020 18:32,https://www.bing.com/th?id=ON.8FE106F7DDEA80193813C28E2EE9717C,Chile,Chile
Tratamiento con plasma en covid-19 gana respaldo en Chile ...,https://www.emol.com/noticias/Nacional/2020/06/19/989626/Plasma-pacientes-covid19-apoyo-Minsal.html,"Tratamiento con plasma en covid-19 gana respaldo en Chile tras cambio de ministro en Salud A diferencia del ex ministro Jaime Mañalich, que lo calificó como ""extraordinariamente riesgoso"", este viernes Enrique Paris avaló la respuesta entregada por especialista en el tema, quien sostuvo que se trata de ""una terapia segura” y ""positiva"".",19-06-2020 18:31,https://www.bing.com/th?id=ON.086CEE8CA33E490086CCC15D938D334F,Chile,Emol
Rector de la UC descarta que manejo y comunicación de ...,https://www.df.cl/noticias/df-lab/transformacion-digital/rector-de-la-uc-descarta-que-manejo-y-comunicacion-de-datos-del-covid-19/2020-06-19/134421.html,"En el marco del aniversario 132 de la Pontificia Universidad Católica y a través de una conferencia de prensa, el rector de esa casa de estudios, Ignacio Sánchez, que participa de la Mesa Social Covid",19-06-2020 18:35,https://www.bing.com/th?id=ON.6E002C7A61249349E78E2E380CB8380B,Chile,df.cl
Instalan morgue de emergencia en Cesfam de La Granja | Tele 13,https://www.t13.cl/noticia/nacional/coronavirus-instalan-morgue-emergencia-cesfam-granja-19-06-2020,"Debido a la pandemia del coronavirus, los distintos centros de salud han tenido que adaptarse al gran incremento de atenciones. En ese escenario, Walter Masías, director consultorio de La Granja, info",19-06-2020 18:45,https://www.bing.com/th?id=ON.4E68B847FF4018C898A88DD02D838AA0,Chile,T13
Daniel Jadue anunció producción de fármaco contra el Covid-19,https://www.lacuarta.com/cronica/noticia/daniel-jadue-anuncio-produccion/512692/,"""En muy poco tiempo podríamos estar produciendo cantidades bastante importantes"", afirmó el alcalde de Recoleta. El alcalde de Recoleta, Daniel Jadue, anunció que seis alcaldes pertenecientes a la Aso",19-06-2020 18:50,https://www.bing.com/th?id=ON.89CF48587C2F8BCB840ECC7E36989BA9,Chile,La Cuarta
"Ministro Paris: ""Ninguna medida del Gobierno avala teoría ...",https://www.theclinic.cl/2020/06/19/ministro-paris-ninguna-medida-del-gobierno-avala-teoria-de-que-se-implemento-el-efecto-rebano/,"El ministro de Salud, Enrique Paris, aseguró este viernes que ninguna medida adoptada por el gobierno frente a la pandemia avala la teoría de algunos en cuanto a que el gobierno aplicó la inmunidad de",19-06-2020 18:50,https://www.bing.com/th?id=ON.443038B8E482C8F2F590084B2F31587C,Chile,Clinic
"Plasma: Inmunólogo califica como ""seguro"" el tratamiento ...",https://www.meganoticias.cl/nacional/305307-coronavirus-tratamiento-con-plasma-convaleciente-inmunologo-larrondo-manalich-ministerio-salud.html,"Este viernes, el inmunólogo Milton Larrondo fue convocado por el ministerio de Salud para participar del balance diario que se realiza en torno a la emergencia sanitaria por coronavirus en el país y q",19-06-2020 18:54,https://www.bing.com/th?id=ON.6ADD87DE6E0499776498C98B375C21CD,Chile,meganoticias
Medir movilidad por celulares: riesgos y experiencias ...,https://www.t13.cl/noticia/nacional/medir-movilidad-cuarentena-celulares-app-riesgos-experiencia-mundial-19-06-20,"¿Cómo frenar la pandemia del coronavirus en Chile, que ya supera los 225 mil casos y se encuentra próxima a llegar a 4 mil fallecidos? A más de 100 días del primer caso en el país, esta pregunta sigue",19-06-2020 19:03,https://www.bing.com/th?id=ON.57526AF91116CA5F119ADD2057F86ACD,Chile,T13
Senador Pugh tras éxito de la cuarentena en... | Puranoticia,https://www.puranoticia.cl/noticias/regiones/senador-pugh-tras-exito-de-la-cuarentena-en-valparaiso-y-vina-se-que/2020-06-19/150143.html,"El parlamentario por la región de Valparaíso subrayó que ""la única forma de detener la enfermedad del Covid-19 es quedándonos en casa"". El ministro de Salud, Enrique Paris, anunció las nuevas comunas",19-06-2020 19:04,https://www.bing.com/th?id=ON.58371BFDE7FB2EE200E6A63BF4B08428,Chile,Puranoticia.cl
Ministro Paris anuncia instalación de recinto modular en ...,https://www.latercera.com/nacional/noticia/ministro-paris-anuncia-instalacion-de-recinto-modular-en-hospital-san-jose-sera-donado-por-desafio-levantemos-chile/ZY62HZMS5RBKFNN66CQ52EKW44/,"El ministro de Salud, Enrique Paris, anunció este miércoles que en los próximos diez días se instalará un recinto modular en el Hospital San José con el objetivo de reemplazar la carpa en la que actua",19-06-2020 19:21,https://www.bing.com/th?id=ON.4FBA9311233BC6A3EC7819DC0590B106,Chile,LA TERCERA
"Estonia, país digital: lo que Chile puede aprender ...",https://www.df.cl/noticias/opinion/columnistas/estonia-pais-digital-lo-que-chile-puede-aprender/2020-06-18/184514.html,"Durante su visita a Chile en enero pasado, la Presidenta de Estonia, Kersti Kaljulaid, suscribió acuerdos de cooperación en ciberseguridad y gobierno electrónico con el Presidente Sebastián Piñera. Lu",19-06-2020 19:22,https://www.bing.com/th?id=ON.CE00B91A7B2154706BEDC2193E616172,Chile,df.cl
Los Lagos: Industria láctea recibió 347 litros entre enero ...,http://www.elvacanudo.cl/noticia/economia/los-lagos-industria-lactea-recibio-347-litros-entre-enero-y-abril-del-2020,"Entre enero y abril de este año, la industria láctea de la región de Los lagos recepcionó 437 litros de Chile, que corresponde a 4,3% más que en el mismo periodo del 2019, según el último boletín elab",19-06-2020 19:24,https://www.bing.com/th?id=ON.EEE9CA1D656D3B402E962192FD14005A,Chile,El Vacanudo
Estos son los cerros de Valparaíso que estudio identifica ...,http://www.elmartutino.cl/noticia/sociedad/estos-son-los-cerros-de-valparaiso-que-estudio-identifica-como-zonas-de-alto-riesgo,"La parte alta de Playa Ancha y de los cerros Esperanza y Cordillera, son las zonas de la comuna de Valparaíso que presentan mayores factores de riesgo que favorecerían la propagación del COVID-19, ade",19-06-2020 19:23,https://www.bing.com/th?id=ON.73C1FC83F5BA95BD706CA5507950667B,Chile,Mar
Alcalde Daniel Jadue se querelló contra el Presidente ...,https://www.radioagricultura.cl/politica/2020/06/19/alcalde-daniel-jadue-se-querello-contra-el-presidente-sebastian-pinera.html,"El alcalde de Recoleta, Daniel Jadue, presentó este viernes una querella contra el Presidente Sebastián Piñera, el ex ministro de Salud, Jaime Mañalich, y los subsecretarios de Salud Pública y Redes A",19-06-2020 19:30,https://www.bing.com/th?id=ON.F3277A4F0E94594CF7B79FC232D299BA,Chile,Radio Agricultura
6.290 casos nuevos elevan cifra total de... | Puranoticia,https://www.puranoticia.cl/noticias/nacional/6-290-casos-nuevos-elevan-cifra-total-de-contagiados-a-231-393-personas/2020-06-19/111259.html,"6.290 son los casos nuevos diagnosticados con coronavirus Covid-19 en Chile, con lo que la cifra total de contagiados asciende a 231.393 personas con la enfermedad pulmonar calificada como pandemia. D",19-06-2020 19:38,https://www.bing.com/th?id=ON.C67FBC75122D33F3C919E9B5D3E888B4,Chile,Puranoticia.cl
Minsal señaló que habrá un cambio en su reporte sobre las ...,https://www.elperiscopio.cl/destacado-1/minsal-senalo-que-habra-un-cambio-en-su-reporte-sobre-las-muertes-este-sabado/,"En la entrega del reporte diario de hoy, el jefe de Epidemiología del Ministerio de Salud, Rafael Araos, anunció que desde el sábado se integrará al informe datos nuevos acerca de los fallecidos con c",19-06-2020 19:41,https://www.bing.com/th?id=ON.2D28911C5174FC04174342BAC8E6BCC5,Chile,elperiscopio.cl
OvejeroNoticias El fantasma de la letra chica y los datos ...,https://www.ovejeronoticias.cl/2020/06/el-fantasma-de-la-letra-chica-y-los-datos-que-no-son-jose-ruiz-santana-opiniones/,"La letra chica, letra pequeña, letra menuda o letra hormiga es el término que describe los términos de un contrato impreso con un tamaño de letra reducido, de tal manera que no se pueda leer fácilmente por la otra parte. Esta letra chica se emplea, a veces, para ocultar cláusulas abusivas o",19-06-2020 19:42,https://www.bing.com/th?id=ON.7F6982BEFEAA7BC686F12548574ADC6C,Chile,Ovejero Noticias
OvejeroNoticias Gobierno anuncia nuevas medidas ...,https://www.ovejeronoticias.cl/2020/06/gobierno-anuncia-nuevas-medidas-restrictivas-y-cuarentenas-para-el-control-de-la-pandemia/,"Hasta cinco de años cárcel arriesgarán aquellas personas que infrinjan las medidas sanitarias establecidas por la autoridad. – Ingresan a cuarentena las comunas de San Felipe y Los Andes, en la región",19-06-2020 19:42,https://www.bing.com/th?id=ON.3F6804758FC635F075AA42949459D326,Chile,Ovejero Noticias
Sólo dos Permisos Temporales por persona a la semana ...,https://www.meganoticias.cl/nacional/305316-permisos-temporales-individuales-instructivo-gobierno-comisaria-virtual-como-sacar-duracion.html,"El Gobierno, en medio de su plan de acción en el combate al coronavirus,entregó una actualización de los detalles y cómo se deben utilizar los Permisos Temporales Individuales de traslado en medio de",19-06-2020 19:43,https://www.bing.com/th?id=ON.C7ADA3CB99A2ED0CE02244B13D7D7437,Chile,meganoticias
Red de Politólogas hace propuestas para un plebiscito seguro,https://www.elciudadano.com/general/red-de-politologas-hace-propuestas-para-un-plebiscito-seguro/06/19/,La red de politólogas sacó un comunicado en el que expresan su preocupación por el proceso democrático constituyente que se avecina este 25 de octubre. Estas propuestas se dan en un contexto de esfuer,19-06-2020 19:55,https://www.bing.com/th?id=ON.72C164A72673991B75FF45FAFB0179AC,Chile,El Ciudadano
Dr. Ugarte llama a no confiarse y advierte sobre una ...,http://www.elquehaydecierto.cl/noticia/coronavirus/dr-ugarte-llama-no-confiarse-y-advierte-sobre-una-posible-segunda-ola-de-contagi,"Uno de los rostros más reconocidos hoy en día en la medicina de Chile es sin dudas el dr. Sebastián Ugarte, quien ha pasado por práxticamente todos los matinales como experto para hablar sobre el Covi",19-06-2020 19:57,https://www.bing.com/th?id=ON.D7CFC8793F4C88ACF775D67F35A16C2F,Chile,El Quehay Decierto
Las cuarentenas han disminuido las enfermedades ...,https://www.elmostrador.cl/agenda-pais/2020/06/19/las-cuarentenas-han-disminuido-las-enfermedades-respiratorias-en-ninos/,"La temporada de invierno 2020 será un periodo en que a las enfermedades respiratorias más comunes en niños, se sumará la presencia del nuevo coronavirus, razón por la cual es importante aprender a dis",19-06-2020 20:01,https://www.bing.com/th?id=ON.DBFCBFBCCB93029C7970997EF0A7CEC2,Chile,El Mostrador
Senado aprobó el aumento del Ingreso Familiar de ...,https://www.cooperativa.cl/noticias/sociedad/salud/coronavirus/senado-aprobo-el-aumento-del-ingreso-familiar-de-emergencia/2020-06-19/135930.html,"La iniciativa eleva a 100 mil pesos el monto por integrante del hogar. Desde la oposición sostienen que se está llegando tarde, mientras que desde el oficialismo dicen que todos se equivocaron al esti",19-06-2020 20:15,https://www.bing.com/th?id=ON.1806CA2185B5B00168576BF299DC1E40,Chile,Radio Cooperativa
Ministro de Salud: “Medidas que tomó el Gobierno son ...,http://www.lanacion.cl/ministro-de-salud-medidas-que-tomo-el-gobierno-son-incompatibles-con-inmunidad-de-rebano/,"El ministro de Salud, Enrique Paris, entró de lleno al debate sobre la supuesta promoción de una estrategia de rebaño durante la emergencia por el Covid-19 y señaló que “todas las medidas que tomó el",19-06-2020 20:21,https://www.bing.com/th?id=ON.6FBF899DA9D5BB2E0B333D293ADED894,Chile,La Nación
“Somos una policía profesional que está al lado de la ...,https://new.diariolaprensa.cl/index.php/2020/06/19/somos-una-policia-profesional-que-esta-al-lado-de-la-gente/,"Jefe regional de la PDI, prefecto inspector Juan Vergara. En este nuevo aniversario de la institución, cuando cumplen 87 años, la autoridad reforzó el llamado a la comunidad a seguir cuidándose en med",19-06-2020 20:23,https://www.bing.com/th?id=ON.85CE52DE630B2228DED89EF16AF97EC8,Chile,La Prensa
OMS alerta que el mundo entró en una “fase peligrosa” tras ...,https://new.diariolaprensa.cl/index.php/2020/06/19/oms-alerta-que-el-mundo-entro-en-una-fase-peligrosa-tras-desconfinamiento-en-muchos-paises/,"El mundo entró en una “fase peligrosa” de la pandemia del Coronavirus con el desconfinamiento, alertó este viernes la Organización Mundial de la Salud (OMS), ante un virus que sigue circulando a gran",19-06-2020 20:23,https://www.bing.com/th?id=ON.F5752FF3A52359A31201DB62AC819498,Chile,La Prensa
H. de Melipilla abre sumario por denuncia a médico ...,https://www.biobiochile.cl/noticias/nacional/region-metropolitana/2020/06/19/h-melipilla-abre-sumario-denuncia-medico-director-s-aseguro-fue-hecho-puntual.shtml,"El Hospital San José de Melipilla anunció que instruyeron la realización un sumario administrativo en contra de uno de sus médicos, a raíz de una denuncia realizada por tres funcionarios de la 24° Com",19-06-2020 20:36,https://www.bing.com/th?id=ON.7AB44924D5C5A33DA3BE1C9942FF17CA,Chile,Chile
U. de Chile es parte de encuentro virtual para desarrollar ...,https://www.uchile.cl/noticias/164471/convocan-a-encuentro-virtual-de-48-hrs-para-soluciones-contra-covid19,"Entre el 19 y el 21 de junio, los equipos abordarán problemas clave que han surgido durante la pandemia para generar iniciativas que incluyan pruebas de conceptos, prototipos y una visión preliminar p",19-06-2020 20:40,https://www.bing.com/th?id=ON.B1831CB1A8BF88FED885AC4E33D9DF2B,Chile,uchile.cl
Ministro Paris abordó la crisis con Izkia Siches – La ...,http://www.ladiscusion.cl/ministro-paris-abordo-la-crisis-con-izkia-siches/,"El ministro de Salud, Enrique Paris, se reunió con la mesa directiva del Colegio Médico, presidida por Izkia Siches, donde abordó las líneas de trabajo para el manejo del Covid-19 en el país. Según lo",19-06-2020 20:51,https://www.bing.com/th?id=ON.64AEC80DA7848E3C85FFB529C9FE12FA,Chile,La Discusión
Funcionarios/as hospitalarios aludidos por la Seremi ...,http://www.eldivisadero.cl/noticia-57413,"Coyhaique-. Con molestia reaccionaron los funcionarios Tens, técnicos paramédicos, auxiliares enfermeros y enfermeras del Servicio de Medicina del Hospital Regional Coyhaique, frente a las palabras de",19-06-2020 20:58,https://www.bing.com/th?id=ON.F67D14D299E2215EF4800CD4F65DF021,Chile,Diario el Divisadero
Revolución Democrática denunció a fiscalía eventual ...,http://www.ladiscusion.cl/revolucion-democratica-denuncio-a-fiscalia-eventual-malversacion-de-fondos/,"Los representantes locales de Revolución Democrática, José Ignacio Marín y Álvaro Valencia, junto al diputado del partido, Pablo Vidal, presentaron ayer una denuncia a Fiscalía por eventual malversaci",19-06-2020 21:02,https://www.bing.com/th?id=ON.892FD84EDBEDBB93D45CD9239FE385C6,Chile,La Discusión
