name,url,description,datePublished,imagen,pais,Fuente
Sin recursos y pernoctando en la calle: La compleja ...,https://www.emol.com/noticias/Nacional/2020/04/17/983361/Peruanos-Bolivianos-Coronavirus.html,"Sin recursos y pernoctando en la calle: La compleja situación de peruanos y bolivianos que quedaron varados en el norte de Chile Esta semana, las regiones de Arica y Parinacota, Tarapacá y Antofagasta registraron un progresivo aumento de personas que buscan regresar a sus países, los cuales mantienen cerradas sus fronteras.",17-04-2020 19:53,https://www.bing.com/th?id=ON.823A38FDF439080F964F647A4F160AAD,Chile,Emol
La otra pandemia: Google descubre a diario 18 millones de ...,https://www.latercera.com/que-pasa/noticia/la-otra-pandemia-google-descubre-a-diario-18-millones-de-correos-fraudulentos-relacionados-al-coronavirus/ZKXMBBXLGNBRNBX7R5F2HDTOP4/,"Aunque la pandemia de coronavirus continúa su camino y en el mundo hay 2,2 millones de infectados y más de 150 mil muertos, en internet se vive una realidad paralela, donde los ciberdelincuentes se aprovechan del pánico planetario para hacer caer a los usuarios por el mayor número de vías",17-04-2020 19:59,https://www.bing.com/th?id=ON.96D8F8D3C8A2EAE13BF991C12055D945,Chile,LA TERCERA
Latam extiende reducción del 95% de su operación de ...,https://www.df.cl/noticias/empresas/industria/latam-extiende-reduccio-n-del-95-de-su-operacio-n-de-pasajeros-para-mayo/2020-04-17/125158.html,"Debido a las restricciones de viaje y la caída histórica de la demanda producto del Covid-19, Latam Airlines y sus filiales anunciaron que mantendrán la reducción de su operación de pasajeros en un 95% durante mayo de 2020. ""A un mes y medio desde que diversos actores de la industria alertamos",17-04-2020 20:01,https://www.bing.com/th?id=ON.A1885AE6925B025FACF7AEB239AB5E3E,Chile,df.cl
5 consejos para las Pymes en tiempos de cuarentena – Mundo ...,https://mundoenlinea.cl/2020/04/17/5-consejos-para-las-pymes-en-tiempos-de-cuarentena/,"Las pequeñas y medianas empresas siguen muy golpeadas en Chile. Atravesaron duros meses desde octubre por el estallido social y hoy, la mayoría, se encuentra imposibilitada de seguir trabajando “en terreno”, debido al llamado de las autoridades a hacer cuarentena ante la rápida propagación del Covid-19, virus que ha arrasado en todo el ...",17-04-2020 20:04,https://www.bing.com/th?id=ON.8EFB389313ACC7E679726CCA2D165623,Chile,Mundo en línea
Chile supera los 9 mil contagios por Covid-19 y repite ...,https://www.biobiochile.cl/noticias/nacional/chile/2020/04/17/chile-supera-los-9-mil-contagios-por-covid-19-y-repite-maximo-diario-con-11-nuevos-fallecidos.shtml,"El Ministerio de Salud (Minsal) informó la mañana de este viernes que se reportaron 445 nuevos casos de Covid-19 (coronavirus), con lo que el total nacional llega a los 9.252 contagios. Según el reporte entregado desde La Moneda, Chile repitió el máximo diario de 11 fallecidos. Tres personas",17-04-2020 20:03,https://www.bing.com/th?id=ON.0A75836F0E4208948A41D50DED39D0D7,Chile,Chile
A raíz del Covid-19: el inquietante mensaje de Piñera ...,https://www.lacuarta.com/cronica/noticia/mensaje-pinera-coronavirus/484815/,"El mandatario dio un discurso en La Moneda donde anunció el pago de ""Bono COVID-19"". Durante este mediodía, el Presidente Sebastián Piñera anunció el pago del «Bono COVID-19», que comenzará a beneficiar a partir de este viernes a cerca de 2,7 millones de personas. Beneficiando a 1,5 millones",17-04-2020 20:05,https://www.bing.com/th?id=ON.815B1AAD848C2E29613629FB27E8D528,Chile,La Cuarta
Universidad de Chile anuncia reducción temporal de los ...,https://www.elmostrador.cl/dia/2020/04/17/universidad-de-chile-anuncia-reduccion-temporal-de-los-sueldos-mas-altos-del-equipo/,"El club Universidad de Chile anunció este viernes de manera oficial que llevará a cabo una una reducción temporal de las remuneraciones más altas de la institución, las que serán devueltas en su totalidad en un plazo definido por mutuo acuerdo. ""La decisión fue tomada en una reunión en la",17-04-2020 20:10,https://www.bing.com/th?id=ON.1E16F4CD42157473A7A8AD0C388AE39A,Chile,El Mostrador
Minsal informa que cifra de fallecidos por coronavirus ...,https://www.latercera.com/que-pasa/noticia/minsal-informa-que-cifra-de-fallecidos-por-coronavirus-asciende-nuevamente-a-11-personas-la-mas-alta-desde-el-comienzo-de-la-pandemia-en-el-pais/7F2YK7VREBFKXOWO2GR7R6CTGM/,"Esta mañana, la subsecretaria de Salud Pública, Paula Daza, dio a conocer como cada mañana el balance de los contagiados en el país de Covid-19. Sobre esto, la autoridad indicó que con corte a las 21.00 horas de ayer, en las últimas 24 horas se registraron 445 nuevas personas confirmadas por",17-04-2020 20:18,https://www.bing.com/th?id=ON.D227959D848136AD019179B6A901BB34,Chile,LA TERCERA
Experto en salud mental y situación en Chile: “Tendemos a ...,https://www.adnradio.cl/nacional/2020/04/17/experto-en-salud-mental-y-situacion-en-chile-tendemos-a-pensar-que-es-mas-bien-un-costo-que-una-inversion.html,"La salud mental como consecuencia del encierro y cuarentena por coronavirus Covid-19 sumado a la crisis económica, podría ser un problema que no se está tratando en Chile. Respecto de esto, el psiquiatra Alberto Larraín, conversó con ADN Hoy sobre esta situación. Sobre las principales",17-04-2020 20:22,https://www.bing.com/th?id=ON.C2B18053B2990C4742FC633A97AA7D45,Chile,ADN
La Universidad de Chile bajará los sueldos más abultados ...,https://www.prensafutbol.cl/352257-la-universidad-de-chile-bajara-los-sueldos-mas-abultados-del-club/,"La Universidad de Chile bajará los sueldos más abultados del club “La decisión fue tomada en una reunión en la que reinó la unidad y el compromiso con el club y responde al difícil escenario económico que atraviesa la industria debido a la paralización de la actividad desde marzo por el COVID-19, generando esto un significativo ...",17-04-2020 20:48,https://www.bing.com/th?id=ON.C1ED36D32A09403C7899C6E2592275BA,Chile,Prensafútbol
Coronavirus: el agro está bien preparado para enfrentar la ...,https://www.elrancaguino.cl/2020/04/17/coronavirus-el-agro-esta-bien-preparado-para-enfrentar-la-crisis/,"Antonio Walker Ministro de Agricultura Estamos viviendo un año radicalmente distinto al que esperábamos. La crisis sanitaria que se ha generado a nivel global, por el virus COVID-19, llegó a nuestro país. Este virus sorprende con la amenaza de un cambio radical a la vida de las personas, debemos quedarnos en casa […]",17-04-2020 21:03,https://www.bing.com/th?id=ON.B9B0329C2304E114E2C04B9F93CA04CB,Chile,elrancaguino.cl
Presidente y manual Covid-19 para el comercio: “Queremos ...,http://lanacion.cl/2020/04/17/presidente-y-manual-covid-19-para-el-comercio-queremos-una-reapertura-gradual-y-segura/,"Presidente y manual Covid-19 para el comercio: “Queremos una reapertura gradual y segura” El Mandatario recalcó que este instructivo publicado por el Ministerio de Economía busca que “pongamos gradualmente en marcha nuestra sociedad, nuestras vidas, nuestras empresas, pero con precauciones y medidas sanitarias mucho más estrictas”.",17-04-2020 21:07,https://www.bing.com/th?id=ON.B76FBFC0B60ADB9561EA6D8795A69980,Chile,La Nación
Las tecnologías que emplean algunas policías para ...,https://www.24horas.cl/coronavirus/las-tecnologias-que-emplean-algunas-policias-para-identificar-sospechosos-de-contagio-de-covid-19-4105740,Las tecnologías que emplean algunas policías para identificar sospechosos de contagio de COVID-19 Avances tecnológicos al servicio de la salud y contra la pandemia. Cascos y cámaras termográficas son empleadas actualmente para detectar a personas contagiadas de coronavirus.,17-04-2020 21:12,https://www.bing.com/th?id=ON.91A4BE094953FC1035126895D724F403,Chile,24 Horas Chile
Pacientes asintomáticos de Covid-19 que se hacen cirugías ...,https://www.biobiochile.cl/noticias/ciencia-y-tecnologia/ciencia/2020/04/17/pacientes-asintomaticos-de-covid-19-que-se-hacen-cirugias-electivas-tendrian-mayor-riesgo-de-muerte.shtml,"Actualmente, Chile presenta más de 6 mil casos de Covid-19 positivos, pero con una de las menores tasas de mortalidad. Los expertos atribuyen estas cifras a la gran cantidad de exámenes que se ejecutan a diario y a las políticas de distanciamiento parcializadas que ha propuesto el Gobierno.",17-04-2020 21:16,https://www.bing.com/th?id=ON.E6D2B97C3BEF3F12AA900B5DE86D7D53,Chile,Chile
Latam descarta haber adquirido nuevo créditos con ...,https://www.publimetro.cl/cl/noticias/2020/04/17/latam-descarta-haber-adquirido-nuevo-creditos-bancoestado.html,"A través de un comunicado, la aerolínea Latam precisó que no ha recibido un crédito de BancoEstado para hacer frente a la crisis derivada de la pandemia de covid-19. El presidente de BancoEstado, Arturo Tagle dijo a CNN Chile, “Latam es cliente del banco y hemos llegado a algunos acuerdos",17-04-2020 21:17,https://www.bing.com/th?id=ON.049CE595A27FE2967994034385AD6484,Chile,publimetro.cl
Subsecretaria Daza por coronavirus: “Aún no tenemos ...,https://www.adnradio.cl/nacional/2020/04/15/subsecretaria-daza-por-coronavirus-aun-no-tenemos-recontagiados-en-chile.html,"Respecto a que una persona no pueda contagiar con COVID-19 tras ser dada de alta aseguró que “aún no tenemos recontagiados en Chile. Certificados. Llevamos muy poco, el virus llegó hace poco más de un mes”, estimando que “pensando en la evidencia científica al momento, y por antecedentes del mismo coronavirus, la inmunidad debiera ...",17-04-2020 21:22,https://www.bing.com/th?id=ON.E37630C50489FE1E3526580065F00033,Chile,ADN
Tras caso positivo de Covid-19 suspenden trayecto de ...,https://www.cooperativa.cl/noticias/sociedad/salud/coronavirus/tras-caso-positivo-de-covid-19-suspenden-trayecto-de-barcaza-crux/2020-04-17/160625.html,Uno de los tripulantes de la embarcación dió positivo por coronavirus lo que obligo al resto de los tripulantes a iniciar su cuarentena. ... Tras caso positivo de Covid-19 suspenden trayecto de barcaza Crux Australis entre Tortel y Puerto Natales. Publicado: ... de Chile por Chile.,17-04-2020 21:27,https://www.bing.com/th?id=ON.B62257FE342109D51ED002799C036DB5,Chile,Radio Cooperativa
"9.252 personas han dado positivo a Covid-19 en Chile, tras ...",https://www.puranoticia.cl/noticias/nacional/9-252-personas-han-dado-positivo-a-covid-19-en-chile-tras-reportarse/2020-04-17/101412.html,"385 personas se encuentran hospitalizadas en Unidades de Cuidados Intensivos, de las cuales 316 están en ventilación mecánica y 97 permanecen en estado crítico. 445 son los casos nuevos diagnosticados con coronavirus Covid-19 en Chile, con lo que la cifra total de contagiados asciende a 9.252",17-04-2020 21:27,https://www.bing.com/th?id=ON.92B4DAAEFD53FA017F60AAD11408D980,Chile,Puranoticia.cl
Chile supera los 100.000 exámenes por covid-19: Conoce las ...,https://www.emol.com/noticias/Nacional/2020/04/17/983372/Examenes-Coronavirus-Chile-Tests-PCR.html,"Chile supera los 100.000 exámenes por covid-19: Conoce las cifras de los testeos realizados en el país De acuerdo al Ministerio de Salud, la capacidad actual de procesamiento es de hasta 8.425 exámenes diarios, aunque el promedio durante abril ha sido poco más de 4.000 resultados cada día.",17-04-2020 21:43,https://www.bing.com/th?id=ON.8DA0A9EA5552C2200299B57F857A0976,Chile,Emol
Latam aclara que créditos de BancoEstado “fueron otorgados ...,https://www.elmostrador.cl/mercados/2020/04/17/latam-aclara-que-creditos-de-bancoestado-fueron-otorgados-con-anterioridad-a-esta-crisis/,"Latam salió a despejar dudas y precisó que no ha recibido un crédito de BancoEstado para hacer frente a la crisis derivada de la pandemia de Covid-19. ""Tal como lo ha señalado el propio BancoEstado, LATAM Airlines Group mantiene créditos con dicha institución bancaria que fueron otorgados con",17-04-2020 21:45,https://www.bing.com/th?id=ON.6294C942B3BF805A02E5F46BDFE4AB72,Chile,El Mostrador
Fundación FUAN: Chile debe asegurar respeto de DD.HH. de ...,http://www.elmartutino.cl/noticia/sociedad/fundacion-fuan-chile-debe-asegurar-respeto-de-ddhh-de-personas-en-riesgo-de-exclusi,"Fundación Unión Autismo y Neurodiversidad FUAN, da a conocer declaración pública, en que suma voces expertas, para exigir respeto de DDHH desde una perspectiva bioética, humana y social, que considere a pueblos originarios, mujeres, niñxs, migrantes, personas en situación de calle, personas con discapacidad o que presenten determinada ...",17-04-2020 21:46,https://www.bing.com/th?id=ON.A9A8978771A811F7DF6B5745410D39AC,Chile,Mar
Buscan cancelar show en casa de Tito el Bambino en ...,https://www.t13.cl/noticia/tendencias/tito-bambino-show-casa-peticion-cancelar-17-04-2020,Los shows desde casa transmitidos en vivo por redes sociales son una de las variantes con las que los músicos de todo el mundo se las han ingeniado para seguir mostrándoles su música a los fans. Unos y otros están privados de encontrarse en recintos físicos para algún concierto o festival,17-04-2020 21:56,https://www.bing.com/th?id=ON.1592A404F453CDAF248CAA698C9057D4,Chile,T13
Región de Valparaíso suma 15 casos nuevos de coronavirus ...,https://www.puranoticia.cl/noticias/regiones/region-de-valparaiso-suma-15-casos-nuevos-de-coronavirus-contagiados/2020-04-17/111557.html,"En base a estos nuevos números revelados por la autoridad sanitaria en su página web, la región de Valparaíso posee ahora el 3,73% de los casos del país. Regiones, Viernes 17 de abril de 2020 a las 11:16 horas 15 son los nuevos casos confirmados con coronavirus Covid-19 en la región de",17-04-2020 21:58,https://www.bing.com/th?id=ON.68D42CCE877480BC1F3085C00181592A,Chile,Puranoticia.cl
DIPUTADO GABRIEL BORIC Y ENAP MAGALLANES COMPARTEN LABORES ...,http://radiopolar.com/noticia_156836.html,"Esta mañana, vía videollamada, se reunió el diputado Gabriel Boric con el Gerente General de ENAP Magallanes, Rodrigo Bustamante; el Presidente del Sindicato de Trabajadores, Alejandro Avendaño, y el Presidente del Sindicato de Profesionales, Guido Kusanovic, para conocer el estado en que se",17-04-2020 22:02,https://www.bing.com/th?id=ON.541B88107D9911ED97BF93E60D048938,Chile,Radio Polar
Clínicas acusan impacto por COVID-19 | Tele 13,https://www.t13.cl/noticia/negocios/clinicas-acusan-impacto-covid-19-80-baja-atenciones-no-urgentes-y-caida-ingresos,"Clínicas acusan impacto por COVID-19: 80% de baja en atenciones no urgentes y caída de ingresos “Esta situación genera una crisis de liquidez muy profunda”, indica carta que la Asociación de Clínicas de Chile ha hecho llegar a distintas autoridades de gobierno.",17-04-2020 22:05,https://www.bing.com/th?id=ON.4AD73B53F98A2B338C22E4F10E533CDC,Chile,T13
El Tipógrafo » Mundo: La empresa que realmente conecta Chile,https://eltipografo.cl/2020/04/mundo-la-empresa-que-realmente-conecta-chile/,"En diciembre del 2019, Mundo pasó a ser la empresa líder en despliegue de Fibra Óptica en regiones, entre las cuales destacan O’Higgins con un 78% y Maule con un 61%. Mundo es la empresa de ...",17-04-2020 22:06,https://www.bing.com/th?id=ON.C4557317CB82BE6DC052FCCC992DEAAB,Chile,eltipografo.cl
Más de 400 bolivianos en campamento militar finalizaron ...,https://www.cooperativa.cl/noticias/sociedad/salud/coronavirus/mas-de-400-bolivianos-en-campamento-militar-finalizaron-cuarentena-y/2020-04-17/172835.html,"El recinto en la localidad de Pisiga se prepara para recibir a otros 440 connacionales varados en Iquique. ""No hemos tenido ni un solo caso positivo de Covid-19"", dijeron las autoridades. Los más de cuatro centenares de bolivianos provenientes de Chile que cumplieron una cuarentena en un campamento",17-04-2020 22:08,https://www.bing.com/th?id=ON.4882E7A3E1E637C5B0DB2F45596DB0CE,Chile,Radio Cooperativa
Ministerio de Culturas opta por “Día del Patrimonio en ...,http://lanacion.cl/2020/04/17/ministerio-de-culturas-opta-por-dia-del-patrimonio-en-casa-para-evitar-el-covid-19/,"Ministerio de Culturas opta por “Día del Patrimonio en casa” para evitar el Covid-19 En el contexto de la emergencia sanitaria, la cartera reemplazó las actividades presenciales programadas para ese tradicional festejo por otras que inviten a la gente a participar y apreciar desde sus hogares las expresiones y acervo de Chile que engloba ...",17-04-2020 22:07,https://www.bing.com/th?id=ON.06F03FEE52B6FACAD6EBBF6F3BFA8730,Chile,La Nación
La nueva jugada de Camila Vallejo en contra de las AFPs,https://www.elperiscopio.cl/destacado-1/la-nueva-jugada-de-camila-vallejo-en-contra-de-las-afps/,La diputada del PC buscará iniciar el proceso de nacionalización del sistema de pensiones con un inédito proyecto de ley en el Congreso. La diputada Camila Vallejo (PC) anunció durante esta jornada que que presentó un proyecto de ley que busca declarar de interés nacional el patrimonio de las,17-04-2020 22:09,https://www.bing.com/th?id=ON.AD3A08F2E560EAD80AB678CDFF35E147,Chile,elperiscopio.cl
Fraude en Carabineros: Fijan fecha para retomar ...,https://www.radioagricultura.cl/nacional/2020/04/17/fraude-en-carabineros-fijan-fecha-para-retomar-preparacion-de-juicio-oral.html,"El Séptimo Juzgado de Garantía de Santiago fijó para el martes 21 de abril la continuación, a través de videoconferencia, de la audiencia de preparación de juicio oral de la causa contra 31 imputados como autores de los delitos de asociación ilícita, malversación de caudales públicos y lavado de activos en Carabineros de Chile.",17-04-2020 22:11,https://www.bing.com/th?id=ON.A7C27967FE4843C0FC6B645AED0BB3BE,Chile,Radio Agricultura
Incami se mostró preocupado ante discriminación de ...,https://www.lacuarta.com/cine/noticia/incami-ciudadano-haitiano/484929/,"El Instituto Católico Chile de Migración puso la voz de alerta ante la detención de un supuesto contagiado con COVID-19. El Instituto Católico Chileno de Migración, Incami, lleva 65 años trabajando por la inclusión social de los migrantes en el país. Ofrece servicios gratuitos de asesoría",17-04-2020 22:21,https://www.bing.com/th?id=ON.B36A3BE0E903A291529B2B64EEFA9E6B,Chile,La Cuarta
Se suman dos nuevos médicos a Hospital de Chimbarongo ...,https://www.elrancaguino.cl/2020/04/17/se-suman-dos-nuevos-medicos-a-hospital-de-chimbarongo/,"Durante los últimos días, se incorporaron dos nuevos médicos a Hospital de Mercedes Chimbarongo, con el objetivo de maximizar el flujo de atención clínica hacia los pacientes de la comuna, más aun dentro de este periodo de emergencia sanitaria por COVID-19. Justamente uno de ellos, el Dr. Francisco Villasmil Núñez llegó al centro ...",17-04-2020 22:36,https://www.bing.com/th?id=ON.4D4841C47E755FD6B89C069856DF2815,Chile,elrancaguino.cl
Coronavirus: Minsal confirma 11 nuevos fallecidos y Chile ...,https://www.publimetro.cl/cl/noticias/2020/04/17/coronavirus-minsal-confirma-11-nuevos-fallecidos-chile-alcanza-cifra-victimas-fatales-116-total.html,"En las últimas 24 horas se registraron en Chile 445 nuevas personas confirmadas con covid-19, llegando a las 9.252 personas infectadas. De aquellas 5.500 son activas en contagio y 3.621 recuperadas. La subsecretaria de Salud Pública Paula Daza informó además que se registraron once nuevos",17-04-2020 22:36,https://www.bing.com/th?id=ON.EF356D1E371F6FBBED9B18645593DAC0,Chile,publimetro.cl
