name,url,description,datePublished,imagen,pais,Fuente
Inglaterra levanta cuarentena para viajeros procedentes de ...,https://www.latercera.com/mundo/noticia/inglaterra-levanta-cuarentena-para-viajeros-procedentes-de-50-paises-chile-y-otras-naciones-de-america-latina-no-estan-en-el-listado/GHXIIWIKBFAKFAHB4V3XHXQHIM/,"Los viajeros que lleguen a Inglaterra procedentes de más de 50 países, entre ellos Grecia y Bélgica estarán exentos de la cuarentena de 14 días impuesta por el gobierno británico, informó Londres el v",03-07-2020 16:13,https://www.bing.com/th?id=ON.8DB8B4A32CEC5BA81E8A41598AC516D1,Chile,LA TERCERA
"Gobierno a 120 días de la llegada del covid: ""Estamos ...",https://www.emol.com/noticias/Nacional/2020/07/03/990917/Balance-4-meses-covid-Chile.html,"SANTIAGO.- A 120 días del primer caso confirmado en Chile de coronavirus, los subsecretarios del Ministerio de Salud, Paula Daza y Arturo Zúñiga, hicieron un balance de lo que han sido estos cuatro me",03-07-2020 16:22,https://www.bing.com/th?id=ON.DC8D6831AE0455D23E086FC10CE52D16,Chile,Emol
Los casos de Covid-19 en Chile región por región ...,https://www.cooperativa.cl/noticias/sociedad/salud/coronavirus/los-casos-de-covid-19-en-chile-region-por-region/2020-07-03/120235.html,"El Ministerio de Salud informó este lunes que en las últimas 24 horas se registraron 3.548 nuevos casos de Covid-19 en el país, lo que eleva la cifra total de contagiados a 288.089 desde el comienzo d",03-07-2020 16:25,https://www.bing.com/th?id=ON.A52ABBB2350343C995C8B38BA7DC039A,Chile,Radio Cooperativa
Chile sobrepasa los 6 mil muertos en 4 meses de pandemia y ...,https://elpinguino.com/noticia/2020/07/03/chile-sobrepasa-los-6-mil-muertos-en-4-meses-de-pandemia-y-suben-nuevos-casos-tras-aumento-de-testeo,"El Ministerio de Salud realizó un nuevo balance diario, desde La Moneda, sobre la situación del coronavirus en el país, que este viernes cumple 4 meses en suelo nacional. La subsecretaria de Salud, Pa",03-07-2020 16:36,https://www.bing.com/th?id=ON.E095C8476FAAA4095D29092874547188,Chile,ELPINGUINO
Jefe de Epidemiología y 6.552 muertos... | Puranoticia,https://www.puranoticia.cl/noticias/nacional/jefe-de-epidemiologia-y-6-552-muertos-reportados-por-el-deis-se-acerca/2020-07-03/123049.html,"Mientras el balance diario ha informado de 6.051 personas fallecidas a causa de la pandemia, el Informe Epidemiológico indica que hay 6.552 víctimas fatales con un test de PCR positivo. Durante el bal",03-07-2020 16:39,https://www.bing.com/th?id=ON.55B9EA62BFB39962268B7664BAD1FED5,Chile,Puranoticia.cl
Joaquín Larrivey informó que todo el plantel de ...,https://www.puranoticia.cl/noticias/deportes/joaquin-larrivey-informo-que-todo-el-plantel-de-la-u-dio-negativo-por/2020-07-03/124825.html,"El atacante argentino reveló que desde el club les enviaron un mensaje informando de los resultados de los exámenes PCR tomados a inicios de semana. Joaquín Larrivey, delantero de Universidad de Chile",03-07-2020 16:56,https://www.bing.com/th?id=ON.9E4BDD3ED614D0998724F970A953E87B,Chile,Puranoticia.cl
Fallecidos en Puente Alto por Covid-19 alcanzan a las 368 ...,https://www.puentealtoaldia.com/fallecidos-en-puente-alto-por-covid-19-alcanzan-a-las-368-personas/,"El Ministerio de Salud publicó el informe epidemiológico Nº30, en el que se detalla el progreso que ha tenido la pandemia del coronavirus Covid-19 en Chile. Los datos obtenidos en el documento permite",03-07-2020 16:56,https://www.bing.com/th?id=ON.693B57B269BD4E2A12126CA330D13840,Chile,Puente Alto al Dia
Chile: 131 muertos y 3.548 contagiados de coronavirus | La ...,https://laprensaaustral.cl/nacional/chile-131-muertos-y-3-548-contagiados-de-coronavirus/,"En el Registro Civil se inscribieron 131 fallecimientos ligados al coronavirus en los últimos días en Chile, según lo informado por el ministerio de Salud. De esta forma, se han registrado 6.051 muert",03-07-2020 17:16,https://www.bing.com/th?id=ON.4A09C4691E84281F0DE5FE3E5DC73DBF,Chile,La Prensa Austral
Chile superó los 6.000 fallecidos por Covid-19 | Radio ...,http://www.radioportales.cl/sitio/chile-supero-los-6-000-fallecidos-por-covid-19/,"El Ministerio de Salud, Minsal, informó, este viernes, de 131 decesos por Covid-19 con PCR positivo inscritos en el Registro Civil, lo que sube el total nacional a 6 mil 51 desde el inicio de la pande",03-07-2020 17:20,https://www.bing.com/th?id=ON.1E762AB68DB0E0AB9FDF6E8395C13C22,Chile,Radio Portales
Ministra Zalaquett se integra de manera permanente a mesa ...,https://www.latercera.com/politica/noticia/ministra-zalaquett-se-integra-de-manera-permanente-a-mesa-social-covid-19/BZCQ4QQYUFD43KZ3XQLCVHZ67Q/,"Solo en Chile, hasta la fecha, el desempleo femenino alcanzó un 11,5%, registrando su punto más crítico en los últimos 16 años. Respecto a violencia, las llamadas de orientación y ayuda al número 1455",03-07-2020 17:43,https://www.bing.com/th?id=ON.E8FC85E8AD328EC001DF7BD8E4D3DF8E,Chile,LA TERCERA
"Cachiyuyo, el pueblo del comercial de la CTC que hoy es ...",http://www.elquehaydecierto.cl/noticia/coronavirus/cachiyuyo-el-pueblo-del-comercial-de-la-ctc-que-hoy-es-foco-de-contagios-de-coro,"¿Te acuerdas de Cachiyuyo? ¿No te suena? Si naciste antes de lo 90 seguro que si. Es que esta pequeña localidad de poco más de 200 habitantes y que queda a unos 60 kilómetros de la ciudad de Vallenar,",03-07-2020 17:48,https://www.bing.com/th?id=ON.CB7AEAE9B2A717D87B32C573D8370327,Chile,El Quehay Decierto
Chile llega a los 288.089 contagios por covid-19: decesos ...,https://www.diarioconcepcion.cl/pais/2020/07/03/chile-llega-a-los-288-089-contagios-por-covid-19-decesos-suman-6-051.html,"Un nuevo balance entregado este viernes por el Ministerio de Salud reveló que Chile registró 131 nuevos decesos y 3.548 casos positivos de covid-19, durante las últimas 24 horas. Del total de nuevos c",03-07-2020 17:53,https://www.bing.com/th?id=ON.F0F7063DBCEC3240FFC4330AB60FFEF9,Chile,El Diario de Concepcion
Chile supera a Reino Unido y se convierte en el sexto país ...,https://www.biobiochile.cl/noticias/nacional/chile/2020/07/03/chile-supera-reino-unido-se-convierte-sexto-pais-mas-casos-covid-19-mundo.shtml,"Tras el balance realizado por el Ministerio de Salud este viernes, se confirmó que Chile superó a Reino Unido en total de casos de Covid-19, convirtiéndose en el sexto con más contagios a nivel mundia",03-07-2020 17:57,https://www.bing.com/th?id=ON.4DB29E11A00021325D3CF7A250B8CCC2,Chile,Chile
Ministra de la Mujer y la Equidad de Género se integra de ...,https://www.elmostrador.cl/braga/2020/07/03/ministra-de-la-mujer-y-la-equidad-de-genero-se-integra-de-manera-permanente-a-la-mesa-social-covid-19/,"Desde el Gobierno informaron que la decisión se tomó enfrentar la crisis sanitaria con enfoque de género, además se basaron en la experiencia internacional y diversos estudios que avalan que el impact",03-07-2020 18:01,https://www.bing.com/th?id=ON.29B63F75FA3AEE0BD53FE3FC0598CB71,Chile,El Mostrador
Valdés y Vergara entre economistas que se suman al debate ...,https://www.df.cl/noticias/mercados/pensiones/valdes-y-vergara-entre-economistas-que-se-suman-al-debate-sobre-usar-o/2020-07-03/130329.html,"Esta mañana, la comisión de Trabajo del Senado realizó una sesión especial para analizar los efectos de posibles retiros de fondos de AFP en el contexto de la pandemia por Covid-19.  Distintos economi",03-07-2020 18:13,https://www.bing.com/th?id=ON.5BDEDB2240A0511662CBFFD4187D45F4,Chile,df.cl
Remdesivir e Ivermectina: ¿son realmente la respuesta al ...,https://www.biobiochile.cl/noticias/ciencia-y-tecnologia/ciencia/2020/07/03/remdesivir-e-ivermectina-realmente-la-respuesta-al-coronavirus.shtml,Diversos laboratorios e instituciones alrededor de todo el mundo se encuentran trabajando arduamente con el objetivo de desarrollar una vacuna para el Covid-19. Y es que la pandemia provocada por el S,03-07-2020 18:14,https://www.bing.com/th?id=ON.68D31FF6CBDF8B4FCB015F7CA02DF11E,Chile,Chile
Déficit de médicos en el sistema: además de contratar ...,https://www.theclinic.cl/2020/07/03/deficit-de-medicos-en-el-sistema-ademas-de-contratar-proteger-a-los-que-ya-estan-en-funciones/,"Con el pronóstico de la pronta llegada del peak de la pandemia, se ha instalado la preocupación acerca si el actual personal de salud especializado dará a basto para atender al flujo de pacientes covi",03-07-2020 18:23,https://www.bing.com/th?id=ON.FA768D0F7AEC45681E923C79222CABF7,Chile,Clinic
Chile es el 6° país con más casos de Covid-19,https://www.radioagricultura.cl/nacional/2020/07/03/chile-es-el-6-pais-con-mas-casos-de-covid-19.html,"Este viernes el Ministerio de Salud informó 3.548 nuevos casos de COVID-19 en Chile, con lo que en cuatro meses el país ya acumuló un total de 288.089 contagiados. De acuerdo a la estadística de la Un",03-07-2020 18:51,https://www.bing.com/th?id=ON.F5C23A1DC6A53552C0ECF377BE95188F,Chile,Radio Agricultura
OvejeroNoticias Los muertos son más que números - José ...,https://www.ovejeronoticias.cl/2020/07/los-muertos-son-mas-que-numeros-jose-ruiz-santana-opiniones/,"De un tiempo a esta parte nos hemos habituado a escuchar o ver en los diferentes medios de comunicación, nacional, regional, o local los informes que entregan las autoridades de salud acerca de la can",03-07-2020 18:56,https://www.bing.com/th?id=ON.C0D55B4D5DC046201138816EF9587E4A,Chile,Ovejero Noticias
Chile sube al sexto puesto de los países con más enfermos ...,https://www.publimetro.cl/cl/noticias/2020/07/03/chile-sube-al-sexto-puesto-los-paises-mas-enfermos-coronavirus.html,"Este viernes 3 de julio, el Ministerio de Salud informó acerca de 3.548 nuevos casos de covid-19, por lo que justo en el día en el que se cumplen cuatro meses desde que se supo del primer contagiado,",03-07-2020 19:02,https://www.bing.com/th?id=ON.CFBC7A915B1F24427A06835C56CCCCAE,Chile,publimetro.cl
El rol clave que ha jugado el Biobío en disminuir la ...,https://www.emol.com/noticias/Nacional/2020/07/03/990936/Biobio-Traslados-Coronavirus.html,"En medio de un sistema sanitario exigido al máximo por la pandemia del coronavirus, desde el Gobierno han destacado la gestión realizada en la Región del Biobío, cuya red ha podido brindar una ""mano s",03-07-2020 19:03,https://www.bing.com/th?id=ON.45D26CA5E1ECD7851C67355A99E76B27,Chile,Emol
Estos son los medicamentos aprobados en Europa para tratar ...,https://www.meganoticias.cl/calidad-de-vida/306598-medicamentos-para-tratar-coronavirus-remdesivir-dexametasona-avifavir-ppx03.html,"Con el avance del nuevo coronavirus y de las investigaciones sobre el SARS- CoV-2 médicos y especialistas en el mundo se han enfocado no sólo en hallar una vacuna contra el patógeno, sino también en l",03-07-2020 19:10,https://www.bing.com/th?id=ON.873161C0D763070463A9EFD7563141E6,Chile,meganoticias
Seguro catastrófico de isapres se activará automáticamente ...,https://www.pauta.cl/nacional/seguro-catastrofico-de-isapres-se-activara-automaticamente-en-pacientes,"El brote en Chile comenzó el 3 de marzo. El virus corre con rapidez. Revise aquí diariamente la situación general de casos. Hasta ahora, un contagiado que cursaba un cuadro complejo por coronavirus, s",03-07-2020 19:20,https://www.bing.com/th?id=ON.07CEE4681C3DC4F91E11747457C0CEAD,Chile,pauta
Chuquicamata aprueba jornada excepcional mientras ...,https://www.df.cl/noticias/empresas/mineria/chuquicamata-aprueba-jornada-excepcional-mientras-sindicatos-reportan/2020-07-03/145311.html,Siguen las medidas en Codelco para evitar el aumento de contagios por Covid-19. Tras las instancias de discusión con las dirigencias sindicales Rol B y la votación de los trabajadores de los sindicato,03-07-2020 19:23,https://www.bing.com/th?id=ON.92AA39AB854C05480979F455E2DF7922,Chile,df.cl
Painecura Antinao: “La mejor colección de Chile está en ...,https://www.latribuna.cl/noticias/2020/07/03/painecura-antinao-la-mejor-coleccion-de-chile-esta-en-los-angeles.html,La actual crisis sanitaria mundial conlleva desafíos cotidianos para las instituciones y centros culturales del país que buscan generar espacios artísticos para la población. El trabajo de artistas e,03-07-2020 19:25,https://www.bing.com/th?id=ON.D41D2587B11210C636A66BD0FC289D08,Chile,La Tribuna
Funcionarios del Hospital Barros Luco denuncian que hay ...,https://www.elperiodista.cl/funcionarios-del-hospital-barros-lucos-denuncian-que-hay-mas-de-13-mil-funcionarios-de-la-salud-con-covid-19/,"Esta jornada trabajadores del Hospital Barros Luco comunicaron un paro de actividades en las afueras del recinto médico, debido a las complicaciones que presenta el personal de la salud ante la pandem",03-07-2020 19:33,https://www.bing.com/th?id=ON.F8234BD25E96FDD1B214F26287B6C3C9,Chile,El Periodista
U. de Chile busca impulsar la perspectiva de género en la ...,https://www.uchile.cl/noticias/164857/u-de-chile-busca-impulsar-la-perspectiva-de-genero-en-investigacion,"La Casa de Bello ha desplegado una serie de políticas institucionales para avanzar en la equidad de género, entendiéndola como un tema transversal de la universidad para el progreso de Chile. En el ma",03-07-2020 19:39,https://www.bing.com/th?id=ON.7820B0D6A15F38E1305A1DA96E47AE18,Chile,uchile.cl
Según Seremi de Salud: Encuentro con Pastor provocó nuevo ...,https://www.elrancaguino.cl/2020/07/02/segun-seremi-de-salud-encuentro-con-pastor-provoco-nuevo-brote-de-coronavirus-al-interior-de-la-carcel-de-rancagua/,"El Pastor también es miembro de Gendarmería por lo que la seremi de Salud informó que tras testear un módulo completo conocieron de 38 nuevos casos. Este viernes se testearán 214 personas, más los exá",03-07-2020 19:40,https://www.bing.com/th?id=ON.2BB43EBCDFD71B63BFF2FD8F459FF2CF,Chile,elrancaguino.cl
Lichnovsky confirmó que es uno de los casos de COVID en ...,https://www.prensafutbol.cl/359489-lichnovsky-confirmo-que-es-uno-de-los-casos-de-covid-en-cruz-azul/,"El zaguero chileno de la 'máquina cementera' confirmó que es uno de los contagiados de su escuadra con el coronavirus, pero afortunadamente no ha sufrido síntomas de la enfermedad. ""Di positivo en el",03-07-2020 19:40,https://www.bing.com/th?id=ON.AF8E871B11F3074E48C44E26CEBFED14,Chile,Prensafútbol
División Chuquicamata inició jornada 7×7 en todas sus ...,https://www.radioagricultura.cl/economia/2020/07/03/division-chuquicamata-inicio-jornada-7x7-en-todas-sus-operaciones-y-procesos.html,"Como resultado de las instancias de trabajo con las dirigencias sindicales Rol B y la votación de los trabajadores y trabajadoras de los sindicatos números 1, 2, 3, 5 y Minero de la división, con sobr",03-07-2020 19:52,https://www.bing.com/th?id=ON.BE6B8A3B1294C3940F04BF927E71F272,Chile,Radio Agricultura
Ministro de Justicia: No habrá más traslado de presos sin ...,https://www.cooperativa.cl/noticias/sociedad/salud/coronavirus/ministro-de-justicia-no-habra-mas-traslado-de-presos-sin-pcr-negativo/2020-07-03/152307.html,"Hernán Larraín anunció la creación de un protocolo de transferencias de un penal a otro junto a la Mesa Social Covid-19. Recuerda nuestra campaña ""Todos podemos hacer más"", si tienes una iniciativa so",03-07-2020 19:52,https://www.bing.com/th?id=ON.F97CF72A5F6F1F6769461D52FA60F0D0,Chile,Radio Cooperativa
El plebiscito… ¿en los tiempos del COVID-19? - El Mostrador,https://www.elmostrador.cl/noticias/opinion/2020/07/03/el-plebiscito-en-los-tiempos-del-covid-19/,"Históricamente, las epidemias han alejado a los votantes de las urnas. Las primeras referencias que tenemos sugieren que la gripe española redujo en 20% la participación en las elecciones legislativas",03-07-2020 19:54,https://www.bing.com/th?id=ON.0ED3CCF74102D6130D96A82A6E92B242,Chile,El Mostrador
120 días de Covid en Chile: 288.089 contagios y más de 6 ...,https://www.elperiodista.cl/120-dias-de-covid-en-chile-288-089-contagios-y-mas-de-6-mil-muertes-certificadas-con-pcr-e-inscritas-en-el-rc/,Tras cumplirse 120 días desde el primer caso de COVID-19 en nuestro país las autoridades sanitarias realizaron un balance destacando el actual estado de evolución de la pandemia. La subsecretaria de S,03-07-2020 19:55,https://www.bing.com/th?id=ON.37DF610FD1AC3CAA05C63762EED9714B,Chile,El Periodista
Tecno Fast entrega recinto modular a Hospital San José,https://www.lacuarta.com/cronica/noticia/tecno-fast-entrega-recinto-modular-hospital-san-jose/518420/,"El aporte, que se extenderá por todo 2020, consiste en 36 módulos que permitirán añadir 40 camas al sistema de salud. Esta mañana, la empresa Tecno Fast, dedicada al arriendo, venta, fabricación y mon",03-07-2020 20:08,https://www.bing.com/th?id=ON.706B9EE1393676A699C7717A3C7D15B6,Chile,La Cuarta
Aseguran que levantamiento de cordón sanitario en Alto ...,https://www.latribuna.cl/noticias/2020/07/03/aseguran-que-levantamiento-de-cordon-sanitario-en-alto-biobio-esta-en-evaluacion.html,"Tras la solicitud del alcalde Nivaldo Piñaleo, la Seremi de Salud (s) de Biobío, Isabel Rojas, señaló que “esta medida fue establecida en relación a la tasa de incidencia alta (por COVID-19) que tenía",03-07-2020 20:13,https://www.bing.com/th?id=ON.913248576A1D10E8FC9CD11995EF4266,Chile,La Tribuna
