name,url,description,datePublished,imagen,pais,Fuente
El 2020 se convirtió en el año con más fallecimientos en ...,https://www.chanarcillo.cl/el-2020-se-convirtio-en-el-ano-con-mas-fallecimientos-en-chile-desde-que-se-tiene-registro/,Falta un mes y medio para que termine el 2020 y Chile ya superó la cantidad de fallecidos que hubo durante todo el 2019 y este año se convirtió en el con mayor cantidad de muertes en el país desde que,17-11-2020 10:00,https://www.bing.com/th?id=OVFT.sgnEw5XHycVif-94cyPeDC,Chile,Diario Chanarcillo
Brigada canina para detectar el covid: Así es el equipo ...,https://www.emol.com/noticias/Nacional/2020/11/18/1004216/brigada-canina-para-detectar-covid.html,Se trata de la primera brigada certificada en toda Amértica de estos perros biodetectores de la escuela de adiestramiento de Carabineros de Chile. Su labor importante con miras al aumento de movilidad,18-11-2020 21:12,https://www.bing.com/th?id=OVFT.2xWqF1hvhJ065lirmLs3yy,Chile,Emol
Investigadora del Instituto Milenio de Inmunología no ...,https://www.radioagricultura.cl/nacional/2020/11/18/investigadora-del-instituto-milenio-de-inmunologia-no-descarta-nueva-ola-de-covid-19-en-chile-y-brote-de-sarampion-en-2021.html,18 de noviembre 2020 Investigadora del Instituto Milenio de Inmunología no descarta nueva ola de COVID-19 en Chile y brote de sarampión en 2021,18-11-2020 21:58,https://www.bing.com/th?id=OVFT.4xJ9INd8XGdPE_w5LE3pMS,Chile,Radio Agricultura
Agricultura sustentable es lo más consultado en nueva ...,https://www.diarioconcepcion.cl/economia/2020/11/18/agricultura-sustentable-es-lo-mas-consultado-en-nueva-plataforma-de-contenidos-gratuitos-chileagricola-cl.html,"Uso eficiente del agua, agroecología y agricultura orgánica fueron los temas más consultados durante los primeros meses de funcionamiento de la Escuela de Capacitación Chile Agrícola, www.chileagricola.cl, plataforma de contenidos gratuitos lanzada este año para apoyar el emprendimiento de productores agrícolas del país y que hoy se ...",18-11-2020 22:15,https://www.bing.com/th?id=OVFT.xg_AbLsh-yBiJ7l05Od5Wi,Chile,El Diario de Concepcion
178 años de la Universidad de Chile - La Tercera,https://www.latercera.com/opinion/noticia/178-anos-de-la-universidad-de-chile/H45TEG3WOVF67MLLC3UG3SUM5E/,"En un día como hoy, hace 178 años, se fundó la Universidad de Chile. Como todas las grandes universidades públicas latinoamericanas, su instalación tiene que ver con la consolidación de las naciones de la región luego de nuestros procesos de independencia. Las universidades públicas son",18-11-2020 23:43,https://www.bing.com/th?id=OVFT.-UEa4NE_iNKVvT_8GMaJ4y,Chile,LA TERCERA
Movilh anunció que buscará prohibir la circulación del ...,https://www.elperiscopio.cl/destacado-1/movilh-anuncio-que-buscara-prohibir-la-circulacion-del-bus-de-la-libertad-en-chile/,"La agrupación realizó la solicitud a las intendencias de la RM y Valparaíso, junto con pedir adoptar medidas contra los ""mensajes de odio"" y aplicar acciones legales contra quienes los difundan. El Movimiento de Integración y Liberación Homosexual (Movilh) solicitó a los intendentes de la",19-11-2020 01:50,https://www.bing.com/th?id=OVFT.SDUM_QhuEv6ofUX3qXI88y,Chile,elperiscopio.cl
"La monumental ""parada de carros"" de Javier Milei a Camila ...",https://www.elperiscopio.cl/destacado-1/la-monumental-parada-de-carros-de-javier-milei-a-camila-vallejo-por-redes-sociales/,"Un incómodo momento vivió la diputada del Partido Comunista de Chile, Camila Vallejo, a través de su cuenta de Twitter, luego de publicar un mensaje en el que valora la iniciativa que se discute en Argentina denominada “impuesto a la riqueza”, la cual busca recaudar alrededor de tres mil millones de dólares mediante un aporte ...",19-11-2020 02:17,https://www.bing.com/th?id=OVFT.YcC-2LN418hH6EQDii1gGC,Chile,elperiscopio.cl
Menos desigualdad y más inclusión en la fiesta de la ...,https://www.diarioconcepcion.cl/ciencia-y-sociedad/2020/11/19/menos-desigualdad-y-mas-inclusion-en-la-fiesta-de-la-ciencia-de-explora-biobio.html,"Cientos de actividades se organizaron a nivel nacional para el “Festival de la Ciencia Feci 2020”, que se realizó entre el 11 y el 15 de noviembre. Charlas, talleres y obras de teatro transmitidas vía streaming fueron algunas de las iniciativas generadas por distintas instituciones que se",19-11-2020 04:07,https://www.bing.com/th?id=OVFT.eUe5NRhbKoCbJcSrElUtpi,Chile,El Diario de Concepcion
Con la asistencia de más de 50 prestadores turísticos se ...,https://www.soberaniaradio.cl/publicacion/?idPublicacion=38980,"El turismo representa una importante actividad para nuestra región y la pandemia ha generado un fuerte impacto en su desarrollo, en Magallanes y en el mundo entero. En el actual contexto, donde el COVID-19 se mantiene presente en nuestro territorio, la implementación de protocolos sanitarios de",19-11-2020 05:17,https://www.bing.com/th?id=OVFT.6rVFjR-jKtzca60GbepBDy,Chile,Soberania
"Proyectos sobre ecología, memoria urbana y salud mental en ...",https://www.uchile.cl/noticias/170817/los-proyectos-ganadores-del-fondo-valentin-letelier-2020,"En un año en que la pandemia del Covid-19 nos ha obligado a hacer distanciamiento social y a cumplir cuarentenas, la Universidad de Chile no ha querido dejar de cumplir su deber en la promoción del acceso a los bienes culturales del país, al contrario, pareciera más fundamental que nunca estrechar esos lazos y es por eso que el Fondo ...",19-11-2020 06:06,https://www.bing.com/th?id=OVFT.jJohA_KNl3zlCZ9nqx3EeC,Chile,uchile.cl
La nueva normalidad de la banca: personalizar la ...,https://mundoenlinea.cl/2020/11/19/la-nueva-normalidad-de-la-banca-personalizar-la-experiencia-digital-y-omnicanal-de-los-clientes/,"En los últimos meses, el Covid-19 ha tenido una fuerte influencia en los bancos, ... gerente de Territorio Industria Financiera de SAS Chile. Asimismo, el ejecutivo señala que, a través de los años, el uso de la tecnología ha permitido automatizar procesos operativos y transaccionales, gestionar campañas, ...",19-11-2020 07:55,https://www.bing.com/th?id=OVFT.pTfQ5bA-e3oeF4Weq4Z1VS,Chile,Mundo en línea
La transformación digital también es humana y cultural ...,https://mundoenlinea.cl/2020/11/19/la-transformacion-digital-tambien-es-humana-y-cultural/,"Antes de la pandemia, muchas empresas venían incorporando tecnologías en sus modelos de negocios y procesos productivos, generando una interacción entre ser humano y tecnologías bastante relevante. No obstante, el COVID-19 profundizó y aceleró la adopción de nuevas y mejores herramientas",19-11-2020 07:55,https://www.bing.com/th?id=OVFT.PpP22mbeGxq3cfnp1hhzMC,Chile,Mundo en línea
Chile registró 945 nuevos casos de covid-19 y 14 ...,https://www.chanarcillo.cl/chile-registro-945-nuevos-casos-de-covid-19-y-14-fallecidos-en-la-ultima-jornada-mientras-que-preocupa-aumento-de-casos-en-atacama/,Chile registró 945 nuevos casos de covid-19 y 14 fallecidos en la última jornada mientras que preocupa aumento de casos en Atacama. 19/11/2020 18/11/2020 Rodrigo Ferrada 6 Views 0 comentarios *Atacama se encuentra entre las regiones con mayor aumento de casos nuevos por habitantes.,19-11-2020 09:00,https://www.bing.com/th?id=OVFT.kToZtoJLsMuF5v8qZxVWLS,Chile,Diario Chanarcillo
Fact checking: ¿El uso de mascarillas nos está enfermando ...,https://www.meganoticias.cl/calidad-de-vida/319138-mascarilla-produce-cancer-coronavirus-fact-checking-ppx03.html,Conoce la postura y la aclaratoria de la Organización Mundial de la Salud (OMS) y especialistas chilenos sobre el uso de la mascarilla como protección contra el coronavirus.,19-11-2020 11:00,https://www.bing.com/th?id=OVFT.cRwjfpsUogr_SwvxLp3bsS,Chile,meganoticias
Plantean desafíos clave de Ñuble en una era de cambios ...,http://www.ladiscusion.cl/plantean-desafios-clave-de-nuble-en-una-era-de-cambios/,"En la primera de dos jornadas, realizada ayer, la segunda versión del Encuentro Regional Ñuble 2020 abordó los desafíos de la nueva región en un contexto de cambios marcado por el estallido",19-11-2020 12:00,https://www.bing.com/th?id=OVFT.TKGPF2PNq8fVB_Ez6Zjeuy,Chile,La Discusión
Realizan fiscalización en calle Antonio Varas de Puerto ...,https://elinsular.cl/noticias/los-lagos/2020/11/19/realizan-fiscalizacion-en-calle-antonio-varas-de-puerto-montt/,"En estas fiscalizaciones se revisaron todos los aspectos de seguridad de las empresas, especialmente los relacionados con las medidas implementadas para reducir la propagación del Covid-19. La Dirección Regional del Trabajo, la Autoridad Sanitaria y la Policía de Investigaciones (PDI) en trabajo",19-11-2020 12:00,https://www.bing.com/th?id=OVFT.YghwmiHf-v3GyZKR0deati,Chile,El Insular
En estos días podría haber novedades sobre avances a la ...,https://www.elrancaguino.cl/2020/11/19/en-estos-dias-podria-haber-novedades-sobre-avances-a-la-fase-de-apertura-inicial/,"Gisella Abarca Fotos Nico Carrasco     Desde este lunes 16 de noviembre, toda la región de O’Higgins se encuentra",19-11-2020 12:07,https://www.bing.com/th?id=OVFT.prlwoQtparpJ2_tQlMV8Jy,Chile,elrancaguino.cl
Presupuesto 2021: Diputados del Distrito 21 apuntan a ...,https://www.latribuna.cl/politica/2020/11/19/presupuesto-2021-diputados-del-distrito-21-apuntan-a-temas-regionales-y-locales-en-la-discusion.html,"Mientras Iván Norambuena felicitó los fondos para la creación de la “Defensoría de las Víctimas”, el diputado José Pérez habló de la Universidad de Concepción para criticar la rebaja propuesta por el",19-11-2020 12:19,https://www.bing.com/th?id=OVFT.B3b3MocR1nKVfaLCoz0Juy,Chile,La Tribuna
Investigadores de la U. de Chile crean aplicación que ...,http://www.lanacion.cl/investigadores-de-la-u-de-chile-crean-aplicacion-que-detecta-enfermedades-pulmonares-con-una-llamada-telefonica/,Investigadores de la U. de Chile crean aplicación que detecta enfermedades pulmonares con una llamada telefónica. ... permitirá también realizar seguimiento a personas contagiadas con coronavirus. ... Una de las motivaciones de esta investigación es detectar y hacer seguimiento automático de población de riesgo en Covid-19.,19-11-2020 13:02,https://www.bing.com/th?id=OVFT.Uib0XV1x0tgwZLDoonNo9C,Chile,La Nación
Gobierno ingresa su proyecto de retiro de las AFP: incluye ...,https://laprensaaustral.cl/2020/11/19/gobierno-ingresa-su-proyecto-de-retiro-de-las-afp-incluye-devolucion-obligatoria-y-hasta-28-millones/,"Propuesta es una respuesta a la aprobada durante la misma jornada por la Comisión de Constitución del Senado, que despachó en general y en particular el proyecto de reforma constitucional que permite",19-11-2020 13:09,https://www.bing.com/th?id=OVFT.eAv-qTYdbS_cWeE6Q2Uf_i,Chile,La Prensa Austral
el dólar de hoy en Chile - Diario Financiero,https://www.df.cl/noticias/mercados/bolsa-monedas/dolar-arranca-al-alza-ante-el-recrudecimiento-de-nuevos-casos-de/2020-11-19/090118.html,"El peso local pierde fuerza ante la vuelta del dólar como moneda refugio. Además, el cobre cede terreno por las alarmas que se encienden en Asia por los contagios.",19-11-2020 13:32,https://www.bing.com/th?id=OVFT.lnQyW8nb0GvYHh4r8vPRbi,Chile,df.cl
La OPS entregó equipamiento computacional a 2 Cesfam de la ...,http://www.lanacion.cl/la-ops-entrego-equipamiento-computacional-a-2-cesfam-de-la-rm-para-que-mejoren-el-acceso-y-la-atencion-a-distancia/,"Debido a la pandemia de Covid-19 la Atención Primaria de Salud (APS) se vio obligada a modificar la forma de atención y evitar que todos los usuarios y pacientes tuvieran que asistir presencialmente a los centros de atención. Así, comenzaron a realizar atención remota cuando existían los",19-11-2020 13:43,https://www.bing.com/th?id=OVFT.YeGnGIxHLYXdrxFTzwpEwi,Chile,La Nación
Banco Mundial: 800 mil personas en Chile entrarán la ...,https://www.adnradio.cl/economia/2020/11/19/banco-mundial-800-mil-personas-en-chile-entraran-la-pobreza-producto-de-la-pandemia.html,"Alrededor de 800 mil personas en Chile entrarán en la pobreza producto de la pandemia por el coronavirus Covid-19, según informó este jueves el Banco Mundial. La organización multinacional entregó sus estimaciones del impacto de acuerdo al porcentaje de la población con ingreso por adulto",19-11-2020 14:03,https://www.bing.com/th?id=OVFT.Mi18XRsPbhu3YTaPYJG4mS,Chile,ADN
Chile reporta 1.455 nuevos casos por COVID-19 este jueves ...,https://www.t13.cl/noticia/nacional/minsal-1455-nuevos-casos-covid-19-jueves-19-11-2020,"El Ministerio de Salud (Minsal) entregó un nuevo balance la jornada de este jueves sobre el avance de la pandemia del COVID-19, cuyos primeros casos en el país se registraron en marzo de este año. El",19-11-2020 15:07,https://www.bing.com/th?id=OVFT.kc55gfTYFbcPQMU2Gu7_wy,Chile,T13
Carola Oliva revela cómo logró superar la crisis nacional ...,https://www.meganoticias.cl/tendencias/319449-carola-oliva-hotel-vina-del-mar-crisis-estallido-y-coronavirus-rpx04.html,"Ante este panorama, Lun conversó con la bailarina Carola Leiva, quien junto a su pareja Paul Barreaux, tiene un hotel en Viña del Mar que ha tenido que cerrar durante los últimos ocho meses.",19-11-2020 15:10,https://www.bing.com/th?id=OVFT.3CtJFT0JM3hsYyBwMMlwcS,Chile,meganoticias
Cuatro comunas de Los Lagos retrocederán a cuarentena a ...,https://www.adnradio.cl/nacional/2020/11/19/cuatro-comunas-de-los-lagos-retroceden-a-cuarentena-a-partir-de-este-sabado.html,"Covid-19 en Chile: reportaron 58 muertos durante las últimas 24 horas, llegando a un total de 14.955 fallecidos. Jue 19 Nov 2020. Además, Martorell informó que retrocederán a Transición las comunas de Parral, Quillón, Toltén y Los Sauces.",19-11-2020 15:32,https://www.bing.com/th?id=OVFT.Ze2zewDyNRVjq0bLiUCHiS,Chile,ADN
Chile anota 1.455 casos nuevos y 58 muertes por coronavirus,http://www.ladiscusion.cl/chile-anota-1-455-casos-nuevos-y-58-muertes-por-coronavirus/,"Un total de 1.455 casos nuevos de Covid-19 fueron reportados en las últimas horas en el país. En el reporte de este jueves, el Ministerio de Salud (Minsal) informó que los contagios corresponden a",19-11-2020 15:52,https://www.bing.com/th?id=OVFT.Mj9idDn1YMNWi1XW_t9bqy,Chile,La Discusión
Paris por entrega de correos a la justicia: No nos han ...,https://www.t13.cl/noticia/nacional/paris-entrega-correos-justicia-no-nos-han-llegado-nosotros-19-11-20,"Ministro de Salud aseguró que cuando nos lleguen vamos a responder según indicó la justicia, en tres días hábiles.",19-11-2020 15:57,https://www.bing.com/th?id=OVFT.HCqaAN8TKOLCQ8cHLqgU-C,Chile,T13
Minuto a minuto: Nieman enfrenta el primer día del RSM ...,https://www.latercera.com/el-deportivo/noticia/minuto-a-minuto-nieman-enfrenta-el-primer-dia-del-rsm-classic/RHRACTKVWVHSREOOEGSU3SDOHY/,"Joaquín Niemann comienza este jueves, desde las 13.00 horas de Chile, su participación en el RSM Classic, torneo que se juega en Georgia este fin de semana, en Sea Island, 300 kilómetros al sur de Aug",19-11-2020 15:59,https://www.bing.com/th?id=OVFT.m_DRExTiDcSbN9PltkvTUC,Chile,LA TERCERA
"Luego de exigencia del Colmed, ministro Paris pide ...",https://www.elmostrador.cl/dia/2020/11/19/luego-de-exigencia-del-colmed-ministro-paris-pide-disculpas-tras-comentario-sobre-altos-sueldos-de-funcionarios-de-salud/,"Si ellos quieren que les ofrezca disculpas públicas, les voy a ofrecer disculpas públicas, y se las ofrezco en este minuto. Le ofrezco todas las disculpas públicas que quieran recibir y no voy a volve",19-11-2020 16:42,https://www.bing.com/th?id=OVFT.ofxYbi7nIIJeyOjWxja2ii,Chile,El Mostrador
"Paris y polémica con médicos por sueldos: ""Ofrezco todas ...",https://www.biobiochile.cl/noticias/nacional/chile/2020/11/19/paris-y-polemica-con-medicos-por-sueldos-ofrezco-todas-las-disculpas-publicas-que-quieran-recibir.shtml,"Este jueves se realizó un nuevo balance de sobre la situación del covid-19 en el país. En la instancia, el ministro de Salud, Enrique Paris, se disculpó con el Colegio Médico por sus dichos en relació",19-11-2020 16:52,https://www.bing.com/th?id=OVFT.Ls5p1kuXs5h21C7sQrvMjC,Chile,Chile
Siete muertos y 299 casos nuevos de covid-19 registró la ...,https://www.biobiochile.cl/noticias/nacional/region-del-bio-bio/2020/11/19/siete-muertos-y-299-casos-nuevos-de-covid-19-registro-la-region-del-bio-bio-tras-balance-del-minsal.shtml,"Siete muertos y 299 casos nuevos de covid-19 registró la región del Bío Bío tras el balance diario del Ministerio de Salud. Debido a lo anterior, el total decesos en la zona es de 563, mientras que lo",19-11-2020 16:52,https://www.bing.com/th?id=OVFT.X78d4ZGUh9H004EWfyhWAC,Chile,Chile
el dólar de hoy en Chile - Diario Financiero,https://www.df.cl/noticias/mercados/bolsa-monedas/dolar-se-rehusa-a-sobre-pasar-los-760-y-cierra-presionado-ante/2020-11-19/090118.html,A nivel global el dólar toma fuerza como moneda de refugio a medida que crecen los temores por los efectos económicos ante el creciente número de contagios de coronavirus en EEUU.,19-11-2020 17:01,https://www.bing.com/th?id=OVFT.lnQyW8nb0GvYHh4r8vPRbi,Chile,df.cl
