name,url,description,datePublished,imagen,pais,Fuente
La Vacuna Rusa llegaría en noviembre próximo: nuevo ...,http://www.diariolaregion.cl/la-vacuna-rusa-llegaria-en-noviembre-proximo-nuevo-estudio-demuestra-que-produce-anticuerpos-y-es-100-segura/,"Esta mañana -tarde en Rusia-, los científicos del Fondo de Inversión Directa de Rusia (RDIF) y el Centro Nacional de Investigación en Epidemiología y Microbiología Gamaleya en Rusia anunciaron en una",04-09-2020 20:42,https://www.bing.com/th?id=ON.FE5062701F19C97B6815C193A5138E73,Chile,La Region
En el día de la Mujer Indígena presentarán el primer E ...,https://www.diarioconcepcion.cl/economia/2020/09/04/en-el-dia-de-la-mujer-indigena-presentaran-el-primer-e-commerce-etnico-de-la-region-del-bio-bio.html,"33 son los emprendedores que reúne de forma inicial el E-commerce Troy Küyen, una iniciativa financiada por Conadi y ejecutada por Injuv Biobío para favorecer la venta online de mercadería de origen é",04-09-2020 20:43,https://www.bing.com/th?id=ON.4B8EDC744D1D635A2A2279E27DF425B5,Chile,El Diario de Concepcion
Preocupación por transmisión comunitaria del COVID-19 ...,https://www.uchile.cl/noticias/167111/cuarto-informe-icovid-chile-preocupa-la-transmision-comunitaria,"Cuarto informe ICOVID Chile advierte que aún persiste un alto volumen de casos activos y contactos que requieren seguimiento en el norte y extremo sur del país. Valparaíso, además, se suma a las regio",04-09-2020 20:49,https://www.bing.com/th?id=ON.DFD483C783D3D435606D1111F9E80668,Chile,uchile.cl
"Coronavirus en Chile: 72 fallecidos, 1.965... | Puranoticia",https://www.puranoticia.cl/noticias/nacional/coronavirus-en-chile-72-fallecidos-1-965-casos-nuevos-y-positividad-de/2020-09-04/112620.html,"El total de contagios llegó a 418.469, de ellos 15.727 se mantienen activos. Los pacientes recuperados suman 391.248 personas. El Ministerio de Salud reportó este viernes otras 72 muertes asociadas al",04-09-2020 20:51,https://www.bing.com/th?id=ON.D3FE053E1FB56F3A81B1C245088F1B78,Chile,Puranoticia.cl
Margarita Lay: Embajadora de la ciencia | tell,https://tell.cl/2020/09/03/margarita-lay-embajadora-de-la-ciencia/,"Hoy es parte del Comité de Vacunas contra el Coronavirus, donde junto a importantes investigadores, buscan soluciones para frenar la pandemia. Es la primera mujer en liderar la Seremi de Ciencia, Tecn",04-09-2020 21:32,https://www.bing.com/th?id=ON.9F7EE77485B605D31CA6164E5BC9D8B9,Chile,Tell Magazine
Especialista advierte aumento de las consultas por ...,https://www.elmostrador.cl/agenda-pais/2020/09/04/especialista-advierte-aumento-de-las-consultas-por-disfunciones-sexuales-en-pandemia/,"Este viernes 04 de septiembre se conmemora el Día Mundial de la Salud Sexual y la crisis sanitaria generada por el covid-19 ha sido un factor relevante en el aumento de las disfunciones sexuales, espe",04-09-2020 22:19,https://www.bing.com/th?id=ON.C7C0783054CA76B46E8117A44C86F372,Chile,El Mostrador
Encuesta indica que cerca del 60% de los hogares en Chile ...,https://www.elperiodista.cl/encuesta-indica-que-cerca-del-60-de-los-hogares-en-chile-han-disminuido-sus-ingresos/,"La Encuesta Social COVID-19, difundida hoy, consultó 4.500 viviendas y consideró a todas las regiones del país, con el objetivo de entregar un panorama de la situación de las familias durante la pande",04-09-2020 22:33,https://www.bing.com/th?id=ON.4748D3669CD4D16A64D0B166B83858A8,Chile,El Periodista
Familias empresarias reenfocan sus fundaciones y aumentan ...,https://www.df.cl/noticias/economia-y-politica/laboral-personas/familias-empresarias-reenfocan-sus-fundaciones-y-aumentan-inversiones-de/2020-09-04/153845.html,"Las empresas familiares han enfrentado una serie de transformaciones en su forma de trabajo y en los focos de acción en diversos ámbitos como consecuencia de la crisis social, primero, y la pandemia p",04-09-2020 22:51,https://www.bing.com/th?id=ON.0C0A21DF5A6730D41B116CFFD775EFB0,Chile,df.cl
Informe revela que estrategia de Testeo-Trazabilidad ...,https://www.uchile.cl/noticias/167174/fallas-en-estrategia-de-testeo-trazabilidad-aislamiento-ante-el-covid,Quinto informe de monitorización de la estrategia de Testeo-Trazabilidad-Aislamiento en la Atención Primaria de Salud advierte que menos de la mitad de los centros cuenta con los recursos en septiembr,04-09-2020 23:07,https://www.bing.com/th?id=ON.127B618D08AA7D060DEB18AF6FFD20C3,Chile,uchile.cl
Un pacto por las pymes | tell,https://tell.cl/2020/09/04/un-pacto-por-las-pymes/,Las pymes y los emprendimientos han experimentado durante agosto un posicionamiento en los canales de venta por internet que nunca antes habían experimentado en Chile. De acuerdo con un sondeo de Kawé,04-09-2020 23:12,https://www.bing.com/th?id=ON.1FA9D168E26CE3D0FBF318312AB4434C,Chile,Tell Magazine
Otra vacuna inicia pruebas en Chile: Jannsen anuncia ...,https://www.latercera.com/que-pasa/noticia/otra-vacuna-inicia-pruebas-en-chile-jannsen-anuncia-ensayos-en-hospital-exequiel-gonzalez-cortes-y-en-cesfam-de-colina-y-san-bernardo/IIAZULATOBGVJFHA7D3XYEK33U/,"La vacuna contra Covid-19 que está desarrollando la farmacéutica Janssen, es otra de las herramientas que será probada en la población chilena como una manera de combatir la actual pandemia del virus",04-09-2020 23:34,https://www.bing.com/th?id=ON.0CA83A02E3524834EEABDE6662BECF20,Chile,LA TERCERA
Aids Healthcare Foundation: Test rápido de VIH sufrió ...,https://www.emol.com/noticias/Tendencias/2020/09/04/997086/Bajan-test-VHI-por-pandemia.html,"El coordinador nacional de AHF, Leonardo Arenas, señaló que desde el 1 de septiembre las personas pueden nuevamente solicitar hora para realizar el examen en la organización. También se refirió a la c",05-09-2020 00:12,https://www.bing.com/th?id=ON.7E74F7A117A9E76928AB96695B66C5FD,Chile,Emol
1.965 nuevos casos de Covid-19 en Chile que totaliza 418 ...,https://www.itvpatagonia.com/noticias/1-965-nuevos-casos-de-covid-19-en-chile-que-totaliza-418-469-diagnosticados-72-fallecidos-en-la-ultima-jornada/,"El Ministerio de Salud confirmó 1.965 nuevos contagiados de coronavirus en las últimas 24 horas, llegando a un total de 418.469 casos desde iniciada la pandemia, 15.727 de ellos aún activos, mientras",05-09-2020 00:19,https://www.bing.com/th?id=ON.C39D444B29D6102483213CE3D185BEC2,Chile,ITV
Más de 8.600 test de PCR se han realizado en la Región de ...,http://www.ladiscusion.cl/mas-de-8-600-test-de-pcr-se-han-realizado-en-la-region-de-nuble/,"Sin pausa avanza la estrategia de búsqueda activa de casos de Covid 19 en la Región, cuyo propósito es detectar precozmente a quienes tengan el virus y aislarlos de manera efectiva. Esta vez, equipos",05-09-2020 02:25,https://www.bing.com/th?id=ON.F78E15460691F666AD5FA4769D2CF108,Chile,La Discusión
OvejeroNoticias Puerto Williams y Estatuto Chileno ...,https://www.ovejeronoticias.cl/2020/09/puerto-williams-y-estatuto-chileno-antartico-la-ciencia-para-el-desarrollo-futuro-de-la-puerta-de-entrada-mas-cercana-a-la-antartica/,"– Tras la reciente promulgación de este nuevo cuerpo legal, se espera que la capital provincial cumpla un importante rol en los planes nacionales y regionales en torno al continente blanco durante los",05-09-2020 02:50,https://www.bing.com/th?id=ON.49D127F576BA39391BC53BE77EF30176,Chile,Ovejero Noticias
Ejército anunció sus medidas para el Plebiscito Constituyente,https://www.elperiscopio.cl/destacado-1/ejercito-anuncio-sus-medidas-para-el-plebiscito-constituyente/,"La entidad militar comenzará su acuartelamiento desde el 2 de octubre, aunque los soldados podrán pasar unos días con sus familias. El Ejército de Chile anunció que aumentará en más de un 70 por cient",05-09-2020 03:22,https://www.bing.com/th?id=ON.4A5781CCEDCCF1719E5CB592ABA5211E,Chile,elperiscopio.cl
Gobierno fiscaliza cadena de abastecimiento tras paro de ...,http://www.diarioelheraldo.cl/noticia/gobierno-fiscaliza-cadena-de-abastecimiento-tras-paro-de-camioneros,"Los Ministros de Agricultura, Antonio Walker y de Salud, Enrique Paris, constataron en terreno el funcionamiento de la cadena de abastecimiento y entregaron una guía de autocuidado con las medidas san",05-09-2020 03:51,https://www.bing.com/th?id=ON.9F23CB92846302155316329F04E7EA07,Chile,El Heraldo
Región de Ñuble tiene en rojo los indicadores de carga y ...,http://www.ladiscusion.cl/region-de-nuble-tiene-en-rojo-los-indicadores-de-carga-y-transmision-del-covid/,"El equipo ICOVID Chile, iniciativa liderada por la Universidad de Chile, la Pontificia Universidad Católica de Chile y la Universidad de Concepción, presentó su cuarto informe con análisis y datos de",05-09-2020 04:08,https://www.bing.com/th?id=ON.59D4DA4994F381B35A0DA54693FC127D,Chile,La Discusión
El Ciudadano | A las urnas en pandemia,https://www.elciudadano.com/columnas/a-las-urnas-en-pandemia/09/03/,"Aún me rechina bastante en el oído cuando escucho hablar de “la nueva normalidad”, es más, personalmente prefiero referirme a “la circunstancial normalidad”, por lo menos es más esperanzador para aque",05-09-2020 04:12,https://www.bing.com/th?id=ON.24EC26A000137B7100BBFD5842ADDC6F,Chile,El Ciudadano
San Javier: Carabineros entregó kits de alimentos a ...,http://www.diarioelheraldo.cl/noticia/san-javier-carabineros-entrego-kits-de-alimentos-a-personas-en-situacion-de-calle-en-pandemia,"Funcionarios de la Oficina de Integración Comunitaria de la 5ta. Comisaría de San Javier entregaron kits de alimentos a personas en situación de calle, quienes son una preocupación constante; debido a",05-09-2020 04:53,https://www.bing.com/th?id=ON.44D3BC45C771A1FF86CFC3981CDC9F16,Chile,El Heraldo
Balance Covid: 1.965 nuevos casos y 72 fallecimientos ...,https://www.cooperativa.cl/noticias/sociedad/salud/coronavirus/balance-covid-1-965-nuevos-casos-y-72-fallecimientos/2020-09-04/104859.html,"Chile ya ha registrado 418.469 contagios totales y 11.494 decesos durante la pandemia. El Ministerio de Salud confirmó 1.965 nuevos contagiados de coronavirus en las últimas 24 horas, llegando a un to",05-09-2020 05:56,https://www.bing.com/th?id=ON.4B2B6376DB50BE6A4ED05D50DDDD2B49,Chile,Radio Cooperativa
Ya es oficial: Lollapalooza Chile se reagendó para ...,https://www.lacuarta.com/espectaculos/noticia/ya-oficial-lollapalooza-chile-se-reagendo/541819/,"La organización reveló que la programación tendrá un nuevo line up. Revisa las nuevas fechas. Después de mucha incertidumbre por la pandemia del COVID-19, finalmente Lollapalooza Chile se reprogramó p",05-09-2020 07:47,https://www.bing.com/th?id=ON.88AA4E0396D02063B03800590CF46B59,Chile,La Cuarta
Lollapalooza Chile se reprograma para noviembre de 2021 ...,https://www.t13.cl/noticia/tendencias/lollapalooza-chile-noviembre-2021-lineup-04-09-20,"Una de las consecuencias de la pandemia por el COVID-19, tanto en Chile como el mundo, está relacionada a la imposibilidad de hacer shows en vivo. En nuestro país, los espectáculos comenzaron a cancel",05-09-2020 08:46,https://www.bing.com/th?id=ON.DAF916639D795134DE23DD815E95D50E,Chile,T13
"Comercio exterior no se recupera, pero exportaciones a ...",http://www.lanacion.cl/comercio-exterior-no-se-recupera-pero-exportaciones-a-china-subieron-98/,"Las cifras globales del intercambio comercial de Chile con el mundo siguen afectadas por la pandemia del Covid-19, aunque la recuperación que han mostrado las exportaciones con China refleja el trabaj",05-09-2020 11:06,https://www.bing.com/th?id=ON.5D4490FA694CA96B9F5F629EF279B33C,Chile,La Nación
Lollapalooza Chile se hará finalmente en noviembre de 2021 ...,https://www.latercera.com/culto/2020/09/04/lollapalooza-chile-se-hara-finalmente-en-noviembre-de-2021/,"Tal como adelantó La Tercera, Lollapalooza Chile no tendrá versión 2020 debido a la pandemia del Covid-19. La versión programada para noviembre próximo -postergada desde marzo- no se llevará a cabo. A",05-09-2020 12:52,https://www.bing.com/th?id=ON.BA9AC63BC4D92C7F68E7E53F2477D35E,Chile,LA TERCERA
En el Día de la Mujer Indígena inaugurarán el primer sitio ...,https://www.latribuna.cl/noticias/2020/09/05/en-el-dia-de-la-mujer-indigena-inauguraran-el-primer-sitio-de-ventas-online-etnico-en-biobio.html,"En total son 33 los emprendedores que reúne de forma inicial el E-commerce Troy Küyen, una iniciativa financiada por Conadi y ejecutada por Injuv Biobío que tiene como finalidad favorecer la venta onl",05-09-2020 13:18,https://www.bing.com/th?id=ON.FE771F7F48782E4A379BBC3FA6D5C5FD,Chile,La Tribuna
Exámenes PCR y aumento de bono: Las ideas para asegurar la ...,https://www.emol.com/noticias/Nacional/2020/09/05/997017/Plebiscito-Vocales-Coronavirus.html,"La presencia del covid-19 en el país ha obligado a tomar una serie de medidas para asegurar la viabilidad y desarrollo del Plebiscito constitucional. De partida, modificó su fecha original para el 25",05-09-2020 13:52,https://www.bing.com/th?id=ON.C81BB7946A0660756DCA2F9FC9E3E8B4,Chile,Emol
OvejeroNoticias Declaración pública del PPD Magallanes ...,https://www.ovejeronoticias.cl/2020/09/declaracion-publica-del-ppd-magallanes-sobre-plan-fondeate-en-tu-casa/,"Hemos recibido la siguiente declaración pública del PPD: » Declaración Pública Partido Por la Democracia, Región de Magallanes El día de ayer el Ministro Secretario de Gobierno, Sr. Jaime Bellolio rei",05-09-2020 14:23,https://www.bing.com/th?id=ON.0178A06305DB3C9ED4EBD96C6AEEE314,Chile,Ovejero Noticias
El Ciudadano | (Videos) Brutal represión de Carabineros a ...,https://www.elciudadano.com/especiales/chiledesperto/videos-manifestacion-en-plaza-de-la-dignidad-termina-con-violenta-represion-de-carabineros/09/05/,"Cientos de personas participaron en una manifestación pacífica en Plaza de la Dignidad, que se dio por tercer viernes consecutivo yque se convirtió en la concentración más significativa desde el inici",05-09-2020 14:46,https://www.bing.com/th?id=ON.DE833FE84A8B44B4F52EFB8740639F26,Chile,El Ciudadano
Muertes por coronavirus llegan a 11.551 en Chile: Minsal ...,https://www.radioagricultura.cl/nacional/2020/09/05/muertes-por-coronavirus-llegan-a-11-551-en-chile-minsal-reporto-1-961-casos-nuevos.html,"El Ministerio de Salud informó este sábado un nuevo balance sobre la pandemia del coronavirus en el país. Según el reporte publicado en la web del Minsal, se reportaron 1.961 casos nuevos de COVID-19,",05-09-2020 15:10,https://www.bing.com/th?id=ON.13F5FFD91F0FE6BCB18010C7ECF1D238,Chile,Radio Agricultura
Nuevo reporte Minsal coronavirus en Chile 5 de septiembre ...,https://www.t13.cl/noticia/nacional/nuevo-reporte-coronavirus-chile-covid-19-muertos-contagios-05-09-2020,"Este sábado, el Ministerio de Salud (Minsal) reportó casi 2 mil nuevos contagios y 57 nuevas muertes por COVID-19 en las últimas 24 horas. Se registraron 57 nuevas muertes, por lo que el total de fall",05-09-2020 15:23,https://www.bing.com/th?id=ON.5A89F165BA450C260D9B9CF77518F013,Chile,T13
"Minsal informó 1.961 nuevos casos, llegando a 420.434 ...",https://www.adnradio.cl/nacional/2020/09/05/minsal-informo-1-961-nuevos-casos-llegando-a-420-434-contagiados-con-covid-19-en-chile.html,"Durante la mañana de este sábado el ministerio de Salud (Minsal) entregó a través de sus redes sociales un nuevo balance del estado de la pandemia del coronavirus Covid-19 en Chile, informando 1.961 n",05-09-2020 15:31,https://www.bing.com/th?id=ON.65E8A3DA97DEF897F762F02E0593C53D,Chile,ADN
Covid-19 en Chile: 57 personas murieron en las últimas 24 ...,https://www.adnradio.cl/nacional/2020/09/05/covid-19-en-chile-57-personas-murieron-en-las-ultimas-24-horas-segun-el-deis.html,"El Ministerio de Salud reportó este sábado 57 fallecidos producto del coronavirus Covid-19 en las últimas 24 horas, según información entregada por el Departamento de Estadística en Información de Sal",05-09-2020 15:31,https://www.bing.com/th?id=ON.32C18758FED6C87D869CAC1AEFADDA01,Chile,ADN
"Pese a no existir norma de COVs en Chile, ENAP potencia ...",https://www.elmostrador.cl/agenda-pais/2020/09/05/pese-a-no-existir-norma-de-covs-en-chile-enap-potencia-plan-de-inversion-para-disminuir-de-manera-importante-sus-emisiones/,"En plena pandemia de Covid-19, ENAP está trabajando activamente en un plan de reducción de sus Compuestos Orgánicos Volátiles (COVs) en todas sus operaciones. Pese a que no existe una norma que regule",05-09-2020 16:12,https://www.bing.com/th?id=ON.0F6AE18DFA7E30691D061D71E4628C1D,Chile,El Mostrador
El 10% fue clave para festival de clickeos del CyberDay,https://www.lacuarta.com/cronica/noticia/clave-festival-clickeos-cyberday/541823/,"Este ingreso extraordinario más el cambio de hábitos de compras de los consumidores, que ahora prefieren hacerlo de manera online, sería el motivo del alza en las ventas que este año se duplicaron. De",05-09-2020 16:38,https://www.bing.com/th?id=ON.FA8B1579F40394111B9F8E89E927EE1E,Chile,La Cuarta
Experto afirma que con el cambio de hora aumenta el riesgo ...,http://www.lanacion.cl/experto-afirma-que-con-el-cambio-de-hora-aumenta-el-riesgo-de-covid-19/,"El horario de verano comenzará a regir a contar de las 24:00 horas de este sábado 5 de septiembre, momento en que los relojes deberán adelantarse en una hora en Chile continental, con excepción de la",05-09-2020 16:46,https://www.bing.com/th?id=ON.A4ABFEF7E58641DD6FB2EBC782F803C5,Chile,La Nación
Ministerio de Salud reportó 1.961 casos nuevos de COVID-19 ...,https://www.puranoticia.cl/noticias/nacional/ministerio-de-salud-reporto-1-961-casos-nuevos-de-covid-19-en-el-pais/2020-09-05/113446.html,"Este sábado, el Ministerio de Salud reportó 1.961 casos nuevos de COVID-19, de los cuales 1.368 corresponden a personas sintomáticas y 538 no presentan síntomas. Además, se registraron 55 test PCR Pos",05-09-2020 16:48,https://www.bing.com/th?id=ON.01E694D5C69580006B4E44132D00DE28,Chile,Puranoticia.cl
