name,url,description,datePublished,imagen,pais,Fuente
Botillerías con caña por “Ley Seca” en Linares en pandemia,https://www.lacuarta.com/cronica/noticia/botillerias-cana-ley-seca-linares/539801/,"Desde el viernes y durante dos semanas rige medida alcaldicia en la ciudad del Maule para supermercados, minimarket y almacenes con patentes de copete. Abogado dice que la medida es ilegal. “Estamos c",30-08-2020 04:29,https://www.bing.com/th?id=ON.73C0E0396F84FB6779D5E2B9165AD79A,Chile,La Cuarta
Estudiante de Diseño fabrica extensores y escudos faciales ...,https://www.uchile.cl/noticias/167022/estudiante-de-diseno-fabrica-extensores-y-escudos-faciales,"Disebel es el nombre de la empresa que diseña y fabrica insumos para enfrentar la pandemia desde la comuna de Salamanca, Región de Coquimbo. El emprendimiento de Belén Lagos, estudiante de Diseño Indu",02-09-2020 00:14,https://www.bing.com/th?id=ON.F1FB1EA14FF2FD291E27D31F3EF3A816,Chile,uchile.cl
1.410 nuevos casos de Covid-19 en Chile que totaliza 413 ...,https://www.itvpatagonia.com/noticias/1-410-nuevos-casos-de-covid-19-en-chile-que-totaliza-413-145-diagnosticados-32-fallecidos-en-la-ultima-jornada/,"El ministerio de Salud entregó este martes un nuevo balance respecto al estado de avance del coronavirus en nuestro país, confirmando un total de 11.321 fallecidos y 413.145 contagiados hasta las 21:0",02-09-2020 01:23,https://www.bing.com/th?id=ON.6EC71C412D7F43F6163832A674F460A3,Chile,ITV
Chile anota 1.415 casos nuevos y 32 muertes por Covid en ...,http://www.ladiscusion.cl/chile-anota-1-415-casos-nuevos-y-32-muertes-por-covid-en-las-ultimas-horas/,"El Ministerio de Salud (Minsal) informó esta jornada que en las últimas 24 horas se confirmaron 1.415 contagios positivos por Covid-19, que corresponden a 926 casos con síntomas, 436 asintomáticos y 5",02-09-2020 03:12,https://www.bing.com/th?id=ON.69574E7BFF463648F47596A9BAF49081,Chile,La Discusión
Coordinadora de Educación expuso ante el CORE e instó al ...,http://www.eldivisadero.cl/noticia-59315,Coyhaique-. La Coordinadora Social de Educación por Aysén expuso al Consejo Regional diversas materias que preocupan a las comunidades educativas y en particular lo relativo al retorno de actividades,02-09-2020 04:30,https://www.bing.com/th?id=ON.90F0D9662E2F7D4DDFBAC29A82EAFC8A,Chile,Diario el Divisadero
"COVID-19, el Congreso y las prescripciones éticas de la ...",https://www.elmostrador.cl/destacado/2020/09/02/covid-19-el-congreso-y-las-prescripciones-eticas-de-la-ley-ricarte-soto/,"Los principios de derechos humanos y éticos que fundamentan los ensayos clínicos, tienen validez universal y su relativización en función de una realidad nacional o de una situación epidémica, introdu",02-09-2020 05:12,https://www.bing.com/th?id=ON.932E57C952AEE8CE6D29BE53BEF68581,Chile,El Mostrador
Estado de Derecho y Pandemia – Diario Chañarcillo,http://www.chanarcillo.cl/estado-de-derecho-y-pandemia/,"La grave crisis sanitaria que nos afecta ha remecido profundamente nuestra vida desafiando, a la vez, la solidez de nuestro Estado Democrático de Derecho, obligando a nuestros gobernantes a limitar ci",02-09-2020 06:01,https://www.bing.com/th?id=ON.E63F6F56951EF65A2CC1F77599F6EBFA,Chile,Diario Chanarcillo
Cinco meses subiendo sin parar y por encima de los US$ 3 ...,http://www.chanarcillo.cl/cinco-meses-subiendo-sin-parar-y-por-encima-de-los-us-3-el-cobre-y-las-buenas-noticias-para-la-economia-chilena/,Poco a poco la situación de la economía chilena va mostrando síntomas de mejoría tras la peor crisis desde la década de los ochenta. Y en estos atisbos de brotes verdes una de las mejores noticias par,02-09-2020 06:01,https://www.bing.com/th?id=ON.B27130CB3B8F6DE956FB7AF25CAF9E3D,Chile,Diario Chanarcillo
Elecciones en EE.UU.: Qué problemas y posibles soluciones ...,https://www.emol.com/noticias/Internacional/2020/09/02/996708/EEUU-Elecciones-Coronavirus-Medidas-Prevencion.html,"A diferencia de Chile, los estadounidenses cuentan con la ventaja de poder votar anticipadamente por correo, una medida que ayudaría a solucionar parte de los obstáculos que presenta la pandemia al pr",02-09-2020 10:53,https://www.bing.com/th?id=ON.FB5C61652A56899EFB33702EFD0FD4FC,Chile,Emol
Movistar propone alianza público-privada para dar salto en ...,https://www.df.cl/noticias/empresas/entre-codigos/movistar-propone-alianza-publico-privada-para-dar-salto-en-inclusion/2020-09-01/210425.html,"Una buena evaluación de cómo ha funcionado el sistema de telecomunicaciones durante la pandemia, realizó el presidente y CEO de Movistar Chile, Roberto Muñoz, en el marco del 8° Summit País Digital. E",02-09-2020 12:33,https://www.bing.com/th?id=ON.C44EEF9E4B25F4072CBE48D4FCF070D6,Chile,df.cl
Encuesta: 57% de los profesores se encuentra en estado ...,https://www.meganoticias.cl/nacional/312379-profesores-teletrabajo-agotamiento-extremo-burnout-encuesta-fundacion-chile-cgx02.html,Una encuesta realizada por la Fundación Chile arrojó el nivel de agotamiento de los docentes en medio de la pandemia de coronavirus que los ha obligado a hacer clases a distancia. Se trata de la encue,02-09-2020 12:46,https://www.bing.com/th?id=ON.AD625C8A8782687AF4C977B5393370A8,Chile,meganoticias
Argentina se acerca a los 9.000 muertos por COVID-19 | El ...,https://www.elperiodista.cl/argentina-se-acerca-a-los-9-000-muertos-por-covid-19/,"El Ministerio de Salud indicó que este martes hubo 10.504 personas que dieron positivo a los testeos para totalizar 428.239 desde el inicio del registro, el 3 de marzo. Con las 259 muertes informadas",02-09-2020 13:05,https://www.bing.com/th?id=ON.E20059FC099E401BC49AD5DDF9DE444D,Chile,El Periodista
Covid-19 deja más de 857.000 muertos y de 25.807.000 en el ...,http://www.lanacion.cl/covid-19-deja-mas-de-857-000-muertos-y-de-25-807-000-en-el-mundo/,La pandemia de nuevo coronavirus ha provocado al menos 857.824 muertos en el mundo desde que la oficina de la Organización Mundial de la Salud (OMS) en China dio cuenta de la aparición de la enfermeda,02-09-2020 13:20,https://www.bing.com/th?id=ON.987548EDA4444E7650B18EFFA91D3393,Chile,La Nación
Crisis del sector gastronómico será abordada hoy por la ...,https://laprensaaustral.cl/cronica/crisis-del-sector-gastronomico-sera-abordada-hoy-por-la-comision-de-economia-del-senado/,Las cifras demuestran que el panorama es desolador y de futuro incierto. En 20 años se estima el retroceso que sufrirá el sector turismo producto de la pandemia. La apreciación de Fedetur no es simple,02-09-2020 14:13,https://www.bing.com/th?id=ON.9A1232889059010F8FCBFECE968E847B,Chile,La Prensa Austral
Claudio Bravo dio negativo en nuevo test... | Puranoticia,https://www.puranoticia.cl/noticias/deportes/claudio-bravo-dio-negativo-en-nuevo-test-realizado-para-detectar-el/2020-09-02/101228.html,"De igual forma, la mañana de este miércoles 2 de septiembre tuvo su primer entrenamiento grupal con el equipo de cara a la siguiente campaña. Claudio Bravo comenzó con todo su etapa en el Real Betis d",02-09-2020 14:20,https://www.bing.com/th?id=ON.25A5610E376B99816B0E407ED7EC4BB5,Chile,Puranoticia.cl
OvejeroNoticias Fuertes pérdidas de puestos de trabajo ...,https://www.ovejeronoticias.cl/2020/09/fuertes-perdidas-de-puestos-de-trabajo-registran-empresas-del-retail-en-chile-mas-de-23-000-trabajadores-despedidos/,"Los últimos reportes financieros de Ripley, Cencosud, Falabella, La Polar y Tricot -entregados la semana pasada- revelaron que al 30 de junio de 2020 operan con una dotación total de 240.555 empleados",02-09-2020 14:21,https://www.bing.com/th?id=ON.E1470953FC83842E00219F9BE5C50C96,Chile,Ovejero Noticias
Un septiembre diferente | ELPINGUINO.COM,https://elpinguino.com/noticia/2020/09/02/un-septiembre-diferente,"Constantemente la pandemia del Covid-19 nos ha puesto a pensar en cómo realizamos diferentes actividades para nuestros vecinos, especialmente en fechas tan importantes como nuestro aniversario y las f",02-09-2020 14:25,https://www.bing.com/th?id=ON.30D06193CB6A72C568EC72F29FCD39A7,Chile,ELPINGUINO
El Ciudadano | Comisión de Salud aprobó proyecto que ...,https://www.elciudadano.com/chile/comision-de-salud-aprobo-proyecto-que-declara-de-interes-publico-vacuna-y-tratamiento-contra-el-covid-19/09/01/,"Este martes, la Comisión de Salud de la Cámara de Diputadas y Diputados aprobó y despachó a Sala el proyecto de ley que propone declarar de interés público la vacuna y eventuales tratamientos para com",02-09-2020 14:46,https://www.bing.com/th?id=ON.C16285E509E5DCFFB5BBD4C4B19D5BF9,Chile,El Ciudadano
Funcionarios Serviu tras presentación de colega Covid ...,http://www.eldivisadero.cl/noticia-59325,"Coyhaique.- Este martes funcionarios del Serviu Región de Aysén, agrupados en la Asociación de Funcionarios Los Patagones, emitieron un comunicado público donde declaran sentirse “vulnerados y afectad",02-09-2020 16:22,https://www.bing.com/th?id=ON.F460E17BCB3D5AD52A66D8F4426FB886,Chile,Diario el Divisadero
Comienza segundo proceso de inscripción a la Prueba de ...,https://www.itvpatagonia.com/noticias/comienza-segundo-proceso-de-inscripcion-a-la-prueba-de-transicion-2021/,Más de 234 mil jóvenes se inscribieron durante el primer proceso a través del portal acceso.mineduc.cl para rendir la evaluación que permitirá postular a las 43 universidades adscritas al Nuevo Sistem,02-09-2020 16:25,https://www.bing.com/th?id=ON.461D16C09F4669D60CC15503CF47D841,Chile,ITV
Pancho Saavedra encabezará brindis online por el Día del ...,https://www.cooperativa.cl/noticias/economia/sectores-productivos/agricultura/pancho-saavedra-encabezara-brindis-online-por-el-dia-del-vino/2020-09-02/080344.html,"Celebración se llevará a cabo este viernes 4 de septiembre a las 20:00 horas. Recuerda nuestra campaña ""Todos podemos hacer más"", si tienes una iniciativa solidaria que quieras comunicar, llámanos al",02-09-2020 16:29,https://www.bing.com/th?id=ON.290952EF0C576727A2F5F894FFFD14BD,Chile,Radio Cooperativa
"Tren a Chillán suma nuevas detenciones, a dos... | Puranoticia",https://www.puranoticia.cl/noticias/regiones/tren-a-chillan-suma-nuevas-detenciones-a-dos-semanas-de-retomar-su/2020-09-02/121928.html,"Por la incorporación de nuevas estaciones, se van a seguir tomando las medidas de higiene para evitar contagios de Covid-19 entre los pasajeros. A dos semanas de retomar su funcionamiento y con el obj",02-09-2020 16:38,https://www.bing.com/th?id=ON.DC93C62298341CD15FBA345FDCB691C5,Chile,Puranoticia.cl
La cruda realidad de los profesores que teletrabajan por ...,https://www.elperiscopio.cl/destacado-1/la-cruda-realidad-de-los-profesores-que-teletrabajan-por-pandemia-covid-19/,Una nueva encuesta realizada por la Fundación Chile demostró que los docentes se encuentran muy agotados en medio de la nueva modalidad de enseñanza que están teniendo en medio de la pandemia de coron,02-09-2020 16:39,https://www.bing.com/th?id=ON.34019E69E993F7E1E45ED147476451FB,Chile,elperiscopio.cl
Chile acumula más de 414 mil casos de coronavirus | Tele 13,https://www.t13.cl/noticia/nacional/minsal-chile-balance-coronavirus-02-09-2020,"El Ministerio de Salud (Minsal) realizó, durante la jornada de este miércoles, un balance sobre la pandemia del nuevo coronavirus COVID-19 cuyos primeros casos en el país se registraron en marzo de es",02-09-2020 16:42,https://www.bing.com/th?id=ON.547DF24975B2AD708FE289C2502D67E9,Chile,T13
Minsal informó 1.582 nuevos casos y ya son 414.739 los ...,https://www.adnradio.cl/nacional/2020/09/02/minsal-informo-1-582-nuevos-casos-y-ya-son-414-739-los-contagiados-con-covid-19-en-chile.html,"Durante la mañana de este martes el ministro de Salud, Enrique Paris, encabezó un nuevo balance respecto del estado de la pandemia del coronavirus Covid-19 en Chile, informando que hubo 1.582 nuevos c",02-09-2020 16:50,https://www.bing.com/th?id=ON.2BAAF717F706E9F5EF4009650DFF23E5,Chile,ADN
Covid-19 en Chile: 23 personas murieron en las últimas 24 ...,https://www.adnradio.cl/nacional/2020/09/02/covid-19-en-chile-23-personas-murieron-en-las-ultimas-24-horas-segun-el-deis.html,"El Ministerio de Salud informó este lunes que 23 personas murieron producto del Covid-19, en las últimas 24 horas, según el Departamento de Estadísticas e Información de Salud (DEIS). El subsecretario",02-09-2020 16:50,https://www.bing.com/th?id=ON.23D89C696BBC4C31377BC8DBF46FD296,Chile,ADN
Minsal reporta 23 decesos y 1.582 casos nuevos ...,https://www.emol.com/noticias/Nacional/2020/09/02/996790/Minsal-balance-coronavirus.html,"En un nuevo balance de la pandemia, el Ministerio de Salud (Minsal) informó 23 muertes por covid-19 según datos Departamento de Información y Estadísticas (DEIS) de la cartera, lo que eleva el total n",02-09-2020 16:57,https://www.bing.com/th?id=ON.B5E1F6636887C960BF2EB215269C58C9,Chile,Emol
Minsal informó 6 nuevas comunas que salen de cuarentena en ...,https://www.prensafutbol.cl/365499-minsal-informo-6-nuevas-comunas-que-salen-de-cuarentena-en-chile/,"El ministerio de Salud entregó el informe del avance del COVID-19, el cual registró 23 fallecidos durante el último día, lo que aumentó la cifra a 11.344 decesos en Chile. Además, los 1.582 nuevos con",02-09-2020 17:02,https://www.bing.com/th?id=ON.AB755076301FE66A34A643E75BA10650,Chile,Prensafútbol
Reporte de Covid-19 en Chile registra 1.582 casos nuevos ...,https://www.lacuarta.com/cronica/noticia/reporte-covid-19-chile-2/540895/,"En total los contagios acumulan 414.739 personas en nuestro país. Durante la mañana de este miércoles, el Ministerio de Salud reportó 1.582 casos nuevos de COVID-19, de los cuales 1.114 corresponden a",02-09-2020 17:05,https://www.bing.com/th?id=ON.2CDBCDC8B0B23E5AB76C7DF6B740D334,Chile,La Cuarta
El Ciudadano | El Ciudadano | Donaciones a El Ciudadano,https://www.elciudadano.com/donaciones/,"Que exista periodismo independiente en Chile y Latinoamérica también depende de ti. Una sociedad plural y democrática necesita de diferentes miradas del mundo. Desde El Ciudadano, diaria y oportunamen",02-09-2020 17:06,https://www.bing.com/th?id=ON.AA77867EFF217D3CA493944E66FEA309,Chile,El Ciudadano
Las proyecciones de la Universidad de Washington: América ...,https://www.elmostrador.cl/dia/2020/09/02/las-proyecciones-de-la-universidad-de-washington-america-latina-llegara-a-casi-medio-millon-de-muertes-por-covid-19-en-diciembre/,"América Latina tiene menos del 10 % de la población del mundo, pero sus muertos por COVID-19 son el 25 % del total y para diciembre de este año habrá acumulado 495.000 fallecidos desde el inicio de la",02-09-2020 17:19,https://www.bing.com/th?id=ON.62EAF0F80B7BE1ABB1F0FE98FBA2DA65,Chile,El Mostrador
Reportan 1.582 casos nuevos y 23 fallecidos por Covid – La ...,http://www.ladiscusion.cl/143105-2/,"El Ministerio de Salud (Minsal) informó este miércoles que en las últimas horas se confirmaron 1.582 contagios por Covid-19, de los cuales 1.114 casos con síntomas, 418 asintomáticos y 50 con PCR posi",02-09-2020 17:46,https://www.bing.com/th?id=ON.52893C06AABAF56EEBCAB41E86F6469C,Chile,La Discusión
Garin: “Había que ganar como sea” | La Prensa Austral,https://laprensaaustral.cl/deportes/garin-habia-que-ganar-como-sea/,"Cristian Garin (19º ATP) logró una espectacular remontada ante el estadounidense Ulises Blanch (244º) y avanzó la noche del pasado lunes a la segunda ronda del US Open, el segundo torneo que se juega",02-09-2020 17:48,https://www.bing.com/th?id=ON.EE3D458ADE55A841056830399A5B65CC,Chile,La Prensa Austral
Vacuna de Oxford contra COVID-19 comienza Fase 3 en Chile ...,https://www.t13.cl/noticia/nacional/vacuna-oxford-covid-19-fase-3-chile-02-09-2020,"Los primeros ensayos clínicos de la vacuna produjeron una respuesta inmunitaria importante y demostraron ser seguros para los pacientes, por lo que su eficacia debe ser establecida en un ensayo de fas",02-09-2020 18:15,https://www.bing.com/th?id=ON.0C1111411BB2B37CEFE3904A7697E965,Chile,T13
Crisis en Clínica Las Condes: médicos evalúan acciones ...,https://www.latercera.com/pulso/noticia/crisis-en-clinica-las-condes-medicos-evaluan-acciones-legales-y-administrativas-por-actuar-de-directorio-y-controlador/RPXFK5QA7NGWBC6URXIJD3TVHQ/,"El cuerpo médico de Clínica Las Condes (CLC), conformado por más de 500 profesionales, decidió hacer pública su visión y preocupación respecto de las decisiones que ha venido tomado la administración",02-09-2020 18:22,https://www.bing.com/th?id=ON.E8941D34B89EAB818EC609CAC2902DEB,Chile,LA TERCERA
"Teletrabajo, un viejo conocido que llegó al rescate | Canal.la",https://www.canal.la/28857-Teletrabajo-un-viejo-conocido-que-llego-al-rescate.html,"El teletrabajo no es algo reciente o desconocido para el mundo tecnológico. En las últimas décadas, gran cantidad de organizaciones han venido integrando procesos y plataformas para que sus colaboradores realicen sus labores y accedan a los recursos digitales que requieren sin tener que estar",02-09-2020 19:19,https://www.bing.com/th?id=ON.467A1631B9C6F558F14A19AC98F1AF5F,Chile,canal.la
Plebiscito: Organización Panamericana de la Salud llama a ...,https://www.cooperativa.cl/noticias/sociedad/salud/coronavirus/plebiscito-organizacion-panamericana-de-la-salud-llama-a-privilegiar-el/2020-09-02/124052.html,En su reporte semanal la Organización Panamericana de la Salud (OPS) abordó la situación que enfrentará Chile el próximo 25 de octubre con la realización del Plebiscito Constitucional en medio de la p,02-09-2020 19:27,https://www.bing.com/th?id=ON.12A0A60CD5BFD6ECAEBCBAE25D3FAAD9,Chile,Radio Cooperativa
