name,url,description,datePublished,imagen,pais,Fuente
Reportan 52 nuevos casos de Covid 19 con PCR positivos; 30 Coyhaique y 13 Aysén,https://www.rln.cl/destacado/87395-reportan-52-nuevos-casos-de-covid-19-con-pcr-positivos-30-coyhaique-y-13-aysen,"Durante el reporte de la Seremi de Salud de este viernes 28 de mayo se informó que en las últimas horas se confirmaron 52 nuevos casos de Covid 19 con PCR positivos. Aysén. - Según se detalló, de esto",28-05-2021 23:18,https://www.bing.com/th?id=OVFT.cvrC3TR4-lKXDAkrY3lBTi,Chile,Radio las Nieves
"51 casos nuevos con covid-19 en Colchagua, 21 en Cardenal Caro",http://www.diarioelmarino.cl/2021/05/30/__trashed/,"Este domingo se confirmaron 432 casos nuevos con covid-19 en la región de O’Higgins, elevando el total acumulado a 56.819 contagiados desde el inicio de la pandemia, de los",30-05-2021 17:10,https://www.bing.com/th?id=OVFT.nVR7djxDDyE9kOvmrPhatS,Chile,El Marino
COVID-19: ministros condenados por la ciencia y la realidad,https://www.elmostrador.cl/destacado/2021/05/31/covid-19-ministros-condenados-por-la-ciencia-y-la-realidad/,"Es esperable que la mortalidad por COVID-19 en Chile, corregida por el tamaño de la población, esté alrededor de las mortalidades de los países sobre los cuales la prensa diariamente nos informa que l",31-05-2021 05:13,https://www.bing.com/th?id=OVFT.uXAp888R-i-WaKysEmbyuS,Chile,El Mostrador
Vacunación Chile | ¿Me puedo vacunar si tuve o tengo Covid-19?,https://redgol.cl/tendencias/Vacunacion-contra-el-Covid-19--Es-posible-vacunarse-si-estuve-contagiado-o-estoy-actualmente-contagiado--20210531-0043.html,"En el caso de que una persona se encuentré actualmente contagiada, podrá inocularse una vez que haya cumplido el plazo de cuarentena.",31-05-2021 18:34,https://www.bing.com/th?id=OVFT.gmEgWI2k0I2niTMrc_x22y,Chile,redgol
Vacuna Covid-19 | ¿Cuándo se vacunan menores de edad?: ISP estudia vacunación entre 12 y 16 años,https://redgol.cl/tendencias/Vacuna-Covid-19--Cuando-se-vacunan-menores-de-edad-ISP-estudia-vacunacion-entre-12-y-16-anos-20210531-0051.html,"El ISP ya se encuentra estudiando la opción de vacunar a menores de entre 12 a 16 años en Chile Lunes de balance covid-19 en La Moneda, donde la autoridad reportó que la preocupante alza de casos aún",31-05-2021 18:35,https://www.bing.com/th?id=OVFT.RQFJxlxkG2jCTxWDRVtefi,Chile,redgol
Paris se emociona al agradecer el apoyo que le ha dado su prima en medio de la pandemia,https://www.meganoticias.cl/nacional/338616-ministro-enrique-paris-emocionado-prima-vacunacion-coronavirus-31-05-2021.html,"El ministro de Salud, Enrique Paris, se refirió este lunes a la campaña de vacunación contra el coronavirus. El secretario de Estado se emocionó previo al cierre el reporte diario de la pandemia, tras",31-05-2021 18:55,https://www.bing.com/th?id=OVFT.d6HhR-Q5d9hNyNuldLIkoy,Chile,meganoticias
Director del ISP: Desde el 1 de junio el Minsal puede añadir al calendario de vacunación a menores de 12 a 16 años,https://www.cnnchile.com/lodijeronencnn/director-isp-minsal-calendario-vacunacion-menores-12-16-anos_20210531/,"En conversación con CNN Chile, Heriberto García comentó los resultados del estudio clínico que investigó la inoculación a menores. Además, explicó que cuando se controle la pandemia podrán identificar",31-05-2021 19:02,https://www.bing.com/th?id=OVFT.Q0uMmL4s2eupS3l2R5d0cy,Chile,CNN Chile
"Tasa de desocupación nacional alcanzó 10,2% en el trimestre móvil febrero-abril de 2021",https://www.elperiodista.cl/2021/05/tasa-de-desocupacion-nacional-alcanzo-102-en-el-trimestre-movil-febrero-abril-de-2021/,"La estimación del total de ocupados descendió 1,6% en doce meses, incidida, principalmente, por los sectores hogares como empleadores (-17,0%), servicios administrativos y de apoyo (-15,7%) y alojamie",31-05-2021 19:09,https://www.bing.com/th?id=OVFT._L01c_daOz0HXyhvK8AcvC,Chile,El Periodista
ISP autoriza el uso de la vacuna Pfizer para menores desde los 12 años,https://www.emol.com/noticias/Nacional/2021/05/31/1022480/ISP-Pfizer-vacuna-ninos-1216anos.html,"""Mientras más vacunados tengamos, más rápido lograremos la inmunidad capullo"", destacó el director (s) del Instituto de Salud Pública.",31-05-2021 19:31,https://www.bing.com/th?id=OVFT.jxLNykd6pmCdIUu3UAIOcy,Chile,Emol
Dr. Germán Acuña y salida del Colmed de la Mesa Social COVID-19: “Nosotros no tenemos vocación de comparsas”,https://www.cnnchile.com/lodijeronencnn/german-acuna-colmed-no-vocacion-comparsas_20210531/,"El presidente del gremio en el Biobío fue enfático al decir que ""no queremos estar en una mesa que no sirve"", apuntando a que ""aparentemente las decisiones son tomadas por la mesa central, no sabemos",31-05-2021 19:48,https://www.bing.com/th?id=OVFT.SMIe-ZGa00bVIJB9N43N9S,Chile,CNN Chile
CHILE HACE UN LLAMADO A REDOBLAR LOS ESFUERZOS PARA FRENAR EL CAMBIO CLIMÁTICO,https://www.soberaniaradio.cl/publicacion/?idPublicacion=39993,"Santiago, Chile. Lunes 31 de mayo de 2021.- Un llamado urgente a redoblar los esfuerzos para frenar el cambio climático es el primer resultado de la cumbre de innovación en energía limpia más importan",31-05-2021 19:50,https://www.bing.com/th?id=OVFT.axUY3PsbLnIzZjKVlHjBIC,Chile,Soberania
Cámara Baja pide al gobierno campaña sobre síntomas y consecuencias del PIMS,https://www.eldesconcierto.cl/nacional/2021/05/31/camara-baja-pide-al-gobierno-campana-sobre-sintomas-y-consecuencias-del-pims.html,"Cabe recordar que el PIMS es un cuadro inflamatorio sistémico que es infrecuente, pero potencialmente letal. La enfermedad afecta especialmente a las niñas y niños, pero también a adolescentes.",31-05-2021 19:57,https://www.bing.com/th?id=OVFT.MYwZoO9h9IRDvy7XK8wQTy,Chile,eldesconcierto
ISP autorizó el uso de la vacuna contra el covid-19 de Pfizer desde los 12 años en adelante,https://www.adnradio.cl/nacional/2021/05/31/isp-autorizo-uso-de-la-vacuna-contra-el-covid-19-de-pfizer-desde-los-12-anos.html,Fuentes confirmaron a ADN que este grupo etario será incorporado en el proceso de vacunación después del 15 de junio.,31-05-2021 20:12,https://www.bing.com/th?id=OVFT.RH-IXLIjsd1Y6UgLU20KMi,Chile,ADN
ISP autoriza el uso de emergencia de la vacuna de Pfizer en menores desde los 12 años,https://www.duna.cl/noticias/2021/05/31/isp-autoriza-el-uso-de-emergencia-de-la-vacuna-de-pfizer-en-menores-desde-los-12-anos/,"Este lunes, el Instituto de Salud Pública (ISP) aprobó el uso de emergencia de la vacuna contra el covid-19 de Pfizer en Chile en niños desde los 12 años de edad. Según indicaron en el documento, “Pfi",31-05-2021 20:38,https://www.bing.com/th?id=OVFT.arPbEFfGw5VH7lUMYnIOmi,Chile,duna
63% de los hospitalizados en UCI no se ha vacunado contra el COVID-19,https://www.elperiodista.cl/2021/05/63-de-los-hospitalizados-en-uci-no-se-ha-vacunado-contra-el-covid-19/,"“El 63% de los hospitalizados en Unidades de Cuidados Intensivos no se ha vacunado contra el COVID-19, eso tiene que corregirse”, indicó el ministro de Salud, Enrique Paris, durante el balance de la p",31-05-2021 20:41,https://www.bing.com/th?id=OVFT.KO4m-mXcL_ciKY4L2npW_y,Chile,El Periodista
ISP autoriza la utilización de la vacuna Pfizer contra COVID-19 en menores de edad desde los 12 años,https://www.eldesconcierto.cl/nacional/2021/05/31/isp-autoriza-la-utilizacion-de-la-vacuna-pfizer-contra-covid-19-en-menores-de-edad-desde-los-12-anos.html,"Este lunes, el Instituto de Salud Pública dio su autorización para incluir a los menores de edad, desde los 12 años en adelante, en el calendario de vacunación con Pfizer. Según el ISP, la empresa “pr",31-05-2021 20:41,https://www.bing.com/th?id=OVFT.pInuIFflSPzd1Z4Bn1P8Xi,Chile,eldesconcierto
ISP autoriza vacunación con Pfizer en niños y niñas desde los 12 años,https://www.lacuarta.com/cronica/noticia/isp-autoriza-vacunacion-pfizer-ninos-ninas-desde-los-12-anos/638138/,"El director (s) del ISP, Heriberto García, confirmó que ""esta es una muy buena noticia para avanzar en la inmunidad capullo"".",31-05-2021 20:52,https://www.bing.com/th?id=OVFT.7O5wKLBM1uAdWqW_xtT_7S,Chile,La Cuarta
Edinson Cavani se vacuna contra el covid-19 y pide a los jóvenes incentivarse: “Seamos conscientes,https://www.publimetro.cl/cl/grafico-chile/2021/05/31/edinson-cavani-se-vacuna-contra-el-covid-19-y-pide-a-los-jovenes-incentivarse-seamos-conscientes.html,El delantero uruguayo se inoculó en su país e hizo un llamado a participar del proceso. “Puede ser algo muy importante para poder volver a darnos un abrazo”.,31-05-2021 21:13,https://www.bing.com/th?id=OVFT.VReajDR__j2-XUOmbjlydy,Chile,publimetro.cl
Pocas expectativas hay en Ñuble en torno al último Mensaje de Piñera,http://www.ladiscusion.cl/pocas-expectativas-hay-en-nuble-en-torno-al-ultimo-mensaje-de-pinera/,"Intensos son los preparativos para la ceremonia de la última Cuenta Pública del Presidente Sebastián Piñera, que se realizará este martes, a las 15 horas, en el Salón de Honor del Congreso en",31-05-2021 21:37,https://www.bing.com/th?id=OVFT.4JbS0zfAzirf1YZht9NFVy,Chile,La Discusión
"Salida del Colmed de la mesa social: Expertos abogan por ""buscar los caminos comunes"" y ""enfocarse en temas centrales""",https://www.emol.com/noticias/Nacional/2021/05/31/1022486/analisis-expertos-salida-colmed-gobierno.html,"Los especialistas, quienes han seguido de cerca la pandemia, enfatizan en que lo importante es tratar de ""hacer efectivas las estrategias que tenemos disponibles"".",31-05-2021 21:37,https://www.bing.com/th?id=OVFT.oQEE1DCL_rgswATX-mJa4y,Chile,Emol
La posible vacuna contra el Covid-19 que se está haciendo con plantas y que se probará en Argentina,https://www.duna.cl/noticias/2021/05/31/la-posible-vacuna-contra-el-covid-19-que-se-esta-haciendo-con-plantas-y-que-se-probara-en-argentina/,"La fase 3 de esta vacuna ya ha sido probada en Canadá, Estados Unidos, Reino Unido, México y en un futuro cercano en Brasil.",31-05-2021 21:43,https://www.bing.com/th?id=OVFT.h7cKjBAxDGQNEWt1YGerPy,Chile,duna
ISP autoriza uso de vacuna Covid-19 de Pfizer para niños mayores de 12 años,https://www.elmostrador.cl/dia/2021/05/31/isp-autoriza-uso-de-vacuna-covid-19-de-pfizer-para-ninos-mayores-de-12-anos/,"A través de una resolución, el ISP dice que “Pfizer Chile S.A. proporcionó información suficiente para demostrar que el uso de emergencia de la vacuna en personas mayores de 12 años es seguro y eficaz",31-05-2021 21:43,https://www.bing.com/th?id=OVFT.tTxJ6YQNruL-c6lMdtvNMi,Chile,El Mostrador
La Roja pierde a Arturo Vidal para las Eliminatorias,https://www.latercera.com/el-deportivo/noticia/la-roja-pierde-a-vidal-para-las-eliminatorias/XJSCC7ZBEVBCTLVDYAY32VKVXU/,"Debido a sus problemas de salud, el volante no será considerado por Martín Lasarte para los choques ante Argentina y Bolivia, por las clasificatorias rumbo al Mundial de Qatar.",31-05-2021 21:49,https://www.bing.com/th?id=OVFT.QRGwZtfEAE5a1J-T-kqoDS,Chile,LA TERCERA
Todo un boom: los importantes avances que la electromovilidad ha logrado en América Latina,https://www.theclinic.cl/2021/05/31/todo-un-boom-los-importantes-avances-que-la-electromovilidad-ha-logrado-en-america-latina/,"Según detalló Ultima Media, para el año 2030 el boom de la electromovilidad se dispararía a tal punto que habría más demanda de baterías que la producida.",31-05-2021 21:59,https://www.bing.com/th?id=OVFT.LL3AoSJ6ZJVXlBaR7us4uy,Chile,Clinic
ISP autorizó uso de emergencia de vacuna Pfizer para menores desde los 12 años,http://www.lanacion.cl/isp-autorizo-uso-de-emergencia-de-vacuna-pfizer-para-menores-desde-los-12-anos/,"Según el documento donde se aprobó el uso de emergencia, “Pfizer Chile S.A. proporcionó información suficiente para demostrar que el uso de emergencia de la vacuna en personas mayores a 12 años es seg",31-05-2021 22:05,https://www.bing.com/th?id=OVFT.1tbcPPV3B8t2yPgYDHa3Qi,Chile,La Nación
Una mujer y su amiga fueron víctimas de femicidio frustrado: Vecinos de San Miguel defendieron a las víctimas,https://www.chilevision.cl/contigo-en-directo/mejores-momentos/una-mujer-y-su-amiga-fueron-victimas-de-femicidio-frustrado-vecinos-de,Una mujer y su amiga que se encontraban en un edificio ubicado en San Miguel fueron atacadas por la ex pareja de una de ellas. El hombre ya tenía denuncias por casos similares y se encuentra prófugo.,31-05-2021 22:18,https://www.bing.com/th?id=OVFT.QKDXfk_UD_PGSUggsE3Xwy,Chile,chilevision.cl
Preocupante baja: Jugador de la ‘Roja’ fue liberado por COVID-19,https://www.prensafutbol.cl/412663-baja-sensible-jugador-de-la-roja-fue-liberado-por-covid-19/,"Malas noticias para la ´Roja´, debido a que uno de los jugadores del plantel de Martín Lasarte ha dado positivo por COVID-19 y será una baja sensible para esta fecha doble por Eliminatorias ante Argen",31-05-2021 22:47,https://www.bing.com/th?id=OVFT.jOg8JbjL-V4k7OhurP_zTi,Chile,Prensafútbol
Municipio de Puente Alto recibirá 1.500 millones de pesos extras para enfrentar la pandemia,https://www.puentealtoaldia.com/municipio-de-puente-alto-recibira-1-500-millones-de-pesos-extras-para-enfrentar-la-pandemia/,"La Subsecretaria de Desarrollo Regional y Administrativo informó la entrega de un tercer fondo solidario para los municipios, el que permitirá que las comunas puedan tener mayores recursos para enfren",31-05-2021 22:52,https://www.bing.com/th?id=OVFT.mW1X4pCdOxAyJL4R9rDNGS,Chile,Puente Alto al Dia
El covid-19 llegó a La Roja: miembro del plantel habría arrojado positivo,https://www.publimetro.cl/cl/grafico-chile/2021/05/31/primera-baja-chile-jugador-covid-19-no-estara-argentina.html,El jugador sería el primer contagio dentro del plantel de 30 futbolistas que trabajan en Pinto Durán de cara al partido del próximo jueves ante la albiceleste.,31-05-2021 23:00,https://www.bing.com/th?id=OVFT.QRWiqf7CygD9CHFt2zKs1y,Chile,publimetro.cl
Ministerio de Salud: El 63% de los hospitalizados en UCI no se ha vacunado contra el covid-19,https://www.adnradio.cl/nacional/2021/05/31/covid-19-uci-ministerio-de-salud-enrique-paris.html,"“Esto debe hacernos reflexionar de que los no vacunados tienen mucho más riesgo de enfermar”, dijo el ministro Paris.",31-05-2021 23:08,https://www.bing.com/th?id=OVFT.6RZvt2XdIUK1ER6v1ZZHvi,Chile,ADN
Colegio Médico abandona la mesa de Covid-19 por falta de transparencia,https://www.biobiochile.cl/biobiotv/programas/radiograma-biobiotv/2021/05/31/colegio-medico-abandona-la-mesa-de-covid-19-por-falta-de-transparencia.shtml,Revisa la edición de Radiograma Mediodía del lunes 31 de mayo junto a Nibaldo Mosciatti y Katherine Cubillos en Bio Bio TV. Revisa la edición de Radiograma Mediodía del lunes 31 de mayo junto a Nibald,31-05-2021 23:51,https://www.bing.com/th?id=OVFT.LlMEbEGVwlU5QBm3jmVgBy,Chile,Chile
ISP autorizó el uso de vacuna Pfizer en menores desde los 12 años,https://www.latercera.com/que-pasa/noticia/isp-autorizo-el-uso-de-vacuna-pfizer-en-menores-desde-los-12-anos/GVS52SFHCVBWBDMQ5FX66ZKEM4/,"Hace poco más de una semana la farmacéutica Pfizer solicitó al Instituto de Salud Pública (ISP) la autorización para utilizar su vacuna contra Covid-19 en menores de 12 a 16 años y hoy, la autoridad s",01-06-2021 00:00,https://www.bing.com/th?id=OVFT.XZ4Lr21XKQUHT6MN2RTNJS,Chile,LA TERCERA
"Aseguran que Arturo Vidal se contagió de COVID tras noche de pasión con ""señorita""",https://www.elperiscopio.cl/deportes/aseguran-que-arturo-vidal-se-contagio-de-covid-tras-noche-de-pasion-con-senorita/,Las redes sociales están explotando con la información que vincula al King con una mujer chilena. Así lo indicó Sergio Rojas en Me Late de UCV. El periodista dijo que Vidal habría tenido una noche muy,01-06-2021 00:01,https://www.bing.com/th?id=OVFT.sfR_SX2wPBhpfmBmAemCoS,Chile,elperiscopio.cl
Por su trabajo de seguridad en la pandemia Empresa Sigsa recibe sello Covid de ARCHS.,https://www.elrancaguino.cl/2021/05/31/por-su-trabajo-de-seguridad-en-la-pandemia-empresa-sigsa-recibe-sello-covid-de-archs/,"Para todos los sectores económicos la pandemia ha sido un gran desafío, mantener la producción y la seguridad de los",01-06-2021 00:03,https://www.bing.com/th?id=OVFT.jQcCapA5BfHePInNGp7fRC,Chile,elrancaguino.cl
Brasil: Gobierno prohíbe temporalmente la entrada de extranjeros al país por casos de covid-19,https://www.biobiochile.cl/noticias/internacional/america-latina/2021/05/31/brasil-gobierno-prohibe-temporalmente-la-entrada-de-extranjeros-al-pais-por-casos-de-covid-19.shtml,El gobierno de Brasil prohibió temporalmente la entrada en el país de extranjeros “de cualquier nacionalidad” por recomendación de,01-06-2021 00:16,https://www.bing.com/th?id=OVFT.ynxKubXxAm0A0VU3m68Oay,Chile,Chile
