name,url,description,datePublished,imagen,pais,Fuente
Nuevo reporte Minsal coronavirus en Chile 13 de septiembre ...,https://www.t13.cl/noticia/nacional/nuevo-reporte-coronavirus-chile-covid-19-muertos-contagios-13-09-2020,"El Ministerio de Salud (Minsal) reportó poco más de 2 mil nuevos contagios y 54 nuevas muertes por COVID-19 en las últimas 24 horas. Tras las 54 nuevas muertes, el total de fallecimientos asciende a 1",14-09-2020 02:43,https://www.bing.com/th?id=ON.BF687E91DA95E60F34162689A81DD4EF,Chile,T13
2.082 nuevos casos de Covid-19 en Chile que totaliza 434 ...,https://www.itvpatagonia.com/noticias/2-082-nuevos-casos-de-covid-19-en-chile-que-totaliza-434-748-diagnosticados-54-fallecidos-en-la-ultima-jornada/,"El Ministerio de Salud entregó este domingo un nuevo balance sobre la pandemia por coronavirus en el país. En la instancia, el ministro de Salud, Enrique Paris, dijo estar preocupado por las regiones",14-09-2020 03:07,https://www.bing.com/th?id=ON.06973A85545E73DBD403A4B0E8D036A1,Chile,ITV
Minsal reporta 54 decesos y nuevamente más de 2 mil ...,https://www.radiosantiago.cl/archivo/143329,"El Ministerio de Salud entregó este domingo un nuevo balance sobre la pandemia por coronavirus en el país. En la instancia, el ministro de Salud, Enrique Paris, dijo estar preocupado por las regiones",14-09-2020 03:51,https://www.bing.com/th?id=ON.80E20520EEC7F04E7194604A65EE8339,Chile,Radio Santiago
"Ministro Paris y contagios en regiones: ""Preocupado"" por ...",https://www.meganoticias.cl/nacional/313387-ministro-paris-contagios-regiones-tasa-de-positividad-coronavirus-los-rios-aysen-la-araucania-y-maule-jdx14.html,"Este domingo, en un nuevo balance diario sobre el estado de la pandemia de coronavirus en Chile, el ministro de Salud, Enrique Paris, expresó su preocupación por las regiones del país donde se han inc",14-09-2020 06:21,https://www.bing.com/th?id=ON.21659B1EF9652D6CDD7377F938519DBB,Chile,meganoticias
"""Estamos muy preocupados"": Chile vuelve a superar los 2 ...",https://www.theclinic.cl/2020/09/13/estamos-muy-preocupados-chile-vuelve-a-superar-los-2-000-casos-de-covid-19-en-ultimas-24-horas/,"Durante la jornada de este domingo el Ministerio de Salud informó que Chile volvió a superar los 2.000 casos de contagiados por Covid-19 en las últimas 24 horas. Sobre esta cifra, el ministro de Salud",14-09-2020 10:15,https://www.bing.com/th?id=ON.BBE536C0EC66D57621A17B76606A50EF,Chile,Clinic
"SanCarlosOnline: San Carlos, cuecas escolares en pandemia",https://www.sancarlosonline.cl/2020/09/san-carlos-cuecas-escolares-en-pandemia.html,Como una contribución a la Cultura y tradición de los estudiantes de San Carlos debido a la suspensión de clases presenciales producto del COVID-19 se ha anunciado la realización vía on line del Comun,14-09-2020 10:22,https://www.bing.com/th?id=ON.6124B0AEF3659E032F6CD7A3B7CEF02F,Chile,San Carlos Online
Enfermos leves de coronavirus pueden mantener síntomas ...,https://www.cooperativa.cl/noticias/sociedad/salud/coronavirus/enfermos-leves-de-coronavirus-pueden-mantener-sintomas-durante-meses/2020-09-13/114435.html,"Mujer argentina viajó 3.000 kilómetros ""a dedo"" para conocer a su pololo virtual y él la rechazó Las personas que se contagiaron de coronavirus y sufrieron síntomas leves pueden mantener éstos por var",14-09-2020 10:31,https://www.bing.com/th?id=ON.5AD3D8175FBA1B5C7C1296C74EF7F66A,Chile,Radio Cooperativa
Cómo abrieron los mercados internacionales - Diario Financiero,https://www.df.cl/noticias/mercados/mercados-en-accion/lo-que-debes-saber-este-lunes-antes-que-abra-el-mercado/2020-09-14/075523.html,"Una serie de anuncios de fusiones y adquisiciones, y el reinicio de las pruebas de una vacuna contra el Covid-19 impulsan el inicio de semana en los mercados. Las acciones tecnológicas lideran la sesi",14-09-2020 11:06,https://www.bing.com/th?id=ON.9080C7AE19316AD6E7AFE401EB69C52A,Chile,df.cl
Detienen a dos contagiados de covid-19 que arrancaron de ...,https://www.biobiochile.cl/noticias/nacional/region-de-magallanes/2020/09/14/detienen-a-dos-contagiados-de-covid-19-que-arrancaron-de-residencia-sanitaria-en-puerto-natales.shtml,"Dos personas fueron detenidas este fin de semana en Puerto Natales, luego que huyeran de una residencia sanitaria, en la que se encontraban tras dar positivo al examen PCR de covid-19. La información",14-09-2020 11:42,https://www.bing.com/th?id=ON.0F5DC019D692876EC219502154CE9561,Chile,Chile
La pandemia global y cuarentena agravan la crisis ...,https://elpinguino.com/noticia/2020/09/14/la-pandemia-global-y-cuarentena-agravan-la-crisis-economica-y-social-de-magallanes-,"A la crisis del turismo, se suma el cierre definitivo de Mina Invierno, la crisis de la centolla por falta de demanda, la caída generalizada de ventas y la pérdida de 18 mil empleos en un año, configu",14-09-2020 12:11,https://www.bing.com/th?id=ON.088FA68292B5A57101D0E449130D64E8,Chile,ELPINGUINO
Cinco universidades critican el plan “Fondéate en tu casa ...,http://www.lanacion.cl/cinco-universidades-critican-el-plan-fondeate-en-tu-casa-para-fiestas-patrias/,A la Mesa Social Covid-19 fue presentado el informe elaborado por cinco universidades chilenas que busca exponer ciertas observaciones en torno a la necesidad de incorporar una perspectiva comunitaria,14-09-2020 12:17,https://www.bing.com/th?id=ON.EEBCCE1BD98FCE6E62C1F41E4530B1E0,Chile,La Nación
"Aduanas: Exportaciones a China subieron 9,8%... | Puranoticia",https://www.puranoticia.cl/noticias/negocios/aduanas-exportaciones-a-china-subieron-9-8-entre-enero-y-agosto/2020-09-12/141358.html,"Según el Reporte de Comercio Exterior del Departamento de Estudios del Servicio Nacional de Aduanas, el intercambio comercial global entre Chile y China promedió US$25.020,9 millones. Las exportacione",14-09-2020 12:31,https://www.bing.com/th?id=ON.0FE0BAF49964394DC0546133541D516F,Chile,Puranoticia.cl
OCDE pide más esfuerzos a los países en la recuperación ...,https://www.emol.com/noticias/Economia/2020/09/14/997870/ocde-crecimiento-verde-covid.html,"Las medidas puestas en marcha por los países para que la reconstrucción económica tras el impacto de la covid-19 sea ecológica son buenas pero no suficientes, según un análisis publicado este lunes po",14-09-2020 12:53,https://www.bing.com/th?id=ON.3A4D326E9F74340035B3E70CD4D2B5B7,Chile,Emol
Lluvias aumentaron en un 20% capacidad de los embalses,https://www.lacuarta.com/cronica/noticia/lluvias-aumentaron-20-capacidad-los-embalses/544739/,"San Isidro ha soltado a la fecha la mayor cantidad de agua desde 2005. Sin embargo, la crisis hídrica sigue presente en nuestro territorio, ya que aún estamos lejos de superar la sequía que nos afecta",14-09-2020 13:31,https://www.bing.com/th?id=ON.78A1BA55BB7C7B91F290D12E27B56654,Chile,La Cuarta
Detienen a dos contagiados de covid-19 que escaparon de ...,https://elpinguino.com/noticia/2020/09/14/detienen-a-dos-contagiados-de-covid-19-que-escaparon-de-residencia-sanitaria-en-puerto-natales-,"La información fue dada a conocer la jornada del domingo por la Gobernación de Última Esperanza, que indicó que dispusieron a las FFAA, PDI y Carabineros la búsqueda de las dos personas. Dos personas",14-09-2020 13:37,https://www.bing.com/th?id=ON.9FE1F6451E00DD3656F5B982EFAFA7B9,Chile,ELPINGUINO
Coronavirus: Chile es el tercer país más afectado en ...,https://www.t13.cl/noticia/negocios/coronavirus-chile-tercer-pais-mas-afectado-empleo-estudio-14-09-2020,Un estudio de la Cámara de Comercio de Santiago plantea que unos 40 millones de empleos se han perdido a nivel global entre marzo y julio de este año a causa de la crisis del coronavirus COVID-19. Chi,14-09-2020 13:51,https://www.bing.com/th?id=ON.8532B0C00D7833F79948F3EFD8E2E66C,Chile,T13
Minsal informó 1.685 nuevos casos y hay un total de 436 ...,https://www.adnradio.cl/nacional/2020/09/14/minsal-informo-1-685-nuevos-casos-y-hay-un-total-de-436-433-contagiados-con-covid-19-en-chile.html,"Durante la mañana de este lunes el Ministerio de Salud entregó a través de sus redes sociales un nuevo balance respecto del estado de la pandemia del coronavirus Covid-19 en Chile, informando que hubo",14-09-2020 14:16,https://www.bing.com/th?id=ON.0CC802395821D9254955C966F4FDA17C,Chile,ADN
Minsal: Chile supera la barrera de 12 mil personas ...,https://www.lacuarta.com/cronica/noticia/minsal-reporta-64-personas/544815/,"Además, durante las últimas 24 horas, se reportaron 1.685 nuevos contagios. En un nuevo reporte diario, el Ministerio de Salud confirmó 1.685 casos de COVID-19, de los cuales 1.064 corresponden a pers",14-09-2020 14:27,https://www.bing.com/th?id=ON.668D4CE5A2DE714678E0C15C33A0281C,Chile,La Cuarta
La cifra de fallecidos por Covid-19 en el mundo supera los ...,http://www.lanacion.cl/la-cifra-de-fallecidos-por-covid-19-en-el-mundo-supera-los-924-000/,La pandemia de nuevo coronavirus ha provocado al menos 924.968 muertos en el mundo desde que la oficina de la Organización Mundial de la Salud (OMS) en China dio cuenta de la aparición de la enfermeda,14-09-2020 14:34,https://www.bing.com/th?id=ON.3A9622512BC60EAAE307E915B75B920E,Chile,La Nación
Balance del Covid-19 en Chile: Reportan 1.685... | Puranoticia,https://www.puranoticia.cl/noticias/nacional/balance-del-covid-19-en-chile-reportan-1-685-casos-nuevos-y-otras-64/2020-09-14/111556.html,"La cifra total de personas que han sido diagnosticadas con el coronavirus en el país alcanza a las 436.433. De ese total, 16.695 pacientes se encuentran en etapa activa del virus. El Ministerio de Sal",14-09-2020 14:35,https://www.bing.com/th?id=ON.B9FAC6663F25FEF4D883FB102F8AE735,Chile,Puranoticia.cl
"Reporte diario: 1.685 nuevos casos Covid, con una ...",https://www.cooperativa.cl/noticias/sociedad/salud/coronavirus/reporte-diario-1-685-nuevos-casos-covid-con-una-positividad-de-5-17/2020-09-14/110550.html,"El Minsal reportó este lunes 64 fallecidos, para llegar a un total de 12.013. La cifra global de contagiados en el país ya alcanza a los 436.433. La positividad diaria de los exámenes PCR aplicados en",14-09-2020 14:36,https://www.bing.com/th?id=ON.A5737EF096E251052CD7387F9F71F423,Chile,Radio Cooperativa
Conoce los requisitos para ser voluntario de potencial ...,https://www.elperiodista.cl/conoce-los-requisitos-para-ser-voluntario-de-potencial-vacuna-de-la-puc-contra-el-covid-19/,"El rector de la Pontificia Universidad Católica (PUC) y miembro de la Mesa Social COVID-19, Ignacio Sánchez, se refirió a los avances en los estudios de la vacuna contra el coronavirus que se realizan",14-09-2020 14:42,https://www.bing.com/th?id=ON.89F19AAB37215A1436C0322168127272,Chile,El Periodista
Fallecidos Covid certificados por el DEIS superan los 12 ...,https://www.elperiodista.cl/fallecidos-covid-certificados-por-el-deis-superan-los-12-mil-en-chile/,"El Ministerio de Salud reporta 1.685 casos nuevos de COVID-19, de los cuales 1.064 corresponden a personas sintomáticas y 561 no presentan síntomas. Además, se registraron 60 test PCR Positivo que no",14-09-2020 14:42,https://www.bing.com/th?id=ON.9F47BFBE12F19F54F9000BB543F7DF6F,Chile,El Periodista
Un respiro en pandemia: realizan sesiones abiertas y ...,https://www.elmostrador.cl/agenda-pais/2020/09/14/un-respiro-en-pandemia-realizan-sesiones-abiertas-y-gratuitas-de-mindfulness-on-line/,"Como una manera de fomentar el autocuidado y reducir el estrés, que se ve intensificado en contexto de crisis, la U. Austral abrió la iniciativa de Mindfulness y Compasión en tiempos de Covid-19. Con",14-09-2020 14:57,https://www.bing.com/th?id=ON.649C03B00A300ECEFE0AC3F6E540B6F5,Chile,El Mostrador
Chile es el tercer país con mayor pérdidas de empleos en ...,https://www.df.cl/noticias/economia-y-politica/laboral-personas/estudio-de-la-ccs-ubica-a-chile-como-el-tercer-pais-con-mayor-perdidas/2020-09-14/101815.html,"Chile es el tercer país a nivel global que en magnitud ha registrado las mayores pérdidas de empleos con una caída de 20,9% entre marzo y julio, según un estudio elaborado por la Cámara de Comercio de",14-09-2020 14:58,https://www.bing.com/th?id=ON.A6A00B23536920758ABB7D8CC29925FE,Chile,df.cl
Covid-19: Chile supera los 12 mil fallecidos y registra 1 ...,https://www.latribuna.cl/noticias/2020/09/14/covid-19-chile-supera-los-12-mil-fallecidos-y-registra-1-685-casso-nuevos.html,"A la fecha, 906 personas se encuentran hospitalizadas en Unidades de Cuidados Intensivos, de las cuales 689 están con apoyo de ventilación mecánica y 117 se encuentran en estado crítico de salud. En e",14-09-2020 15:01,https://www.bing.com/th?id=ON.21FCE6B3330DEDC83ECBA974EFB665A2,Chile,La Tribuna
Autoridad sanitaria decreta Cordón Sanitario para ...,http://web.elpatagondomingo.cl/2020/09/14/autoridad-sanitaria-decreta-cordon-sanitario-para-coyhaique-en-la-previa-de-fiestas-patrias/,"Este martes a partir de las 5:00 a.m. se aplicará la medida de manera indefinida. Este lunes, el Ministerio de Salud (Minsal) emanó la Resolución Exenta N°772 en la que resuelve un cordón sanitario pa",14-09-2020 15:11,https://www.bing.com/th?id=ON.E7BAE989A049356B034D2A05DA017483,Chile,EPD Noticias
Chile superó las 12 mil muertes inscritas por causa del ...,https://www.prensafutbol.cl/367226-chile-supero-las-12-mil-muertes-inscritas-por-causa-del-coronavirus/,"El ministerio de Salud entregó el informe diario del COVID-19, el cual registró 64 fallecidos registrados durante el último día, lo que aumentó la cifra a 12.013 decesos desde la aparición del virus a",14-09-2020 15:13,https://www.bing.com/th?id=ON.C85A2F4F82D1C386CE79D60AB9E77554,Chile,Prensafútbol
Covid-19 en Chile: 64 personas murieron en las últimas 24 ...,https://www.adnradio.cl/nacional/2020/09/14/covid-19-en-chile-64-personas-murieron-en-las-ultimas-24-horas-y-el-pais-supero-los-12-mil-decesos-confirmados-segun-el-deis.html,"El Ministerio de Salud informó este lunes que 64 personas murieron producto del Covid-19, en las últimas 24 horas, según el Departamento de Estadísticas e Información de Salud (DEIS). De acuerdo con e",14-09-2020 15:27,https://www.bing.com/th?id=ON.C4D1D41E96669E551C9DAD1EB91241C8,Chile,ADN
Estudio: Chile es el tercer país con mayor afectación en ...,https://www.latercera.com/pulso/noticia/estudio-chile-es-el-tercer-pais-con-mayor-afectacion-en-el-empleo-en-un-ranking-de-25-economias/CLYW4YUXINGMBHCSK7TLK7TJAI/,"Unos 40 millones de empleos se han destruido a nivel mundial entre marzo y julio de este año como consecuencia del Covid-19, siendo Chile uno de los países más afectados en términos de porcentaje de e",14-09-2020 15:37,https://www.bing.com/th?id=ON.290EC3C7A102A44D98018C74F17AD6D5,Chile,LA TERCERA
Más de 16 mil pacientes con Covid-19 en Chile se ...,https://redbiobio.com/nacional/mas-de-16-mil-pacientes-con-covid-19-en-chile-se-encuentran-en-etapa,"Actualmente hay 906 ciudadanos en la Unidad de Cuidados Intensivos. En un nuevo informe sobre el Covid-19 en Chile, se reportaron 1.685 casos, de los cuales, 1.064 corresponden a personas sintomáticas",14-09-2020 15:56,https://www.bing.com/th?id=ON.AE2B58CD498EACF56FA8A13F6CC2283A,Chile,Red Bio Bio
Más de 7.500 almuerzos ha entregado la red de comedores ...,http://www.diariolaregion.cl/mas-de-7-500-almuerzos-ha-entregado-la-red-de-comedores-populares-en-los-ultimos-tres-meses-a-vecinos-de-coquimbo/,"Tierras Blancas, Parte Alta, Lomas del Sauce, El Culebron, San Juan, Punta Mira, Villa Talinay. La Rinconada, Coquimbo Oriente y Villa El Faro, son algunos de los sectores que forman parte de esta red",14-09-2020 15:57,https://www.bing.com/th?id=ON.81D5442B1A18B6901E8FED53D4CB0632,Chile,La Region
OCDE pide más esfuerzos en la recuperación “verde” de las ...,https://www.elmostrador.cl/mercados/2020/09/14/ocde-pide-mas-esfuerzos-en-la-recuperacion-verde-de-las-economias-tras-la-pandemia/,"Las medidas puestas en marcha por los países para que la reconstrucción económica tras el impacto de la COVID-19 sea ecológica son buenas pero no suficientes, según un análisis publicado este lunes po",14-09-2020 16:13,https://www.bing.com/th?id=ON.B290057271792CABF734B7AB6F41A02B,Chile,El Mostrador
Gran brecha educacional por culpa de enseñanza online ...,https://www.publimetro.cl/cl/noticias/2020/09/14/gran-brecha-educacional-por-culpa-de-ensenanza-online.html,"Los escolares y universitarios del país están de vacaciones, una pausa dieciochera en medio de la ""nueva normalidad educativa"" que han vivido desde hace medio año junto a sus profesores, padres y apod",14-09-2020 16:35,https://www.bing.com/th?id=ON.A3E1BBAC9B0FA2080AF5DA01EC24B013,Chile,publimetro.cl
Coyhaique suma seis nuevos casos de Covid-19,http://www.eldivisadero.cl/noticia-59507,"Coyhaique-. Tres nuevos casos de Covid-19 fueron informados este lunes por la Seremi de Salud, Alejandra Valdebenito. Se trata de personas que fueron estudiadas durante el fin de semana, muchas de ell",14-09-2020 16:49,https://www.bing.com/th?id=ON.08E0574C35FEE4E03068E3B3184E52FF,Chile,Diario el Divisadero
Informe de la CCS indica que Chile es el tercer país más ...,https://www.biobiochile.cl/noticias/nacional/chile/2020/09/14/informe-de-la-ccs-indica-que-chile-es-el-tercer-pais-mas-afectado-en-empleo-durante-la-pandemia.shtml,"Un reporte realizado por la Cámara de Comercio de Santiago sitúa a Chile como el tercer país donde el empleo se ha visto más afectado a nivel global, siendo sólo superado por otras dos economías latin",14-09-2020 17:02,https://www.bing.com/th?id=ON.5F14FC83D7E486469D3F03ADE0A1BD91,Chile,Chile
