name,url,description,datePublished,imagen,pais,Fuente
"Tres meses, mil muertos: el perfil por comuna de las ...",https://www.latercera.com/la-tercera-domingo/noticia/tres-meses-mil-muertos-el-perfil-por-comuna-de-las-primeras-victimas-del-coronavirus-en-chile/I6LFGCVNCFFHPJ2KAWEG3PZETM/,"Tenemos que lamentar el primer fallecido en Chile por Covid-19. A las 14.16 horas del sábado 21 de marzo, y a través de su cuenta de Twitter, el ministro de Salud, Jaime Mañalich, informaba el primer",31-05-2020 03:52,https://www.bing.com/th?id=ON.3EAC7F591E750E79ACC63B5A6CB33707,Chile,LA TERCERA
Dos alcaldes menos y un municipio investigado: el mayo ...,http://www.ladiscusion.cl/dos-alcaldes-menos-y-un-municipio-investigado-el-mayo-negro-de-rn-en-nuble/,"Mayo comenzó de manera agitada para Renovación Nacional (RN) en la Región de Ñuble. En medio de la pandemia por Covid-19, el foco noticioso se trasladó a comienzos de mes hasta el municipio de Chillán, luego que fueran detenidos dos exfuncionarios (el exadministrador, Ricardo Vallejos, y el",31-05-2020 03:57,https://www.bing.com/th?id=ON.A7351F4C76294A11DCA5F95573E32315,Chile,La Discusión
"MagEx Starlet, el ""robot"" que llega a Magallanes para ...",https://www.biobiochile.cl/noticias/nacional/region-de-magallanes/2020/05/28/magex-starlet-robot-llega-magallanes-colaborar-combate-covid-19.shtml,"Este jueves se reportó la llegada a Punta Arenas de MagEx Starlet, un sistema automatizado diseñado para acelerar la detección de Covid-19. La máquina funciona autónomamente y detecta el virus mediant",31-05-2020 04:09,https://www.bing.com/th?id=ON.C41396EC6557EAE48D464069A21B16E9,Chile,Chile
Brechas de género se profundizarían y serían más evidentes ...,https://www.diarioconcepcion.cl/economia/2020/05/31/brechas-de-genero-se-profundizarian-y-serian-mas-evidentes-por-covid-19.html,"“Las brechas de género en este contexto de crisis sanitaria se hacen aún más evidentes y se profundizan”, afirma Lucía Saldaña, directora de la Dirección de Equidad de Género y Diversidad de la Univer",31-05-2020 04:16,https://www.bing.com/th?id=ON.119A79411DC62780A73E4203520B8E4A,Chile,El Diario de Concepcion
Cifras esperables: Autoridades explican la incidencia del ...,http://www.elquehaydecierto.cl/noticia/economia/cifras-esperables-autoridades-explican-la-incidencia-del-coronavirus-en-la-tasa-de-,"El Instituto Nacional de Estadística (INE) entregó la tasa de desocupados correspondiente al trimestre móvil febrero-marzo-abril 2020, es decir que la mitad del periodo de levantamiento de la encuesta",31-05-2020 04:21,https://www.bing.com/th?id=ON.0F91947679580FAE1288D3452739193A,Chile,El Quehay Decierto
Efecto Coronavirus: ¿Afectó a la pequeña minería de la ...,http://www.elquehaydecierto.cl/noticia/mineria/efecto-coronavirus-afecto-la-pequena-mineria-de-la-region-de-atacama,"El inicio de 2020 el área minería a nivel nacional se visualizaba de manera positiva gracias al anuncio de importantes proyectos, tales como Infraestructura Complementaria de Minera Los Pelambres (INC",31-05-2020 04:31,https://www.bing.com/th?id=ON.A91E7984131D046ED7AF3EB4C468B3F7,Chile,El Quehay Decierto
Tras su alta médica regresa a Santiago paciente de 30 años ...,http://www.elconcecuente.cl/noticia/salud/tras-su-alta-medica-regresa-santiago-paciente-de-30-anos-con-covid-19-trasladado-al-bi,"El sábado 16 de mayo se realizó uno de los primeros operativos aéreos de traslado de pacientes con coronavirus desde el Hospital Padre Hurtado en Santiago, al Hospital Guillermo Grant Bemavente de Con",31-05-2020 04:35,https://www.bing.com/th?id=ON.B9E6B85F42497C926FB6A0E3DDB81A55,Chile,El Conce Cuente
UCM aumenta su labor de apoyo para el diagnóstico regional ...,http://www.diarioelheraldo.cl/noticia/ucm-aumenta-su-labor-de-apoyo-para-el-diagnostico-regional-de-covid-19-ante-el-mayor-numero-de-casos-,"En respuesta al apoyo solicitado por la autoridad sanitaria, los investigadores coordinados por la Vicerrectoría de Investigación y Postgrado reforzarán los turnos para el diagnóstico del COVID-19 que",31-05-2020 04:40,https://www.bing.com/th?id=ON.D2193B0FB1F8FC9093EB4C335680E812,Chile,El Heraldo
Chile sumó más de 16 mil casos nuevos de Covid-19 en cinco ...,https://www.cooperativa.cl/noticias/sociedad/salud/coronavirus/chile-sumo-mas-de-16-mil-casos-nuevos-de-covid-19-en-cinco-dias/2020-05-30/223246.html,"Así lo arrojó el el Informe epidemiológico N° 21 del Minsal, que reconoce, por primera vez, que los ""casos recuperados"" no son personas recuperadas clínicamente. Hasta las 14:00 horas del 28 de mayo s",31-05-2020 04:56,https://www.bing.com/th?id=ON.56FA9ABB381FAADD436E5A866DC9705F,Chile,Radio Cooperativa
Los 10 rostros más expuestos en TV por la pandemia del ...,https://www.lacuarta.com/cronica/noticia/los-10-mas-expuestos-en-tv-por-la-pandemia/503834/,"En medio de la cobertura televisiva por la emergencia sanitaria, rostros nuevos y otros no tanto han tomado las vocerías para entregar claridad a la ciudadanía. Donaciones, información y trabajo en te",31-05-2020 05:13,https://www.bing.com/th?id=ON.4583E049FB68BFECE5294C14FC6A7BB9,Chile,La Cuarta
Los políticos del Bío Bío que se verían afectados por la ...,https://www.diarioconcepcion.cl/politica/2020/05/31/los-politicos-del-bio-bio-que-se-verian-afectados-por-la-retroactividad.html,Un polémico y álgido debate fue el que se vivió durante la semana en el Parlamento con el proyecto de ley que regula la reelección de autoridades. Es el numeral seis de la normativa el que generó mayo,31-05-2020 05:23,https://www.bing.com/th?id=ON.C728D184B1223789A1A59AD7503FDFB0,Chile,El Diario de Concepcion
Las cinco propuestas de la Mesa Covid-19 a La Moneda para ...,http://www.diariolabrador.cl/las-cinco-propuestas-de-la-mesa-covid-19-a-la-moneda-para-salir-de-crisis-economica-de-la-pandemia/,"La mesa social Covid-19 será la catalizadora de propuestas económicas para llevar adelante el acuerdo nacional al que convocó La Moneda y en la sesión de este viernes, según lo explicó el ministro del",31-05-2020 06:59,https://www.bing.com/th?id=ON.237973A7E562F3B074A3EC833FAA36C7,Chile,El Labrador
Informe Epidemiológico: Más de 3 mil niños menores de 10 ...,https://www.meganoticias.cl/nacional/303339-informe-epidemiologico-mas-3-mil-ninos-menores-10-anos-contagiados-coronavirus.html,"El último Informe Epidemiológico del coronavirus publicado por el Ministerio de Salud (Minsal), asegura que los niños menores de 10 años contagiados por el virus ascienden a más de 3.000 en todo el pa",31-05-2020 07:34,https://www.bing.com/th?id=ON.88971DE3C9DD9D9BC97FC7C0BDD494A5,Chile,meganoticias
Día Mundial Sin Tabaco: fumadores pueden desarrollar ...,http://www.lanacion.cl/dia-mundial-sin-tabaco-fumadores-pueden-desarrollar-sintomas-graves-en-caso-de-contagio-con-covid-19/,"Además de las enfermedades cardiovasculares, como los infartos al corazón y cerebrales, problemas en las arterias, aneurismas, ateromatosis, entre otras, la lista de problemas causados por el tabaco e",31-05-2020 12:03,https://www.bing.com/th?id=ON.439AD4205F56283E8566E6200034F3B6,Chile,La Nación
34 comunas no han registrado casos de covid-19 a casi tres ...,https://www.emol.com/noticias/Nacional/2020/05/31/987711/34-comunas-sin-casos-covid19.html,"Esta semana se cumplirán tres meses desde que se reportó el primer caso de covid-19 en el país y, si bien la enfermedad se ha propagado prácticamente en todos los rincones, aún hay 34 comunas que se m",31-05-2020 12:47,https://www.bing.com/th?id=ON.8F5AD582F30B2C4CEE6B4AB0B02B5046,Chile,Emol
Karla Rubilar dedica potente mensaje a Mañalich en medio ...,https://www.radioagricultura.cl/entretencion/2020/05/31/karla-rubilar-dedica-potente-mensaje-a-manalich-en-medio-de-polemica-por-posible-reemplazo.html,"La ministra vocera de Gobierno, Karla Rubilar, publicó un cariño mensaje en Instagram dedicado a su par de Salud Jaime Mañalich, en medio de la polémica que ambos protagonizaron por un “posible” reemp",31-05-2020 13:50,https://www.bing.com/th?id=ON.899574D204DB937FCB6096B28CB93173,Chile,Radio Agricultura
El alto riesgo de nuestros funcionarios de la salud ...,https://elpinguino.com/noticia/2020/05/31/el-alto-riesgo-de-nuestros-funcionarios-de-la-salud,"""En Magallanes hemos tenido a dos funcionarias en condición crítica por el Coronavirus"". La semana que cerramos hoy en sin duda una de las más tristes en lo que va de la pandemia del Coronavirus en Ch",31-05-2020 13:52,https://www.bing.com/th?id=ON.9632818428AD8110DA3D43F97E518197,Chile,ELPINGUINO
Informe epidemiológico revela que Puente Alto es la comuna ...,https://www.elmostrador.cl/dia/2020/05/31/informe-epidemiologico-revela-que-puente-alto-es-la-comuna-con-mas-casos-del-pais-y-que-hay-mas-de-tres-mil-menores-contagiados-de-coronavirus/,El Ministerio de Salud publicó el vigésimo primer Informe Epidemiológico sobre el Covid-19 en el país con información acumulada hasta las 14:00 horas del 28 de mayo de 2020. El documento reveló que 30,31-05-2020 14:07,https://www.bing.com/th?id=ON.F0E79D25C9FF1825F029ED2341F56EB6,Chile,El Mostrador
[Minuto a minuto] Detienen a 19 personas sorprendidas en ...,https://www.cnnchile.com/coronavirus/minuto-a-minuto-31-de-mayo_20200531/,"Según detalló Carabineros, entre los detenidos se encuentra el DJ, el organizador de la fiesta y al menos 3 de los detenidos son reincidentes, es decir, personas que ya han infringido con anterioridad",31-05-2020 14:52,https://www.bing.com/th?id=ON.C21240143D403351A15BE61C08805FA2,Chile,CNN Chile
Covid-19: Aparición temprana de enfermedades crónicas ...,https://www.latercera.com/que-pasa/noticia/covid-19-aparicion-temprana-de-enfermedades-cronicas-podria-aumentar-riesgo-de-portadores-de-vih/5ARQAXFIMBC5FIQL5QNWNFDBCQ/,La aparición temprana de enfermedades crónicas podría incrementar el riesgo de sufrir cuadros más severos de Covid-19 en personas portadoras del VIH mayores de 50 años. Esto es al menos 10 años que el,31-05-2020 15:38,https://www.bing.com/th?id=ON.C93D1DFB30CFAA4B2872CBEDB5915180,Chile,LA TERCERA
Día Mundial sin Tabaco: Fumadores tienen más... | Puranoticia,https://www.puranoticia.cl/noticias/nacional/dia-mundial-sin-tabaco-fumadores-tienen-mas-riesgo-de-contagiarse-de/2020-05-31/122123.html,"La coordinadora de la Comisión Tabaco de SER Chile sostuvo que ""este Día Mundial sin Tabaco tiene como lema proteger a los jóvenes de la manipulación de la industria y evitar que consuman tabaco y nic",31-05-2020 16:22,https://www.bing.com/th?id=ON.CBD0F9FFF770BDB3CE5AA9988D814613,Chile,Puranoticia.cl
Confirman que fumadores tienen más riesgo de contagio de ...,https://www.radioagricultura.cl/nacional/2020/05/31/confirman-que-fumadores-tienen-mas-riesgo-de-contagio-de-coronavirus.html,"En el Día Mundial Sin Tabaco, la Sociedad Chilena de Enfermedades Respiratorias (SER Chile) planteó los riesgos asociados al consumo de tabaco para personas contagiadas de COVID-19 y recordó que la pr",31-05-2020 16:40,https://www.bing.com/th?id=ON.E4BF280FD161863B0BA2AE20DA594626,Chile,Radio Agricultura
Blumel valora positivamente la gestión de Mañalich en ...,https://www.t13.cl/noticia/politica/blumel-gestion-manalich-pandemia-ha-hecho-trabajo-muy-importante,"El ministro de lnterior, Gonzalo Blumel, abordó el rol de su par de Salud, Jaime Mañalich, y aseguró que “ha hecho un trabajo muy importante” en su labor como cabeza de la contención de la pandemia de",31-05-2020 17:11,https://www.bing.com/th?id=ON.1FE7D5B0DFBCC0F5F338E62F43143DE5,Chile,T13
Ministro Moreno y la sequía en Chile: “Se ha dejado de ...,https://www.cnnchile.com/pais/ministro-moreno-sequia-agua-situacion-critica_20200531/,"En conversación con CNN Chile, el ministro de Obras Públicas, Alfredo Moreno, advirtió sobre la sequía que ha afectado al país desde hace más de 11 años y se refirió al plan de ayuda a sistemas de agu",31-05-2020 17:15,https://www.bing.com/th?id=ON.911FEB4A8BFADBF7C7558C78DF727FD8,Chile,CNN Chile
Muertes por Covid-19 en Chile ya se acercan a las mil: hay ...,https://www.biobiochile.cl/noticias/nacional/chile/2020/05/30/muertes-covid-19-chile-ya-se-acercan-las-mil-4-220-nuevas-casos.shtml,"El ministro de Salud, Jaime Mañalich; y la subsecretaria de Salud Pública, Paula Daza, entregaron este sábado un nuevo reporte con detalles de la propagación de la pandemia del coronavirus en Chile. D",31-05-2020 17:21,https://www.bing.com/th?id=ON.69D345A85D6493FDA13315DFFCA8F93E,Chile,Chile
“Propuestas para evitar una catástrofe”: Científicos ...,https://www.radiosantiago.cl/archivo/131660,"Un grupo de 40 expertos, científicos y divulgadores de diversas ramas lanzó hoy una carta abierta al presidente Sebastián Piñera, con el objetivo de “evitar en Chile una catástrofe nacional por la pro",31-05-2020 17:25,https://www.bing.com/th?id=ON.BAA3BBDC5270F8A4833D036C919C8564,Chile,Radio Santiago
Coronavirus en Chile: Mil muertos y casi 100 mil ...,https://www.t13.cl/noticia/nacional/coronavirus-chile-mil-muertes-covid-19-contagios-31-05-2020,"Este domingo, Chile superó los mil muertos y los 99 mil contagiados por COVID-19. Esto luego de la actualización de las cifras ligadas al coronavirus en nuestro país. En el detalle, se reportaron 4.83",31-05-2020 17:33,https://www.bing.com/th?id=ON.2F3A4AA459A3A04B9175FCFF2A6598FB,Chile,T13
Chile superó los 1.000 fallecidos por el Covid-19 mientras ...,https://www.cooperativa.cl/noticias/sociedad/salud/coronavirus/chile-supero-los-1-000-fallecidos-por-el-covid-19-mientras-que/2020-05-31/104027.html,"La cifra de recuperados alcanza los 42.727 personas, informó hoy el Ministerio de Salud. En un día se registraron 4.830 casos nuevos en Chile, con la Región Metropolitana que más casos contabiliza. El",31-05-2020 17:39,https://www.bing.com/th?id=ON.4DB36EC2E2EF49CB1F553F1A85765D3A,Chile,Radio Cooperativa
CHILE SUPERA LOS MIL FALLECIDOS POR COVID – 19,http://www.radiopolar.com/noticia_157788.html,Ud. es el visitante nro.:,31-05-2020 17:41,https://www.bing.com/th?id=ON.50818C9665BBD5076A04994E592C35EC,Chile,Radio Polar
Chile supera el millar de muertos por... | Puranoticia,https://www.puranoticia.cl/noticias/nacional/chile-supera-el-millar-de-muertos-por-coronavirus-nueva-cifra-record-de/2020-05-31/134404.html,"El Ministerio de Salud informó que hasta las 21 horas de anoche se registraron otros 57 fallecimientos por covid-19, cifra récord a la fecha, con lo cual el total acumulado superó el umbral del millar",31-05-2020 17:48,https://www.bing.com/th?id=ON.483358A2E66244972F740336A9AE5855,Chile,Puranoticia.cl
Chile superó los 1.000 fallecidos por Covid-19 y los ...,http://www.lanacion.cl/chile-supero-los-1-000-fallecidos-por-covid-19-y-los-contagiados-se-elevaron-a-99-688/,"Subsecretaria de Salud Pública, Paula Daza, informó que este sábado se notificaron 57 nuevos decesos por el coronavirus. Se registraron también 4.830 casos nuevos, de los cuales 4.437 presentaron sínt",31-05-2020 17:47,https://www.bing.com/th?id=ON.ABD59E8919A86DBD8EDA0ABD84A7E380,Chile,La Nación
Minsal confirma 4.830 nuevos casos Covid-19 y fallecidos ...,https://elpinguino.com/noticia/2020/05/31/minsal-confirma-4830-nuevos-casos-covid-19-y-fallecidos-superan-los-1000-con-57-nuevas-muertes,"En cuanto a recuperados, la subsecretaria Paula Daza confirmó que la cifra llegó a 42.627. Este domingo, el Ministerio de Salud informó sobre 4.830 nuevos casos de Covid-19 en Chile, elevando el total",31-05-2020 17:47,https://www.bing.com/th?id=ON.09D6AB19603F6BA95ABC2ACBF491908D,Chile,ELPINGUINO
Urgente: Chile superó los 1.000 fallecidos por coronavirus,https://www.elperiscopio.cl/destacado-1/urgente-chile-supero-los-1-000-fallecidos-por-coronavirus/,Este domingo 31 de mayo se realizó el habitual reporte de contagiados y muertos por COVID-19. El Ministerio de Salud confirmó este domingo que Chile superó las 1.000 personas fallecidas por el Covid-1,31-05-2020 17:50,https://www.bing.com/th?id=ON.E353EDEC26FEFC5DA1AF9CAAF4A11DC3,Chile,elperiscopio.cl
Covid-19: Investigadores y académicos exigen a Piñera un ...,https://www.elciudadano.com/chile/covid-19-investigadores-y-academicos-exigen-a-pinera-un-cambio-urgente-de-estrategia-para-evitar-una-catastrofe/05/31/,"A través de una carta, agrupaciones de académicos y académicas emplazaron al Presidente Sebastián Piñera a «cambiar de rumbo» y aplicar las propuestas técnicas para evitar una «catástrofe» por el Covi",31-05-2020 17:50,https://www.bing.com/th?id=ON.9FFFBCB34959B70B0B51FB833BAF1BCC,Chile,El Ciudadano
Reporte del Minsal: Chile anota peak de muertes diarias y ...,https://www.elmostrador.cl/destacado/2020/05/31/reporte-del-minsal-chile-anota-peak-de-muertes-diarias-y-los-fallecidos-por-covid-19-ya-superan-los-mil/,"El Ministerio de Salud confirmó este domingo que en las últimas 24 horas murieron 57 persona a causa del coronavirus, lo que elevó la cifra total a 1.054 fallecidos. Además, en la última jornada, se r",31-05-2020 17:55,https://www.bing.com/th?id=ON.8206AE1828999477CE65D49C43277FC4,Chile,El Mostrador
Nuevo reporte de Covid-19 se eleva a 99.688 contagiados ...,https://www.lacuarta.com/cronica/noticia/reporte/503930/,"La cifra de recuperados alcanza los 42.727 personas, según informó el Ministerio de Salud. Durante la tarde de este domingo 31 de mayo, la  subsecretaria de Salud Pública Paula Daza, entregó un nuevo",31-05-2020 18:05,https://www.bing.com/th?id=ON.40495F88BA412DE773270D082BDEAB6A,Chile,La Cuarta
Chile superó los mil fallecidos y se acerca a los 100 mil ...,https://www.prensafutbol.cl/356528-chile-supero-los-mil-fallecidos-y-se-acerca-los-100-mil-contagiados/,"En una nueva jornada, el Ministerio de Salud entregó las últimas cifras que arrojó el reporte diario de la actividad del COVID-19. Con 4.830 nuevos casos de infectados y 57 fallecidos más, el gobierno",31-05-2020 18:04,https://www.bing.com/th?id=ON.F213F7FB73525FE6DF6D954FC826E13C,Chile,Prensafútbol
