name,url,description,datePublished,imagen,pais,Fuente
Más de la mitad de los pacientes Uci ha llegado desde otras regiones,https://laprensaaustral.cl/2021/04/25/mas-de-la-mitad-de-los-pacientes-uci-ha-llegado-desde-otras-regiones/,"En 2020 Magallanes registró el mayor número de aeroevacuaciones al norte del país. En lo que va del año 37 pacientes han sido derivados a la capital. “Estos aviones son una Uci en el aire”, y no podía",25-04-2021 12:36,https://www.bing.com/th?id=OVFT.7_ZGszs91wYKtY8cumZM_y,Chile,La Prensa Austral
Informe epidemiológico: Los Ángeles dentro de las cinco comunas con más casos activos de todo el país,https://www.latribuna.cl/coronavirus/2021/04/25/informe-epidemiologico-los-angeles-dentro-de-las-cinco-comunas-con-mas-casos-activos-de-todo-el-pais.html,"ste sábado, el 114° Informe Epidemiológico emitido por el Ministerio de Salud reportó más de 32.800 muertes y 58 mil casos activos de COVID-19 en Chile. De acuerdo con el documento, hay 58.349 casos a",25-04-2021 13:18,https://www.bing.com/th?id=OVFT.9qzGYK7_ZYUSXkD_-UIUiy,Chile,La Tribuna
Identifican en Ecuador variante del SARS-CoV-2 ya detectada en Chile y Perú,https://www.elmostrador.cl/noticias/mundo/2021/04/25/identifican-en-ecuador-variante-del-sars-cov-2-ya-detectada-en-chile-y-peru/,"Según un informe oficial, Ecuador sumó este sábado 1.448 nuevos contagios por covid-19 para un acumulado de 372.754 positivos desde que empezó el registro de la pandemia en el país, el 29 de febrero d",25-04-2021 14:02,https://www.bing.com/th?id=OVFT.edQdPMDYzoHsIU54gGyhfi,Chile,El Mostrador
"Chimbarongo, San Fernando, Rengo y Graneros, son las comunas que presentan los peores indicadores de covid en la región.",https://www.elrancaguino.cl/2021/04/25/chimbarongo-san-fernando-rengo-y-graneros-son-las-comunas-que-presentan-los-peores-indicadores-de-covid-en-la-region/,"Por: Gisella Abarca. En la región de O’Higgins son 21 las comunas que se mantienen en cuarentena total. Una de ellas, Rengo que lleva más de dos meses en la extrema medida que",25-04-2021 14:51,https://www.bing.com/th?id=OVFT.kHXGpR906tifgic3-FD5Xy,Chile,elrancaguino.cl
Balance Covid de domingo: más de 6600 nuevos casos en Chile,https://www.lacuarta.com/cronica/noticia/cifras-coronavirus-chile-domingo-25-abril-2021/626853/,"El Ministerio de Salud reportó este domingo en su balance 6.638 casos nuevos de COVID-19, de los cuales 4.386 corresponden a personas sintomáticas y 1.746 no presentan síntomas",25-04-2021 15:48,https://www.bing.com/th?id=OVFT.mXebTvzvyNjCgFmIWzPkPy,Chile,La Cuarta
Contagios por COVID-19 alcanza cifras récord en el mundo: India reportó 350 mil casos,https://www.cnnchile.com/mundo/covid-19-record-contagios-india_20210425/,"Con estos nuevos récords, los casos globales desde el inicio de la pandemia ascienden a 145 millones sin que se vislumbre por ahora el peak de esta cuarta ola global, mientras que las muertes ya super",25-04-2021 17:04,https://www.bing.com/th?id=OVFT.sJ0vxbxkcIXGix-zrJNm4C,Chile,CNN Chile
COVID-19 alcanza récord de 900 mil contagios diarios en el mundo: 350 mil en India,https://www.chvnoticias.cl/internacional/covid-19-record-contagios-india_20210425/,"Con estos nuevos récords, los casos globales desde el inicio de la pandemia ascienden a 145 millones sin que se vislumbre por ahora el peak de esta cuarta ola global, mientras que las muertes ya super",25-04-2021 17:06,https://www.bing.com/th?id=OVFT.WergE2Df3JQZ6idGQFEe7S,Chile,chvnoticias
Vacunan a personas en situación de calle de Albergue Protege de Rancagua.,https://www.elrancaguino.cl/2021/04/25/vacunan-a-personas-en-situacion-de-calle-de-albergue-protege-de-rancagua/,"El Intendente Ricardo Guzmán junto a los seremis de Desarrollo Social y Familia, y de Salud, Mónica Toro y Pablo",25-04-2021 17:41,https://www.bing.com/th?id=OVFT.EpP2HCgDdxCXRWxapFxi8i,Chile,elrancaguino.cl
Chile suma 114 fallecidos y más de 6.600 casos de Covid-19,https://www.elmostrador.cl/destacado/2021/04/25/chile-suma-114-fallecidos-y-mas-de-6-600-casos-de-covid-19/,"El país vive desde hace un mes los momentos más críticos de la segunda ola de la pandemia, que se agravó tras las vacaciones de verano y que ha puesto contra las cuerdas al sistema hospitalario.",25-04-2021 18:00,https://www.bing.com/th?id=OVFT.FYNFL965kZzJfjbYJLw1YC,Chile,El Mostrador
Minsal informó 6.638 casos nuevos de COVID-19 en Chile,https://radioportales.cl/sitio/minsal-informo-6-638-casos-nuevos-de-covid-19-en-chile/,"Este domingo, el Ministerio de Salud (Minsal) reportó 6.638 nuevos contagios y 114 muertes en las últimas 24 horas producto de la pandemia de coronavirus en Chile. La autoridad sanitaria precisó que 6",25-04-2021 18:22,https://www.bing.com/th?id=OVFT.ighuoZQt8t3VXU1kxX97zC,Chile,Radio Portales
Homenajean a víctimas del Covid-19 con 30 cruces en las escalinatas de la Catedral,http://www.lanacion.cl/homenajean-a-victimas-del-covid-19-con-30-cruces-en-las-escalinatas-de-la-catedral/,"El Presidente de la Asociación Nacional de Comunicadores Cristianos de Chile, Marco Milla, señaló sobre el Memorial: ""Cuesta sacar palabras cuando se trata de hacer memoria sobre hechos dolorosos de m",25-04-2021 18:25,https://www.bing.com/th?id=OVFT.dwmMYZ_NxOVue7GilXP7fy,Chile,La Nación
Calendario Vacunación Covid-19 | ¿Cuándo me toca? Conoce quién se vacuna desde este lunes 26 de abril,https://redgol.cl/tendencias/Calendario-Vacunacion-Covid-19--Cuando-me-toca-Conoce-quien-se-vacuna-desde-este-lunes-26-de-abril-20210425-0037.html,"El proceso de vacunación en Chile ha sido uno de los más eficientes del mundo. Ese dato no se puede desmentir, dado la alta tasa de vacunas administradas en todo el país. Sin embargo, se ha generado r",25-04-2021 18:46,https://www.bing.com/th?id=OVFT.S53L97LmL-L6fOxB5m6xZS,Chile,redgol
ME-O pidió convertir las próximas elecciones en un “plebiscito” para sacar a Sebastián Piñera,https://www.elperiscopio.cl/destacado-1/me-o-pidio-convertir-las-proximas-elecciones-en-un-plebiscito-para-sacar-a-sebastian-pinera/,"""Los invito a no soltar la presión, a no aflojar, este hombre funciona a presión"", dijo este sábado el ex candidato presidencial del PRO.",25-04-2021 19:22,https://www.bing.com/th?id=OVFT.9U94cvTcxU31CGNTDrC8Cy,Chile,elperiscopio.cl
Perú: Ex presidente Martín Vizcarra dio positivo al COVID-19,https://www.cnnchile.com/coronavirus/peru-martin-vizcarra-positivo-covid19_20210425/,"""Pese a los cuidados necesarios para evitar llevar el virus a casa, mi esposa y yo hemos dado positivo"", informó el ex mandatario, quien hace una semana fue inhabilitado por el Congreso peruano para e",25-04-2021 19:28,https://www.bing.com/th?id=OVFT._TVxYd-EafDeOtAtXzjgmC,Chile,CNN Chile
Llega a Chile nueva variante de Covid-19 llamada C.37,https://redgol.cl/tendencias/-C.37-la-variante-chileno-peruana-de-Covid-19--Nueva-variante-de-Covid-llega-a-Chile--Casos-covid-hoy-Chile-20210425-0058.html,"Esta nueva variante del virus,  se ha expandido rápidamente por Chile y Perú, con más presencia que la cepa británica y brasileña.",25-04-2021 21:16,https://www.bing.com/th?id=OVFT.tXHFDSb4Z8Vw-XqiauV6BS,Chile,redgol
Más de mil millones de personas en el mundo han recibido la vacuna contra el coronavirus,https://www.elciudadano.com/mundo/mas-de-mil-millones-de-personas-en-el-mundo-han-recibido-la-vacuna-contra-el-coronavirus/04/25/,"Unas mil millones de personas en todo el mundo han recibido, hasta la fecha, la vacuna contra el coronavirus, de acuerdo con recuentos basados en datos oficiales.",25-04-2021 22:05,https://www.bing.com/th?id=OVFT.8pm9dtIWGqwMDFq2iWfZLS,Chile,El Ciudadano
"Óscar Castro, actor y fundador del Teatro Aleph, muere por complicaciones derivadas del COVID-19",https://www.chvnoticias.cl/show/oscar-castro-fundador-teatro-aleph-muere-covid-19_20210425/,"Este domingo se confirmó el deceso del destacado artista chileno radicado en Francia. ""Intérprete, director y gestor que dedicó su vida al teatro en Chile y el extranjero, con un compromiso inclaudica",25-04-2021 22:12,https://www.bing.com/th?id=OVFT.6S2zrNVSdJlmU_PqkogQRy,Chile,chvnoticias
Gasto militar mundial aumentó en 2020 pese a la pandemia de coronavirus,https://www.elperiodista.cl/2021/04/gasto-militar-mundial-aumento-en-2020-pese-a-la-pandemia-de-coronavirus/,"Los gastos militares siguieron incrementándose hasta alcanzar casi dos billones de dólares en 2020 en el mundo, con Estados Unidos y China a la cabeza, pese a la pandemia de coronavirus, según un info",25-04-2021 23:24,https://www.bing.com/th?id=OVFT.9CAzD6UJtrvdqObjRAitBy,Chile,El Periodista
Clínicas móviles y un nuevo vacunatorio se suman a la batalla contra el coronavirus y la influenza en zonas rurales del sur de Chile,https://www.latercera.com/nacional/noticia/clinicas-moviles-y-un-nuevo-vacunatorio-se-suman-a-la-batalla-contra-el-coronavirus-y-la-influenza-en-zonas-rurales-del-sur-de-chile/LSMOEIAPBFGCPNDRCNVRLJ2LQI/,"En las regiones de Biobío y La Araucanía estas clínicas recorren lugares alejados apoyando la campaña de vacunación contra el Covid 19 y también la de la influenza. Además, en Nacimiento se acondicion",26-04-2021 00:42,https://www.bing.com/th?id=OVFT.y8Z4Jd7LcmR6tlefQfnw5i,Chile,LA TERCERA
Urge una dosis de empatía en Chile,https://www.granvalparaiso.cl/opinion/urge-una-dosis-de-empatia-en-chile/,"Por Carlos Guajardo Castillo Académico de la Facultad de Educación, UCEN La necesidad de empatía en estos tiempos de pandemia, se ha visto trastocada a partir de situaciones tan simples a los ojos del",26-04-2021 03:30,https://www.bing.com/th?id=OVFT.lTBK_HaqeMuCiDdsbtfRZy,Chile,granvalparaiso.cl
Cadem: Aprobación del Presidente Piñera alcanza el nivel más bajo de su segundo mandato con un 9%,https://www.24horas.cl/politica/cadem-aprobacion-pinera-9---4752606,"Asimismo, un 17% de los encuestados dice que ha recibido el Bono de Clase Media, frente a un 69% que afirmó que debería recibirlo",26-04-2021 08:25,https://www.bing.com/th?id=OVFT.kSKrY1FT_R0v3k_M8MTjFi,Chile,24 Horas Chile
LSG 1603 “ALACALUFE”: 32 AÑOS DE SERVICIO EN LAS ZONAS MÁS AUSTRALES DE CHILE,https://www.soberaniaradio.cl/publicacion/?idPublicacion=39814,"La Lancha de Servicio General 1603 “Alacalufe” cumple el 26 de abril 32 años al servicio de la Patria, desarrollando distintas tareas en las zonas aisladas más australes de nuestro territorio nacional",26-04-2021 11:55,https://www.bing.com/th?id=OVFT.G2FT5gYqpT3wS4hDGr4dYS,Chile,Soberania
Franja horaria,http://www.ladiscusion.cl/franja-horaria/,"La última Encuesta Nacional de Salud (2017) reveló que en Chile, un 39.8% de la población tiene sobrepeso, un 31.2% tiene obesidad y un 3.2% tiene obesidad mórbida. Es decir, casi tres de cada",26-04-2021 12:11,https://www.bing.com/th?id=OVFT.9ho4UlhnBAUmrZLSSaqzsy,Chile,La Discusión
Exportador de cerezas de Negrete relata experiencia de productores en China en medio de pandemia,https://www.latribuna.cl/destacados/2021/04/26/exportador-de-cerezas-de-negrete-relata-experiencia-de-productores-en-china-en-medio-de-pandemia.html,"En la industria cerecera jamás se había vivido un impacto de tal magnitud, siendo únicamente comparable con la crisis de las uvas chilenas en los años ochenta, que tensionó la relación comercial con E",26-04-2021 12:45,https://www.bing.com/th?id=OVFT.srmlNa4Of3-MgJyR9_bQzi,Chile,La Tribuna
EMPRESA REGIONAL ADHERIDA A ISL ES DESTACADA EN MATERIA DE PREVENCIÓN A NIVEL PAÍS,http://radiopolar.com/noticia_166219.html,"En el marco del “Mes de la Prevención”, las autoridades del trabajo en la región dieron a conocer esta jornada la exitosa experiencia en materia de prevención de riesgos laborales de la empresa Cecina",26-04-2021 12:45,https://www.bing.com/th?id=OVFT.AWhh4Varqs-krAKSAyQiqi,Chile,Radio Polar
Minsal afirma que en mayo llegarán vacunas contra el covid-19 desarrolladas por CanSino,https://www.biobiochile.cl/noticias/nacional/chile/2021/04/26/minsal-afirma-que-en-mayo-llegaran-vacunas-contra-el-covid-19-desarrolladas-por-cansino.shtml,El Ministerio de Salud afirmó que durante mayo llegará el primer lote de vacunas contra el covid-19 desarrolladas por,26-04-2021 14:29,https://www.bing.com/th?id=OVFT.xBW4GGAjZlaqWTuEJz_vUS,Chile,Chile
Por qué las embarazadas deben vacunarse,https://www.latercera.com/opinion/noticia/por-que-las-embarazadas-debieran-poder-vacunarse/IKJ7YDPDSVGFVJEDZ6GZGQRSDY/,"Sabemos que el coronavirus afecta a las embarazadas directa y gravemente (Galang 2021). Tenemos a mano buenos datos. A nivel internacional, un estudio que analizó a casi 400 mil gestantes entre 15 y 4",26-04-2021 15:30,https://www.bing.com/th?id=OVFT.78H39TI56eZ_-hMJPdVDaC,Chile,LA TERCERA
Puente Alto en cuarentena,https://www.puentealtoaldia.com/puente-alto-en-cuarentena/,Seis de la mañana con cinco minutos y desde la estación Plaza de Puente Alto sale el primer tren con destino a Tobalaba atestado de gente que seguramente no guarda conciencia que esta semana se cumpli,26-04-2021 15:38,https://www.bing.com/th?id=OVFT.yUL9QXKQT_nqqDCyQIpDPi,Chile,Puente Alto al Dia
"Presidente de Uruguay dice que no tomará ""más medidas"" anticovid pese a la ""triste realidad"" del país",https://www.emol.com/noticias/Internacional/2021/04/26/1019049/Uruguay-Lacalle-medidas-coronavirus.html,"Luis Lacalle Pou afirmó que la situación ""se revierte con la vacunación, con el cuidado personal y, obviamente, con la llegada rápida a la internación y a los tratamientos intensivos"".",26-04-2021 15:44,https://www.bing.com/th?id=OVFT.jxLNykd6pmCdIUu3UAIOcy,Chile,Emol
Unión Portuaria mantiene llamado a paro para apoyar a quienes no han recibido ningún bono,https://www.elciudadano.com/actualidad/union-portuaria-mantiene-llamado-a-paro-para-apoyar-a-quienes-no-han-recibido-ningun-bono/04/26/,"La Unión Portuaria de Chile confirmó que se mantiene el llamado a paro nacional convocado para este lunes, pese al la noche del domingo el presidente Sebastián Piñera anunciara un proyecto alternativo",26-04-2021 17:07,https://www.bing.com/th?id=OVFT.ZHkvsswoLVYcvfNkxEyy8i,Chile,El Ciudadano
Sernac alerta que hay más trotadoras que podrían presentar riesgo de electrocución a quien las use,https://www.biobiochile.cl/noticias/economia/tu-bolsillo/2021/04/26/sernac-alerta-que-hay-mas-trotadoras-que-podrian-presentar-riesgo-de-electrocucion-a-quien-la-use.shtml,"El pasado 8 de abril, el Servicio Nacional del Consumidor (Sernac) confirmó una alerta de seguridad por casi 5.000",26-04-2021 17:07,https://www.bing.com/th?id=OVFT.KjEkoLmYZnrxd3uxGgbr4i,Chile,Chile
