name,url,description,datePublished,imagen,pais,Fuente
Los famosos que ya se vacunaron contra el covid,https://www.pauta.cl/ciencia-y-tecnologia/celebridades-que-se-vacunaron-covid,Anthony Hopkins se sumó a la lista de celebridades que mostraron en sus redes sociales su proceso de inoculación.,29-01-2021 21:47,https://www.bing.com/th?id=OVFT.Q9m0yoGEMMZtzNHESdzGti,Chile,pauta
Presidente Piñera por nuevo proyecto de retiro desde AFP ...,https://www.24horas.cl/politica/presidente-pinera-por-nuevo-proyecto-de-retiro-desde-afp--la-red-de-proteccion-social-va-a-seguir-4631669,"El Mandatario enfatizó en la red de protección social del Estado y comentó respecto a la respuesta al COVID-19 que ""Chile lo está haciendo bien dentro de las tremendas dificultades que enfrentamos"".",29-01-2021 21:50,https://www.bing.com/th?id=OVFT.YkR7nyx8KTNKB6AKDyYUlC,Chile,24 Horas Chile
Gobierno por restricción de exportaciones de vacunas de la ...,https://www.emol.com/noticias/Nacional/2021/01/29/1010779/RREE-medida-unilateral-UE-pfizer.html,"Tras encabezar el consejo anual de gabinete, el Mandatario se refirió a la decisión del organismo internacional, que comunicó este viernes que las vacunas producidas en Europa solamente podrán abandon",29-01-2021 22:07,https://www.bing.com/th?id=OVFT.u7LoUd32bqmbTTV0M7q-Xy,Chile,Emol
Diferencias y similitudes entre las vacunas Coronavac de ...,https://www.24horas.cl/data/diferencias-y-similitudes-entre-las-vacunas-coronavac-de-sinovac-y-pfizer-biontech-4629420,Además revisa el calendario y los grupos de la población que serán inmunizados primero en el plan de vacunación.,29-01-2021 22:19,https://www.bing.com/th?id=OVFT.Zsr35CTJjsWZAWoesoCbOS,Chile,24 Horas Chile
Federación de enfermeros y enfermeras de Chile alertan ...,https://www.eldesconcierto.cl/nacional/2021/01/29/federacion-de-enfermeros-y-enfermeras-de-chile-alertan-contagios-covid-19-podrian-llegar-a-40-mil-casos-diarios.html,"Considerando que durante la primera ola a nivel local, el peak de contagios se produjo en invierno, y dada la evolución de la pandemia, «el actual contexto hace pensar que, durante los meses fríos de",29-01-2021 22:43,https://www.bing.com/th?id=OVFT.m4y8OXsUg6tFLzE1zEAfIC,Chile,eldesconcierto
Presidente Piñera reacciona al control de exportación ...,https://www.radioagricultura.cl/nacional/2021/01/29/presidente-pinera-reacciona-al-control-de-exportacion-implementado-por-ue-a-vacunas-covid-19-chile-tiene-ventaja.html,El Presidente Sebastián Piñera se refirió al anuncio de la Unión Europea (UE) sobre la implementación de un control de exportación,29-01-2021 23:23,https://www.bing.com/th?id=OVFT.KidqNLPpKOC3qeuNgLYojC,Chile,Radio Agricultura
Cuarentenas: Las comunas que retroceden de fase en el Plan ...,https://www.meganoticias.cl/dato-util/325715-comunas-cuarentena-ptx21.html,"Revisa los cambios en el plan Paso a Paso para este sábado 30 de enero donde cinco comunas deberán pasar a cuarentena por la pandemia de COVID-19 en el país, desde las 5 de la mañana de esa jornada.",30-01-2021 00:15,https://www.bing.com/th?id=OVFT.FyRExc5pLWk_EdmrZy1uYS,Chile,meganoticias
Colombia iniciará campaña de vacunación contra el COVID-19 ...,https://www.t13.cl/noticia/mundo/colombia-vacunacion-febrero-29-01-2021,"La idea que nosotros tenemos es cerrar este primer trimestre del año garantizando al menos un millón de colombianos que tengan la vacuna, dijo el presidente Iván Duque.",30-01-2021 00:43,https://www.bing.com/th?id=OVFT.0MdYBsU0gs5hkeod183noC,Chile,T13
El Ciudadano | Presentan proyecto de ley para sancionar a ...,https://www.elciudadano.com/chile/presentan-proyecto-de-ley-para-sancionar-a-las-autoridades-que-adelanten-su-vacunacion/01/29/,"La idea es ""prevenir y evitar que cualquier autoridad utilice sus privilegios y sus fueros, para vacunarse antes"", dijo Leiva.",30-01-2021 01:02,https://www.bing.com/th?id=OVFT.e-7gYE7xog1nzXHTA34mzy,Chile,El Ciudadano
Congreso aprobó extender la vigencia de las licencias de ...,https://www.elperiscopio.cl/destacado-1/congreso-aprobo-extender-la-vigencia-de-las-licencias-de-conducir/,"La prórroga despachada establece que aquellas personas cuyos permisos caducaron en 2020, o lo harán en 2021, podrán realizar el trámite de renovación el próximo año.",30-01-2021 02:16,https://www.bing.com/th?id=OVFT.oNS4j9_44WMfgp1GEpJw3S,Chile,elperiscopio.cl
715 traslados aéreos de pacientes críticos COVID-19 se han ...,https://www.elciudadano.com/chile/715-traslados-aereos-de-pacientes-criticos-covid-19-se-han-hecho-en-el-pais/01/29/,"""Atacama y Antofagasta son las regiones que han requerido mayor cantidad de traslados hacia la Región Metropolitana"", dijo Dougnac.",30-01-2021 02:25,https://www.bing.com/th?id=OVFT.CCb1BdJu8lYF-85Vw56wmi,Chile,El Ciudadano
Chile registró récord de personas aisladas en residencias ...,https://www.elperiscopio.cl/destacado-1/chile-registro-record-de-personas-aisladas-en-residencias-sanitarias/,"Las regiones con mayor número de hospedados son Tarapacá, con 1.935; la Metropolitana, con 1.210; y el Biobío, con 874.",30-01-2021 02:30,https://www.bing.com/th?id=OVFT.9tBr2swydSedOi9JUEltIS,Chile,elperiscopio.cl
Educación ambiental: conocer el entorno para proteger su valor,https://www.diarioconcepcion.cl/ciencia-y-sociedad/2021/01/30/educacion-ambiental-conocer-el-entorno-para-proteger-su-valor.html,"En el marco del Día Mundial de este ámbito de acción, la premisa es que si no se sabe el valor del medioambiente difícilmente se cuidará. Al enseñar sobre el rol de la naturaleza se concientiza su est",30-01-2021 04:05,https://www.bing.com/th?id=OVFT._ZkpPcM2tg7H3hP4vQOBpS,Chile,El Diario de Concepcion
Fútbol Joven aún no ve luz de esperanza para el retorno,https://www.diarioconcepcion.cl/deportes/2021/01/30/futbol-joven-aun-no-ve-luz-de-esperanza-para-el-retorno.html,"El jefe técnico de las series menores de UdeC, Carlos Pedemonte, analizó el difícil escenario de varias categorías que cumplirán un año sin competir oficialmente.",30-01-2021 04:06,https://www.bing.com/th?id=OVFT.YYJzD548GxiLlRixAHLhXS,Chile,El Diario de Concepcion
Fusionan anticuerpos humanos y de alpaca para implementar ...,https://www.elmostrador.cl/agenda-pais/2021/01/30/fusionan-anticuerpos-humanos-y-de-alpaca-para-implementar-una-terapia-contra-el-covid-19/,Investigadores de la Universidad Austral de Chile y la Universidad de Queensland logran modificar nanoanticuerpos de alpaca y fusionarlos con fragmentos de anticuerpos humanos que pueden usarse para i,30-01-2021 04:07,https://www.bing.com/th?id=OVFT.a1Co0pLpKtYrpBjmVfDouS,Chile,El Mostrador
Presidente mexicano dice que “está pasando la etapa ...,https://www.latercera.com/mundo/noticia/presidente-mexicano-dice-que-esta-pasando-la-etapa-critica-de-su-contagio-de-covid-19/4QTGBYFBUJGFPCNPX2WKDM3XSY/,"El pasado lunes, Andrés Manuel López Obrador concretó con el líder ruso -Putin- la compra de 24 millones de vacunas Sputnik V, parte de las cuales se espera que arriben la próxima semana.",30-01-2021 04:49,https://www.bing.com/th?id=OVFT.VXGNYow2tgZ7U99IWZDUaC,Chile,LA TERCERA
Región de Aysén contabiliza 42 nuevos casos de Covid-19,http://www.eldivisadero.cl/noticia-61354,"Coyhaique-. La Seremi de Salud Aysén informó 42 nuevos contagios por Covid-19 este jueves 28 de enero. En el detalle, se trata de 26 casos confirmados mediante examen PCR, de los cuales 18 son de Coyh",30-01-2021 04:53,https://www.bing.com/th?id=OVFT.PA7dLh8srZjWcx7exoERzC,Chile,Diario el Divisadero
Minsal acorta a 11 días la cuarentena para contactos ...,https://www.emol.com/noticias/Nacional/2021/01/30/1010807/Minsal-cuarentena-11-dias-contactos.html,"La subsecretaria de Salud Pública, Paula Daza, señaló que expertos realizaron recomendaciones que avalan la disminución del período de confinamiento para los asintomáticos.",30-01-2021 08:41,https://www.bing.com/th?id=OVFT.mjoMaoRUWZS7zni0mBNHTi,Chile,Emol
Misión de OMS visita hospital de Wuhan que recibió a los ...,https://www.biobiochile.cl/noticias/internacional/asia/2021/01/30/mision-de-oms-visita-hospital-de-wuhan-que-recibio-a-los-primeros-enfermos-de-covid-19.shtml,"Los expertos de la Organización Mundial de la Salud (OMS), que se encuentran de misión en la ciudad china de Wuhan (centro) para intentar aclarar los orígenes del covid-19, visitaron este sábado el pr",30-01-2021 13:02,https://www.bing.com/th?id=OVFT.RJeUBY-_9uGeaU79X0Em0S,Chile,Chile
Chile registra récord de personas aisladas en residencias ...,https://laprensaaustral.cl/2021/01/30/chile-registra-record-de-personas-aisladas-en-residencias-sanitarias/,El Ministerio de Salud anunció que se registró el número más alto de personas aisladas en residencias sanitarias desde el inicio de la pandemia en marzo pasado,30-01-2021 13:03,https://www.bing.com/th?id=OVFT.zQMWsZjGE6fb9Y7NiRdNHi,Chile,La Prensa Austral
Diputados opositores presentan proyecto que permite un ...,https://laprensaaustral.cl/2021/01/30/diputados-opositores-presentan-proyecto-que-permite-un-tercer-retiro-de-fondos-de-afp/,Diputados opositores ingresaron durante la tarde de este viernes el proyecto del tercer retiro del 10% de los fondos previsionales,30-01-2021 13:55,https://www.bing.com/th?id=OVFT.c6ceXhK8vp_nMDdSoBU1Dy,Chile,La Prensa Austral
Nuevo protocolo sanitario del Minsal reduce a 11 días la ...,https://www.publimetro.cl/cl/noticias/2021/01/30/minsal-reduce-11-dias-cuarentena-contactos-estrechos.html,La medida de aislamiento pasa de 14 a 11 días de confinamiento de acuerdo a la adecuación realizada por los especialistas del ministerio de Salud.,30-01-2021 14:51,https://www.bing.com/th?id=OVFT.XOn2ZSJ6q_GRc0waIpzgEC,Chile,publimetro.cl
Minsal registró cifra récord de personas internadas en ...,http://www.lanacion.cl/minsal-registro-cifra-record-de-personas-internadas-en-residencias-sanitarias/,"La entidad ministerial situó un total de 7.915 usuarios que están aislados en las locaciones sanitarias dispuestas por la autoridad. Las regiones que registran mayor número de hospedados son Tarapacá,",30-01-2021 15:01,https://www.bing.com/th?id=OVFT.92epgeJL1yMYpouuvbzszC,Chile,La Nación
CNN Chile,https://www.cnnchile.com/tag/hospital-san-borja/,"10:02 / El ministro Enrique Paris indicó que ""sólo quedan 14 pacientes para ser trasladados de zonas críticas"". Además, hizo un llamado a la calma por el siniestro en el recinto de salud. ""Nadie ha mu",30-01-2021 15:24,https://www.bing.com/th?id=OVFT.4wLuOg9uFhM8MSKeoSaX7i,Chile,CNN Chile
Coronavirus en Chile: 82 muertes y 4.160 nuevos contagios ...,https://www.t13.cl/noticia/nacional/coronavirus-chile-82-muertes-4160-contagios-30-01-2021,"Con esto, la cifra total de contagios en Chile es de 722.900; mientras que 26.594 figuran como casos activos y 677.602 son casos recuperados.",30-01-2021 15:51,https://www.bing.com/th?id=OVFT.VOCkcTd_kXTo2J_ZZINuji,Chile,T13
Covid-19: Minsal informó 82 personas fallecidas y 4.160 ...,https://www.latribuna.cl/coronavirus/2021/01/30/covid-19-minsal-informo-82-personas-fallecidas-y-4-160-casos-nuevos.html,"El Ministerio de Salud (Minsal) informó este sábado que hubo 4.160 casos nuevos de coronavirus Covid-19 en Chile en las últimas 24 horas, alcanzando un total de 722.900 contagiados desde el inicio de",30-01-2021 15:54,https://www.bing.com/th?id=OVFT.Ie1WQlAfu3pN1BpstaUFki,Chile,La Tribuna
Chile suma 4.160 nuevos contagios de covid-19 y cifra ...,https://www.biobiochile.cl/noticias/nacional/chile/2021/01/30/chile-suma-4-160-nuevos-contagios-de-covid-19-y-cifra-total-sube-a-722-900-casos.shtml,"Este sábado, el Ministerio de Salud entregó un nuevo balance de cifras relacionadas con la pandemia del covid-19 que",30-01-2021 16:04,https://www.bing.com/th?id=OVFT.BW3qBcyPAsp2lLcLHJGvDC,Chile,Chile
El Covid otra vez golpea al básquetbol: se suspenden los ...,https://www.latercera.com/el-deportivo/noticia/el-covid-otra-vez-golpea-al-basquetbol-se-suspenden-los-duelos-entre-puerto-montt-y-las-animas/G2V6FNALQJHPPC7IJP3QZT2FL4/,"A través de un comunicado, la LNB informó que los partidos entre los puertomontinos y los fantasmas, correspondientes a la tercera semana de competencia de la Copa Chile 2021, deberán ser reprogramado",30-01-2021 16:16,https://www.bing.com/th?id=OVFT.Orl3r8al-jvqkn6ch60Mly,Chile,LA TERCERA
Reporte Minsal: 4.160 casos nuevos y 82 fallecidos en las ...,https://www.eldesconcierto.cl/noticias/2021/01/30/reporte-minsal-4-160-casos-nuevos-y-82-fallecidos-en-las-ultimas-24-horas.html,"Con relación a la Red Integrada de Salud, se informó que existen apenas 161 camas críticas disponibles para el paciente que lo requiera, independiente de la región donde se encuentre.",30-01-2021 16:17,https://www.bing.com/th?id=OVFT.dhqjuDZtlyF1VVte-lI4SC,Chile,eldesconcierto
INÉDITA MISIÓN CIENTÍFICA EXPLORARÁ LAS COSTAS DE CHILE ...,http://www.radiopolar.com/noticia_163087.html,El velero francés TARA conectará los océanos Atlántico y Pacífico para estudiar el microbioma marino. En la red de colaboración detrás de la iniciativa participan más de 700 investigadores nacionales,30-01-2021 16:29,https://www.bing.com/th?id=OVFT.74vbUbkXiyDe2-ffIBXdIy,Chile,Radio Polar
Chile registra 82 fallecidos y 4.160 nuevos contagiados de ...,https://www.theclinic.cl/2021/01/30/chile-registra-82-fallecidos-y-4-160-nuevos-contagiados-de-covid-19-en-ultimas-24-horas/,Durante la mañana de este sábado las autoridades del Ministerio de Salud informaron que Chile registró 4.160 nuevos contagiados de Covid-19 en las últimas 24 horas. De la cifra se desprende que hubo 2,30-01-2021 17:10,https://www.bing.com/th?id=OVFT.cimdfXlfIha5YRe_cuF7ny,Chile,Clinic
CNN Chile,https://www.cnnchile.com/tag/tamarugal/,"14:12 / El presidente Sebastián Piñera aceptó la decisión de Jussef Araya Leiva, quien fue de vacaciones a Estados Unidos en medio del alza de contagios por COVID-19. La ex autoridad no alcanzó a esta",30-01-2021 17:14,https://www.bing.com/th?id=OVFT.4wLuOg9uFhM8MSKeoSaX7i,Chile,CNN Chile
Covid-19 en Chile: 82 fallecidos en la última jornada y ...,https://www.elmostrador.cl/dia/2021/01/30/covid-19-en-chile-82-fallecidos-en-la-ultima-jornada-y-mas-de-cuatro-mil-casos-diarios-por-tercer-dia-consecutivo/,"Desde La Moneda, y Tras una reunión entre autoridades por el Plan de Vacunación, el Ministerio de Salud (Minsal) entregó las cifras diarias de la pandemia.",30-01-2021 17:23,https://www.bing.com/th?id=OVFT.wVBdi_yKyjUY65BltC6CzC,Chile,El Mostrador
“Impactante”: Incendio en Hospital San Borja es noticia en ...,https://www.radioagricultura.cl/nacional/2021/01/30/impactante-incendio-en-hospital-san-borja-es-noticia-en-medios-internacionales.html,Esta mañana un incendio de grandes magnitudes afecto al Hospital San Borja Arriarán ubicado en la intersección de calle Amazonas,30-01-2021 18:18,https://www.bing.com/th?id=OVFT.1fGQ1ViPECzq9t-r_EOtfS,Chile,Radio Agricultura
Gobierno se reunió con Alcaldes de todo Chile para ...,https://www.elperiodista.cl/2021/01/gobierno-se-reunio-con-alcaldes-de-todo-chile-para-coordinar-distribucion-de-vacunas-y-proceso-de-inoculacion-contra-el-covid-19/,"Más de dos horas estuvieron reunidos los ministros de Salud, Enrique Paris, del Interior, Rodrigo Delgado y la subsecretaria de Salud Pública, Paula Daza con los alcaldes de todo Chile, entregándoles",30-01-2021 18:37,https://www.bing.com/th?id=OVFT.-nDPKnIMyN7C87FlKxS9TC,Chile,El Periodista
Delgado responde a cuestionamientos de alcaldes por ...,https://www.publimetro.cl/cl/noticias/2021/01/30/delgado-alcaldes-proceso-vacunacion.html,Rodrigo Delgado afirmó que realizarán todas las reuniones que sean necesarias a fin de aclarar las dudas que han surgido desde los municipios.,30-01-2021 18:47,https://www.bing.com/th?id=OVFT.UYhDPG3BwPAB46ZA8aRLfi,Chile,publimetro.cl
