name,url,description,datePublished,imagen,pais,Fuente
"Informe que defiende ""nueva normalidad"" proyecta en 2 a 3 ...",https://www.emol.com/noticias/Nacional/2020/04/22/983824/Informe-nueva-normalidad.html,"Un informe interno del Gobierno contiene parte de la estrategia del Ejecutivo ante el covid-19. El texto, al que accedió ""El Mercurio"", se denomina ""La nueva normalidad, nueva etapa en el combate al coronavirus"". En el documento se establece una proyección respecto del peak de contagios, el que se",22-04-2020 15:21,https://www.bing.com/th?id=ON.929C1E366775F435DFC476DB9AAF9901,Chile,Emol
Chile llega a 160 muertes por Covid-19 con 13 nuevos ...,https://www.biobiochile.cl/noticias/nacional/chile/2020/04/22/chile-llega-a-160-muertes-por-covid-19-con-13-nuevos-fallecidos-el-alza-diaria-mas-alta.shtml,"Chile llega a 160 muertes por Covid-19 con 13 nuevos fallecidos, el alza diaria más alta Por Nicolás Parra. Archivo | Agencia UNO. visitas. a-A+. El Ministerio de Salud (Minsal) informó la mañana de este miércoles que se reportaron 464 nuevos casos de Covid-19 (coronavirus), con lo que el total nacional llega a los 11.296 contagios.",24-04-2020 04:41,https://www.bing.com/th?id=ON.183189CDFB28F5082DF0834462FCF55F,Chile,Chile
Gobierno y credos constituyen mesa interreligiosa para ...,https://www.cooperativa.cl/noticias/sociedad/salud/coronavirus/gobierno-y-credos-constituyen-mesa-interreligiosa-para-enfrentar-el/2020-04-24/001307.html,"Este jueves, el Palacio de La Moneda, el ministro de la Secretaría General de la Presidencia (Segpres), Felipe Ward, presidió la primera sesión de la mesa interreligiosa en el marco de la pandemia del Covid-19, en la cual participaron 12 representantes de siete credos presentes en nuestro país.",24-04-2020 04:48,https://www.bing.com/th?id=ON.6333926D5D9761FC840135BD401CA1B6,Chile,Radio Cooperativa
Cités en la mira del virus y el gobierno | La Cuarta,https://www.lacuarta.com/cronica/noticia/cites-la-mira-del-virus-gobierno/487273/,"Tras el polémico operativo sanitario que afectó a 250 personas en un cité de Quilicura, donde 33 dieron positivo por coronavirus; y un segundo caso en Estación Central con ocho contagiados, las autoridades pusieron ojo a estos antiguos pasajes, los cuales se caracterizan por los altos niveles de hacinamiento que tienen sus vecinos.",24-04-2020 04:54,https://www.bing.com/th?id=ON.07E2B9D08A4AED2115CB34E193DAD64F,Chile,La Cuarta
Las innovaciones tecnológicas y biomédicas surgidas en ...,https://www.elmostrador.cl/cultura/2020/04/24/las-innovaciones-tecnologicas-surgidas-en-universidades-y-centros-de-investigacion-por-el-coronavirus-en-chile/,"Las innovaciones tecnológicas y biomédicas surgidas en universidades y centros de investigación por el coronavirus en Chile por Marco Fajardo 24 abril, 2020 Es una tendencia a nivel mundial: este jueves, la U. de Oxford empezó a probar una vacuna contra el SARS-CoV-2 en seres humanos.",24-04-2020 05:07,https://www.bing.com/th?id=ON.53D8B41B0E8A51BCD52DC841F5ECB864,Chile,El Mostrador
Christian Slater: Alineados tras el General Mañalich ...,https://www.radiosantiago.cl/archivo/127916,"Como Patriotas por Chile, desde hace más de un mes decidimos apoyar al Gobierno en el tema de la Emergencia Sanitaria. Confiamos y estamos completamente de acuerdo con las medidas adoptadas y, ... en el momento que vive Chile. Si pudiera, lo nombraría como el General de Sanidad que está ganando el combate al covid 19, ...",24-04-2020 06:51,https://www.bing.com/th?id=ON.2C94E9BB698AD2B438A8D55C17CEFA2A,Chile,Radio Santiago
Remezón total en TVN: desvinculan a 30 trabajadores ...,https://www.radiosantiago.cl/archivo/127954,"Un nuevo remezón afectó a Televisión Nacional de Chile (TVN). A las medidas ya anunciadas en el marco del Covid-19, y que apuntaban principalmente a la reducción de salarios de rostros, este jueves se confirmó la desvinculación de 30 trabajadores de distintas áreas. Mediante un comunicado, la",24-04-2020 06:51,https://www.bing.com/th?id=ON.0CCF991FDD734AEB4885BDE3D406370E,Chile,Radio Santiago
Ministra Rubilar dice que vacuna contra el Covid-19 “para ...,https://www.latercera.com/nacional/noticia/ministra-rubilar-dice-que-vacuna-contra-el-covid-19-no-llega-antes-de-un-ano/YSRTFIL2UBBT3EQXF5UBSTHXKE/,"Ministra Rubilar dice que vacuna contra el Covid-19 “para un país como Chile, no llega antes de un año” Hace 2 horas Se inicia cuarentena en Pedro Aguirre Cerda, Quinta Normal y la zona sur de Independencia",24-04-2020 07:42,https://www.bing.com/th?id=ON.3F8C85E87030AE8C34DB3DB7DA437ED0,Chile,LA TERCERA
Hacia un nuevo modelo de desarrollo - Diario Financiero,https://www.df.cl/noticias/opinion/cartas/hacia-un-nuevo-modelo-de-desarrollo/2020-04-23/173221.html,"Como ASIMET, previo y posterior a la crisis social que estalló en octubre del año pasado -agravada ahora por el Covid-19-, hemos venido insistiendo que Chile vivió un ciclo virtuoso de crecimiento que llegó a su fin. ... Coronavirus, la Fase 4 en Chile . Día Internacional de la Mujer en Chile . El 8M en el mundo . Marzo y el súper lunes ...",24-04-2020 08:03,https://www.bing.com/th?id=ON.64AD9369BC67F1295CF223FBD287A8B3,Chile,df.cl
"Coronavirus, crisis, oportunidades - Diario Financiero",https://www.df.cl/noticias/opinion/cartas/coronavirus-crisis-oportunidades/2020-04-23/184931.html,"La ""nueva normalidad"" en la que entraremos post Covid-19 transformará la manera de hacer las cosas para siempre. El tema es, ¿cuántos actores del ecosistema podrán entregar un aporte real a su entorno en base a su experiencia frente al nuevo escenario? Afortunadamente, hay casos de",24-04-2020 08:03,https://www.bing.com/th?id=ON.64AD9369BC67F1295CF223FBD287A8B3,Chile,df.cl
Coronavirus: Minsal estima que primera ola de contagios en ...,https://www.t13.cl/noticia/nacional/Coronavirus-Minsal-estima-que-peak-de-contagios-en-Chile-estaria-cerca-de-ser-superado,"Coronavirus: Minsal estima que primera ola de contagios en Chile estaría cerca de ser superada. Por su parte, el ministro de Salud Jaime Mañalich indicó que “se había proyectado una curva mucho más alta que la que tenemos en este momento"", pero hizo un llamado a ser cautos.",24-04-2020 08:05,https://www.bing.com/th?id=ON.FAC14775B18B6DB9E31FFAB66072A57F,Chile,T13
Reciclaje de base en tiempos de pandemia: la experiencia ...,https://www.elciudadano.com/medio-ambiente/reciclaje-de-base-en-tiempos-de-pandemia-la-experiencia-de-elisa-millanao/04/24/,"Elisa Millanao Ñancupe es una experimentada recicladora de base de Temuco. Sus inicios en el rubro se remontan a la instalación del vertedero municipal de Temuco en el sector Boyeko (o Agua de foye, uno de los árboles sagrados del pueblo mapuche). Su trabajo ha cambiado enormemente con el correr",24-04-2020 08:21,https://www.bing.com/th?id=ON.AB0AC7F9FB8906434A52F8CFF4A6AF5D,Chile,El Ciudadano
Ecuador: se duplica número de casos de COVID-19 por ...,https://www.elciudadano.com/latino-america/ecuador-se-duplica-numero-de-casos-de-covid-19-por-resultados-de-monton-de-pruebas-represadas/04/23/,"El ministro de Salud de Ecuador, Juan Carlos Zevallos, informó este jueves 23 de abril que la cifra oficial de contagios por COVID-19 en el país ascendió a 22.160, tras obtener los resultados de pruebas que se encontraban represadas, lo que convierte al país en la segunda nación más afectada",24-04-2020 08:58,https://www.bing.com/th?id=ON.A8E322A12A80E6E5374B759043941F3F,Chile,El Ciudadano
Chile reporta 516 nuevos casos y ocho fallecidos por ...,https://www.biobiochile.cl/noticias/nacional/chile/2020/04/23/chile-reporta-516-nuevos-casos-y-ocho-fallecidos-por-coronavirus-total-de-contagios-llega-a-11-812.shtml,"El Ministerio de Salud (Minsal) informó la mañana de este jueves que se reportaron 516 nuevos casos de Covid-19 (coronavirus), con lo que el total nacional llega a los 11.812 contagios. De acuerdo al tradicional balance desde La Moneda, ocho personas fallecieron en las últimas horas: siete en la",24-04-2020 09:08,https://www.bing.com/th?id=ON.B7573131CD8B8437AD1E1A98435F7836,Chile,Chile
Prematuros con COVID-19 y enfermedades respiratorias son ...,https://www.24horas.cl/coronavirus/prematuros-con-covid-19-y-enfermedades-respiratorias-son-propensos-a-infecciones-mas-graves-4123239,"Para este año y a raíz del Covid-19, se prevé un escenario complejo para los menores prematuros en cuanto a las enfermedades respiratorias como la influenza y el Virus Respiratorio Sincicial (VRS). Según las últimas cifras públicas entregadas por el Ministerio de Salud, en 2016 hubo casi 100",24-04-2020 09:12,https://www.bing.com/th?id=ON.5D5CD87206D6A7171D4668357D23EA12,Chile,24 Horas Chile
Intercambio comercial de Chile cierra primer trimestre con ...,https://www.emol.com/noticias/Economia/2020/04/24/984039/Comercio-exterior-Chile-primertrimestre-coronavirus.html,"Intercambio comercial de Chile cierra primer trimestre con caída de 8,2% ante shock del covid-19 en los mercados De acuerdo a la Subsecretaría de Relaciones Económicas Internacionales, gran parte del retroceso total se explicó por la baja de más de 10% en las importaciones.",24-04-2020 10:12,https://www.bing.com/th?id=ON.A2C5FE26DA48A1A9588C6C89FDAEBADE,Chile,Emol
Coronavirus: países de AméricaLatina que lograron ...,https://www.t13.cl/noticia/mundo/bbc/coronavirus-4-paises-de-america-latina-que-lograron-aplicar-estrategias-exitosas-de-educacion-a-distancia-ante-la-pandemia,"Coronavirus: Países de América Latina que lograron aplicar estrategias exitosas de educación remota. Estos son los países de la región que se destacan por su enseñanza a distancia ante el cierre de escuelas, según el Banco Mundial.",24-04-2020 10:41,https://www.bing.com/th?id=ON.CF5FF4B98ABDF3C41B0A43DB4536E242,Chile,T13
A partir del 30 de abril: AFC publica calendario de pagos ...,https://www.cnnchile.com/pais/calendario-pago-trabajadores-afc_20200424/,"A partir del próximo jueves 30 de abril, los trabajadores que hayan visto suspendidas sus funciones a causa de la crisis del COVID-19 y cuyos empleadores se hayan acogido a la Ley de Protección del Empleo y sus solicitudes hayan sido aceptadas, comenzarán a recibir sus pagos por parte de Administradora de Fondos de Cesantía (AFC).",24-04-2020 10:51,https://www.bing.com/th?id=ON.8A11A555E2AE221B6FB742E388C5CCCC,Chile,CNN Chile
El Covid-19 impacta el calendario electoral y países toman ...,https://www.latercera.com/mundo/noticia/el-covid-19-impacta-el-calendario-electoral-y-paises-toman-medidas/DAGAAQBXWRBKFMGCDOM6FBEZMA/,"El Covid-19 está provocando profundos cambios en las sociedades. En este nuevo escenario, la política se ha debido adaptar a las medidas sanitarias, como el distanciamiento social. Sin embargo, una de las mayores dificultades ha sido decidir qué hacer con las elecciones. A pesar de experiencias",24-04-2020 10:50,https://www.bing.com/th?id=ON.8C278AAC02C6ABC7FE1C3FB3C284B0A9,Chile,LA TERCERA
"""Visor Territorial"": Gobierno lanza plataforma ...",https://www.puranoticia.cl/noticias/nacional/visor-territorial-gobierno-lanza-plataforma-digital-con-datos/2020-04-23/211941.html,"""Visor Territorial"": Gobierno lanza plataforma digital con datos actualizados sobre el Covid-19 en Chile. El sitio web, denominado Visor Territorial, presenta un mapa de todo el territorio nacional, y recuadros con cifras de casos positivos a la fecha, ... Coronavirus: Cuánto tiempo sobrevive el virus causante de covid-19 en distintas superficies.",24-04-2020 11:26,https://www.bing.com/th?id=ON.7EC9F8B715DDC66E81517F33F2842ECE,Chile,Puranoticia.cl
Rubilar por coronavirus: “La vacuna para un país como ...,https://www.adnradio.cl/nacional/2020/04/24/rubilar-por-coronavirus-la-vacuna-para-un-pais-como-chile-no-llega-antes-de-un-ano.html,"En conversación con 24 Horas, la ministra vocera de Gobierno, Karla Rubilar, entregó una visión realista en torno a la posibilidad con la que el país podría contar con algún antídoto para enfrentar el coronavirus Covid-19. La autoridad habló tanto de este aspecto como el de la aplicación de",24-04-2020 11:30,https://www.bing.com/th?id=ON.64823400DC248B608FE16470333F452E,Chile,ADN
Ecuador duplicó casos de coronavirus tras obtener ...,https://www.adnradio.cl/internacional/2020/04/24/ecuador-duplico-casos-de-coronavirus-tras-obtener-resultados-de-test-atrasados.html,"Ecuador duplicó la cifra oficial de casos confirmados de coronavorus Covid-19, después de obtener los resultados de miles de pruebas que estaban pendientes, informó el ministerio de salud de ese país. De acuerdo con el titular de la cartera, Juan Carlos Zevallos, en Ecuador hay 22.160 infectados",24-04-2020 11:41,https://www.bing.com/th?id=ON.E56D29CC6D71FA52DC7CFE94A9CE727C,Chile,ADN
Paciente con COVID-19 tratada con plasma sanguíneo comenzó ...,https://www.24horas.cl/coronavirus/paciente-con-covid-19-tratada-con-plasma-sanguineo-comenzo-a-recuperarse-4123992,"Una paciente que se encontraba en estado crítico evoluciona favorablemente tras ser tratada con plasma sanguíneo. El doctor Sebastián Ugarte, a cargo del proceso experimental que está siendo usado en pacientes críticos por coronavirus, comentó que el equipo está muy emocionado con los",24-04-2020 11:50,https://www.bing.com/th?id=ON.5FC72FF6D80413B8657F42C0C452D198,Chile,24 Horas Chile
Unos 4 mil internos han dejado las cárceles... | Puranoticia,https://www.puranoticia.cl/noticias/nacional/unos-4-mil-internos-han-dejado-las-carceles-para-seguir-cumpliendo/2020-04-24/075746.html,"A un mes de iniciadas las gestiones del Ministerio de Justicia y Derechos Humanos y de la Defensoría Penal Pública ante el alto riesgo de contagio de Covid-19 para la población penal, cerca de 4 mil personas privadas de libertad en todo Chile han logrado salir de las cárceles para seguir cumpliendo sus condenas o medidas cautelares en sus ...",24-04-2020 11:59,https://www.bing.com/th?id=ON.BDB39E0E230C74437A4ED6A39D3C7F1E,Chile,Puranoticia.cl
La “omnipresente” Izkia Siches: el elogioso perfil en ...,https://www.elmostrador.cl/noticias/sin-editar/2020/04/24/el-elogioso-perfil-a-la-omnipresente-izkia-siches-en-france-inter/,"La presidenta del Colegio Médico fue elegida para un perfil que France Inter realiza a diario a las figuras destacadas de la lucha contra COVID-19 en el mundo. “Ante un Gobierno que ha perdido toda credibilidad, se ha convertido en la voz de referencia en el país, a veces más fuerte que la del",24-04-2020 12:00,https://www.bing.com/th?id=ON.46741C0C65E8EB5E73B8482B97564F7E,Chile,El Mostrador
[Minuto a Minuto] Covid-19: Chile se acerca a los 12 mil ...,https://www.cooperativa.cl/noticias/sociedad/salud/coronavirus/covid-19-chile-se-acerca-a-los-12-mil-contagiados/2020-04-23/100214.html,"07:59 - | Chile se acerca a los 12 mil contagiados por Covid-19, luego que en el último balance se reportaran 11.812 nuevos casos: los fallecidos ya llegan a 168, mientras que los recuperados alcanzan los 5.804",24-04-2020 12:11,https://www.bing.com/th?id=ON.64891709B16FB03D909770DB8E04E2BA,Chile,Radio Cooperativa
