name,url,description,datePublished,imagen,pais,Fuente
A desempolvar las palomas: los partidos retoman la ...,https://www.pauta.cl/politica/los-partidos-inician-discusion-plebiscito-a-un-mes-de-inicio-de-campana,"El momento de desempolvar las poleras, los afiches y los spots ha llegado. La conversación suspendida sobre el Plebiscito, las campañas, la unión de los comandos, el Apruebo y el Rechazo de a poco se",28-07-2020 14:43,https://www.bing.com/th?id=ON.F0C37C863D9E23F6D83FC5F3113693A7,Chile,pauta
Vacuna contra el coronavirus: Rusia sorprende y anuncia la ...,https://eltipografo.cl/2020/07/vacuna-contra-el-coronavirus-rusia-sorprende-y-anuncia-la-suya-en-dos-semanas,La carrera por la vacuna del covid 19 se ha convertido en algunos lugares en una cuestión de orgullo nacional. Tras las esperanzadoras noticias sobre el desarrollo de una vacuna promovida por la Unive,29-07-2020 14:22,https://www.bing.com/th?id=ON.28C7DD0E53968A3845D37874B6EB3FA5,Chile,eltipografo.cl
Piñera destaca la proyección de Chile para atraer más ...,https://www.elmostrador.cl/dia/2020/07/29/pinera-destaca-la-proyeccion-de-chile-para-atraer-mas-inversion-extranjera/,El Presidente indicó que el Gobierno ya está trabajando desde diferentes ángulos para hacer frente a una recesión y encaminar la senda de la recuperación lo antes posible y animó a los inversores a seguir confiando en la capacidad de Chile para ofrecer un escenario favorable y confiable,29-07-2020 14:22,https://www.bing.com/th?id=ON.2730FC1988D10B41A0F4A7EB398C4D72,Chile,El Mostrador
Coronavirus no da tregua en América Latina: cifras y ...,https://www.elperiodista.cl/coronavirus-no-da-tregua-en-america-latina-cifras-y-medidas-pais-por-pais/,"Coronavirus no da tregua en América Latina: cifras y medidas país por país MEXICO, 29 jul (Xinhua) -- A pesar de que la enfermedad del nuevo coronavirus (COVID-19) ha disminuido su intensidad en casos y muertos en América Latina, autoridades de la región afirman que el ""problema está lejos de resolverse"", por lo que piden a la gente ...",29-07-2020 15:04,https://www.bing.com/th?id=ON.7CF9C6FE5AF6D2EDE96D98F95CD8B511,Chile,El Periodista
Senado rechazó veto y Piñera deberá promulgar la ley de ...,https://www.cooperativa.cl/noticias/sociedad/salud/coronavirus/senado-rechazo-veto-y-pinera-debera-promulgar-la-ley-de-servicios/2020-07-28/202007.html,"El Senado rechazó este martes el veto presentado a la ley que prohíbe el corte del suministro de servicios básicos -luz, agua, telefonía, internet y gas-durante la duración del estado de emergencia por la pandemia de Covid-19, que deberá promulgarse dentro de un plazo de 10 días.",29-07-2020 16:03,https://www.bing.com/th?id=ON.A5A7C5DBFF2C210680E8F4B5A927C511,Chile,Radio Cooperativa
"Covid-19 en Chile: 351.575 contagiados, 9.278 fallecidos y ...",https://www.cooperativa.cl/noticias/sociedad/salud/coronavirus/covid-19-en-chile-351-575-contagiados-9-278-fallecidos-y-324-557/2020-07-29/105327.html,"Covid-19 en Chile: 351.575 contagiados, 9.278 fallecidos y 324.557 recuperados. Publicado: ... El Ministerio de Salud informó de 1.773 nuevos casos de coronavirus confirmados en las últimas 24 horas y de 38 fallecidos reportados por el Departamento de Estadísticas e Información de Salud (DEIS) por Covid-19. De esa forma, ...",29-07-2020 16:03,https://www.bing.com/th?id=ON.A5A7C5DBFF2C210680E8F4B5A927C511,Chile,Radio Cooperativa
El Desconcierto - Prensa digital libre,https://www.eldesconcierto.cl/2020/07/29/declaran-admisible-una-nueva-querella-por-cuasi-delito-de-homicidio-contra-sebastian-pinera-y-jaime-manalich/,"Este miércoles, el tercer Juzgado de Garantía de Santiago acogió el recurso presentado por la concejala de Conchalí, Grace Arcos, contra el Presidente y el ex ministro de Salud, por la denegación de a",29-07-2020 16:34,https://www.bing.com/th?id=ON.C28828237494380EB961910C1C7D7675,Chile,eldesconcierto
Reportan 1.773 casos nuevos y 38 fallecidos en el país ...,http://www.ladiscusion.cl/reportan-1-773-casos-nuevos-y-38-fallecidos-en-el-pais/,"El Ministerio de Salud reportó este miércoles 1.773 nuevos contagios por Covid-19, de los cuales 1.294 presentaron síntomas, 346 asintomáticos y 133 no fueron notificados al Minsal de su PCR positivo.",29-07-2020 16:45,https://www.bing.com/th?id=ON.19B56899E7EE71D4708EE0542B49FEB7,Chile,La Discusión
Chile supera los 350 mil contagios por covid-19: se ...,https://www.diarioconcepcion.cl/pais/2020/07/29/chile-supera-los-350-mil-contagios-por-covid-19-se-registraron-38-nuevos-decesos.html,"Un nuevo balance entregado este martes por el Ministerio de Salud informó que Chile registró 38 nuevos decesos inscritos y 1.773 casos positivos de covid-19, durante las últimas 24 horas. Del total de",29-07-2020 17:14,https://www.bing.com/th?id=ON.011D769F26E3719E8FA267580FE8D60F,Chile,El Diario de Concepcion
Chile superó los 350 mil contagios: Minsal informó 1.773 ...,https://www.publimetro.cl/cl/noticias/2020/07/29/balance-minsal-miercoles-cifras-covid-19.html,"El Ministerio de Salud informó que desde marzo a la fecha se han registrado 351.575 casos de coronavirus, donde la cifra de fallecidos llega a 9.278. El Ministerio de Salud entregó un nuevo reporte de",29-07-2020 18:13,https://www.bing.com/th?id=ON.0D728A21B027BA04F18FA1254EF6D08D,Chile,publimetro.cl
Otra dura evaluación de The Economist por el COVID-19 en ...,https://www.elmostrador.cl/noticias/pais/2020/07/29/otra-dura-evaluacion-de-the-economist-por-el-covid-19-en-chile-el-manejo-ha-sido-una-decepcion-el-gobierno-no-entendio-esto-a-tiempo/,"Sin embargo, Reid consideró que las medidas económicas tomadas por el Gobierno han sido ""importantes"", lo que abre la posibilidad a una recuperación ""relativamente rápida"", aunque también criticó la r",29-07-2020 18:29,https://www.bing.com/th?id=ON.F8A6F16368ACA3B81ACB450CC668DDF3,Chile,El Mostrador
"Salomé Martínez, la profesora chilena invitada a relatar ...",https://www.latercera.com/que-pasa/noticia/salome-martinez-la-profesora-chilena-invitada-a-relatar-en-eeuu-como-los-docentes-del-pais-han-debido-hacer-clases-en-linea/TYW6C7775FE7JN3TKC52M4Y4UI/,El 2020 ha sido el año en que el mundo ha vivido una de las mayores amenazas de los últimos tiempos. La crisis sanitaria por la pandemia por Covid-19 impactó todas las áreas. Y la educación es una de,29-07-2020 19:26,https://www.bing.com/th?id=ON.01B85444DFE67B652D43B09305AAF62D,Chile,LA TERCERA
Radio Valparaíso COVID-19: MINVU INICIA SEGUNDA ENTREGA ...,http://www.radiovalparaiso.cl/2020/07/29/covid-19-minvu-inicia-segunda-entrega-kits-de-aseo-a-todos-los-campamentos-de-la-region/,12 mil nuevas cajas con productos de limpieza del hogar y aseo personal comenzó a distribuir el Equipo Regional de Campamentos del SERVIU en los 181 asentamientos de la región. Esta segunda ayuda se c,29-07-2020 19:37,https://www.bing.com/th?id=ON.7D4FD7DEA530858B251C850373071197,Chile,Radio Valparaiso
Aglomeraciones fuera de las AFP por pago del 10% – La ...,http://www.ladiscusion.cl/aglomeraciones-fuera-de-las-afp-por-pago-del-10/,"Un recorrido por las distintas sucursales de las AFP presentes en Chillán realizaron durante la mañana del martes funcionarios de la Gobernación de Diguillín, tras solicitud del gobernador Enrique Riv",29-07-2020 19:38,https://www.bing.com/th?id=ON.038507BAA7EFA5AC6BA18C41F578FE64,Chile,La Discusión
