name,url,description,datePublished,imagen,pais,Fuente
Paris: no está demostrado que este virus produzca ...,https://www.chanarcillo.cl/paris-no-esta-demostrado-que-este-virus-produzca-anticuerpos-con-mucha-duracion/,"El ministro de Salud, Enrique Paris, mencionó que las aseveraciones del director general de la Organización Mundial de la Salud (OMS), Tedros Adhanom, apuntan a que hay que tener una alerta permanente",04-08-2020 06:57,https://www.bing.com/th?id=OVFT.FvDImVdfgI7CXOX5KNC8ky,Chile,Diario Chanarcillo
A full el CEFF continúa preparación de series menores y ...,https://www.chanarcillo.cl/a-full-el-ceff-continua-preparacion-de-series-menores-y-femenina/,"La institución deportiva CEFF Copiapó, continúa con su planificación de entrenamientos semanales para las categorías sub.6, 8, 10, 12, 14, 16, 18 y fútbol femenino los días Lunes, miércoles, jueves y",04-08-2020 08:15,https://www.bing.com/th?id=OVFT.WWqw7vme9s_FS-wMitFQmS,Chile,Diario Chanarcillo
Ministro Víctor Pérez encabezará su primera Mesa Social ...,https://www.radioagricultura.cl/nacional/2020/08/04/ministro-victor-perez-encabezara-su-primera-mesa-social-covid-19.html,"El ministro del Interior y Seguridad Pública, Víctor Pérez, liderará durante este martes su primera Mesa Social Covid-19, espacio creado por su antecesor Gonzalo Blumel para coordinar las acciones necesarias y transversales para combatir la expansión del coronavirus en el territorio nacional",04-08-2020 11:30,https://www.bing.com/th?id=OVFT.Q_zAuPXU1Y6sDAq6YWKczy,Chile,Radio Agricultura
"Ministra Zaldívar: ""La propuesta previsional de la ...",https://www.pauta.cl/economia/ministra-zaldivar-la-propuesta-previsional-de-oposicion-no-es-canto-sirena,"Mientras aún el Gobierno lamenta la Ley del Retiro del 10% de los fondos previsionales, cuya implementación ya muestra que casi el 65% de los afiliados ha solicitado esa acción, se ha puesto en marcha",04-08-2020 12:45,https://www.bing.com/th?id=OVFT._XZvJhYEsNHUc1tn0EndFy,Chile,pauta
El 44% de los chilenos confiesa haber subido de peso ...,https://www.cooperativa.cl/noticias/pais/salud/alimentos/el-44-de-los-chilenos-confiesa-haber-subido-de-peso-durante-el/2020-08-04/082729.html,"Un 44 por ciento de los chilenos reconoció haber subido de peso durante el periodo de confinamiento, según arrojó la ""Encuesta de Consumo de alimentos y ansiedad durante la cuarentena por Covid-19 en Iberoamérica"", realizada entre abril y la primera semana de mayo en 11 países.",04-08-2020 12:46,https://www.bing.com/th?id=OVFT.PG-kzuP04_E1nfa8vdxd0y,Chile,Radio Cooperativa
La mitad de los fallecidos en la RM durante últimos tres ...,https://www.theclinic.cl/2020/08/04/la-mitad-de-los-fallecidos-en-la-rm-durante-ultimos-tres-meses-esta-asociada-a-covid-19/,"Uno de cada tres fallecidos en Chile murió a causa del Covid-19 en los últimos tres meses, de acuerdo a cifras del Departamento de Estadísticas e Información (DEIS) del Ministerio de Salud. Según cons",04-08-2020 12:54,https://www.bing.com/th?id=OVFT.pF8i3vMTJV-kN7NOVfkTTi,Chile,Clinic
Los 90 días más duros de la pandemia: 1 de cada 3 muertes ...,https://www.elmostrador.cl/dia/2020/08/04/los-90-dias-mas-duros-de-la-pandemia-1-de-cada-3-muertes-en-ese-lapso-de-tiempo-corresponden-al-covid-19/,"De esos fallecidos, 12.943 (33,23%) corresponden a un confirmado por PCR positivo (9.279, 23,82%) o un caso sospechoso de haber muerto por el virus (3.664, 9,41%). Es decir, uno de cada tres muertes r",04-08-2020 13:03,https://www.bing.com/th?id=OVFT.NOzVPiWyOhaHTdxbxqNUPS,Chile,El Mostrador
“Ojalá en octubre se abra una ventana para la rayuela ...,https://laprensaaustral.cl/deportes/ojala-en-octubre-se-abra-una-ventana-para-la-rayuela/,"La rayuela, como todos los deportes, también fue una “víctima” del Covid-19 y su retorno a las canchas sigue siendo incierto en medio de la pandemia. La ansiedad de los más menos 200 jugadores que pra",04-08-2020 13:15,https://www.bing.com/th?id=OVFT.qorQHGZC_lq8e6_GTcLtZy,Chile,La Prensa Austral
Coronavirus: América Latina supera los 5 millones de casos ...,https://www.fayerwayer.com/2020/08/coronavirus-america-latina-covid-19/,La pandemia global del Coronavirus Covid-19 avanza a su ritmo distintivo en cada región del planeta y sin lugar a dudas América Latina se ha convertido en uno de los puntos más complejos donde sucede,04-08-2020 13:18,https://www.bing.com/th?id=OVFT.LSgMzt6qmcw2LbvkMyox6y,Chile,FayerWayer
COVID 19: Se registran 50 días continuos de mejoría | El ...,https://www.elperiodista.cl/covid-19-se-registran-50-dias-continuos-de-mejoria/,"El ministro de Salud, Enrique Paris, señaló al inicio de la entrega del reporte que “hoy completamos 50 días de mejoría, seguimos paso a paso avanzando en la recuperación del país”. La variación de ca",04-08-2020 13:47,https://www.bing.com/th?id=OVFT.K-w42awglBh4fs1-KMsfgy,Chile,El Periodista
Disponible app Sporty para generar redes que conecten a ...,https://www.transmedia.cl/blog/2020/08/04/disponible-app-sporty-para-generar-redes-que-conecten-a-entrenadores-y-atletas/,Dar mayor visibilidad al campo de la Actividad Física  y el Entrenamiento en nuestro país son algunas de las razones por las cuales se lanza la nueva app “Sporty” que busca generar redes y entregar to,04-08-2020 14:09,https://www.bing.com/th?id=OVFT.UZHMZrmNDHx7OY6DGBttqS,Chile,Transmedia
Casi la mitad de los chilenos subió de peso durante ...,https://www.latribuna.cl/nacional/2020/08/04/casi-la-mitad-de-los-chilenos-subio-de-peso-durante-cuarentena-segun-estudio.html,"Así lo reveló la ""Encuesta de Consumo de alimentos y ansiedad durante la cuarentena por COVID-19 en Iberoamérica"", donde un considerable segmento de la población de nuestro país -que participó entre a",04-08-2020 15:09,https://www.bing.com/th?id=OVFT.yEMwizD7WYbhNvUqGm-ghC,Chile,La Tribuna
Mano a mano con Chaleco López: práctica con consola ...,https://www.biobiochile.cl/noticias/deportes/motor/2020/07/20/francisco-chaleco-lopez-entrevista.shtml,"Francisco ‘Chaleco’ López es, sin duda, uno de los mayores referentes del mundo tuerca en Chile. Ya sea en moto o en automóvil, el oriundo de Curicó siempre logra reinventarse y destacar entre los deportistas nacionales. El título del Dakar conseguido en 2019 en Perú vino a consolidar",04-08-2020 15:12,https://www.bing.com/th?id=OVFT.SZgZCh_h_sEQHb7whaWkZy,Chile,Chile
Chile como polo frutícola - Diario Financiero,https://www.df.cl/noticias/opinion/columnistas/df-conexion-a-china-chile-como-polo-fruticola-para-el-mercado-chino/2020-08-03/190329.html,"Desde 2018, China superó a Estados Unidos como el principal importador de productos silvícolas y agropecuarios chilenos. De hecho, Chile ha sido reconocido por China como un potencial hub (o polo) de",04-08-2020 15:23,https://www.bing.com/th?id=OVFT.Noq9BJq07fKCXEJBIjeV4i,Chile,df.cl
A-ha reprograma concierto en Chile en casi un año ...,https://www.biobiochile.cl/noticias/artes-y-cultura/musica/2020/08/04/ha-reprograma-concierto-chile-casi-ano-devolucion-entradas-comienza-esta-semana.shtml,"Para este 3 de septiembre estaba agendado el concierto en Chile de A-ha, banda noruega que ahora reprogramó su concierto en Santiago para el domingo 29 de agosto de 2021 en Movistar Arena. “Debido al",04-08-2020 15:27,https://www.bing.com/th?id=OVFT.zr_g0gXY2we8vgZ33sbRzC,Chile,Chile
Una de cada tres muertes registradas durante los últimos ...,https://www.elciudadano.com/chile/una-de-cada-tres-muertes-registradas-durante-los-ultimos-90-dias-en-chile-estan-asociadas-al-covid-19/08/04/,"Entre el 1 de mayo y el 29 de julio, una de cada tres defunciones ocurridas en Chile han estado asociadas al COVID-19, tal y como revelan los datos del Ministerio de Salud. De los 38.955 decesos que reportó el Departamento de Estadísticas e Información de Salud (DEIS)durante ese período, un",04-08-2020 15:34,https://www.bing.com/th?id=OVFT.ooDnQu0E4gkclWS47Ddkti,Chile,El Ciudadano
EN VIVO: Cifras actualizadas de coronavirus en Chile | Tele 13,https://www.t13.cl/noticia/nacional/en-vivo-coronavirus-chile-casos-muertes-minsal-4-08-2020,"El 3 de marzo de 2020 el Ministerio de Salud confirmó el primer caso positivo de coronavirus en Chile. Desde ahí, cada día la autoridad sanitaria presenta un balance del estado de avance de la pandemia global en el país. El 13 de junio y tras más de cien días de la llegada del COVID-19 a Chile",04-08-2020 15:52,https://www.bing.com/th?id=OVFT.kzHZVfC6KKD4pPMv6jzpWS,Chile,T13
Coronavirus en tiempo real: La curva de contagios en Chile ...,https://www.t13.cl/noticia/nacional/4-de-agosto-2020-curva-contagios-muertes-coronavirus,Un médico de la región del Maule fue el primer paciente cuyos exámenes por COVID-19 dieron positivos en Chile. El profesional de 33 años llegó al país proveniente de un viaje que incluyó varios destinos del sudeste asiático y el diagnóstico fue confirmado el 3 de marzo. Desde esa fecha se,04-08-2020 15:57,https://www.bing.com/th?id=OVFT.BueyzpDtK9SUVL4nlSse8i,Chile,T13
Chile sumó 38 muertes y 1.462 contagiados por COVID el ...,https://www.prensafutbol.cl/362620-minsal-informe-coronavirus-04-de-agosto-2020-chile-covid19/,"El ministerio de Salud entregó el reporte del avance del coronavirus, el cual detalló que se sumaron 38 fallecidos en el último día, lo que aumentó la cifra a 9.745 decesos. Además, los contagios en e",04-08-2020 16:01,https://www.bing.com/th?id=OVFT.eVpeWI4cBVvAkG-Dz4iS6y,Chile,Prensafútbol
La cifra más baja desde mayo: Minsal informa 1.462 casos ...,https://www.publimetro.cl/cl/noticias/2020/08/04/balance-baja-cifra-mayo-covid-19.html,"El Ministerio de Salud dio a conocer el balance de contagiados y fallecidos por coronavirus en las últimas 24 horas. Este martes, el ministro Enrique Paris, destacó la baja positividad y casos nuevos,",04-08-2020 16:02,https://www.bing.com/th?id=OVFT.wzt3Bfzx-1QqanJVdbb0hy,Chile,publimetro.cl
Nuevo balance Covid-19 en Chile: los casos confirmados han ...,https://redmagallanes.com/nacional/nuevo-balance-covid-19-en-chile-los-casos-confirmados-han-disminuido-un,"Las autoridades sanitarias entregaron el último balance de Covid-19 en nuestro país. Al comenzar un nuevo reporte del balance Covid-19 en Chile, el ministro Enrique Paris señaló: ""Los casos confirmado",04-08-2020 16:10,https://www.bing.com/th?id=OVFT.ShJI7s9xNhe0pgCH9TM1zS,Chile,Red Magallanes
Confirman 1.462 casos nuevos y 38 fallecidos por Covid en ...,http://www.ladiscusion.cl/confirman-1-462-casos-nuevos-y-38-fallecidos-por-covid-en-el-pais/,"En las últimas horas, se diagnosticaron 1.462 nuevos contagios por Covid-19 en todo el territorio nacional. De ellos, 1.049 presentaron síntomas, 350 son casos asintomáticos y 63 con PCR positivo sin",04-08-2020 16:13,https://www.bing.com/th?id=OVFT.3ypwZPyVgp0_PHbIBi--9y,Chile,La Discusión
Chile registra 38 fallecidos asociados al Covid en última ...,https://www.theclinic.cl/2020/08/04/chile-registra-38-fallecidos-asociados-al-covid-en-ultima-jornada/,"Durante el balance de este martes el subsecretario de Redes Asistenciales, Arturo Zúñiga, informó que hasta las 21 horas de ayer Chile registró 38 fallecidos asociados al Covid-19, según las cifras del Departamento de Estadísticas e Información de Salud (DEIS). Con esto se llega a un número total de 9.745 decesos desde que llegó la…",04-08-2020 16:21,https://www.bing.com/th?id=OVFT.wmeo6s-YlR0LEfjMmsIAhy,Chile,Clinic
"Reportan 1.462 casos nuevos de Covid-19, la... | Puranoticia",https://www.puranoticia.cl/noticias/nacional/reportan-1-462-casos-nuevos-de-covid-19-la-cifra-diaria-mas-baja-desde/2020-08-04/122623.html,"También se reportó el fallecimiento de 38 personas en Chile, de acuerdo a la base de datos del DEIS. De esta forma, el total de víctimas fatales llegó a 9.745. El Ministerio de Salud entregó este mart",04-08-2020 16:31,https://www.bing.com/th?id=OVFT.e-H3AYJMw6MyVTbwSTNqAS,Chile,Puranoticia.cl
Covid-19: nuevos casos bajan de los 1.500 por primera vez ...,https://elpinguino.com/noticia/2020/08/04/covid-19-nuevos-casos-bajan-de-los-1500-por-primera-vez-en-85-dias-y-leve-mejoria-sigue-su-curso,El Ministerio de Salud reportó la mañana de este martes 1.462 casos nuevos y 38 muertes por coronavirus. Desde la cartera valoraron los números en el tradicional balance emitido desde La Moneda. “Hay,04-08-2020 16:33,https://www.bing.com/th?id=OVFT.fmB_xGqoMYsyCpmFD0afFy,Chile,ELPINGUINO
Plantel de Santiago Wanderers dio negativo en... | Puranoticia,https://www.puranoticia.cl/noticias/deportes/plantel-de-santiago-wanderers-dio-negativo-en-nuevos-examenes-pcr/2020-08-04/123100.html,"El club informó que los jugadores, cuerpo técnico y funcionarios del complejo deportivo se sometieron por tercera semana consecutiva a exámenes de PCR, saliendo nuevamente todos negativo. Santiago Wan",04-08-2020 16:36,https://www.bing.com/th?id=OVFT.4TmvabjupaxAskNLqkPBwy,Chile,Puranoticia.cl
