name,url,description,datePublished,imagen,pais,Fuente
Plebiscito: Senadora Rincón (DC) plantea implementar voto ...,https://www.elmostrador.cl/dia/2020/08/28/plebiscito-senadora-rincon-dc-plantea-implementar-voto-por-correo-para-enfermos-covid/,"La senadora Ximena Rincón (DC) respondió al Presidente Sebastián Piñera respecto a la posibilidad de establecer el voto por correo para enfermos covid-19 en el plebiscito del 25 de octubre. ""Este tema",28-08-2020 22:32,https://www.bing.com/th?id=ON.FE1EB1FE1D8103955FFEC6FCB0EC52AF,Chile,El Mostrador
Balance: Se registran 1.868 casos nuevos y 60 fallecidos ...,https://www.24horas.cl/coronavirus/balance-se-registran-1868-casos-nuevos-y-60-fallecidos-por-covid-19-4417710,"Investigadora ICBM U. de Chile: ""El virus está en la población y va a seguir",28-08-2020 22:32,https://www.bing.com/th?id=ON.E63DDA4A9FE859F353CBCEBD2BEA8B95,Chile,24 Horas Chile
Para octubre de 2021 se trasladó debut de Emperor en Chile ...,https://www.cooperativa.cl/noticias/entretencion/musica/shows-en-chile/para-octubre-de-2021-se-traslado-debut-de-emperor-en-chile/2020-08-28/105337.html,"Recuerda nuestra campaña ""Todos podemos hacer más"", si tienes una iniciativa solidaria que quieras comunicar, llámanos al 223648003 o visita nuestro sitio si quieres hacer tu aporte La banda noruega E",28-08-2020 22:52,https://www.bing.com/th?id=ON.A5A7C5DBFF2C210680E8F4B5A927C511,Chile,Radio Cooperativa
Enrique Osses despedido de la Comisión de árbitros de la ...,https://www.t13.cl/noticia/deportes13/enrique-osses-despedido-comision-de-arbitros-anfp-futbol-chileno-var-28-08-2020,El ex árbitro nacional y hasta este viernes presidente de la Comisión de Árbitros de la Asociación Nacional de Fútbol Profesional (ANFP) Enrique Osses fue despedido de su cargo y no seguirá siendo par,28-08-2020 23:19,https://www.bing.com/th?id=ON.57992AC5624A6377E6B323FE70310559,Chile,T13
Argentina extiende cuarentena tras un salto de casos de ...,https://www.latercera.com/mundo/noticia/argentina-extiende-cuarentena-tras-un-salto-de-casos-de-coronavirus-en-agosto/LCIRFKPRU5D3VDNPZJEH5ATQ5M/,"Por sobre la barrera de los 10 mil casos diarios, Argentina intenta enfrentar la pandemia de Covid-19, que parece registrar sus peores días en el país. El país ya se encuentra en el puesto 11 de las n",28-08-2020 23:38,https://www.bing.com/th?id=ON.916D9A2BBAECD5D4F43F49229F64A9EC,Chile,LA TERCERA
Instan al gobierno a facilitar voto de contagiados con ...,https://www.df.cl/noticias/economia-y-politica/politica/senadora-rincon-dc-pone-presion-al-gobierno-para-facilitar-voto-de/2020-08-28/192401.html,"Ante la postura asumida por las autoridades en cuanto a que quienes estén contagiados de Covid-19 no podrán ejercer su derecho a voto, en el plebiscito del 25 de octubre, la senadora Ximena Rincón (DC",28-08-2020 23:44,https://www.bing.com/th?id=ON.715B94EABE52AD2968A826B44E8C9811,Chile,df.cl
UMAG colabora con estudio acerca de las experiencias de ...,https://www.itvpatagonia.com/noticias/umag-colabora-con-estudio-acerca-de-las-experiencias-de-familias-y-sus-hijos-pequenos-en-contexto-de-covid-19/,"-La investigación internacional liderada por la Universidad de Maryland (Estados Unidos) se propone comprender mejor estas vivencias y los efectos que tiene el confinamiento, para aportar en las medid",29-08-2020 02:08,https://www.bing.com/th?id=ON.AC8947B9DC0C739B958C64D0B5C1AF3A,Chile,ITV
1.868 nuevos casos de Covid-19 en Chile que totaliza 405 ...,https://www.itvpatagonia.com/noticias/1-868-nuevos-casos-de-covid-19-en-chile-que-totaliza-405-972-diagnosticados-60-fallecidos-en-la-ultima-jornada/,"Minsal reporta hoy 60 decesos y 1.860 casos nuevos de covid-19: Hubo más de 30 mil exámenes y 6,1% de positividad",29-08-2020 02:08,https://www.bing.com/th?id=ON.AF81E28FA0B58769D0006E1A637978E1,Chile,ITV
“Las organizaciones deportivas que se adjudicaron ...,https://elpinguino.com/noticia/2020/08/28/las-organizaciones-deportivas-que-se-adjudicaron-fondeporte-pidieron-postergacion-para-el-2021-y-se-lo-estamos-concediendo,"Dijo Iván Andrade, Director regional del Instituto Nacional del Deporte (IND), en relación a los proyectos deportivos que estaban para ejecutarse durante el 2020. A pesar de la complicada situación qu",29-08-2020 02:09,https://www.bing.com/th?id=ON.F74165A68F96E34690C80EA8EBAB7742,Chile,ELPINGUINO
"Presidente señala que ""lo primero es la salud"" ante debate ...",https://www.emol.com/noticias/Nacional/2020/08/28/996374/Presidente-y-Plebiscito.html,"Ante el debate sobre la posibilidad de que los contagiados con covid-19 puedan votar en el Plebiscito de octubre, el Presidente Sebatián Piñera señaló este viernes que el Gobierno ha planteado que ""lo",29-08-2020 03:05,https://www.bing.com/th?id=ON.4C6752BC1CFA80C96F1865AB9335FC26,Chile,Emol
Ministros Zaldívar y Briones llaman a la unidad para la ...,http://www.lanacion.cl/ministros-zaldivar-y-briones-llaman-a-la-unidad-para-la-recuperacion-del-empleo/,"Los ministros de Hacienda, Ignacio Briones, y del Trabajo, María José Zaldívar, se refirieron a la última cifra de desempleo en el trimestre móvil mayo-julio, publicada por el INE, que alcanzó un 13,1",29-08-2020 03:27,https://www.bing.com/th?id=ON.51413364E0CDED1F43F5917B67E0C82F,Chile,La Nación
Celebraciones responsables y con esencia preventiva,http://www.eldivisadero.cl/redac-59264,"A esta altura del año estamos ad portas de enfrentar un mes importantísimo para los chilenos, el mes de septiembre, mes de la patria, mes de celebración, de festejo, de relajo, de reuniones familiares",29-08-2020 04:07,https://www.bing.com/th?id=ON.C80C9184BDBB0D16E0ED63DB828B4F18,Chile,Diario el Divisadero
Hoy más que nunca el orgullo de ser gendarme,http://www.eldivisadero.cl/redac-59263,"Este fin de semana culmina el proceso de inscripción de candidatos del Premio El Orgullo de Ser Gendarme 2020, concurso impulsado por nuestro alto mando institucional y que busca reconocer a funcionar",29-08-2020 04:07,https://www.bing.com/th?id=ON.C80C9184BDBB0D16E0ED63DB828B4F18,Chile,Diario el Divisadero
Este semestre se iniciarán obras del par vial Collao Novoa ...,https://www.diarioconcepcion.cl/ciudad/2020/08/29/este-semestre-se-iniciaran-obras-del-par-vial-collao-novoa-en-concepcion.html,"La obra renovará más de dos kilómetros del colapsado sector. Secretario de Estado dijo que se debe pensar las ciudades a 50 años, con más espacios públicos y mejor estándar en viviendas. Un total de 2",29-08-2020 04:33,https://www.bing.com/th?id=ON.9FAD81FA9CF01CE3C2FB2CBE7B19E8D4,Chile,El Diario de Concepcion
El retorno - El Mostrador,https://www.elmostrador.cl/destacado/2020/08/29/el-retorno/,Lo cierto y real es que la actividad vuelve a tener movimiento y precisamente acá en Chile. En los últimos 12 meses el torneo chileno ha sido afectado de manera directa por el estallido social y luego,29-08-2020 05:21,https://www.bing.com/th?id=ON.5B1E9DB74273AAA2460B17E4D4801269,Chile,El Mostrador
El 94 por ciento de los contagiados de Covid-19 en Chile ...,https://www.cooperativa.cl/noticias/sociedad/salud/coronavirus/el-94-por-ciento-de-los-contagiados-de-covid-19-en-chile-se-ha-recuperado/2020-08-28/105004.html,"379.452 personas ya han sido dadas de alta y sólo 15.388 están activos. En la última jornada se reportaron 1.868 nuevos casos y 60 fallecimientos. Recuerda nuestra campaña ""Todos podemos hacer más"", s",29-08-2020 05:24,https://www.bing.com/th?id=ON.119DF943431C9C9F4BB7D23798E68CFD,Chile,Radio Cooperativa
Natalia Lafourcade se suma al ciclo de conciertos ...,https://www.chilevision.cl/vamos-contigo/novedades/natalia-lafourcade-se-suma-al-ciclo-de-conciertos-personalizados-para,"Los conciertos de Vicentico, Sebastián Yatra y Gepe han sido todo un éxito. Ahora, será el turno de la mexicana Natalia Lafourcade, única artista femenina de la campaña solidaria de Mercado Libre. #Co",29-08-2020 05:43,https://www.bing.com/th?id=ON.4B52B5265BC7217DA2F600C6FFB36418,Chile,chilevision.cl
Realizan la segunda entrega del Fondo Único de apoyo a los ...,http://www.chanarcillo.cl/realizan-la-segunda-entrega-del-fondo-unico-de-apoyo-a-los-sistemas-de-agua-potable-rural/,Con éxito se realizó la segunda entrega del Fondo Único de Apoyo a las APR impulsado por el Gobierno y el Ministerio de Obras Públicas en el marco de la emergencia sanitaria y económica que vive el pa,29-08-2020 06:24,https://www.bing.com/th?id=ON.CF3C18A44370EDD6D161AABBA5831028,Chile,Diario Chanarcillo
Gabriel Osorio: el estilo del abogado transversal del PS ...,https://www.pauta.cl/politica/gabriel-osorio-quien-abogado-partido-socialista-acuerdo-plebiscito-seguro,Cómo realizar un Plebiscito seguro el 25 de octubre en medio de las complicaciones que trae la pandemia y cómo regular el financiamiento de las campañas que partieron esta semana han sido dos de los t,29-08-2020 06:42,https://www.bing.com/th?id=ON.FCDA5ACB164B343EB9D29786723D74A0,Chile,pauta
Coronavirus: cerca de las 840.000 víctimas en todo el mundo,https://www.adnradio.cl/internacional/2020/08/29/coronavirus-cerca-de-las-840-000-victimas-en-todo-el-mundo.html,Las cifra muestran la tragedia que provoca la emergencia global. Los registros de la Universidad Johns Hopkins muestran que a la fecha se contabilizan al menos 837.559 personas que perdieron la vida p,29-08-2020 10:04,https://www.bing.com/th?id=ON.62186EF54D34237F1E6DB6CD2C75F9CF,Chile,ADN
Conoce a tu enemigo: Laboratorio UC explica cómo logró ...,https://www.latercera.com/que-pasa/noticia/conoce-a-tu-enemigo-laboratorio-uc-explica-como-logro-aislar-el-virus-causante-de-la-covid-19/2XNEDQTHI5G5LBRF6CUSL4UVYA/,"En abril pasado, a poco más de un mes de la detección del primer caso de coronavirus en Chile, el Instituto de Salud Pública (ISP) anunció un importante paso en la lucha contra la pandemia: el aislami",29-08-2020 11:21,https://www.bing.com/th?id=ON.2CA9DE70FF3F6F12CD5F8F5AC3CC5A3E,Chile,LA TERCERA
Colo Colo y Wanderers marcan la vuelta al fútbol | La ...,https://laprensaaustral.cl/deportes/colo-colo-y-wanderers-marcan-la-vuelta-al-futbol/,"Tras casi seis meses con el fútbol chileno suspendido por el coronavirus, este fin de semana regresa con todo el Torneo Nacional de Primera “A”. Esta tarde a las 14,30 horas (de Magallanes) Colo Colo",29-08-2020 12:30,https://www.bing.com/th?id=ON.39CB484CE26DC89A8586F095FA21986C,Chile,La Prensa Austral
"Desempleo rompió otro récord y llegó al 13,1% | La Prensa ...",https://laprensaaustral.cl/nacional/desempleo-rompio-otro-record-y-llego-al-131/,"El desempleo en Chile anotó un nuevo récord tras subir a un 13,1% en el trimestre móvil mayo-julio, un alza de 5,6 puntos porcentuales respecto a igual período del año pasado, debido a los efectos de",29-08-2020 13:32,https://www.bing.com/th?id=ON.8C6A847307645709539FC556C0AAE0FB,Chile,La Prensa Austral
Coronavirus: pronóstico sombrío en EEUU y reacciones ...,https://www.elperiodista.cl/coronavirus-pronostico-sombrio-en-eeuu-y-reacciones-diversas-ante-rebrotes-en-europa/,"El número de fallecimientos por coronavirus en Estados Unidos trepará de los 181.265 actuales a 317.312 en diciembre, según un cálculo del Instituto de Métricas y Evaluación de la Salud (IHME, en ingl",29-08-2020 13:53,https://www.bing.com/th?id=ON.E8D054D15C5BB1672ED21C1F9FB9407B,Chile,El Periodista
Al igual que en Chile: Argentina debatirá un impuesto a ...,https://www.biobiochile.cl/noticias/internacional/america-latina/2020/08/29/al-igual-que-en-chile-argentina-debatira-un-impuesto-a-los-super-ricos.shtml,"El Congreso de Argentina debatirá a partir de la próxima semana un impuesto a las grandes fortunas, tras presentarse este viernes un proyecto que contempla el gravamen por una sola vez y con ocasión d",29-08-2020 14:06,https://www.bing.com/th?id=ON.165095B183A9C64011A36F0CF7E90C87,Chile,Chile
Masivos testeos en servicios públicos para detectar casos ...,http://www.ladiscusion.cl/masivos-testeos-en-servicios-publicos-para-detectar-casos-asintomaticos/,Los centros de salud familiar de la comuna continúan con la estrategia de testeos masivos para detectar tempranamente posibles casos de Coronavirus (Covid-19) en la población. Esta semana el cesfam Is,29-08-2020 14:07,https://www.bing.com/th?id=ON.DA8C4AEDA3805A52266063B892A6B89E,Chile,La Discusión
Expertos explican cómo es que Perú pasó a ser el país con ...,http://www.lanacion.cl/expertos-explican-como-es-que-peru-paso-a-ser-el-pais-con-mayor-mortalidad-por-covid-19-en-el-mundo/,"Con 86 decesos por cada 100.000 habitantes, Perú desplazó esta semana a Bélgica (85,5%) en el ranking global de mortalidad por coronavirus, luego de que el país europeo corrigiera a la baja su cifra d",29-08-2020 14:10,https://www.bing.com/th?id=ON.EBA5F13BE274B468EB084C891E063F6D,Chile,La Nación
Estudio Data Influye: Jadue se transforma en el ...,https://www.elciudadano.com/chile/estudio-data-influye-jadue-se-transforma-en-el-precandidato-presidencial-favorito-de-la-opinion-publica/08/28/,"Este viernes 28 de agosto se entregaron los resultados del Estudio Data Influye, correspondiente a agosto, el cual mostró altos índices de desaprobación acerca de la gestión de Sebastián Piñera y el E",29-08-2020 14:11,https://www.bing.com/th?id=ON.B5849B454FFD0A4AAA90F8B197EBF73C,Chile,El Ciudadano
Felipe Kast va por el Apruebo: “Es una oportunidad para ...,https://www.cnnchile.com/pais/felipe-kast-voto-apruebo-dejar-fuera-radicales-toma-decision_20200829/,"El senador Felipe Kast (Evópoli) ratificó su apoyo a la opción Apruebo de cara al plebiscito del próximo 25 de octubre. “Hay quienes creen que estar por el Apruebo es una ingenuidad, porque sería una",29-08-2020 14:29,https://www.bing.com/th?id=ON.9C5CC2513C1D6F0EA55E3E82A579654E,Chile,CNN Chile
Nuevo reporte Minsal coronavirus en Chile 29 de agosto ...,https://www.t13.cl/noticia/nacional/nuevo-reporte-coronavirus-chile-covid-19-muertos-contagios-29-8-2020,"Este sábado, el Ministerio de Salud (Minsal) reportó más de 2 mil nuevos contagios y 49 nuevas muertes por COVID-19 en las últimas 24 horas. Tras las 49 nuevas muertes, el total de fallecimientos asci",29-08-2020 15:12,https://www.bing.com/th?id=ON.5A89F165BA450C260D9B9CF77518F013,Chile,T13
Suazo lidera las movidas del fútbol chileno en tiempos de ...,https://www.prensafutbol.cl/364879-los-movimientos-de-jugadores-en-primera-en-tiempos-de-pandemia/,Vuelve el fútbol chileno y el partido que abrirá el retorno a la competencia en la Primera A será entre Colo Colo y Santiago Wanderers el 29/08 a las 13:30 en el Monumental. Pero este tiempo sin activ,29-08-2020 15:15,https://www.bing.com/th?id=ON.19F13FE55DC25F8B406697C067770D1E,Chile,Prensafútbol
Chile traspasa los 408 mil casos de covid-19: 2.033 nuevos ...,https://www.biobiochile.cl/noticias/nacional/chile/2020/08/29/chile-traspasa-los-408-mil-casos-de-covid-19-2-033-nuevos-positivos-y-49-muertes-en-ultimas-horas.shtml,"El Ministerio de Salud (Minsal) reportó este sábado que en las últimas 24 horas se registraron 2.033 casos nuevos de contagios de covid-19. De esos, 1.330 son personas sintomáticas y 645 no presentan",29-08-2020 15:17,https://www.bing.com/th?id=ON.EF994D4AFADBF2D7952A87A8F6F265A0,Chile,Chile
Balance coronavirus: Se registran más de 2.000 nuevos ...,https://www.meganoticias.cl/nacional/312046-coronavirus-chile-casos-retorno-seguro-plan-paso-a-paso-29-de-agosto-jdx14.html,"A través de sus redes sociales, la autoridad sanitaria informó que en las últimas 24 horas se registraron 2.033 nuevos casos de contagios, de los cuales 1.330 presentaron síntomas, 645 son asintomátic",29-08-2020 15:20,https://www.bing.com/th?id=ON.926BE91772E5D9F5237D5243059406D9,Chile,meganoticias
Minsal informó 2.033 nuevos casos y ya son 408.009 los ...,https://www.adnradio.cl/nacional/2020/08/29/minsal-informo-2-033-nuevos-casos-y-ya-son-408-009-los-contagiados-con-coronavirus-en-chile.html,"Durante la mañana de este sábado se entregó un nuevo balance respecto del estado de la pandemia del coronavirus Covid-19 en Chile, informando que actualmente existen 2.033 nuevos casos, llegando a un",29-08-2020 15:23,https://www.bing.com/th?id=ON.D56C9765ABA0CB94E6CB921FFEA6E502,Chile,ADN
Covid-19: Fallecidos en Chile llegan a 11.181 personas y ...,https://www.latribuna.cl/nacional/2020/08/29/covid-19-fallecidos-llegan-a-11-181-personase-y-nuevos-casos-suman-2-033.html,"La cifra total de personas diagnosticadas con COVID-19 en el país alcanza a las 408.009. De ese total, 15.645 se encuentran en etapa activa del virus. Los casos recuperados son 381.183. En el marco de",29-08-2020 15:28,https://www.bing.com/th?id=ON.9A7DEBC191B10ABD44DAB6383F51CDB9,Chile,La Tribuna
"Análisis | Ciudades con y post COVID-19: 18 medidas, tres ...",https://www.eldesconcierto.cl/2020/08/29/ciudades-con-y-post-covid-19/,"tenemos evidencia puntual de medidas efectivas de prevención, como el CESFAM de Providencia que informa pocos casos entre sus trabajadores de salud y ninguna muerte, con testeo mensual y las medidas d",29-08-2020 15:50,https://www.bing.com/th?id=ON.1E6EBC3BE83DAB3E603FB049F83AFF61,Chile,eldesconcierto
Chile volvió a pasar la barrera de 2 mil casos diarios por ...,https://www.prensafutbol.cl/365052-chile-volvio-pasar-la-barrera-de-2-mil-casos-diarios-por-covid-19/,"En un nuevo balance de las autoridades de salud, informaron que hubo un ligero aumento de casos en las últimas 24 horas con 2.033 contagios y un total de 408.009 desde que llegó la pandemia al país el",29-08-2020 16:06,https://www.bing.com/th?id=ON.06F1A65F88235C5339ED021FCFA5E64A,Chile,Prensafútbol
Chile vuelve a superar el umbral de los 2.000 contagios ...,https://www.eldesconcierto.cl/2020/08/29/chile-vuelve-a-superar-el-umbral-de-los-2-000-contagios-diarios-por-covid-19/,"Desde el Minsal señalaron que en las últimas 24 horas fallecieron 49 personas por COVID-19, llegando a 11.181 las muertes asociadas al virus. Este sábado, el Ministerio de Salud entregó las últimas ci",29-08-2020 16:21,https://www.bing.com/th?id=ON.54429141AC92044F0B46A8B1BBB9D689,Chile,eldesconcierto
Minsal reporta más de 2 mil contagios nuevos y 49 muertes ...,http://www.ladiscusion.cl/minsal-reporta-mas-de-2-mil-contagios-nuevos-y-49-muertes-por-covid-en-chile/,"El Ministerio de Salud reportó este sábado 2.033 casos nuevos de Covid-19. Se trata de 1.330 casos con síntomas, 645 asintomáticas y 58 con PCR positivo que no fueron notificados. La cifra total de pe",29-08-2020 16:24,https://www.bing.com/th?id=ON.901A61CED468E9D0CDC6B41375FD49B1,Chile,La Discusión
El Parque Metropolitano de Santiago reabre sus con ...,https://www.plataformaarquitectura.cl/cl/946702/el-parque-metropolitano-de-santiago-reabre-sus-con-intervencion-de-cekis,"La obra se encuentra en el acceso de Pedro de Valdivia Norte del Parque Metropolitano de Santiago y fue creada por el estudio creativo Lira Arte Público, especialistas en intervenciones en espacios pú",29-08-2020 16:41,https://www.bing.com/th?id=ON.8D0ECB4279A54F2D1F42C0F9715C25D7,Chile,Plataforma Arquitectura
