name,url,description,datePublished,imagen,pais,Fuente
"VIDEO José Antonio Neme explotó contra los antivacunas en pleno matinal: “Usted que está en su casa, googlee”",https://www.theclinic.cl/2021/05/12/video-jose-antonio-neme-exploto-contra-los-antivacunas-en-pleno-matinal-usted-que-esta-en-su-casa-googlee/,"El conductor de Mucho Gusto lamentó el caso del ciclista Cristopher Mansilla, quien murió por la enfermedad, y disparó contra los movimientos antivacunas ""aunque me vayan a funar a mi casa"".",12-05-2021 17:23,https://www.bing.com/th?id=OVFT.Hbsg08x0C1AsyqUxn3sLBy,Chile,Clinic
"""Cada día es un milagro"": Doctora Herrera se encuentra hospitalizada por COVID-19",https://www.elperiscopio.cl/destacado-1/cada-dia-es-un-milagro-doctora-herrera-se-encuentra-hospitalizada-por-covid-19/,"La doctora Carolina Herrera informó que no solo contrajo el virus, sino que llegó a complicarse por otro problema; pero está bien.",12-05-2021 17:31,https://www.bing.com/th?id=OVFT.h8tJWxydBt2NnjKCmH9Roi,Chile,elperiscopio.cl
"Pérez: «Conmebol no ha llamado, pero Chile está disponible»",https://www.prensafutbol.cl/408897-ministra-perez-la-conmebol-no-se-ha-comunicado-con-nosotros/,"La ministra del deporte Cecilia Pérez afirmó que se encuentran disponibles para albergar la Copa América 2021, en el caso de que Colombia o Argentina desistan albergar este evento por la crisis social",12-05-2021 18:26,https://www.bing.com/th?id=OVFT.hHxeeSxICBVKR6NJofAEty,Chile,Prensafútbol
Chile supera los 16 millones de dosis administradas de la vacuna contra el Covid-19,https://www.elmostrador.cl/dia/2021/05/12/chile-supera-los-16-millones-de-dosis-administradas-de-la-vacuna-contra-el-covid-19/,"Más de 8,7 millones de personas se han inoculado con la primera dosis. En tanto, casi 7,3 millones lo han hecho con ambas.",12-05-2021 20:05,https://www.bing.com/th?id=OVFT.VqB5j3kB_nYxZIrHWcVTCS,Chile,El Mostrador
Chile suma 3.920 nuevos casos covid-19 y 28 decesos en las últimas 24 horas,https://www.diarioconcepcion.cl/pais/2021/05/12/chile-suma-3-920-nuevos-casos-covid-19-y-28-decesos-en-las-ultimas-24-horas.html,"Este miércoles 12 de mayo el Ministerio de Salud informó en el reporte covid-19 que Chile registró 28 nuevos decesos inscritos y 3.920 casos positivos, durante las últimas 24 horas. Del total de nuevo",12-05-2021 20:07,https://www.bing.com/th?id=OVFT.aSZR2mBGQRHHp552zFqtAi,Chile,El Diario de Concepcion
Inflación arrastra a Wall Street mientras el IPSA concreta su quinta sesión a la baja,https://www.df.cl/noticias/mercados/bolsa-monedas/inflacion-arrastra-a-wall-street-mientras-el-ipsa-concreta-su-quinta/2021-05-12/081003.html,"El Dow Jones cayó 1,99% hasta perder los 34 mil puntos, seguido por el S&P 500 que retrocedió 2,12% hasta los 4.063. En tanto, las tecnológicas vuelven a cae un 2,67%, arrastrando al Nasdaq hacia los",12-05-2021 20:22,https://www.bing.com/th?id=OVFT.CCBIwfCcvdZajE5gSAT8_y,Chile,df.cl
Informe epidemiológico: Casos activos en Chile registran baja desde el 1 de mayo y llegan a 46 mil,https://www.emol.com/noticias/Nacional/2021/05/12/1020694/Casos-baja-1mayo-epidemiologico.html,El reporte revela que 15 de las 16 regiones disminuyeron sus contagiantes en comparación con el estudio anterior.,12-05-2021 22:01,https://www.bing.com/th?id=OVFT.jxLNykd6pmCdIUu3UAIOcy,Chile,Emol
En Machalí presentan estrategia nacional “Cuadrillas Sanitarias en tu Barrio”.,https://www.elrancaguino.cl/2021/05/12/en-machali-presentan-estrategia-nacional-cuadrillas-sanitarias-en-tu-barrio/,"En la Villa Arcoíris de la comuna de Machalí, la subsecretaria de Salud Pública, Paula Daza, lideró la presentación de",12-05-2021 22:28,https://www.bing.com/th?id=OVFT.MbjEnYuG6q0mWy4lcyAFAy,Chile,elrancaguino.cl
Calendario Vacunación Covid-19 | Quiénes se vacunan este jueves 13 de mayo en Chile,https://redgol.cl/tendencias/Calendario-de-vacunacion-Covid--Quienes-se-vacunan-este-jueves-13-de-mayo-en-Chile-Conoce-el-calendario-aca-20210512-0107.html,"A la fecha más de 7,2 millones de personas han completado la vacunación contra el coronavirus.7 Un poco más de 7,2 millones de personas en Chile han completado su vacunación contra el Covid-19. Asimis",12-05-2021 23:54,https://www.bing.com/th?id=OVFT.XclEudmbInUmnjcnWBVxqS,Chile,redgol
"Cifras del covid-19 en O'Higgins: 181 nuevos casos y positividad de 17,3%",https://eltipografo.cl/2021/05/181-nuevos-casos-y-una-preocupante-positividad-de-173-el-panorama-del-covid-en-la-region-a-pocos-dias-de-las-elecciones,"181 casos nuevos de covid-19 se reportaron ayer en la región de O’Higgins, contabilizando un total de 51.016 contagios desde que la pandemia llegó a Chile. Asimismo, no se registraron decesos en las ú",13-05-2021 01:00,https://www.bing.com/th?id=OVFT.TJEFU3prs02sYMy7pWpHaC,Chile,eltipografo.cl
Elecciones 15 y 16 de mayo: no será necesario portar consulta al Servel dentro de una misma región,https://www.elciudadano.com/chile/elecciones-15-y-16-de-mayo-no-sera-necesario-portar-consulta-al-servel-dentro-de-una-misma-region/05/12/,La exigencia de la consulta del Servel es sólo para quienes se trasladen desde una región a otra para ir a votar,13-05-2021 01:38,https://www.bing.com/th?id=OVFT.7qwB5QVtodfmcy_w-KqE4y,Chile,El Ciudadano
“Estas elecciones se hacen con más de 16 millones de personas vacunadas”,http://www.diariolongino.cl/estas-elecciones-se-hacen-con-mas-de-16-millones-de-personas-vacunadas/,"Ministro Andrés Couve, desde Iquique: Rescatando el ejemplo de disciplina social y sentido de comunidad de los pueblos originarios en esta pandemia, el líder de la cartera de Ci",13-05-2021 01:50,https://www.bing.com/th?id=OVFT.2GrPDOzoeQyBBcjVNdGKbS,Chile,El Longino
La esperanza como motor del proceso constituyente,https://www.diarioconcepcion.cl/opinion/2021/05/13/la-esperanza-como-motor-del-proceso-constituyente.html,"En un mundo cada día mas amenazado por el cambio climático y la inestabilidad social, económica y política, estos optimistas son un rayo de luz que nos permite soñar un futuro para nuestros hijos y ni",13-05-2021 03:07,https://www.bing.com/th?id=OVFT.KooorVRohxJpnnZoc6wKti,Chile,El Diario de Concepcion
Informe epidemiológico: Chile acumula baja de más de 8 mil casos en lo que va de mayo,https://www.emol.com/noticias/Nacional/2021/05/13/1020712/Chile-acumula-baja-8000-casos.html,"El reporte señala que prácticamente todas las regiones disminuyeron sus contagiantes en lo que va del mes, siendo la Metropolitana la que registró la mayor caída.",13-05-2021 03:31,https://www.bing.com/th?id=OVFT.n7yGkJUcZ_OgOQEHEwZxLi,Chile,Emol
Llegó nuevo cargamento de vacunas Pfizer con más de 270 mil dosis,https://www.radioagricultura.cl/nacional/2021/05/13/llego-nuevo-cargamento-de-vacunas-pfizer-con-mas-de-270-mil-dosis.html,Este jueves arribó al país un nuevo cargamento de vacunas contra el Covid-19 fabricadas por el laboratorio Pfizer junto a BioNTech.,13-05-2021 08:32,https://www.bing.com/th?id=OVFT.LGDhENx4FPE9VUH7xkEURS,Chile,Radio Agricultura
Cuarentenas: Conoce todas las comunas que permanecen en confinamiento total en Chile,https://www.meganoticias.cl/dato-util/336099-minsal-comunas-cuarentena-hoy-fase-1-covid-cog23.html,"Para contener la pandemia de Covid-19 en Chile, el Ministerio de Salud ha establecido cuarentenas totales en diversas comunas del país. Conoce el listado de comunas aquí.",13-05-2021 09:00,https://www.bing.com/th?id=OVFT.WYqpDQHbLyfvCpVgmmjI0S,Chile,meganoticias
Covid 19 deja ya más de 160 millones de casos en el mundo,https://www.radioagricultura.cl/internacional/2021/05/13/covid-19-deja-ya-mas-de-160-millones-de-casos-en-el-mundo.html,"La pandemia del coronavirus ha dejado ya más de 160 millones de casos en el mundo, cerca de 760.000 durante las últimas 24 horas, dos días después de superar la barrera de los 3,3 millones de muertos,",13-05-2021 09:48,https://www.bing.com/th?id=OVFT.gVHNeMZBJ8ZUupYZMMTldi,Chile,Radio Agricultura
Tras casi siete meses: Candidata Miriam Henríquez cierra campaña a constituyente,https://www.chanarcillo.cl/tras-casi-siete-meses-candidata-miriam-henriquez-cierra-campana-a-constituyente/,"* Encabezando la lista de Independientes por la Nueva Constitución, la profesora de derecho constitucional repasa los puntos más importantes",13-05-2021 10:11,https://www.bing.com/th?id=OVFT.vHe5YPqj0oTXFnpG55ziNC,Chile,Diario Chanarcillo
"Plan Paso a Paso: comuna de Santiago salió de Cuarentena este jueves, medida había sido decretada en marzo",https://www.adnradio.cl/nacional/2021/05/13/plan-paso-a-paso-comuna-de-santiago-salio-de-cuarentena-este-jueves-medida-habia-sido-decretada-en-marzo.html,"Fue el segundo confinamiento total de la ciudad debido al covid-19, el primer se extendió entre marzo y agosto de 2020.",13-05-2021 11:07,https://www.bing.com/th?id=OVFT.bOqgfM8ynX0OsQkpTzkrqS,Chile,ADN
"“Mi hermano me dijo que quería vivir, que era un gladiador”",https://laprensaaustral.cl/2021/05/13/mi-hermano-me-dijo-que-queria-vivir-que-era-un-gladiador/,Luis Mansilla reveló la conversación que tuvo con Cristopher poco antes de que el fallecido pedalero fuera intubado,13-05-2021 12:20,https://www.bing.com/th?id=OVFT.js8y9f7GzR5G0jqrMDeS5S,Chile,La Prensa Austral
Utilidades de Telefónica se duplican en primer trimestre y operación chilena emite nueva deuda,https://www.df.cl/noticias/empresas/telecom-tecnologia/utilidades-de-telefonica-se-duplican-en-primer-trimestre-y-operacion/2021-05-13/083523.html,Telefónica empieza a recuperarse tras el golpe que le significó al negocio el Covid-19. La operadora con sede en Madrid obtuvo utilidades netas por 886 millones de euros durante los tres primeros mese,13-05-2021 12:35,https://www.bing.com/th?id=OVFT.VX_RjwKyaIiUnMaMrwUySS,Chile,df.cl
Ante las aprobaciones de Canadá y EEUU ¿Cuándo podría haber vacuna COVID-19 para los niños en Chile?,https://www.biobiochile.cl/noticias/salud-y-bienestar/tratamientos/2021/05/13/ante-las-noticias-de-canada-y-eeuu-cuando-podria-haber-vacuna-covid-19-para-los-ninos-en-chile.shtml,Positivas informaciones entregaron esta semana los gobiernos de Estados Unidos y Canadá respecto a la vacunación de niños frente,13-05-2021 12:43,https://www.bing.com/th?id=OVFT.QJoOaXdF3gSX7H5OxNXLQi,Chile,Chile
Elección municipal en Natales: el reto de enfrentar los estragos de la pandemia,https://laprensaaustral.cl/2021/05/13/eleccion-municipal-en-natales-el-reto-de-enfrentar-los-estragos-de-la-pandemia/,"José Cuyul, Ana Mayorga, Felipe Muñoz y Antonieta Oyarzo buscan sentar sus reales en el sillón que desde el año 2008 ha ocupado el actual presidente nacional de la Asociación Chilena de Municipalidade",13-05-2021 13:10,https://www.bing.com/th?id=OVFT.rU0VljBUe_5-N7FSNW2MXy,Chile,La Prensa Austral
Aprobaciones en Canadá y EEUU: ¿Cuándo podría haber vacuna COVID-19 para los niños en Chile?,http://www.diarioeldia.cl/mundo/aprobaciones-en-canada-eeuu-cuando-podria-haber-vacuna-covid-19-para-ninos-en-chile,Positivas informaciones entregaron esta semana los gobiernos de Estados Unidos y Canadá respecto a la vacunación de niños frente al coronavirus. El primer país autorizó el uso de la fórmula de Pfizer,13-05-2021 13:55,https://www.bing.com/th?id=OVFT.dJcnyjOP7ZEWBtP7l69jmC,Chile,El Día
Neme hizo un fuerte llamado a los “antivacunas”: Esa postura “es una franca estupidez”,http://www.lanacion.cl/neme-hizo-un-fuerte-llamado-a-los-antivacunas-esa-postura-es-una-franca-estupidez/,"""Cuando aparecen los señores antivacunas hablando que van a quedar con autismo, no hay nada concluyente respecto al tema. Usted no se vacune, perfecto, yo no voy a obligarlo a vacunarse, pero no me po",13-05-2021 14:11,https://www.bing.com/th?id=OVFT.WXO0cSwYPIWru3C54AdLNS,Chile,La Nación
Llegó a Chile nuevo cargamento con más de 270 mil vacunas contra el covid-19 de Pfizer,https://www.adnradio.cl/nacional/2021/05/13/llego-a-chile-nuevo-cargamento-con-mas-de-270-mil-vacunas-contra-el-covid-19-de-pfizer.html,"La mañana de este jueves 13 de marzo llegó a Chile un nuevo cargamento con más de 270.000 vacunas contra el coronavirus covid-19 del laboratorio Pfizer-BioNTech. Incluyendo este envío, a la fecha han",13-05-2021 14:11,https://www.bing.com/th?id=OVFT.nRTioGDOeTNrGw96K6OGEi,Chile,ADN
"Desbordes y nuevas ayudas sociales: ""El Presidente nos dijo que teníamos que llegar al RSH completo""",https://www.t13.cl/noticia/politica/desbordes-ayudas-sociales-presidente-llegar-rsh-completo-13-05-2021,"En conversación con Tele13 Radio, el candidato presidencial de RN y el PRI se refirió específicamente a la propuesta de mínimos comunes de la oposición, indicando que hay que estudiarla y ver cómo se",13-05-2021 14:27,https://www.bing.com/th?id=OVFT.VrcxeM-BRgqX5FJ7SBY9Ni,Chile,T13
Materiales de construcción en Chile registran escasez y aumentos de precio,https://www.ovejeronoticias.cl/2021/05/materiales-de-construccion-en-chile-registran-escasez-y-aumentos-de-precio/,"Grandes, medianas y pequeñas empresas -y también los dueños de casa- han notado los aumentos de precio que han registrado los materiales de construcción en Chile. En Magallanes,",13-05-2021 14:59,https://www.bing.com/th?id=OVFT.7-n0WhPB7a4gAlNTHpSCTS,Chile,Ovejero Noticias
Plan de vacunación: llegó a Chile cargamento con más de 270 mil dosis de la vacuna Pfizer,https://www.elmostrador.cl/noticias/multimedia/2021/05/13/plan-de-vacunacion-llego-a-chile-cargamento-con-mas-de-270-mil-dosis-de-la-vacuna-pfizer/,Continúa el plan de vacunación contra el covid-19 en Chile y durante esta mañana llegó un nuevo cargamento de Pfizer. Más de 270 mil dosis fueron recibidas en el aeropuerto de Pudahuel y para esta sem,13-05-2021 15:18,https://www.bing.com/th?id=OVFT.HY1Q8HDeVIIr41ygbeAU7y,Chile,El Mostrador
Chile anota fuerte retroceso en índice de empoderamiento económico de las mujeres,https://www.latercera.com/pulso-pm/noticia/chile-anota-fuerte-retroceso-en-indice-de-empoderamiento-economico-de-las-mujeres/V3VGC2DDOFAAZD3MBWLGDAYEWU/,"Así lo mostró el PwC Women in Work Index(*), que mide el empoderamiento económico de las mujeres en 33 países de la Organización para la Cooperación y el Desarrollo Económicos.",13-05-2021 15:50,https://www.bing.com/th?id=OVFT.2XYSQu6j2CkiUwvZ_96YzS,Chile,LA TERCERA
Llegan a Chile 270 mil nuevas dosis de vacunas Pfizer para continuar con la campaña de vacunación contra el Covid-19,https://www.latercera.com/nacional/noticia/llegan-a-chile-270-mil-nuevas-dosis-de-vacunas-pfizer-para-continuar-con-la-campana-de-vacunacion-contra-el-covid-19/6IJEZJXK6FD5BMHJ37HEMN2UFQ/,Durante la madrugada de hoy llegó al país un nuevo cargamento de vacunas Pfizer-BioNTech contra el coronavirus. Se trata de 272.610 vacunas que servirán para continuar con la campaña de vacunación y e,13-05-2021 15:49,https://www.bing.com/th?id=OVFT.9Ew0DhitfeSdUbK5HT00gS,Chile,LA TERCERA
Seminario abordará dinámicas del mercado productos lácteos nacional y global,https://www.mundoagropecuario.cl/new/seminario-abordara-dinamicas-del-mercado-productos-lacteos-nacional-y-global/,"Seminario Internacional: “Mercado Lácteo: Radiografía Nacional y una mirada al mundo"" radiografía del sector lácteo nacional",13-05-2021 16:00,https://www.bing.com/th?id=OVFT.4FvwavycQnEkK0a7ikq4OC,Chile,Mundo Agropecuario
"Gobierno informa de mejoras en indicadores por covid-19 en el Bío Bío: positividad bajó a un 10,1%",https://www.biobiochile.cl/noticias/nacional/region-del-bio-bio/2021/05/13/gobierno-informa-de-mejoras-en-indicadores-por-covid-19-en-el-bio-bio-positividad-a-un-101.shtml,"El seremi de Salud del Bío Bío, Héctor Muñoz, indicó que la región presenta una mejora en varios indicadores relacionados con el testeo, trazabilidad, aislamiento e inmunización asociado con el covid-",13-05-2021 16:11,https://www.bing.com/th?id=OVFT.W_3QiyyODwEMwS0FcWdiYS,Chile,Chile
