name,url,description,datePublished,imagen,pais,Fuente
"Estados Unidos recomienda no viajar a Chile: niveles de Covid-19 son ""muy altos""",https://www.13.cl/programas/servicios-13/salud/estados-unidos-recomienda-no-viajar-a-chile-niveles-de-covid-19-son-muy,"La Oficina de Asuntos Consulares del Departamento de Estado de Estados Unidos recomendó a sus ciudadanos que no viajen a Chile por los altos niveles de contagios de coronavirus. Además, la oficina agr",18-06-2021 14:36,https://www.bing.com/th?id=OVFT.3q363JskWckF2IleyPEPDC,Chile,13.cl
DEIS: Chile tiene menos casos activos de Covid-19 que hace una semana,https://www.elmostrador.cl/dia/2021/06/19/deis-chile-tiene-menos-casos-activos-de-covid-19-que-hace-una-semana/,"Por otro lado el país superó las 40.000 muertes —desde el inicio de la pandemia— entre pacientes con Covid-19 confirmado y con sospecha de contagio, cerca de la mitad de ellas se han registrado en lo",20-06-2021 00:24,https://www.bing.com/th?id=OVFT.wARgHsyn46ndoRmobzo9HC,Chile,El Mostrador
Región de Aysén registra 53 nuevos casos asociados a Covid 19,http://www.eldivisadero.cl/noticia-63035,"Este domingo y fuera de reporte oficial del Minsal la región registra 53 casos asociados a Covid 19. Se trata de 49 PCR positivo y test antígeno positivo, donde 20 son de Coyhaique, 7 de Aysén, 2 de C",20-06-2021 17:44,https://www.bing.com/th?id=OVFT.zBQxmmBVhAH4zxb_znmwTy,Chile,Diario el Divisadero
Chile registró 5.252 casos nuevos de Covid-19 este lunes,https://radioportales.cl/sitio/chile-registro-5-252-casos-nuevos-de-covid-19-este-lunes/,"El Minsal informó este lunes 5 mil 252 nuevos casos contagios con Covid-19. Además, se lamentaron 132 decesos informados por el DEIS. Con esto, la cifra total de confirmados positivos llega a un milló",21-06-2021 16:44,https://www.bing.com/th?id=OVFT.ighuoZQt8t3VXU1kxX97zC,Chile,Radio Portales
Cifras de positividad del Ministerio de Salud difieren hasta en un punto con las entregadas por Seremi y laboratorios de Valparaíso,https://www.puranoticia.cl/noticias/regiones/cifras-de-positividad-del-ministerio-de-salud-difieren-hasta-en-un-punto/2021-06-22/122457.html,"A modo de ejemplo, en la región de Valparaíso, el promedio de la positividad mensual de marzo fue de 9,85% según el Minsal, pero los reportes locales hablan de 10,83%.",22-06-2021 18:45,https://www.bing.com/th?id=OVFT.HtPkZ81gm7uGnAH4LcoZvS,Chile,Puranoticia.cl
Briones negó pedir salida de Sichel del Gobierno: “Eso lo decide el Presidente”,http://www.lanacion.cl/briones-nego-pedir-salida-de-sichel-del-gobierno-eso-lo-decide-el-presidente/,El expresidente del BancoEstado hizo el emplazamiento después de que el exministro de Hacienda lo acusara de haberse negado a un acuerdo para ampliar las ayudas económicas por la pandemia del Covid-19,22-06-2021 19:02,https://www.bing.com/th?id=OVFT.s_hWNAAl-AkpgtTbtbQYxS,Chile,La Nación
Estudian aplicar una tercera dosis de refuerzo de vacunas contra Covid-19,https://www.elmostrador.cl/agenda-pais/2021/06/22/estudian-aplicar-una-tercera-dosis-de-refuerzo-de-vacunas-contra-covid-19/,"Expertos han mostrado preocupación sobre la eficiencia de las vacunas para enfrentar algunas variantes del coronavirus como la Delta, que ha puesto presión a diversos países del mundo.",22-06-2021 19:10,https://www.bing.com/th?id=OVFT.8v63IqXqCExiHmTMdYpdFS,Chile,El Mostrador
“Es una prensa de mierda”: Bolsonaro se quitó la mascarilla para insultar a periodista,https://www.cnnchile.com/mundo/bolsonaro-quito-mascarilla-insultar-periodista-globo_20210622/,"El presidente brasileño no escatimó en insultos para una de las cadenas más grandes del gigante sudamericano, que ha sido además crítica de su gestión de la pandemia. Esto, luego que le recordaran que",22-06-2021 19:43,https://www.bing.com/th?id=OVFT.UK2ZojvUIFlg9JC8BeFUYS,Chile,CNN Chile
Parte la vacunación de los niños y niñas en Chile: todo lo que debes saber del proceso,https://www.latercera.com/que-pasa/noticia/parte-la-vacunacion-de-los-ninos-y-ninas-en-chile-todo-lo-que-debes-saber-del-proceso/H75YCDL56NGEVBAQMJQJH4UBDE/,Se estima que casi 1 millón y medio de menores podrán ser inoculados contra el Covid-19 en Chile. Revisa todos los detalles del proceso que acaba de iniciarse en el país.,22-06-2021 19:51,https://www.bing.com/th?id=OVFT.UoUtp_UaGuYm_3m4bhZk5S,Chile,LA TERCERA
Gobierno advierte que habría vacunación anual contra covid-19: ya negocia dosis para 2022,https://www.diarioconcepcion.cl/pais/2021/06/22/gobierno-advierte-que-habria-vacunacion-anual-contra-covid-19-ya-negocia-dosis-para-2022.html,"El ministro de Salud, Enrique Paris, confirmó que el Gobierno ya se encuentra negociando dosis de vacunas contra la Covid-19 para el próximo año, pues adelantó que “lo más probable” es que se deba ino",22-06-2021 20:32,https://www.bing.com/th?id=OVFT.NlsZ9osFe1UoyFmIrXiudi,Chile,El Diario de Concepcion
"Los coletazos del debate de candidatos de Chile Vamos: Sichel acusa agresividad, Briones lo desmiente y La Moneda molesta",https://www.publimetro.cl/cl/noticias/2021/06/22/coletazos-debate-chile-vamos-primarias.html,"Luego del primer debate entre los candidatos de Chile Vamos, La Moneda se molestó por el desmarque que tuvieron con el Gobierno.",22-06-2021 20:35,https://www.bing.com/th?id=OVFT.lSyu6szl4vyDZeIA8dYBMS,Chile,publimetro.cl
Webinar explicará las claves de la Ley Retorno Seguro al Trabajo y el Seguro Covid-19,https://www.radioagricultura.cl/economia/2021/06/22/webinar-explicara-las-claves-de-la-ley-retorno-seguro-al-trabajo-y-el-seguro-covid-19.html,"Con el objetivo de informar y guiar a todas las empresas del país en su retorno seguro al trabajo, Nubox realizará un webinar gratuito titulado “ Ley de Retorno Seguro al Trabajo ”, espacio donde los",22-06-2021 20:35,https://www.bing.com/th?id=OVFT.ZFXb_c3AB38JqldDqPNTAi,Chile,Radio Agricultura
FISUR 2021 se realizará en modalidad virtual,https://elinsular.cl/noticias/los-lagos/2021/06/22/fisur-2021-se-realizara-en-modalidad-virtual/,"Este año, en medio de la pandemia de COVID 19 que ha obligado a la suspensión de todos los eventos masivos de su tipo, SAGO A.G. decidió desarrollar esta feria, empleando tecnología de última generaci",22-06-2021 21:00,https://www.bing.com/th?id=OVFT.7XfGeaUxd_4ak2RjVQ-c9i,Chile,El Insular
Las comunas de la RM que saldrán de cuarentena con números más altos a cuando entraron,https://www.duna.cl/noticias/2021/06/22/10-comunas-de-la-rm-saldran-de-cuarentena-con-numeros-mas-altos-a-cuando-entraron/,"Tal como explicó la autoridad sanitaria, la mayoría de estas comunas no cumplen con los valores establecidos por el mismo Gobierno.",22-06-2021 22:12,https://www.bing.com/th?id=OVFT.YDIgqv2DgUAC7QS5VSp_Uy,Chile,duna
Con énfasis en el rol de los docentes y nuevas generaciones se inició Conferencia sobre Educación y Cambio Climático,http://www.lanacion.cl/con-enfasis-en-el-rol-de-los-docentes-y-nuevas-generaciones-se-inicio-conferencia-sobre-educacion-y-cambio-climatico/,La tercera versión del encuentro -que reúne a investigadores y profesores nacionales e internacionales- se inició con la conferencia del astrofísico francés y miembro fundador de la Office for Climate,22-06-2021 22:26,https://www.bing.com/th?id=OVFT.4xOJHid9NuHH9B-TC1whJy,Chile,La Nación
Conozca de qué comunas son los 368 casos nuevos de coronavirus en la región de Valparaíso,https://www.puranoticia.cl/noticias/regiones/conozca-de-que-comunas-son-los-368-casos-nuevos-de-coronavirus-en-la/2021-06-22/180432.html,"Chile reporta la cifra más baja de casos nuevos de Covid-19 en seis semanas: 3.464 contagios y 45 decesos Nacional 12:14 Las cifras configuran un total nacional de 1.525.663 casos desde el inicio de la pandemia, con 36.114 activos y 1.456.672 pacientes ...",22-06-2021 22:37,https://www.bing.com/th?id=OVFT.G7r8uL0sOoFr1pBeQk6vqi,Chile,Puranoticia.cl
"México y Chile, los países de AL con los mayores niveles de concentración de riqueza y desigualdad",https://www.elciudadano.com/mexico/mexico-y-chile-los-paises-de-al-con-los-mayores-niveles-de-concentracion-de-riqueza-y-desigualdad/06/22/,"Por Mathieu Tourliere México es, junto con Chile, el país de América Latina donde imperan los mayores niveles de concentración de riquezas, y las peores",22-06-2021 22:49,https://www.bing.com/th?id=OVFT.qpSnGvyTLpJQFh5plx-tOi,Chile,El Ciudadano
Minsal estudia aplicación de tercera dosis de vacuna contra COVID-19 para reforzar inmunidad,https://www.elperiodista.cl/2021/06/minsal-estudia-aplicacion-de-tercera-dosis-de-vacuna-contra-covid-19-para-reforzar-inmunidad/,"El presidente Sebastián Piñera aseguró hoy martes que estudian aplicar una tercera dosis de la vacuna contra la enfermedad del nuevo coronavirus (COVID-19), según sea pertinente, para reforzar la inmu",22-06-2021 23:18,https://www.bing.com/th?id=OVFT.UjB-I4qcoH57CzphTWPcYS,Chile,El Periodista
Gabriel Boric: “¿Cómo se entiende que se abran primero los malls antes que los liceos públicos?”,https://www.radioagricultura.cl/politica/2021/06/22/gabriel-boric-como-se-entiende-que-se-abran-primero-los-malls-antes-que-los-liceos-publicos.html,"Durante el debate por las elecciones primarias, Gabriel Boric se refirió al panorama actual de la educación en Chile, que",22-06-2021 23:50,https://www.bing.com/th?id=OVFT.w0l6q4mSSpZ-XloCxJ9Cji,Chile,Radio Agricultura
Argentina llega a los 90 mil muertos por covid-19 con un récord diario de decesos,https://www.biobiochile.cl/noticias/internacional/america-latina/2021/06/22/argentina-llega-a-los-90-mil-muertos-por-covid-19-con-un-record-diario-de-decesos.shtml,"Argentina reportó este martes un nuevo récord diario de 792 muertes por el coronavirus SARS-CoV-2, con lo que el",22-06-2021 23:50,https://www.bing.com/th?id=OVFT.xYcvITc-Je3gBAl8Zpf86S,Chile,Chile
Presidente de Filipinas amenaza con enviar a la cárcel a quienes no se vacunen contra el COVID-19,https://www.cnnchile.com/programas-completos/filipinas-carcel-vacuna-covid_20210622/,"(EFE) – El presidente de Filipinas, Rodrigo Duterte, amenazó con enviar a la cárcel a aquellas personas que rechacen la vacuna contra el COVID-19, mientras el país todavía lucha por contener su peor r",23-06-2021 00:25,https://www.bing.com/th?id=OVFT.BnlN20CIfoAAQZLNuCNajy,Chile,CNN Chile
Presidente Piñera da inicio al proceso de vacunación contra el Covid-19 para menores de 18 años,https://www.rln.cl/nacional/88191-presidente-pinera-da-inicio-al-proceso-de-vacunacion-contra-el-covid-19-para-menores-de-18-anos,"En una primera etapa serán inoculados adolescentes entre 12 y 17 años de centros del Sename y colaboradores del servicio, centros de atención de salud mental y adolescentes con comorbilidades. Santiag",23-06-2021 01:24,https://www.bing.com/th?id=OVFT.1eE4orAwmiyrMEG_aag33C,Chile,Radio las Nieves
Pandemia y reformas: Presidente fija prioridades legislativas para los próximos meses en cita con dirigentes de Chile Vamos,https://www.emol.com/noticias/Nacional/2021/06/22/1024656/reunion-chile-vamos-gobierno-reformas.html,"El presidente electo de RN, Francisco Chahuán, sostuvo que la reunión fue ""provechosa"". ""Hemos dado una muestra de unidad de los cuatro partidos de la coalición"", destacó.",23-06-2021 01:40,https://www.bing.com/th?id=OVFT.8vm5HGWOA81YbVRaKp9DAi,Chile,Emol
Implementan en Hospital de San Fernando un test de PCR que diagnostica el covid-19 o la influenza de una vez,http://www.diarioelmarino.cl/2021/06/23/implementan-en-hospital-de-san-fernando-un-test-de-pcr-que-diagnostica-el-covid-19-o-la-influenza-de-una-vez/,"Tomando en cuenta el comienzo de la época invernal y la irrupción de las enfermedades respiratorias en un contexto de pandemia, es de gran importancia lograr diferenciar el SARS-CoV-2",23-06-2021 05:57,https://www.bing.com/th?id=OVFT.oyL7MSi228mK_J3VNq_RPS,Chile,El Marino
El debate de las coincidencias marca el encuentro entre Boric y Jadue,https://www.pauta.cl/politica/jadue-boric-debate-primarias-izquierda-coincidencias,"Los candidatos de izquierda no mostraron diferencias en pensiones, reforma policial y ajustes laborales. Solo hubo disentimiento en sus roles para el acuerdo del 15 de noviembre y sobre Venezuela.",23-06-2021 06:10,https://www.bing.com/th?id=OVFT._NQu5IbmStl2qNmM_p3xqC,Chile,pauta
Tendencia a la baja en casos covid-19 se ha consolidado en la última semana en región de Valparaíso,https://www.biobiochile.cl/noticias/nacional/region-de-valparaiso/2021/06/23/tendencia-a-la-baja-en-casos-covid-19-se-ha-consolidado-en-la-ultima-semana-en-region-de-valparaiso.shtml,"Un total de 368 casos de covid 19 se reportaron en la región de Valparaíso. De esta manera el total acumulado es de 11.418 casos desde que la pandemia llegó al territorio regional. Del total, 266 pers",23-06-2021 06:31,https://www.bing.com/th?id=OVFT.SKjWi9RpW7MidheU2Mx00i,Chile,Chile
Mercado Laboral: lanzan plataforma “Mujer Emplea”,https://www.diarioconcepcion.cl/economia/2021/06/23/mercado-laboral-lanzan-plataforma-mujer-emplea.html,El Sistema de Naciones Unidas en Chile es el que impulsa esta iniciativa que tiene dentro de sus principales beneficios conectar a las mujeres con las ofertas laborales y posibilidades de emprendimien,23-06-2021 07:03,https://www.bing.com/th?id=OVFT.tzqzxiknJKRj01nAQw4n_y,Chile,El Diario de Concepcion
Crisis sanitaria y DD.HH: Jadue y Boric se enfrentaron en primer debate de cara a primarias,https://www.t13.cl/noticia/elecciones-2021/politica/jadue-boric-primer-debate-primarias-23-06-2021,"Si bien los candidatos aseguraron tener varios puntos en común, durante el desarrollo del debate fueron matizando sus ideas y marcando sus diferencias respecto a diversas materias.",23-06-2021 07:25,https://www.bing.com/th?id=OVFT.74MsbCKO-9sTbstPxKZbEC,Chile,T13
"Ministro de RR.EE alemán: UEFA envía ""mensaje equivocado"" al prohibir colores arcoíris en estadio",https://www.t13.cl/noticia/deportest13/ministro-rr.ee-aleman-uefa-envia-mensaje-equivocado-al-prohibir-colores-arcoiris-estadio,El ente rector del fútbol europeo rechazó la solicitud por parte del municipio de Múnich de colorear el Allianz Arena a modo de protesta por políticas de Hungría que van contra las diversidades sexual,23-06-2021 08:15,https://www.bing.com/th?id=OVFT.2shw2HqL-Yq5hO5mvGkXDi,Chile,T13
Cuarentenas: Conoce todas las comunas que permanecen en confinamiento total en Chile,https://www.meganoticias.cl/dato-util/341201-minsal-comunas-en-cuarentena-hoy-fase-1-covid-23-06-2021.html,"Para contener la pandemia de Covid-19 en Chile, el Ministerio de Salud ha establecido cuarentenas totales en diversas comunas del país. Conoce el listado de comunas aquí.",23-06-2021 09:00,https://www.bing.com/th?id=OVFT.vXzDkRzex7wG4UWIQccKoC,Chile,meganoticias
Las lecciones que los presidenciables de Chile Vamos sacaron de su primer debate,https://www.latercera.com/earlyaccess/noticia/las-lecciones-que-los-presidenciables-de-chile-vamos-sacaron-de-su-primer-debate/WTGUAO72ZBGDVEUZGJO6XBJIHQ/,"En los cuatro comandos sacan cuentas alegres respecto del desempeño de sus abanderados, pero reconocen -en privado- que deben mejorar ciertos aspectos para poder dar a conocer con mayor fuerza sus pla",23-06-2021 09:45,https://www.bing.com/th?id=OVFT.dXXYeCqDPlmuTR6wEvLfyC,Chile,LA TERCERA
Más de 14 mil emprendedores de Atacama podrían acceder al bono pyme del Gobierno,https://www.chanarcillo.cl/mas-de-14-mil-emprendedores-de-atacama-podrian-acceder-al-bono-pyme-del-gobierno/,"El Presidente de la República, Sebastián Piñera, promulgó dos leyes que incluyen bonos y beneficios tributarios para más de 820 mil micro, pequeñas y medianas empresas que han resultado afectadas por",23-06-2021 09:57,https://www.bing.com/th?id=OVFT.jSVuL9nE53hbJsRXu5XDLC,Chile,Diario Chanarcillo
Comenzó proceso de vacunación contra el Covid-19 en menores de 18 años del Maule,https://new.diariolaprensa.cl/index.php/2021/06/23/comenzo-proceso-de-vacunacion-contra-el-covid-19-en-menores-de-18-anos-del-maule/,"Nuevo hito. El procedimiento de inmunización inició en niños y jóvenes de entre 12 y 17 años de edad pertenecientes a centros del Sename, centros de atención de salud mental y adolescentes con comorbi",23-06-2021 10:04,https://www.bing.com/th?id=OVFT.pfxBYwYrjU7de_i3LxOcVS,Chile,La Prensa
Inicio de vacunación en menores: expertos confirman su seguridad,https://new.diariolaprensa.cl/index.php/2021/06/23/inicio-de-vacunacion-en-menores-expertos-confirman-su-seguridad/,Nuevos hitos.“Todas las vacunas que han sido aprobadas en Chile cumplen con el requisito de estimular al sistema inmune y evitar al máximo que la población llegue a la UCI ya que tiene un alto porcent,23-06-2021 10:24,https://www.bing.com/th?id=OVFT.kZEMdvTBzw8dKRNJyyBw8i,Chile,La Prensa
Región de Magallanes es la primera en vacunar al 80% de su población con dos dosis contra el COVID-19,https://www.24horas.cl/coronavirus/region-magallanes-primera-vacunar-80-poblacion-dos-dosis-contra-covid-19-4837656,"Según indicó la subsecretaria de Salud Pública, Paula Daza, ""también lleva más del 80% de los jóvenes de 18 a 23 años vacunados"".",23-06-2021 10:32,https://www.bing.com/th?id=OVFT.THjkqiwrI8U3uIxAP5l87S,Chile,24 Horas Chile
Mascarillas: ¿Qué tan seguras son las que se ocupan?,https://www.24horas.cl/coronavirus/mascarillas-tipos-analisis-seguridad-covid-19--4837688,"Según un estudio de la Universidad de Santiago, la mayoría de los chilenos utiliza las conocidas quirúrgicas pero también las caseras o personalizadas. Una elección muy importante ya que usar cubreboc",23-06-2021 11:17,https://www.bing.com/th?id=OVFT.8HtQAf6livDcI1lEl7xjoC,Chile,24 Horas Chile
"Miércoles 23 de Jun, 2021 - 07:02",https://www.adnradio.cl/futbol/2021/06/23/previa-brasil-y-colombia-se-enfrentan-en-rio-de-janeiro-en-el-duelo-mas-importante-del-grupo-b-de-copa-america.html,"El próximo miércoles 23 de junio sigue la acción de la cuadragésima séptima (47°) versión de la Copa América 2021, la que estuvo cerca de volver a suspenderse por la pandemia del Covid-19 y que, origi",23-06-2021 11:39,https://www.bing.com/th?id=OVFT.31MM3Yx9AHcpMfSVMjWAkC,Chile,ADN
