name,url,description,datePublished,imagen,pais,Fuente
"Informe que defiende ""nueva normalidad"" proyecta en 2 a 3 ...",https://www.emol.com/noticias/Nacional/2020/04/22/983824/Informe-nueva-normalidad.html,"Para ese periodo se estima ""altamente probable que el número de contagios nuevos sea igual al número de recuperados nuevos"", según se lee en el texto del Gobierno.",22-04-2020 15:21,https://www.bing.com/th?id=ON.929C1E366775F435DFC476DB9AAF9901,Chile,Emol
La increíble odisea de uno de los últimos cruceros | Tele 13,https://www.t13.cl/noticia/mundo/bbc/la-increible-odisea-de-uno-de-los-ultimos-cruceros-que-siguio-navegando-en-medio-de-la-pandemia,"El MSC Magnifica iba a navegar durante 117 días y dar la vuelta al mundo, pero el viaje no resultó según lo planeado.",25-04-2020 21:24,https://www.bing.com/th?id=ON.69E307FC99540B0AA00311B744B630FA,Chile,T13
En día más grave del coronavirus: largas filas se ...,https://elpinguino.com/noticia/2020/05/03/en-dia-mas-grave-del-coronavirus-largas-filas-se-registran-tras-apertura-de-tiendas-falabella-en-distintas-ciudades,"La multitienda Falabella decidió abrir las puertas de varias de sus sucursales en el país este sábado por la mañana, generando largas colas de personas, quienes no respetaron el metro de distancia, ju",03-05-2020 18:31,https://www.bing.com/th?id=ON.EE7F9B5C27E43C10F47E0DE883ADAAEE,Chile,ELPINGUINO
300 emprendedores magallánicos han respondido encuesta del ...,https://elpinguino.com/noticia/2020/05/03/300-emprendedores-magallanicos-han-respondido-encuesta-del-gobierno-regional-,"En el marco de la Estrategia Regional Covid-19, para hacer frente a la crisis sanitaria más importante que ha debido enfrentar Chile en el último siglo, y con el fin de impulsar la reactivación socioe",03-05-2020 19:05,https://www.bing.com/th?id=ON.B031B55B47C12C5E5BADF978851F4FE7,Chile,ELPINGUINO
"CDN - Canal de Noticias, Malleco",https://www.canaldenoticias.cl/noticias/?post=12017,"Este domingo 3 de mayo se conmemora el Día Mundial de la Libertad de Prensa, en un contexto donde el los medios de comunicación juegan un rol crucial en otorgar la adecuada información sobre la pandem",03-05-2020 19:34,https://www.bing.com/th?id=ON.DDBB19970906DEDFBB244A07002F0FE8,Chile,CANAL DE NOTICIAS
Covid-19 hace tambalear el amor tarifado en Chile,https://www.lacuarta.com/cronica/noticia/covid-19-amor-tarifado/490845/,"Night Clubs, Cafés con piernas, strippers y scorts sufren una crisis sin precedentes y ven amenazada la estabilidad de su negocio, asegurando que el rubro está con los días contados. El impacto económ",03-05-2020 19:45,https://www.bing.com/th?id=ON.7251E329E09B9EE63CB7F2F67591E027,Chile,La Cuarta
Nuevo informe por Covid 19: Chile se acerca a los 20.000 ...,https://www.cooperativa.cl/noticias/sociedad/salud/coronavirus/nuevo-informe-por-covid-19-chile-se-acerca-a-los-20-000-contagiados/2020-05-03/121929.html,Ministerio de Salud confirmó que en las últimas 24 horas se registraron 1.228 nuevos casos y 13 fallecidos. El Ministerio de Salud confirmó que en las últimas 24 horas se registraron 1.228 nuevos caso,03-05-2020 20:02,https://www.bing.com/th?id=ON.6E87C2E9C985FE9ABD88D0489E972805,Chile,Radio Cooperativa
Castro (PS) al Gobierno: “Se precipitaron relajando las ...,https://www.radioagricultura.cl/politica/2020/05/03/castro-ps-al-gobierno-se-precipitaron-relajando-las-medidas-y-privilegiaron-la-economia-por-sobre-la-salud.html,El diputado socialista Juan Luis Castro se sumó a las críticas al manejo del Gobierno respecto a la pandemia del coronavirus que ya lleva un total de 19.663 contagiados en Chile. El parlamentario subr,03-05-2020 20:20,https://www.bing.com/th?id=ON.02661210959DFAF2549F2B95FF013D82,Chile,Radio Agricultura
Senador Chahuán exigió ayuda inmediata para jóvenes ...,https://www.elmostrador.cl/dia/2020/05/03/senador-chahuan-exigio-ayuda-inmediata-para-jovenes-chilenos-abandonados-en-isla-de-honduras/,"Chahuán, quien ha hecho gestiones similares en otros casos, se comunicó directamente con la Dirección General Consular, para pedir que se haga todo lo que sea necesario y llevarles las ayudas correspo",03-05-2020 21:16,https://www.bing.com/th?id=ON.868F3C2E185B91A33AA3FD2821813ABF,Chile,El Mostrador
Se reportan 13 decesos más y 1.228 nuevos casos de Covid ...,http://lanacion.cl/2020/05/03/se-reportan-13-decesos-mas-y-1-228-nuevos-casos-de-covid-19-en-chile/,"Jaime Mañalich, ministro de Salud, dio a conocer este domingo en Valparaíso un nuevo balance relacionados a los casos de Covid-19 en Chile. El secretario de Estado comunicó que en las últimas 24 horas",03-05-2020 21:43,https://www.bing.com/th?id=ON.5C5B8A9378A2E1392069C61B6A2C8859,Chile,La Nación
Maule: Universidad Autónoma tendrá un laboratorio para ...,https://www.cooperativa.cl/noticias/sociedad/salud/coronavirus/maule-universidad-autonoma-tendra-un-laboratorio-para-analizar-180/2020-05-03/164113.html,"Hasta 180 muestras de Covid-19 diarias podrán ser analizadas en el laboratorio que tendrá la Universidad autónoma de Chile gracias a un convenio suscrito con el Servicio de Salud del Maule, que permit",03-05-2020 22:01,https://www.bing.com/th?id=ON.9D75AC4BE184A9F3198E3E37B93528C7,Chile,Radio Cooperativa
El plan de salvataje financiero que prepara el gobierno ...,https://www.radiosantiago.cl/archivo/128799,Fuerte fue el impacto de prorrogar el pago de los permisos de circulación de la plaza vehicular del país como una forma de alivianar el bolsillo de los chilenos en tiempos de Covid-19. Pero los efecto,03-05-2020 22:04,https://www.bing.com/th?id=ON.ABA3DCEB0BA3C2C471235DACE760DF0E,Chile,Radio Santiago
Coronavirus en Chile: Se registraron 1.427 casos durante ...,https://www.elperiscopio.cl/noticias/coronavirus-en-chile-se-registraron-1-427-casos-durante-las-ultimas-24-horas/,"El Ministerio de Salud confirmó este sábado 02 de mayo que en las últimas 24 horas se registraron 1.427 nuevos casos documentados de contagio por Covid-19, que elevan preocupantemente la cifra total a",03-05-2020 22:07,https://www.bing.com/th?id=ON.B63D5F8BCF4F7CF4891E7210B614E59A,Chile,elperiscopio.cl
"Covid-19 en Chile: Más de 17.000 contagiados, 234 muertos ...",https://www.elperiscopio.cl/destacado-1/covid-19-en-chile-mas-de-17-000-contagiados-234-muertos-y-985-nuevos-casos/,"Este viernes 01 de mayo, el Ministerio de Salud confirmó que en las últimas 24 horas se registraron 985 nuevos casos documentados de contagio por coronavirus, que elevan la cifra total a 17.008 person",03-05-2020 22:07,https://www.bing.com/th?id=ON.8DFCB74BF7826D9EFB5AE80F938082B0,Chile,elperiscopio.cl
Coronavirus en Chile: 13 nuevas muertes en... | Puranoticia,https://www.puranoticia.cl/noticias/nacional/coronavirus-en-chile-13-nuevas-muertes-en-ultimas-24-horas-y-1-228/2020-05-03/124842.html,"El Ministerio de Salud informó que hasta las 21 horas de ayer se produjeron 13 nuevas muertes por covid-19, la misma cantidad reportada este sábado, con lo cual el número oficial de fallecidos subió a",03-05-2020 22:11,https://www.bing.com/th?id=ON.9D687DDBAA6FA855FCC1B6886364EB05,Chile,Puranoticia.cl
En jaque el discurso de la “nueva normalidad”: explosivo ...,https://www.elmostrador.cl/noticias/pais/2020/05/03/en-jaque-el-discurso-de-la-nueva-normalidad-explosivo-aumento-de-casos-obliga-al-gobierno-a-decretar-cuarentenas-en-mas-comunas/,"Los anuncios llegaron con 48 horas de anticipación, considerando que ya se había hecho costumbre en el Gobierno anunciar las nuevas medidas en los balances que se realizan los días martes. En la Regió",03-05-2020 22:19,https://www.bing.com/th?id=ON.EDCDD306C3D924B6ED056390908B7193,Chile,El Mostrador
Intendenta pide disculpas al reunirse con familia y ...,http://www.eldivisadero.cl/noticia-56711,"Chile Chico-. Una conversación breve pero sincera sostuvo el pasado jueves la Intendenta Geoconda Navarrete con el trabajador que se contagió con Covid-19, Carlos Rojas y su familia, para conocer de p",03-05-2020 22:56,https://www.bing.com/th?id=ON.6D67FBCA9003DD4A459B29EA6BFD14F1,Chile,Diario el Divisadero
Chilenos regresan al país tras estar varados en España por ...,http://lanacion.cl/2020/05/03/chilenos-regresan-al-pais-tras-estar-varados-en-espana-por-mas-de-un-mes/,"En la tarde de este domingo se inició un vuelo desde España con 136 chilenos que podrán regresar al país luego de que estuvieran varados en Europa desde finales de marzo, debido a la pandemia de Covid",03-05-2020 23:57,https://www.bing.com/th?id=ON.1B26B8F5CD3D800212A2630B18FA2CE8,Chile,La Nación
Chile registra explosivo aumento con 1.427 nuevos casos de ...,https://www.biobiochile.cl/noticias/nacional/chile/2020/05/02/chile-registra-explosivo-aumento-con-1-427-nuevos-casos-de-covid-19-y-suma-otros-13-fallecidos.shtml,"El ministro de Salud, Jaime Mañalich, desde Osorno, confirmó este sábado que Chile cuenta con un récord de 1.427 nuevos casos positivos de Covid-19, lamentando además la muerte de otras 13 personas, t",04-05-2020 00:01,https://www.bing.com/th?id=ON.35B69B1D211BA851C663566215093169,Chile,Chile
"Coronavirus habría llegado a Chile en febrero, semanas ...",https://www.biobiochile.cl/noticias/nacional/chile/2020/05/02/coronavirus-habria-llegado-a-chile-en-febrero-semanas-antes-que-el-primer-caso-confirmado.shtml,"El 3 de marzo se confirmó el primer caso de la enfermedad por coronavirus, Covid-19, en Chile. Se trataba de un médico de la región del Maule que había viajado al sudéste asíatico. Sin embargo, estudi",04-05-2020 00:01,https://www.bing.com/th?id=ON.2B70754B932451C077F61C2C11D5EFEC,Chile,Chile
Balance diario del coronavirus en Chile se realizará esta ...,https://www.adnradio.cl/regional/2020/05/03/balance-diario-del-coronavirus-en-chile-se-realizara-esta-jornada-en-la-region-de-valparaiso.html,"Tras una visita inspectiva al nuevo Hospital Gustavo Fricke de Viña del Mar, las autoridades de salud, encabezados por el ministro Jaime Mañalich, entregarán el nuevo informe sobre el avance del coron",04-05-2020 00:02,https://www.bing.com/th?id=ON.3530AEF6F6240FF758115B3C181DFC00,Chile,ADN
Casinos Enjoy en la mira: Se aprueba comisión... | Puranoticia,https://www.puranoticia.cl/noticias/negocios/casinos-enjoy-en-la-mira-se-aprueba-comision-investigadora-para-conocer/2020-05-03/204745.html,La instancia buscará esclarecer las consecuencias de la decisión de Enjoy de hacer una reorganización judicial para evitar la quiebra. Con 85 votos a favor y 47 en contra la Cámara de Diputados aprobó,04-05-2020 00:50,https://www.bing.com/th?id=ON.A50C0618BECDEAA673C49132869AC186,Chile,Puranoticia.cl
Amigos y familiares despidieron a sindicalista Hugo ...,https://www.elrancaguino.cl/2020/05/03/amigos-y-familiares-despidieron-a-sindicalista-hugo-ramirez/,"– El pasado sábado se realizó el funeral del hombre que fue parte de la Central Unitaria de Trabajadores de Chile, el Sindicato de Trabajadores de Panaderos de Rancagua y dirigente del club Deportivo",04-05-2020 00:53,https://www.bing.com/th?id=ON.9A8E973402B15DE3A43435D2EF8BD3FC,Chile,elrancaguino.cl
Evitemos un mal equilibrio - La Tercera,https://www.latercera.com/opinion/noticia/evitemos-un-mal-equilibrio/DNT24J5JUNCTHBL6EKAER74MEA/,"EL gobierno ha lanzado dos planes económicos de emergencia para enfrentar los efectos del Covid-19, argumentado correctamente que enfrentamos un shock transitorio y que para reducir sus efectos negati",04-05-2020 01:39,https://www.bing.com/th?id=ON.49B095285247B1DD91564C117AC9D413,Chile,LA TERCERA
A dos meses de la llegada de la pandemia a Chile: Los ...,https://www.emol.com/noticias/Nacional/2020/05/03/984958/hitos-dos-meses-pandemia.html,Este domingo se cumplieron dos meses desde la llegada de la pandemia de la enfermedad covid-19 al país. Fue un 3 de marzo cuando las autoridades sanitarias confirmaban que el examen practicado a un ho,04-05-2020 02:23,https://www.bing.com/th?id=ON.31CD16191E7C1A1E389E185DA5FCA2FE,Chile,Emol
AS Chile alcanzó su peak histórico de usuarios y consolida ...,https://www.adnradio.cl/deportes/2020/05/03/as-chile-alcanzo-su-peak-historico-de-usuarios-y-consolida-su-presencia-en-el-pais.html,"Una cifra histórica logró el portal especializado AS Chile durante el mes de marzo. Según el ranking de ComScore, el sitio web logró un registro de 5.186.000 de usuarios únicos, lo que consolida su li",04-05-2020 03:13,https://www.bing.com/th?id=ON.E8315A5905966F10B3BDACB5087D5060,Chile,ADN
10 hitos de la crisis sanitaria en Chile - La Tercera,https://www.latercera.com/nacional/noticia/10-hitos-de-la-crisis-sanitaria-en-chile/DNCNFFEY5JH25FPLHXRJF2PQO4/,"LARGAS FILAS Y AGLOMERACIONES SE REGISTRARON ESTA MAÑANA EN EL SUPERMERCADO LIDER UBICADO EN AVENIDA LA DEHESA CON LAS CONDES, DEBIDO A LA CUARENTENA TOTAL DECRETADA POR EL GOBIERNO EN 7 COMUNAS DE LA",04-05-2020 03:23,https://www.bing.com/th?id=ON.CE33BAF264842A2606917CC7D17FA9F3,Chile,LA TERCERA
Chimbarongo: mnOrdenanza municipal mandata uso obligatorio ...,https://www.elrancaguino.cl/2020/05/03/chimbarongo-mnordenanza-municipal-mandata-uso-obligatorio-de-mascarilla-en-la-comuna/,"La Ilustre Municipalidad de Chimbarongo, informó sobre una nueva ordenanza que ordena el uso obligatorio de mascarillas y otros mecanismos de prevención de contagio de Pandemia Covid 19. El documento",04-05-2020 03:29,https://www.bing.com/th?id=ON.E6B1389127E2EA4A809FBB381133DD29,Chile,elrancaguino.cl
"Es mascarilla, no bozal",http://www.eldivisadero.cl/redac-56723,"En medio de momentos en que más se requiere de una prensa libre, pluralista e incisiva, los grandes conglomerados mediáticos del país continúan con su política de precarización laboral para miles de t",04-05-2020 04:01,https://www.bing.com/th?id=ON.C80C9184BDBB0D16E0ED63DB828B4F18,Chile,Diario el Divisadero
"Carta abierta al Ministro de Educación, que llega desde La ...",https://www.radiosantiago.cl/archivo/128771,"Por medio de la presente y junto con saludarle afectuosamente, me dirijo a usted con el apoyo del Concejo Municipal y directivas comunales del Colegio de Profesores(as), Asistentes de La Educación y A",04-05-2020 04:12,https://www.bing.com/th?id=ON.1D0778018B1AE327D3AADE74F69C3C6A,Chile,Radio Santiago
