name,url,description,datePublished,imagen,pais,Fuente
Rector de la U. de Chile proyecta para el segundo semestre inicio de construcción de un Centro de Producción de Vacunas,https://www.theclinic.cl/2021/05/05/rector-de-la-u-de-chile-proyecta-para-el-segundo-semestre-inicio-de-construccion-de-un-centro-de-produccion-de-vacunas/,"Durante una ceremonia de inicio del año académico, el rector de la Universidad de Chile, Ennio Vivaldi, anunció el inicio de un proceso para construir un centro de producción de vacunas. Asimismo, en",06-05-2021 03:14,https://www.bing.com/th?id=OVFT.L70TnlOZJMO950i4GX3AXy,Chile,Clinic
Puerto San Antonio y organismos públicos realizaron exámenes PCR gratuitos a transportistas en el Nodo Logístico,https://elproa.cl/2021/05/puerto-san-antonio-y-organismos-publicos-realizaron-examenes-pcr-gratuitos-a-transportistas-en-el-nodo-logistico/,"La fiscalización de camiones y el procedimiento sanitario forman parte de la agenda de trabajo para el año 2021 del Comité Portuario de Coordinación de Organismos Públicos. Puerto San Antonio, … Leer",06-05-2021 05:01,https://www.bing.com/th?id=OVFT.Nq-4NlhPliDD0_9RAHZTyC,Chile,elproa.cl
Cuarentenas: Conoce todas las comunas que permanecen en confinamiento total en Chile,https://www.meganoticias.cl/dato-util/335324-minsal-comunas-cuarentena-hoy-fase-1-covid-cog23.html,"Para contener la pandemia de Covid-19 en Chile, el Ministerio de Salud ha establecido cuarentenas totales en diversas comunas del país. Conoce el listado de comunas aquí.",06-05-2021 09:00,https://www.bing.com/th?id=OVFT.ihhpSu6zWNfcnWw8V9WPNi,Chile,meganoticias
Comenzó el pago del tercer retiro del 10%: Revisa la fecha según cada AFP,https://www.t13.cl/noticia/nacional/afp-pago-tercer-retiro-cuando-06-05-2021,"Por ley, las administradoras tiene un plazo no superior a 10 días hábiles para realizar los depósitos. Sin embargo, algunas AFP adelantaron el proceso.",06-05-2021 11:16,https://www.bing.com/th?id=OVFT.X1HH4IXSmwmxeGprFeMXzC,Chile,T13
"Desbordes por 10%: “Ante esta derrota abrumadora, el gobierno daña la relación con sus partidos”",https://www.cnnchile.com/programas-completos/mario-desbordes-retiro-fondos-gobierno-dana-relacion-partidos_20210506/,"Conduce: Fernando Paulsen. El candidato presidencial Mario Desbordes (RN) se refirió a la agenda de mínimos comunes de la oposición y el gobierno, y precisó cuáles han sido los planteamientos que han",06-05-2021 11:20,https://www.bing.com/th?id=OVFT.3AM1TuCBBelDUOYpqv-evy,Chile,CNN Chile
Conoce las 14 comunas que no tienen casos de Covid-19 en Chile,https://www.latribuna.cl/noticias/2021/05/06/conoce-las-14-comunas-que-no-tienen-casos-de-covid-19-en-chile.html,"El último informe epidemiológico realizado a nivel nacional detalla que hay 14 comunas, que no presentan contagios.",06-05-2021 12:42,https://www.bing.com/th?id=OVFT.DV3iW0gVavNGXZV0lS-J0y,Chile,La Tribuna
Chile bordea 7 millones de personas que han completado su proceso de vacunación contra el Covid-19,https://www.radioagricultura.cl/nacional/2021/05/06/chile-bordea-7-millones-de-personas-que-han-completado-su-proceso-de-vacunacion-contra-el-covid-19.html,"El Ministerio de Salud entregó el balance del proceso de vacunación, informando que 6.990.900 personas completaron su inmunización contra el",06-05-2021 12:59,https://www.bing.com/th?id=OVFT.h_bpwgD4JEo4DNHe_YVR6y,Chile,Radio Agricultura
Vacunación contra el COVID-19 está enfocada a rezagados y segundas dosis este lunes,https://www.cnnchile.com/search/vacunacion/page/2/,"19-04-2021 09:55 / En el caso de la influenza, esta jornada serán inoculadas las personas de 69 años. Revisa acá los detalles del calendario para ambas vacunas. 16-04-2021 20:30 / Junto a las cifras o",06-05-2021 13:42,https://www.bing.com/th?id=OVFT.4wLuOg9uFhM8MSKeoSaX7i,Chile,CNN Chile
Cuba agradece reclamo del Grupo de Puebla para cerrar base de EEUU en Guantánamo,https://www.elperiodista.cl/2021/05/cuba-agradece-reclamo-del-grupo-de-puebla-para-cerrar-base-de-eeuu-en-guantanamo/,"El canciller de Cuba, Bruno Rodríguez Parrilla, agradeció este jueves al Grupo de Puebla, integrado por 52 líderes de 16 países latinoamericanos, su reclamo al Gobierno de EEUU para cerrar la base nav",06-05-2021 14:29,https://www.bing.com/th?id=OVFT.HMWmUddEOqwMRack-dtpyy,Chile,El Periodista
El duro descargo de Carolina Molina tras sumar 14 meses sin trabajar: “No he recibido ni un solo bono”,https://www.radioagricultura.cl/entretencion/2021/05/06/el-duro-descargo-de-carolina-molina-tras-sumar-14-meses-sin-trabajar-no-he-recibido-ni-un-solo-bono.html,"La pandemia del Covid-19 afectó a múltiples empleos en Chile, y uno de estos ha sido el rubro del entretenimiento,",06-05-2021 14:47,https://www.bing.com/th?id=OVFT.kX0lP_X4b6h6ntCG30xlgi,Chile,Radio Agricultura
Chile vuelve a registrar más de 6 mil contagios de COVID-19 en un día,https://www.t13.cl/noticia/nacional/contagios-chile-minsal-casos-coronavirus-06-05-2021,"3.188 pacientes están internados en Unidades de Cuidados Intensivos (UCI) del país, de las cuales 2.691 están conectados a ventilación mecánica.",06-05-2021 15:25,https://www.bing.com/th?id=OVFT.V5S-jLAGIC54nTHut8LeGi,Chile,T13
"Coronavirus: por qué se han ""disparado"" las muertes y hospitalizaciones de personas más jóvenes con covid-19 en América Latina",https://www.elmostrador.cl/agenda-pais/2021/05/06/coronavirus-por-que-se-han-disparado-las-muertes-y-hospitalizaciones-de-personas-mas-jovenes-con-covid-19-en-america-latina/,La Organización Panamericana de la Salud advirtió que la edad de las personas hospitalizadas por covid-19 está bajando.,06-05-2021 15:43,https://www.bing.com/th?id=OVFT.i5SVB7XZhTcMEkzXJaIOpC,Chile,El Mostrador
Concepción y Coquimbo dejan cuarentena: Gobierno anuncia cambios en 44 comunas,https://www.24horas.cl/nacional/concepcion-y-coquimbo-dejan-cuarentena-cambios-comunas-jueves-6-de-mayo-4768678,"El Ministerio de Salud informó que 40 zonas del país avanzarán de fase, mientras que solo cuatro presentarán retrocesos.",06-05-2021 15:57,https://www.bing.com/th?id=OVFT.XASWwgX8v1ioWE0Yb473Jy,Chile,24 Horas Chile
"Ministerio de Salud reportó 169 muertos por Covid-19 durante las últimas 24 horas, llegando a un total de 26.895",https://www.adnradio.cl/nacional/2021/05/06/ministerio-de-salud-reporto-169-muertos-por-covid-19-durante-las-ultimas-24-horas-llegando-a-un-total-de-26-895.html,"El ministerio de Salud informó que 169 personas murieron por Covid-19, de acuerdo con las inscripciones en el Registro Civil durante las últimas 24 horas, en el marco del balance diario entregado. De",06-05-2021 16:29,https://www.bing.com/th?id=OVFT.jf4mBOCeB2j9SzM5BMDALC,Chile,ADN
Covid-19: Chile vuelve a presentar más de 6 mil casos nuevos y 169 fallecidos en las últimas 24 horas,https://www.latribuna.cl/coronavirus/2021/05/06/covid-19-chile-vuelve-a-presentar-mas-de-6-mil-casos-nuevos-y-169-fallecidos-en-las-ultimas-24-horas.html,"En cuanto al estado de la red de salud, se informó que hay 3.188 hospitalizados en las UCI y 2.629 con ventilación mecánica.",06-05-2021 16:29,https://www.bing.com/th?id=OVFT.ra-Vnb-jOX38onmz05Jt2y,Chile,La Tribuna
Minsal informa de 6.202 casos nuevos de coronavirus y 169 fallecidos inscritos,https://www.duna.cl/noticias/2021/05/06/minsal-informa-de-6-202-casos-nuevos-de-coronavirus-y-169-fallecidos-inscritos/,"Durante el balance de este jueves, el Ministerio de Salud informó de 6.202 casos nuevos de coronavirus, de estos 4.291 casos con síntomas,  1.603 casos asintomáticos y 308 sin notificar. En total hay",06-05-2021 16:51,https://www.bing.com/th?id=OVFT.2szNKVzywTN2gue0t6jzhy,Chile,duna
"Espacio Público: nuevos casos de covid-19 disminuyeron un 24,5% durante las últimas tres semanas",https://www.biobiochile.cl/noticias/nacional/chile/2021/05/06/espacio-publico-nuevos-casos-de-covid-19-disminuyeron-un-245-durante-las-ultimas-tres-semanas.shtml,"Un nuevo informe del centro de estudios Espacio Público sobre la evolución de la pandemia en Chile, publicado este",06-05-2021 16:54,https://www.bing.com/th?id=OVFT.Xp_RMTdRmxEjOerv3k5mhC,Chile,Chile
Crece polémica ante posible implementación de “pasaporte verde” para vacunados contra el Covid-19,https://www.elciudadano.com/especiales/covid19-coronavirus/crece-polemica-ante-posible-implementacion-de-pasaporte-verde-para-vacunados-contra-el-covid-19/05/06/,"La idea de implementar un pasaporte verde para flexibilizar las libertades de quienes se han vacunado ambas dosis contra el Covid levantó diversas críticas, mientras el proyecto sigue avanzando en el",06-05-2021 17:02,https://www.bing.com/th?id=OVFT.WNN0_nx7yeOcQSqK7_EueC,Chile,El Ciudadano
Se habilitará un Permiso de Vacunación para trabajadores y Concepción saldrá de cuarentena,https://redgol.cl/tendencias/Se-habilitara-un-Permiso-de-Vacunacion-para-trabajadores-y-Concepcion-saldra-de-cuarentena-20210506-0054.html,De esta manera se confirma la baja sostenida de contagios que se viene reportando en las últimas semanas. El Minsal informó que hay 8.371.677 personas vacunadas con una dosis de la fórmula contra el c,06-05-2021 17:08,https://www.bing.com/th?id=OVFT.ux_oasARAfAOQ-6YduHKaC,Chile,redgol
"Minsal por dualidad entre vacunación y contagios en Magallanes: ""Quienes se están enfermando son personas más jóvenes""",https://www.emol.com/noticias/Nacional/2021/05/06/1020102/Dualidad-alta-vacunacioncontagios-en-Magallanes.html,"En ese sentido, la subsecretaria subrayó que ""la vacunación es importante, pero tenemos que seguir cuidándonos y manteniendo estas medidas de autocuidado"". ""La vacunación es u",06-05-2021 17:09,https://www.bing.com/th?id=OVFT.pNlfgTqQm9kCfpEeJKXKmy,Chile,Emol
"""Permiso de Vacunación"": Conoce para qué servirá esta nueva medida del Gobierno",https://www.meganoticias.cl/dato-util/335715-permiso-de-vacunacion-calendario-ministerio-economia-vacuna-covid-cog23.html,"Para incentivar la vacunación de los trabajadores, el ministerio de Economía anunció medidas. Las empresas deben facilitar la inoculación y quienes no lo hagan podrán ser denunciados en Permiso de Vac",06-05-2021 17:15,https://www.bing.com/th?id=OVFT.dv7_WPMUMUNFBWvRE3oduS,Chile,meganoticias
Yo no fui: Usuarios reaccionaron al nombre de la nueva campaña del Ministerio de Salud,https://www.adnradio.cl/tiempo-libre/2021/05/06/yo-no-fui-usuarios-reaccionaron-al-nombre-de-la-nueva-campana-del-ministerio-de-salud.html,La estrategia comunicacional contra el coronavirus tiene coincidencia con un destacado momento de la serie Los Simpson.,06-05-2021 17:17,https://www.bing.com/th?id=OVFT.3Da3DWUmups790M7hC6Uty,Chile,ADN
EE.UU. y la UE se abren a liberar las patentes de vacunas: ¿Se podrían producir en Chile?,https://www.duna.cl/noticias/2021/05/06/ee-uu-y-la-ue-se-abren-a-liberar-las-patentes-de-vacunas-se-podrian-producir-en-chile/,El gobierno de Estados Unidos respaldó la liberación temporal de las patentes de las vacunas de la covid-19 para que puedan ser producidas en otros países. La representante del gobierno de Joe Biden e,06-05-2021 17:24,https://www.bing.com/th?id=OVFT.gGwQCisQ4_kPsvdn51iNHC,Chile,duna
"Desinversión, acusaciones de compadrazgos y la explosión del caso coimas: Todo lo que rodeó el fin de la producción de vacunas en Chile",https://www.theclinic.cl/2021/05/06/desinversion-acusaciones-de-compadrazgos-y-la-explosion-del-caso-coimas-todo-lo-que-rodeo-el-fin-de-la-produccion-de-vacunas-en-chile/,"El 2002, el gobierno de Ricardo Lagos firmó el acta de defunción de la producción de vacunas en Chile. La planta venía arrastrando problemas presupuestarios por más de una década y la decisión estuvo",06-05-2021 17:35,https://www.bing.com/th?id=OVFT.Tqqnyo31cchXucdA_AG5rC,Chile,Clinic
"PESE A DISMINUCIÓN SIGNIFICATIVA, CARGA NACIONAL TRIPLICA LOS 10 CASOS NUEVOS DE COVID-19 POR CIEN MIL HABITANTES",http://www.radiopolar.com/noticia_166515.html,"El equipo ICOVID Chile, iniciativa liderada por la Universidad de Chile, la Pontificia Universidad Católica de Chile y la Universidad de Concepción, presentó su informe número 39 con análisis y datos",06-05-2021 17:40,https://www.bing.com/th?id=OVFT.8YoNgx3C-Iljk0SUAO3o_y,Chile,Radio Polar
"Scientific American afirma que ""imprudente prisa"" chilena por reabrir amenaza ""ejemplar vacunación""",https://www.biobiochile.cl/noticias/nacional/chile/2021/05/06/scientific-american-afirma-que-imprudente-prisa-chilena-por-reabrir-amenaza-ejemplar-vacunacion.shtml,“La imprudente prisa por reabrir amenaza la ejemplar estrategia de vacunación de Chile”. Ese es el titular de una nota,06-05-2021 18:01,https://www.bing.com/th?id=OVFT.xFvprhdnIgDDsxHftnZj7i,Chile,Chile
El futuro de la tecnología: inclusión femenina,https://mundoenlinea.cl/2021/05/06/el-futuro-de-la-tecnologia-inclusion-femenina/,"Los retos que viven las mujeres en la región Latinoamericana son muy similares sin importar el país en el que residan, situación que se evidencia en el estudio “El futuro de la tecnología: inclusión f",06-05-2021 18:09,https://www.bing.com/th?id=OVFT.ly4FwuEaHdwgrFRQ_CRM_i,Chile,Mundo en línea
"Subsecretaria Martorell por detención de Pablo Chill-E: ""Esperamos realmente que quede privado de libertad""",https://www.puranoticia.cl/noticias/nacional/subsecretaria-martorell-por-detencion-de-pablo-chill-e-esperamos/2021-05-06/135111.html,"La subsecretaria de Prevención del Delito, Katherine Martorell, se refirió a la nueva detención del cantante nacional Pablo Acevedo, conocido como Pablo Chill-E, quien este mir",06-05-2021 18:26,https://www.bing.com/th?id=OVFT.HDgmTavixecCMrF8SPSGfC,Chile,Puranoticia.cl
Palacios anuncia acuerdo con empresarios para campaña especial de vacunación,http://www.lanacion.cl/palacios-anuncia-acuerdo-con-empresarios-para-campana-especial-de-vacunacion/,"El ministro de Economía manifestó que para volver a trabajar con mayores índices de normalidad ""tenemos que tener un mínimo del 80% de la población objetivo vacunada"".",06-05-2021 18:27,https://www.bing.com/th?id=OVFT.nSZf2g6ej0AFFpejh9nJ9i,Chile,La Nación
Cámara aprueba Royalty Minero y es despachado al Senado,https://www.latercera.com/pulso/noticia/camara-aprueba-royalty-minero-y-es-despachado-al-senado/S2XFW5Z6FZE53M5IO7I2IG5TCI/,"La iniciativa busca establecer una compensación a favor del Estado por la explotación del cobre y litio en Chile, y que además apunta al financiamiento de una renta renta básica y universal de emergen",06-05-2021 18:45,https://www.bing.com/th?id=OVFT.SP8ErE2ai6NeQuFD5DX29y,Chile,LA TERCERA
"DE LOS ÚLTIMOS CASOS COVID EN MAGALLANES: 99 SON DE PUNTA ARENAS, 27 DE PUERTO NATALES Y 4 SIN NOTIFICACIÓN",http://www.radiopolar.com/noticia_166519.html,"Para hoy informamos que de acuerdo con el sistema Epivigila, Magallanes reporta 130 casos nuevos: 99 corresponden a Punta Arenas, 27 Puerto Natales, 4 casos nuevos reportados y se suman 2 casos por aj",06-05-2021 18:58,https://www.bing.com/th?id=OVFT.7X44MT8gyo6w6kqQ0hJvey,Chile,Radio Polar
Mujeres víctimas de violencia de género desprotegidas por incumplimiento y falencias en protocolos del SernamEG según auditoria de Contraloría,https://www.elmostrador.cl/braga/destacados-braga/2021/05/06/mujeres-victimas-de-violencia-de-genero-desprotegidas-por-incumplimiento-y-falencias-en-protocolos-del-sernameg-segun-auditoria-de-contraloria/,"Desde el año 2019 se encuentra el fono de orientación para mujeres víctimas de violencia (1455). Sobre este servicio de atención, el ente fiscalizador detectó falencias en la atención de llamadas, fal",06-05-2021 19:00,https://www.bing.com/th?id=OVFT.VPS91fvoq5dYpS5c6qrjQS,Chile,El Mostrador
Pedro Pascal está en Chile y desata ola de memes dándole la bienvenida,https://www.lacuarta.com/espectaculos/noticia/pedro-pascal-en-chile-ola-memes-bienvenida/630695/,"Hace unas horas, la persona que le tomó el PCR al destacado actor chileno subió una foto con él en el aeropuerto de Santiago. La publicación se viralizó.",06-05-2021 19:04,https://www.bing.com/th?id=OVFT.k_xhap7io8C3mHks8c0fpi,Chile,La Cuarta
Préstamo Solidario Clase Media SII | ¿Cuándo se postula? Fechas clave del beneficio,https://redgol.cl/tendencias/Cuando-se-postula-al-Prestamo-Solidario-2021--SII.cl-Prestamo-Solidario-2021-Revisa-la-fecha-de-postulacion-20210506-0075.html,El Servicio de Impuestos Internos habilitará dentro de los próximos días una plataforma para solicitar el beneficio.,06-05-2021 19:13,https://www.bing.com/th?id=OVFT.PbJuFCoPD2IuxNaTWFl_jy,Chile,redgol
