name,url,description,datePublished,imagen,pais,Fuente
Presentaron protocolo para el uso de las playas – La Discusión,http://www.ladiscusion.cl/presentaron-protocolo-para-el-uso-de-las-playas/,"Cobquecura fue el lugar escogido por autoridades regionales para presentar el protocolo y guía de recomendaciones para el uso de las playas en Chile, en el contexto Covid-19, disponible en",06-11-2020 01:22,https://www.bing.com/th?id=OVFT.Nf_q1ec-TucKRxNRLmwLEy,Chile,La Discusión
"Desempleo, recuperación y crisis como oportunidad",http://www.diarioelheraldo.cl/noticia/desempleo-recuperacion-y-crisis-como-oportunidad,"Para el trimestre de julio-septiembre, la tasa de desempleo en Chile anotó una leve disminución llegando a 12,3%. Se trata del segundo",06-11-2020 02:02,https://www.bing.com/th?id=OVFT.t1V45_reCcjYj4IswfS6KS,Chile,El Heraldo
Gremio turístico tras anuncio de protocolo para ingreso de ...,https://www.elmostrador.cl/generacion-m/2020/11/06/gremio-turistico-tras-anuncio-de-protocolo-para-ingreso-de-visitantes-extranjeros-al-pais-necesitamos-que-las-fronteras-se-abran-ahora/,"Tras casi ocho meses sin actividad, la subsecretaria de Salud Paula Daza afirmó que se está trabajando en un protocolo para permitir el ingreso de personas extranjeras al país, lo que favorecería la r",06-11-2020 03:40,https://www.bing.com/th?id=OVFT.Qy1yN_cnN7KEhS8Qa0wwHy,Chile,El Mostrador
SanCarlosOnline: En Cobquecura presentan guía de ...,https://www.sancarlosonline.cl/2020/11/en-cobquecura-presentan-guia-de.html,"Autoridades presentaron este jueves el protocolo y guía de recomendaciones para el uso de las playas en Chile, en el contexto Covid-19. En la oportunidad se anunció que, dentro de las medidas obligato",06-11-2020 10:31,https://www.bing.com/th?id=OVFT.JBVdfSYqKegp1wBH5KqC5S,Chile,San Carlos Online
"OCDE ""incrédula"" por segundo 10%: ""Sin criterios de máxima ...",https://www.meganoticias.cl/nacional/318274-segundo-retiro-10-afp-ocde-cgx02.html,"La Organización para la Cooperación y el Desarrollo Económicos (OCDE), manifestó su incredulidad por la posibilidad de que en Chile se apruebe un segundo retiro del 10% de los fondos de AFP",06-11-2020 11:50,https://www.bing.com/th?id=OVFT.24dzjpms-6b4OD_-dGhR7S,Chile,meganoticias
"IPC DE OCTUBRE REGISTRÓ UNA VARIACIÓN MENSUAL DE 0,7%",http://www.radiopolar.com/noticia_161155.html,"En octubre de 2020[1], el Índice de Precios al Consumidor (IPC) anotó una variación mensual de 0,7%, acumulando 2,8% en lo que va del año y un alza a doce meses de 3,0%. En el décimo mes del año, ocho",06-11-2020 13:16,https://www.bing.com/th?id=OVFT.eVwSqaBGv59kAs5hWHM74C,Chile,Radio Polar
"Tío Wom y su arribo a Colombia: ""Invertiremos US$1.000 ...",https://www.df.cl/noticias/empresas/telecom-tecnologia/tio-wom-y-su-arribo-a-colombia-invertiremos-us-1-000-millones-y-vamos/2020-11-06/093555.html,"Ayer fue presentada la marca Wom, que espera arrancar con su operación comercial durante el primer o segundo trimestre del próximo año.",06-11-2020 13:35,https://www.bing.com/th?id=OVFT.5y7KTypGNlzr3nZSW7Pv7y,Chile,df.cl
Inauguran cruce Tokio en el centro de Rancagua para evitar ...,http://www.ultimahora.cl/inauguran-cruce-tokio-en-el-centro-de-rancagua-para-evitar-contagios-por-covid-19/,"Se trata de uno de los proyectos del Plan Nacional de Movilidad, llevado a cabo entre el Ministerio de Transportes y la Subdere, el cual ha aprobado más de $210 millones en iniciativas para la Región",06-11-2020 13:49,https://www.bing.com/th?id=OVFT.j7VF9PP_I1nnTJP5X5KDxi,Chile,Ultima Hora
"Minsal informó 1.801 nuevos casos, llegando a un total de ...",https://www.adnradio.cl/nacional/2020/11/06/minsal-informo-1-801-nuevos-casos-llegando-a-un-total-de-518-390-contagiados-con-covid-19-en-chile.html,"El Ministerio de Salud (Minsal) informó este viernes que hubo 1.801 casos nuevos de coronavirus Covid-19 en Chile en las últimas 24 horas, alcanzando un total de 518.390 contagiados desde el inicio de",06-11-2020 14:08,https://www.bing.com/th?id=OVFT.1ZHpyVjfUOaxPoHlB-naES,Chile,ADN
Covid-19: Chile alcanza 14.450 muertos y 1.801 casos ...,https://www.latribuna.cl/noticias/2020/11/06/covid-19-chile-alcanza-14-450-muertos-y-1-801-casos-nuevos.html,"A la fecha, 733 personas se encuentran hospitalizadas en Unidades de Cuidados Intensivos, de las cuales 579 están con apoyo de ventilación mecánica y 90 se encuentran en estado crítico de salud.",06-11-2020 14:20,https://www.bing.com/th?id=OVFT.zD35kj_FTcFDbuPg-xYp1i,Chile,La Tribuna
Chile registra 1.801 casos nuevos de... | Puranoticia,https://www.puranoticia.cl/noticias/nacional/chile-registra-1-801-casos-nuevos-de-coronavirus-otros-46-decesos-y/2020-11-06/111730.html,"La cifra total de personas que han sido diagnosticadas con covid-19 en el país alcanza a las 518.390. De ese total, 9.346 pacientes se encuentran en etapa activa.",06-11-2020 14:37,https://www.bing.com/th?id=OVFT.ElIruIjZ8Y9PopgPWo-11i,Chile,Puranoticia.cl
Chile registra 518.390 casos y 14.450 fallecidos por COVID-19,https://www.prensafutbol.cl/374660-chile-registra-518-390-casos-y-14-450-fallecido-por-covid-19/,"En el nuevo reporte diario del coronavirus entregado por el Ministerio de Salud, se registraron 1801 nuevos casos, además de 46 nuevas muertes respecto al día anterior. Por otro lado, los test de PCR",06-11-2020 15:14,https://www.bing.com/th?id=OVFT.i0fLXDvQVmh7s5rFfTG0KC,Chile,Prensafútbol
Presidente Piñera recibirá este domingo a Mandatario ...,https://www.emol.com/noticias/Nacional/2020/11/06/1003034/Presidentes-Chile-y-Colombia.html,"En la cita se abordarán los esfuerzos para el combate de la pandemia del coronavirus, así como la profundización de la integración y la colaboración de Prosur y la Alianza del Pacífico, entre otros te",06-11-2020 16:27,https://www.bing.com/th?id=OVFT.9xpBFG63IWd-mxuEfv9PTC,Chile,Emol
Vacuna de la U. de Oxford contra el Covid-19... | Puranoticia,https://www.puranoticia.cl/noticias/regiones/vacuna-de-la-u-de-oxford-contra-el-covid-19-podra-ser-probada-por/2020-11-06/131526.html,Someterse a este estudio clínico es una decisión voluntaria y éste se podrá llevar a cabo en el laboratorio perteneciente a la doctora Juana Pavié.,06-11-2020 16:28,https://www.bing.com/th?id=OVFT.VYQ2LtnfWHmZ89UVOX-Qhy,Chile,Puranoticia.cl
Chile suma 46 muertes por covid-19 y registra 1.801 nuevos ...,https://www.diarioconcepcion.cl/pais/2020/11/06/chile-suma-46-muertes-por-covid-19-y-registra-1-801-nuevos-contagios.html,"Un nuevo balance entregado este viernes por el Ministerio de Salud informó que Chile registró 46 nuevos decesos inscritos y 1.801 casos positivos de covid-19, durante las últimas 24 horas. Del total d",06-11-2020 16:28,https://www.bing.com/th?id=OVFT.7LFN4WPDm0wriflazcHfCi,Chile,El Diario de Concepcion
Tres muertos y 255 casos nuevos de covid-19 reporta región ...,https://www.biobiochile.cl/noticias/nacional/region-del-bio-bio/2020/11/06/tres-muertos-y-255-casos-nuevos-de-covid-19-reporta-region-del-bio-bio-tras-balance-del-gobierno.shtml,Tres muertos y 255 casos nuevos de covid-19 reportó la región del Bío Bío tras el último balance del Gobierno.,06-11-2020 16:30,https://www.bing.com/th?id=OVFT.FZhC2N9CGRwbrYv4HyYyAy,Chile,Chile
Presidente Piñera anuncia que vacunación contra covid-19 ...,https://www.diarioconcepcion.cl/pais/2020/11/06/presidente-pinera-anuncia-que-vacunacion-contra-covid-19-se-aplicara-en-tres-etapas.html,País Presidente Piñera anuncia que vacunación contra covid-19 se aplicará en tres etapas País Chile suma 64 nuevas muertes y registra 8.640 casos activos covid-19,06-11-2020 16:47,https://www.bing.com/th?id=OVFT.18BToaqPP_u4uy2pVlJ2RC,Chile,El Diario de Concepcion
Este domingo el Presidente Piñera recibirá a Iván Duque ...,https://www.adnradio.cl/nacional/2020/11/06/este-domingo-el-presidente-pinera-recibira-a-ivan-duque-para-abordar-esfuerzos-regionales-frente-la-pandemia-del-covid-19.html,También los mandatarios profundizarán en la integración y colaboración de Chile y Colombia en Prosur y la Alianza del Pacífico.,06-11-2020 16:54,https://www.bing.com/th?id=OVFT.j99oPgRV-HhV4uB6eu7CBy,Chile,ADN
"Vuelven las visitas oficiales en La Moneda, Piñera ...",https://www.publimetro.cl/cl/noticias/2020/11/06/la-moneda-pinera-duque.html,"Piñera y Duque, abordarán los desafíos regionales frente a la pandemia y la profundización de la integración y colaboración del bloque.",06-11-2020 16:55,https://www.bing.com/th?id=OVFT.AYRsrmhZGmbCrEMs5MSM9C,Chile,publimetro.cl
“Caco” Latorre (DC) confía en el Regeneron: Primer chileno ...,https://www.latercera.com/la-tercera-pm/noticia/caco-latorre-dc-confia-en-el-regeneron-primer-chileno-en-probar-el-farmaco-usado-por-trump-contra-el-covid-19/D6U2DDOGGRAQ5B2KYWBVWYS5ZA/,El exdiputado DC se encuentra internado en la Unidad de Tratamiento Intensivo de la Clínica Las Condes y aceptó ser parte del ensayo clínico para probar las ventajas del fármaco contra el coronavirus.,06-11-2020 17:00,https://www.bing.com/th?id=OVFT.vx7p39O_cTURvB-55u_TMi,Chile,LA TERCERA
Técnico de Curicó contrae COVID-19 y no puede regresar a ...,https://www.t13.cl/noticia/deportes13/tecnico-curico-unido-nicolas-larcamon-coronavirus-covid-06-11-2020,"El técnico de Curicó Unido, Nicolás Larcamón, viajó esta semana con la autorización del club a Buenos Aires –martes 3 y miércoles 4 de noviembre– para visitar a su hijo de 3 años y familiares más dire",06-11-2020 17:01,https://www.bing.com/th?id=OVFT.hh4mYuM2EFxZS4DRWcEdLS,Chile,T13
Pablo Milad confirmó las bajas de Medel y Aránguiz en la ...,https://www.prensafutbol.cl/374703-pablo-milad-confirmo-las-bajas-de-medel-y-aranguiz-en-la-roja/,Era un secreto a voces que finalmente fue confirmado. Charles Aránguiz y Gary Medel son bajas para los duelos clasificatorios de cara al Mundial de Qatar 2022 ante Perú y Venezuela. Así lo comunicó el,06-11-2020 17:57,https://www.bing.com/th?id=OVFT.NOPqczHf596q_dLS2KxB4i,Chile,Prensafútbol
Realizan sanitización con nanopartículas de cobre en ...,https://www.radioagricultura.cl/nacional/2020/11/06/realizan-sanitizacion-con-nanoparticulas-de-cobre-en-cadena-de-supermercados-2.html,"El intendente de la Región Metropolitana, Felipe Guevara, junto al ministro de Minería, Baldo Prokurica, el vicepresidente de Operaciones de Walmart Chile, Manuel López, y el gerente general del laboratorio nacional Aintech, Tomás Houdely, asistieron este viernes a un operativo de sanitización con nanopartículas de cobre en supermercado ...",06-11-2020 18:15,https://www.bing.com/th?id=OVFT.VSlnkha33h2MvmcLSZtn0y,Chile,Radio Agricultura
Revisa acá si tienes bonos pendientes por cobrar ...,https://www.meganoticias.cl/dato-util/318321-bonos-pendientes-cobro-ndx18.html,"Revisa aquí si tienes bonos pendientes de cobro en el marco de la campaña No pierdas tu bono del Gobierno. Cerca de 137 mil personas no han cobrado sus beneficios, sumando más de $7.200 millones.",06-11-2020 18:45,https://www.bing.com/th?id=OVFT.jtFg1ccdOAYus_NBU6Zu6S,Chile,meganoticias
Provincia de Bío Bío registra 68 casos nuevos de covid-19 ...,https://www.biobiochile.cl/noticias/nacional/region-del-bio-bio/2020/11/06/provincia-de-bio-bio-registra-68-casos-nuevos-de-covid-19-gobierno-impulsa-busqueda-de-contagios.shtml,"68 casos nuevos de covid-19 registró la provincia de Bío Bío, acumulando en todos estos meses un total de 5.825 contagios, de los cuales 368 se mantienen en calidad de activos. A su vez, el Servicio de Salud Bío Bío sigue impulsando la búsqueda activa de casos. En específico, Los Ángeles",06-11-2020 19:01,https://www.bing.com/th?id=OVFT.qDO2JXd2-lQM3amwrL6dUi,Chile,Chile
"No habrá ""Semana Pichilemina"" en 2021 — El Marino",https://www.diarioelmarino.cl/2020/11/06/no-habra-semana-pichilemina-en-2021/,"La municipalidad de Pichilemu, mediante el alcalde, informó esta tarde que no está considerada la realización de la Semana Pichilemina en febrero próximo. La celebración, que corona el fin",06-11-2020 19:22,https://www.bing.com/th?id=OVFT._x6bHcLZIjvgPLc1VpDfNi,Chile,El Marino
Dirección del Trabajo fiscalizará medidas contra el Covid ...,http://www.lanacion.cl/direccion-del-trabajo-fiscalizara-medidas-contra-el-covid-19-en-el-trabajo-agricola-de-temporada/,"La Dirección del Trabajo (DT) informó a las empresas agrícolas que están iniciando sus cosechas en la provincia del Ranco y las comunas de Lanco y Panguipulli el énfasis que tendrá la fiscalización de las normales laborales, previsionales y de seguridad en el contexto de la pandemia de Covid-19.",06-11-2020 19:42,https://www.bing.com/th?id=OVFT.kiEbSzDC_Nf6b5419tAAQy,Chile,La Nación
Nicolás Larcamon dio positivo por coronavirus estando en ...,https://www.elperiscopio.cl/deportes/nicolas-larcamon-dio-positivo-por-coronavirus-estando-en-argentina/,"El técnico de Curicó Unido, Nicolás Larcamon, dio positivo en un test de Covid-19 y se perderá el partido pendiente ante Universidad Católica.",06-11-2020 19:55,https://www.bing.com/th?id=OVFT.LlnBhJ8hU32oVnyoyZz5Li,Chile,elperiscopio.cl
En Ñuble 45 pacientes se encuentran hospitalizados por ...,http://www.ladiscusion.cl/en-nuble-45-pacientes-se-encuentran-hospitalizados-por-covid-19/,"El normal funcionamiento de los hospitales, de la atención primaria y de las unidades de emergencia de la Región, reportó el Servicio de Salud Ñuble en un nuevo balance de la red asistencial. En",06-11-2020 19:57,https://www.bing.com/th?id=OVFT.NDL8Pt5cAZ46fYMfVsUH9C,Chile,La Discusión
Llega a Chile nuevo test rápido COVID-19 que promete ...,https://www.t13.cl/noticia/nacional/nuevo-test-rapido-covid-19-resultados-15-minutos-06-11-20,"La compañía Abbott asegura que el test permite la detección, en pocos minutos, del antígeno del virus SARS-CoV-2, convirtiéndolo en una herramienta de valor para realizar pruebas a escala masiva.",06-11-2020 19:58,https://www.bing.com/th?id=OVFT.Ys2M0yxlgxbAtcV5uMbTSy,Chile,T13
Joaquín Niemann y sus malas noticias: dio positivo por ...,https://www.publimetro.cl/cl/grafico-chile/2020/11/06/joaquin-niemann-positivo-covid-masters.html,"""Estoy muy desilusionado de no poder jugar el Masters este año, pero haré todo lo posible por tener una pronta recuperación"", expresó Joaquín Niemann.",06-11-2020 20:30,https://www.bing.com/th?id=OVFT.kfGwso-WTjMTYB23ag_rSy,Chile,publimetro.cl
