name,url,description,datePublished,imagen,pais,Fuente
Más que un vapor inofensivo: El uso de cigarrillos electrónicos en espacios cerrados aumentan los factores de riesgo ante el Covid-19,https://www.elmostrador.cl/agenda-pais/2021/07/10/mas-que-un-vapor-inofensivo-el-uso-de-cigarrillos-electronicos-en-espacios-cerrados-aumentan-los-factores-de-riesgo-ante-el-covid-19/,"Los cigarrillos electrónicos o vapers son dispositivos para fumar, estos utilizan un líquido que suele contener nicotina, saborizantes y sustancias químicas.",10-07-2021 11:26,https://www.bing.com/th?id=OVFT.EG3GxWpbCeqqcPvDkNxs1i,Chile,El Mostrador
BONO DE ALIVIO PARA MICRO Y PEQUEÑAS EMPRESAS (MYPES),https://www.chanarcillo.cl/bono-de-alivio-para-micro-y-pequenas-empresas-mypes/,El pasado 11 de junio de 2021 el Presidente Sebastián Piñera promulgó la ley que permite otorgar bonos de cargo fiscal para ir en ayuda de más de 820 mil micro y pequeñas empresas (Mypes) que han sido,10-07-2021 11:50,https://www.bing.com/th?id=OVFT.yYZmiDF-Ssc29c7Rg6rUEy,Chile,Diario Chanarcillo
Gobierno denuncia por apropiación indebida al presidente del directorio de Clínica Las Condes,https://laprensaaustral.cl/2021/07/10/gobierno-denuncia-por-apropiacion-indebida-al-presidente-del-directorio-de-clinica-las-condes/,Alejandro Gil habría obligado a una enfermera a inocularlo con una tercera dosis de la vacuna contra el Covid-19,10-07-2021 14:00,https://www.bing.com/th?id=OVFT.YUAx3YXkgAFUqlQ8CbOR2C,Chile,La Prensa Austral
Coronavirus en Chile: 2.696 nuevos contagios y 131 muertes en las últimas 24 horas,https://www.t13.cl/noticia/nacional/coronavirus-chile-nuevos-contagios-y-muertes-ultimas-24-horas-10-07-2021,"La positividad de la totalidad de exámenes realizados alcanzó el 4,03% a nivel nacional y un 4% en la Región Metropolitana.",10-07-2021 14:11,https://www.bing.com/th?id=OVFT.AxmfqZSshlOi9Iybs6ntUi,Chile,T13
Coronavirus en Chile: Minsal confirmó 2.696 nuevos casos y cifra total llegó a 1.585.160 personas que han tenido la enfermedad,https://www.adnradio.cl/nacional/2021/07/10/coronavirus-en-chile-minsal-confirmo-2-696-nuevos-casos-y-cifra-total-llego-a-1-585-160-personas-que-han-tenido-la-enfermedad.html,"El Ministerio de Salud (Minsal) entregó este sábado 10 de julio un nuevo balance sobre la situación del coronavirus en Chile. En este informe, el organismo detalló que se han registrado 2.696 nuevos c",10-07-2021 15:13,https://www.bing.com/th?id=OVFT.XNg2tl1Hx-G8-YGgNkdVki,Chile,ADN
Minsal informó 131 fallecidos por covid-19 en Chile en las últimas 24 horas: Total llegó a 33.767 personas,https://www.adnradio.cl/nacional/2021/07/10/minsal-informo-131-fallecidos-por-covid-19-en-chile-en-las-ultimas-24-horas-total-llego-a-33-767-personas.html,"En tanto se indicó que hay 2.447 personas hospitalizadas en unidades de cuidados intensivos, 1.999 de ellas con ventilación mecánica.",10-07-2021 15:13,https://www.bing.com/th?id=OVFT.PR-DGJR2_WB-oordG1i9cy,Chile,ADN
"Minsal reportó 2.696 casos nuevos y 131 fallecidos: Positividad llegó a 4,03%, nuevamente la más baja del año",http://www.lanacion.cl/minsal-reporto-2-696-casos-nuevos-y-131-fallecidos-positividad-llego-a-403-nuevamente-la-mas-baja-del-ano/,"El ministerio dio el balance diario respecto a la situación del Covid-19 en Chile, con un alto porcentaje de ocupación de camas críticas, con 2.447 personas en Unidades de Cuidados Intensivos, de las",10-07-2021 15:20,https://www.bing.com/th?id=OVFT.TefER33c530WBq7LUFBOMS,Chile,La Nación
Chile reporta 2.696 nuevos casos de coronavirus y 131 decesos,http://www.ladiscusion.cl/chile-reporta-2-696-nuevos-casos-de-coronavirus-y-131-decesos/,"Este sábado el Ministerio de Salud reportó 2.696 nuevos casos de coronavirus y 131 decesos. A la fecha 1.585.160 personas han dado positivo por el covid-19 y 33.767 han fallecido, desde que",10-07-2021 15:24,https://www.bing.com/th?id=OVFT._hkl3byvklhc8pCV4DN7Ey,Chile,La Discusión
Reporte covid-19: nuevos contagios siguen bajo los tres mil casos,https://www.publimetro.cl/cl/noticias/2021/07/10/reporte-covid-19-nuevos-contagios-siguen-bajo-los-tres-mil-casos.html,"El Ministerio de Salud entregó esta jornada un nuevo balance sobre la evolución del covid-19. Totaliza 2.696 casos en las últimas 24 horas, de los cuales 1.748 manifestaron algún síntoma y 811 fueron",10-07-2021 16:02,https://www.bing.com/th?id=OVFT.teylvBFhTe-r7G3E-jj5SC,Chile,publimetro.cl
Chile suma 131 fallecidos y 2.696 contagios nuevos por Covid-19: positividad alcanza un 4% a nivel nacional en últimas 24 horas,https://www.elmostrador.cl/destacado/2021/07/10/chile-suma-131-fallecidos-y-2-696-contagios-nuevos-por-covid-19-positividad-alcanza-un-4-a-nivel-nacional-en-ultimas-24-horas/,"El Ministerio de Salud informó que, desde el inicio de la pandemia, ha habido 1.585.160 personas que han dado positivo para el virus y 33.767 víctimas fatales. La positividad de los exámanes fue nueva",10-07-2021 16:03,https://www.bing.com/th?id=OVFT.0QLHRJOgetQ3D0WASCBbjS,Chile,El Mostrador
Región de Valparaíso registró 285 casos nuevos de Covid-19,https://www.radioagricultura.cl/nacional/2021/07/10/region-de-valparaiso-registro-285-casos-nuevos-de-covid-19.html,"La Seremi de Salud de Valparaíso confirmó 285 nuevos casos de coronavirus en la región, por lo que el total en la zona ya asciende a 117.572 personas contagiadas. El total de víctimas fatales por la e",10-07-2021 16:13,https://www.bing.com/th?id=OVFT.XsTdLyt3BF4qzG4Itib24i,Chile,Radio Agricultura
Fenasenf llama a transparentar casos de diez pacientes vacunados con tercera dosis,http://www.lanacion.cl/fenasenf-llama-a-transparentar-casos-de-diez-pacientes-vacunados-con-tercera-dosis/,"El Presidente de Fenasenf (Federación Nacional de Asociaciones de Enfermeras y Enfermeros de Chile), José Luis Espinoza ... Minsal para recibir un refuerzo de tercera dosis contra el Covid-19. Espinoza emplazó al medio de comunicación a transparentar ...",10-07-2021 17:12,https://www.bing.com/th?id=OVFT.-h_DPiewaBpLcPOTmR0d9S,Chile,La Nación
IFE Universal: Conoce el detalle de los pagos retroactivos,https://www.13.cl/programas/servicios-13/servicios/ife-universal-conoce-el-detalle-de-los-pagos-retroactivos,El Ingreso Familiar de Emergencia (IFE) Universal es entregado por el Gobierno a las familias chilenas más afectadas por la pandemia hasta el mes de septiembre. El Gobierno de Chile ha implementado al,10-07-2021 17:28,https://www.bing.com/th?id=OVFT.nYK4UviVpsf5P58qka2SFi,Chile,13.cl
Coronavirus en Chile: Minsal confirmó 2.696 nuevos casos,https://radioportales.cl/sitio/coronavirus-en-chile-minsal-confirmo-2-696-nuevos-casos/,"Este sábado 10 de julio, el Minsal entregó un nuevo balance sobre la situación del coronavirus en Chile. En el informe se detalló que han registrado 2.696 casos nuevos de Covid-19 en nuestro país. Así",10-07-2021 17:29,https://www.bing.com/th?id=OVFT.s5TRU6Xu1AnegnWoKGDCQi,Chile,Radio Portales
Alerta de Enfermeros y Enfermeras de Chile por más casos de chilenos ya vacunados con tercera dosis,https://www.puranoticia.cl/noticias/nacional/alerta-de-enfermeros-y-enfermeras-de-chile-por-mas-casos-de-chilenos-ya/2021-07-10/134122.html,"El caso del Presidente del Directorio de la Clínica Las Condes no sería el único en el país, al menos habrían otros 10 casos.",10-07-2021 18:12,https://www.bing.com/th?id=OVFT.50rc158EUH4CPiOBZalz0y,Chile,Puranoticia.cl
OMS insta a no inmunizar masivamente a menores de edad hasta lograr acceso equitativo de vacunas,https://www.elperiodista.cl/2021/07/oms-insta-a-no-inmunizar-masivamente-a-menores-de-edad-hasta-lograr-acceso-equitativo-de-vacunas/,"La Organización Mundial de Salud (OMS) recomienda no ofrecer de forma masiva las vacunas contra el coronavirus a niñas, niños y adolescentes ya que no pertenecen a un grupo de riesgo y estos fármacos",10-07-2021 18:40,https://www.bing.com/th?id=OVFT.2Xbs1zetdcnKz6nmVKqL4S,Chile,El Periodista
"Informe Epidemiológico: Puente Alto, Arica y Maipú lideran casos activos de Covid-19",https://www.radioagricultura.cl/nacional/2021/07/10/informe-epidemiologico-puente-alto-arica-y-maipu-lideran-casos-activos-de-covid-19.html,El ministerio de Salud publicó este sábado 10 de julio el 136° Informe Epidemiológico realizado por el Estadísticas e Información de,10-07-2021 18:43,https://www.bing.com/th?id=OVFT.mDMOoShftywPfUWg6z7vly,Chile,Radio Agricultura
Libres de coronavirus: Las 18 comunas que no presentan casos activos en Chile,https://www.meganoticias.cl/nacional/343433-informe-epidemiologico-comunas-libres-coronavirus-colchane-futaleufu-torres-del-paine-10-07-2021.html,El ministerio de Salud dio a conocer este sábado las comunas que no presentan casos activos de coronavirus en Chile. La información fue entregada en un nuevo Informe Epidemiológico.,10-07-2021 20:01,https://www.bing.com/th?id=OVFT.FJmQTyTCqnk6h68QkdOuKS,Chile,meganoticias
Hospitalizados Covid-19 en UCI a nivel nacional continúan a la baja y alcanzan menor cifra en 107 días,https://www.latercera.com/nacional/noticia/hospitalizados-covid-19-en-uci-a-nivel-nacional-continuan-a-la-baja-y-alcanzan-menor-cifra-en-107-dias/5XQSCXDZFFFNNOKG3M4LXXEGLQ/,"En estos primeros días de julio, además, ninguna de las 16 regiones ha alcanzado sus récords de internados en Unidades de Cuidados Intensivos. Esto se enmarca en medio de una disminución en los indica",10-07-2021 20:08,https://www.bing.com/th?id=OVFT.VThOopP9II8cB1BZicSSBi,Chile,LA TERCERA
Informe Epidemiológico: Total de contagios bordea el millón 900 mil entre confirmados y sospechosos,https://www.t13.cl/noticia/nacional/informe-epidemiologico-arica-es-segunda-comuna-mas-casos-activos-covid-19-pais,"Hasta el 8 de julio de 2021 han ocurrido 1.899.123 casos de COVID-19 (1.582.391 con confirmación de laboratorio y 316.732 probables) en Chile. En esta versión, la Región Metropolitana sigue concentran",10-07-2021 20:59,https://www.bing.com/th?id=OVFT.BehKGzWc8G6YYAjyNNApGi,Chile,T13
Informe epidemiológico: Casos activos de Covid-19 en el país bajan de los 25 mil y llegan a su menor número en seis meses,https://www.latercera.com/nacional/noticia/informe-epidemiologico-casos-activos-de-covid-19-en-el-pais-bajan-de-los-25-mil-y-llegan-a-su-menor-numero-en-seis-meses/MQAPHOEMVFFDBFD23K6NMJLNQM/,"La Región Metropolitana actualmente contabiliza 8.780 contagiantes, una situación que no se registraba desde marzo. Por otra parte, las comunas con mayor cantidad de activos son: Arica, Maipú y Puente",10-07-2021 22:21,https://www.bing.com/th?id=OVFT.aiFBuEFgi8dIlO_UK0mN7S,Chile,LA TERCERA
Reportan 27 casos nuevos de Covid 19 con PCR positivos; 11 de Coyhaique y 12 de Aysén,https://www.rln.cl/destacado/88912-reportan-27-casos-nuevos-de-covid-19-con-pcr-positivos-11-de-coyhaique-y-12-de-aysen,"Durante el reporte de la Seremi de Salud de este sábado 10 de Julio se informó que en las últimas horas se confirmaron 27 nuevos casos de Covid 19 con PCR positivos. Aysén.- Según se detalló, de estos",11-07-2021 00:25,https://www.bing.com/th?id=OVFT.BukjeXzmNgiGKErsgKSvjC,Chile,Radio las Nieves
15 comunas de Ñuble en fase 3: ¿Cómo evitar retroceder en el Plan Paso a Paso?,http://www.ladiscusion.cl/15-comunas-de-nuble-en-fase-3-como-evitar-retroceder-en-el-plan-paso-a-paso/,"La Región de Ñuble tiene a la fecha 15 comunas en fase 3 de Preparación del Plan Paso a Paso, y ha sido gracias a los indicadores de la pandemia por Covid-19 que en las últimas semanas ha mejorado",11-07-2021 00:51,https://www.bing.com/th?id=OVFT._tj3fQ6upJ7wZ4YNM9x-tC,Chile,La Discusión
Raquel Argandoña responde a lluvia de críticas tras subir foto en «vacaciones»,https://www.lacuarta.com/espectaculos/noticia/raquel-argandona-responde-criticas-foto-vacaciones/650901/,"La ex rostro de Canal 13, Raquel Argandoña fue criticada tras subir foto de vacaciones y no aclarar que se trataba de un registro del pasado y sin Covid-19-",11-07-2021 00:54,https://www.bing.com/th?id=OVFT.u3OM2XdYYxeym9voV3Z6ri,Chile,La Cuarta
El caso inédito de mujer belga de 90 años contagiada simultáneamente con dos variantes de covid-19,https://www.biobiochile.cl/noticias/internacional/europa/2021/07/10/el-caso-inedito-de-mujer-belga-de-90-anos-contagiada-simultaneamente-con-dos-variantes-de-covid-19.shtml,"Los investigadores belgas informaron el domingo del caso inédito de una nonagenaria fallecida en marzo del covid-19, después de",11-07-2021 01:02,https://www.bing.com/th?id=OVFT.ucHaSH86I-Uby_B4JaoJqi,Chile,Chile
"José Plubins: ""Bagó fue la primera empresa del país en tener una política escrita sobre violencia intrafamiliar""",https://www.cnnchile.com/tag/equidad/,"10-07-2021 21:16 / En conversación con Empresas 2050, el presidente de Bagó Chile recalcó la importancia de tomar medidas que aseguren el bienestar de las trabajadoras. “El tema de violencia intrafami",11-07-2021 01:18,https://www.bing.com/th?id=OVFT.4wLuOg9uFhM8MSKeoSaX7i,Chile,CNN Chile
La quinta es la vencida: Por fin se le dio a Lionel Messi,https://www.13.cl/programas/copa-america/noticias/la-quinta-es-la-vencida-por-fin-se-le-dio-a-lionel-messi,"Goleador y mejor jugador de la Copa, Lionel Messi esfumó a todos los fantasmas y consiguió un sueño que tenía desde niño: Ser Campeón con Argentina. Messi Campeón en Brasil y la alegría soñada La fina",11-07-2021 03:46,https://www.bing.com/th?id=OVFT.6dRI8o6zweoEvjF8tRz_iC,Chile,13.cl
Salud informa que 10 personas ya han recibido tercera dosis de vacuna: Todos padecen una enfermedad inmunosupresora,http://www.diarioelheraldo.cl/noticia/salud-informa-que-10-personas-ya-han-recibido-tercera-dosis-de-vacuna-todos-padecen-una-enfermedad-inmunosupresora,"En Chile ya hay registro de 11 personas que han recibido la tercera ... o las personas que reciben medicamentos o terapias inmunosupresores pueden tener un mayor riesgo de contraer COVID-19 grave"". Agrega que ""al día de hoy, no existen datos para ...",11-07-2021 03:48,https://www.bing.com/th?id=OVFT.flqhRAc-c7W52Pfnc1NxDi,Chile,El Heraldo
"Minsal reporta 2.696 casos nuevos y 131 decesos: Positividad llegó a 4,03%, nuevamente la más baja del año",http://www.diarioelheraldo.cl/noticia/-minsal-reporta-2696-casos-nuevos-y-131-decesos-positividad-llego-a-403-nuevamente-la-mas-baja-del-ano,Este sábado el Ministerio de Salud reportó 2.696 nuevos casos de coronavirus y lamentó 131 decesos. Esto es inferior a lo ocurrido hace siete,11-07-2021 03:51,https://www.bing.com/th?id=OVFT.-aw4ZjxSKNhKzhZ-txghwC,Chile,El Heraldo
Critican paso a Fase 3 justo cuando Mesa Social Biobío pedía tomar precauciones,https://www.diarioconcepcion.cl/ciudad/2021/07/11/critican-paso-a-fase-3-justo-cuando-mesa-social-biobio-pedia-tomar-precauciones.html,"La intercomuna, salvo excepciones, ha estado en Fase 2 o en cuarentena en lo que va del 2021, de modo que la instancia era esperada por los vecinos de la ciudad, naturalmente fatigados por las medidas",11-07-2021 07:05,https://www.bing.com/th?id=OVFT.Pq1tcqd_eYuiiAfhN26Chy,Chile,El Diario de Concepcion
"Gobernador electo de Magallanes delinea propuestas de desarrollo y asegura que ""congelaría"" concesiones a salmoneras",https://www.emol.com/noticias/Economia/2021/07/11/1026264/gobernador-magallanes-desarrollo-salmoneras.html,"Según Jorge Flies las empresas salmoneras que actualmente operan en la región ""van a tener que responder a su responsabilidad social, que es insuficiente"".",11-07-2021 08:36,https://www.bing.com/th?id=OVFT.HOt0VccEZURXIT73asZYAy,Chile,Emol
Encuesta Amuch: Un 63% de las personas practica alguna actividad física pese a la pandemia,https://www.emol.com/noticias/Nacional/2021/07/11/1026257/encuestaamuch-y-actividad-fisica-pandemia.html,"El estudio realizado junto al Ministerio del Deporte, mostró además que el 46,9% lo hace por ser importante para la salud e imagen y un 30% porque lo ayuda frente al estrés y la ansiedad.",11-07-2021 08:38,https://www.bing.com/th?id=OVFT.YAxg-vPolWQ7SU8R-nIvyy,Chile,Emol
Cuarentenas: Conoce todas las comunas que permanecen en confinamiento total en Chile,https://www.meganoticias.cl/dato-util/343156-minsal-comunas-en-cuarentena-hoy-fase-1-covid-nuevo-plan-paso-a-paso-11-07-2021.html,"Para contener la pandemia de Covid-19 en Chile, el Ministerio de Salud ha establecido cuarentenas totales en diversas comunas del país. La Fase 1 del Plan Paso a Paso es la medida más restrictiva de movilidad y sólo permite salir para realizar compras o ...",11-07-2021 09:00,https://www.bing.com/th?id=OVFT.LOLY2_01JmO76lKRnUSPVS,Chile,meganoticias
