name,url,description,datePublished,imagen,pais,Fuente
Figueroa critica actitud del presidente del Colegio de ...,https://www.t13.cl/noticia/politica/figueroa-colegio-profesores-penoso-02-10-2020,"A juicio del titular de Educación, las declaraciones del presidente del Colegio de Profesores son penosas y eso habla mucho del nivel del gremio.",02-10-2020 10:54,https://www.bing.com/th?id=OVFT.aVnRo-JD0sZzB4uD-BMt6i,Chile,T13
Cómo cambió la composición de los accionistas de Latam en ...,https://www.latercera.com/pulso-trader/noticia/como-cambio-la-composicion-de-los-accionistas-de-latam-en-el-ultimo-trimestre/DKRJV3JEN5CNZG3BMPRQ3BT3IU/,"Menos ADR, una AFP menos pero un mayor número de accionistas. Así es la actual estructura de propiedad de la compañía.",02-10-2020 10:59,https://www.bing.com/th?id=OVFT.a4iJXp2iRYE8c5qa-vfaBS,Chile,LA TERCERA
Primarias en Chile Vamos y la oposición: Las batallas ...,https://www.emol.com/noticias/Nacional/2020/10/02/999547/Primarias-Oposicion-Chile-Vamos.html,"Primarias en Chile Vamos y la oposición: Las batallas electorales de alcaldes y gobernadores que hay que seguir Luego de la ratificación de los pactos ante el Servicio Electoral (Servel), los distintos bloques mostraron sus cartas en regiones y alcaldías que asoman como clave.",02-10-2020 11:18,https://www.bing.com/th?id=OVFT.gBQJwzKQy8jxM0y1aKWMdi,Chile,Emol
Ministro de Educación apunta contra los alcaldes: “Hay ...,https://www.radioagricultura.cl/nacional/2020/10/02/ministro-de-educacion-apunta-contra-los-alcaldes-hay-muchos-que-no-toman-todas-las-medidas-que-debiesen-estar-tomando.html,"El ministro de Educación, Raúl Figueroa, cree que algunos alcaldes no están haciendo todo lo necesario para que sus liceos reabran a la comunidad educativa, en el contexto de la pandemia de Covid-19. El análisis lo hizo luego de que este jueves, la comuna de Pirque recibiera solo 20 alumnos",02-10-2020 11:26,https://www.bing.com/th?id=OVFT.oELADP2VVT149HzeYBrWIC,Chile,Radio Agricultura
Acusación constitucional: Mañalich expone este viernes ...,http://www.lanacion.cl/acusacion-constitucional-manalich-expone-este-viernes-ante-comision-que-revisa-libelo/,"El exministro de Salud, Jaime Mañalich, expondrá este viernes, a las 10:30 horas, ante la comisión de la Cámara de Diputados que analiza la acusación constitucional, que fue presentada en su contra por parde de la oposición, por infringir gravemente la Constitución al poner el riesgo la vida",02-10-2020 11:51,https://www.bing.com/th?id=OVFT.WdH1cthX5pMonfQ9uCRBRy,Chile,La Nación
Radio Valparaíso Sernapesca Fiscaliza Nave Rusa en Puertos ...,https://www.radiovalparaiso.cl/2020/10/02/sernapesca-fiscaliza-nave-rusa-en-puertos-de-valparaiso-e-iquique/,"Chile es miembro activo de la Organización Regional de Pesca del Pacífico Sur (ORPPS, o SPRFMO por su sigla en Inglés), entidad intergubernamental comprometida con la conservación y sostenibilidad de",02-10-2020 12:07,https://www.bing.com/th?id=OVFT.sLZOkOkvgYFGn3NhvHZdGi,Chile,Radio Valparaiso
El 82% de los casos totales de Covid-19 en Magallanes ...,https://www.itvpatagonia.com/noticias/el-82-de-los-casos-totales-de-covid-19-en-magallanes-proviene-de-segunda-ola/,"“Es un nivel de contagio muy alto. Es como si aquí, en la Región Metropolitana, tuviésemos ocho mil o 10 mil casos (diarios). La red asistencial ha podido dar respuesta, (pero) estamos aeroevacuando a",02-10-2020 12:36,https://www.bing.com/th?id=OVFT.naeiQ-dX1Gq9jZ55C0OnAi,Chile,ITV
Ministro de Ciencia anuncia que para el 2021 no habrá ...,https://www.elmostrador.cl/cultura/2020/10/02/ministro-de-ciencia-anuncia-que-para-el-2021-no-habra-convocatoria-a-becas-chile/,"Estamos frente a un escenario presupuestario muy complejo -lamentó- donde hay un déficit fiscal, recesión económica, hay muchas necesidades en temas económicos, en temas sociales, y el presupuesto 202",02-10-2020 12:38,https://www.bing.com/th?id=OVFT.JtW4Cwu9uwOBQ6ec6OTycS,Chile,El Mostrador
UC ya tiene fecha para comenzar con las pruebas de la ...,https://www.elperiscopio.cl/destacado-1/uc-ya-tiene-fecha-para-comenzar-con-las-pruebas-de-la-vacuna-contra-el-covid-19/,"La Universidad Católica a través de su rector, Ignacio Sánchez, confirmó que el próximo y cercano 10 de octubre comenzará el reclutamiento de voluntarios para que se ponga a prueba la vacuna contra el",02-10-2020 13:09,https://www.bing.com/th?id=OVFT.E1MJMJ6qQoyemN6KKgVI6S,Chile,elperiscopio.cl
El positivo por Covid-19 de Trump golpeó con fuerza a los ...,https://www.elmostrador.cl/mercados/2020/10/02/el-positivo-para-covid-19-de-trump-golpeo-con-fuerza-a-los-mercados/,"Los inversionistas, que ya estaban nerviosos por las elecciones a la Casa Blanca de noviembre, tienen ahora otra cosa de la que preocuparse: la salud del presidente estadounidense. En Chile, tras la n",02-10-2020 13:25,https://www.bing.com/th?id=OVFT.b_pYE0Ia3kBKjn_k96N5Ui,Chile,El Mostrador
El dólar en Chile hoy - Diario Financiero,https://www.df.cl/noticias/mercados/divisas/dolar-en-chile-se-acerca-a-los-790-en-jornada-marcada-por-la/2020-10-02/083638.html,"El peso chileno terminó la sesión bajo presión en línea con un debilitamiento transversal de las mayores monedas del mundo emergente, luego de que se conociera que Trump dio positivo en el test de Cov",02-10-2020 13:38,https://www.bing.com/th?id=OVFT.tDjYd7x-XsFFJyGYKyo_hS,Chile,df.cl
Norambuena destacó enfoque en recuperación económica y ...,https://www.latribuna.cl/politica/2020/10/02/norambuena-destaco-enfoque-en-recuperacion-economica-y-empleo-de-presupuesto-2021.html,El parlamentario de la UDI aseguró que anuncio del Presidente Piñera “es la expresión más clara de un Estado que va en ayuda de los chilenos” y “que haya una discusión con altura de miras” en el Congr,02-10-2020 13:49,https://www.bing.com/th?id=OVFT.yP6nQ_se8Ro5vM8UZ87rRC,Chile,La Tribuna
"Mañalich reconoció ""serios problemas"" y lamentó si sus ...",https://www.biobiochile.cl/noticias/nacional/chile/2020/10/02/manalich-defiende-su-gestion-ante-la-pandemia-en-comision-que-analiza-acusacion-constitucional.shtml,"El exministro de Salud, Jaime Mañalich, expuso ante la comisión revisora de la acusación constitucional en su contra, donde",02-10-2020 14:04,https://www.bing.com/th?id=OVFT.3fA_j3oYu2Lxi0I8U8bvDC,Chile,Chile
Autoridades fiscalizaron medidas sanitarias para el ...,https://www.radioagricultura.cl/deportes/2020/10/02/autoridades-fiscalizaron-medidas-sanitarias-para-el-clasico-universitario.html,"Este domingo, a las 14 horas, Universidad Católica y Universidad de Chile animarán en San Carlos de Apoquindo el partido más atractivo de la fecha 13 del Campeonato Nacional 2020. A dos días del clásico universitario, autoridades tanto de gobierno como sanitarias llegaron al recinto de Las",02-10-2020 14:05,https://www.bing.com/th?id=OVFT.ICKnGyTYrLJkzl8L468A-i,Chile,Radio Agricultura
Hospital cumple 75 años con muestra fotográfica que ...,http://www.ladiscusion.cl/hospital-cumple-75-anos-con-muestra-fotografica-que-destaca-labor-del-personal/,"El principal centro asistencial de la Región de Ñuble cumple mañana 75 años, efeméride doblemente significativa porque, además, en todo el país se conmemora el Día del Hospital, recordando el",02-10-2020 14:11,https://www.bing.com/th?id=OVFT.8X9VaM56bWJAsYw59mduIi,Chile,La Discusión
Covid-19: Chile suma 12.867 fallecidos y 1.839 casos ...,https://www.latribuna.cl/noticias/2020/10/02/covid-19-chile-suma-12-867-fallecidos-y-1-839-casos-nuevos.html,"Respecto a la de Red de Laboratorios y la capacidad diagnóstica, ayer se informaron los resultados de 38.674 exámenes PCR, alcanzando a la fecha un total de 3.394.522 test analizados a nivel nacional.",02-10-2020 14:19,https://www.bing.com/th?id=OVFT.QVHLFOQZl330Tc5RPNm6iC,Chile,La Tribuna
Reporte del coronavirus en Chile: 1.839 casos... | Puranoticia,https://www.puranoticia.cl/noticias/nacional/reporte-del-coronavirus-en-chile-1-839-casos-nuevos-positividad-del/2020-10-02/113213.html,"La cifra total de personas que han sido diagnosticadas con covid-19 en el país alcanza a las 466.590. De ese total, 14.116 pacientes se encuentran en etapa activa del virus.",02-10-2020 14:40,https://www.bing.com/th?id=OVFT.OWo1YZpKnKmpFITtTHYh5i,Chile,Puranoticia.cl
Arriba Todos Juntos: El plan que busca apoyar a ...,https://www.puentealtoaldia.com/arriba-todos-juntos-el-plan-que-busca-apoyar-a-emprendedores-y-pequenos-comerciantes/,El plan impulsado por CMPC contempla estrictas medidas de seguridad que van desde la capacitación para la aplicación de protocolos sanitarios hasta la entrega de lavamanos portátiles y kits con produc,02-10-2020 15:26,https://www.bing.com/th?id=OVFT.NmNxjJAQk2yVQcjhiXC3hi,Chile,Puente Alto al Dia
Pese a pandemia un 64% de consumidores aún prefiere el ...,https://www.publimetro.cl/cl/noticias/2020/10/02/whatsapp-llamado-delivery.html,Chile está entre los cuatro países de Latinoamérica que más usa la llamada telefónica o el Whatsapp para comprar productos con despacho o delivery de comida,02-10-2020 15:32,https://www.bing.com/th?id=OVFT.axdShF_pGzBqJX1Mza_niC,Chile,publimetro.cl
Chile registró 1.839 nuevos casos de COVID-19 en un día ...,http://www.radioportales.cl/sitio/chile-registro-1-839-nuevos-casos-de-covid-19-en-un-dia/,"El Minsal reportó este viernes 45 fallecidos por Covid-19 inscritos por el Departamento de Estadísticas e Información en Salud, DEIS de la cartera, lo que eleva al total nacional de defunciones a 12 m",02-10-2020 15:44,https://www.bing.com/th?id=OVFT.acB-SmZ-vkhg9JEgcjBEmi,Chile,Radio Portales
Ministro Pérez e ingreso irregular a Chile: “Tiene como ...,https://www.adnradio.cl/nacional/2020/10/02/ministro-perez-e-ingreso-irregular-a-chile-tiene-como-proposito-generar-muchas-dificultades.html,"El ministro del Interior, Víctor Pérez, y el subsecretario del Interior, Juan Francisco Galli, se refirieron al aumento del ingreso irregular de extranjeros por pasos inhabilitados, en medio de la pandemia por el coronavirus Covid-19. Al respecto, el jefe de la cartera sostuvo: “El mensaje que",02-10-2020 16:08,https://www.bing.com/th?id=OVFT.5O4slJukHLsCzCYtq6X29S,Chile,ADN
Patricio Navia: No llegó nadie a clases | El Diario de ...,https://www.radiosantiago.cl/archivo/145387,"De todos los legados que va a dejar la pandemia, el impacto en la educación de los niños, adolescentes y jóvenes será el más costoso a largo plazo. Porque no hay mejor inversión que la educación",02-10-2020 16:18,https://www.bing.com/th?id=OVFT.2kXXlke03dr7eJ6ZhAbaBi,Chile,Radio Santiago
Anne Hathaway como la malvada bruja en filme The Witches ...,https://www.biobiochile.cl/noticias/espectaculos-y-tv/cine-y-series/2020/10/02/anne-hathaway-como-malvada-bruja-en-pelicula-the-witches-ella-es-tan-rara-tan-tonta-y-exagerada.shtml,"Para este mes está programado el estreno de la película The Witches (Las Brujas), producida por Esperanto Filmoj y",02-10-2020 16:36,https://www.bing.com/th?id=OVFT.OwwAp_22rzmsW1XbeAKxdy,Chile,Chile
Jaime Mañalich y su defensa ante comisión... | Puranoticia,https://www.puranoticia.cl/noticias/nacional/jaime-manalich-y-su-defensa-ante-comision-investigadora-nunca/2020-10-02/133346.html,"El exsecretario de Estado reconoció errores y problemas que obligaron a ir modificando y corrigiendo criterios, especialmente en materia de conteo de casos y fallecidos.",02-10-2020 16:42,https://www.bing.com/th?id=OVFT.Z9f7D-J9MhC2qocVKqNJ_y,Chile,Puranoticia.cl
Zoom presidencial: Jadue arrasa con Beatriz Sánchez en la ...,https://www.latercera.com/la-tercera-pm/noticia/zoom-presidencial-jadue-arrasa-con-beatriz-sanchez-en-la-izquierda-y-lavin-gana-en-el-centro-pero-enfrenta-competencia-en-la-derecha/VVC5YHFM6ZBVTA5JJPID5XSNII/,"¿Cómo se comportan las preferencias según identificación política para la elección venidera? La Tercera PM accedió al cruce de la base de datos de la encuesta Criteria, que muestra los escenarios por",02-10-2020 16:50,https://www.bing.com/th?id=OVFT.wicnhPd9BdO3EGLMeWmJGS,Chile,LA TERCERA
Washington Post asegura que Donald Trump minimizó en 136 ...,https://www.publimetro.cl/cl/noticias/2020/10/02/trumpo-covid-washington-post-minimizo-virus.html,Washington Post asegura que Donald Trump minimizó en 136 ocasiones la amenaza del covid-19 El diario estadounidense recopiló más de cien citas y declaraciones del mandatario en donde incluso sugería que el virus desaparecería repentinamente.,02-10-2020 16:56,https://www.bing.com/th?id=OVFT.KLN4HulH8ctS_ZpEyFlDny,Chile,publimetro.cl
"Luego de 12 días, Chile vuelve a superar la barrera de los ...",https://www.emol.com/noticias/Nacional/2020/10/02/999612/Barrera-casos-activos-14-mil.html,"Luego de 12 días, Chile vuelve a superar la barrera de los 14 mil casos activos a nivel nacional El último reporte da cuenta además de un total de 12.867 personas fallecidas producto de la pandemia del covid-19.",02-10-2020 16:57,https://www.bing.com/th?id=OVFT.afosNy99Lxe7o1Qge9YsTS,Chile,Emol
Mañalich en comisión investigadora: “Nosotros nunca ...,http://www.lanacion.cl/manalich-en-comision-investigadora-nosotros-nunca-ocultamos-ningun-numero/,"El exministro de Salud expuso ante la comisión investigadora de la Cámara de Diputados y reconoció errores y problemas que obligaron a ir modificando y corrigiendo criterios, especialmente en materia",02-10-2020 17:04,https://www.bing.com/th?id=OVFT.uBgBgDZ5tIH3tyxZ4gaYpS,Chile,La Nación
Covid-19 en Chile: 45 personas murieron en las últimas 24 ...,https://www.adnradio.cl/nacional/2020/10/02/covid-19-en-chile-45-personas-murieron-en-las-ultimas-24-horas-segun-el-deis-3.html,"El Ministerio de Salud informó este viernes que 45 personas murieron producto del Covid-19, en las últimas 24 horas, según el Departamento de Estadísticas e Información de Salud (DEIS). De acuerdo con",02-10-2020 17:34,https://www.bing.com/th?id=OVFT.A7OigDORf74F_jPyEVa6AS,Chile,ADN
Estado de la Hacienda Pública: recuperación económica uno ...,https://www.diarioconcepcion.cl/economia/2020/10/02/estado-de-la-hacienda-publica-recuperacion-economica-uno-de-los-principales-ejes-que-acompanan-a-la-ley-de-presupuesto-2021.html,"Tras el ingreso del texto del proyecto este 29 de septiembre el ministro de Hacienda dio a conocer los principales lineamientos proyectando una caída un poco más moderada del PIB de -5,5% para este año y de -5% para 2021. En lo práctico, la Comisión Mixta de Presupuesto podría sesionar presencialmente en el ex Congreso.",02-10-2020 17:48,https://www.bing.com/th?id=OVFT.uasKIrquVG4sicSNiDYjUC,Chile,El Diario de Concepcion
"Holan: ""Venimos de un trajín importante que no podemos ...",https://www.prensafutbol.cl/369792-holan-venimos-de-un-trajin-importante-que-podemos-sacar-de-contexto/,Ariel Holan habló en conferencia de prensa para referirse al clásico universitario que se jugará el domingo 04 de octubre en San Carlos de Apoquindo.,02-10-2020 18:09,https://www.bing.com/th?id=OVFT.3qbfWzKiYgvV2ne0jRwNei,Chile,Prensafútbol
Chile suma 45 nuevas muertes y registra 14.116 casos ...,https://www.diarioconcepcion.cl/pais/2020/10/02/chile-suma-45-nuevas-muertes-y-registra-14-116-casos-activos-covid-19.html,"Un nuevo balance entregado este viernes por el Ministerio de Salud informó que Chile registró 45 nuevos decesos inscritos y 1.839 casos positivos de covid-19, durante las últimas 24 horas. Del total de nuevos contagios, 1.208 fueron sintomáticos, 585 asintomáticos y 46 sin notificar, detallaron",02-10-2020 18:12,https://www.bing.com/th?id=OVFT.7dMwHEEO3MkrWanUscb5vC,Chile,El Diario de Concepcion
Variante rara en el mundo habría en COVID-19 de Magallanes ...,https://www.t13.cl/noticia/nacional/investigador-segunda-ola-region-magallanes-cepa-rara-mundo-02-10-2020,La preocupación por el alza de contagios de COVID-19 en la región de Magallanes se mantiene por parte del Gobierno de Chile y también por los especialistas. La Universidad de Magallanes precisamente está llevando adelante un estudio sobre esta “segunda ola” que llegó a Punta Arenas y que,02-10-2020 18:57,https://www.bing.com/th?id=OVFT.Q6QccykqdGRz-gcE9Kpt-S,Chile,T13
