name,url,description,datePublished,imagen,pais,Fuente
Llega a Chile nuevo cargamento con casi dos millones de ...,https://www.meganoticias.cl/nacional/325855-vacunas-sinovac-chile-plan-de-vacunacion-coronavirus-rex10.html,"Esta jornada aterrizó en nuestro país un nuevo cargamento con casi dos millones de dosis de la vacuna Sinovac, para comenzar con el plan de inoculación que tiene previsto el Gobierno.",31-01-2021 21:05,https://www.bing.com/th?id=OVFT.sgeJ0_ikaVJYrpPeRo1aPC,Chile,meganoticias
Alcalde afirma que Chile Chico debe avanzar pero el sesgo ...,https://www.rln.cl/regional/83174-alcalde-afirma-que-chile-chico-debe-avanzar-pero-el-sesgo-politico-del-gobierno-lo-impide,"Cada día son menos los casos positivos de Covid – 19 en Chile Chico, pero sin embargo, la también conocida “ciudad del sol”, se mantiene en la fase 2 del plan paso a paso creado por el Gobierno. Esto",31-01-2021 21:29,https://www.bing.com/th?id=OVFT.B_N2NQixta1u_cuyRK2Lry,Chile,Radio las Nieves
Llegó segundo cargamento con casi dos millones de vacunas ...,https://www.radioagricultura.cl/nacional/2021/01/31/llego-segundo-cargamento-con-casi-dos-millones-de-vacunas-sinovac-contra-el-covid-19.html,"La tarde de este domingo aterrizó en Chile el segundo cargamento con 1,9 millones dosis de la vacuna CoronaVac del laboratorio Sinovac,",31-01-2021 21:33,https://www.bing.com/th?id=OVFT.eHiGWphlAo3KyYezJAvzJi,Chile,Radio Agricultura
"Llegan 1,9 millones de vacunas contra el COVID-19 a días ...",https://www.eldesconcierto.cl/nacional/2021/01/31/llegan-19-millones-de-vacunas-contra-el-covid-19-a-dias-del-inicio-de-la-inoculacion-masiva.html,"Los municipios trabajan para organizar el programa de vacunación masiva que parte el miércoles 3 de febrero, y comenzará en primera instancia a las personas mayores de 90 años.",31-01-2021 22:36,https://www.bing.com/th?id=OVFT.spSYq6lCjOovmeZzJy9PFy,Chile,eldesconcierto
"Recoleta comenzará a entregar Avifavir, el medicamento ...",https://www.publimetro.cl/cl/noticias/2021/01/31/avifavir-recoleta-covid-19.html,"El alcalde Daniel Jadue celebró el arribo del Avifavir, asegurando que el medicamento los ayudará a ""salvar muchas vidas"".",31-01-2021 22:59,https://www.bing.com/th?id=OVFT.s_Yk0L0QGIuH-Iw7cEsWLi,Chile,publimetro.cl
El Ciudadano | Incendio dejó una pérdida de 500 camas ...,https://www.elciudadano.com/chile/incendio-dejo-una-perdida-de-500-camas-atencion-de-urgencias-del-hospital-san-borja-estara-suspendido-por-una-semana/01/31/,"La atención de urgencias en el Hospital San Borja estará suspendido por una semana, tras el incendio que se registró este sábado en las instalaciones del centro de salud",31-01-2021 23:47,https://www.bing.com/th?id=OVFT.HsXyw4K6F6mlkGt4q_vhBi,Chile,El Ciudadano
Llega a Chile segundo cargamento de Sinovac con casi 2 ...,https://www.elperiodista.cl/2021/01/llega-a-chile-segundo-cargamento-de-sinovac-con-casi-2-millones-de-vacunas/,"Esta tarde llegó hasta el Aeropuerto Arturo Merino Benítez el segundo cargamento de las vacunas Coronavac, del Laboratorio Sinovac con 1.917.663 dosis, las cuales se suman a las recibidas el jueves re",01-02-2021 01:04,https://www.bing.com/th?id=OVFT.CLH5ZOQWrscqr-dGQEtKAC,Chile,El Periodista
Aysén y Chile Chico reclaman al Gobierno para que sus ...,http://web.elpatagondomingo.cl/2021/01/31/aysen-y-chile-chico-reclaman-al-gobierno-para-que-sus-comunas-avancen-en-el-plan-paso-a-paso/,"Cada día son menos los casos positivos de Covid–19 en Chile Chico y en Aysén, sin embargo, la primera comuna se mantiene en fase 2 de Transición y la segunda en Cuarentena, del Plan Paso a Paso creado",01-02-2021 01:50,https://www.bing.com/th?id=OVFT.cL0xdFp4VZc8gg-V_uZaZy,Chile,EPD Noticias
Vacunación en Puyehue: comenzará inoculando a mayores de ...,https://elinsular.cl/noticias/los-lagos/2021/02/01/vacunacion-en-puyehue-comenzara-inoculando-a-mayores-de-70-anos/,"Dentro de los próximos días llegarán a Chile, nuevas dosis de la vacuna Sinovac, contra el Covid-19. Por este motivo, el Cesfam Entre Lagos, de la comuna de Puyehue, comenzará con el proceso de vacuna",01-02-2021 04:15,https://www.bing.com/th?id=OVFT.TKGCScla4GvHGJ7WUwlfjy,Chile,El Insular
Gobierno se reunió con Alcaldes de todo Chile para ...,https://www.chanarcillo.cl/gobierno-se-reunio-con-alcaldes-de-todo-chile-para-coordinar-distribucion-de-vacunas-y-proceso-de-inoculacion-contra-el-covid-19/,*Todos los alcaldes del país fueron citados por los ministros de Salud e Interior para entregarles información y responder sus,01-02-2021 07:00,https://www.bing.com/th?id=OVFT.ENeJlkORgZaqjekobxEyGC,Chile,Diario Chanarcillo
113 fallecidos y 4.209 nuevos contagios por COVID-19 ...,https://www.chanarcillo.cl/113-fallecidos-y-4-209-nuevos-contagios-por-covid-19-registro-ayer-el-pais/,"*Chile baja 4% los casos en una semana, aunque mantiene ocupación de camas críticas sobre 90% Según el reporte nacional",01-02-2021 08:00,https://www.bing.com/th?id=OVFT.YmjiM2RCqKz0eZS1wxquAi,Chile,Diario Chanarcillo
Con habilitación de puntos de inmunización y operativos a ...,https://www.latercera.com/nacional/noticia/con-habilitacion-de-puntos-de-inmunizacion-y-operativos-a-domicilio-los-municipios-preparan-la-masiva-vacunacion-contra-el-covid-19/KBIGVQDQU5EY7AQGK5KGZLDBO4/,"A dos días de que se inicie la inoculación en adultos mayores, los alcaldes ya alistan en varias comunas puntos de vacunación distintos a los Cesfam, para así evitar posibles aglomeraciones. En todo c",01-02-2021 12:41,https://www.bing.com/th?id=OVFT.xP768i4tKuCn7N1XFIVrci,Chile,LA TERCERA
"Ad portas de inoculación masiva, llega segundo cargamento ...",https://laprensaaustral.cl/2021/02/01/ad-portas-de-inoculacion-masiva-llega-segundo-cargamento-con-mas-de-1-9-millones-de-vacunas/,"El cargamento llega a tres días de que el Presidente Piñera recibiera las primeras dosis, que permitirán vacunar durante el mes de febrero a “cerca de 4 millones de personas”",01-02-2021 13:05,https://www.bing.com/th?id=OVFT.WluQahX1LqZUInn1O2HhTC,Chile,La Prensa Austral
Pulso Ciudadano: aprobación del Presidente Piñera cayó a ...,http://www.lanacion.cl/pulso-ciudadano-aprobacion-del-presidente-pinera-cayo-a-un-124/,"En cuanto a las próximas elecciones presidenciales, al preguntar de forma espontánea a los encuestados ¿quién preferirías que sea el próximo Presidente?, Pamela Jiles lidera las preferencias con un (1",01-02-2021 13:37,https://www.bing.com/th?id=OVFT.ftI6W9Swgz_oScjPLquehS,Chile,La Nación
Proceso de vacunación: ¿Quiénes no podrán recibir las ...,https://www.meganoticias.cl/nacional/325914-vacuna-quienes-no-reciben-no-pueden-cgx02.html,"El proceso de vacunación masiva contra el COVID-19 comienza este miércoles, el cual prioriza a los adultos mayores y personal de salud, sin embargo, hay grupos que no podrán ser incoculados por ahora.",01-02-2021 14:17,https://www.bing.com/th?id=OVFT.tiis12svW8-3xbcunJYkiS,Chile,meganoticias
"El misil de Izkia Siches: ""Me llama mucho la atención que ...",https://www.theclinic.cl/2021/02/01/el-misil-de-izkia-siches-me-llama-mucho-la-atencion-que-como-pais-tengamos-abiertos-los-malls-y-no-podamos-abrir-un-colegio/,"La presidenta del Colegio Médico (Colmed), Izkia Siches, se refirió este domingo al proceso de vacunación masiva que comenzará el próximo miércoles e hizo un balance del manejo que ha tenido el Gobier",01-02-2021 15:02,https://www.bing.com/th?id=OVFT.74JYHoKsEUYWFaSpJDvHXS,Chile,Clinic
"Pulso Ciudadano: 51,4% no confía en vacuna Sinovac | Tele 13",https://www.t13.cl/noticia/nacional/pulso-ciudadano-covid-19-no-confia-vacuna-china-sinovac-01-02-2021,"Además, el 46,6% de los consultados tiene poca o nada de confianza en que se pueda cumplir con el Plan de Vacunación COVID-19 del Gobierno.",01-02-2021 15:13,https://www.bing.com/th?id=OVFT.03jsWioYk_jRMi-DaFB3qy,Chile,T13
Economía chilena sufre en 2020 la mayor caída en cuatro ...,https://www.emol.com/noticias/Economia/2021/02/01/1010959/PIB-Chile-desde-1980.html,"El Banco Central informó esta mañana que el Imacec de diciembre cayó 0,4%. Con ello, el PIB del año pasado anotó un descenso preliminar de 6%, el peor registro desde 1982.",01-02-2021 15:17,https://www.bing.com/th?id=OVFT.YHeKLSmnfFkaW326Z2ncLy,Chile,Emol
"Así es Sophia, la robot que será producida en masa para ...",https://www.biobiochile.cl/noticias/ciencia-y-tecnologia/adelantos/2021/02/01/asi-es-sophia-la-robot-que-sera-producida-en-masa-para-luchar-contra-la-covid-19.shtml,La compañía hongkonesa Hanson Robotics anunció su plan de crear miles de robots durante 2021. Pero no se trata,01-02-2021 16:28,https://www.bing.com/th?id=OVFT.zIu_niuqttUnaadZPb8uhy,Chile,Chile
Minsal reporta 85 fallecidos y 3.779 casos: Se realizaron ...,https://www.emol.com/noticias/Nacional/2021/02/01/1010978/Minsal-Balance-Coronavirus.html,"De acuerdo con el informe entregado por las autoridades de la cartera, la cifra de contagios descendió de cuatro mil por primera vez en cuatro días.",01-02-2021 16:40,https://www.bing.com/th?id=OVFT.MM03Rjq26LTywsW9L0hunC,Chile,Emol
Choque de opiniones sobre el manejo de la pandemia de ...,https://www.publimetro.cl/cl/noticias/2021/02/01/choque-opiniones-manejo-pandemia-coronavirus-chile.html,Un estudio de un centro de estudios australiano y un reporte de una agencia estadounidense calificaron de muy distinta forma al país.,01-02-2021 16:43,https://www.bing.com/th?id=OVFT.pPuHYSj5QtNchQUq78u2Sy,Chile,publimetro.cl
Chile reporta 3.779 nuevos contagios de COVID-19 este ...,https://www.t13.cl/noticia/nacional/chile-3.779-nuevos-contagios-covid-19-85-muertos-lunes-01-02-2021,"La cifra total de contagios por COVID-19 en Chile es de 730.888, de los cuales 25.589 figuran como casos activos.",01-02-2021 16:45,https://www.bing.com/th?id=OVFT.8NcFL3GneOpTnTc3E0e4eC,Chile,T13
Covid-19 en Chile: Contagios bajan de los 4 mil diarios y ...,https://www.elmostrador.cl/dia/2021/02/01/covid-19-en-chile-contagios-bajan-de-los-4-mil-diarios-y-8-comunas-del-pais-retroceden-a-cuarentena/,"El Ministerio de Salud informó este lunes que en las últimas 24 horas se registraron 3.779 casos nuevos y 85 fallecidos por Covid-19 en el país. Del total de nuevos contagios, 2.278 casos presentan sí",01-02-2021 17:21,https://www.bing.com/th?id=OVFT.E-mUsPy6tygnPTDMUTPpNy,Chile,El Mostrador
Minsal confirma 3.779 nuevos contagios y 85 muertes por ...,http://www.ladiscusion.cl/minsal-confirma-3-779-nuevos-contagios-y-85-muertes-por-covid/,"En las últimas horas fueron diagnosticados 3.779 casos nuevos por Covid-19, así lo informó el Ministerio de Salud (Minsal) en el balance de esta jornada sobre la situación de la pandemia en el",01-02-2021 17:24,https://www.bing.com/th?id=OVFT.02DAT7hOTjQxVpA9XoujxS,Chile,La Discusión
Opinión de John Müller: ''La falacia del 'capitalismo del ...,https://www.pauta.cl/opinion-de-john-muller/opinion-john-muller-sociedad-del-riesgo-ulrich-beck-desastres-chile,John Müller recuerda la teoría de la sociedad del riesgo de Ulrich Beck para comparar la gestión privada ante desastres. ''Los nuevos riesgos globales son terreno propicio para esta guerrilla ideológi,01-02-2021 17:30,https://www.bing.com/th?id=OVFT.L2nfZdM19RqQWRTT2jiE7C,Chile,pauta
Estudio evidencia que crecimiento profesional de las ...,https://www.elmostrador.cl/braga/2021/02/01/estudio-evidencia-que-crecimiento-profesional-de-las-mujeres-en-tecnologia-se-ha-frenado-con-la-pandemia/,"El 62% de las mujeres que trabaja en el área de la tecnología e innovación cree que los efectos de la pandemia han retrasado, en lugar de mejorar, su evolución profesional general. Si bien este mundo",01-02-2021 18:08,https://www.bing.com/th?id=OVFT.MhUwDYOQeCHLUBncnF2Sqy,Chile,El Mostrador
Covid-19: 30 mil vacunas Sinovac fueron embarcadas este ...,http://www.lanacion.cl/covid-19-30-mil-vacunas-sinovac-fueron-embarcadas-este-lunes-a-punta-arenas-y-balmaceda/,"Serán trasladadas en vuelos comerciales de Latam y Sky Airline, respectivamente. La encargada de Logística Aeroportuaria del MTT, Zaida Muñoz, explicó que ""hoy finalizamos la distribución del primer c",01-02-2021 18:30,https://www.bing.com/th?id=OVFT.I5rZI5hZeBBqFAQUuSxS6S,Chile,La Nación
Las recomendaciones que recogió la CUT para mejorar la ...,https://www.df.cl/noticias/economia-y-politica/laboral-personas/las-recomendaciones-que-recogio-la-cut-para-mejorar-la-implementacion/2021-02-01/143503.html,"De acuerdo a una investigación de la Central junto a Fetracall y la Organización Internacional del Trabajo (OIT), el trabajo a distancia se ha transformado en una carga para los trabajadores.",01-02-2021 18:43,https://www.bing.com/th?id=OVFT.sOrpYMM7XMTPIp5h97-tNC,Chile,df.cl
Reportan 3.379 casos nuevos y 85 muertos por covid ...,https://www.biobiochile.cl/noticias/nacional/chile/2021/02/01/covid-19-chile-suma-3-379-casos-nuevos-85-muertos-y-mantiene-elevada-ocupacion-de-camas-criticas.shtml,"El Ministerio de Salud reportó este lunes 3.779 casos nuevos de covid-19, 2.278 de ellos con síntomas y 1.334 asintomáticos. La cifra de total alcanza los 730.888 casos, con 25.589 activos y 686.374 r",01-02-2021 18:54,https://www.bing.com/th?id=OVFT.f0_MsVgMsrYiXMeET-7kzi,Chile,Chile
Paris por medicamento ruso que trajo Recoleta para ...,https://www.latercera.com/nacional/noticia/paris-por-medicamento-ruso-que-trajo-recoleta-para-enfrentar-el-covid-19-no-tiene-un-uso-autorizado-en-nuestro-pais-para-el-coronavirus/SPUTPQOAJBFKXN3A6FPKI7X7WI/,"El ministro de Salud, explicó que ""el ISP en la actualidad dio autorización sanitaria, transitoria, para su uso en estudios clínicos, como también para su uso en pacientes dentro del contexto acotado",01-02-2021 18:56,https://www.bing.com/th?id=OVFT.t-t9upHGlhee_FF_3WzTcC,Chile,LA TERCERA
Plan de vacunación: ¿Quiénes no podrán recibir la ...,https://www.duna.cl/noticias/2021/02/01/plan-de-vacunacion-quienes-no-podran-recibir-la-inyeccion/,"Durante el balance, el ministro de Salud, Enrique Paris, aseveró que “será la oportunidad para vacunarse de forma voluntaria, gratuita y segura”.",01-02-2021 19:00,https://www.bing.com/th?id=OVFT.Bg052x2VzBS6ZhkoGStGjC,Chile,duna
Programa socioeducativo apoyará a 44 niños del SENAME en ...,https://www.granvalparaiso.cl/sociedad/programa-socioeducativo-apoyara-a-44-ninos-del-sename-en-la-region-de-valparaiso/,"La iniciativa, que se extenderá por 18 semanas se inició el 11 de enero, tiene por objetivo dar acompañamiento en el ámbito social y educativo a niñ@s entre 2 y 5 años que se encuentran en Familias de",01-02-2021 19:29,https://www.bing.com/th?id=OVFT.jy1B176O76eukkq8BK4a0i,Chile,granvalparaiso.cl
Asalto en Providencia con víctima fatal: Hombre de 51 años ...,https://www.chilevision.cl/contigo-en-directo/mejores-momentos/asalto-en-providencia-con-victima-fatal-hombre-de-51-anos-murio-apunalado,"Un hombre murió tras ser apuñalado por dos antisociales en la intersección de Marchant Pereira con calle Bustos, comuna de Providencia. Los sujetos buscaban robar el celular del hombre de 51 años, qui",01-02-2021 19:46,https://www.bing.com/th?id=OVFT.yr_ekqkXvU-0ufAnom-Umy,Chile,chilevision.cl
Más de 220 funcionarios del hospital de Chillán se suman a ...,http://www.ladiscusion.cl/mas-de-220-funcionarios-del-hospital-de-chillan-se-suman-a-vacunacion/,"Más de 220 funcionarios y funcionarias del Hospital Clínico Herminda Martín se protegerán contra el COVID-19, ahora con la vacuna Coronovac del Laboratorio Sinovac, que comenzará a administrarse",01-02-2021 20:02,https://www.bing.com/th?id=OVFT.c-qC0ov86QulzL5LAW1VNy,Chile,La Discusión
