name,url,description,datePublished,imagen,pais,Fuente
El voto secreto: factor sorpresa que podría estrechar ...,https://www.radiosantiago.cl/archivo/147451,"En 2016, el resultado del plebiscito para refrendar un acuerdo entre el gobierno de Colombia y la guerrilla fue inesperado. Días antes, las encuestas indicaron una ventaja de la opción del",24-10-2020 03:15,https://www.bing.com/th?id=OVFT.X5o1Q7_yvw8sVBRJfJiwlS,Chile,Radio Santiago
MOP construye nuevos caminos para sectores rurales de la ...,http://www.diarioelheraldo.cl/noticia/mop-construye-nuevos-caminos-para-sectores-rurales-de-la-region-del-maule,Importantes comunidades de sectores rurales de la Región del Maule se han visto beneficiadas con la construcción de pavimentos en sus caminos,24-10-2020 03:40,https://www.bing.com/th?id=OVFT.Eq5FO7u7K28RjtTUXAzj5i,Chile,El Heraldo
La lista completa de las multinacionales que se fueron o ...,https://www.radiosantiago.cl/archivo/147486,La lista de empresas multinacionales que dejaron el mercado local o comenzaron a anunciar sus planes de salir de la Argentina sigue aumentando cada semana. Las salidas más resonantes comenzaron,24-10-2020 04:04,https://www.bing.com/th?id=OVFT.a-BQjHzUR_NY-16B_AJsZS,Chile,Radio Santiago
Uso irracional de sanitizantes podría nublar la protección,https://www.diarioconcepcion.cl/ciencia-y-sociedad/2020/10/24/uso-irracional-de-sanitizantes-podria-nublar-la-proteccion.html,"La necesidad de contar productos como alcohol gel para aplicar en las manos y de otros para usarse en la desinfección de espacios o artículos, subió de nivel desde que explotó la crisis sanitaria de la Covid-19. Con justa razón, ya que su empleo puede contribuir a combatir, desde el cuidado y",24-10-2020 04:04,https://www.bing.com/th?id=OVFT.GhQNrQk47Kl3LSWrdRNlFC,Chile,El Diario de Concepcion
"Permisos, horarios y variaciones en el ""rito"" de votar ...",https://www.emol.com/noticias/Nacional/2020/10/24/1001615/Permisos-horarios-documentos-todo-Plebiscito.html,"Permisos, horarios y variaciones en el ""rito"" de votar: Todo lo que hay que saber para el Plebiscito Revise las medidas especiales y los documentos adicionales que se requerirán la jornada del domingo, en el primer Plebiscito que se realiza en el país en medio de una pandemia.",24-10-2020 08:57,https://www.bing.com/th?id=OVFT.6jutsMsKJRsqyhEGwuuN8S,Chile,Emol
"Chile supera los 500 mil contagios por Covid-19, según ...",https://www.elperiodista.cl/chile-supera-los-500-mil-contagios-por-covid-19-segun-ultimo-reporte-del-minsal/,"Este sábado, el Ministerio de Salud emitió un nuevo reporte diario acerca del estado de la pandemia de coronavirus en Chile. Según informó el subsecretario de Redes Asistenciales, Arturo Zúñiga, en la",24-10-2020 09:34,https://www.bing.com/th?id=OVFT.6qYFLAs7Mxrlx2ooA-VdfC,Chile,El Periodista
Balance mundial covid-19: 42 millones de contagios y Perú ...,https://www.biobiochile.cl/noticias/internacional/mundo/2020/10/24/balance-mundial-covid-19-42-millones-de-contagios-y-peru-y-bolivia-en-top-por-tasa-de-mortalidad.shtml,"La pandemia de nuevo coronavirus ha provocado al menos 1.145.847 muertos en el mundo desde que la oficina de la OMS en China dio cuenta de la aparición de la enfermedad en diciembre, según un balance en base a fuentes oficiales. Desde el comienzo de la epidemia más de 42.262.290 personas",24-10-2020 12:37,https://www.bing.com/th?id=OVFT.M7FFIKQMuqeXYkPelgs17i,Chile,Chile
Todo el peso de la ley contra quienes voten con covid-19 ...,https://www.publimetro.cl/cl/noticias/2020/10/24/plebiscito-votar-covid19-sanciones.html,Jefe nacional de la Fiscalía instruyó perseguir penalmente a quienes acudan este domingo a votar aún estando contagiados del covid-19.,24-10-2020 12:39,https://www.bing.com/th?id=OVFT.vjG4UMjDWcQUI2wJ_4Shmy,Chile,publimetro.cl
Ajustes en el mercado de oficinas: la nueva realidad post ...,https://www.elmostrador.cl/generacion-m/2020/10/24/ajustes-en-el-mercado-de-oficinas-la-nueva-realidad-post-covid-19/,"Qué pasó con las oficinas durante las cuarentenas y cuáles serán los efectos de la pandemia en esta industria. Sin dudas, ésas son las grandes preguntas que los inversionistas y el mercado, en general",24-10-2020 12:54,https://www.bing.com/th?id=OVFT.M6bcmB6judbb_ENMBu0THS,Chile,El Mostrador
Pandemia de coronavirus supera los 42 millones de ...,https://www.eldesconcierto.cl/2020/10/24/pandemia-de-coronavirus-supera-los-42-millones-de-contagios-en-el-mundo/,"Revisa aquí las cifras de la pandemia de coronavirus a nivel mundial, entregadas periódicamente por la Universidad Johns Hopkins.",24-10-2020 13:00,https://www.bing.com/th?id=OVFT.GC2y073A7kulNnBEeoiN2S,Chile,eldesconcierto
Covid-19: Ministerio de Salud confirmó 48 nuevos ...,https://www.adnradio.cl/nacional/2020/10/24/covid-19-ministerio-de-salud-confirmo-48-nuevos-fallecidos-y-chile-llego-a-los-13-892-muertos-por-el-virus.html,"Este sábado, el Ministerio de Salud (Minsal) entregó un nuevo reporte de cómo avanza la pandemia del Covid-19 en el país, informando que hubo 1.631 nuevos contagiados por la enfermedad, con lo que Chile alcanzó los 500.542 enfermos por el virus. Además, la autoridad reportó 48 nuevos",24-10-2020 13:15,https://www.bing.com/th?id=OVFT.gII8XwQTewqD5Pb7P6wx6i,Chile,ADN
Reporte de Covid-19 en Chile registra 1.631 casos nuevos ...,https://www.lacuarta.com/cronica/noticia/reporte-de-covid-19-en-chile-registra-1-631-casos-nuevos-48-fallecidos/559122/,"Durante la mañana de este sábado el Ministerio de Salud reportó 1.631 casos nuevos de Covid-19, de los cuales 1.121 corresponden a personas sintomáticas.",24-10-2020 13:19,https://www.bing.com/th?id=OVFT.nDulyz5GZF_QC-dLMkGJiy,Chile,La Cuarta
"Minsal informó 1.631 nuevos casos, llegando a 500.542 ...",https://www.adnradio.cl/nacional/2020/10/24/minsal-informo-1-631-nuevos-casos-llegando-a-500-542-casos-totales-de-contagiados-con-covid-19-en-chile.html,"Durante la mañana de este sábado el ministerio de Salud entregó un nuevo balance del estado de la pandemia del coronavirus Covid-19 en Chile, informando 1.631 nuevos casos, llegando a un total de 500.",24-10-2020 13:22,https://www.bing.com/th?id=OVFT.de112OrIt3y7pROPsYJJ5y,Chile,ADN
Reporte del Minsal: Se superan las 500.00 personas ...,https://www.meganoticias.cl/nacional/317138-informe-diario-covid-19-reporte-minsal-sabado-24-de-octubre-jdx14.html,"Revisa detalles sobre las cifras de personas contagiadas y fallecidas por la pandemia de coronavirus en Chile, según el más reciente balance del Ministerio de Salud.",24-10-2020 13:23,https://www.bing.com/th?id=OVFT.u9j8EJ75mtjFN2tLz8FcSi,Chile,meganoticias
Minsal reporta 1.631 nuevos casos de coronavirus y 48 ...,https://www.biobiochile.cl/noticias/nacional/chile/2020/10/24/minsal-reporta-1-631-nuevos-casos-de-coronavirus-y-48-fallecidos-en-las-ultimas-24-horas.shtml,Este sábado el Ministerio de Salud (Minsal) entregó un nuevo reporte con respecto a la propagación de la pandemia,24-10-2020 13:25,https://www.bing.com/th?id=OVFT.ppJE_olQdD60R_jthRk-9S,Chile,Chile
Covid-19: Chile alcanzó los 500 mil casos y muertes ...,https://www.radioagricultura.cl/nacional/2020/10/24/covid-19-chile-alcanzo-los-500-mil-casos-y-muertes-ascienden-a-13-892.html,"Covid-19: Chile alcanzó los 500 mil casos y muertes ascienden a 13.892. Por Francisca Plaza | Crédito: Agricultura Este sábado, el Ministerio de Salud informó 1.631 casos nuevos de Covid-19 en el país, de los cuales 1.121 corresponde a personas sintomáticas y 491 a asintomáticas. Además, se ...",24-10-2020 13:28,https://www.bing.com/th?id=OVFT.-GjUqA-Md9Tcs2D1u9fGZy,Chile,Radio Agricultura
Chile supera los 500 mil casos de Covid-19 diagnosticados ...,https://www.latercera.com/que-pasa/noticia/chile-supera-los-500-mil-casos-de-covid-19-diagnosticados-desde-el-inicio-de-la-pandemia-y-contagios-activos-bajan-de-los-10-mil/WZNJKUDIYRBXLJSMRU3MU4SDGI/,"El Ministerio de Salud informó 1.631 nuevos contagios, lo que representa una baja con respecto al balance anterior (1.773). Por otra parte, el DEIS confirmó 48 nuevos fallecimientos por el coronavirus",24-10-2020 13:30,https://www.bing.com/th?id=OVFT.qqK_1ONsmbH9jjANm-YFQi,Chile,LA TERCERA
SanCarlosOnline: Los permisos que debe portar si va a ...,https://www.sancarlosonline.cl/2020/10/los-permisos-que-debe-portar-si-va.html,"La titular de Salud en Ñuble recordó que las personas que viajarán a otras regiones deben exhibir de forma física o electrónica el resultado de la Consulta de Datos Electorales, donde conste el local",24-10-2020 13:46,https://www.bing.com/th?id=OVFT.X31uftxTLU2FZNR1vopHUC,Chile,San Carlos Online
Gobierno aclara: Fiscalizaciones aleatorias se realizarán ...,https://www.24horas.cl/coronavirus/gobierno-aclara-fiscalizaciones-aleatorias-se-realizaran-fuera-de-los-recintos-de-votacion-4503208,"El subsecretario de Redes Asistenciales, Arturo Zúñiga, explicó que todos los controles se harán fuera de los recintos, por lo que los contagiados o contactos estrechos no podrán ingresar a emitir el",24-10-2020 13:52,https://www.bing.com/th?id=OVFT.Kgq0Wd3RRxWmAY9AdwbRHi,Chile,24 Horas Chile
Chile supera los 500 mil contagios desde el inicio de la ...,http://www.ladiscusion.cl/chile-supera-los-500-mil-contagios-desde-el-inicio-de-la-pandemia-por-covid-19/,"En el reporte diario entregado este sábado por las autoridades del Ministerio de Salud (Minsal), sobre la situación de la pandemia por Covid-19, informaron que en las últimas horas en el país se",24-10-2020 13:54,https://www.bing.com/th?id=OVFT.pdw5sWAWmhAHfWsw4GtNOy,Chile,La Discusión
Nuevo balance Minsal coronavirus en Chile 24 de octubre ...,https://www.t13.cl/noticia/nacional/nuevo-balance-coronavirus-chile-covid-19-contagios-24-10-2020,"Actualmente, 9.990 son casos activos y 476.576 figuran como recuperados. Eso mientras que se registraron 48 muertes por COVID-19 en las últimas 24 horas.",24-10-2020 13:55,https://www.bing.com/th?id=OVFT.7MVlsGU3FfQVpSYy9jCgwC,Chile,T13
Chile supera el medio millón de contagiados: Minsal ...,http://www.lanacion.cl/chile-supera-el-medio-millon-de-contagiados-minsal-reporto-1-631-nuevos-casos-y-48-fallecidos/,"El Ministerio de Salud informó que Chile superó los 500 mil contagios por Covid-19 desde que comenzó la pandemia en nuestro país, en marzo pasado. De esta manera, a nivel nacional se alcanzó la cifra de 500.542 casos totales, mientras que en las últimas 24 horas, se registraron 1.631",24-10-2020 13:56,https://www.bing.com/th?id=OVFT.qWyME7D4wbfCiw-rbgmq-C,Chile,La Nación
Chile alcanza los 500 mil casos positivos de coronavirus,https://www.cnnchile.com/coronavirus/chile-alcanza-500-mil-casos-positivos_20201024/,"De acuerdo con el reporte del Minsal, el número total de fallecidos inscritos asciende a 13.892 y los contagiados activos son 9.990.",24-10-2020 14:00,https://www.bing.com/th?id=OVFT.piCgqimIzrDq3jAjltJHdy,Chile,CNN Chile
COVID-19: Chile supera el medio millón de contagios,https://www.chvnoticias.cl/coronavirus/chile-supera-medio-millon-contagios_20201024/,"De acuerdo con el reporte del Minsal, el número total de fallecidos inscritos asciende a 13.892 y los contagiados activos son 9.990.",24-10-2020 14:00,https://www.bing.com/th?id=OVFT.00ndCmIihXaoEZYGuJRiTy,Chile,chvnoticias
Chile alcanzó los 500 mil casos y muertes ascienden a 13 ...,https://www.latribuna.cl/destacados/2020/10/24/chile-alcanzo-los-500-mil-casos-y-muertes-ascienden-a-13-892.html,"En unidades de cuidados intensivos permanecen internadas 729 personas, de las cuales 85 están en estado crítico de salud.",24-10-2020 14:05,https://www.bing.com/th?id=OVFT.wrqOx6ftupsLlIos-mstXy,Chile,La Tribuna
Chile supera los 500 mil casos de COVID-19,https://www.eldesconcierto.cl/2020/10/24/reporte-minsal-chile-supera-los-500-mil-casos-de-covid-19/,"De acuerdo a las cifras entregadas este sábado por el Minsal, 500.542 personas han sido diagnosticadas con COVID-19 en el país.",24-10-2020 14:36,https://www.bing.com/th?id=OVFT.F4bTZ6yveRLA9681OmBtsy,Chile,eldesconcierto
Chile registra 1.631 nuevos casos de Covid-19 a un día del ...,https://www.theclinic.cl/2020/10/24/chile-registra-1-631-nuevos-casos-de-covid-19-a-un-dia-del-plebiscito/,"En el balance diario de este sábado 24 de octubre, el Ministerio de Salud informó que en las últimas 24 horas se detectaron 1.631 pacientes que dieron positivos por Covid-19, alcanzando un total de 50",24-10-2020 14:44,https://www.bing.com/th?id=OVFT.q9_URsriMkHeXDcP-x-DdC,Chile,Clinic
Ministro Víctor Pérez y el Plebiscito: “Esperamos que las ...,https://www.latercera.com/politica/noticia/ministro-victor-perez-y-el-plebiscito-esperamos-que-las-personas-que-tengan-covid-19-se-queden-en-sus-casas/NZ2JL4CWWVG4DFNCT7QTKXEFXE/,"Además, el titular de Interior hizo un llamado a mantener el orden público, en pos de asegurar la participación ciudadana. ""Si alguien quiere alterar el orden público es para impedir que los chilenos",24-10-2020 14:49,https://www.bing.com/th?id=OVFT.Dzd90RWx7aZRAsSfs0g1hi,Chile,LA TERCERA
Balance Covid-19: Chile supera el medio millón de ...,https://www.elmostrador.cl/noticias/pais/2020/10/24/balance-covid-19-chile-supera-el-medio-millon-de-contagios-y-fallecidos-se-acercan-a-los-14-mil/,"El Ministerio de Salud reportó este sábado que, en las últimas 24 horas, hubo 48 decesos y 1.631 nuevos contagios. Con esto, la cifra de víctimas fatales ascendió a 13.892, mientras que los casos cont",24-10-2020 14:49,https://www.bing.com/th?id=OVFT.Vc6Hdmk-wLe06g-WpaXlFy,Chile,El Mostrador
Plebiscito: Minsal informa que habrá controles sanitarios ...,https://www.meganoticias.cl/nacional/317141-plebiscito-2020-minsal-controles-sanitarios-locales-de-votacion-contagiados-coronavirus-jdx14.html,"Conoce las declaraciones del subsecretario de Redes Asistenciales, Arturo Zúñiga, quien se refirió a los protocolos que se implementarán para evitar que personas contagiadas de coronavirus vayan a vot",24-10-2020 15:32,https://www.bing.com/th?id=OVFT.ldz1QIki92-j2AGeJv_dvi,Chile,meganoticias
Minsal llamó a respetar medidas de protección personal ...,https://www.radioagricultura.cl/nacional/2020/10/24/minsal-llamo-a-respetar-medidas-de-proteccion-personal-para-el-plebiscito-nacional-2020.html,"De cara al Plebiscito Nacional 2020, los subsecretarios de Salud Pública, Paula Daza y de Redes Asistenciales, Arturo Zúñiga, entregaron una nueva actualización de la situación de la pandemia por Covid-19 en Chile. “El día de mañana vamos a tener un acto que es trascendental para el futuro",24-10-2020 15:38,https://www.bing.com/th?id=OVFT.NAt2F3tXOYZuWAQLju7Mdi,Chile,Radio Agricultura
Caída de casos activos de covid-19 en Chile: Minsal ...,https://www.publimetro.cl/cl/noticias/2020/10/24/caida-casos-activos-covid-minsal.html,"Subsecretaria de Salud explicó por qué este sábado se reportaron menos de diez mil casos activos, como no ocurría desde mayo.",24-10-2020 16:11,https://www.bing.com/th?id=OVFT.q1wUPpFPxZHP_nXR6wASRC,Chile,publimetro.cl
Habrá controles aleatorios en locales de votación para ...,https://www.cnnchile.com/plebiscito2020/controles-aleatorios-locales-votacion-covid-19_20201024/,"A menos de un día de la realización del plebiscito, Fiscalía informó que perseguirá penalmente a los contagiados de COVID-19 que asistan a los locales a votar. Esto por disposición de la norma sanitaria en el artículo 318 del Código Penal. Por su parte, en el último balance de coronavirus",24-10-2020 16:22,https://www.bing.com/th?id=OVFT.PNtW13v-UE_d53gktn3liy,Chile,CNN Chile
Plebiscito y COVID-19: Se realizarán controles aleatorios ...,https://www.chvnoticias.cl/plebiscito2020/controles-aleatorios-locales-votacion-covid-19_20201024/,Esto se suma a la disposición del Ministerio Público de perseguir penalmente a aquellas personas COVID-19 positivo que asistan a los locales de votación para ejercer su derecho a sufragio. COVID-19: Chile supera el medio millón de contagios y registra menos de 10 mil casos activos 09:12 A menos,24-10-2020 16:22,https://www.bing.com/th?id=OVFT.xD37wjhFEwhiQ4oj3KFYPC,Chile,chvnoticias
INSPECCIONAN LOCAL DE VOTACIÓN DE PUERTO WILLIAMS PREVIO ...,http://radiopolar.com/noticia_160862.html,"El gobernador de la Provincia Antártica Chilena, Nelson Cárcamo, acompañado por autoridades y personal de Fuerzas Armadas, de Orden y Seguridad, recorrió el Liceo Donald Mc Intyre Griffiths.",24-10-2020 16:31,https://www.bing.com/th?id=OVFT.lfkAK959iCd0s3lplHE5mi,Chile,Radio Polar
Argentina abrirá sus fronteras aéreas desde el 2 de ...,https://www.t13.cl/noticia/nacional/atencion-turistas-chilenos-argentina-abrira-sus-fronteras-aereas-2-noviembre,"La apertura de las fronteras será solo para los países limítrofes como Brasil, Paraguay, Uruguay, Bolivia y Chile.",24-10-2020 16:36,https://www.bing.com/th?id=OVFT.pTdi6Pj1wA7A87qF5rwPMC,Chile,T13
Contagios de COVID-19 en Chile superan los 500 mil ...,https://www.redaysen.com/nacional/chile-supera-los-500-mil-casos-de-coronavirus,"En total los contagios acumulan 500.542 personas en nuestro país desde la llegada de la pandemia. Durante la mañana de este sábado el Ministerio de Salud reportó 1.631 casos nuevos de Covid-19, de los",24-10-2020 16:43,https://www.bing.com/th?id=OVFT.mdamO7FZwa_u59519_oABC,Chile,Red Aysen
