name,url,description,datePublished,imagen,pais,Fuente
COVID-19 en Chile: 83 fallecidos y 3.333 nuevos casos en ...,https://www.chanarcillo.cl/covid-19-en-chile-83-fallecidos-y-3-333-nuevos-casos-en-la-ultima-jornada-mientras-campana-bordea-los-2-millones-de-vacunados/,"El Ministerio de Salud entregó este lunes un nuevo reporte sobre la situación de la pandemia de COVID-19 en Chile, destacando",16-02-2021 07:00,https://www.bing.com/th?id=OVFT.bNiIpZMHWcg1xZV9JVaXJS,Chile,Diario Chanarcillo
ADULTOS MAYORES AÚN REACIOS A LA VACUNA – El Gong – Chile,https://www.elgong.cl/esp/2021/02/16/adultos-mayores-aun-reacios-a-la-vacuna/,"Con un especial llamado a la población de adultos mayores, continúa proceso de vacunación contra COVID – 19 en Araucanía Sur. A pesar de que han sido los primeros priorizado",16-02-2021 07:33,https://www.bing.com/th?id=OVFT.pNh_F_QtWP2x0fHB4dOGsS,Chile,El Gong
Minsal precisa que Chile ya lleva 2.092.453 vacunados ...,https://elpinguino.com/noticia/2021/02/16/minsal-precisa-que-chile-ya-lleva-2092453-vacunados-contra-covid-19-,"La tarde del lunes, el presidente Sebastián Piñera anunció que Chile ya había superado los 2 millones de vacunados contra la covid-19. Durante la noche de este martes, el Ministerio de Salud precisó q",16-02-2021 10:49,https://www.bing.com/th?id=OVFT.7Jsb799026TYLoxFg3kTJS,Chile,ELPINGUINO
“El Gobierno y municipios no están sacando provecho ...,https://new.diariolaprensa.cl/index.php/2021/02/16/el-gobierno-y-municipios-no-estan-sacando-provecho-politico-con-proceso-de-vacunacion/,"Justificación. Indicó que despliegue de autoridades por vacunatorios es para generar trabajo coordinado con alcaldes, estar cercanos al proceso, resolver dudas y cuestionamiento",16-02-2021 11:46,https://www.bing.com/th?id=OVFT.JxG6ldg7-GH5qpUdBKcm1C,Chile,La Prensa
Dos comunas retroceden a Cuarentena y una avanza a ...,https://new.diariolaprensa.cl/index.php/2021/02/16/dos-comunas-retroceden-a-cuarentena-y-una-avanza-a-preparacion-en-la-region-del-maule/,"Pencahue es una de las dos comunas maulinas que retroceden a Paso 1 y quedan con cuarentena total a partir del jueves 18 de febrero, a las 5 de la mañana. Controles. Entre el jueves 11 y el domingo 14",16-02-2021 11:48,https://www.bing.com/th?id=OVFT.WaXtDO5lXkClsAzXtfXdfC,Chile,La Prensa
Un 64% de los padres condiciona la vuelta a clases ...,http://www.lanacion.cl/un-64-de-los-padres-condiciona-la-vuelta-a-clases-presenciales-de-sus-hijos-si-estan-vacunados/,La investigación también demuestra que la diferencia más significativa se presenta según el tipo de establecimiento al que asisten los escolares.,16-02-2021 11:49,https://www.bing.com/th?id=OVFT.Ab9xsNrhoQ_7IbW915EY2S,Chile,La Nación
Más de dos millones de personas han sido vacunadas contra ...,http://www.ladiscusion.cl/mas-de-dos-millones-de-personas-han-sido-vacunadas-contra-el-covid-19-en-chile/,"De acuerdo con los datos entregados por el Departamento de Estadística e Información de Salud (DEIS), el ministro de Salud, Enrique Paris, informó que durante la jornada de ayer hasta las 17:00",16-02-2021 11:50,https://www.bing.com/th?id=OVFT.DsknUCDvCInSUHqZ31clFC,Chile,La Discusión
Presidente Piñera destaca que Chile supera los dos ...,https://www.rln.cl/nacional/83700-presidente-pinera-destaca-que-chile-supera-los-dos-millones-de-personas-vacunadas-contra-el-covid-19,"La vacunación comenzó el 24 de diciembre y el proceso masivo en la ciudadanía el 3 de febrero. A la fecha se han vacunado 2.092.453 personas. El Presidente de la República, Sebastián Piñera, anunció q",16-02-2021 12:20,https://www.bing.com/th?id=OVFT.U_htMOcH4xsZU-YUGlo_2y,Chile,Radio las Nieves
"Covid-19: 4,3 millones de dosis llegarán a Chile durante ...",https://www.latribuna.cl/nacional/2021/02/16/covid-19-43-millones-de-dosis-llegaran-a-chile-durante-la-segunda-mitad-de-febrero.html,"En el marco del proceso de vacunación masivo en Chile encabezado por el Ministerio de Salud, se estima que entre el 18 y 24 de febrero llegarán dos envíos de la vacuna Pfizer/BioNTech, con 170 mil dos",16-02-2021 12:39,https://www.bing.com/th?id=OVFT.zi31DiI8q3CixsqWj_QW-i,Chile,La Tribuna
Guinea declaró oficialmente un nuevo brote de ébola – La ...,http://www.ladiscusion.cl/guinea-declaro-oficialmente-un-nuevo-brote-de-ebola/,"En medio de la crisis causada por el Covid-19, Guinea declaró este domingo un brote de ébola en una de sus regiones. Esto se dio luego de que el país africano confirmará al menos siete casos de la",16-02-2021 12:48,https://www.bing.com/th?id=OVFT.ygCpCudY_g1tIhXfZEE_mi,Chile,La Discusión
Hasta el viernes pasado 1.588 habitantes de Tierra del ...,https://laprensaaustral.cl/2021/02/16/hasta-el-viernes-pasado-1-588-habitantes-de-tierra-del-fuego-habian-sido-vacunados/,"El Plan nacional de vacunación contra el Covid-19, iniciado en el país el 3 de febrero, representó que en Tierra del Fuego hayan sido vacunados hasta el viernes de la semana pasada 1",16-02-2021 13:03,https://www.bing.com/th?id=OVFT.1yd_9xbZgs94FOJ9KpFhly,Chile,La Prensa Austral
"Carlos Menem, el presidente que acercó Argentina a Chile ...",https://www.df.cl/noticias/economia-y-politica/allamand-y-muerte-de-menem-avanzo-en-cimentar-la-amistad-profunda/2021-02-14/115757.html,"Fue cercano a Chile en los años clave de la transición, poniendo fin a diferendos limítrofes e impulsando la integración económica. Aunque peronista, implementó reformas económicas de corte liberal du",16-02-2021 13:09,https://www.bing.com/th?id=OVFT.W4yaEwbkKY9RoGXLh_GYIC,Chile,df.cl
El Ciudadano | Se llamará “Patria”: México prepara su ...,https://www.elciudadano.com/latinoamerica/se-llamara-patria-mexico-prepara-su-propia-vacuna-contra-el-covid-19/02/16/,"El presidente mexicano, Manuel López Obrador, informó que su país se encuentra desarrollando “Patria”, una vacuna propia contra el Covid-19.",16-02-2021 13:29,https://www.bing.com/th?id=OVFT.6yin7HfWr_PSOyc5k0JaEi,Chile,El Ciudadano
Embajador de Rusia dice que Sputnik V podría llegar a ...,https://www.emol.com/noticias/Nacional/2021/02/16/1012358/Embajador-Rusia-Avifavir-Vacuna-Sputnik.html,"Según el representante de ese país en Santiago, Sergei Koshkin, las negociaciones para traer la Sputnik V van a “paso firme”. Asimismo, defendió el uso del antigripal Avifavir.",16-02-2021 13:34,https://www.bing.com/th?id=OVFT.bYhBhupXOfqYLWKiBjIPhy,Chile,Emol
"Izkia Siches: ""Niños, niñas y adolescentes sí se pueden ...",https://www.meganoticias.cl/nacional/327383-izkia-siches-vuelta-a-clases-cgx02.html,"Este martes la presidenta del Colegio Médico, Izkia Siches, afirmó que los menores de edad sí pueden contagiar el COVID-19, en el marco de la vuelta a clases presenciales programada para el próximo 1",16-02-2021 13:40,https://www.bing.com/th?id=OVFT.nrhh7tcLoVtvKG-iqBeNFC,Chile,meganoticias
"Izkia Siches refuta dichos del ministro Paris: ""Niños y ...",https://www.theclinic.cl/2021/02/16/izkia-siches-refuta-dichos-del-ministro-paris-ninos-y-adolescentes-si-se-pueden-infectar-de-covid-19-y-transmitirlo/,"La presidenta del Colegio Médico (Colmed), Izkia Siches, le hizo una aclaración al ministro de Salud, Enrique de Paris, luego de que afirmara, en el marco del retorno a clases, que los niños transmite",16-02-2021 13:50,https://www.bing.com/th?id=OVFT.no1C5Ic5J-JUeLzMOxR0NS,Chile,Clinic
Coronavirus: Minsal reporta 2.547 nuevos casos y 20 ...,https://www.meganoticias.cl/nacional/327354-balance-covid-chile-cgx02.html,"El ministerio de Salud entregó un nuevo balance con respecto a la situación del coronavirus en el país, actualizando la cifra total de fallecidos y contagiados.",16-02-2021 14:00,https://www.bing.com/th?id=OVFT.qUYehobn_Q0iYJPcmecd2S,Chile,meganoticias
Chile registró 2.547 nuevos casos de COVID-19 en un día ...,https://www.t13.cl/noticia/nacional/contagios-chile-minsal-casos-2547-coronavirus-16-02-2021,El Minsal aseguró que 21.539 pacientes se encuentran en la etapa activa del virus mientras que la cifra de fallecidos aumentó a 19.644.,16-02-2021 14:07,https://www.bing.com/th?id=OVFT.IRZTkXvQdrl16OI6HLgrGy,Chile,T13
Covid-19: Minsal informó que en Chile aún hay 21.539 casos ...,https://www.latribuna.cl/coronavirus/2021/02/16/covid-19-minsal-informo-que-chile-aun-hay-21-539-casos-activos.html,"El Ministerio de Salud (Minsal) informó este martes que hubo 2.547 casos nuevos de coronavirus Covid-19 en Chile en las últimas 24 horas, alcanzando un total de 782.039 contagiados desde el inicio de",16-02-2021 14:20,https://www.bing.com/th?id=OVFT.XtT2lySvCitBkECDtRmeXC,Chile,La Tribuna
Alcaldes piden que regreso de clases presenciales sea el ...,https://www.publimetro.cl/cl/noticias/2021/02/16/clases-presenciales-alcaldes-15-abril.html,"La idea es que el año escolar inicie en marzo, pero que atendiendo a que recintos son usados como vacunatorios, las clases presenciales se aplacen.",16-02-2021 14:24,https://www.bing.com/th?id=OVFT.71aYj9xDKOLp7IrGtB_lVC,Chile,publimetro.cl
"Balance del Covid-19 en Chile: hay 2.547 casos nuevos, 20 ...",https://www.elmostrador.cl/dia/2021/02/16/balance-del-covid-19-en-chile-hay-2-547-casos-nuevos-20-fallecidos-registrados-en-las-ultimas-24-horas-y-1-573-pacientes-en-la-uci/,La región de Los Ríos registra el índice de incidencia más alto a nivel país por 100 mil habitantes. Mientras que las regiones con mayor aumento de nuevos casos confirmados en los últimos siete días s,16-02-2021 14:24,https://www.bing.com/th?id=OVFT.7DyzbokEpweYE90LcAJV-C,Chile,El Mostrador
Clases presenciales 2021: ¿qué dicen los expertos? | Tele 13,https://www.t13.cl/noticia/nacional/regreso-clases-presenciales-coronavirus-16-02-2021,"The New York Times encuestó a 175 profesionales, en su mayoría pediatras enfocados en la salud pública, y existen algunos consensos.",16-02-2021 14:33,https://www.bing.com/th?id=OVFT.G0ywS4qjcS7lsVzM4Lw8Pi,Chile,T13
Embajador ruso: ''Sputnik V podría estar en Chile el ...,https://www.pauta.cl/nacional/embajador-ruso-sputnik-v-podria-estar-en-chile-el-segundo-trimestre,De la desconfianza inicial a una alta demanda que podría alcanzar hasta los dos mil quinientos millones de dosis. La vacuna rusa contra el coronavirus Sputnik V ya calmó las dudas científicas al demostrar un éxito de cerca de un 92% para evitar síntomas graves de covid-19 y es una alternativa,16-02-2021 14:38,https://www.bing.com/th?id=OVFT.xM-6DqIaMt8IN0Axx4ZPVi,Chile,pauta
Ale Valle muestra consecuencias faciales que le dejó el ...,https://www.ar13.cl/noticias/ale-valle-muestra-consecuencias-faciales-que-le-dejo-el-coronavirus,"La periodista, cuyo diagnóstico se dio a conocer a fines de enero, compartió una foto que da cuenta de uno de los efectos que dejó el COVID-19.",16-02-2021 14:39,https://www.bing.com/th?id=OVFT.Yy-W2jXrba0E0orO8ml7hC,Chile,ar13.cl
Ale Valle | AR13.cl,https://www.ar13.cl/tags/Ale%20Valle,"La periodista, cuyo diagnóstico se dio a conocer a fines de enero, compartió una foto que da cuenta de uno de los efectos que dejó el COVID-19. Inés Matte Urrejola 0848, Santiago, Chile - Fono (562) 2",16-02-2021 14:43,https://www.bing.com/th?id=OVFT.wV2DeLnWmQ-8S1-gQmelfy,Chile,ar13.cl
ChileAtiende comenzó a entregar información respecto de ...,https://elpinguino.com/noticia/2021/02/16/chileatiende-comenzo-a-entregar-informacion-respecto-de-vacunacion,"Hoy nuestro país está viviendo uno de los momentos más importante en su lucha contra el Covid-19, tras el proceso de vacunación que comenzó el pasado 3 de febrero, sin embargo, aún en la comunidad exi",16-02-2021 15:02,https://www.bing.com/th?id=OVFT.WgciC6TI4Zhf2UkAk2dd7y,Chile,ELPINGUINO
"Palacios busca precisar dichos: ""Jamás pretendí hablar de ...",https://www.emol.com/noticias/Nacional/2021/02/16/1012375/Ministro-palacios-precisa-dichos-profesores.html,"El titular de Economía dijo más temprano que los educadores ""buscan por todas las formas no trabajar"" mientras criticaba la resistencia del gremio a retomar las clases presenciales antes de que se com",16-02-2021 15:08,https://www.bing.com/th?id=OVFT.-S0zLesPmdi8F3PZcBLFVy,Chile,Emol
"MINSAL INFORMÓ 2.547 CASOS NUEVOS, LLEGANDO A 782.039 ...",http://radiopolar.com/noticia_163691.html,"El Ministerio de Salud (Minsal) informó este martes que hubo 2.547 casos nuevos de coronavirus Covid-19 en Chile en las últimas 24 horas, alcanzando un total de 782.039 contagiados desde el inicio de",16-02-2021 15:08,https://www.bing.com/th?id=OVFT.bEHCQFrlAI72Vl1Xn8xdbi,Chile,Radio Polar
Presidenta del Colmed corrige a ministro de Salud: “Los ...,https://www.elmostrador.cl/noticias/pais/2021/02/16/presidenta-del-colmed-corrige-a-ministro-de-salud-los-ninos-y-adolescentes-si-pueden-transmitir-y-contagiar-el-covid-19/,"A raíz del retorno a clases de manera presencial que tiene agendado el Ministerio de Educación para el próximo 1 de marzo, el debate por la vacunación de los niños y adolescentes se ha tomado la agend",16-02-2021 15:10,https://www.bing.com/th?id=OVFT.c617QtVzTpniVec8xajsuS,Chile,El Mostrador
Vacunas Covid-19 y circulación de nuevas variantes del ...,https://www.latercera.com/que-pasa/noticia/vacunas-covid-19-y-circulacion-de-nuevas-variantes-del-virus-que-tanto-nos-protegen-frente-a-las-mutaciones-del-sars-cov-2/4QB2IZODVJF3DHT7OIHQM5SUJQ/,Las nuevas mutaciones del virus Sars-CoV-2 que se están propagando han encendido las alarmas en los países sobre la efectividad de las inoculaciones y cuestionando la duración de la inmunidad de las a,16-02-2021 15:19,https://www.bing.com/th?id=OVFT.0ZPu8sgwqaRfkRRtf9ikDC,Chile,LA TERCERA
"Izkia Siches: ""Los niños, niñas y adolescentes sí se ...",https://www.lacuarta.com/cronica/noticia/siches-ninos-infectar-covid/601241/,"La presidenta del Colegio Médico, Izkia Siches, aseguró que los niños y adolescente sí pueden contagiarse y transmitir el Covid-19.",16-02-2021 15:29,https://www.bing.com/th?id=OVFT.DC9_-seaI3asedLkJK0vXC,Chile,La Cuarta
"Chile se acerca a los 2,2 millones de personas vacunadas ...",http://www.lanacion.cl/chile-se-acerca-a-los-22-millones-de-personas-vacunadas-contra-el-covid-19/,"Según los datos del Departamento de Estadística e Información de Salud (DEIS), del total 1.224.711 personas mayores de 68 años han participado en la campaña de inoculación masiva. Respecto al género,",16-02-2021 15:51,https://www.bing.com/th?id=OVFT.gnXdgDRl_oJx7gU83wTEwy,Chile,La Nación
India genera desconcierto mundial: de 100 mil a 11 mil ...,https://www.publimetro.cl/cl/noticias/2021/02/16/india-baja-casos-covid.html,"Científicos plantean que los habitantes del gigante asiático lograron la inmunidad de rebaño, o bien una protección prexistente al virus.",16-02-2021 15:56,https://www.bing.com/th?id=OVFT.Z58eBBooDAE7OT8ctkwKVC,Chile,publimetro.cl
300 casos nuevos de covid-19 en región del Bío Bío: Los ...,https://www.biobiochile.cl/noticias/nacional/region-del-bio-bio/2021/02/16/300-casos-nuevos-de-covid-19-en-region-del-bio-bio-los-angeles-sigue-liderando-casos-activos.shtml,"La seremi de Salud del Bío Bío entregó el nuevo balance de los casos de covid-19 en la zona. Son 300 casos nuevos contabilizados en las últimas 24 horas y 67 mil 229 casos acumulados, de los cuales 2",16-02-2021 16:05,https://www.bing.com/th?id=OVFT.Yjfo1uS7zQr7KXuXOPFAFS,Chile,Chile
"Embajador ruso sobre Sputnik V: ""Podría estar en Chile el ...",https://www.elperiodista.cl/2021/02/embajador-ruso-sobre-sputnik-v-podria-estar-en-chile-el-segundo-trimestre/,"El embajador de Rusia en Chile, Sergei Koshkin, aseguró en conversación con Primera Pauta, de Radio PAUTA, lo avanzado de las negociaciones del país con la vacuna rusa Sputnik V, lo que podría permiti",16-02-2021 16:21,https://www.bing.com/th?id=OVFT.RsoHurAXQHsvGz1erRyYdS,Chile,El Periodista
Vacunación anticovid alcanza los 2 millones 182 mil ...,https://www.biobiochile.cl/noticias/nacional/chile/2021/02/16/vacunacion-anticovid-alcanza-los-2-millones-182-mil-calendario-sera-actualizado-antes-del-miercoles.shtml,Durante la mañana de este martes las autoridades entregaron una actualización de las cifras del proceso de vacunación contra COVID-19.,16-02-2021 16:58,https://www.bing.com/th?id=OVFT.JZtG0YxcdcB50p-CzTqOFi,Chile,Chile
