name,url,description,datePublished,imagen,pais,Fuente
Revisa las cuatro comunas que regresan a cuarentena total ...,https://www.elperiodista.cl/revisa-las-cuatro-comunas-que-regresan-a-cuarentena-total-por-incremento-de-casos-positivos-de-covid-19/,"A partir de hoy cuatro comunas del país retroceden una fase en el programa ‘Paso a Paso, implementado por el Gobierno y el Minsal debido a la actual emergencia sanitaria por Covid-19. Se trata de Lonq",25-09-2020 21:27,https://www.bing.com/th?id=OVFT.vOcKUOiRG8hfMEMSuaanmy,Chile,El Periodista
La nueva tecnología sanitizante que promete eliminar el ...,https://www.t13.cl/noticia/emprendedores/ivy-c-nueva-tecnologia-sanitizante-promete-eliminar-covid-19-luces-ultravioleta,"IVY-C es un tótem de desinfección de espacios, diseñado y fabricado en Chile que utiliza luz ultravioleta tipo C de acción comprobada en la desactivación del SARS-CoV-2- para sanitizar aire y superfic",25-09-2020 21:46,https://www.bing.com/th?id=OVFT.ukVwJkINuKxgiDXjWShZoy,Chile,T13
Subsecretario de Hacienda destaca ante foro de ...,https://www.puranoticia.cl/noticias/negocios/subsecretario-de-hacienda-destaca-ante-foro-de-apec-la-robustez-fiscal/2020-09-25/160113.html,"El subsecretario de Hacienda, Francisco Moreno, destacó las fortalezas de Chile en el marco de la pandemia del covid-19 en la reunión virtual de ministros de finanzas del Foro de Cooperación Económica",25-09-2020 21:48,https://www.bing.com/th?id=OVFT.XomQ-BK298KJZrBl1cxqCi,Chile,Puranoticia.cl
En Puerto Aysén se realizará “Cicletada por el Apruebo ...,https://www.rln.cl/local/78008-en-puerto-aysen-se-realizara-cicletada-por-el-apruebo,"La actividad “Pedaleando por un Chile Digno” es organizada por el comando ciudadano “Puerto Aysén Aprueba, Convención Constitucional”. Puerto Aysen.- A menos de un mes de que se realice el histórico p",25-09-2020 22:13,https://www.bing.com/th?id=OVFT.Ebwmn1VSgEOJMUUo2sHtyy,Chile,Radio las Nieves
Subsecretario Zúñiga afirmó que la denuncia de Jadue por ...,https://www.chvnoticias.cl/nacional/subsecretario-zuniga-denuncia-jadue_20200925/,"""En ese sentido nosotros no hemos perdido el tiempo en eso, seguimos trabajando de cara a la ciudadanía"", señaló la autoridad de Salud en entrevista con CNN Chile. El subsecretario de Redes Asistencia",25-09-2020 22:46,https://www.bing.com/th?id=OVFT.8IBzmgbWOqg7Y9uTQVAJRS,Chile,chvnoticias
Bío Bío marcha tercera en generación de mano de obra para ...,https://www.diarioconcepcion.cl/economia/2020/09/25/bio-bio-marcha-tercera-en-generacion-de-mano-de-obra-para-el-quinquenio.html,"La Región del Bío Bío marcha tercera a nivel nacional en generación de mano de obra para el próximo quinquenio, cifras al segundo trimestre aportadas por la Corporación de Bienes de Capital (CBC). La",25-09-2020 23:06,https://www.bing.com/th?id=OVFT.qGWqD6r6xqJnKCTxF8VAaC,Chile,El Diario de Concepcion
Sumario sobreseyó a funcionarios de Hospital de Melipilla ...,https://www.adnradio.cl/nacional/2020/09/25/sumario-sobreseyo-a-funcionarios-de-hospital-de-melipilla-acusados-de-negar-atencion-a-personal-de-carabineros.html,"Este viernes, el Colegio Médico de Chile (Colmed) dio a conocer el resultado del sumario que sobreseyó a los funcionarios del Hospital de Melipilla, quienes fueron acusados de negar atención a personal de Carabineros. Los hechos ocurrieron el 18 de junio pasado, cuando tres integrantes de la",25-09-2020 23:08,https://www.bing.com/th?id=OVFT.8_fA2LcQSsAHpW0k4dPORy,Chile,ADN
Coronavac china: ministro de Salud confía en que la vacuna ...,https://www.publimetro.cl/cl/noticias/2020/09/25/coronavac-china-ministro-salud-confia-la-vacuna-estara-chile-primer-trimestre-2021.html,"El ministro de Salud, Enrique Paris, manifestó su confianza de que la vacuna contra el covid-19 pueda estar en Chile en el primer trimestre del próximo año. ""Yo creo que vamos a tener vacuna el próxim",26-09-2020 01:17,https://www.bing.com/th?id=OVFT.ZSdrfQ9besr1IRcnfD-JPy,Chile,publimetro.cl
COVID-19: Positividad alcanza el 6% a nivel país y ...,https://www.radioagricultura.cl/nacional/2020/09/26/covid-19-positividad-alcanza-el-6-a-nivel-pais-y-nuevamente-se-registran-mas-de-2-mil-casos-nuevos.html,"Este sábado se dio a conocer en conferencia de prensa el nuevo balance por coronavirus en el país, luego de que se cambiaran los días del reporte presencial para los días lunes, jueves y sábado. La Subsecretaria de Salud Pública informó que la positividad en Chile alcanza un 6%, mientras que",26-09-2020 13:46,https://www.bing.com/th?id=OVFT.MVro6uqEtEKWQY0eJrqj1C,Chile,Radio Agricultura
Reporte del Minsal: Se informan más de 2.000 nuevos ...,https://www.meganoticias.cl/nacional/314639-minsal-coronavirus-chile-casos-retorno-seguro-plan-paso-a-paso-sabado-26-de-septiembre-jdx14.html,"Este sábado, el Ministerio de Salud entregó un nuevo reporte diario sobre el estado de la pandemia de coronavirus en el país. Nuevos contagios Según informó el subsecretario de Redes Asistenciales, Ar",26-09-2020 13:52,https://www.bing.com/th?id=OVFT.u9j8EJ75mtjFN2tLz8FcSi,Chile,meganoticias
Excelente noticia: Vacuna que se probará en Chile generó ...,https://eltipografo.cl/2020/09/excelente-noticia-vacuna-que-se-probara-en-chile-genero-inmunidad-en-voluntarios,Desde varios lugares del mundo se están realizando ensayos para lograr obtener la vacuna contra el covid-19. Una sola dosis de la vacuna experimental covid-19 de Johnson & Johnson produjo una respuest,26-09-2020 13:52,https://www.bing.com/th?id=OVFT.7njm3l-qy0o9eIajGR4Ypy,Chile,eltipografo.cl
Nuevo balance Minsal coronavirus en Chile 26 de septiembre ...,https://www.t13.cl/noticia/nacional/nuevo-balance-diario-coronavirus-chile-covid-19-muertos-contagios-26-09-2020,"Este sábado, el Ministerio de Salud (Minsal) dio un nuevo balance sobre el avance de la pandemia de coronavirus en Chile. En esa línea, se reportaron más de 2.109 nuevos contagios y 64 muertes por COV",26-09-2020 13:54,https://www.bing.com/th?id=OVFT.MDsfKJh8HPoamNvJGPxOqy,Chile,T13
Por caso positivo de coronavirus: ANFP suspende partido ...,https://www.meganoticias.cl/deportes/314642-colo-colo-vs-antofagasta-partido-suspendido-caso-positivo-de-coronavirus-crx12.html,"A través de un comunicado, el ente rector del fútbol chileno informó que “la suspensión se debe a la detección de un caso positivo por COVID-19, sin haber podido determinar aún sus contactos estrechos",26-09-2020 13:59,https://www.bing.com/th?id=OVFT.Q7-V69VPpE4RrAuFm260tC,Chile,meganoticias
Sigue el aumento: Chile vuelve a superar la barrera de los ...,https://www.theclinic.cl/2020/09/26/sigue-el-aumento-chile-vuelve-a-superar-la-barrera-de-los-2-mil-nuevos-contagiados-de-covid-19-en-un-dia/,"Durante la mañana de este sábado el Ministerio de Salud informó que Chile volvió a superar la barrera de los 2 mil nuevos contagiados por Covid-19 en las últimas 24 horas. Según las autoridades del Minsal, en la última jornada nuestro país tuvo 2.109 casos nuevos, con 1.458 pacientes con síntomas, 594 asintomáticos y 57…",26-09-2020 13:59,https://www.bing.com/th?id=OVFT.r6qFeMEIfHsykjbU99K_nS,Chile,Clinic
Covid-19: Chile registra 64 fallecidos y 2.109 casos ...,https://www.latribuna.cl/coronavirus/2020/09/26/covid-19-chile-registra-64-fallecidos-y-2109-casos-nuevos.html,"Un total de 8905personas se encuentran hospitalizadas en Unidades de Cuidados Intensivos, de las cuales 653 están con apoyo de ventilación mecánica y 135 se encuentran en estado crítico de salud. En e",26-09-2020 14:02,https://www.bing.com/th?id=OVFT.PUCXYJdkd1o9oWxwjvaily,Chile,La Tribuna
Coronavirus en Chile: Nuevos casos siguen sobre ...,https://www.puranoticia.cl/noticias/nacional/coronavirus-en-chile-nuevos-casos-siguen-sobre-los-2-mil-diarios-y-se/2020-09-26/113110.html,"El total de contagios llegó a 455.979, de ellos 13.129 se mantienen activos. Los pacientes recuperados suman 430.259. El Ministerio de Salud reportó este sábado otras 64 muertes asociadas al covid-19,",26-09-2020 14:34,https://www.bing.com/th?id=OVFT.pE0q3VYN0aljkRhIgDtRAy,Chile,Puranoticia.cl
Coronavirus en Colo Colo: Seremi de Salud está ...,https://www.emol.com/noticias/Nacional/2020/09/26/999046/Colo-Colo-covid-investigacion-avion.html,"El caso de coronavirus en Colo Colo llevó a que las autoridades sanitarias realicen una investigación de todos los pasajeros del avión en que viajó el cuadro albo desde Brasil. ""Es una persona que al",26-09-2020 14:46,https://www.bing.com/th?id=OVFT.POJaQa7ze5EznAnh5_Fquy,Chile,Emol
COVID- 19: Vacuna que se probará en Chile generó inmunidad ...,https://www.chvnoticias.cl/coronavirus/covid19-vacuna-pruebas-chile-inmunidad-voluntarios_20200926/,En los testeos de la farmacéutica estadounidense se generó una respuesta inmune en el 98% de los voluntarios. Se espera que esta única dosis llegue a mediados del 2021 a nuestro país. Una dosis de la,26-09-2020 14:55,https://www.bing.com/th?id=OVFT.6p516Md9Tecq6yMWw6u8ES,Chile,chvnoticias
Coronavirus: Vacuna de Johnson & Johnson generó inmunidad ...,https://www.cnnchile.com/coronavirus/vacuna-coronavirus-inmunidad-voluntarios_20200926/,"Una dosis de la vacuna desarrollada por la farmacéutica estadounidense Johnson & Johnson arrojó resultados positivos durante sus ensayos, generando una fuerte respuesta inmune contra la enfermedad.  S",26-09-2020 14:56,https://www.bing.com/th?id=OVFT.UQN6AyZIblyDOoPzqpuV2y,Chile,CNN Chile
COVID-19 en Chile mantiene tendencia al alza: Minsal ...,https://www.eldesconcierto.cl/2020/09/26/covid-19-chile-mantiene-alza-minsal-sobre-2-000-nuevos-casos/,"Las cifras reportadas este sábado transparentaron 2.109 nuevos casos, con lo que la cifra total de personas diagnosticadas con coronavirus en el país se acerca a las 500.000. Respecto de los decesos,",26-09-2020 15:07,https://www.bing.com/th?id=OVFT.rxquCWEGej0HP0vjXS0SpC,Chile,eldesconcierto
Minsal reporta 64 muertes y 2.109 nuevos contagios ...,https://www.elmostrador.cl/dia/2020/09/26/minsal-reporta-64-muertes-y-2-109-nuevos-contagios-autoridades-piden-cautela-ante-incremento-de-casos-diarios/,"El Ministerio de Salud realizó este sábado un balance televisado de la pandemia del coronavirus en Chile. Se trata del primero con el nuevo calendario de reportes desde La Moneda, donde los lunes, jue",26-09-2020 15:08,https://www.bing.com/th?id=OVFT.ASbfkLAuehcOW75b3Qt5gy,Chile,El Mostrador
Colo Colo niega toda responsabilidad en la suspensión ...,https://www.latercera.com/el-deportivo/noticia/colo-colo-niega-toda-responsabilidad-en-la-suspension-hemos-cumplido-con-todos-los-protocolos-sanitarios/Y6TI6UU6PBGERMSO2WC2VLSSFQ/,"El partido entre Colo Colo y Deportes Antofagasta fue suspendido tras encontrarse un caso positivo de Covid-19 en la delegación alba que viajó desde Brasil hacia Santiago, tras su participación en Cop",26-09-2020 15:23,https://www.bing.com/th?id=OVFT.iuB1zgucdciCMELM7hEfoy,Chile,LA TERCERA
Colo Colo lamenta caso positivo en delegación que viajó a ...,https://www.24horas.cl/deportes/futbol-nacional/colo-colo-lamenta-caso-positivo-en-delegacion-que-viajo-a-brasil-e-informa-que-sus-integrantes-haran-cuarentena-preventiva-4466162,"A través de un comunicado, Colo Colo se refirió a la suspensión del encuentro que se debía realizar a las 11:00 horas en el Estadio Monumental, con Deportes Antofagasta, lamentando los hechos y asegur",26-09-2020 15:26,https://www.bing.com/th?id=OVFT.HYLo-v5oKRu28zo9MUS8mC,Chile,24 Horas Chile
Hospital Regional descarta falta de personal pese a 53 ...,https://www.biobiochile.cl/noticias/nacional/region-del-bio-bio/2020/09/26/hospital-regional-descarta-falta-de-personal-pese-a-53-funcionarios-contagiados-con-covid-19.shtml,"El Servicio de Salud Concepción precisó que los 800 funcionarios contagiados por Covid-19, cifra entregada por la Fenats, corresponde a quienes se han enfermado durante la pandemia y no a los ausentes",26-09-2020 15:40,https://www.bing.com/th?id=OVFT.nWTveimU9v2cGMKmaXG6di,Chile,Chile
Minsal reporta 64 decesos por coronavirus y 2.109 nuevos ...,https://www.radiosantiago.cl/archivo/144670,El Ministerio de Salud realizó este sábado un balance televisado para dar cuenta de la evolución de la pandemia del coronavirus en Chile. Se trata del primero con el nuevo calendario de reportes desde,26-09-2020 15:42,https://www.bing.com/th?id=OVFT.0KQ8EdR6STDs-R8-LpbaCS,Chile,Radio Santiago
"El mundo supera los 32,5 millones de contagiados por ...",https://www.latercera.com/mundo/noticia/el-mundo-supera-los-325-millones-de-contagiados-por-coronavirus/HH2SVBEYQRDIPLDBVYINV643P4/,"Más de 32,5 millones se han contagiado de coronavirus a nivel mundial, en el marco de una pandemia que experimenta un repunte y ha sumado en las últimas 24 horas más de 335.000 nuevos positivos, el se",26-09-2020 16:00,https://www.bing.com/th?id=OVFT.YcRp5vnTjecVe7NCvl-_Xy,Chile,LA TERCERA
ANFP decidió suspender el partido entre Colo Colo y ...,http://www.radioportales.cl/sitio/anfp-decidio-suspender-el-partido-entre-colo-colo-y-antofagasta/,"Hoy sábado 26 de septiembre, a las 9:00 am, el Ministerio de Salud, a través de la Subsecretaria de la cartera, Paula Daza, se comunicó con el presidente de la ANFP, Pablo Milad, para determinar la su",26-09-2020 16:34,https://www.bing.com/th?id=OVFT.TErYkobqws3U7Rfso9d4hi,Chile,Radio Portales
En época de pandemia: El rol de los haitianos como ...,https://www.elrancaguino.cl/2020/09/26/en-epoca-de-pandemia-el-rol-de-los-haitianos-como-facilitadores-interculturales-en-los-hospitales-de-ohiggins/,"Actualmente en Chile viven un millón 492 mil 522 extranjeros y la comunidad haitiana es de 185 mil 865, de acuerdo a la última estimación realizada por el INE en conjunto con el Departamento de Extran",26-09-2020 16:36,https://www.bing.com/th?id=OVFT.kXT4c-5xIB_CiwVDUaVx3i,Chile,elrancaguino.cl
COVID-19: Daza pidió cautela ante incremento de casos en ...,https://www.eldesconcierto.cl/2020/09/26/covid-19-daza-pidio-cautela-ante-aumento-de-casos/,"La autoridad del Minsal planteó que esta situación se podría deber “a un efecto de las fiestas del 18' de septiembre, donde esos días las personas no consultaron ni se tomaron exámenes"". “Hemos visto",26-09-2020 16:55,https://www.bing.com/th?id=OVFT.2y-HNW8XbHS9I3r-nKVONC,Chile,eldesconcierto
