name,url,description,datePublished,imagen,pais,Fuente
VIDEO. Profe José Maza se entusiasma con las elecciones y llama a cuidarse: “Votar es seguro e histórico”,https://www.theclinic.cl/2021/05/13/video-profe-jose-maza-se-entusiasma-con-las-elecciones-y-llama-a-cuidarse-votar-es-seguro-e-historico/,"El profesor José Maza, astrónomo y Premio Nacional de Ciencias 1999, se entusiasmó con la jornada electoral del próximo 15 y 16 de mayo y señaló que “votar es seguro e histórico”. El video que publicó",14-05-2021 00:51,https://www.bing.com/th?id=OVFT.-j_Uf-VKCAl4IhG-1nyQ1y,Chile,Clinic
Aguas Patagonia abre fondo concursable para organizaciones sociales,http://www.eldivisadero.cl/noticia-62629,"Hasta el 10 de junio hay plazo para postular al fondo concursable ""Patagones Todos"", iniciativa de Aguas Patagonia que va en respaldo de actividades de organizaciones sociales regionales que impacten",14-05-2021 02:03,https://www.bing.com/th?id=OVFT.R78Qs4aY3Q6bUKfTQCxdaS,Chile,Diario el Divisadero
"Vencer a la pandemia, solo con vacunas para todos los países",https://www.diarioconcepcion.cl/editorial/2021/05/14/vencer-a-la-pandemia-solo-con-vacunas-para-todos-los-paises.html,"Según la ONU, más del 80% de las dosis administradas en el mundo están en los países más ricos, mientras que sólo el 1,3% ha llegado a las economías de ingresos más bajos. Otra vez es clave recordarlo",14-05-2021 03:08,https://www.bing.com/th?id=OVFT.fvjd-91FyiBoWKuJotbImS,Chile,El Diario de Concepcion
Ministro Cancino procesa a oficial (r) de la Armada por secuestro de militante comunista en 1973,https://www.elciudadano.com/chile/ministro-cancino-procesa-a-oficial-r-de-la-armada-por-secuestro-de-militante-comunista-en-1973/05/13/,"Edmundo Renato Jiménez Venegas fue detenido en Valparaíso, en octubre de 1973, siendo conducido primeramente a una Comisaría de Carabineros y luego transportado a la Academia de Guerra, donde fue golp",14-05-2021 03:16,https://www.bing.com/th?id=OVFT.O7NCAD7dgLSrQlu7GW_XQi,Chile,El Ciudadano
Candidato a concejal por RN fue atacado con balín en el ojo izquierdo,https://www.24horas.cl/nacional/candidato-a-conceja-rn--atacado-balin--4778888,Un candidato a concejal por RN recibió un ataque con balín en uno de sus ojos mientras realizaba el cierre de su campaña en Quinta Normal,14-05-2021 04:41,https://www.bing.com/th?id=OVFT.1OyCUTx2othXtES5_cZR6i,Chile,24 Horas Chile
Con 136 fallecidos y 6.181 casos nuevos Chile reporta menos de 3 mil internos en UCI por primera vez en 5 semanas,https://www.chanarcillo.cl/con-136-fallecidos-y-6-181-casos-nuevos-chile-reporta-menos-de-3-mil-internos-en-uci-por-primera-vez-en-5-semanas/,"*Atacama registró un 15% de positividad. La tarde de este jueves, el Ministerio de Salud (Minsal) reportó 6.181 casos nuevos de",14-05-2021 07:00,https://www.bing.com/th?id=OVFT.Y1dve56MrnsbMGsVh7wtzi,Chile,Diario Chanarcillo
Estudio revela falta de información para desechar mascarillas en playas de Chile,https://www.diariolaregion.cl/estudio-revela-falta-de-informacion-para-desechar-mascarillas-en-playas-de-chile/,"El análisis, publicado en la revista científica Science of the Total Environment, da cuenta de la falta de señalética que indique dónde depositar el residuo, así como la poca cantidad de basurer",14-05-2021 10:22,https://www.bing.com/th?id=OVFT.180x2XC9fS2MVtOXEo_UpC,Chile,La Region
Elecciones: 24 preguntas y respuestas del trascendental proceso de este fin de semana,http://www.lanacion.cl/elecciones-24-preguntas-y-respuestas-del-trascendental-proceso-de-este-fin-de-semana/,"Este 15 y 16 de mayo se realizarán las elecciones para elegir a los convencionales constituyentes, los gobernadores regionales, alcaldes y concejales. Según datos del padrón electoral entregado por el",14-05-2021 13:00,https://www.bing.com/th?id=OVFT.UeR3ubaPyOts7ENd2qVnIy,Chile,La Nación
"Científico Alexis Kalergis y mascarillas: ""Tenemos que usarlas mientras el virus siga circulando""",https://www.pauta.cl/ciencia-y-tecnologia/kalergis-mascarillas-uso-aire-libre-sinovac-vacunas,"Casi 900 mil rezagados del tramo de 40 a 49 años tiene el proceso de vacunación en Chile, una cifra que está atrasando significativamente el objetivo de conseguir el porcentaje de inoculados necesario",14-05-2021 13:02,https://www.bing.com/th?id=OVFT.22xCN6PvkZ-U6fMosAI4iy,Chile,pauta
OMS pide a los países no vacunar a sus niños y donar dosis excedentes a COVAX,http://www.ladiscusion.cl/oms-pide-a-los-paises-no-vacunar-a-sus-ninos-y-donar-dosis-excedentes-a-covax/,"Los países ricos que ya han alcanzado altos niveles de vacunación contra la COVID-19 deberían preferiblemente donar dosis excedentes de vacunas, en lugar de usarlas para inmunizar a sus",14-05-2021 14:03,https://www.bing.com/th?id=OVFT.Or4cCiX4sZv5lWSJo41DeS,Chile,La Discusión
Reporte de COVID-19: Chile llega a las elecciones con 6.903 casos diarios,https://www.t13.cl/noticia/elecciones-2021/nacional/coronavirus-chile-reporte-viernes-elecciones-14-05-2021,"En cuanto a la positividad para las últimas 24 horas, a nivel país es de 9,52% y en la región Metropolitana es de 11%.",14-05-2021 14:13,https://www.bing.com/th?id=OVFT._RRz7cLNr9mjgkJjluqW8C,Chile,T13
"Ministro Cerda responde a críticas de la oposición tras anuncio de IFE universal: ""No es un portazo, es una invitación al diálogo""",https://www.emol.com/noticias/Economia/2021/05/14/1020867/Cerda-criticas-a-IFE-universal.html,"El jefe de la billetera fiscal adelantó que los detalles del proyecto serán analizados en el Congreso, ""tal como siempre conversamos"", cuando finalice el periodo distrital.",14-05-2021 14:17,https://www.bing.com/th?id=OVFT.MFaR4N2A51mTz-D9Vaw2BS,Chile,Emol
Covid-19: Chile suma 6.903 casos nuevos y 127 fallecidos en las últimas 24 horas,https://www.latribuna.cl/coronavirus/2021/05/14/covid-19-chile-suma-6-903-casos-nuevos-y-127-fallecidos-en-las-ultimas-24-horas.html,"A la fecha, 2.976 personas se encuentran hospitalizadas en Unidades de Cuidados Intensivos, de las cuales 2.488 están con apoyo de ventilación mecánica.",14-05-2021 14:20,https://www.bing.com/th?id=OVFT.zRH4r08zs2hI1pMjdDHpyy,Chile,La Tribuna
Partido entre Huachipato y Rosario Central debe disputarse en Buenos Aires,https://redgol.cl/internacional/Partido-entre-Huachipato-y-Rosario-Central-debe-disputarse-en-Buenos-Aires-20210514-0018.html,Huachipato espera poder sellar su clasificación a la siguiente etapa de la Copa Sudamericana en su visita a Rosario Central.,14-05-2021 14:39,https://www.bing.com/th?id=OVFT.PkIuky0GL_Uey4XNrKVS4C,Chile,redgol
Chile registró casi 7 mil casos nuevos de Covid-19,http://www.ladiscusion.cl/chile-registro-casi-7-mil-casos-nuevos-de-covid-19/,"El Ministerio de Salud (Minsal) reportó 6.903 casos nuevos y 127 nuevos decesos por covid-19. Con ello, el  total de casos activos, es decir, aquellas personas que portan el SARS-CoV-2 y que son",14-05-2021 14:46,https://www.bing.com/th?id=OVFT.CccnXoQIxBnaNlWHToCIHS,Chile,La Discusión
COVID-19: ¿Se cumplió o no la proyección de Paris de 4.500 casos semanales antes de las elecciones?,https://www.t13.cl/noticia/elecciones-2021/politica/nacional/coronavirus-covid-19-enrique-paris-chile-registra-casi-7-mil-casos-antesala-elecciones-14-05-21,"Este viernes y a solo horas de la mega elección de alcaldes, gobernadores y constituyentes, se registraron casi 7 mil casos de Coronavirus. Colmed atribuye alza a aumento en la movilidad tras reapertu",14-05-2021 15:12,https://www.bing.com/th?id=OVFT.Tgwitp8Cr-DoTI7A-hcwRi,Chile,T13
Minsal informó 6.903 casos nuevos de covid-19 en Chile: contagiados totales alcanzaron 1.273.516,https://www.adnradio.cl/nacional/2021/05/14/minsal-informo-6-903-casos-nuevos-de-covid-19-en-chile-contagiados-totales-alcanzaron-1-273-516.html,"El ministerio de Salud (Minsal) informó este jueves 6.903 casos nuevos de coronavirus covid-19 en Chile en las últimas 24 horas, alcanzando un total de 1.273.516 contagiados desde el inicio de la pand",14-05-2021 15:13,https://www.bing.com/th?id=OVFT._Eg2lziZMjOwaMznTF-r4S,Chile,ADN
"Ministerio de Salud reportó 127 muertos por covid-19 durante las últimas 24 horas, llegando a un total de 27.647",https://www.adnradio.cl/nacional/2021/05/14/ministerio-de-salud-reporto-127-muertos-por-covid-19-durante-las-ultimas-24-horas-llegando-a-un-total-de-27-647.html,"El ministerio de Salud informó este viernes que 127 personas murieron por covid-19, de acuerdo con las inscripciones en el Registro Civil durante las últimas 24 horas, en el marco del balance diario e",14-05-2021 15:18,https://www.bing.com/th?id=OVFT.KpW7Xx6Denxw2xlQKkjN3C,Chile,ADN
Chile reporta 6.903 nuevos casos y 36.746 pacientes contagiantes covid-19,https://www.diarioconcepcion.cl/pais/2021/05/14/chile-reporta-6-903-nuevos-casos-y-36-746-pacientes-contagiantes-covid-19.html,"Este viernes 14 de mayo el Ministerio de Salud informó en el reporte covid-19 que Chile registró 127 nuevos decesos inscritos y 6.903 casos positivos, durante las últimas 24 horas. Del total de nuevos",14-05-2021 15:33,https://www.bing.com/th?id=OVFT.SYWNBz5QMT54OGJcqfVnkS,Chile,El Diario de Concepcion
Chile: Casi 7.000 casos nuevos de Covid-19 en la última jornada,https://radioportales.cl/sitio/chile-casi-7-000-casos-nuevos-de-covid-19-en-la-ultima-jornada/,"El Minsal reportó este viernes 127 nuevos decesos por covid-19, según el Departamento de Estadística e Información de Salud, DEIS, lo que eleva el total nacional de defunciones a 27 mil 647 con PCR co",14-05-2021 15:35,https://www.bing.com/th?id=OVFT.P0ZXDdb-7OWF8QytI53bBi,Chile,Radio Portales
A horas de mega elección: Chile suma casi 7 mil casos nuevos y alcanza su mayor alza de mayo,https://www.biobiochile.cl/noticias/nacional/chile/2021/05/14/chile-suma-casi-7-mil-casos-nuevos-y-alcanza-su-mayor-alza-de-mayo.shtml,"La mañana de este viernes, a horas del mega proceso eleccionario del fin de semana, el Ministerio de Salud (Minsal) reportó 6.903 casos nuevos de covid-19. En lo que va de mayo, esta es la cifra más a",14-05-2021 15:59,https://www.bing.com/th?id=OVFT.LvzbkR9ih8YMB0w1BwsedS,Chile,Chile
Abril versus mayo: El escenario sanitario a un día de las elecciones y el que se presentaba previo a la fecha original,https://www.emol.com/noticias/Nacional/2021/05/14/1020882/escenario-sanitario-mayo-comparado-abril.html,"A fines de marzo, el Minsal esperaba que se presentara ""una situación sanitaria distinta"" para llegar a los comicios de este mes. Al comparar las fechas, se evidencia menor positividad nacional y baja",14-05-2021 17:00,https://www.bing.com/th?id=OVFT.aDm5mjkm7-qAJq-Np3tB4y,Chile,Emol
Los pueblos originarios han dado un ejemplo en medio de la pandemia,http://www.diariolongino.cl/los-pueblos-originarios-han-dado-un-ejemplo-en-medio-de-la-pandemia/,"En una simbólica visita a nuestra región, el líder de la cartera de Ciencia y Tecnología resaltó la disciplina social de las localidades andinas, valorando “el gran sentido de comunidad por sobre lo i",14-05-2021 17:01,https://www.bing.com/th?id=OVFT.SKbCAooAFHj8v_aUdpIo8i,Chile,El Longino
La incertidumbre de ser padres de un hijo con asma en tiempos de pandemia.,https://www.elrancaguino.cl/2021/05/14/la-incertidumbre-de-ser-padres-de-un-hijo-con-asma-en-tiempos-de-pandemia/,Por: Viviana Aguirre Vicedecana de Investigación y Desarrollo de la Facultad de Ciencias Médicas de Usach       La,14-05-2021 17:40,https://www.bing.com/th?id=OVFT.FZmJfSmOCJuTlR-c_LO8Gi,Chile,elrancaguino.cl
América Latina se compromete a reactivar el turismo en la Declaración de Punta Cana,https://www.elmostrador.cl/generacion-m/2021/05/14/america-latina-se-compromete-a-reactivar-el-turismo-en-la-declaracion-de-punta-cana/,"La reunión, organizada por la Organización Mundial del Turismo (OMT), viene a paliar la falta de liderazgo que aún existe en la creación de corredores turísticos que permitan viajar con normalidad tra",14-05-2021 18:17,https://www.bing.com/th?id=OVFT.v5RSkyd4IkC_GfR3n3LYnC,Chile,El Mostrador
Presentan Plan de Invierno para el sistema eléctrico de la Región Metropolitana,https://www.elmostrador.cl/agenda-pais/2021/05/14/presentan-plan-de-invierno-para-el-sistema-electrico-de-la-region-metropolitana/,"Enel Distribución incorporó 250 equipos de telecontrol adicionales llegando a 2.456 al cierre de mayo, los que permiten reducir los tiempos de recuperación del suministro cuando se produce una interru",14-05-2021 18:31,https://www.bing.com/th?id=OVFT.--flMEIXNEnQlifmvxuVZi,Chile,El Mostrador
Red de Laboratorios universitarios duplicarán capacidad nacional para secuenciar coronavirus,https://www.latercera.com/que-pasa/noticia/red-de-laboratorios-universitarios-duplicaran-capacidad-nacional-para-secuenciar-coronavirus/5YFC26MJIJFP3JONMDRKQZNE6Y/,"A través de la coordinación del Ministerio de Ciencia, seis universidades desde Antofagasta a Punta Arenas participan de un plan de aceleramiento que permitirá analizar hasta 360 muestras semanales pa",14-05-2021 18:34,https://www.bing.com/th?id=OVFT.fkh2Bwb7yRWc9OdWGtyr0i,Chile,LA TERCERA
Ejército ya se encuentra desplegado en locales de votación de la región de Aysén,https://www.rln.cl/destacado/86980-ejercito-ya-se-encuentra-desplegado-en-locales-de-votacion-de-la-region-de-aysen,"Integrantes de las unidades de la IV División de Ejército se encuentran desplegados en los establecimientos educacionales asignados como locales de votación en la Región de Aysén, para el proceso de l",14-05-2021 18:42,https://www.bing.com/th?id=OVFT.cPYaqBhBTIN-Drda80GyQC,Chile,Radio las Nieves
Radiograma: Contagios de Covid-19 llegan a la cifra más alta en lo que va del mes,https://www.biobiochile.cl/biobiotv/programas/radiograma-biobiotv/2021/05/14/radiograma-contagios-de-covid-19-llegan-a-la-cifra-mas-alta-en-lo-que-va-del-mes.shtml,Revisa la edición de Radiograma Mediodía del viernes 14 de mayo junto a Katherine Cubillos y Nibaldo Mosciatti en Bio Bio TV. Revisa la edición de Radiograma Mediodía del viernes 14 de mayo junto a Ka,14-05-2021 19:10,https://www.bing.com/th?id=OVFT.xJXJwIBTqaGijNxZHwIxYS,Chile,Chile
Desbaratan banda que trasladaba droga en camión con caballos: incautan 87 kilos de cannabis avaluada en $436 millones,https://www.puranoticia.cl/noticias/nacional/desbaratan-banda-que-trasladaba-droga-en-camion-con-caballos-incautan/2021-05-14/150743.html,"En la operación ""Alter Real"", la PDI y la Fiscalía de Ñuñoa desbarató una banda compuesta ciudadanos chilenos que trasladaba cannabis sativa cultivada en Ovalle en la región de Coquimbo, hasta la regi",14-05-2021 19:44,https://www.bing.com/th?id=OVFT.gLeHsVuVhxCKcs6lZqXkMi,Chile,Puranoticia.cl
Rol de las telecomunicaciones en pandemia será eje principal en webinar de la Universidad de Concepción,https://mundoenlinea.cl/2021/05/14/rol-de-las-telecomunicaciones-en-pandemia-sera-eje-principal-en-webinar-de-la-universidad-de-concepcion/,"Desde principios del 2020, debido a la crisis sanitaria acarreada por el Covid-19, gran parte de la población mundial a tenido que quedarse en sus hogares, obligando a potenciar distintas manera de re",14-05-2021 20:08,https://www.bing.com/th?id=OVFT.42mFp1XcdaawyqkORvYphS,Chile,Mundo en línea
