name,url,description,datePublished,imagen,pais,Fuente
Minagri impulsa compromiso por la Capacitación del Agro ...,https://www.mundoagropecuario.cl/new/2020/12/17/minagri-impulsa-compromiso-por-la-capacitacion-del-agro-con-30-universidades-e-instituciones/,"Cabe destacar que a la fecha, la Escuela de Capacitación Chile Agrícola cuenta con más de 300 contenidos instructivos (videos, manuales y fichas) clasificados en 9 grandes temas: ... manejo productivo, tecnología e información, manejo forestal y Covid-19. La plataforma permite ver los contenidos online, descargarlos e imprimirlos, ...",17-12-2020 14:15,https://www.bing.com/th?id=OVFT.MPAh1iGhUglqs1JhehsAXS,Chile,Mundo Agropecuario
Piñera informó que este mes llegarán las primeras 20 mil ...,https://www.latribuna.cl/noticias/2020/12/17/pinera-informo-que-este-mes-llegaran-las-primeras-20-mil-dosis-de-la-vacuna-pfizer-contra-el-covid-19.html,"El Presidente Sebastián Piñera anunció la noche de este miércoles, en Cadena Nacional, que las primeras 20 mil dosis de la vacuna contra el coronavirus de Pfizer-Biontech llegarán a Chile este mes. El",17-12-2020 15:01,https://www.bing.com/th?id=OVFT.yYP0v0FQ8ARutiS-hVulki,Chile,La Tribuna
"Minsal informó 1.998 casos nuevos, llegando a 578.732 ...",https://www.adnradio.cl/nacional/2020/12/17/minsal-informo-1-998-casos-nuevos-llegando-a-578-732-contagiados-totales-con-covid-19-en-chile.html,"El Ministerio de Salud (Minsal) informó este jueves que hubo 1.998 casos nuevos de coronavirus Covid-19 en Chile en las últimas 24 horas, alcanzando un total de 578.732 contagiados desde el inicio de la pandemia. En detalle, 1.414 pacientes presentaron síntomas, mientras que 535 fueron",17-12-2020 15:10,https://www.bing.com/th?id=OVFT.jqGHLB42-cw6KuFptDMHxi,Chile,ADN
Presidente Piñera: “La vacuna contra la covid-19 será ...,https://www.diarioconcepcion.cl/pais/2020/12/17/presidente-pinera-la-vacuna-contra-la-covid-19-sera-voluntaria-y-gratuita-para-todos.html,"El Presidente Sebastián Piñera entregó detalles del proceso de vacunación contra la covid-19 que vivirá el país. A través de una cadena nacional, el mandatario anunció que tras la aprobación de los co",17-12-2020 15:13,https://www.bing.com/th?id=OVFT.9lX0T6df4lMmAALaW0iJJy,Chile,El Diario de Concepcion
"Conozca los secretos de la vacuna Pfizer-BioNTech, la ...",https://www.publimetro.cl/cl/noticias/2020/12/17/conozca-los-secretos-la-vacuna-pfizer-biontech-la-primera-autorizada-chile.html,"Como se esperaba, el ISP visó este producto, que tiene los mismos efectos secundarios que otras inmunizaciones: dolor leve en la zona del pinchazo y fiebre.",17-12-2020 15:19,https://www.bing.com/th?id=OVFT.2Y5aIlBZvB4xzTFMBOLMHy,Chile,publimetro.cl
Chile supera las 16 mil muertes por covid-19: sumó 1.998 ...,https://www.diarioconcepcion.cl/pais/2020/12/17/chile-supera-las-16-mil-muertes-por-covid-19-sumo-1-998-contagios-en-la-ultima-jornada.html,"Un nuevo balance entregado este jueves por el Ministerio de Salud informó que Chile registró 48 nuevos decesos inscritos y 1.998 casos positivos de covid-19, durante las últimas 24 horas. Del total de nuevos contagios, 1.414 fueron sintomáticos, 535 asintomáticos y 49 sin notificar, detallaron",17-12-2020 15:21,https://www.bing.com/th?id=OVFT.JwdqQaeGXLPFJ0hcSQqt6i,Chile,El Diario de Concepcion
Minsal reporta 48 personas fallecidas y 1.998 casos nuevos ...,https://www.lacuarta.com/cronica/noticia/minsal-reporta-48-personas-fallecidas-1-998-casos-nuevos-covid-19/579455/,"Este jueves 17 de diciembre, el Ministerio de Salud entregó un nuevo reporte diario sobre el avance del Covid-19 en Chile.",17-12-2020 15:32,https://www.bing.com/th?id=OVFT.U7On5V0yLT1ZiUKZjJe9Qi,Chile,La Cuarta
Covid-19: En Chile muertos superan las 16.000 personas ...,https://www.latribuna.cl/noticias/2020/12/17/covid-19-en-chile-muertos-superan-las-16-000-personas.html,"A la fecha, 627 personas se encuentran hospitalizadas en Unidades de Cuidados Intensivos, de las cuales 468 están con apoyo de ventilación mecánica y 51 se encuentran en estado crítico de salud.",17-12-2020 15:32,https://www.bing.com/th?id=OVFT.kG6EGACk7RooKU5GJ0NsGy,Chile,La Tribuna
Chile superó las 16 mil muertes por Covid-19 – La Discusión,http://www.ladiscusion.cl/chile-supero-las-16-mil-muertes-por-covid-19/,"Las autoridades del Ministerio de Salud entregaron este jueves un nuevo balance sobre el avance de la pandemia por Covid-19 en el país, en el que informaron que en la última jornada se",17-12-2020 15:41,https://www.bing.com/th?id=OVFT.02DAT7hOTjQxVpA9XoujxS,Chile,La Discusión
Infección natural o una vacuna: ¿Qué produce una mejor ...,https://www.duna.cl/noticias/2020/12/17/infeccion-natural-o-una-vacuna-que-produce-una-mejor-respuesta-inmune-ante-el-covid-19/,"El miércoles, fue una jornada histórica en Chile debido a que el Instituto de Salud Pública (ISP) aprobó el uso de emergencia de la vacuna de Pfizer en Chile desde los 16 años. Por su parte, el presidente Sebastián Piñera manifestó que se pretende vacunar a un público objetivo de 15",17-12-2020 16:03,https://www.bing.com/th?id=OVFT.7yXj1a8Fno66GNRvIMduCC,Chile,duna
Otra esperanza: Vacuna de Sinovac podría ser aprobada para ...,https://www.duna.cl/noticias/2020/12/17/otra-esperanza-vacuna-de-sinovac-podria-ser-aprobada-para-enero-en-chile/,Dos funcionarias de ISP están en China supervisando las plantas de producción con miras en obtener un certificado de buenas prácticas de manufactura y con eso se facilite la autorización.,17-12-2020 16:15,https://www.bing.com/th?id=OVFT.103Jv1Ag4n9Khoq7NvPXfC,Chile,duna
"En el día 290 de pandemia en Chile, fallecidos por Covid ...",https://www.latercera.com/que-pasa/noticia/en-el-dia-290-de-pandemia-en-chile-fallecidos-por-covid-19-superan-los-16-mil/QG4SAABK5VA3VJ5THLKFVZPRUM/,"A esta cifra de decesos se llega tras informarse 48 nuevas víctimas fatales confirmadas por la pandemia. En tanto, durante la última jornada, se registraron 1.998 casos nuevos, con lo que el total lle",17-12-2020 16:20,https://www.bing.com/th?id=OVFT.oDCgl7650JYHS5fKOT21ay,Chile,LA TERCERA
CPLT ofició al Minsal para resguardar transparencia en ...,https://www.elmostrador.cl/dia/2020/12/17/cplt-oficio-al-minsal-para-resguardar-transparencia-en-gasto-y-distribucion-de-la-vacuna-contra-el-covid-19/,Gloria de la Fuente hizo llamado a la apertura en materia de información oportuna y clara para la ciudadanía. “Siempre es importante que se tenga a la luz los fundamentos de las decisiones y cuando se,17-12-2020 16:25,https://www.bing.com/th?id=OVFT.NoScLMUETOrRqNKihrDW0y,Chile,El Mostrador
Minsal anuncia que RM permanecerá en fase de Transición ...,https://www.theclinic.cl/2020/12/17/minsal-anuncia-que-rm-permanecera-en-fase-de-transicion-revisa-las-comunas-que-avanzan-o-retroceden-por-sus-contagios-de-covid-19/,Durante la tarde de este jueves las autoridades de Gobierno anunciaron que las comunas de la Región Metropolitana permanecerán en fase 2 de Transición dentro del plan “Paso a Paso” por el Covid-19. En,17-12-2020 16:33,https://www.bing.com/th?id=OVFT.K0DzGfFtYhbpvp6J-5wB0S,Chile,Clinic
Gobierno llega a acuerdo con Espacio Riesco: Minsal ...,https://www.emol.com/noticias/Nacional/2020/12/17/1006948/Gobierno-acuerdo-espacio-riesco.html,"A días de iniciada la polémica, el Gobierno arribó a un acuerdo con los contralores de Espacio Riesco, recinto que fue acondicionado durante este año como un centro médico para enfrentar la pandemia del covid-19. La disputa, aseguró hoy el subsecretario de Redes Asistenciales Alberto Dougnac",17-12-2020 16:55,https://www.bing.com/th?id=OVFT.F2bl7wY40BSlbuypqiygaS,Chile,Emol
Presidente Piñera: “Nuestro plan de vacunación contempla ...,https://www.radioagricultura.cl/nacional/2020/12/17/presidente-pinera-nuestro-plan-de-vacunacion-contempla-vacuna-al-grueso-de-la-poblacion-critica-durante-el-primer-trimestre-del-2021.html,"El Presidente Sebastián Piñera entregó este jueves mayores detalles sobre cómo será el proceso de vacunación contra el Covid-19, luego",17-12-2020 17:04,https://www.bing.com/th?id=OVFT.SC10zPK2WQ0T4mjQIynHrS,Chile,Radio Agricultura
Vacuna contra Covid-19 podría llegar a Ñuble durante ...,http://www.ladiscusion.cl/vacuna-contra-covid-19-podria-llegar-a-nuble-durante-primer-trimestre-de-2021/,"Las autoridades de Ñuble se pronunciaron este jueves sobre la aprobación de la vacuna del laboratorio Pfizer/BioNTech contra el Covid-19, cuyas primeras dosis llegarán a Chile antes de que",17-12-2020 17:22,https://www.bing.com/th?id=OVFT.iFX20dRcDcz4Bj2zjaEkty,Chile,La Discusión
Posible brote de covid-19 enciende las alarmas en la ...,https://www.publimetro.cl/cl/noticias/2020/12/17/covid-antartica.html,"Una o más personas han presentado síntomas en la Base O'Higgins, en la Antártica chilena, y requerirían someterse a los exámenes correspondientes.",17-12-2020 17:34,https://www.bing.com/th?id=OVFT.0DNNVLes7cOaefej92PPzC,Chile,publimetro.cl
Piñera anuncia que en los próximos días se inicia proceso ...,https://www.df.cl/noticias/economia-y-politica/politica/pinera-detalla-plan-de-vacunacion-y-anuncia-que-en-los-proximos-dias/2020-12-17/144107.html,"Piñera detalla plan de vacunación y anuncia que “en los próximos días” comenzaría la inoculación de los primeros grupos de riesgo. En el marco de la presentación de la “Ruta de la vacuna”, el mandatario dijo que el proceso se iniciará en las comunas más afectadas, como son Magallanes, La Araucanía y Biobío.",17-12-2020 17:56,https://www.bing.com/th?id=OVFT.KGYKFSu4VSL9wlZoZkNecy,Chile,df.cl
Gobierno entrega detalles de ruta de la vacuna contra ...,https://www.t13.cl/noticia/nacional/gobierno-detalles-ruta-vacuna-covid-19-chile-17-12-2020,"Ustedes saben que igual como hubo una guerra de los ventiladores, se puede producir también una guerra de las vacunas, advirtió Piñera.",17-12-2020 18:00,https://www.bing.com/th?id=OVFT.42918i3SFsuWxuLVzq4I7i,Chile,T13
Presidente Piñera presenta detalles del plan de vacunación ...,https://www.elperiodista.cl/presidente-pinera-presenta-detalles-del-plan-de-inoculacion-contra-el-covid-19/,"En una actividad realizada en el Palacio de La Moneda, el Mandatario profundizó en el anuncio realizada en cadena nacional, en que se oficializó que, durante los próximos días, Chile recibirá un prime",17-12-2020 18:02,https://www.bing.com/th?id=OVFT.mkfkkazZg-iA4Elzxc6nJi,Chile,El Periodista
Piñera anuncia que vacuna contra el covid-19 se aplicará ...,https://www.elmostrador.cl/dia/2020/12/17/pinera-anuncia-que-vacuna-contra-el-covid-19-se-aplicara-al-grueso-de-la-poblacion-critica-el-primer-trimestre-de-2021/,"Nuestro plan de vacunación contempla vacunar al grueso de la vacunación crítica durante el trimestre del año 2021 y también contempla vacunar a una parte de la población objetivo, durante el primer se",17-12-2020 18:03,https://www.bing.com/th?id=OVFT.0S3X782OuDJdOrEryQ7mBC,Chile,El Mostrador
Conjunto Graneros y Los Grillitos celebraron un nuevo ...,https://www.elrancaguino.cl/2020/12/17/conjunto-graneros-y-los-grillitos-celebraron-un-nuevo-aniversario/,"Dos grandes agrupaciones folclóricas de nuestra región, el Conjunto Infantil Los Grillitos y Graneros, cumplieron 52 y 54 años respectivamente,",17-12-2020 18:15,https://www.bing.com/th?id=OVFT.Jyy6PPUTuosMTV-rGIOUhy,Chile,elrancaguino.cl
Piñera anuncia que en los próximos días se inicia proceso ...,https://www.df.cl/noticias/economia-y-politica/politica/plan-de-vacunacion-compromete-aplicacion-de-20-millones-de-dosis-en-el/2020-12-17/144107.html,"Plan de vacunación compromete aplicación de 20 millones de dosis en el primer semestre de 2021. En el marco de la presentación de la “Ruta de la vacuna”, el mandatario dijo que el proceso se iniciará en las comunas más afectadas, como son Magallanes, La Araucanía y Biobío.",17-12-2020 18:21,https://www.bing.com/th?id=OVFT.KGYKFSu4VSL9wlZoZkNecy,Chile,df.cl
Piñera detalla plan de vacunación: Se comenzará por ...,http://www.lanacion.cl/pinera-detalla-plan-de-vacunacion-se-comenzara-por-trabajadores-de-las-uci-y-uti/,El Presidente Piñera realizó este jueves un punto de prensa en La Moneda para profundizar en el anuncio dado en función al proceso de vacunación contra el Covid-19 en el país. Luego de reafirmar que Chile recibirá un primer cargamento de 20 mil dosis de la vacuna Pfizer-BioNtech este mes-fue,17-12-2020 18:38,https://www.bing.com/th?id=OVFT.J33R3VI4C4hTdN7ViztaQy,Chile,La Nación
Nuevo informe del Minsal: Casos de Coronavirus aumentan un ...,https://www.chilevision.cl/contigo-en-la-manana/mejores-momentos/nuevo-informe-del-minsal-casos-de-coronavirus-aumentan-un-11-en-chile,Nuevo informe del Minsal: Casos de Coronavirus aumentan un 11% en Chile. Las autoridades del Ministerio de Salud reportaron un total de 1.998 y 48 muertes durante las últimas 24 horas.,17-12-2020 18:58,https://www.bing.com/th?id=OVFT.PnfaHYqL8lY1Y3NwoRXlmC,Chile,chilevision.cl
Europa supera el medio millón de muertos por covid-19 ...,https://www.biobiochile.cl/noticias/internacional/mundo/2020/12/17/europa-supera-el-medio-millon-de-muertos-por-covid-19-mientras-eeuu-evalua-una-segunda-vacuna.shtml,"Europa superó este jueves el medio millón de muertes a causa del coronavirus, la primera región del mundo en llegar a esa simbólica cifra, mientras que en Estados Unidos, el país más afectado, un comité de expertos estudiaba la aprobación de la vacuna del laboratorio Moderna. Desde octubre",17-12-2020 19:01,https://www.bing.com/th?id=OVFT.cbku_GNmtgI-mT9BMJewNS,Chile,Chile
Anafilaxia y parálisis de Bell: en qué consisten estas ...,https://www.latercera.com/que-pasa/noticia/anafilaxia-y-paralisis-de-bell-en-que-consisten-estas-reacciones-a-la-vacuna-contra-el-coronavirus-y-por-que-no-nos-deberian-preocupar/KWBVR6KEQ5ET7FVH4XBU7HAPGU/,"Anafilaxia y parálisis de Bell: en qué consisten estas reacciones a la vacuna contra el coronavirus, ... la vacuna contra el Covid-19 desarrollada por Pfizer/BioNTech. ... En Chile, hay alrededor de 5 mil casos al año ...",17-12-2020 19:11,https://www.bing.com/th?id=OVFT.COUI8TPxQYCrVcDwlE-yNy,Chile,LA TERCERA
El plan del Gobierno para distribuir 20 millones de ...,https://www.pauta.cl/nacional/plan-gobierno-distribuir-20-millones-de-vacunas-pfizer-sinovac-mitad-2021,"Este jueves 17 de diciembre al mediodía, el Presidente Sebastián Piñera presentó nuevos detalles sobre el plan de inoculación contra el Covid-19, asegurando que hasta ahora el Gobierno tiene, o está en etapas muy avanzadas de acuerdos para garantizar, 10 millones de dosis de vacunas BNT162B2",17-12-2020 19:54,https://www.bing.com/th?id=OVFT.npXELc1_HXGfqE6c2X75HS,Chile,pauta
Aplicación permite denunciar incumplimiento de medidas ...,https://eltipografo.cl/2020/12/aplicacion-permite-denunciar-incumplimiento-de-medidas-sanitarias-y-problemas-de-acceso-a-playas,"La herramienta para dispositivos móviles, también muestra las playas menos concurridas que con medidas de autocuidado, se pueden visitar, evitando las aglomeraciones.",17-12-2020 19:58,https://www.bing.com/th?id=OVFT.g9_6zcbuHchEpBheubULrC,Chile,eltipografo.cl
El Ciudadano | Contraloría abre sumario al Servicio de ...,https://www.elciudadano.com/chile/contraloria-abre-sumario-al-servicio-de-salud-metropolitano-oriente-por-millonario-pago-sin-respaldo-a-hotel-que-fungio-como-residencia-sanitaria/12/17/,La Contraloría constató que el Servicio de Salud Metropolitano Oriente no respaldó la procedencia del pago de la factura por un monto total de $109.896.500.,17-12-2020 20:03,https://www.bing.com/th?id=OVFT.VO08I9q2qjKqqX2wF44tpS,Chile,El Ciudadano
Informe ICovid: alertan de aumento de hospitalizaciones ...,http://www.lanacion.cl/informe-icovid-alertan-de-aumento-de-hospitalizaciones-por-coronavirus-en-el-pais/,"Paula Margozzini, epidemióloga y académica del Departamento de Salud Pública de la Pontificia Universidad Católica de Chile, enfatizó que se observa “un aumento persistente en el número de casos a niv",17-12-2020 20:16,https://www.bing.com/th?id=OVFT.ICoURH7gyN2wNNTIT1wCBS,Chile,La Nación
Número promedio de contagios de coronavirus aumentan en un ...,https://www.meganoticias.cl/nacional/321898-informe-icovid-aumentan-contagios-coronavirus-jrx07.html,"De acuerdo al último informe ICOVID Chile se registró un aumento en el número promedio de casos positivos diarios de coronavirus, en torno al 11%. También hay un crecimiento en hospitalizaciones.",17-12-2020 20:17,https://www.bing.com/th?id=OVFT.kYQBZgme0So328PQnMGFVC,Chile,meganoticias
Vacuna contra covid-19 de British American Tobacco recibe ...,https://www.biobiochile.cl/noticias/salud-y-bienestar/tratamientos/2020/12/17/vacuna-contra-covid-19-de-british-american-tobacco-recibe-aprobacion-para-hacer-ensayos-en-humanos.shtml,"Vacuna contra covid-19 de la tabacalera British American Tobacco recibe aprobación de EE.UU. para hacer ensayos en humano Se espera que la inscripción para el estudio comience en breve, con resultados",17-12-2020 20:18,https://www.bing.com/th?id=OVFT.CKTc2UBy7dzhUwcocfbR1i,Chile,Chile
Paris dice que cada hospital escogerá qué funcionario se ...,https://www.t13.cl/noticia/nacional/ministro-paris-vacuna-covid-pfizer-personal-salud-hospital-escogera-17-12-2020,"La vacuna contra el COVID-19 de Pfizer llegará a nuestro país la próxima semana, según las autoridades, y serán solo 20 mil dosis, por lo que solo algunos funcionarios de la salud, principalmente, ser",17-12-2020 20:30,https://www.bing.com/th?id=OVFT.NrlCmY6ab-az4SZoc7R8Uy,Chile,T13
ICOVID Chile: Aumentan hospitalizaciones ante incremento ...,https://www.radioagricultura.cl/nacional/2020/12/17/icovid-chile-aumentan-hospitalizaciones-ante-incremento-de-casos.html,"El equipo ICOVID Chile, iniciativa liderada por la Universidad de Chile, la Pontificia Universidad Católica de Chile y la Universidad de Concepción, presentó su informe número 19 con análisis y datos de las dimensiones propuestas para monitorear la pandemia en el país, con información obtenida hasta el sábado 12 de diciembre.",17-12-2020 20:35,https://www.bing.com/th?id=OVFT.QnOFHbhfe-RFwhQxTwMrjC,Chile,Radio Agricultura
