name,url,description,datePublished,imagen,pais,Fuente
La ONU dice que el coronavirus va a agudizar la hambruna ...,https://www.publimetro.cl/cl/noticias/2020/07/13/grave-pronostico-la-onu-coronavirus-va-agudizar-la-hambruna-mundial.html,"El número de personas que padece hambre aumentó en diez millones durante el último año, advirtió este lunes 13 de julio la ONU, que agregó que la pandemia de coronavirus podría acercar a otras 130 millones de personas a tan grave situación alimentaria en 2020. El sombrío panorama está",14-07-2020 15:44,https://www.bing.com/th?id=ON.DFD27F5D31C06D3A8E39EC9919C6FA6D,Chile,publimetro.cl
Ministro Paris: Salir de la cuarentena a un ...,https://www.cooperativa.cl/noticias/sociedad/salud/coronavirus/ministro-paris-salir-de-la-cuarentena-a-un-desconfinamiento-es-un-paso/2020-07-14/111802.html,"""Siempre vamos a coordinar con la autoridad local y territorial cualquier avance que queramos realizar en el futuro"", afirmó el secretario de Estado. Según el titular del Minsal, la pandemia en Chile",14-07-2020 15:44,https://www.bing.com/th?id=ON.A5A7C5DBFF2C210680E8F4B5A927C511,Chile,Radio Cooperativa
Chile registra 45 fallecidos y 1.836 nuevos contagiados ...,https://www.theclinic.cl/2020/07/14/chile-registra-45-fallecidos-y-1-836-nuevos-contagiados-por-covid-19-en-ultima-jornada/,"Durante el balance diario de este martes, el subsecretario de Redes Asistenciales, Arturo Zúñiga, informó que hasta ayer a las 21 horas Chile reportó 1.836 nuevos contagiados de Covid-19, con 1.444 pe",14-07-2020 15:45,https://www.bing.com/th?id=ON.D5DA17C023F083C1F80687FA31B6FB4E,Chile,Clinic
"Pudú, el robot de la U. de Chile que promueve la ...",https://www.biobiochile.cl/noticias/nacional/region-metropolitana/2020/07/14/pudu-robot-la-u-chile-promueve-la-teleasistencia-pacientes-aislados-covid-19.shtml,"La Universidad de Chile creó un robot que promueve la teleasistencia en pacientes aislados y la comunicación con sus familiares, manteniendo la distancia mediante telepresencia profesional. Se trata d",14-07-2020 15:46,https://www.bing.com/th?id=ON.F5A0F4D6CE6065A3CCF813F5382856A9,Chile,Chile
No nos olvidemos de ellos por la pandemia: Personas con ...,http://www.elquehaydecierto.cl/noticia/sociedad/no-nos-olvidemos-de-ellos-por-la-pandemia-personas-con-discapacidad-de-copiapo-reci,"Un total de 60 cajas que contienen 240 paquetes de pañales serán entregadas a personas con discapacidad de Copiapó. Esto debido a un trabajo colaborativo y una alianza público-privada, entre la secret",14-07-2020 15:49,https://www.bing.com/th?id=ON.179D4A54DA8B4464CBE8B004C9BA4A01,Chile,El Quehay Decierto
La triada pandémica no cesa de contagiar,https://www.elciudadano.com/columnas/la-triada-pandemica-no-cesa-de-contagiar/07/14/,El mundo debe estar preparado ante la próxima intensificación de los actos de violencia de Estados Unidos y dos de sus principales aliados en materia de violaciones a los derechos humanos y leyes inte,14-07-2020 16:18,https://www.bing.com/th?id=ON.9A19CEAFEB6F34C822F8AE8A95D4C42A,Chile,El Ciudadano
"Enrique Paris alaba preparación ante la pandemia: ""Yo creo ...",https://elpinguino.com/noticia/2020/07/14/enrique-paris-alaba-preparacion-ante-la-pandemia-yo-creo-que-manalich-lo-hizo-muy-bien-,"“Cuando la región (Metropolitana) esté sin cuarentena, recién ahí hay que empezar a hablar de desconfinamiento. Y para suspender la cuarentena también pueden haber otros períodos de transición, explic",14-07-2020 16:33,https://www.bing.com/th?id=ON.9145D297320325D43F306D487FEF7E83,Chile,ELPINGUINO
Subsecretario del Interior y nuevo carro lanzaaguas de ...,https://www.meganoticias.cl/nacional/307640-carro-lanzaaguas-carabineros-san-antonio-austriaca-rosenbauer-ministerio-interior-emx01.html,"El subsecretario del Interior, Juan Francisco Gallí, se refirió a la llegada del nuevo carro lanzaaguas de Carabineros, que la noche del lunes arribó al puerto de San Antonio, asegurando que este fue",14-07-2020 16:36,https://www.bing.com/th?id=ON.F7EE3B0865C2999D485EAB4844511AB7,Chile,meganoticias
"La SEC exige a eléctricas eliminar frase ""corte en trámite ...",https://www.publimetro.cl/cl/noticias/2020/07/14/la-sec-exige-electricas-eliminar-frase-corte-tramite-las-boletas.html,"La Superintendencia de Electricidad y Combustibles (SEC) exigió a las eléctricas la eliminación inmediata de la glosa “corte en trámite”, que ha estado apareciendo en las boletas de consumo eléctrico",14-07-2020 16:39,https://www.bing.com/th?id=ON.78B602B9DEF2BBDC65256DEB113782C7,Chile,publimetro.cl
Más de trece millones de personas en el mundo se han ...,https://www.elmostrador.cl/dia/2020/07/14/mas-de-trece-millones-de-personas-en-el-mundo-se-han-contagiado-con-coronavirus/,"El foco principal de la COVID-19 continúa en el continente americano, ya que, además de Estados Unidos y Brasil, entre los diez países con mayor número de casos figuran Perú, con 330.123 (quinto puest",14-07-2020 16:45,https://www.bing.com/th?id=ON.399B806E3B0DFB7BCF279EDE7E8A72C9,Chile,El Mostrador
"Chile suma 1.836 nuevos casos, la menor cantidad en dos ...",https://elpinguino.com/noticia/2020/07/14/chile-suma-1836-nuevos-casos-la-menor-cantidad-en-dos-meses-minsal-reporta-baja-semanal-del-15,"El Ministerio de Salud informó la mañana de este martes 1.836 casos nuevos por coronavirus, la cifra más baja en 63 días. “La mejoría continúa y la confirmación viene desde las propias cifras”, asegur",14-07-2020 16:48,https://www.bing.com/th?id=ON.4857EEB121A0CE9209965C36D9F30BEB,Chile,ELPINGUINO
FAO: 3 millones de chilenos padecen inseguridad ...,http://www.lanacion.cl/fao-3-millones-de-chilenos-padecen-inseguridad-alimentaria-moderada-o-severa/,"La Organización de las Naciones Unidas para la Alimentación y la Agricultura (FAO) lanzó este martes el informe sobre el estado de la seguridad alimentaria y la nutrición en el mundo (SOFI) 2020, dond",14-07-2020 17:00,https://www.bing.com/th?id=ON.E23351623C74BBC41DC823ABF9D4F9DA,Chile,La Nación
Violencia intrafamiliar en pandemia: Un problema ...,https://www.elciudadano.com/chile/violencia-intrafamiliar-en-pandemia-un-problema-estructural-abordado-a-partir-de-los-estereotipos/07/12/,"Por Marcelo Rioseco, Secretario General PH / El Covid-19 no solamente ha significado un problema sanitario de escala mundial, sino que ha impactado profundamente la forma de vida y de adaptación de la",14-07-2020 17:13,https://www.bing.com/th?id=ON.B19C565AED48B798D44296D57C89C74C,Chile,El Ciudadano
Chile superó las siete mil muertes y reporta la cifra más ...,https://www.elperiscopio.cl/destacado-1/chile-supero-las-siete-mil-muertes-y-reporta-la-cifra-mas-baja-de-contagios-desde-el-16-de-mayo/,"En la entrega del balance diario, el Ministerio de Salud informó que se reportaron 45 decesos inscritos ante el Registro Civil, lo que nos lleva a un total de 7.069 fallecidos durante la pandemia por",14-07-2020 17:18,https://www.bing.com/th?id=ON.C994E65D298EB34E44823F6D99C91293,Chile,elperiscopio.cl
Salir de la cuarentena a un desconfinamiento es “un paso ...,http://www.radioportales.cl/sitio/salir-de-la-cuarentena-a-un-desconfinamiento-es-un-paso-muy-lento/,"Al inicio de su balance diario de la pandemia del Covid-19 en Chile, el ministro de Salud, Enrique Paris, aseguró este martes que aspirar a un desconfinamiento es un proceso “muy lento”. El secretario",14-07-2020 17:52,https://www.bing.com/th?id=ON.56BABA0D92724AB412CD232B72941AE7,Chile,Radio Portales
El dólar en Chile hoy - Diario Financiero,https://www.df.cl/noticias/mercados/divisas/dolar-en-chile-sube-levemente-en-jornada-de-caida-del-cobre-pero-se/2020-07-14/082617.html,"Pese a tener viento a favor, las primeras operaciones del mercado cambiario chileno se muestran sin grandes variaciones, mientras los inversionistas  miran de cerca la evolución de las expectativas ec",14-07-2020 18:00,https://www.bing.com/th?id=ON.15749342E03CDD377367DE23E178FB0E,Chile,df.cl
U. Johns Hopkins: Coronavirus ya ha cobrado la ...,https://www.puranoticia.cl/noticias/internacional/u-johns-hopkins-coronavirus-ya-ha-cobrado-la-vida-de-573-000-personas/2020-07-14/102111.html,"Este martes, la Universidad Johns Hopkins dio a conocer su balance global en el que señaló que el Covid-10 ya superó los 13,1 millones de casos en todo el mundo con más de 573.000 víctimas mortales. E",14-07-2020 18:00,https://www.bing.com/th?id=ON.55F921FD78FED8AF91D80AAEBD4A2B0B,Chile,Puranoticia.cl
Cancelación de La Tirana pone en jaque la cultura en Tarapacá,https://www.lacuarta.com/espectaculos/noticia/cancelacion-de-la-tirana-visibilizaoscuro-panorama-que-enfrenta-la-actividad-cultural-en-tarapaca/522213/,La cancelación de La Tirana visibiliza una cadena económica seriamente dañada. Es el punto de encuentro más importante en términos socio económicos para la región. La fiesta de La Tirana fue cancelada,14-07-2020 18:07,https://www.bing.com/th?id=ON.3FD2BC4D2516232C2ABB467A2C12C2F8,Chile,La Cuarta
Presidente Piñera anuncia bono de $500 mil para ...,https://www.radioagricultura.cl/nacional/2020/07/14/presidente-pinera-anuncia-bono-de-500-mil-para-trabajadores-de-la-clase-media.html,"El Presidente Sebastián Piñera presentó este martes un plan para la clase media en el contexto de la pandemia del Covid-19, como un proyecto de alternativo al retiro de 10% de los ahorros de las AFP,",14-07-2020 18:40,https://www.bing.com/th?id=ON.8C9D20991F58BA86DAB9120747DB2028,Chile,Radio Agricultura
La otra “secuela” del Covid-19 - La Tercera,https://www.latercera.com/opinion/noticia/la-otra-secuela-del-covid-19/KVRY2553KVF6BFYNIPUCP6LWEQ/,"Es una verdad tan cotidiana, que la hemos pasado por alto. Las restricciones sanitarias han impactado fuertemente nuestras transacciones comerciales, sin importar el tamaño. Y, como en muchos otros ám",14-07-2020 18:42,https://www.bing.com/th?id=ON.FC89A1EE9D8EA98D8A43B831BF8D9F55,Chile,LA TERCERA
Universidad de Chile creó robot que promueve la ...,https://www.elperiodista.cl/universidad-de-chile-creo-robot-que-promueve-la-teleasistencia-en-pacientes-aislados/,"El proyecto fue liderado por la psicóloga Verónica Vargas-Araya, psicointensivista del Hospital Clínico de la Universidad de Chile, encargada del área de salud emocional de la Unidad de Pacientes Crít",14-07-2020 19:06,https://www.bing.com/th?id=ON.E43650B9075A06BC6ADA93CACFC1283D,Chile,El Periodista
Pudú: el robot que permite a pacientes internados por ...,https://www.latercera.com/que-pasa/noticia/pudu-el-robot-que-permite-a-pacientes-internados-por-covid-19-contacto-con-su-familia-y-personal-medico/SFOYRCB6TNBZBAI57UILWBCI5I/,"La tecnología y sus aplicaciones se suelen asociar a herramientas impersonales. Frías. Distantes. No permiten el valorado “cara a cara”. Pero hoy esa premisa, gracias al confinamiento por Covid-19, es",14-07-2020 19:20,https://www.bing.com/th?id=ON.F62914E84D8AB4DD4390E33CC7C40CCC,Chile,LA TERCERA
El sobregiro y sacrificio medioambiental de Chile y sus ...,https://www.biobiochile.cl/especial/aqui-tierra/noticias/2020/07/14/sobregiro-sacrificio-medioambiental-chile-vecinos-satisfacer-mercados.shtml,"La crisis mundial del coronavirus ha centrado la atención mediática de esta pandemia sin precedentes en la historia reciente. No obstante, mientras la humanidad está enferma, el planeta sufre la presi",14-07-2020 19:24,https://www.bing.com/th?id=ON.4DBC0BA7170DBBDECE4E0DA01169BD3D,Chile,Chile
María Luisa Godoy reveló que dos de sus hijas... | Puranoticia,https://www.puranoticia.cl/noticias/espectaculos/maria-luisa-godoy-revelo-que-dos-de-sus-hijas-tambien-dieron-positivo/2020-07-14/152449.html,"María Luisa Godoy retomó la conducción del matinal «Buenos Días a Todos» de TVN, tras cumplir con la cuarentena obligatoria debido a su contagio por Covid-19. Y previo a su regreso al programa, la periodista fue entrevistada por LUN, donde reveló que dos de sus hijas también dieron positivo",14-07-2020 19:31,https://www.bing.com/th?id=ON.307CCCAD8E24BB2F3AA729630783117D,Chile,Puranoticia.cl
Ministros de agricultura de América acuerdan posición en ...,http://www.diariolabrador.cl/ministros-de-agricultura-de-america-acuerdan-posicion-en-conjunto-para-la-activacion-agricola-post-pandemia/,"En su calidad de presidente del Consejo Agropecuario del Sur (CAS), el Ministro de Agricultura, Antonio Walker, participó de la reunión que juntó a los 34 ministros y secretarios de Agricultura de Amé",14-07-2020 19:34,https://www.bing.com/th?id=ON.3DB8C905AC80411F3EA0700C382BFB2D,Chile,El Labrador
Felipe Braun tras asentarse en el sur de Chile: “No quiero ...,https://www.radioagricultura.cl/entretencion/2020/07/14/felipe-braun-tras-asentarse-en-el-sur-de-chile-no-quiero-volver-hacer-nunca-mas-teleseries.html,"El actor nacional Felipe Braun se encuentra pasando la cuarentena del Covid-19 en el sur del Chile, en compañía de su familia. En este contexto, recientemente entregó una entrevista a Angélica Castro",14-07-2020 19:35,https://www.bing.com/th?id=ON.9413A38A814E340917E3775786F9D154,Chile,Radio Agricultura
Universidad de Chile y Ediciones SM ponen a disposición ...,https://www.uchile.cl/noticias/165243/u-de-chile-y-ediciones-sm-liberan-libros-gratis-para-estudiantes,"La colección ""Recursos para la Formación Inicial de Profesores de Educación Básica"" (ReFIP), del Centro de Modelamiento Matemático (CMM) de la Casa de Bello, se encuentra disponible en formato digital",14-07-2020 19:41,https://www.bing.com/th?id=ON.B553B3B446BCDE9650A41AC192F92D5E,Chile,uchile.cl
ODECU llama a beneficiarios a cobrar compensación del ...,https://www.elperiodista.cl/odecu-llama-a-beneficiarios-a-cobrar-compensacion-del-grupo-volkswagen-un-92-aun-no-ha-solicitado-el-pago-de-388-mil/,"ODECU llama a beneficiarios a cobrar compensación del Grupo Volkswagen: un 92% aún no ha solicitado el pago de $388 mil El primer balance del proceso fue realizado en el marco de la formalización del acuerdo de pago de $145 millones del grupo automotriz a la Fundación Las Rosas, que alcanzó ODECU en el marco de una demanda colectiva ...",14-07-2020 20:26,https://www.bing.com/th?id=ON.8D78325EDE61EA3256EC490B18F21902,Chile,El Periodista
Visor Covid-19 muestra casos activos por cuadrante en ...,http://www.ladiscusion.cl/visor-covid-19-muestra-casos-activos-por-cuadrante-en-nuble/,"El Ministerio de Bienes Nacionales anunció que ya es posible conocer la cantidad  de contagios activos por kilómetro cuadrado en la Región de Ñuble a través del Visor Territorial Covid-19, disponible",14-07-2020 20:30,https://www.bing.com/th?id=ON.BE1A0698C684CC52D8EAC0F6058F613D,Chile,La Discusión
