name,url,description,datePublished,imagen,pais,Fuente
Minsal reportó siete nuevos fallecidos por Covid-19 en las ...,https://www.cooperativa.cl/noticias/sociedad/salud/coronavirus/minsal-reporto-siete-nuevos-fallecidos-por-covid-19-en-las-ultimas-24/2020-04-12/121043.html,"Con esto, la cifra total de muertos por coronavirus llega a 80 en el país. Tres de cada 4 víctimas fatales tenían más de 70 años, según la estadística. La subsecretaria de Salud Pública, Paula Daza, informó de siete nuevas muertes producto del coronavirus en Chile, lo que eleva la cifra a",12-04-2020 19:17,https://www.bing.com/th?id=ON.F432E1F3A69B759883D97A5E4B4F1DA2&pid=News,Chile,Radio Cooperativa
"La Semana ""más dura"" del COVID-19 termina con 25.000 ...",https://www.minuto30.com/por-marcar/la-semana-mas-dura-del-covid-19-termina-con-25-000-muertes-en-america/1008151/,"El pasado 4 de abril el presidente de Estados Unidos, Donald Trump, advirtió que para su país esta semana sería ""la más dura"". El mandatario no se equivocó",13-04-2020 05:47,https://www.bing.com/th?id=ON.FCA7D14A94D751EAB7041B88CA7B5A76&pid=News,Chile,Minuto30
Coronavirus en tiempo real: La curva de contagios en Chile ...,https://www.t13.cl/noticia/nacional/evolucion-curva-coronavirus-chile-12-04-2020-actualizado,Un médico de la región del Maule fue el primer paciente cuyos exámenes por COVID-19 dieron positivos en Chile. El profesional de 33 años llegó al país proveniente de un viaje que incluyó varios destinos del sudeste asiático y el diagnóstico fue confirmado el 3 de marzo. Desde esa fecha se,12-04-2020 20:31,https://www.bing.com/th?id=ON.E516DCF0795386F0BBEAA432409F6AAD&pid=News,Chile,T13
Minsal reportó 80 nuevos fallecidos por Covid-19 en el ...,https://www.cooperativa.cl/noticias/sociedad/salud/coronavirus/minsal-reporto-80-nuevos-fallecidos-por-covid-19-en-el-pais/2020-04-12/121043.html,"Se sumaron siete nuevas víctimas fatales respecto al último balance. La subsecretaria de Salud Pública, Paula Daza, informó de siete nuevas muertes productos del coronavirus en Chile, lo que eleva la cifra a 80 decesos en el país desde el inicio de la pandemia. De las siete personas",12-04-2020 16:20,https://www.bing.com/th?id=ON.F432E1F3A69B759883D97A5E4B4F1DA2&pid=News,Chile,Radio Cooperativa
El espacio fiscal para el Covid-19 - La Tercera,https://www.latercera.com/pulso/noticia/el-espacio-fiscal-para-el-covid-19/TTCNH2WTJBCSLIUMBVBHEGGDAE/,"En el marco del segundo paquete económico anunciado por el gobierno para enfrentar los efectos en la economía del Covid-19, las autoridades económicas han señalado que, dado el alto déficit público proyectado para este año, el que alcanzaría un 8% del PIB, el espacio fiscal para nuevas",13-04-2020 00:21,https://www.bing.com/th?id=ON.8128CE9431ACF187398D0D46B1B0F038&pid=News,Chile,LA TERCERA
Minsal reporta un total de 80 fallecidos por coronavirus ...,https://www.eldinamo.com/nacional/2020/04/12/subsecretaria-reporta-un-total-de-80-fallecidos-por-coronavirus-en-chile/,"Minsal reporta un total de 80 fallecidos por coronavirus en Chile Pese a que también se levanta la cuarentena en algunas comunas, la autoridad de Salud explicó que se debe seguir respetando el toque de queda, el distanciamiento social, las aglomeraciones y evitar salir de la casa.",12-04-2020 16:49,https://www.bing.com/th?id=ON.84B71A797DFBACD785DC4CEF60A55087&pid=News,Chile,El Dinamo
Coronavirus en Chile: Muertes llegan a 80... | Puranoticia,https://www.puranoticia.cl/noticias/nacional/coronavirus-en-chile-muertes-llegan-a-80-personas-y-contagiados-son/2020-04-12/120846.html,"Coronavirus en Chile: Muertes llegan a 80 personas y contagiados son 7.213 personas. ... alcanzando las 80 muertes asociadas al covid-19 en el país. En cuanto a los fallecimientos, tres corresponden a la Región Metropolitana, mientras que Magallanes, Arica, Ñuble y Los Ríos registraron uno.",12-04-2020 16:10,https://www.bing.com/th?id=ON.959DFE804F99B2C92B68EF4FDD62547D&pid=News,Chile,Puranoticia.cl
Banco Mundial prevé que PIB de Chile caiga -3% en 2020 ...,https://laprensaaustral.cl/nacional/banco-mundial-preve-que-pib-de-chile-caiga-3-en-2020-producto-de-covid19/,"Banco Mundial prevé que PIB de Chile caiga -3% en 2020 producto de Covid19. Por La Prensa Austral domingo 12 de abril del 2020. Compartir esta noticia. Twittear. Visitas La región de América Latina y el Caribe (ALC) experimenta una caída brusca del crecimiento debido a la crisis del Covid-19 (coronavirus), ...",12-04-2020 19:58,https://www.bing.com/th?id=ON.4FB99D20F05FAF42D2C9C5A1AC87D4E4&pid=News,Chile,La Prensa Austral
Ricardo Lagos y crisis del COVID-19: Ha desnudado las ...,https://www.t13.cl/noticia/nacional/ricardo-lagos-se-muestra-favor-indultar-condenados-violacion-derechos-humanos,"Ricardo Lagos y crisis del COVID-19: Ha desnudado ""las desigualdades que hay en nuestras sociedades"" En entrevista con Mesa Central, el ex mandatario aplaudió la labor de los profesionales de la salud, aseguró que Chile tiene margen para endeudarse ante la crissi económica y sostuvo que no se atreve a darle consejos al Presidente Sebastián ...",12-04-2020 18:25,https://www.bing.com/th?id=ON.605E0C004815111789AB270CA9A8B1FF&pid=News,Chile,T13
Chile llega a los 80 fallecidos producto del coronavirus,https://www.lacuarta.com/cronica/noticia/chile-80-fallecidos-coronavirus/482926/,"Las autoridades de salud complementaron el balance del avance del Covid-19 en nuestro país. Durante esta mañana el presidente Piñera informó de 286 nuevos casos de coronavirus en nuestro país, siento un total de 7.212 casos. Horas después, la subsecretaria Paula Daza, complementó este balance",12-04-2020 21:01,https://www.bing.com/th?id=ON.18EFFA0DF90D5C27EB066CDE34371AF6&pid=News,Chile,La Cuarta
Confirman 7 nuevos fallecidos por Covid-19 en Chile | La ...,http://lanacion.cl/2020/04/12/confirman-7-nuevos-fallecidos-por-covid-19-en-chile/,"Confirman 7 nuevos fallecidos por Covid-19 en Chile Según el balance entregado por la subsecretaria de Salud Pública, Paula Daza, de las nuevas víctimas fatales de la enfermedad, uno corresponde a la región de Magallanes, uno de Arica-Parinacota, tres de la Metropolitana, uno de Ñuble y uno de Los Ríos.",12-04-2020 21:07,https://www.bing.com/th?id=ON.FBFE04BC90A2973EEA05858B303C6A75&pid=News,Chile,La Nación
COVID-19: más de 75.000 muertos en Europa | Euronews,https://es.euronews.com/2020/04/13/covid-19-mas-de-75-000-muertos-en-europa,"Mientras los cristianos de toda Europa celebraban la Pascua confinados, el continente más afectado por la pandemia superaba los 75.000 muertos. Aunque las cifras en Italia y España parecen estar ...",13-04-2020 05:45,https://www.bing.com/th?id=ON.057906496C18ED46AAB5138F7E850DDE&pid=News,Chile,Euronews
Coronavirus en Chile: informan que recién nacida y su ...,https://www.publimetro.cl/cl/noticias/2020/04/12/coronavirus-chile-informan-recien-nacida-madre-dan-positivo-temuco.html,"Coronavirus en Chile: ... Las autoridades de salud de la zona, revelaron que una madre y su bebé recién nacida dieron positivo a un test de covid-19 que se les aplicó. La lactante nació el 8 de abril pasado y de inmediato presentó síntomas de alguna afección respiratoria, ...",13-04-2020 03:09,https://www.bing.com/th?id=ON.9857A7048240507698917921C13816BC&pid=News,Chile,publimetro.cl
Víctimas fatales por Covid-19 en Chile aumentan a 80 personas,https://www.radioagricultura.cl/nacional/2020/04/12/victimas-fatales-por-covid-19-en-chile-aumentan-a-80-personas.html,"La subsecretaria de Salud, Paula Daza, reportó 286 nuevos casos con Covid-19 en el país, llegando a un total de 7.213 contagios. Además, detalló que hay 387 personas en cuidados intensivos y 328 están conectados a un ventilador mecánico. 78 de ellos están en condición crítica. En tanto",12-04-2020 15:58,https://www.bing.com/th?id=ON.3D87D0C1E38873A98BF1A90A58849E4B&pid=News,Chile,Radio Agricultura
Coronavirus en Chile: hotel O’Higgins funcionará a partir ...,https://www.publimetro.cl/cl/noticias/2020/04/12/coronavirus-chile-hotel-ohiggins-funcionara-partir-lunes-residencia-sanitaria.html,"Coronavirus en Chile: hotel O’Higgins funcionará a partir de este lunes como residencia sanitaria El recinto, albergará a pacientes diagnosticados con la enfermedad y que requieran cuidados especiales según su estado.",13-04-2020 03:58,https://www.bing.com/th?id=ON.01F58FFAAA4A55F806630BCB9A229745&pid=News,Chile,publimetro.cl
Coronavirus en Chile: hay 286 nuevos casos que suman un ...,http://lanacion.cl/2020/04/12/coronavirus-en-chile-hay-286-nuevos-casos-que-suman-un-total-de-7-213/,"El Covid-19 sumó 286 nuevos casos positivos en Chile, dejando un total de 7.213, informó en la mañana de este domingo el Presidente Sebastián Piñera. El Mandatario, junto al ministro de Salud Jaime Mañalich y el subsecretario de Redes Asistenciales Arturo Zúñiga, dio la puesta en marcha del renovado Hospital Clínico Félix Bulnes, en ...",12-04-2020 18:05,https://www.bing.com/th?id=ON.1502E019BE963B118A177EAEAEF0A3F3&pid=News,Chile,La Nación
Chile tiene 7.213 personas contagiadas de Covid-19 y debe ...,https://laprensaaustral.cl/nacional/chile-tiene-7-213-personas-contagiadas-de-covid-19-y-debe-lamentar-la-muerte-de-80-pacientes/,"Con 286 nuevos casos, Chile ya tiene 7.213 personas contagiadas con coronavirus y, en las últimas horas, debió lamentar el deceso de otros siete pacientes, seis de los cuales tenían otras enfermedades concomitantes. Esto eleva a 80 el número de los fallecidos asociados a esta enfermedad. Este",12-04-2020 17:58,https://www.bing.com/th?id=ON.12ADB9C471EEA19411898301D3BF955A&pid=News,Chile,La Prensa Austral
Predicciones de modelos matemáticos sobre la expansión en ...,https://www.elmostrador.cl/destacado/2020/04/12/predicciones-de-modelos-matematicos-sobre-la-expansion-en-chile-del-covid-19/,"Predicciones de modelos matemáticos sobre la expansión en Chile del Covid-19. ... Con la información pública al 28 de marzo, se puede esperar un máximo de contagiados por el coronavirus Covid-19 de 160.000 personas y con 2.188 nuevos contagios cada día, aproximadamente.",12-04-2020 15:22,https://www.bing.com/th?id=ON.2BF2845AF07353095F0785C23FA99BF6&pid=News,Chile,El Mostrador
Tres claves para el diseño de la campaña masiva del Covid-19,https://www.elmostrador.cl/noticias/opinion/2020/04/13/tres-claves-para-el-diseno-de-la-campana-masiva-del-covid-19/,El ministro de Salud confirmó la adquisición de los servicios para realizar una campaña de comunicación masiva en el contexto de la crisis del Coronavirus en Chile. Ante las reacciones negativas que han surgido en redes sociales criticando la inversión de 400 millones de pesos en una campaña,13-04-2020 05:20,https://www.bing.com/th?id=ON.338876CDC98CB754016BFD151AB9650C&pid=News,Chile,El Mostrador
