name,url,description,datePublished,imagen,pais,Fuente
Instituto Coreano de Investigación Polar ofrece pasantía ...,https://www.itvpatagonia.com/noticias/instituto-coreano-de-investigacion-polar-ofrece-pasantia-de-investigacion-antartica/,El Instituto Coreano de Investigación Polar (Kopri) invita a jóvenes investigadores de los principales países socios en investigación antártica -Chile y Nueva Zelandia- a postular a una beca para real,31-05-2020 01:50,https://www.bing.com/th?id=ON.A480787044C815CB2E9884984E389CF2,Chile,ITV
En Biobío aumenta la desocupación en medio de la crisis ...,https://www.latribuna.cl/los-angeles/2020/05/30/en-biobio-aumenta-la-desocupacion-en-medio-de-la-crisis-sanitaria.html,"Las cifras entregadas por el INE consideran la tasa de desocupación regional, no así la realidad provincial, donde el panorama está marcado por una merma en las actividades económicas, que ya venían e",31-05-2020 01:59,https://www.bing.com/th?id=ON.A7DF1E2DE36AEC6A72BD83FA93B4767B,Chile,La Tribuna
Chile quedó ad portas de los 1.000 muertos por coronavirus ...,https://www.latribuna.cl/destacados/2020/05/30/chile-quedo-ad-portas-de-los-1-000-muertos-por-coronavirus.html,"La subsecretaria Paula Daza fue la encargada de entregar las cifras que revelan que la cantidad de contagios se aproxima a las mil personas. Por Juvenal Rivera 30 de Mayo de 2020, a las 11:39 El nuevo",31-05-2020 01:59,https://www.bing.com/th?id=ON.137D36D3EAE8846F8B99EC62A60CEFD8,Chile,La Tribuna
"""Se necesita con urgencia un cambio de estrategia ...",https://www.publimetro.cl/cl/noticias/2020/05/30/expertos-pinera-carta.html,"Un grupo de 40 expertos, entre los que aparecen científicos, académicos, comunicadores y activistas, envió una carta abierta al Presidente Sebastián Piñera, en la que plantean la necesidad de realizar",31-05-2020 02:05,https://www.bing.com/th?id=ON.1003A904452C7C6415F0B683E45274BB,Chile,publimetro.cl
Posta Central aumenta a 110 sus camas críticas para ...,https://www.biobiochile.cl/noticias/nacional/region-metropolitana/2020/05/30/posta-central-aumenta-110-camas-criticas-pacientes-covid-19.shtml,"“La Posta Central, ícono de la salud de Chile, una vez más está respondiendo. Lo digo con alegría, porque nuestro personal se merece este reconocimiento”. Con esas palabras, el director del recinto, O",31-05-2020 02:15,https://www.bing.com/th?id=ON.537B089E94ACC889C5E28EFFEBC421F4,Chile,Chile
Hombre con COVID-19 fue encontrado muerto al interior de ...,https://www.lacuarta.com/cronica/noticia/fue-encontrado-muerto-al-interior-casa-macul/503857/,"Su cuerpo lleva nueve horas sin retirar y estaba a la espera de su examen de PCR. Un nuevo fallecido por COVID-19 se reveló hace pocos minutos. Un adulto mayor, de 86 años, falleció este mediodía al i",31-05-2020 02:15,https://www.bing.com/th?id=ON.C14E4AC4513407B1B50B2E1C7390DFC5,Chile,La Cuarta
72% respalda opción de delegar la gestión de la pandemia a ...,http://www.ladiscusion.cl/72-respalda-opcion-de-delegar-la-gestion-de-la-pandemia-a-las-municipalidades/,"A través de un estudio que midió la proactividad municipal durante la pandemia por Covid-19 , efectuado  entre el 22 y el 25 de mayo de 2020, se determinó que un 39 por ciento de los consultados está",31-05-2020 02:33,https://www.bing.com/th?id=ON.0F829482E17B0ADD9D3D1F0EC32D4610,Chile,La Discusión
Ministro del Interior comprometió «mejorar la percepción ...,http://www.radioportales.cl/sitio/ministro-del-interior-comprometio-mejorar-la-percepcion-de-la-seguridad-durante-este-2020/,"Este sábado y desde el palacio de La Moneda, el ministro del Interior Gonzalo Blumel declaro una cuenta publica de la cartera que dirige desde el pasado mes de octubre poniendo énfasis en la seguridad",31-05-2020 02:55,https://www.bing.com/th?id=ON.22991EE9D6D17B60AF5901688A7675ED,Chile,Radio Portales
Radio Valparaíso Cementerios de Valparaíso realizarán ...,http://www.radiovalparaiso.cl/2020/05/29/cementerios-de-valparaiso-realizaran-tours-virtuales-en-el-marco-del-dia-del-patrimonio/,"La emergencia sanitaria producto de la pandemia del Covid-19 implicó suspender las visitas a los 3 cementerios municipales de Valparaíso, para evitar mayor circulación de la población y posibles conta",31-05-2020 03:18,https://www.bing.com/th?id=ON.FDCCA8D26170E2C41DAD38ACB4EC7140,Chile,Radio Valparaiso
Especialistas advierten vulnerabilidad en hogares de ...,http://www.diarioelheraldo.cl/noticia/especialistas-advierten-vulnerabilidad-en-hogares-de-adultos-mayores-por-covid-19,"Esta semana la Seremi de Salud de la Región Metropolitana, Paula Labra, se refirió a los casos adultos mayores, víctimas fatales por COVID-19, reportadas por el Ministerio de Salud. La cifra, contabil",31-05-2020 03:43,https://www.bing.com/th?id=ON.D2193B0FB1F8FC9093EB4C335680E812,Chile,El Heraldo
"Tres meses, mil muertos: el perfil por comuna de las ...",https://www.latercera.com/la-tercera-domingo/noticia/tres-meses-mil-muertos-el-perfil-por-comuna-de-las-primeras-victimas-del-coronavirus-en-chile/I6LFGCVNCFFHPJ2KAWEG3PZETM/,"Tenemos que lamentar el primer fallecido en Chile por Covid-19. A las 14.16 horas del sábado 21 de marzo, y a través de su cuenta de Twitter, el ministro de Salud, Jaime Mañalich, informaba el primer",31-05-2020 03:52,https://www.bing.com/th?id=ON.3EAC7F591E750E79ACC63B5A6CB33707,Chile,LA TERCERA
Dos alcaldes menos y un municipio investigado: el mayo ...,http://www.ladiscusion.cl/dos-alcaldes-menos-y-un-municipio-investigado-el-mayo-negro-de-rn-en-nuble/,"Mayo comenzó de manera agitada para Renovación Nacional (RN) en la Región de Ñuble. En medio de la pandemia por Covid-19, el foco noticioso se trasladó a comienzos de mes hasta el municipio de Chillán, luego que fueran detenidos dos exfuncionarios (el exadministrador, Ricardo Vallejos, y el",31-05-2020 03:57,https://www.bing.com/th?id=ON.A7351F4C76294A11DCA5F95573E32315,Chile,La Discusión
"MagEx Starlet, el ""robot"" que llega a Magallanes para ...",https://www.biobiochile.cl/noticias/nacional/region-de-magallanes/2020/05/28/magex-starlet-robot-llega-magallanes-colaborar-combate-covid-19.shtml,"Este jueves se reportó la llegada a Punta Arenas de MagEx Starlet, un sistema automatizado diseñado para acelerar la detección de Covid-19. La máquina funciona autónomamente y detecta el virus mediant",31-05-2020 04:09,https://www.bing.com/th?id=ON.C41396EC6557EAE48D464069A21B16E9,Chile,Chile
Brechas de género se profundizarían y serían más evidentes ...,https://www.diarioconcepcion.cl/economia/2020/05/31/brechas-de-genero-se-profundizarian-y-serian-mas-evidentes-por-covid-19.html,"“Las brechas de género en este contexto de crisis sanitaria se hacen aún más evidentes y se profundizan”, afirma Lucía Saldaña, directora de la Dirección de Equidad de Género y Diversidad de la Univer",31-05-2020 04:16,https://www.bing.com/th?id=ON.119A79411DC62780A73E4203520B8E4A,Chile,El Diario de Concepcion
Cifras esperables: Autoridades explican la incidencia del ...,http://www.elquehaydecierto.cl/noticia/economia/cifras-esperables-autoridades-explican-la-incidencia-del-coronavirus-en-la-tasa-de-,"El Instituto Nacional de Estadística (INE) entregó la tasa de desocupados correspondiente al trimestre móvil febrero-marzo-abril 2020, es decir que la mitad del periodo de levantamiento de la encuesta",31-05-2020 04:21,https://www.bing.com/th?id=ON.0F91947679580FAE1288D3452739193A,Chile,El Quehay Decierto
Efecto Coronavirus: ¿Afectó a la pequeña minería de la ...,http://www.elquehaydecierto.cl/noticia/mineria/efecto-coronavirus-afecto-la-pequena-mineria-de-la-region-de-atacama,"El inicio de 2020 el área minería a nivel nacional se visualizaba de manera positiva gracias al anuncio de importantes proyectos, tales como Infraestructura Complementaria de Minera Los Pelambres (INC",31-05-2020 04:31,https://www.bing.com/th?id=ON.A91E7984131D046ED7AF3EB4C468B3F7,Chile,El Quehay Decierto
Tras su alta médica regresa a Santiago paciente de 30 años ...,http://www.elconcecuente.cl/noticia/salud/tras-su-alta-medica-regresa-santiago-paciente-de-30-anos-con-covid-19-trasladado-al-bi,"El sábado 16 de mayo se realizó uno de los primeros operativos aéreos de traslado de pacientes con coronavirus desde el Hospital Padre Hurtado en Santiago, al Hospital Guillermo Grant Bemavente de Con",31-05-2020 04:35,https://www.bing.com/th?id=ON.B9E6B85F42497C926FB6A0E3DDB81A55,Chile,El Conce Cuente
UCM aumenta su labor de apoyo para el diagnóstico regional ...,http://www.diarioelheraldo.cl/noticia/ucm-aumenta-su-labor-de-apoyo-para-el-diagnostico-regional-de-covid-19-ante-el-mayor-numero-de-casos-,"En respuesta al apoyo solicitado por la autoridad sanitaria, los investigadores coordinados por la Vicerrectoría de Investigación y Postgrado reforzarán los turnos para el diagnóstico del COVID-19 que",31-05-2020 04:40,https://www.bing.com/th?id=ON.D2193B0FB1F8FC9093EB4C335680E812,Chile,El Heraldo
Chile sumó más de 16 mil casos nuevos de Covid-19 en cinco ...,https://www.cooperativa.cl/noticias/sociedad/salud/coronavirus/chile-sumo-mas-de-16-mil-casos-nuevos-de-covid-19-en-cinco-dias/2020-05-30/223246.html,"Así lo arrojó el el Informe epidemiológico N° 21 del Minsal, que reconoce, por primera vez, que los ""casos recuperados"" no son personas recuperadas clínicamente. Hasta las 14:00 horas del 28 de mayo s",31-05-2020 04:56,https://www.bing.com/th?id=ON.56FA9ABB381FAADD436E5A866DC9705F,Chile,Radio Cooperativa
Los 10 rostros más expuestos en TV por la pandemia del ...,https://www.lacuarta.com/cronica/noticia/los-10-mas-expuestos-en-tv-por-la-pandemia/503834/,"En medio de la cobertura televisiva por la emergencia sanitaria, rostros nuevos y otros no tanto han tomado las vocerías para entregar claridad a la ciudadanía. Donaciones, información y trabajo en te",31-05-2020 05:13,https://www.bing.com/th?id=ON.4583E049FB68BFECE5294C14FC6A7BB9,Chile,La Cuarta
Los políticos del Bío Bío que se verían afectados por la ...,https://www.diarioconcepcion.cl/politica/2020/05/31/los-politicos-del-bio-bio-que-se-verian-afectados-por-la-retroactividad.html,Un polémico y álgido debate fue el que se vivió durante la semana en el Parlamento con el proyecto de ley que regula la reelección de autoridades. Es el numeral seis de la normativa el que generó mayo,31-05-2020 05:23,https://www.bing.com/th?id=ON.C728D184B1223789A1A59AD7503FDFB0,Chile,El Diario de Concepcion
30 años y el regreso de la pobreza - El Mostrador,https://www.elmostrador.cl/noticias/opinion/columnas/2020/05/31/30-anos-y-el-regreso-de-la-pobreza/,La peor pandemia en más de un siglo está causando un duro revés en una de las luchas socioeconómicas más significativas que se han librado en la historia de América Latina como es la reducción de la p,31-05-2020 05:34,https://www.bing.com/th?id=ON.2CC7C66502789A77C7EEFA9FB5A1CBCB,Chile,El Mostrador
Las cinco propuestas de la Mesa Covid-19 a La Moneda para ...,http://www.diariolabrador.cl/las-cinco-propuestas-de-la-mesa-covid-19-a-la-moneda-para-salir-de-crisis-economica-de-la-pandemia/,"La mesa social Covid-19 será la catalizadora de propuestas económicas para llevar adelante el acuerdo nacional al que convocó La Moneda y en la sesión de este viernes, según lo explicó el ministro del",31-05-2020 06:59,https://www.bing.com/th?id=ON.237973A7E562F3B074A3EC833FAA36C7,Chile,El Labrador
Informe Epidemiológico: Más de 3 mil niños menores de 10 ...,https://www.meganoticias.cl/nacional/303339-informe-epidemiologico-mas-3-mil-ninos-menores-10-anos-contagiados-coronavirus.html,"El último Informe Epidemiológico del coronavirus publicado por el Ministerio de Salud (Minsal), asegura que los niños menores de 10 años contagiados por el virus ascienden a más de 3.000 en todo el pa",31-05-2020 07:34,https://www.bing.com/th?id=ON.88971DE3C9DD9D9BC97FC7C0BDD494A5,Chile,meganoticias
Día Mundial Sin Tabaco: fumadores pueden desarrollar ...,http://www.lanacion.cl/dia-mundial-sin-tabaco-fumadores-pueden-desarrollar-sintomas-graves-en-caso-de-contagio-con-covid-19/,"Además de las enfermedades cardiovasculares, como los infartos al corazón y cerebrales, problemas en las arterias, aneurismas, ateromatosis, entre otras, la lista de problemas causados por el tabaco e",31-05-2020 12:03,https://www.bing.com/th?id=ON.439AD4205F56283E8566E6200034F3B6,Chile,La Nación
34 comunas no han registrado casos de covid-19 a casi tres ...,https://www.emol.com/noticias/Nacional/2020/05/31/987711/34-comunas-sin-casos-covid19.html,"Esta semana se cumplirán tres meses desde que se reportó el primer caso de covid-19 en el país y, si bien la enfermedad se ha propagado prácticamente en todos los rincones, aún hay 34 comunas que se m",31-05-2020 12:47,https://www.bing.com/th?id=ON.8F5AD582F30B2C4CEE6B4AB0B02B5046,Chile,Emol
Karla Rubilar dedica potente mensaje a Mañalich en medio ...,https://www.radioagricultura.cl/entretencion/2020/05/31/karla-rubilar-dedica-potente-mensaje-a-manalich-en-medio-de-polemica-por-posible-reemplazo.html,"La ministra vocera de Gobierno, Karla Rubilar, publicó un cariño mensaje en Instagram dedicado a su par de Salud Jaime Mañalich, en medio de la polémica que ambos protagonizaron por un “posible” reemp",31-05-2020 13:50,https://www.bing.com/th?id=ON.899574D204DB937FCB6096B28CB93173,Chile,Radio Agricultura
El alto riesgo de nuestros funcionarios de la salud ...,https://elpinguino.com/noticia/2020/05/31/el-alto-riesgo-de-nuestros-funcionarios-de-la-salud,"""En Magallanes hemos tenido a dos funcionarias en condición crítica por el Coronavirus"". La semana que cerramos hoy en sin duda una de las más tristes en lo que va de la pandemia del Coronavirus en Ch",31-05-2020 13:52,https://www.bing.com/th?id=ON.9632818428AD8110DA3D43F97E518197,Chile,ELPINGUINO
Informe epidemiológico revela que Puente Alto es la comuna ...,https://www.elmostrador.cl/dia/2020/05/31/informe-epidemiologico-revela-que-puente-alto-es-la-comuna-con-mas-casos-del-pais-y-que-hay-mas-de-tres-mil-menores-contagiados-de-coronavirus/,El Ministerio de Salud publicó el vigésimo primer Informe Epidemiológico sobre el Covid-19 en el país con información acumulada hasta las 14:00 horas del 28 de mayo de 2020. El documento reveló que 30,31-05-2020 14:07,https://www.bing.com/th?id=ON.F0E79D25C9FF1825F029ED2341F56EB6,Chile,El Mostrador
[Minuto a minuto] Detienen a 19 personas sorprendidas en ...,https://www.cnnchile.com/coronavirus/minuto-a-minuto-31-de-mayo_20200531/,"Según detalló Carabineros, entre los detenidos se encuentra el DJ, el organizador de la fiesta y al menos 3 de los detenidos son reincidentes, es decir, personas que ya han infringido con anterioridad",31-05-2020 14:52,https://www.bing.com/th?id=ON.C21240143D403351A15BE61C08805FA2,Chile,CNN Chile
Covid-19: Aparición temprana de enfermedades crónicas ...,https://www.latercera.com/que-pasa/noticia/covid-19-aparicion-temprana-de-enfermedades-cronicas-podria-aumentar-riesgo-de-portadores-de-vih/5ARQAXFIMBC5FIQL5QNWNFDBCQ/,La aparición temprana de enfermedades crónicas podría incrementar el riesgo de sufrir cuadros más severos de Covid-19 en personas portadoras del VIH mayores de 50 años. Esto es al menos 10 años que el,31-05-2020 15:38,https://www.bing.com/th?id=ON.C93D1DFB30CFAA4B2872CBEDB5915180,Chile,LA TERCERA
Día Mundial sin Tabaco: Fumadores tienen más... | Puranoticia,https://www.puranoticia.cl/noticias/nacional/dia-mundial-sin-tabaco-fumadores-tienen-mas-riesgo-de-contagiarse-de/2020-05-31/122123.html,"La coordinadora de la Comisión Tabaco de SER Chile sostuvo que ""este Día Mundial sin Tabaco tiene como lema proteger a los jóvenes de la manipulación de la industria y evitar que consuman tabaco y nic",31-05-2020 16:22,https://www.bing.com/th?id=ON.CBD0F9FFF770BDB3CE5AA9988D814613,Chile,Puranoticia.cl
Gobierno anuncia querella contra participantes de nueva ...,https://elpinguino.com/noticia/2020/05/31/gobierno-anuncia-querella-contra-participantes-de-nueva-fiesta-clandestina-en-santiago-centro-,"El subsecretario del Interior, Juan Francisco Galli. El subsecretario del Interior, Juan Francisco Galli, anunció este domingo que el Gobierno se querellará contra los participantes de una fiesta clan",31-05-2020 17:00,https://www.bing.com/th?id=ON.F14ABE521C50A8B77A76131A2377D44E,Chile,ELPINGUINO
