name,url,description,datePublished,imagen,pais,Fuente
La pandemia global y cuarentena agravan la crisis ...,https://elpinguino.com/noticia/2020/09/14/la-pandemia-global-y-cuarentena-agravan-la-crisis-economica-y-social-de-magallanes-,"A la crisis del turismo, se suma el cierre definitivo de Mina Invierno, la crisis de la centolla por falta de demanda, la caída generalizada de ventas y la pérdida de 18 mil empleos en un año, configu",14-09-2020 12:11,https://www.bing.com/th?id=ON.088FA68292B5A57101D0E449130D64E8,Chile,ELPINGUINO
Cómo abrieron los mercados internacionales - Diario Financiero,https://www.df.cl/noticias/mercados/mercados-en-accion/lo-que-debes-saber-este-lunes-antes-que-abra-el-mercado/2020-09-14/075523.html,"Una serie de anuncios de fusiones y adquisiciones, y el reinicio de las pruebas de una vacuna contra el Covid-19 impulsan el inicio de semana en los mercados. Las acciones tecnológicas lideran la sesi",14-09-2020 12:58,https://www.bing.com/th?id=ON.9080C7AE19316AD6E7AFE401EB69C52A,Chile,df.cl
Lluvias aumentaron en un 20% capacidad de los embalses,https://www.lacuarta.com/cronica/noticia/lluvias-aumentaron-20-capacidad-los-embalses/544739/,"San Isidro ha soltado a la fecha la mayor cantidad de agua desde 2005. Sin embargo, la crisis hídrica sigue presente en nuestro territorio, ya que aún estamos lejos de superar la sequía que nos afecta",14-09-2020 13:31,https://www.bing.com/th?id=ON.78A1BA55BB7C7B91F290D12E27B56654,Chile,La Cuarta
Minsal informó 1.685 nuevos casos y hay un total de 436 ...,https://www.adnradio.cl/nacional/2020/09/14/minsal-informo-1-685-nuevos-casos-y-hay-un-total-de-436-433-contagiados-con-covid-19-en-chile.html,"Durante la mañana de este lunes el Ministerio de Salud entregó a través de sus redes sociales un nuevo balance respecto del estado de la pandemia del coronavirus Covid-19 en Chile, informando que hubo",14-09-2020 14:16,https://www.bing.com/th?id=ON.0CC802395821D9254955C966F4FDA17C,Chile,ADN
Minsal: Chile supera la barrera de 12 mil personas ...,https://www.lacuarta.com/cronica/noticia/minsal-reporta-64-personas/544815/,"Además, durante las últimas 24 horas, se reportaron 1.685 nuevos contagios. En un nuevo reporte diario, el Ministerio de Salud confirmó 1.685 casos de COVID-19, de los cuales 1.064 corresponden a pers",14-09-2020 14:27,https://www.bing.com/th?id=ON.668D4CE5A2DE714678E0C15C33A0281C,Chile,La Cuarta
La cifra de fallecidos por Covid-19 en el mundo supera los ...,http://www.lanacion.cl/la-cifra-de-fallecidos-por-covid-19-en-el-mundo-supera-los-924-000/,La pandemia de nuevo coronavirus ha provocado al menos 924.968 muertos en el mundo desde que la oficina de la Organización Mundial de la Salud (OMS) en China dio cuenta de la aparición de la enfermeda,14-09-2020 14:34,https://www.bing.com/th?id=ON.3A9622512BC60EAAE307E915B75B920E,Chile,La Nación
Balance del Covid-19 en Chile: Reportan 1.685... | Puranoticia,https://www.puranoticia.cl/noticias/nacional/balance-del-covid-19-en-chile-reportan-1-685-casos-nuevos-y-otras-64/2020-09-14/111556.html,"La cifra total de personas que han sido diagnosticadas con el coronavirus en el país alcanza a las 436.433. De ese total, 16.695 pacientes se encuentran en etapa activa del virus. El Ministerio de Sal",14-09-2020 14:35,https://www.bing.com/th?id=ON.B9FAC6663F25FEF4D883FB102F8AE735,Chile,Puranoticia.cl
Crisis económica: Falabella busca una fórmula para dejar ...,https://www.cooperativa.cl/noticias/economia/empresas/grupos-economicos/crisis-economica-falabella-busca-una-formula-para-dejar-argentina/2020-09-14/111137.html,"El diario Clarín reporta que la empresa nacional trabaja quiere un ""socio estratégico"" e irse del vecino país. El grupo Falabella proyecta terminar la operación de sus 10 locales en Argentina, a raíz",14-09-2020 14:36,https://www.bing.com/th?id=ON.EA9DF5C2AF043C55A4B25D032D54EFD8,Chile,Radio Cooperativa
"Reporte diario: 1.685 nuevos casos Covid, con una ...",https://www.cooperativa.cl/noticias/sociedad/salud/coronavirus/reporte-diario-1-685-nuevos-casos-covid-con-una-positividad-de-5-17/2020-09-14/110550.html,"El Minsal reportó este lunes 64 fallecidos, para llegar a un total de 12.013. La cifra global de contagiados en el país ya alcanza a los 436.433. La positividad diaria de los exámenes PCR aplicados en",14-09-2020 14:36,https://www.bing.com/th?id=ON.A5737EF096E251052CD7387F9F71F423,Chile,Radio Cooperativa
Conoce los requisitos para ser voluntario de potencial ...,https://www.elperiodista.cl/conoce-los-requisitos-para-ser-voluntario-de-potencial-vacuna-de-la-puc-contra-el-covid-19/,"El rector de la Pontificia Universidad Católica (PUC) y miembro de la Mesa Social COVID-19, Ignacio Sánchez, se refirió a los avances en los estudios de la vacuna contra el coronavirus que se realizan",14-09-2020 14:42,https://www.bing.com/th?id=ON.89F19AAB37215A1436C0322168127272,Chile,El Periodista
Fallecidos Covid certificados por el DEIS superan los 12 ...,https://www.elperiodista.cl/fallecidos-covid-certificados-por-el-deis-superan-los-12-mil-en-chile/,"El Ministerio de Salud reporta 1.685 casos nuevos de COVID-19, de los cuales 1.064 corresponden a personas sintomáticas y 561 no presentan síntomas. Además, se registraron 60 test PCR Positivo que no",14-09-2020 14:42,https://www.bing.com/th?id=ON.9F47BFBE12F19F54F9000BB543F7DF6F,Chile,El Periodista
Un respiro en pandemia: realizan sesiones abiertas y ...,https://www.elmostrador.cl/agenda-pais/2020/09/14/un-respiro-en-pandemia-realizan-sesiones-abiertas-y-gratuitas-de-mindfulness-on-line/,"Como una manera de fomentar el autocuidado y reducir el estrés, que se ve intensificado en contexto de crisis, la U. Austral abrió la iniciativa de Mindfulness y Compasión en tiempos de Covid-19. Con",14-09-2020 14:57,https://www.bing.com/th?id=ON.649C03B00A300ECEFE0AC3F6E540B6F5,Chile,El Mostrador
"Universidades de Chile, Santiago, Valparaíso,... | Puranoticia",https://www.puranoticia.cl/noticias/nacional/universidades-de-chile-santiago-valparaiso-concepcion-y-de-la/2020-09-14/084532.html,A la Mesa Social Covid-19 fue presentado el informe elaborado por cinco universidades chilenas que busca exponer ciertas observaciones en torno a la necesidad de incorporar una perspectiva comunitaria,14-09-2020 15:00,https://www.bing.com/th?id=ON.70905CE6A2B81632A34D3DA3AC67B30A,Chile,Puranoticia.cl
Covid-19: Chile supera los 12 mil fallecidos y registra 1 ...,https://www.latribuna.cl/noticias/2020/09/14/covid-19-chile-supera-los-12-mil-fallecidos-y-registra-1-685-casso-nuevos.html,"A la fecha, 906 personas se encuentran hospitalizadas en Unidades de Cuidados Intensivos, de las cuales 689 están con apoyo de ventilación mecánica y 117 se encuentran en estado crítico de salud. En e",14-09-2020 15:01,https://www.bing.com/th?id=ON.21FCE6B3330DEDC83ECBA974EFB665A2,Chile,La Tribuna
Estudio: Chile es el tercer país con mayor afectación en ...,https://www.latercera.com/pulso/noticia/estudio-revela-que-chile-es-el-tercer-pais-con-mayor-afectacion-en-el-empleo-a-nivel-mundial/CLYW4YUXINGMBHCSK7TLK7TJAI/,"Unos 40 millones de empleos se han destruido a nivel mundial entre marzo y julio de este año como consecuencia del Covid-19, siendo Chile uno de los países más afectados en términos de porcentaje de empleos perdidos. Es esa es la conclusión a la que llegó la Cámara de Comercio de Santiago",14-09-2020 15:10,https://www.bing.com/th?id=ON.290EC3C7A102A44D98018C74F17AD6D5,Chile,LA TERCERA
Autoridad sanitaria decreta Cordón Sanitario para ...,http://web.elpatagondomingo.cl/2020/09/14/autoridad-sanitaria-decreta-cordon-sanitario-para-coyhaique-en-la-previa-de-fiestas-patrias/,"Este martes a partir de las 5:00 a.m. se aplicará la medida de manera indefinida. Este lunes, el Ministerio de Salud (Minsal) emanó la Resolución Exenta N°772 en la que resuelve un cordón sanitario pa",14-09-2020 15:11,https://www.bing.com/th?id=ON.E7BAE989A049356B034D2A05DA017483,Chile,EPD Noticias
Más de 16 mil pacientes con Covid-19 en Chile se ...,https://redbiobio.com/nacional/mas-de-16-mil-pacientes-con-covid-19-en-chile-se-encuentran-en-etapa,"Actualmente hay 906 ciudadanos en la Unidad de Cuidados Intensivos. En un nuevo informe sobre el Covid-19 en Chile, se reportaron 1.685 casos, de los cuales, 1.064 corresponden a personas sintomáticas",14-09-2020 15:56,https://www.bing.com/th?id=ON.AE2B58CD498EACF56FA8A13F6CC2283A,Chile,Red Bio Bio
Cinco universidades critican el plan “Fondéate en tu casa ...,http://www.lanacion.cl/cinco-universidades-critican-el-plan-fondeate-en-tu-casa-para-fiestas-patrias/,A la Mesa Social Covid-19 fue presentado el informe elaborado por cinco universidades chilenas que busca exponer ciertas observaciones en torno a la necesidad de incorporar una perspectiva comunitaria,14-09-2020 16:11,https://www.bing.com/th?id=ON.EEBCCE1BD98FCE6E62C1F41E4530B1E0,Chile,La Nación
Gran brecha educacional por culpa de enseñanza online ...,https://www.publimetro.cl/cl/noticias/2020/09/14/gran-brecha-educacional-por-culpa-de-ensenanza-online.html,"Los escolares y universitarios del país están de vacaciones, una pausa dieciochera en medio de la ""nueva normalidad educativa"" que han vivido desde hace medio año junto a sus profesores, padres y apod",14-09-2020 16:35,https://www.bing.com/th?id=ON.A3E1BBAC9B0FA2080AF5DA01EC24B013,Chile,publimetro.cl
Coyhaique suma seis nuevos casos de Covid-19,http://www.eldivisadero.cl/noticia-59507,"Coyhaique-. Tres nuevos casos de Covid-19 fueron informados este lunes por la Seremi de Salud, Alejandra Valdebenito. Se trata de personas que fueron estudiadas durante el fin de semana, muchas de ell",14-09-2020 16:49,https://www.bing.com/th?id=ON.08E0574C35FEE4E03068E3B3184E52FF,Chile,Diario el Divisadero
Informe de la CCS indica que Chile es el tercer país más ...,https://www.biobiochile.cl/noticias/nacional/chile/2020/09/14/informe-de-la-ccs-indica-que-chile-es-el-tercer-pais-mas-afectado-en-empleo-durante-la-pandemia.shtml,"Un reporte realizado por la Cámara de Comercio de Santiago sitúa a Chile como el tercer país donde el empleo se ha visto más afectado a nivel global, siendo sólo superado por otras dos economías latin",14-09-2020 17:02,https://www.bing.com/th?id=ON.5F14FC83D7E486469D3F03ADE0A1BD91,Chile,Chile
Ventiladores “made in Chile”: Cuatro prototipos quedan ...,https://www.latercera.com/la-tercera-pm/noticia/ventiladores-made-in-chile-cuatro-prototipos-quedan-certificados-y-se-inician-gestiones-para-exportar-a-latinoamerica/RRBMDZHANZBVFJ3WAI26HRYAAI/,"Fueron 35 los prototipos que participaron de la iniciativa ""Un respiro para Chile"" de los cuales cuatro pasaron todas las pruebas y lograron validar su funcionamiento en pacientes con Covid-19 hospita",14-09-2020 17:27,https://www.bing.com/th?id=ON.2F4A9C8A87262B01AB7DBA73D8F46549,Chile,LA TERCERA
Chile es el tercer país con mayor pérdidas de empleos en ...,https://www.df.cl/noticias/economia-y-politica/laboral-personas/estudio-de-la-ccs-ubica-a-chile-como-el-tercer-pais-con-mayor-perdidas/2020-09-14/101815.html,"Chile es el tercer país a nivel global que en magnitud ha registrado las mayores pérdidas de empleos con una caída de 20,9% entre marzo y julio, según un estudio elaborado por la Cámara de Comercio de",14-09-2020 17:37,https://www.bing.com/th?id=ON.A6A00B23536920758ABB7D8CC29925FE,Chile,df.cl
Coronavirus: Chile es el tercer país más afectado en ...,https://www.t13.cl/noticia/negocios/coronavirus-chile-tercer-pais-mas-afectado-empleo-estudio-14-09-2020,Un estudio de la Cámara de Comercio de Santiago plantea que unos 40 millones de empleos se han perdido a nivel global entre marzo y julio de este año a causa de la crisis del coronavirus COVID-19. Chi,14-09-2020 17:40,https://www.bing.com/th?id=ON.8532B0C00D7833F79948F3EFD8E2E66C,Chile,T13
Crisis social y territorial – La Discusión,http://www.ladiscusion.cl/crisis-social-y-territorial/,"Ventiladores, camas UCI, reconversión de camas, concentraron los esfuerzos del Gobierno durante los 100 primeros días de la Pandemia y, debemos reconocer, con buenos resultados si el objetivo era ampl",14-09-2020 17:47,https://www.bing.com/th?id=ON.B863F88BCFCD94E5CF03883F288B08BD,Chile,La Discusión
Más recursos para la atención primaria es clave en ...,http://www.ladiscusion.cl/mas-recursos-para-la-atencion-primaria-es-clave-en-trazabilidad/,Un diagnóstico preocupante es el que mantienen comunidades científicas frente a los datos de trazabilidad procedentes tanto del Ministerio de Salud como de otros organismos que complementan la informa,14-09-2020 17:47,https://www.bing.com/th?id=ON.2FA6E25A0E7527E800EE04F7DDEB171C,Chile,La Discusión
Covid-19 en Chile: 64 personas murieron en las últimas 24 ...,https://www.adnradio.cl/nacional/2020/09/14/covid-19-en-chile-64-personas-murieron-en-las-ultimas-24-horas-y-el-pais-supero-los-12-mil-decesos-confirmados-segun-el-deis.html,"El Ministerio de Salud informó este lunes que 64 personas murieron producto del Covid-19, en las últimas 24 horas, según el Departamento de Estadísticas e Información de Salud (DEIS). De acuerdo con e",14-09-2020 17:59,https://www.bing.com/th?id=ON.C4D1D41E96669E551C9DAD1EB91241C8,Chile,ADN
Coronavirus en tiempo real: La curva de contagios en Chile ...,https://www.t13.cl/noticia/nacional/14-septiembre-2020-curva-contagios-muertes-coronavirus-chile,Un médico de la región del Maule fue el primer paciente cuyos exámenes por COVID-19 dieron positivos en Chile. El profesional de 33 años llegó al país proveniente de un viaje que incluyó varios destin,14-09-2020 18:33,https://www.bing.com/th?id=ON.4EB3B6C9758AD1F69926470CD8ED2917,Chile,T13
Museo Nacional de Historia Natural se prepara para su ...,https://www.radioagricultura.cl/nacional/2020/09/14/museo-nacional-de-historia-natural-se-prepara-para-su-reapertura.html,"El Museo Nacional de Historia Natural es el más antiguo de Chile y este lunes cumplió 190 años desde que fuera fundado en 1830 por el naturalista francés Claudio Gay. Para conmemorar su aniversario, s",14-09-2020 18:55,https://www.bing.com/th?id=ON.D901580E8659703FB3E76CB85E76C331,Chile,Radio Agricultura
Chile forma parte de una lista negra de países ...,https://www.elperiscopio.cl/destacado-1/chile-forma-parte-de-una-lista-negra-de-paises-latinoamericanos-mas-afectados-por-el-covid-19/,"No cabe duda que los estragos que ha dejado la pandemia por coronavirus han sido muchísimos, sobre todo para la región Latinoamericana que hasta ahora ha sido la mas golpeada, donde solamente en la li",14-09-2020 18:55,https://www.bing.com/th?id=ON.85039DCECA09D720E81E01CC44938FF4,Chile,elperiscopio.cl
Chile superó las 12 mil muertes inscritas por causa del ...,https://www.prensafutbol.cl/367226-chile-supero-las-12-mil-muertes-inscritas-por-causa-del-coronavirus/,"El ministerio de Salud entregó el informe diario del COVID-19, el cual registró 64 fallecidos registrados durante el último día, lo que aumentó la cifra a 12.013 decesos desde la aparición del virus a",14-09-2020 18:59,https://www.bing.com/th?id=ON.C85A2F4F82D1C386CE79D60AB9E77554,Chile,Prensafútbol
Estudio posiciona a Chile como el tercer país del mundo ...,https://www.emol.com/noticias/Economia/2020/09/14/997880/Estudio-CCS-empleo-Chile-mundo.html,"Un estudio confeccionado por la Cámara de Comercio de Santiago (CCS), posicionó a Chile como el tercer país más afectado en términos de empleo en el mundo, producto de la pandemia de covid-19 que azot",14-09-2020 19:17,https://www.bing.com/th?id=ON.2BC729292C3128ED927AFEE6EDE1A923,Chile,Emol
Más de 7.500 almuerzos ha entregado la red de comedores ...,http://www.diariolaregion.cl/mas-de-7-500-almuerzos-ha-entregado-la-red-de-comedores-populares-en-los-ultimos-tres-meses-a-vecinos-de-coquimbo/,"Tierras Blancas, Parte Alta, Lomas del Sauce, El Culebron, San Juan, Punta Mira, Villa Talinay. La Rinconada, Coquimbo Oriente y Villa El Faro, son algunos de los sectores que forman parte de esta red",14-09-2020 19:25,https://www.bing.com/th?id=ON.81D5442B1A18B6901E8FED53D4CB0632,Chile,La Region
Al menos un 44% de chilenos está seguro de someterse al ...,https://www.elperiscopio.cl/destacado-1/al-menos-un-44-de-chilenos-esta-seguro-de-someterse-al-tratamiento-contra-el-covid-19/,Una nueva encuesta realizada por el grupo Pulso Ciudadano de Activa Research reveló este lunes que menos de la mitad de los chilenos está seguro de que se vacunaría contra el COVID-19 cuando se desarr,14-09-2020 19:41,https://www.bing.com/th?id=ON.4DBE26ED3974838368FE6B0D393A5214,Chile,elperiscopio.cl
“Fue un visionario”: Ministro Paris pone las manos al ...,https://www.elmostrador.cl/dia/2020/09/14/fue-un-visionario-ministro-paris-pone-las-manos-al-fuego-por-jaime-manalich-ante-acusacion-constitucional/,"""Quiero hacer una defensa cerrada de lo que hizo Jaime Mañalich"", añadió. ""Ayer quizás no fui lo suficientemente enfático, me centré en la diferencia de los poderes del Estado, pero creo que el minist",14-09-2020 20:02,https://www.bing.com/th?id=ON.4906EE896D68EA15AC8F44625474E25F,Chile,El Mostrador
