name,url,description,datePublished,imagen,pais,Fuente
"""La profunda crisis"" en la aviación: En qué están las ...",https://www.emol.com/noticias/Economia/2020/05/01/984778/Aerolineas-Chile-plan-reactivacion-operaciones.html,"SANTIAGO.- El golpe de la pandemia del coronavirus no ha sido parejo para todas las industrias del mundo. Así, las aerolíneas y el turismo han sido probablemente uno de los sectores más afectados y ho",01-05-2020 13:46,https://www.bing.com/th?id=ON.22052F88B7A12D16E4B01C01239F168B,Chile,Emol
Restorán La Dicha se prepara para reabrir - Diario Financiero,https://www.df.cl/noticias/empresas/industria/restoran-la-dicha-se-prepara-para-reabrir/2020-04-30/193245.html,"Fueron el segundo restorán de Santiago en cerrar sus puertas. El sábado 14 de marzo, los banqueteros Bagnara y Margozzini organizaron un matrimonio de 600 personas. El día antes se había decretado la",01-05-2020 13:51,https://www.bing.com/th?id=ON.248A78646DD7FCCF29F8124AB86707EB,Chile,df.cl
Imagen de Chile convoca encuentro virtual de marcas país ...,https://www.df.cl/noticias/economia-y-politica/pais/fundacion-imagen-de-chile-convoca-encuentro-virtual-de-marcas-pais-para/2020-04-30/184439.html,"Ante las negativas cifras de caída del turismo, inversiones y del intercambio comercial como consecuencia del coronavirus, la fundación Imagen de Chile, que promueve al país y su reputación en el extr",01-05-2020 13:54,https://www.bing.com/th?id=ON.F8DC279143A3057FD336164256850907,Chile,df.cl
Chile reporta enorme alza diaria: 888 nuevos casos de ...,https://www.biobiochile.cl/noticias/nacional/chile/2020/04/30/chile-reporta-enorme-alza-diaria-888-nuevos-casos-de-covid-19-en-24-horas-tras-cambio-en-criterios.shtml,"Los casos por coronavirus se dispararon en Chile, luego de que el Ministerio de Salud cambiara sus criterios e incluyera pacientes asintomáticos en sus balances diarios. Así, se registraron 888 nuevos",01-05-2020 14:06,https://www.bing.com/th?id=ON.3B16D3DA9C86F2890BD6535009C7EEC7,Chile,Chile
El fuerte relato de una enfermera chilena que estuvo 13 ...,https://www.emol.com/noticias/Nacional/2020/04/30/984630/Relato-enfermera-chilena-coronavirus.html,"Este es el caso de Marianela Vargas, enfermera de 59 años del Hospital de Urgencia Asistencia Pública (HUAP o ex Posta Central). Vivió intubada y en coma inducido por 13 días, hospitalizada por cerca",01-05-2020 14:17,https://www.bing.com/th?id=ON.C81E5E09C0F95B9DBA48CD9E5B80FA9B,Chile,Emol
El Tipógrafo » Trabajadores del Cobre se querellan contra ...,https://eltipografo.cl/2020/05/trabajadores-del-cobre-se-querellan-contra-expresidente-ejecutivo-de-codelco-por-cohecho/,"La Federación de Trabajadores del Cobre (FTC) interpondrá una querella criminal por cohecho en contra del expresidente ejecutivo de Codelco, Nelson Pizarro, en el marco de la indagatoria que ...",01-05-2020 14:19,https://www.bing.com/th?id=ON.17E5AF97DF50BCE5940686221CE1D6F3,Chile,eltipografo.cl
A 17 MIL 8 CASOS SE ELEVAN LAS CIFRAS DE CONTAGIADOS POR ...,http://radiopolar.com/noticia_157124.html,"612 ventiladores disponibles en el país (volvió a aumentar, por más equipos y baja de pacientes en ventilación)",01-05-2020 15:01,https://www.bing.com/th?id=ON.4D1EE2DDD616D2961F7BFA67DE316E57,Chile,Radio Polar
Casi mil nuevos contagios por COVID y 7 muertes en un día ...,https://www.prensafutbol.cl/353552-chile-informe-coronavirus-01-de-mayo-2020-covid19/,"El ministerio de Salud de Chile entregó el informe diario con el avance de contagios por coronavirus, cifra que subió en 985 en relación a las últimas 24 horas, con lo que se llegó a 17.008 diagnostic",01-05-2020 15:02,https://www.bing.com/th?id=ON.6A046FEE27A0CC30E789F4C2DA2E8924,Chile,Prensafútbol
Se registraron 7 nuevas muertes por coronavirus en Chile ...,https://www.adnradio.cl/nacional/2020/05/01/se-registraron-7-nuevas-muertes-por-coronavirus-en-chile-fallecidos-ya-suman-un-total-de-234.html,"El Ministerio de Salud informó que murieron 7 por coronavirus Covid-19 en las últimas 24 horas, con el reporte cerrado a las 21:00 horas del jueves 29 de abril. Con esta actualización, la cifra de fal",01-05-2020 15:07,https://www.bing.com/th?id=ON.467CCEF60BC1ECD67F16527590AE3503,Chile,ADN
"Covid-19 en Chile: Más de 17.000 contagiados, 234 muertos ...",https://www.elperiscopio.cl/destacado-1/covid-19-en-chile-mas-de-17-000-contagiados-234-muertos-y-985-nuevos-casos/,"Este viernes 01 de mayo, el Ministerio de Salud confirmó que en las últimas 24 horas se registraron 985 nuevos casos documentados de contagio por coronavirus, que elevan la cifra total a 17.008 person",01-05-2020 15:12,https://www.bing.com/th?id=ON.8DFCB74BF7826D9EFB5AE80F938082B0,Chile,elperiscopio.cl
"Covid-19 en Chile: Más de 17.000 contagiados, 234 muertos ...",https://www.cooperativa.cl/noticias/sociedad/salud/coronavirus/covid-19-en-chile-mas-de-17-000-contagiados-234-muertos-y-9-018/2020-05-01/105416.html,Ministerio de Salud confirmó que en las últimas 24 horas se registraron 985 nuevos casos y 7 fallecidos. El Ministerio de Salud confirmó este viernes que en las últimas 24 horas se registraron 985 nue,01-05-2020 15:15,https://www.bing.com/th?id=ON.8BA95BF568B6430C290D184F65ED7348,Chile,Radio Cooperativa
985 nuevos casos de Coronavirus en Chile: Es la ...,https://www.puranoticia.cl/noticias/nacional/985-nuevos-casos-de-coronavirus-en-chile-es-la-mas-alta-cifra-diaria-de/2020-05-01/112045.html,"El Ministerio de Salud informó que hasta las 21 horas de este jueves 30 de abril se produjeron 7 nuevas muertes por covid-19, con lo cual el número oficial de fallecidos subió a 234 a nivel nacional.",01-05-2020 15:22,https://www.bing.com/th?id=ON.56252F372E05FE1F6FC72217B1FF6FD4,Chile,Puranoticia.cl
Chile reportó 985 casos nuevos de coronavirus y sobrepasó ...,https://laprensaaustral.cl/nacional/chile-reporto-985-casos-nuevos-de-coronavirus-y-sobrepaso-los-7-mil-infectados/,"El ministro de Salud, Jaime Mañalich, informó que se reportaron 985 nuevos casos de coronavirus en Chile, de los cuales 882 corresponden a personas que han presentado síntomas asociados a la enfermeda",01-05-2020 15:42,https://www.bing.com/th?id=ON.9590BB42C368CC9488A7D2C26A09559C,Chile,La Prensa Austral
Covid-19: Gobierno reporta en total 17.008 contagiados a ...,https://www.radioagricultura.cl/nacional/2020/05/01/covid-19-gobierno-reporta-en-total-17-008-contagiados-a-nivel-nacional.html,"La ministro de Salud, Jaime Mañalich, informó que se registran 985 nuevos contagios por Covid-19 —882 con síntomas y 103 asintomáticos— sumando 17.008 casos a nivel nacional. Además, hasta el momento",01-05-2020 16:07,https://www.bing.com/th?id=ON.FF6AD46DCC7C71F9798A74DAD48E7881,Chile,Radio Agricultura
Gary Medel descarta un pronto retorno a Universidad ...,https://www.publimetro.cl/cl/grafico-chile/2020/05/01/gary-medel-descarta-pronto-retorno-universidad-catolica.html,"Los hinchas de Universidad Católica estaba ilusionados en el posible retorno de Gary Medel. En medio de la pandemia por el covid-19, un sitio web especializado en noticias del Bologna había asegurado",01-05-2020 16:09,https://www.bing.com/th?id=ON.25FE89E0C073D8D5B01BC23BB2AEBCD8,Chile,publimetro.cl
"La historia del Doctor de programa ""Caso... | Puranoticia",https://www.puranoticia.cl/noticias/espectaculos/la-historia-del-doctor-de-programa-caso-cerrado-que-se-contagio-con/2020-05-01/121405.html,"El famoso doctor cubano Misael González, ha vuelto a ser noticia, no por haber vuelto a Caso Cerrado, programa del cual formó parte hasta el 2018; sino por haber contraído coronavirus y lograr recuper",01-05-2020 16:15,https://www.bing.com/th?id=ON.800744F7423EA0B8647FBA73976253F6,Chile,Puranoticia.cl
"Mascarillas, de la necesidad a la banalidad - El Mostrador",https://www.elmostrador.cl/cultura/2020/05/01/mascarillas-de-la-necesidad-a-la-banalidad/,"El Covid 19 ha impuesto su uso obligatorio: en la calle, en los ascensores, transporte público y en todos los lugares donde exista un mínimo contacto con otras personas. La mascarilla llegó para queda",01-05-2020 16:15,https://www.bing.com/th?id=ON.AD3352B72EEDF3F1F949FECFCC551DF3,Chile,El Mostrador
"""Nos parece sumamente grave"": Sociedad de Epidemiólogos ...",https://www.publimetro.cl/cl/noticias/2020/05/01/grave-epidemilogos-sochepi-gobierno-oms-manalich-asintomaticos.html,"La Sochepi detalló en un comunicado que, en el reporte del 30 de abril de la OMS, el Gobierno sólo reportó 520 casos, y no los 770 que correspondían. ""Sociedad Chilena de Epidemiología solicita envío",01-05-2020 16:18,https://www.bing.com/th?id=ON.A078306B0181DBB00097ED8B5D70EFF0,Chile,publimetro.cl
Ventas de autos : Marcas optan por el comercio electrónico ...,https://www.elrancaguino.cl/2020/04/30/ventas-de-autos-marcas-optan-por-el-comercio-electronico/,La industria automotriz es una de las tantas que a nivel mundial se ha visto afectada por la propagación del Covid 19. Además se sabe que más del 80% de la cadena de suministro de automóviles del mund,01-05-2020 16:30,https://www.bing.com/th?id=ON.67F3450DE17FCF4392129E3439194267,Chile,elrancaguino.cl
"Rueda y jugadores de la Roja: “Son como el vino, la ...",http://triunfo.lanacion.cl/2020/05/01/rueda-y-jugadores-de-la-roja-son-como-el-vino-la-madurez-los-hace-mejores/,"Reinaldo Rueda entregó una singular frase en su nueva aparición en los medios durante la pandemia del Covid-19. En declaraciones a ESPN, el DT de la Selección chilena elogió a sus dirigidos al asegura",01-05-2020 17:13,https://www.bing.com/th?id=ON.56F85B72774ED1B3610ABDE9D29DCFB4,Chile,La Nación
Una más: trabajadores del Cobre se querellan contra ...,https://www.biobiochile.cl/noticias/nacional/chile/2020/05/01/una-mas-trabajadores-del-cobre-se-querellan-contra-expresidente-ejecutivo-de-codelco-por-cohecho.shtml,"La Federación de Trabajadores del Cobre (FTC) interpondrá una querella criminal por cohecho en contra del expresidente ejecutivo de Codelco, Nelson Pizarro, en el marco de la indagatoria que lleva la",01-05-2020 17:16,https://www.bing.com/th?id=ON.74ECBA55BF038DA69C37F1C8D144818E,Chile,Chile
Coronavirus en Chile: muertes y contagiados por COVID-19 ...,https://www.t13.cl/noticia/nacional/coronavirus-chile-nuevas-muertes-contagiados-covid-19-01-05,"Este viernes, el Gobierno entregó una nueva cuenta diaria sobre la evolución del coronavirus en Chile. En esa línea, se confirmó que 7 murieron en las últimas 24 horas producto del COVID-19 y, además,",01-05-2020 17:46,https://www.bing.com/th?id=ON.BF1AA6EA3E7B4399D92CE1D3FC3669C9,Chile,T13
Carabineros confirmó detención de manifestante con Covid ...,https://www.adnradio.cl/nacional/2020/05/01/carabineros-confirmo-detencion-de-manifestante-con-covid-19-positivo-en-manifestacion-de-plaza-baquedano.html,"Esta tarde, incidentes entre manifestantes y Carabineros se produjeron en Plaza Baquedano, luego de que un grupo aproximado de 50 personas intentaran protestar en medio de la conmemoración de un nuevo",01-05-2020 18:00,https://www.bing.com/th?id=ON.94C195110A5C0BA11C40D8468A657D74,Chile,ADN
1 de Mayo en pandemia: La realidad del trabajo precario en ...,https://www.elciudadano.com/chile/1-de-mayo-en-pandemia-la-realidad-del-trabajo-precario-en-chile/05/01/,Editorial Boletín Fundación SOL / Estamos ante una nueva conmemoración del 1° de mayo y esta vez será diferente; no podremos salir a marchar masivamente como lo hemos hecho siempre debido a la pandemi,01-05-2020 18:21,https://www.bing.com/th?id=ON.5A8B596FC1944B7EB3D4D00C1FD4D203,Chile,El Ciudadano
Nuevos casos de Covid-19 en Chile se disparan a casi 1000 ...,https://www.elmostrador.cl/noticias/pais/2020/05/01/nuevos-casos-de-covid-19-en-chile-se-disparan-a-985-y-manalich-atribuye-el-alza-al-aumento-de-test/,"El Ministerio de Salud confirmó este viernes que en las últimas 24 horas se registraron 985 nuevos casos documentados de contagio por coronavirus, que elevan la cifra total a 17.008 personas desde el",01-05-2020 18:24,https://www.bing.com/th?id=ON.0585184F93FA892698A58B7CAFC0CDE4,Chile,El Mostrador
Una estaba contagiada con COVID-19: Carabineros detuvo a ...,https://www.t13.cl/noticia/nacional/una-estaba-contagiada-covid-19-carabineros-detuvo-57-personas-plaza-italia-protestas,"Carabineros de Chile confirmó que detuvo a 57 personas que protagonizaron manifestaciones en Plaza Baquedano en Santiago durante este viernes por el Día Internacional del Trabajador, de las cuales una",01-05-2020 18:26,https://www.bing.com/th?id=ON.C6DF776E6D9C1AB8D06DBAB5DDAC38D7,Chile,T13
Gobierno reporta en total 17.008 contagiados a nivel ...,https://www.radioagricultura.cl/nacional/2020/05/01/gobierno-reporta-en-total-17-008-contagiados-a-nivel-nacional-por-covid-19.html,"La ministro de Salud, Jaime Mañalich, informó que se registran 985 nuevos contagios por Covid-19 —882 con síntomas y 103 asintomáticos— sumando 17.008 casos a nivel nacional. Además, hasta el momento",01-05-2020 18:34,https://www.bing.com/th?id=ON.FF6AD46DCC7C71F9798A74DAD48E7881,Chile,Radio Agricultura
Walmart busca socio o comprador para su negocio en ...,https://www.latercera.com/pulso/noticia/walmart-busca-socio-o-comprador-para-su-negocio-en-argentina/VS2LOOUK5NDXRPGJL3WG7CITRQ/,"En medio de la crisis sanitaria por el coronavirus, Walmart puso a la venta o busca socio para su negocio en Argentina, según informa La Nación. La cadena de supermercado más grande del mundo y con pr",01-05-2020 18:45,https://www.bing.com/th?id=ON.E75256F6FDF7573379785D87B279D51B,Chile,LA TERCERA
Mesa de Datos Covid-19: Ministro de Ciencia “lamenta ...,https://www.latercera.com/politica/noticia/mesa-de-datos-covid-19-ministro-de-ciencia-lamenta-congelamiento-de-participacion-del-imfd-y-destaca-funcionamiento-de-la-instancia/RL7QLJU4T5D6LDYXHRWCZSK2AA/,Una “falta de información abierta de datos de salud que permitan hacer el trabajo comprometido”. Así justificó ayer el Instituto Milenio Fundamentos de los Datos (IMFD) la decisión de congelar su part,01-05-2020 18:58,https://www.bing.com/th?id=ON.032617BFC928D88ADA02D41F7943439F,Chile,LA TERCERA
"Medel: “Regresaré a Chile al final de mi carrera, aún no ...",http://triunfo.lanacion.cl/2020/05/01/medel-regresare-a-chile-al-final-de-mi-carrera-aun-no-es-el-momento/,"Los hinchas de Universidad Católica estaban ilusionados en el posible retorno de Gary Medel. En medio de la pandemia por el Covid-19, el portal web 1000cuorirossoblu (especializado en noticias del Bol",01-05-2020 19:18,https://www.bing.com/th?id=ON.B933BDF9F3C7FF9096304DD1210195AF,Chile,La Nación
Restricciones por Covid-19 han aumentado 20 por ciento el ...,https://www.cooperativa.cl/noticias/sociedad/salud/coronavirus/restricciones-por-covid-19-han-aumentado-20-por-ciento-el-trafico-de-voz/2020-05-01/150754.html,También se ha generado un alza en la carga sobre redes Wifi en comparación con el 3G y 4G. El coronavirus está cambiando la forma en que vivimos y también la forma en que nos conectamos. El aislamient,01-05-2020 19:28,https://www.bing.com/th?id=ON.50BF9440B871DB12938D4120EA81E3A2,Chile,Radio Cooperativa
