name,url,description,datePublished,imagen,pais,Fuente
"Informe que defiende ""nueva normalidad"" proyecta en 2 a 3 ...",https://www.emol.com/noticias/Nacional/2020/04/22/983824/Informe-nueva-normalidad.html,"Un informe interno del Gobierno contiene parte de la estrategia del Ejecutivo ante el covid-19. El texto, al que accedió ""El Mercurio"", se denomina ""La nueva normalidad, nueva etapa en el combate al coronavirus"". En el documento se establece una proyección respecto del peak de contagios, el que se",22-04-2020 15:21,https://www.bing.com/th?id=ON.929C1E366775F435DFC476DB9AAF9901,Chile,Emol
Tasa de letalidad por covid-19 en Chile se mantiene baja ...,https://www.emol.com/noticias/Nacional/2020/04/22/983897/Tasa-letalidad-coronavirus-Chile.html,"Tasa de letalidad por covid-19 en Chile se mantiene baja respecto a otros países, pero crece y ya llega a 1,4 Experto explica que los contagios en el país hasta ahora se han centrado en la población más joven y que, a medida que se extiendan a grupos de mayor edad, la letalidad podría aumentar.",23-04-2020 00:34,https://www.bing.com/th?id=ON.737EDFD0A2F089A5280111C8CC56D93A,Chile,Emol
Cifra total de contagiados con coronavirus... | Puranoticia,https://www.puranoticia.cl/noticias/nacional/cifra-total-de-contagiados-con-coronavirus-llega-a-11-296-personas-tras/2020-04-22/113538.html,"De igual forma, 399 personas se encuentran hospitalizadas en Unidades de Cuidados Intensivos (UCI), de las cuales 309 están conectadas a ventilación mecánica. 464 son los casos nuevos diagnosticados con coronavirus Covid-19 en Chile, con lo que la cifra total de contagiados asciende a 11.296",23-04-2020 00:38,https://www.bing.com/th?id=ON.BBB06948D847B8B0DFC58B37F42D1556,Chile,Puranoticia.cl
Alentador parte médico de Pato Frez: espera por carnet ...,https://www.lacuarta.com/espectaculos/noticia/pato-frez-coronavirus/486533/,"“Falta un examen final, de sangre obviamente, después estoy 14 días, en mi casa en cuarentena total"", fueron algunas de las palabras del comunicador. Hace algunos días, les contábamos sobre el difícil momento que vive el reconocido comunicador, Pato Frez, contrajo coronavirus en plena lucha",23-04-2020 00:53,https://www.bing.com/th?id=ON.9A31A5230A54EC1C991D351C15874AD8,Chile,La Cuarta
Jean Paul Luksic ve “impacto significativo” del ...,https://www.latercera.com/pulso/noticia/jean-paul-luksic-ve-impacto-significativo-en-mercado-del-cobre-por-coronavirus/C5UNTDXPOJCXRFCWZULNEOBKY4/,"Un impacto significativo en la demanda de cobre es lo que ve el presidente de Antofagasta plc, Jean Paul Luksic, producto de la propagación del coronavirus en el mundo. El empresario señaló en el reporte anual de la compañía, publicado en Londres el pasado 14 de abril, que el brote del virus",23-04-2020 00:55,https://www.bing.com/th?id=ON.6210033E0E62BB3CD11B21D81A563130,Chile,LA TERCERA
Montillo y la muerte de su padre por coronavirus: “A veces ...,https://www.adnradio.cl/deportes/2020/04/22/montillo-y-la-muerte-de-su-padre-por-coronavirus-a-veces-la-vida-golpea.html,"En conversación con El Mercurio, el volante de Universidad de Chile, Walter Montillo, habló acerca de la muerte de su padre, quien falleció producto del coronavirus Covid-19. Al respecto, expresó el dolor que ha significado la situación, más en el contexto actual en vista de los confinamientos",23-04-2020 01:24,https://www.bing.com/th?id=ON.D120F08D39E979940B21D0F263A0CA62,Chile,ADN
Nahuel Pennisi volverá a Chile con un concierto el sábado ...,https://www.adnradio.cl/conciertos/2020/04/21/nahuel-pennisi-volvera-a-chile-con-un-concierto-el-sabado-3-de-octubre.html,"Nahuel Pennisi volverá a Chile con un concierto el sábado 3 de octubre. ... considerando que solo existe una estimación de cuanto podría durar el coronavirus Covid-19. De esta forma, varios artistas han anunciado nuevas fechas en nuestro país.",23-04-2020 01:24,https://www.bing.com/th?id=ON.FBFAF4885E06649E28103B84B254DD12,Chile,ADN
"Roberto Díaz, presidente del Curtis Institute: “Todos ...",https://www.latercera.com/culto/2020/04/22/roberto-diaz-presidente-del-curtis-institute-todos-conocemos-el-poder-de-la-musica-y-encontramos-consuelo-en-ella/,"Con las salas de concierto cerradas por el Covid-19, la música clásica ha convertido a Internet en su nuevo escenario. Proliferan las actuaciones en live streaming, los archivos históricos y experimentaciones a la distancia, y en esta pandemia musical también hay reflexión online. El ciclo",23-04-2020 01:48,https://www.bing.com/th?id=ON.A3D331475F96FF64A3874B88E21EF63A,Chile,LA TERCERA
"La Peste realizará lanzamiento virtual de 4S, un proyecto ...",https://www.elciudadano.com/cultura-2/la-peste-realizara-lanzamiento-virtual-de-4s-un-proyecto-inspirado-en-el-proceso-de-la-unidad-popular/04/22/,"Este viernes 24 de abril, a las 19:00 horas, el Centro de Investigación Teatro La Peste realizará a través de su cuenta en Instagram (@teatrolapeste) el lanzamiento virtual del proceso creativo que próximamente dará vida a su nueva obra 4S. El montaje se inspira en el proceso de la Unidad",23-04-2020 02:15,https://www.bing.com/th?id=ON.6DA41839DE5F68CCDB906D0B7AA51A44,Chile,El Ciudadano
DESCARTADO CONTAGIO DE COVID-19 EN INTERNO DE LA CÁRCEL DE ...,http://radiopolar.com/noticia_156941.html,"La dirección regional de Gendarmería en la región de Magallanes informa a la opinión pública que el interno condenado de la cárcel de Punta Arenas que se encontraba aislado en la sección de enfermería del Complejo Penitenciario (CP), y que fuera derivado el pasado viernes 17 de abril desde",23-04-2020 02:22,https://www.bing.com/th?id=ON.DC079F8ABF2D2B63E4EFEF886693D9FE,Chile,Radio Polar
IVª BRIGADA AÉREA TRASLADÓ A PACIENTES RECUPERADOS DE ...,http://radiopolar.com/noticia_156945.html,"Una tripulación del Grupo de Aviación N°6 de la IVª Brigada Aérea realizó el traslado de pacientes recuperados de COVID-19, quienes pudieron retornar a sus hogares en Puerto Williams, tras haber recibido atención médica en el Hospital Clínico Magallanes (HCM) de Punta Arenas. Las personas",23-04-2020 02:22,https://www.bing.com/th?id=ON.EC71FD6FE401E16750210AF210A7CD50,Chile,Radio Polar
13 personas fallecieron el último día a causa... | Puranoticia,https://www.puranoticia.cl/noticias/nacional/13-personas-fallecieron-el-ultimo-dia-a-causa-de-la-pandemia-en-chile/2020-04-22/114711.html,"13 personas fallecieron las últimas 24 horas a causa del coronavirus Covid-19 en Chile, con lo que la cifra total de víctimas fatales asciende a 160 personas. Así lo dio a conocer el subsecretario de Redes Asistenciales, Arturo Zúñiga, en el marco del reporte diario de la contigencia sanitaria, ...",23-04-2020 02:22,https://www.bing.com/th?id=ON.C7202442B30CD1C7994B762A60B3986D,Chile,Puranoticia.cl
Nancagua aprueba Ordenanza de uso obligatorio de ...,https://www.elrancaguino.cl/2020/04/22/nancagua-aprueba-ordenanza-de-uso-obligatorio-de-mascarillas-en-espacios-publicos/,"F.A.F . Este martes 21 de abril en sesión extraordinaria remota del Concejo Municipal, y presidida por el Alcalde, Eduardo Escanilla Gaete, se aprobó la Ordenanza Municipal Sobre Uso de Mascarillas en el contexto del brote Covid-19, en el espacio público de la comuna de Nancagua.",23-04-2020 02:48,https://www.bing.com/th?id=ON.28D19B116B469A30C1BF47FB910E75C6,Chile,elrancaguino.cl
La prisión no es una panacea - eldivisadero.cl,http://www.eldivisadero.cl/redac-56595,"La crisis sanitaria que vive nuestro país nos ha obligado como nunca antes a mirar la realidad de nuestras cárceles y las condiciones en que se encuentran, en su interior, los más de 42.000 presos y presas que existen actualmente en Chile. Los esfuerzos interinstitucionales que hemos podido",23-04-2020 04:00,https://www.bing.com/th?id=ON.C80C9184BDBB0D16E0ED63DB828B4F18,Chile,Diario el Divisadero
La receta tras el inesperado protagonismo del ministro ...,https://www.radiosantiago.cl/archivo/127774,"Así, el secretario de Estado ha acompañado las iniciativas del Gobierno, como el bono Covid-19 y el Proyecto Ingreso Familiar de Emergencia, con explicaciones en redes sociales y con su constante participación en programas de televisión, espacios donde ha salido a la pizarra cada vez que ha sido requerido.",23-04-2020 04:18,https://www.bing.com/th?id=ON.9C74AFBB9760E917BA3B314C553BB7D5,Chile,Radio Santiago
"Montillo: ""La vida golpea, pero hay que seguir y ponerle ...",https://www.prensafutbol.cl/352685-montillo-la-vida-golpea-pero-hay-que-seguir-y-ponerle-el-pecho/,"Montillo: «La vida golpea, pero hay que seguir y ponerle el pecho» Walter Damián Montillo sufrió la pérdida de su padre y abuelo a causa del coronavirus, por eso ahora quiere mantenerse fuerte anímicamente para acompañar a su familia.",23-04-2020 04:25,https://www.bing.com/th?id=ON.C134AAE381A5229685022AEEA7EB1A80,Chile,Prensafútbol
SimRacing en Esports 13: Llegó la hora de Carrera Cup Chile,https://www.13.cl/esports/articulos/simracing-en-esports-13-llego-la-hora-de-carrera-cup-chile,"La carrera invitacional reunirá a más de 20 pilotos nacionales e internacionales en el clásico circuito de Daytona. Comienza a calentar motores para el invitacional de Carrera Cup Chile, donde los participantes deberán demostrar su talento y habilidad en el Porsche 911 GT3 y quedarse con la",23-04-2020 04:54,https://www.bing.com/th?id=ON.9122A5FC3F93D80E4486855DB8543053,Chile,13.cl
Una nueva amenaza a la supervivencia del pueblo yagán - El ...,https://www.elmostrador.cl/destacado/2020/04/23/una-nueva-amenaza-a-la-supervivencia-del-pueblo-yagan/,"La comunidad yagán de Puerto Williams está enfrentando hoy, por el COVID-19, una nueva amenaza a su supervivencia. Con una población de 94 personas, esta comunidad habita hoy en esa localidad ubicada en la Isla de Navarino, en la Región de Magallanes, la que es parte del que fuera su extenso",23-04-2020 05:00,https://www.bing.com/th?id=ON.41A0F5DC1D27D4661FBB107BC4CDFDDC,Chile,El Mostrador
Médico es recibido por sus vecinos con aplausos y globos ...,https://www.t13.cl/noticia/nacional/medico-es-recibido-sus-vecinos-aplausos-y-globos-cumplir-turno-24-horas-covid-19,"Un médico que vive en la comuna de Conchalí recibió una linda sorpresa por parte de sus vecinos, quienes lo recibieron entre aplausos, globos y carteles tras cumplir una jornada de 24 horas de trabajo por el COVID-19. Según contó Andrés Garrido, el protagonista de esta historia, ese mismo día",23-04-2020 06:30,https://www.bing.com/th?id=ON.798AB472EB7182C0ABDAD26F7825C835,Chile,T13
Región por región: Dónde se concentra la mayor cantidad de ...,https://www.cooperativa.cl/noticias/sociedad/salud/coronavirus/region-por-region-donde-se-concentra-la-mayor-cantidad-de-casos-de/2020-04-22/114421.html,"Chile registra un total de 11.296 personas contagiadas con Covid-19 desde el inicio de la pandemia, según el reporte oficial entregado por el Gobierno la mañana de este miércoles. El ministro de Salud, Jaime Mañalich, precisó que hubo un aumento de 464 casos en la última jornada en base a 6.365 testeos realizados antes de las 21:00 horas ...",23-04-2020 06:44,https://www.bing.com/th?id=ON.229888446C556790A2791C35A31A4AF3,Chile,Radio Cooperativa
El rol del tocilizumab en el tratamiento contra el Covid-19,https://www.biobiochile.cl/noticias/nacional/chile/2020/04/22/farmaco-se-habria-usado-experimentalmente-con-exito-en-paciente-chilena-con-covid-19.shtml,"La pandemia del coronavirus ha cobrado la vida de más de 160 mil personas en todo el mundo. Ante su inexorable avance, investigadores de la Universidad de Oxford comenzarán a realizar pruebas de una vacuna en humanos, mientras que otros expertos están estudiando fármacos que se utilizan para",23-04-2020 07:10,https://www.bing.com/th?id=ON.29BA5E8CFB4C2590805B0A8C6738ADE8,Chile,Chile
"Covid-19 en Chile: Minsal confirma 11.296 contagiados, 160 ...",https://www.cooperativa.cl/noticias/sociedad/salud/coronavirus/covid-19-en-chile-minsal-confirma-11-296-contagiados-160-fallecidos-y/2020-04-22/101703.html,"El subsecretario de Redes Asistenciales, Arturo Zúñiga, confirmó este miércoles que se registraron 464 nuevos casos documentados de contagio por coronavirus, elevando la cifra total a 11.296 personas desde el inicio de la pandemia de Covid-19 en Chile.",23-04-2020 07:17,https://www.bing.com/th?id=ON.DFCBF2CFE352C10BD67B80574A474A29,Chile,Radio Cooperativa
Covid-19: Denuncian que hijos de migrantes sin carnet no ...,https://www.elciudadano.com/chile/covid-19-denuncian-que-hijos-de-migrantes-sin-carnet-no-pueden-acceder-a-proteccion-social/04/22/,"Covid-19: Denuncian que hijos de migrantes sin carnet no pueden acceder a protección social. Opazo. 4 horas atras. Facebook. Twitter. Telegram. WhatsApp. Views: 308. Tras la llegada de la pandemia del coronavirus a Chile, se han agudizado las dificultades de los sectores y grupos más vulnerables.",23-04-2020 07:28,https://www.bing.com/th?id=ON.85FB8376ACE10FFEB11CC400C6FC42A1,Chile,El Ciudadano
Los académicos extranjeros que no le creen al carné COVID-19,https://www.elmostrador.cl/noticias/sin-editar/2020/04/23/los-academicos-extranjeros-que-no-le-creen-al-carne-covid-19/,"“¿Qué es el ""pasaporte o carné de inmunidad"" al COVID-19 y por qué genera polémica?”, se pregunta un reportaje de la BBC respecto a esta iniciativa que barajan algunos gobiernos, entre ellos el de Chile, dentro de su paquete de medidas de combate a la pandemia de coronavirus.",23-04-2020 07:40,https://www.bing.com/th?id=ON.9984F7ED1B569AFC3348768BC590774B,Chile,El Mostrador
BTG Pactual ve rápida recuperación de ganancias de ...,https://www.df.cl/noticias/mercados/bolsa-monedas/btg-pactual-ve-rapida-recuperacion-de-ganancias-de-empresas-en-2021/2020-04-22/194420.html,"El jefe Latam Equities de BTG Pactual Asset Management, Will Landers, realizó ayer una videoconferencia donde analizó las oportunidades de inversión en la región en el marco de la expansión del Covid-19. En el caso de Chile, expresó que pese a la complejidad de este escenario, el gobierno y",23-04-2020 08:03,https://www.bing.com/th?id=ON.62B97B1FB24F57370562119BDD44C3E1,Chile,df.cl
“El agua es un factor clave para la recuperación económica ...,https://www.df.cl/noticias/df-lab/sostenibilidad/alexander-serrano-el-agua-es-un-factor-clave-para-la-recuperacion/2020-04-22/183432.html,"En este contexto de escasez hídrica y coronavirus, el especialista en gestión de recursos hídricos del Banco Mundial, Alexander Serrano, -que desde 2011 asesora a gobiernos chilenos en estos temas-, afirma que “el agua es uno de los factores que van a permitir la recuperación económica post Covid-19, y no sólo en Chile, ...",23-04-2020 08:04,https://www.bing.com/th?id=ON.6C19BBC075F99ED293512326F0EE7823,Chile,df.cl
Tarifa del pasaje del Transantiago no tendrá variación ...,https://www.t13.cl/noticia/nacional/Transantiago-Panel-de-Expertos-asegura-que-tarifa-del-pasaje-no-tendra-variacion,"Transantiago: Panel de expertos cree que valor del pasaje no tendrá variación en un ""largo periodo"" Entre las variables consideradas para definir el valor del pasaje se considera, entre otras, el valor del petróleo y la disminución de pasajeros por el COVID-19.",23-04-2020 08:45,https://www.bing.com/th?id=ON.7312C8AFE516766F58699E02195BD3FE,Chile,T13
Chile llega a 160 muertes por Covid-19 con 13 nuevos ...,https://www.biobiochile.cl/noticias/nacional/chile/2020/04/22/chile-llega-a-160-muertes-por-covid-19-con-13-nuevos-fallecidos-el-alza-diaria-mas-alta.shtml,"Chile llega a 160 muertes por Covid-19 con 13 nuevos fallecidos, el alza diaria más alta Por Nicolás Parra. Archivo | Agencia UNO. visitas. a-A+. El Ministerio de Salud (Minsal) informó la mañana de este miércoles que se reportaron 464 nuevos casos de Covid-19 (coronavirus), con lo que el total nacional llega a los 11.296 contagios.",23-04-2020 09:08,https://www.bing.com/th?id=ON.183189CDFB28F5082DF0834462FCF55F,Chile,Chile
