name,url,description,datePublished,imagen,pais,Fuente
"Covid-19 en Chile: Casos activos llegan a su peor cifra, con alza centrada en menores de 20 años",https://www.latercera.com/la-tercera-sabado/noticia/covid-19-en-chile-casos-activos-llegan-a-su-peor-cifra-con-alza-centrada-en-menores-de-20-anos/DSXOTBE7EJCLBHJUJHOWZBTQTA/,La comparación de las proporciones de contagios entre mayo de 2020 y el mismo mes de 2021 arroja que son los jóvenes los que se están llevando el mayor peso de esta ola: los menores de 30 años represe,05-06-2021 04:21,https://www.bing.com/th?id=OVFT.nuo0OpO1iM0iW3GPPC8Piy,Chile,LA TERCERA
Chile superó los 30 mil fallecidos por Covid-19,http://www.ladiscusion.cl/chile-supero-los-30-mil-fallecidos-por-covid-19/,"El Ministerio de Salud informó en su reporte diario por el avance del Covid-19 que en las últimas horas se confirmaron 6.958 casos nuevos, distribuidos en 4.459 contagios con síntomas, 1.842",07-06-2021 16:33,https://www.bing.com/th?id=OVFT.fIlE6XfE1_R0xkn1COW_jC,Chile,La Discusión
Minsal informó 6.958 casos nuevos de covid-19 en Chile: contagiados totales alcanzaron 1.434.884,https://www.adnradio.cl/nacional/2021/06/07/covid-19-en-chile-minsal-informo-6-958-casos-nuevos-y-contagiados-totales-alcanzaron-1-434-884.html,"El ministerio de Salud (Minsal) informó este lunes 6.958 casos nuevos de covid-19 en Chile en las últimas 24 horas, alcanzando un total de 1.434.884 contagiados desde el inicio",07-06-2021 16:47,https://www.bing.com/th?id=OVFT.xyE3PARP8fVUe-GjBjY8hi,Chile,ADN
Chile supera los 30 mil fallecidos: balance Covid informa 6.958 casos nuevos y 121 muertes registradas en las últimas 24 horas,https://www.elmostrador.cl/dia/2021/06/07/chile-supera-los-30-mil-fallecidos-balance-covid-informa-6-958-casos-nuevos-y-121-muertes-registradas-en-las-ultimas-24-horas/,"Si no tuviéramos la tasa de vacuna que tenemos, Chile podría tener hasta 25 mil casos diarios, a contraposición de lo que tenemos hoy en día, dijo en el balance el ministro de Salud, Enrique Paris.",07-06-2021 17:12,https://www.bing.com/th?id=OVFT.jh_EW7ZmjjeVF0rqW9gu5i,Chile,El Mostrador
Rinconada deberá regresar a la fase más dura del plan Paso a Paso: A «Cuarentena» desde este jueves 10 de junio,https://www.puranoticia.cl/noticias/regiones/rinconada-debera-regresar-a-la-fase-mas-dura-del-plan-paso-a-paso-a/2021-06-07/123948.html,"Y es que según el último Informe Epidemiológico, esta comuna perteneciente a la provincia de Los Andes posee 31 casos activos, con una tasa de incidencia de 275,2 por cada 100 mil habitantes.",07-06-2021 17:16,https://www.bing.com/th?id=OVFT.ARMeBcPfUXqIdvvwHBoA0y,Chile,Puranoticia.cl
ISP autoriza almacenamiento de la vacuna de Pfizer por 30 días en cadena de frío regular,https://www.lacuarta.com/cronica/noticia/isp-autoriza-almacenamiento-pfizer/640377/,El Instituto de Salud Pública de Chile (ISP) evaluó conforme la actualización de antecedentes de estabilidad de la vacuna,07-06-2021 17:37,https://www.bing.com/th?id=OVFT.Sg__UkpG1X52qn3fmVrl8S,Chile,La Cuarta
"Lasarte: «En lo reglamentario y sanitario, Vidal no podría jugar»",https://www.prensafutbol.cl/413923-lasarte-en-lo-reglamentario-y-sanitario-vidal-no-podria-jugar/,"El entrenador de Chile descartó a Arturo Vidal para el partido ante Bolivia, a pesar de haber terminado la cuarentena. Además, reiteró que para la Copa América planea presentar una mixtura y darle opo",07-06-2021 17:39,https://www.bing.com/th?id=OVFT.xL5606KJkYW-8eFo9L9FiC,Chile,Prensafútbol
Monserrat Álvarez: “Los partidos políticos tienen que ser el respaldo y ver a quién están promoviendo”,https://www.chilevision.cl/contigo-en-la-manana/mejores-momentos/monserrat-alvarez-los-partidos-politicos-tienen-que-ser-el-respaldo-y,"La periodista se refirió a la polémica por el video donde el concejal recién electo por Til Til promueve el femicidio y la violencia intrafamiliar. Asimismo, habló de la responsabilidad de los partido",07-06-2021 17:42,https://www.bing.com/th?id=OVFT.cJSkgjTKAxcOgIA9u-_qkS,Chile,chilevision.cl
Más de 1.100 personas participaron en jornada de vacunación extraordinaria contra covid-19 en Punta Arenas.,https://www.ovejeronoticias.cl/2021/06/mas-de-1-100-personas-participaron-en-jornada-de-vacunacion-extraordinaria-contra-covid-19-en-punta-arenas/,"Con éxito se desarrolló operativo con vacuna Cansino de dosis única, que buscó facilitar y acercar este proceso a la comunidad. Con gran participación de la comunidad se desarrolló durante este fin de",07-06-2021 18:06,https://www.bing.com/th?id=OVFT.JFKWXdcxYbKzpjY0kL63-y,Chile,Ovejero Noticias
URGE QUE EL ESTADO INCLUYA ENFOQUE DE UNA SALUD EN EL RESGUARDO DEL MEDIO AMBIENTE,http://radiopolar.com/noticia_167419.html,"Colmevet recordó que los Objetivos de Desarrollo Sostenible de 2030 y los efectos de la pandemia, hacen imprescindible un enfoque que considere la interdependencia de la salud ambiental, humana y anim",07-06-2021 18:08,https://www.bing.com/th?id=OVFT.XbUnDNyXX6sQHW8eEBlN8S,Chile,Radio Polar
Minsal está preocupado por variante Delta y anuncia que cierre de fronteras se extenderá hasta el 30 de junio,http://www.lanacion.cl/minsal-esta-preocupado-por-variante-delta-y-anuncia-que-cierre-de-fronteras-se-extendera-hasta-el-30-de-junio/,"La subsecretaria de Salud Pública, Paula Daza, anunció la extensión del cierre de fronteras en el país, debido no solo a la grave situación sanitaria que se vive en Chile, sino que a nivel mundial, po",07-06-2021 18:10,https://www.bing.com/th?id=OVFT.qufbc3XKCnWSqkcebWYtIC,Chile,La Nación
Covid-19: Chile es el 14vo país con más muertes por millón de habitantes en la última semana,https://www.radioagricultura.cl/nacional/2021/06/07/chile-es-el-14vo-pais-con-mas-muertes-por-millon-de-habitantes-por-covid-19-en-el-mundo.html,Este lunes el ministro de Salud Enrique Paris informó que Chile es el país número 14 en el mundo con la mayor cantidad de muertes por Covid-19 en la última semana. El anuncio fue realizado en el balan,07-06-2021 18:15,https://www.bing.com/th?id=OVFT.cEqtgyy_TxDydeo0maszni,Chile,Radio Agricultura
Pauta en Desarrollo - 7 de junio de 2021,https://www.pauta.cl/programas/pauta-en-desarrollo/pauta-en-desarrollo-7-de-junio-de-2021,"El Ministerio de Salud manifestó preocupación por la variante Delta, detectada en India, que es altamente contagiosa. Se mantiene el cierre de fronteras hasta el 30 de junio. Además, 11 comunas retroc",07-06-2021 19:02,https://www.bing.com/th?id=OVFT.GperYWgYR1Qg1i9yyPq9Yy,Chile,pauta
Calendario Vacunación Covid-19 | Martes 8 de junio: ¿A quién le toca vacunarse?,https://redgol.cl/tendencias/Calendario-Vacunacion-Covid-19--Martes-8-de-junio-A-quien-le-toca-vacunarse-20210607-0059.html,Esta semana primará una campaña de vacunación para llegar a la población que aún no se inocula La pandemia se encuentra en un estado delicado y este lunes se realizó un nuevo balance covid-19 en La Mo,07-06-2021 19:09,https://www.bing.com/th?id=OVFT.SUVx5mK5oGRoJN9WnifIqi,Chile,redgol
España abre fronteras a los turistas inoculados contra el Covid-19: incluye la vacuna de Sinovac,https://www.elmostrador.cl/dia/2021/06/07/espana-abre-fronteras-a-los-turistas-inoculados-contra-el-covid-19-incluye-la-vacuna-de-sinovac/,"Los viajeros que lleguen a España deberán haber completado la vacunación al menos 14 días antes de llegar con los preparados de Pfizer, Moderna, AstraZeneca o Janssen, autorizadas por la Agencia Europ",07-06-2021 19:15,https://www.bing.com/th?id=OVFT.JKOnrfyWDzxNvIud1CHagC,Chile,El Mostrador
Lasarte baja a Vidal del partido con Bolivia por no estar en condiciones de participar,https://www.13.cl/programas/copa-america/noticias/lasarte-baja-a-vidal-del-partido-con-bolivia-por-no-estar-en,Hace una semana se supo que Vidal se había contagiado de Covid 19 y esto le impidió estar frente a Argentina en el empate a 1 con la albiceleste. Aunque ya esté entrenando como lo ha mostrado en sus r,07-06-2021 20:36,https://www.bing.com/th?id=OVFT.EH-bamxjejpXrvuqzxIERS,Chile,13.cl
Covid-19 en Chile,https://redgol.cl/tendencias/Apertura-de-fronteras-Chile--Cuando-abren-las-fronteras-en-Chile--Cifras-Covid-Chile--Medidas-sanitarias-20210607-0072.html,"Este lunes, el Ministerio de Salud reportó una leve baja en los casos de Coronavirus en Chile, registrando 6.958 casos nuevos de Covid-19 en las últimas 24 horas. Con una positividad de un 8,39% a niv",07-06-2021 21:00,https://www.bing.com/th?id=OVFT.bGOM5J2qqWHIZUSzrhnOKC,Chile,redgol
Las cuatro dimensiones de la transformación digital,https://www.latercera.com/que-pasa/noticia/las-cuatro-dimensiones-de-la-transformacion-digital/NYSXVG2YKNHA3ESI2PK524PFD4/,"El documento define métricas clave para precisar qué tan rápido, cuánto y cuán lejos podemos avanzar en esta transformación digital, en un contexto que los autores denominan como “una nueva fase para",07-06-2021 21:15,https://www.bing.com/th?id=OVFT.AMcZwSI375WkJjouc4FmqS,Chile,LA TERCERA
"Epidemiólogo y situación actual de Covid 19: ""El virus está viajando con las personas sin síntomas a lugares muy recónditos en nuestra región""",http://www.eldivisadero.cl/noticia-62909,"Conversamos con Marco Acuña, el epidemiólogo de la Seremi de Salud sobre la situación que vive la región y comenzamos con los contagios informados en Villa Mañihuales, donde hasta el domingo se han no",07-06-2021 22:25,https://www.bing.com/th?id=OVFT.khUA7q_F2oJvc-jb23wqaS,Chile,Diario el Divisadero
"Un saludo al Comercio sancarlino, en tiempos de pandemia",http://elsancarlino.cl/wp/2021/06/07/un-saludo-al-comercio-sancarlino-en-tiempos-de-pandemia/,"Cuando la pandemia, producto del Covid-19, ha provocado un trastorno en todas nuestras vidas. Y cada uno de nosotros, tiene la responsabilidad, en todos los col",07-06-2021 22:33,https://www.bing.com/th?id=OVFT.ny7ojwt7VW7WvHKD5GIJgS,Chile,El Sancarlino
Honduras confirma primer caso de hongo negro en paciente recuperado de covid-19,https://www.emol.com/noticias/Internacional/2021/06/07/1023198/honduras-caso-hongo-negro-covid19.html,"Se trata de un hombre de 58 años, quien acudió a un centro asistencial entre dos y tres semanas después de superar el cuadro de coronavirus.",07-06-2021 22:40,https://www.bing.com/th?id=OVFT.PzjkFvbZbSGWMJM21qu3YS,Chile,Emol
Argentina ve cuesta arriba su recuperación postpandemia,https://www.elperiodista.cl/2021/06/argentina-ve-cuesta-arriba-su-recuperacion-postpandemia/,"Por Ana Delicado Palacios Más de seis años tardará Argentina en conseguir que su economía se recupere. El Producto Interior Bruto (PIB) per capita del país sudamericano no alcanzará, hasta el segundo",07-06-2021 22:49,https://www.bing.com/th?id=OVFT.ZDBZ8q_dE6EH5UOCk2LT4y,Chile,El Periodista
La alegría de Mauricio Pinilla tras vacunarse contra el covid-19 este lunes,https://www.adnradio.cl/futbol/2021/06/07/la-alegria-de-mauricio-pinilla-tras-vacunarse-contra-el-covid-19-este-lunes.html,"El exdelantero de Universidad de Chile se fotografió de lo más sonriente después que le aplicaran la dosis. Pese a que ya dejó el fútbol profesional para siempre hace varios meses, Mauricio Pinilla si",07-06-2021 23:54,https://www.bing.com/th?id=OVFT.Cq2DWRmrcjEypJ7yU8SmOS,Chile,ADN
